,Id,Tweet
800,8815,no veo a los madridistas haciendo autocrtica hicieron un partido normalito tirando a malo cuando era su ltima oportunidad de engancharse a la liga y solo hay excusas y excusas carvajal un muerto vini 2 veces y me estoy pasando benzema horrible valverde peor y as
801,8816,nunca fue nadie carvajal y ahora tiene que ir a por chavales que s lo son se nota la frustracin
802,8817,de la gente no de la banca y ya van
803,8818,slo te fijas en carvajal con la msica de fondo y es que te res sin querer
804,8819,aranu agarra a carvajal y lo mata
805,8820,ceballos y carvajal en cuanto vean a gavi en las rozas
806,8821,esto tampoco se vi en la tv roja asegurada pa carvajal
807,8822,preocupa y duele todo lo que pasa en el pas tenemos derecho a trabajar y a vivir en paz sin amenazas sin presiones sin miedo hoy son leninartieda y ecuavisainforma maana quin la solidaridad en estos das ya no es opcional es un deber si queremos salir de este agujero
808,8823,en sta imagen todava la tiene carvajal y no no es fuera de juego
809,8824,cerdallos y carvajal hacen agresiones con y sin baln es normal es que de estn jugando mucho y los nervios juegan una mala pasada lo hace gavi vaya guarro otra vez sin la roja siempre igual al borde del reglamento y si hablamos de vinicius cuntos partidos
810,8825,no puedo ser tan exigente conmigo misma
811,8826,buenos das amigos feliz inicio de semana
812,8827,choreography  jimin set me free pt 2 dance practice va youtube
813,8828,se les ha olvidado poner los trozos de vdeo donde carvajal agarra del cuello a arnau luego lloran por los frames pero mira qu finos para elegirlos aqu
814,8829,una pena grandes prdidas
815,8830,al amanecer el dia despues del ataque de juan n cortina y sus hombres a brownsville jose maria carvajal uno de los hombres ms influyentes en la regin sali a las calles diciendo que el detendra la violencia estando del lado norte del ro hizo seas al crnl miguel tijerina
816,8831,lo mas pegao musica wbcenfox oscar gamarra y camilo carvajal by la amenaza colombia wbcenfox
817,8832,q carvajal se chino porq arnau le dijo facha de los cojones
818,8833,tensin tras la derrota del real madrid en el camp nou carvajal se encar con arnau tenas
819,8834,ancelotti out benzema banca modric banca kroos banca carvajal out haber ganado la champions la temporada pasada nos ha hecho un gran dao sino floper no despierta out tambin 2 laterales 1 medio creativo 1 killer 1 extremo derecho
820,8835,antes 207 9 ahora 175 99 15 don descanso mulhacn colchn viscoelstico espuma altura 26cm 135x190 cm gavi alonso benzema sergi roberto elclasico bara carvajal
821,8836,hipismo amp parley escuchen al parasito de fred rafael desideiro carvajal para jalarle bolas al potro no se equivoca el medico frustrado este puros incompetentes en inh tv
822,8837,jajaja qu lindo este pibe carvajal
823,8838,y en esto se resume el presente no solo de carvajal sino de un par ms que carajos hace carvajal yendo a presionar como loco a esa parte dejando el espacio por dnde atacan para el 2 1 desde hace tiempo no es jugador de nivel real madrid ojal se tomen en serio fichar un ld
824,8839,yo creo que ceballos no se fue a por gavi ni arnau a por carvajal creo que gavi agredi a ceballos y carvajal cogi del cuello a arnau
825,8840,hacer paddle es terapia
826,8841,ayer el clasico no se pierde por el rbitro se pierde por lo siguiente 1 mal planteamiento del tcnico 2 no puede seguir carvajal de lateral derecho titular 3 benzema ahora mismo es 1 menos
827,8842,cmo me la paso 24 7 cmo soy
828,8843,el pc sigue sumando puntos en contra puro trucherio
829,8844,carvajal es el tpico que va de gallito y luego a la que le sueltan la primera sale llorando
830,8845,estoy preocupado por el codo de gavi habra que denunciar que carvajal le dio con la barbilla en el codo
831,8846,que puto asco da carvajal maldito
832,8847,dice la prensa que arnau tenas se fue a por carvajal en el final lo que no ponen es que fue al revs una vez ms la prensa nacionalmadridista
833,8848,a propsito de la vuelta a catalua montar una startup es como el ciclismo de ruta muchas etapas de gran fondo donde pequeos xitos y derrotas se van acumulando para el resultado final un exit o morir
834,8849,somosguardianesdelpueblo 20mar ante cualquier situacin de peligro acude al gaes ms cercano de tu jurisdiccin estamos para protegerte lafanbesvenezuela gnb31portuguesa
835,8850,lo de dani carvajal el domingo lo de carioca guido pizarro el sbado es similitud de que ya aun que sea de jerarqua di no aportas mejor ya hazte a un lado de verdad si aman los colores del equipo reconozcan que no pueden ya y cedan el paso a alguien mejor
836,8851,jugar monopolio y quedar en bancarrota es mi pasin jajajajajaja
837,8852,es el da de la felicidad a sonrer
838,8853,despus del partido de ayer aun lo tengo mas claro q el taurino se equivoca carvajal es malo no lo siguiente xd nacho de lateral meh y de central se vera las caras contra haaland ceballos juega solo los minutos basura en el rm
839,8854,carvajal solo sirve para crear polmica o algo
840,8855,antes 499 ahora 319 36 cecotec patinetes elctricos bongo serie a potencia mxima de 700 w batera extrable e intercambiable aut gavi benzema alonso sergi roberto elclasico bara carvajal
841,8856,lo de dani carvajal es tristsimo
842,8857,recoge el fruto de tu sudor
843,8858,a m lo que me van a tener que explicar es por qu teniendo a este carvajal ayer tras los cambios le coloca toda la banda derecha para l como si fuera r james que haba jugadas en las que estaba de extremo sabiendo que es muy limitado el 2 gol viene de varias cagadas suyas
844,8859,entre carvajal que no est en su mejor momento y valverde que no es extremo pero juega siempre de extremo nuestra amenaza ofensiva por la banda derecha es inexistente y los rivales lo saben sobreprotegen la izquierda sabiendo que por la derecha pueden estar tranquilos
845,8860,carvajal es de la mayor escoria que hay en el mundo del ftbol menudo tonto
846,8861,pero no muestran cuando carvajal va y lo agarra del cuello primero via marca
847,8862,y de pronto el mundo se puso en blanco y negro y ella ella brillo de color
848,8863,promocin de msica gratis disponible ahora obtenga su acceso gratuito a los xitos ms recientes aqu elclasico gavi alonso benzema sergiroberto bara carvajal felizlunes madrid conexinhonduras3 asensio mendilibar sampaoli araujo
849,8864,a todo esto para lnea polmica la que tir el var en la ida en el fuera de juego que precede al penalti a rodrygo de aquello no se habl nada tampoco del penalti de carvajal a lewandowski en la primera vuelta todo de maravilla eh a pesar de que s hubo polmica de verdad
850,8865,la verdad es que fue carvajal el que se fue a por arnau tenas pero supongo que queda mejor as
851,8866,y aqui no paso nada si fuese sido el realmadrid ya usteden se imagina
852,8867,la humildad es el nico terreno en el que puede crecer la verdadera unidad solo cuando cristo sea ms precioso para nosotros que nuestra propia reputacin abandonaremos nuestras pequeas rivalidades y agendas personales michael reeves
853,8868,pobre carvajal as termino caminando yo despues de una media corrida en el navideo
854,8869,no vale joder solo a carvajal ni benzema vinicius o asensio hace el recorrido luego de perder la pelota el madrid es un equipo y todos juegan para el mismo escudo todos deben de hacer el esfuerzo y queda claro que no les importa pelear la liga
855,8870,si no agarran a tenas te matan carvajal payaso
856,8871,ymj haber perdido e irte a por el portero suplente carvajal tiene la neurona justa pa no cagarse encima
857,8872,carvajal es un lloron maricon
858,8873,el madrid con mendy juega con uno menos con carvajal juega contra 12 fue bueno mientras dur lo dio todo pero est a aos luz del nivel que necesita el madrid y ya no es algo puntual
859,8874,no he visto ni una sola imagen en la televisin en la que se muestre como es carvajal el que agarra del cuello a arnau tenas y luego ya se revuelve el portero del barcelona solo se ve como directamente es el portero el que va a por l
860,8875,por lo que sea empieza a medias yo quiero ver ms contexto siendo carvajal es probable que simplemente sea gilipollas tambien te digo que no entiendo cuando os quejais de que no lo echen si nos hara un favor
861,8876,carvajal subnormal
862,8877,que hueva que se quejen tanto de los rbitros pensamiento de equipo pequeo y no lo somos el problema es que el madrid a dejo ir 20 puntos haciendo el ridiculo jugamos con benzema kroos modric y carvajal todos los partidos y ya jugamos con 4 jugadores menos as no se compite
863,8878,que lamentable es carvajal encima tarda en regresar y lewandowski se deshace de l fcilmente pero da igual no se buscar a un ld hasta que el decida
864,8879,karl marx el progreso y ls caminos del arte cemees
865,8880,santiago pavlovic destroz a pamela jiles revel que toda su vida ha sido un fraude y que se jacta de recibir millones de la empresa caffarena
866,8881,que carvajal es gilipollas ya lo sabamos y por desgracia que en marca son unos manipuladores tambin
867,8882,carvajal guarro antideportivo y mal perdedor siempre qu asco de tuercebotas
868,8883,se nota claramente que o putin camina medio raro o tiene problemas para andar por su pierna izquierda
869,8884,cnd va a tocar hablar de q achraf era nuestro y no se ha guardado ni una opcin de compra barata preferencia para cuando empezara el declive de carvajal
870,8885,fiscala espaola pidi prorrogar prisin de hugo el pollo carvajal
871,8886,vinicius tobias no puede tener oportunidades viendo a carvajal lindola cada semana en serio ancelotti est a punto de ser despedido
872,8887,van a estar carvajal y ceballos en el mismo vestuario que gavi encima gestionado por el bufn de luis de la fuente se van a dar de ostias fijo
873,8888,carvajal es un pedazo de maula del copn
874,8889,est claro que el segundo frame es justamente cuando carvajal est soltando el baln y obviamente asensio que estaba saliendo ya no est en fuera de juego pero las decisiones las toman los que las toman por qu no se revisaron las dos agresiones de gavi sobre todo la segunda
875,8890,arnau tenas estall tras la provocacin de carvajal tuvieron que pararlo entre cuatro gargajal en todas las salsas el sucesor del quillo ramos a cual peor
876,8891,lo que cita ecuadorplay doc jorgesosameza pilas
877,8892,miguel serrano pretende hacernos creer que entre que carvajal golpea el baln y sale de su pie pasan 3 segundos fijaos en el marcador y los segundos que marca en cada frame son un meme y no dan para ms que para ser el hazmerrer
878,8893,desde 2013 la onu celebra el 20de mar el da internacional de la felicidad como reconocimiento al bienestar y la felicidad en la humanidad y la necesidad de que tome relevancia en las polticas de los gobiernos laavanzadora vicent carvajal mppeducacion
879,8894,seora lewin empiece del ao 70 71 72 hasta llegar porque tuvieron que asumir las ffaa y orden el ao 73 no borre la historia de esos aos de que vivimos gobernando los comunistas al igual que ahora estamos viviendo en las del sr boric su presidente
880,8895,carvajal siempre es un subnormal valores
881,8896,ni por mendy y ni por militao ese gol fue culpa de carvajal ya se est pareciendo a los ltimos aos de marcelo
882,8897,carvajal es tan especial que golpea el baln directamente con su pierna ya totalmente estirada como si tuviera una muleta periodistas se hacen llamar
883,8898,buen da
884,8899,historia que tu hiciste
885,8900,fue un tremendo robo a los gurs no haba fuera de judgo en esa posicin otra cmara mostr asencio estaba en buena posicin cuando carvajal le pas la pelota
886,8901,lewandoski manda a volar a carvajal cuando dio el taco jajajaja
887,8902,carvajal estaba peleando por su vida
888,8903,pero como vas a criticar a alguien que juega en una posicin que no le corresponde jabsjabsajhs es como que critiques a camavinga porque a veces juega mal de lateral izquierdo adems valverde se ve condicionado porque tiene al muerto de carvajal por su banda y debe cubrirlo
889,8904,dani carvajal la peor escoria que he visto
890,8905,balde corriendo todo el partido y siendo importante en el gol del bara al final del partido pero nosotros tenemos que soportar que carvajal sea titular porque claro puso la primera piedra
891,8906,claramente el tonto de carvajal provoca a arnau tenas
892,8907,no se vio en tv lewandowski derrib a carvajal y bengoetxea evit anular el gol del bara siguen los pagos y la corrupcin tanto en el barcelona como en los rbitros esta temporada debe ganar la liga el barcelona si no hay pelas
893,8908,nada ms satisfactorio que ver cmo las personas malas solas se hacen dao
894,8909,es muy difcil competir en una liga con cuatro tipos que llevan 15 aos en la lite y en su final de camino kroos modric benzema y carvajal deben terminar sus contratos y abandonar el realmadrid como jugadores si se quieren quedar en la parcela deportiva que se queden
895,8910,jorge carvajal con mara corina vamos rumbo a la libertad y recuperacin de la democracia
896,8911,justicia espaola prorroga la prisin preventiva para el pollo carvajal
897,8912,ayuda mama coco me rompi muy roto
898,8913,el to ms cagon d la historia el puto carvajal se mete en to los fregados y nunca hace na escoria madridista
899,8914,ah que cambiar los laterales por completo mendy venderle y fichar otro carvajal no puede seguir siendo titular o se sube a vinicius tobias o fichas a frimpong realmadrid
900,8915,por qu no has puesto cuando carvajal se montaba en el autobus
901,8916,otra cosa es que que lucas est ah antes que carvajal es algo q no entiendo
902,8917,por que no te callas traidor moreira
903,8918,definicion de daniel carvajal en 30 segundos
904,8919,lecturasfestivas describiendo lo cotidiano se me ocurri este texto se titula el gesto de pelar un banano aqu va
905,8920,carvajal le dio muy fuerte con los dientes en el codo de gavi cc jesusrafael2002
906,8921,puta carvajal ni cafucas hace semejante estupidez
907,8922,nacho baja ante el valladolid a travs de diarioas sergiolopezdv vio la quinta amarilla ante el barcelona y se perder el primer partido posparn el 2 de abril justo antes del clsico de copa carvajal y camavinga tambin apercibidos
908,8923,fundacin las rosas
909,8924,esa flor ya no retoa viene un cataclismo bancario
910,8925,definitivamente pereira tiene el clima perfecto
911,8926,los antimadridistas se quejan de que luis de la fuente lleve a ceballos y nacho a la seleccin cuando se deberan quejar de que vaya carvajal madre ma el nivel lleva saliendo en la foto de los goles en contra del madrid aos lamentable lo de esta jugada ayer es esperpntico
912,8927,what happened between arnau tenas and dani carvajal after el clsico halamadrid madridista madridismo
913,8928,te maldigo caf a las 8 de la maana con la guata vaca literal soy el gato tom
914,8929,por cierto en gol no han sacado la jugada del segundo gol del bara donde previo al gol lewandowski le hace un placaje a carvajal de ah viene el pique porque no rebobinaron la cinta como en san mams as maroto no interesa laliga adulterada
915,8930,lo mal que me cae carvajal no es normal ya
916,8931,antes 169 ahora 144 89 14 chicco ohlal 3 silla de paseo ultraligera desde 0 meses hasta 15 kg cochecito reclinable y plegable con gavi alonso benzema sergi roberto elclasico bara carvajal
917,8932,en movistar cortan el trozo donde se ve que es carvajal quien va donde arnau tenas a cogerle del cuello por lo que sea
918,8933,la vergenza del futbol y la mierda que arrastran tensin tras la derrota del real madrid en el camp nou carvajal se encar con arnau tenas
919,8934,le caer 4 partidos a carvajal por esto un carajo es el puto vardrid rfef
920,8935,mirad que fcil lo explico alguien me hace entender como carvajal puede estar centrando sin tener la pierna estirada imagen 1 fuera de juego resumen cogen el frame que les interesa nos roban la liga y se quedan tan anchos
921,8936,carvajal es la representacin de todo lo malo del madridismo
922,8937,y aqu piden falta a carvajal
923,8938,mal no desastroso colombiavamal
924,8939,mal dia anchelottiout tuchel realmadrid realmadrid carvajal modric kross benzema hazard mariano ausencio odriozola vallejo out
925,8940,lo de carvajal en esta jugada q sentido tiene
926,8941,ny programa levntate ny y aracelis carvajal nominados a premios los mejores
927,8942,soy el primero que dice que carvajal no sabe centrar pero si el var en espaa no fuese un robo carvajal hubiese dado la asistencia del 1 2
928,8943,penoso carvajal para los del madrid no existe el respeto hacia los rivales o que
929,8944,mentirosos manipuladores carvajal fue por arnau
930,8945,carvajal estaba tieso y se ve 3 minutos antes hizo un partido muy bueno lo que no puedes pedir es a un lateral que te ataque como un extremo pero seguir tirando mierda por traer a cualquier extranjero que tenga media pierna
931,8946,dicen en elgolazodegol que que habr pasado con carvajal y arnau tenas que no se ve no queris verlo que es diferente un to con ms aos que un gnomo que se va a coger a un chaval del cuello
932,8947,carletto diciendo que ayer jugamos bien con dos conos en la derecha con valverde y carvajal y que as ganaremos algo denle el finiquito al seor
933,8948,no vamos a descubrir ahora las carencias de carvajal pero ayer el madrid hace el ridculo por culpa del planteamiento de ancelotti hace falta mano dura otra vez que le han cogido el brazo a carletto
934,8949,lo lamento por carvajal pero ya no esta para seguir en el equipo
935,8950,carvajal sempre tan deportivo
936,8951,ya estais volviendo a mentir carvajal habla y arnau no se achanta q es muy distinto a ir a buscarlo
937,8952,arnau se fue a x carvajal ay dios mos ensear videos
938,8953,surez mordiendo a gavi ah no carvajal lo siento
939,8954,carvajal le arreo un empujn a lewandoski luego provoc a arnau tenas otro k d los valores k pregona vio poco ayer
940,8955,depana que cancelo era el fichaje perfecto carvajal ayer fue de lo peor
941,8956,encima araujo pasa de celebrar a ir a pararlo vaya payaso carvajal
942,8957,en 2013 un jugo baggio salia 5 pesos ahora sale 130
943,8958,como carvajal no se llama isaac ni juega de amarillo no le caern 3 partidos de sancin por empujar o buscar bronca con rivales
944,8959,no se donde hay falta a carvajal antes del gol usted vio otro partido
945,8960,sumarle a carvajal la banda izquierda ninguno de los laterales hace de carrilero es llegar a la frontal del rea y echar la pelota atrs una y otra vez cero progresin
946,8961,carvajal fue el peor del madrid lo han certificado opinadores facultados pero mira la nota que le pone este sinverguenza el periodismo esta tan contaminado como los arbitrajes
947,8962,qu da tan hermoso buenos aires
948,8963,estamos claro que carvajal al sol de hoy debera ser el suplente del suplente del lateral derecho modric si quiere seguir en el club adios croacia o sino adios modric kroos le doy un ao de contrato benzema un ao de contrato y que juegue mucho menos por lo tanto otro 9
949,8964,el real madrid es un equipo con unos dficits de plantilla muy grandes en el lateral derecho porque carvajal lleva 2 aos jugando bien 3 meses y su suplente es lucas vzquez el cual a parte de ser malo no es ni lateral esta temporada en el lateral izquierdo pq mendy no est
950,8965,estoy en directo en twitch ven a verme
951,8966,pobre carvajal lo de arnau es lamentable hdp
952,8967,no se vio en tv lewandowski derrib a carvajal y bengoetxea evit anular el gol del bara
953,8968,tres jugadas en un mismo partido gol mal anulado a marco asensio falta a carvajal en el segundo gol del bara 4 amarillas perdonadas a gavi esta competicin pretende ser un campeonato de verdad pero es una parodia liga sin valor y sin igualdad de trato arbitral
954,8969,si florentino ha renovado a carvajal en verano 2021 cuando lleva toda la temporada lesionado y horrible es que va a renovar a kroos modric y benzema
955,8970,lo que hizo carvajal con arnau tenas si fuera gavi estara en todos los diarios
956,8971,lewandowski carvajal y las tanganas finales que calentaron el clsico
957,8972,20mar fiscala espaola pide mantener la prisin provisional del pollo carvajal
958,8973,el lo que se mont tras acabar el clsico un jugador cul intento agredir a carvajal y arajo acab en el suelo
959,8974,pueden los equipos grandes dejar de llorar por los rbitros yo q se esque noveas que pereza no tenis ni puta idea de lo que es que os desfavorezcan de verdad
960,8975,hay vdeos circulando que muestran cmo es carvajal el que va a agredir a tenas pero que la realidad no te estropee la noticia manejan el relato a su antojo nada nuevo
961,8976,nada nuevo carvajal es un subnormal
962,8977,carvajal es un cerdo esto lo hace gavi y la maquinaria de la central lechera estuviese vomitando
963,8978,una lstima que no dejaran a arnau tenas soltarle un guantazo a carvajal
964,8979,carvajal siempre es un becerro sin distincin
965,8980,la criptonita de carvajal el particular semedo davies de los clsicos
966,8981,foto de raymond este mircoles 22 de marzo meditacin para principiantes
967,8982,as es como se hace hiena a ese carrito habra que quemarlo como uds hicieron con los hospitales odontolgicos te acords cnica se hace la buenita y despus te cierra todo como las escuelas y se afana todo como los aportantes truchos
968,8983,en el ftbol moderno adems de otras muchas ms cosas necesitas dos laterales de gran recorrido que sean puales el madrid juega con carvajal que ya no da para ms y con nacho que defensivamente es un muro pero no aporta profundidad ofensiva
969,8984,seamos sinceros benzema est esta temporada desaparecido cuando la delantera depende de l valverde no se le ve desde el mundial carvajal es una sombra de lo que fue y araujo le tiene la matrcula cogida a vinicius por lo que esta muy bien defendido el resultado es este
970,8985,ya pero y a quien metes en su lugar a lucas vzquez toda la culpa no la tiene carvajal si no la directiva por no traer a cancelo
971,8986,le he visto peores partidos a carvajal que lo hecho por miguel gutirrez en ese partido por el cual fue desterrado no se puede probar a alguien de la cantera xavi le di la titularidad a balde en serio tan mala la cantera para no probar a ni uno
972,8987,volv a disociarme c
973,8988,como si a mi gaganoseke me ha dicho que carvajal fue el mvp porque se pas el partido corriendo y los que perdan los balones eran vini y rodrygo
974,8989,algo que si quiero recalcar de ayer es el gran papel y el gran comportamiento sobre el terreno de juego de vinicius militao y camavinga ejemplos que se lo hagan mirar otros como carvajal ceballos y nacho
975,8990,siempre es q salio calientito carvajal normal con esas bailadas q le daba balde por esa banda
976,8991,carvajal mal perdedor mal tipo payaso acomplejado danicarvajal92
977,8992,hay que ser malos periodistas y una basura de ser humano para mentir y rajar de arnau tenas cuando fue carvajal el que se fue a por el y lo agarr del cuello y despus os preguntis por qu hay tantos antimadridistas slo sabis generar odio
978,8993,en este partido vinicius no ha hecho nada malo se ha comportado de lujo con araujo hoy los nicos que han hecho polmica y han jugado sucio han sido ceballos nacho y carvajal
979,8994,espero que haigas hecho el mismo tweet con agresiones de casemiro carvajal sergio ramos pepe etc
980,8995,nuestra campaa qued de no 1 en el ranking mundial de warc un honor desde inlesco y phd poder trabajar en generar conciencia y empata hacia la realidad de la comunidad sorda esperamos que las televisoras y marcas se sumen a tener espacios ms inclusivos
981,8996,tiene que ser increble la sensacin de jugar con dos buenos laterales ofensivos quiero mucho a carvajal y me cae bien mendy pero necesitamos aire fresco en los laterales prioridad absoluta debe ser en verano solo por detrs del extremo derecho
982,8997,interesante documental sobre el cobre y el lado oscuro de la transicin energtica cobre energas elladooscuro
983,8998,pero dnde va el muerto de carvajal jajajajajajaaa cmo huye cuando ve que pintan bastos
984,8999,carvajal es un exfutbolista a tiempo completo
985,9000,ceballos twittero nacho utillero y carvajal pandillero
986,9001,hay 2 cosas que no entiendo en esta vida 1 es como la gasolina ha subido tanto en tan poco y 2 es como carvajal es titular en el madrid y en la seleccin que persona ms odiosa
987,9002,lucas vzquez siendo lo limitado en cuanto a calidad ha hecho clsicos que carvajal en su puta vida ha logrado y no es coa
988,9003,arnau tenas y dani carvajal se engancharon tras el clsico
989,9004,mira si queres hacerle propaganda a la cnica ya que ella desasbasteci y abandon los hospitales encima ahora graba videitos de restaurar la educacin mientras se cans de cerrar escuelas cierren el orto uds por favor
990,9005,les he enseado estas 2 imgenes explicndoles que carvajal en la segunda imagen an no ha dado el pase en la primera sale la pelota de su pierna a unos 10 amigos culs todos me han dicho que no es fuera de juego ni de coa
991,9006,carvajal lo sigue buscando
992,9007,notable carvajal en serio malas decisiones en ataque que dejan a la defensa debilitada en transiciones defensivas es un jugador que lleva temporadas jugando una minoria de partidos a buen nivel y con 0 regularidad en una temporada entera
993,9008,es preocupante el estado de forma que tiene carvajal
994,9009,diario de todas la aficiones sacando un bulo cuando fue carvajal el que empezo todo
995,9010,carvajal ha sido desde siempre un grandsimo cerdo lo que pasa es que ahora que no estn ramos ni casemiro se nota ms
996,9011,carvajal con sangre encima del escudo
997,9012,estoy leyendo que el taconazo de lewandoski es falta a carvajal
998,9013,por qu no hablas de la agresin de carvajal
999,9014,natalia carvajal vive nueva etapa en su vida he hecho las paces con muchas partes mas
1000,9015,el mundo va a ser un lugar mejor cuando alguien le explique libremente las cosas a carvajal supongo que antiviolencia investigar el suceso
1001,9016,ojal alguien le rompa la boca a carvajal de una vez
