,Id,Tweet
1607,35713,saudiarabiangp con la sancin a alonso 1 sergio prez 2 max verstappen vr 3 george russell 4 fernando alonso 5 lewis hamilton 6 carlos sainz 7 charles leclerc 8 esteban ocon 9 pierre gasly 10 kevin magnussen f1
1608,35714,prez hizo una conduccin perfecta para contener a un verstappen que remont desde el 15 puesto de salida alonso acaba en el podio por 100 vez en su carrera pero corre el riesgo de perderlo por una sancin debida a que un mecnico toc el coche con el gato en un stop amp go
1609,35715,pero weon que chucha joss verstappen tiene que saludar al ganador y co equipo de su hijo
1610,35716,prez vence gp da arbia verstappen e alonso completam pdio
1611,35717,lloro de la risa con la cara de jos verstappen
1612,35718,verstappen mejor del mundo no admito discusiones
1613,35719,a ver si con verstappen o hamilton tenis los cojones de hacer hijos de la grandisima puta mafia de mierda
1614,35720,que se vaya alv max verstappen y su pap
1615,35721,gran jornada de formula1 checo prez con un slido rendimiento conquist el saudiarabiangp el mexicano quin haba logrado la pole hizo mritos para batir a verstappen a pesar de ser penalizado con 10 segundos contina el show de alonso y aston martin 4
1616,35722,que barbaro ese jos verstappen
1617,35723,jsdjdj ninguna novedad pero jos verstappen es la persona ms mala leche de la historia
1618,35724,1 punto hace la diferencia verstappen no deja la vuelta rpida perez continua 2do en el campeonato y alonso tiene penalizacin 10 segundos por no cumplir correctamente su 1ra penalizacin en carrera lo que lo deja fuera del 3er lugar saudiarabiangp f1
1619,35725,jos verstappen pedazo de sorete
1620,35726,jos verstappen pierde max pierde mi familia f1 checoprez
1621,35727,el checo prez triunfa en arabia saudita el piloto mexicano sergio checo prez se qued con el gparabiasaudita de la f1 el podio lo completaron el neerlands max verstappen y el espaol fernando alonso f1 78aosendeportes
1622,35728,no se si celebrar ms la victoria de checo o la cara del papa de verstappen cuando checo se acerco a celebrar con el equipo
1623,35729,yo apostaba por victoria de prez antes de empezar la carrera pero ni de coa esperaba que aguantara por puro ritmo a verstappen lo que est claro es que hay mucha tensin entre los red bull y el mexicano tiene ganas de demostrar que tiene el nivel brutal saudiarabiangp f1
1624,35730,checo prez conquist el gran premio de arabia saudita y se afianz como el rey de los circuitos callejeros verstappen fue segundo y alonso perdi el tercer al final de la carrera por una penalizacin russell tom su lugar
1625,35731,checo prez gana premio de arabia saud verstappen es segundo
1626,35732,jos verstappen celebrando a lo grande la victoria de checo
1627,35733,muy bien fia f1 sancin de 10 segundos pq un mecnico toca el coche con el gato hamilton revienta a verstappen a ms de 300km h provocando un grave accidente y se le penaliza con 10 segundos sois basura sin ms saudidaznf1
1628,35734,nadie traga al jos verstappen no esta soportando el viejo amargado
1629,35735,de locos que verstappen estaba en el 15vo lugar y termin en 2do con red bull y alonso ya no quien se acuerde de ferrari y mercedes
1630,35736,f1 y el colmo alonso pierde el tercer lugar por diez segundos de penalizacin y russell es tercero en el gp de arabia saudita que pena para el equipo de aston martn el podio queda mxico checo pases bajos verstappen y gran bretaa russell uffffffff
1631,35737,te amo checo prez tu vete alv verstappen
1632,35738,y q soporten los verstappen
1633,35739,chinga tu madre joss verstappen con todo el afn de ofender
1634,35740,crnica alonso se pone a 100 en la fiesta de red bull magic suma otro tercer puesto prez arrasa y verstappen remonta sainz 6 y ferrari desaparecidos en combate saudiarabiangp
1635,35741,nueva clasificacin del gp de arabia saud tras la sancin a alonso 1 prez 2 verstappen 3 russell 4 alonso 5 sainz 6 leclerc saudiarabiangp f1
1636,35742,el nico logro deportivo de jos verstappen es ser paps de max verstappen
1637,35743,somos max verstappen y yo contra el mundo
1638,35744,deportes checoprez es el ganador del saudiarabiangp y firma su quinta victoria en la f1 tras perder momentneamente el liderato el piloto mexicano se llev el triunfo este domingo en jeddah max verstappen fue segundo y george rusell tercero
1639,35745,el hijo de puta de jos verstappen es tan mal jugador de equipo que no fue ni siquiera capaz de saludar a schecoperez esa familia es txica de a madre
1640,35746,checo prez gan el gp de arabia saud el segundo de la temporada de f1 fernando alonso fue tercero y cerr el podio tras verstappen y los dos red bull
1641,35747,checo no vayas de after con verstappen
1642,35748,que basura son los verstappen
1643,35749,y que chingue a su madre los verstappen
1644,35750,no soporto a max verstappen pero a su pap lo detesto
1645,35751,ltimahora schecoperez se lleva el triunfo en cerrada competencia con max verstappen y gana su primer gp de 2023 en arabia saudita despus de obtener el 2o sitio la semana pasada en el circuito de barehin
1646,35752,carrern del checo prez que se lleva la victoria en el saudiarabiangp delante de un verstappen que acab llegando checo prez max verstappen fernando alonso centenario para fernando alonso y segundo consecutivo cosa que no pasaba desde 2013 f1
1647,35753,ahora le dan 10 segundos a alonso por cumplir mal su penalidad de 5 segundos por lo tanto pierde el podio resultado final 1 checo 2 verstappen 3 russell 4 alonso 5 hamilton
1648,35754,pap verstappen de seguro trae un berrinche atravesado
1649,35755,deportes checoprez es el ganador del saudiarabiangp y firma su quinta victoria en la f1 tras perder momentneamente el liderato el piloto mexicano se llev el triunfo este domingo en jeddah max verstappen fue segundo y george rusell tercero
1650,35756,qu hermoso es leer los lloros de los pro verstappen que la ma
1651,35757,cuando alonso y checo hablan en espaol y verstappen no entiende nada
1652,35758,q csm max verstappen y la fia
1653,35759,checo prez se qued con la victoria en el gp de arabia saud verstappen y rusell lo acompaaron en el podio
1654,35760,como te odio verstappen
1655,35761,saludos jos verstappen
1656,35762,la felicidad del papa de verstappen es amazing increible y contagiosa jajaja lero lero
1657,35763,formula1 fernando alonso tercero en el gparabiasaudita el piloto espaol ha terminado solo por detrs de prez y verstappen carlos sinz ha sido sexto
1658,35764,xfavor la cara de jos verstappen tieso
1659,35765,finalmente fueron 10 segundos de penalizacin para alonso que incluso ya haba festejado en el podio con checo y verstappen george russell sube a tercero
1660,35766,jos verstappen no soporto
1661,35767,el pap de verstappen en el festejo de checo
1662,35768,carreron de checo amp que bueno es verstappen corre a otro maldito nivel
1663,35769,la cara de jos verstappen pobrecito nunca gan una carrera
1664,35770,que me quede claro sancionan a alonso por hacer lo que max verstappen estuvo haciendo todo el ao pasado en la parada el equipo comete un error y le caen 10 segundos no 5 y a russell le llueve un podio russell que ayer se libr de una sancin
1665,69762,revelan mal comportamiento de max verstappen durante todo el gran premio de arabia saudita
1666,69763,aunque sergio checo prez gan el gp de arabia saudita no todos estuvieron conformes con ello empezando por su coequipero max verstappen nms17 con elizabeth cano y alejandrogodi01 unmundocompartido sguelo por
1667,69764,s felicit a checo la carita viral del pap de max jos verstappen le dio la vuelta a las redes aunque apareci una grabacin sin cortes donde se muestra la interaccin con sergio prez f1xfsmx
1668,69765,yo lo siento pero este ao es difcil ponerle buena nota a verstappen porque el red bull es una bala aun hacindolo fatal podra ganar como hamilton en su momento
1669,69766,comienza la guerra en red bull max verstappen no acepta estar por detrs de checo prez
1670,69767,son el himno nacional mexicano en arabia saud sergio checo prez consigui la victoria en el gran premio de arabia saud el mexicano obtuvo el primer podio mientras que su compaero de rb max verstappen qued segundo y fernando alonso tercero saudiarabiangp
1671,69768,algunas estadsticas en la corta historia del gparabiasaudita en el circuito de jeddah f1 formula1 pole vueltas rpidas podiums top5 top10 puntos histricos verstappen hamilton perez mejisports mejiestadisticas elmeji
1672,69769,jos verstappen es un psicpata por suerte el hijo todava tiene humanidad
1673,69770,revelan mal comportamiento de max verstappen durante todo el gran premio de arabia saudita
1674,69771,jos verstappen reconoci que el triunfo del mexicano sergio prez en el gp de arabia saudita se dio por falla en el blido de su hijo max f1 checoperez
1675,69772,no aguant mas pap verstappen tuvo que hablar a mercedes ya se va youtube
1676,69773,no veo f1 pero tanto que veo a verstappen en todos lados ya me cay gordo jajaja
1677,69774,rosberg y hamilton me hacen acordar a senna y prost si verstappen y perez van a ser o intentar ser as ojal sea una gran rivalidad porque ambos traen bronca
1678,69775,qu vergenza la actitud de verstappen y la del tata ni digamos
1679,69776,para favorecer a verstappen eso era todo de ah pudo llegar al segundo por fortuna no logro superar a checo y as se pudo disfrutar la arrechera del padre y el malcriado y peligroso piloto
1680,69777,checo prez encar a verstappen tras desobedecer las ordenes de red bull sigue sin entender
1681,69778,yo camino a contarle a mi novia algo que se supone no debera contarle a nadie
1682,69779,tierra trgame la cara del padre de verstappen en la celebracin de prez f1 spanishgp formula1 mundo deportivo
1683,69780,inicia la guerra checo prez vs verstappen por el campeonato resumen via youtube
1684,69781,los verstappen contra checo prez la mam de max lo ha llamado infiel su pap lo ha minimizado y mad max no ha sido el mejor compaero en red bull
1685,69782,hasta parece que verstappen es el mexicano por sus actitudes
1686,69783,no como el pap de verstappen bien ogt el don
1687,69784,estaba viendo cosas de la formula 1 hoy en tumblr y de alguna manera termin leyendo un fanfic cortito de max verstappen y rayita jajajajajajajajajaja
1688,69785,frmula 1 la tensa charla entre checo prez y max verstappen que mantiene en alerta a red bull
1689,69786,todo es culpa de jos verstappen
1690,69787,verstappen es un mal perdedor todo lo bueno q es lo empaa eso
1691,69788,sin checo perz max verstappen jams hubiera sido campen del mundo ahora es el turno de checo prximo campen del mundo en f1 a darlo todo por
1692,69789,es cosa ma o si dura 20 vueltas ms fernando alonso llega a verstappen fijaos a partir de la vuelta 45
1693,69790,pues para m por mucho que seas hamilton alonso o verstappen me parece una guarrada de mucho cuidado es deporte y tiene que haber juego limpio y dejar espacio al rival es parte del juego
1694,69791,la vida va como verstappen en frmula 1
1695,69792,como este carajo no fue campen existe verstappen
1696,69793,la pola ms top que existe con las papamugre ms deliciosas
1697,69794,pap de verstappen s felicit a checo prez en el gran premio de arabia saudita
1698,69795,sergio prez vence em jeddah mas max verstappen segue lder do campeonato
1699,69796,pues a m s me gustara ver a schecoperez en ferrari el otro ao tras ganar el campeonato f1 checoprez te odio verstappen
1700,69797,otro buen dato ste de mi amigo salimgol checo ya iba para el hat trick pole triunfo y vuelta rpida pero en esas condiciones verstappen hubiera sufrido la primera gran humillacin de su carrera y sacrific ritmo para sacar la vuelta rpida a como diera lugar no slo fue
1701,69798,helmut marko justifica que verstappen le robara la vuelta rpida a checo prez
1702,69799,eventualmente va a tronar el carro ya se ver que tanta dureza mental tiene verstappen al tiempo
1703,69800,pap de verstappen mostr tremendo enfado en festejo de red bull con checo schecoperez f1 max33verstappen redbullracing
1704,69801,jos y max verstappen son ms tontos que un bocado en la polla
1705,69802,naomi formula1 fernando alonso leclerc carlos sainz jr max verstappen checo perez hamilton antonella vettel ferrari red bull steam mclaren league of legend otaku andaluca yo soy mas de cupra de ternura o con cupra aston martin sampaoli
1706,69803,max verstappen dio una ctedra de manejo super a todos los pilotos a pesar de haber salido en la posicin 15 por una falla mecnica solo un prodigioso piloto fue mejor por cinco segundos es un orgullo que ningn mexicano haba logrado despertar llevar tan alto
1707,69804,que inmamables y poco profesionales estn saliendo los verstappen
1708,69805,al igual que con verstappen y prez se llama ser competitivo que les dejen competir y veremos quin es mejor ganamos los aficionados
1709,69806,naomi formula1 fernando alonso leclerc carlos sainz jr max verstappen checo perez hamilton antonella vettel ferrari red bull steam mclaren league of legend otaku andaluca yo soy mas de cupra de ternura o con cupra aston martin sampaoli
1710,69807,tpico de max red bull se refiri a vuelta rpida que verstappen le gan a checo
1711,69808,un nuevo video demuestra que s hubo felicitacin de jos verstappen a sergio prez tras la victoria en arabia saud pero esto no dej contentos a todos
1712,69809,adivinen que van a hacer la prensa y fandom de checho estas dos semanas de espera para el proximo gp no no van a celebrar la victoria del mexicano
1713,69810,no hay ni ha habido nadie como fernando alonso en lectura de carrera y que lo haya va a ser muy pero que muy difcil esto es tan animal como el hammer time de hamilton o el ritmo de clasificacin que tiene verstappen uno de los elegidos
1714,69811,la actitud de verstappen es de niato desobedecer las rdenes de equipo debera acarrear una sancin interna y un gran aviso ojala checo lo pueda domar y se vea una guerra a timba abierta en igualdad si el nuevo ceo lo permite
1715,69812,ya se ve como verstappen con un coche bueno es mega dominante pero cmo este pibe todava no tuvo su oportunidad yo te compro que en ciertos sectores le falta madurar pero es un piloto tan completo que tranquilamente podra hacer lo mismo que verstappen imo el sera mejor
1716,69813,la amelia como mam si sera
1717,69814,20hs clasificando en vivo analizamos junto a guido croceri alelezcano totodriver a carlosdsaavedra todo el supertc2000 las tcpk la f1 sigue enojado verstappen porque gan checo que pas con alonso en vivo
1718,69815,verstappen todos estn felices en el equipo yo no via dlasamericas
1719,69816,el concepto
1720,69817,yo creo y voy a seros franca con el tema charles y es que el monegasco yo le veo condenado a quedarse en ferrari no hay por ahora un equipo que pueda genuinamente con red bull y si se va a rb verstappen se lo coge en el sentido latam
1721,69818,el plan alonso verstappen checo f1 jeddah saudiarabiangp elmagic
1722,69819,alguien me va a tener que explicar de dnde inventaron esto la radio literalmente les dijeron free to push verstappen cuando pregunt por el tiempo de vuelta rpida su ingeniero se lo dijo y nunca le di ninguna indicacin de que no pudiera hacerla increble
1723,69820,en lo personal schecoperez esta demostrando porque esta donde esta no es un regalo es esfuerzo horas de practica en el simulador etc etc felicidades para checo y la actitud del sr jos verstappen algo vergonsoza que perro asco de actitud hasta corage me dio
1724,69821,saudiarabiangp 1 perez est en su mejor momento en f1 su manager lo tiene que asesorar muy bien alejarlo de cualquier controversia y hacerlo hablar en la pista no fuera 2 verstappen minimiz los daos de la quali no pudo con el ritmo de perez frustrado pero lder
1725,69822,hoy si que estoy en desacuerdo verstappen ha ganado 36 carreras conoce muy bien cul es el protocolo y sabe perfectamente que los 3 primeros autos deben de mantenerse en pista y parar en los lugares asignados si eso lo hubiera hecho niconozco el podium hulkenberg se
1726,69823,tambin hubo algo de polmica tras la victoria de checo prez en el saudiarabiangp jos verstappen padre de max se volvi viral en redes sociales debido al semblante serio que tuvo en medio de las celebraciones del piloto mexicano
1727,69824,no se a ustedes pero a mi verstappen me da vibes de este wey
1728,69825,comparan el max checo con el lewis nico verstappen est en un nivel inalcanzable para prez sorry por los mexicanos y haters de max
1729,69826,max verstappen solito est cayendo con sus malas actitudes en el papel del patn odioso de la pelcula mientras que checo con sus cualidades y carisma es el muchacho bueno de la pelcula
1730,69827,me gusta que quin est sacando a la luz el drama con la lucha verstappen prez es nico rosberg jajajaja te amo nico checo mtele nitro p
1731,69828,ya ayer conocimos en su mejor faceta al pap de verstappen pero te presentamos a ellos
1732,69829,buenas noches me voy a soar que max verstappen va a dejar a su novia por mi y vamos a tener 3 hijos un perro y dos gatos
1733,69830,jos verstappen reconoci que el triunfo del mexicano sergio prez en el gp de arabia saudita se dio por falla en el blido de su hijo max f1 checoperez
1734,69831,naomi formula1 fernando alonso leclerc carlos sainz jr max verstappen checo perez hamilton antonella vettel ferrari red bull steam mclaren league of legend otaku andaluca yo soy mas de cupra de ternura o con cupra aston martin sampaoli
1735,69832,me declaro enemiga de los verstappen y me vale culo que max est agradable a la vista pero esa mean girl energy que tienen me la vuela
1736,69833,con toda la polmica respecto al record de vuelta de verstappen en la ltima me parece raro que haya existido una orden respecto a no atacar el record si que hubo una de no subir el ritmo para atacar la posicin lo ms lgico f1 saudiarabiangp
1737,69834,naomi formula1 fernando alonso leclerc carlos sainz jr max verstappen checo perez hamilton antonellavettel ferrari red bull steam mclaren league of legend otaku andaluca yo soy mas de cupra de ternura o con cupra aston martin sampaoli
1738,69835,verstappen pone mala cara pese a remontada en yeda
1739,69836,lo nazi que es jos verstappen madre de jesucristo
1740,69837,al expiloto y padre de mad max jos verstappen no le gust nada la victoria de sergio checo prez en el gran premio de arabia saudita de la frmula 1 the post cara de desprecio y palo en los medios la furia del pap de verstappen por triunfo de
1741,69838,no soy el segundo verstappen max verstappen piloto de red bull explic su molestia tras el gp de arabia saudita el equipo est feliz pero yo personalmente no lo estoy porque no estoy aqu para ser el segundo verstappen redbull f1
1742,69839,esta actuacin de checo prez le pone a red bull la condicin de que puede pelear por el campeonato verstappen no la tendr fcil contra el mexicano max en igualdad de condiciones ni lo pudo pasar ni lo alcanz fsradiomx
1743,69840,mi descubridor de talentos particular quien me puso sobre la pista de de vries albon norris max verstappen y tantos otros antes que nadie antes de que los ejspertos reclamaran luego esos descubrimientos borjapdlr
1744,69841,hay niveles checoprez verstappen
1745,69842,jos verstappen reconoci que el triunfo del mexicano sergio prez en el gp de arabia saudita se dio por falla en el blido de su hijo max f1 checoperez
1746,69843,que va a pasar si checo y verstappen siguen tan parejos fernando tornello no se si van a seguir yam parejos jajajaja me encanta ese seor
1747,69844,verstappen hace el ridculo y demuestra miedo escnico a sergio prez va youtube chacho lml as o mas claro o solo los espaoles lo ven
1748,69845,jos verstappen jams gan un gran premio
1749,69846,checo prez logr un gran triunfo en arabia saudita verstappen complet el 1 2 de red bull y lidera el campeonato de la frmula 1
1750,69847,puto genio
1751,69848,helmut marko arremete contra verstappen por robo de vuelta rpida a checo tpico de max hay quien de rdenes y se acatan o cada quien hace lo que su gana le da
1752,69849,felizlunes yoonsanha saudiarabiangp dainternacionaldelafelicidad chivas zcalo verstappen alonso jisoo concept poster
1753,69850,jos verstappen reconoci que el triunfo del mexicano sergio prez en el gp de arabia saudita se dio por falla en el blido de su hijo max f1 checoperez
1754,69851,felizlunes yoonsanha saudiarabiangp dainternacionaldelafelicidad chivas zcalo verstappen alonso jisoo concept poster
1755,69852,los fanticos de checo festejan y quieren que este se meta en los con verstappen lo que no saben es que el nico que puede perder algo es el mismo perez verstappen es 100 la prioridad de rb jams van a preferir al mexicano
1756,69853,felizlunes yoonsanha saudiarabiangp dainternacionaldelafelicidad chivas zcalo verstappen alonso jisoo concept poster
1757,69854,pap verstappen cuando gana prez pap prez cuando gana verstappen
1758,69855,estoy llorando como un lactante
1759,69856,la virgencita nos har el milagro de que verstappen siempre qued en segundo tercer cuarto o ltimo lugar con un mexicano nadie se mete
1760,69857,sexo en estado puro
1761,69858,pole position liderar casi toda la carrera contuvo a verstappen quinta victoria en f1 fin de semana espectacular de checo prez en el saudiarabiangp
1762,69859,el resentimiento a hamilton es increble red bull es igual de dominantes que en 2011 o 2013 por lo menos en mercedes haba lucha entre compaeros de equipo o verstappen haciendo sombra ac la diferencia es abismal psimo relator y encima un resentido
1763,69860,va reforma jos verstappen reconoci que el triunfo del mexicano sergio prez en el gp de arabia saudita se dio por falla en el blido de su hijo max f1 checoperez
1764,69861,va reforma jos verstappen reconoci que el triunfo del mexicano sergio prez en el gp de arabia saudita se dio por falla en el blido de su hijo max f1 checoperez
1765,69862,va reforma jos verstappen reconoci que el triunfo del mexicano sergio prez en el gp de arabia saudita se dio por falla en el blido de su hijo max f1 checoperez
1766,69863,va reforma jos verstappen reconoci que el triunfo del mexicano sergio prez en el gp de arabia saudita se dio por falla en el blido de su hijo max f1 checoperez
1767,69864,va reforma jos verstappen reconoci que el triunfo del mexicano sergio prez en el gp de arabia saudita se dio por falla en el blido de su hijo max f1 checoperez
1768,69865,aunque los verstappen hayan felicitado a checo la declaracin del papa verstappen de la victoria de prez no es muy amable que digamos sea seor su hijo ya tiene 2 world championships ya sintese
1769,69866,checo prez el triunfo que no soport el padre de max verstappen somosunanimo
1770,69867,te amo don guapo
1771,69868,verstappen es el carajito malcriado al que su papi le deca que no y armaba el berrinche tengo cero dudas
1772,69869,jos verstappen no creo que checo tenga la oportunidad de ganar tan a menudo seamos sinceros triquiuelas de red bull aparte y sin desmerecer a sergio prez max est a un nivel superior y por cierto jos s felicit a prez f1 saudiarabiangp
1773,69870,jos verstappen reconoci que el triunfo del mexicano sergio prez en el gp de arabia saudita se dio por falla en el blido de su hijo max f1 checoperez
1774,69871,verstappen que penilla me ests dando si no soy el centro de atencin me enfado y no respiro
1775,69872,jos verstappen reconoci que el triunfo del mexicano sergio prez en el gp de arabia saudita se dio por falla en el blido de su hijo max f1 checoperez
1776,69873,prez responde a horner me dieron informacin distinta a verstappen f1
1777,69874,verstappen critica la avera del sbado en su red bull si el ttulo est entre nosotros hay que asegurarse de que los dos coches son fiables
1778,69875,jos verstappen fue es y siempre ser un fracasado su nico logro es ser la sombra de su hijo
1779,69876,naomi formula1 fernando alonso leclerc carlos sainz jr max verstappen checo perez hamilton vettel ferrari red bull steam mclaren league of legend otaku andaluca yo soy mas de cupra de ternura o con cupra shanks aston martin sampaoli
1780,69877,nos olvidamos como jugar al futbol
1781,69878,infografaimp prez gana en arabia saudita tras resistir carga de verstappen 19mar
1782,69879,buscando una cosa sobre pap verstappen que un compi de equipo escribi para la revista que hacamos me he dado cuenta de lo chula que estaba nuestro magazine de f1 taba guay o no revista muy fan de la f1 n2 ahora en calameo calameo
1783,69880,naomi formula1 fernando alonso leclerc carlos sainz jr max verstappen checo perez hamilton vettel ferrari red bull steam mclaren league of legend otaku andaluca yo soy mas de cupra de ternura o con cupra shanks aston martin sampaoli
1784,69881,que mal esta jugando el bayern
1785,69882,verstappen pone mala cara pese a remontada en yeda
1786,69883,i mean le meta medio segundo por sesin arrastrando una enfermedad y despus le casco dos segundos en la ultima vuelta para hacer la vr
1787,69884,jajajajajajaj ests en un concurso de fracasados pero tu oponente es jos verstappen
1788,69885,padredeverstappen se moria del coraje el padre de verstappen
1789,69886,checo no va a ganar en su vida un mundial hermano es de primero de primaria que se va a por la vuelta rpida en la ltima y que verstappen es un lobo y va a hacer todo y ms para ganar el mundial qu coo haces hermano
1790,69887,naomi formula1 fernando alonso leclerc carlos sainz jr max verstappen checo perez hamilton vettel ferrari red bull steam mclaren league of legend otaku andaluca yo soy mas de cupra de ternura o con cupra shanks aston martin
1791,69888,verstappen pone mala cara pese a remontada en yeda
1792,69889,es imprescindible ser un maleducado como verstappen y su padre para ser campen del mundo
1793,69890,verstappen pone mala cara pese a remontada en yeda
1794,69891,qued demostrado que en igualdad de circunstancias sergio el checo prez es mejor piloto que max verstappen
