,Id,Tweet
567,27834,ahora s rafa puente ya se va ya se va ya se va
568,27835,rafa puente est fuera de pumas ya se haban tardado o no notadeportiva ligamx
569,27836,pumas rafa puente del ro est fuera del club universidad nacional pumasmx pumas torosports
570,27837,cesan a rafa puente del rio por fin aunque eso no signifique que los pumas mgicamente comiencen a jugar bien
571,27838,mijos es la directiva rafa puente jr solo ser uno ms
572,27839,as reaccion la aficin de pumas a rafa puente tras el silbatazo final
573,27840,noooooo que siga don rafa puente
574,27841,rafa puente deja de ser tcnico de pumas no aguantaron los malos resultados terrible gestin
575,27842,a rafapuente lo corrieron no importa qu da o en qu poca leas esto
576,27843,desde que se anunci se vea venir no tengo pruebas pero tampoco tengo dudas rafa puente del ro no es ms tcnico de pumas ligamx
577,27844,lo pensaron mucho pero se dio el paso es cierto como deca rafa puente una vez puma siempre puma pero hay que defender el honor y la mstica de una institucin como pumasmx y ahora quin a pesar de todo comonotevoyaquerer
578,27845,aficin de pumas agredi a rafa puente tras derrota frente al pachuca
579,27846,adis al poeta rafa puente
580,27847,lo peor es que rafa puente jr no se fue baado se fue entre fideos de maruchan
581,27848,cesan a rafa puente como director tcnico de pumas deportes
582,27849,primeradivisindemxico rafa puente niega que pumas toc fondo porque puede ir ms abajo cuntas veces ha sido ltimo
