,Id,Tweet
998,92769,carre a que hora piensa dar el anuncio de qsmp
999,92770,se las dedico a mis mutis y no mutis
1000,92771,y te digo
1001,92772,lo guapo que es dios mo
1002,92773,no te creo na hrmno
1003,92774,nunca ms voy a confiar en los tetones me mintieron sobre ranboo estando en qsmp
1004,92775,yo se que esto es una pista george comiendo quesadillas mmm y que ms va con las quesadillas la isla quesadilla del qsmp ayuda estoy cayendo en la locura
1005,92776,quien rayos a dicho que farfa no sabe rolear que venga que me lo cago a trompadas
1006,92777,ahora es cuando lo anuncian al qsmp ayuda porfavor soy tremendo esquizofrenico me hice tremenda idea d q el estar x las pocas interacciones q tuvo con el pato
1007,92778,odi oqie me salga los cosos falsos de invitaciones del qsmp bastaaaaaaa
1008,92779,me voy a mear si vegetta y spreen llegan a interactuar gracias dios quackity por esto
1009,92780,jugamos roblox ayuds
1010,92781,mi fav
1011,92782,rodri es yo con luke
1012,92783,es que loco billie es re linda
1013,92784,su problema es que no conoce la integracin bsica de la repblica los poderes del estado colaboran de manera institucional no rien earthquake foradomitila gfvip kiev pascal qsmp worldbaseballclassic aries
1014,92785,into you te amo hoy y siempre
1015,92786,dios q hombre estpido no veo la hora de q mi mama se separe
1016,92787,mi nica neurona se hizo chicarron dejen veo los clips de cuando sacaron su boleto en el qsmp y vuelvo
1017,92788,orgullosa de lo que se ha convertido este pato qsmp
1018,92789,s que odian y yo odio escribir a mi volkacio con traiciones o cosas negativas pero como late escribir con una cancin de tolerate it de fondo mejor escribo uno de drama si a todo menos a la separacin o divorcio
1019,92790,tengo una insana necesidad de que elmariana este en el qsmp nopuedeser estoi mal
1020,92791,yo creo q ahorita carre abre de la nada del minecraft y dice omg estoy en el qsmp
1021,92792,soy carre mientras vea a billie en la tele no hay plata
1022,92793,tengo clases hasta las 5 15 no podr ver el stream de quackity la concha
1023,92794,galaqsmp con mi cubo menso te quiero mucho shark o y estoy emocionadisima por el qsmp
1024,92795,mi profesora me encanta me da tanta confianza
1025,92796,queeee aldo confirmado en el qsmp
1026,92797,se imaginan mikecrackyt en el qsmp pero naaaaaaaaaaaaaaaaaaaaaaaaaaaaaaaaaaaaaaaaaaaaaaaaaaaaaaaaaaaaaaaaaaaaaaaaaaaaaaaaaaaaaaaaaaaaaaaaaaaaaaaaaaaaaaaaaa
1027,92798,me niego a pensar que juan no tenia invitacin para el qsmp en caso de que l no est es por que haya rechazado si es as tocar respetar el porqu lo haya echo aunque me duela en toda la puta alma
1028,92799,ya me est enojando muchsimo la gente que hace los fakes qsmp invitations
1029,92800,cuando van a ver el documental
1030,92801,susurra un un au rinsagi enemies to lovers con corazon delator de soda estereo
1031,92802,george anunciando quesadillas tiene q significar algo escuchenme
1032,92803,comooo
1033,92804,la guajolota es un pan con un tamal en medio no me gust nadaaaa
1034,92805,decia que finneas es shadoune ajaj es igual
1035,92806,me prestan 11 mutis juro que los cuido
1036,92807,que que
1037,92808,m estoy durmiendosjwkebdje
1038,92809,ya pasaron horas pero yo no supero q vegetta vaya a estar en el qsmp hermanas ustedes no entienden lo pico que es esto
1039,92810,estoy nerviosa q pasa si roier de verdad no esta en qsmp
1040,92811,ya maana es el qsmp te juro que pensaba que era el 27 soy imbcil el jueves tenho examenes
1041,92812,ya llegue d la escuela gente toca llorar x qsmp i ni ha empesado
1042,92813,aaaaaa me perd muchoo
1043,92814,ahora que lo pienso memory suena como me mor pero mal pronunciado
1044,92815,veqetta en qsmp queeeee aaaaaaaaaaaaaaaa aaaaaaa
1045,92816,maana a esta hora voy a estar saliendo para el cine q no se note mi emocion desde hace 2 semanas
1046,92817,hola wilbur puedes prender y confrmanos tu participacin o lloro
1047,92818,carre y yo tenemos el mismo fanatismo por billie
1048,92819,en estos momentos me encuentro esperando a mis paps que quedaron de llegar a las 7 y ya han pasado 28 minutos
1049,92820,fans de wilbur cuando se enamoran de una egirl o no se mi ex no tiene un nuevo novio
1050,92821,el d publicando un poster del qsmp me tiene
1051,92822,que tierno es carre
1052,92823,cul son yo el primero
1053,92824,como que estara jaiden en el qsmp
1054,92825,memes por si dream carta de est en el qsmp suicidio
1055,92826,no saben cuanto quisiera que axo este en el qsmp
1056,92827,memes por si el mctrio carta de est en el qsmp suicidio
1057,92828,que grata sorpresa lu y yo antes de dormir que entre triple 7 al qsmp
1058,92829,cuando van a decir que vicky est en el qsmp la necesito en ese server
1059,92830,ya a ver a el estilo de la panto elijan en cunto tiempo quieren la actu
1060,92831,la profe dijo q busquemos informacin nunca q tengamos q copiarla en la carpeta vaco legal xd
1061,92832,queeeee como que jaiden estara en el qsmp hoy colapse
1062,92833,no da risa es mi trauma de los squids
1063,92834,wey si quackity ya la est rompiendo un chingo en el qsmp y ni siquiera ha empezado no me puedo imaginar maana nahmmamen
1064,92835,mutuals interactuemos comenten y les doy uno o varios me gusta tu cuenta quiero verte ms un mi tl me caes bien lindo ly quieres amigar interactuemos ms muti fav casmonos
1065,92836,con philza foolish y vegetta en un mismo server no me quiero ni imaginar las construcciones q vamos a ver
1066,92837,la foto
1067,92838,q lindo vegetta en el qsmp
1068,92839,yo no me preocupo porque estoy 99 segura q eventualmente se le invitar a otros participantes para q entren al qsmp
1069,92840,carre prendi yo s que pronto abrir minecraft y estar la invitacin
1070,92841,dos cosas qsmp es una serie larga puede que personas entren y salgan durante el transcurso de la misma puede que sapopeta haga aparicin en algn momento if you know you know
1071,92842,golden procede a hacer hc con mi cubito jskdnfksd
1072,92843,literalmente tuvimos todo frente a nosotros cuando wilbur menciono a karmaland
1073,92844,chau persona annima
1074,92845,nadie del dream team fue anunciado an para el qsmp
1075,92846,wtf maana empieza qsmp y un nueva session del biza diazo
1076,92847,la doble personalidad le est pegando fuerte
1077,92848,rubius y roier afirmando no estar en el qsmp comunidad vigilando por si acaso
1078,92849,q el mac trio rivers estn el qsmp
1079,92850,ya que sabemos que vegetta estar en el qsmp recordemos este momento pues que vamos a hacer en la crcel pues escupirnos y darnos besos jakjskjs
1080,92851,no sabi q mi hermana me dijo q m de nuevo porq le dije q lo iba a subir en 5 das a si q tal vez sean menos esta kbra chica qlia me trata como el hoyo
1081,92852,yo viendo como quackity anunci a los miembros del qsmp y todava no estn carre tina roier mariana aldo rivers y el dream team apost quedarme pelada si no estn dream george y sapnap
1082,92853,estoy as
1083,92854,fav y mato a mi pap
1084,92855,ya fue m encanto
1085,92856,x quin quieres que este en el qsmp me diamantes aw man
1086,92857,solo pienso en que volveremos a tener momentos como este en el qsmp
1087,92858,historia me caes mal
1088,92859,hermano que emocin que jaidenanimation est en qsmp
1089,92860,gente maana para ver los qsmp en el colegio voy a volver a hacer el mismo plan q hacia con los squid
1090,92861,ando en clase pero ando bien al pendiente de twitter haber si anuncian a alguien ms ahhhh
1091,92862,no me dejan de citar bots con este comentario lpm
1092,92863,donacin cuando y como iremos ese dia germn todos de gala ese da tenemos que encontrar el nombre perfecto para ustedes estara bueno y luego elegimos un da para el bautizo y podra tambin ser nuestro aniversario tambin sera bueno dicho y hecho rey
1093,92864,hijos de la chingada empezo a sonar high school sweethearts del lbum k 12 justito seal de no s que pero seal tiene que ser
1094,92865,yo m fui a dormir y dije fue me despierto y seguro anuncian a cinco o siete participantes ms y no pas la vdd no tengo ni idea de cuntos faltan
1095,92866,twitter ta fome quackity dale sube otro integrante del qsmp porfa
1096,92867,literalmente todos los tripoiers manifestando que roier este en el qsmp cuando ya nos repiti un montn que no va a estar
1097,92868,estoy desesperado necesito que roier anuncie que va a estar en el qsmp o voy a llorar como no tienen idea
1098,92869,a partir de ahora es isla pato y no acepto otras opiniones
1099,92870,carre explicando soy yo
1100,92871,este emoji desde cuando existe
1101,92872,yo maana pq no quiero perderme el estreno de qsmp
1102,92873,bueno no se dibujar pero como me agrada mucho quackity y su serie ac dejo mi dibujito qsmp
1103,92874,a las chicas lindas no nos importa la nota del parcial nos importa que el mc tro este en qsmp
1104,92875,fan de rubius cuando ven un rubio o no s a mi nunca me qued lejos mxico
1105,92876,broo maana empieza qsmp sabias que empieza qsmp por que yo s q maana empieza qsmp y t deberas saber q maana arranca qsmp
1106,92877,me acabo de imaginar en un equipo en qsmp a missa maau farfadox spreen quackity rubius no se por que pero vera un desmadre con esos juntos
1107,92878,necesito una cancin d taylor swift k me identifique en este momento
1108,92879,podrn manejar esa facha y ser parte del qsmp
1109,92880,ojo chisme
1110,92881,bueno pero dime quin eres
1111,92882,el hilo donde me han expuesto ha tenido demasiada repercusin y ahora mismo tengo ms de 1 000 mensajes insultndome solo quiero decir que me parece impresionante el hate que me est cayendo por el simple hecho de tener un culo enorme
1112,92883,estoy en shock vegetta777 en los qsmp
1113,92884,que haba lo vi y dije despues lo voy abrir por que estaba ocupada y ahora me sale esto
1114,92885,a que hora seria el coso del qsmp
1115,92886,q edad tiene le calculo unos 8 aos
1116,92887,cuantos van a ser en el qsmp pq no tienen mucho tiempo parq anunciar a ms
1117,92888,si analizamos esto roier roier qsmp qsmp 5 5 a las 5 anuncian a roier en el qsmp
1118,92889,diosito porfa mete a tina al qsmp es lo nico q necesito para ser feliz
1119,92890,emotes nuevos en el canal de german si a todo pero necesito una sub de ahi a a a a aa a a
1120,92891,carre en el qsmp alo
1121,92892,ya no aguanto este sufrimiento llamado maana comienza el qsmp y quackity est revelando a los integrantes como tortuga
1122,92893,se cancela la depresin maana empieza el qsmp
1123,92894,maana louis esssss
1124,92895,vayan a ver este edit y se ganan una galleta
1125,92896,soy nueva en la comunidad del mctrio pero que cague de risa ver a la gente tomndose las cosas tan enserio
1126,92897,vegetta se confirm para el qsmp yo manifest esto rec para esto dios es grande dios est aqu
1127,92898,ahuevo
1128,92899,qsmp tiene todo para ser la mejor serie de minecraft del ao yo s tu sabes todos saben
1129,92900,no conozco a nadie de los del qsmp
1130,92901,quien creen que sea la primera muerte en qsmp
1131,92902,me sal de twitter 2 segundos y vegetta en el qsmp
1132,92903,y soy afortunado de serlo
1133,92904,neta q el qsmp me trae bien esquizofrnica
1134,92905,listo maana estoy para ver el qsmp
1135,92906,rubius y roier si van a estar en el qsmp pero nos mienten como tpicos hombres que son
1136,92907,metan a ran al qsmp ya vi que bio encerr a frisbee en la crcel
1137,92908,sarec vegetta ya confirm q si estar en el qsmp
1138,92909,hola diganme hola
1139,92910,ojal pasen el qsmp en el canal 5
1140,92911,me cago en la mrdaaaaaa
1141,92912,todos cuando vegetta fue anunciado en el qsmp
1142,92913,la cancin the fall de lovejoy es la droga auditiva de la que hablan en ese captulo de la rosa de guadalupe
1143,92914,martes con m de me voy a matar
1144,92915,wey lo mucho que va a crecer q con el qsmp estoy muy orgullosa de l
1145,92916,siento que carre va a estar en el qsmp
1146,92917,galaqsmp qsmpfanart qsmp informal pero fachero pa
1147,92918,yo tmb quiero carola en el qsmp
1148,92919,dios
1149,92920,estoy lol osea vegetta en qsmp
1150,92921,okei d un actu a otro hay 5 das a si q tal vez en 5 das mas este la 3era parte
1151,92922,dios ya quiero que sea maana y mas momentos luckity qsmp luckity quackity luzufanart
1152,92923,amigos hoy es el mejor da de mi vida
1153,92924,lo que tengo que hacer para estar bien
1154,92925,quackity est logrando tanto q ala mi yo del ao pasado q pensaba q nos abandonara esta super feliz por l
1155,92926,me esyas diciendo que tendr a jaiden y vegetta en un mismo server estoy gritando
1156,92927,puede roier decir ya q si va a estar en el qsmp ya no es gracioso
1157,92928,posiblemente maana me lleguen mis pcs de minghao aaaaaaaaaaaaaaaah
1158,92929,voy a irme a cualquier lugar a ver si anuncian mas participantes en qsmp digo ya sucedio 4 veces lajskajd
1159,92930,oficialmente si el dteam est en el qsmp me rapo toda
1160,92931,va a estar rubius en el qsmp
1161,92932,spreen sube una foto con fondo verde diciendo nos vemos maana en el qsmp pero saben quien mas subi sin motivo una imgen verde asi es dream esto es una confirmacin indirecta de su participacin en el server lo s creanme
1162,92933,basta viy a llorar
1163,92934,ahora ya no es explotar la puerta de vegetta en el da 1 de karmaland ahora es explotar la puerta de quackity en el da 1 de qsmp
1164,92935,que paja hacer guiones la concha de mi madre
1165,92936,maana se viene una banda de cosas piolas  qsmp quackity qsmp spreen vegetta luzu
1166,92937,voy a esperar pacientemente a que este ser presente una denuncia con pruebas que no sea archivada de ninguna manera de otra forma voy a proceder a decir xd
1167,92938,por culpaa de qsmp estoy en mi momento ms esquizoooooo aaaaaaaaaaaaaaa
1168,92939,maana no voy a la escuela
1169,92940,los que dicen que no estarn en el qsmp como rubius o el mctrio es que van a estar segurisimo
1170,92941,dios mio estoy muy inactiva por la escuela pero todo lo de qsmp me est regresando a la vida
1171,92942,mexican q qsmp quackity quackityfanart
1172,92943,yo ya asum que dream karl sapnap george rub roier aldo mariana rivers shadoune juan carre y robleis no van a estar en el qsmp ahora les toca asumirlo a ustedes
1173,92944,maana
1174,92945,si anuncian a roier en el qsmp me corto la polla y me la como
1175,92946,carre en vivo vamos carre abr minecraft y el server qsmp
1176,92947,germn se va a entrenar y despus descansar
1177,92948,como les digo a mis padres q ya no quiero estar en el curso en el q estoy google buscar
1178,92949,quackity nos est volviendo locos a todos y eso que todava no comienza la serie ayudaaa que nerviosss welcome to the qsmp
1179,92950,acabo de despertar de mi siesta de 3 horas y me salio una foto de roier confirmado en el qsmp grite y llore y luego vi que es feik amigos no sean as
1180,92951,que maana es el qsmp
1181,92952,por si nadie les di sus flores amarillas
1182,92953,carre acaba de decir produc en lugar de produje y literalmente nadie en el chat dijo nada por dios son todos unos burros
1183,92954,manifiesto carre en el qsmp
1184,92955,y cmo se que esto no es una pista para decir que el maccombo estar en el qsmp
1185,92956,termine la parte 3 tengo q leerla de nuevo para estar segura pero no creo q la suba al tiro tal vez la suba la prxima semana
1186,92957,gente acabo de llegar de la escuela quienes estn confirmados para el qsmp a quienes anunciaron dganme que esper todo el da para poder saber aaaa
1187,92958,llegu de la escuela y lo primero q veo es a vegetta confirmado de vdd quiero llorar
1188,92959,no entiendo lo de las flores amarillas
1189,92960,che cuntos hay ya confirmado en qsmp ya perdi la cuenta
1190,92961,gery se lleva el premio a la troleada del ao xq lo admito re ca
1191,92962,hoy carre confirma tengo 0 pruebas pero tengo fe
1192,92963,no est rob porque de la nada sale carrera anunciando q es parte del qsmp y ms tarde sale rob que tambin anuncia que es parte del qsmp
1193,92964,aaaaaaaah hijos de su putamadre el estres q llevo en estos momentos solo lo puede sanar recordar que manifeste a vegetta en el qsmp
1194,92965,cmo q an no confirman a rubius para el qsmp
1195,92966,a qu hora anuncian a schlatt parte del qsmp
1196,92967,ahora se confirma a carre en el qsmp tengo fe
1197,92968,hasta que carre no reciba su invitacin no me duermo
1198,92969,feli cumpleaos wonjin
1199,92970,se me fue el atiny selca day noo9
1200,92971,ahhhh puedes hacerlo lo hiciste una vez solo que ahora s quedars
1201,92972,los pibes q ya han sido anunciados diciendo nos vemos maana en el qsmp pero y donde queda el mctrio y rivers y rubius y tina y shadoune y los otros 50 streamers q quiero q estn
1202,92973,y si el fondo verde de spreen tiene que ver con dream ayuda me vuelvo loco
1203,92974,ya se a quien voy a estar viendo en el qsmp
1204,92975,vegetta no va a dejar en paz a quackity con el nombre jajja
1205,92976,amigas se han dado cuenta de que si el rubegetta entra al qsmp podramos expandir la nation a nuevos horizontes
1206,92977,hola ya llegu a mi casa ha pasado mucho
1207,92978,no es cierto si fuera oficial ya en su directo o quizas la cuenta oficial de qsmp lo confirmaria
1208,92979,amigos apartense que voy a empezar a chillar kajslajlaksl
1209,92980,aprovecho eso para recordar esto otro
1210,92981,teoria spreen sube esta foto con una pantalla verde atras pantalla verde en ingles es green screen y a quien llama a haci si dream eso significa que dream confirmado en el qsmp
1211,92982,esta todo tan planeado y tan detallado de hecho hay una cancin de taylor swift q lo explica
1212,92983,carre se est comprando un tantito raro no basta ya ns necesito q este en el qsmp
1213,92984,hola mutuaaals jajaja estoy en urgencias jajajaj
1214,92985,quiero ver riverdale otra vez
1215,92986,no quiero salir de twitter siempre que salgo se anuncia un nuevo integrante del qsmp
1216,92987,callate roier no hables del qsmp si no es para decir q estars en l
1217,92988,as estoy esperando a q roier prenda stream y mgicamente se le antoje jugar minecraft y abra un cofre y de sorpresa le den su invitacin al qsmp
1218,92989,los 2 ltimos integrantes confirmados qsmp quackity
1219,92990,ya andamos muy esquizofrenicas y ojo q yo soy de las ms esquizos
1220,92991,yo pens q sera el 077 o el 007
1221,92992,quieren dejar de subir cosas fake ya me com como 5 hoy carajo
1222,92993,dos horas
1223,92994,qsmp que solo conozco isla pato
1224,92995,sera esta una qsmp referencia
1225,92996,gracias rodrigo estaba rezando que alguien prenda m salvaste
1226,92997,maana me pierdo el qsmp te odio universidad
1227,92998,me dio una sobredosis de vergenza que estoy tirada en el piso largando espuma
1228,92999,es que ya me veo que en dos das voy a estar extraando el da de hoy es que macho
1229,93000,como que vegetta estara en qsmp soy lagrimas soy alegria quiero llorar de la emocioooooooooooooooooooooooooooooon
1230,93001,memes por si roier carta de est en el qsmp suicidio
1231,93002,el ttulo de rodricarreraaa es la intro de vegetta eso significa que va a estar en el qsmp qsmp
1232,93003,m encantan los temones que pone carre al inicio de sus streams
1233,93004,amigos carre prendio stream y su titulo es esto y si lo puso pq hoy anunciaron a veggetta en el qsmp y si puso algo q ver con el qsmp es pq en este stream va a sacar su invitacin del qsmp
1234,93005,carre en el qsmp carre en el qsmp carre en el qsmp carre en el qsmp carre en el qsmp carre en el qsmp carre en el qsmp carre en el qsmp carre en el qsmp carre en el qsmp carre en el qsmp carre en el qsmp carre en el qsmp carre en el qsmp carre en el qsmp carre en el qsmp
1235,93006,es anormal la insensibilidad d los hombres
1236,93007,prendi carre para confirmar lo de qsmp yo s
1237,93008,me inspir
1238,93009,espero que pasen el qsmp por el canal 5 a las 5 confirmo lo que todos esperaban sobre el qsmp
1239,93010,no procesa que maana inicia el qsmp
1240,93011,konfien en mi banda faltan 20 minutos en 20 anuncian a doied
1241,93012,carre prendi
1242,93013,maana tendre q correr a mi casa a ver el qsmp me muero
1243,93014,maana se estrena qsmp as que quera recordarles este hermoso moment
1244,93015,acabo de salir de dar clases y me doy cuenta que vegetta estar en el qsmp es uno de los das ms felices de mi vida
1245,93016,mi para ti est lleno del qsmp pero como q mucho se demoran en lanzar mas integrantes no xd
1246,93017,como le hago para faltar a la uni para poder ver el qsmp
1247,93018,carre en su ttulo haciendo referencia a veggetta777 y vegetta hoy confirm su participacin en el qsmp es decir que hoy carre confirma su participacin tambin
1248,93019,como se respiraba wn maana no solo sale el qsmp sin que ahora me vine a enterar q 31 minutos va a tener otro collab con la unicef y ms encima con uno de mis personajes favoritos del ranking top aaaaaaaaaaaaaaaaaaaaaaaaaaaaaaaaaaaaaaaaaaaaaaaaaaahhhh
1249,93020,maana es mi cumpleaos y me mandaron esto a mi trabajo de manera annima lt 3 quackity no hay mejor regalo
1250,93021,maana voy a cancelar todas mis salidas por qsmp
1251,93022,los jvenes de hoy solo quieren una cosa que eret est en el qsmp
1252,93023,mn voy a estar en clases para el qsmp pero nimodo prestar atencin nunca fue una opcin
1253,93024,espera queee
1254,93025,ya estuvo buena la broma tvbbo ya anuncia tu boleto del cueseempe
1255,93026,un dia antes del qsmp se me viene a cortar el internet
1256,93027,prendi carre
1257,93028,busco amigos con quienes hablar del qsmp
1258,93029,hagamos un trio t y yo y toda la vida
1259,93030,solo pido q carre y rob estn en el qsmp
1260,93031,isla pato
1261,93032,prendio prendioo dd
1262,93033,m da mucha emocin el qsmp
1263,93034,bueno ya basta me voy a estudiar
1264,93035,mi yo d 2020 estaria llorando en el piso por esto igual la actual tambien pero en ese momento no m lo esperaba ni a palo
1265,93036,arcangel queeeeeeeeeeeee
1266,93037,hoy anuncian a carre y a rub en el qsmp
1267,93038,como k ch4rlie ni wilbah estn en el qsmp
1268,93039,dale carre inicia ya lpm
1269,93040,de los gringos que van a salir en el qsmp solo conozco a foolish
1270,93041,mucho dteam mucho qsmp lo que me pregunto yo es dnde est karl
1271,93042,me vuelven a poner otro tuit as en el tl y me voy a aventar de la ventana ms cercana q encuentre
1272,93043,carre por fa anuncia que vas a estar en el qsmp
1273,93044,carre prendio se vienen carre en el qsmp
1274,93045,el directo de carre tiene como ttulo el saludo iconic de vegetta y en donde participa vege maana en el qsmp carre en el qsmp confirmadooooo
1275,93046,de hecho hay una teora de kika y gaby que lo explica
1276,93047,chale creo que de plano no estar juan en el qsmp tena la ilusin que iba a prender hoy de sorpresa anunciando su participacin
1277,93048,carre prendio hoy confirma q entra al qsmp fuentes creanme por favor
1278,93049,la dualidad nomo incrwibl
1279,93050,estoy preparando agua de manzana real que segn mi mam es para los locos porqueyanoaguantoestatortura auxilio
1280,93051,carre prendioooo mifen si esta en rl qsmp yo confio mutis amen amen
1281,93052,no jodas jeiden estara aaaaah que emocin welcome to the qsmp jeiden
1282,93053,no puede ser v en tendencias karmaland y me ilucione
1283,93054,juegos minecraft qsmp
1284,93055,carre en el qsmp
1285,93056,recin veo esto estoy muy contenta
1286,93057,saquenme del flop porfi
1287,93058,mentira mam no congele la carrera por mi intento de suicidio fue para ver el qsmp
1288,93059,mi infancia
1289,93060,y lo dice todo normal el bld
1290,93061,dorm 45 minutos ahora si que se caiga el mundo hdspm
1291,93062,culturizo a los gringos bien ahi
1292,93063,quiere que le hagan un intro para qsmp creanme
1293,93064,gracias tortillaland por darme esta amistad tan linda
1294,93065,ahhhhhhhh ando alucinando y no se que pensar de qsmp hahaha teora ma y loca albordedelcolapso
1295,93066,gracias carre x prender tkm
1296,93067,que pasa si organizamos las imagenes de los que fueron anunciados como si fuera un rompecabezas no se una idea mia que se me vino en la mente
1297,93068,el titulo del stream carrera en el qsmp confirmadisimo
1298,93069,saben quin ms dice eso vegetta y saben en que serie va a estar vegetta exacto qsmp
1299,93070,si el ttulo del stream de carre no es un spoiler de que estar en el qsmp me doy un tir0
1300,93071,por que ha puesto la intro de vegetta carre en qsmp
1301,93072,repito el qsmp se pone cada vez mejor dios mo
1302,93073,el qsmp se estrenar justo cuando me ando regresando de la u nose si alcanceaaaaa
1303,93074,carre en el qsmp carre en el qsmp carre en el qsmp carre en el qsmp carre en el qsmp carre en el qsmp carre en el qsmp
1304,93075,perdn pero obelisco solo hay uno
1305,93076,el layout de ese moot wn que lindo estilo
1306,93077,dale carre dime qu ests en el qsmp
1307,93078,spreen con la pantalla verde nombrando el qsmp dream en el qsmp confirmado
1308,93079,no puede seeeer jaideeeeen estoy tan feliz lskbelsjwlsklkjwlw
1309,93080,prendi carre ojal le den su invitacin para el qsmp
1310,93081,veg regaando a quackity por el nombre de su serie
1311,93082,una disculpa a mis mutis no planeteros q me ven dndome a madrazos con gringas en unas semanas volvemos a la programacin habitual
1312,93083,vegetta en qsmp aaaaaaaaaaaaaa dios escuch mis plegarias
1313,93084,carre prendio xfa q este en el qsmp es lo unico q pido
1314,93085,prendi carre es este el momento en el q dice q est en el qsmp xfavor
1315,93086,carre prendi acurdense de mi cuando anuncie que est en el qsmp
1316,93087,qsmp empieza maana y ni la mitad de los participantes estn anunciados jajajs
1317,93088,tina porfa abre directo y dime q estas ene el qsmp ya no aguanto
1318,93089,la menos rpida
1319,93090,me voy a dormir la siesta dsp me dicen q onda con el qsmp
1320,93091,carrera en el qsmp por favor
1321,93092,prendi carre va a anunciar q est en el qsmp cranme
1322,93093,cada vez que me voy de twitter anuncian un nuevo miembro de qsmp soy el retraso o mala suerte
1323,93094,manifestando a carre en el qsmp
1324,93095,amigos el chavo acaba a las 4 30 tengo fe
1325,93096,qsmp tiene toda la pinta a serie del ao ni siquiera ha comenzado y para m ya lo es en mi corazn
