,Id,Tweet
1616,31823,realmente debutaron con pepe el da de san jos clc espaolas
1617,31824,el papa en el ngelus pidamos a san jos la gracia de ver las circunstancias ms difciles como oportunidades
1618,31825,hoy es el da del hombre en conmemoracin a san jos hombre virtuoso y el 8 de marzo es el da de la mujer en conmemoracin por haber sido asesinadas reclamando nuestros derechos busque las diferencias si las hay
1619,31826,feliz da del padre sdalmaoficial feliz san jos saludos desde bsas
1620,31827,en 1824 el templo de san francisco san salvador fue sede original de los tres poderes del estadosv y de la universidadsv destruido por el terremoto de san jos el 19 marzo 1873 su predio ahora es el mercado excuartel o municipal de artesanas grabado metlico espaol
1621,31828,ftbol cd san roque vs atltico san jos 19 marzo 2023 a travs de youtube
1622,31829,san jos patrono de david 19 de marzo
1623,31830,difundimos tomado de facebook es urgenteeee la ayuda para este pequeo san jos de cotiza caracas
1624,31831,no puedo con las viejas que le ponen a los novios mi san jos ajajjajaja san jos no era un hpta mijaaa
1625,31832,elorza en el estado apure se convierte en capital folklrica del pas cada 19 de marzo para celebrar el da de san jos al ritmo de arpa cuatro y maracas conoce ms de esta fiesta tradicional aqu
1626,31833,hoy se celebra el da de san jos patrn de la iglesia universal y de los carpinteros aldia efemrides
1627,31834,oracin a san jos para alcanzar una gracia de dios oracin sanjos 19marzo
1628,31835,la cofrada de los nazarenos y la cofrada de san jos llevan de regreso en procesin las imgenes de san jos de la catedral a su parroquia puebla
1629,31836,asedecer del da de san jos por la huerta
1630,31837,sanjose ensanos a ser como t
1631,31838,fiesta patronal en limpio hoy se celebra el da de san jos tambin la fiesta patronal de san jos de los campos limpios de tapu conocido como limpio mir las actividades para este da nota
1632,31839,para celebrar el da de san jos me he tomado un
1633,31840,ap besos all arriba y para am tambin felicidades hermano querido eres un gran padre feliz sanjos a todos los jos y josefas y feliz diadelpadre a to2 los de de mi tl disfrutad y sed felices
1634,31841,lunes 20 de marzo misa en honor de san jos 19 00 h parroquia de san juan bautista sanjuandeaznalfarache sanjuanbajo
1635,31842,feliz y bendecido domingo del seor y da de san jose tengan todos
1636,31843,da de san jos da del artesano da del carpintero da de mi onomstico luis jos segn ha venido explicando la iglesia catlica lo celebraremos maana lunes 20 de marzo y no hoy19 cevmedios santosiglesia luiscordovaper diocesisbna ven diocesiseltigre josegrasso
1637,31844,manoduracontraloscorruptos celebran en la guaira al patrono san jose
1638,31845,cumpleaos barrio san jos
1639,31846,hoy se celebra en varias parte de mi estado falcn el da de san jos entre ellas corralito san jos de seque san jos de cocodite san jos de la costa felicitaciones para todos los jos y josefinas
1640,31847,dios todopoderoso que en los albores del nuevo testamento encomendaste a san jos los misterios de nuestra salvacin haz que ahora tu iglesia sostenida por la intercesin del esposo de mara lleve a su pleno cumplimiento la obra de la salvacin de los hombres amn
1641,31848,hace 8 aos estaba en arrasate en una charla del responsable de investigacin de mugaritz dani lasa y de la responsable de la huerta leire etxaide me flip que se pudiese comer la flor de san jos tengo el jardn a tope de ellas y los macarons de sangre de cerdo
1642,31849,manoduracontraloscorruptos celebran en la guaira al patrono san jose
1643,31850,querido santos varones hombres bellos y amorosos que san jos les lleve a imitar su ejemplo como hijos padres tos hermanos esposos novios etc polo2589 alfonsojavierl5 yarohe2 arango mauricio y a todos los que no alcanzo se les quiere mucho
1644,31851,san jos guido reni siglo xvii museo nacional del prado madrid
1645,31852,aviso como hoy es mi santo de san jos 1 festejar el triunfo del ame 2 festejare mi santo de jos 3 felicidades a todos los jos americanistas si hoy domingo es da de los pepes y pepas j j el tigre salud
1646,31853,19 de marzo da del hombre del carpintero del artesano del rugbier y de san jos hoy es el da del patriarcado
1647,31854,es de pena que costa rica no tenga transporte pblico estn en el subdesarrollo total en movilidad san jos est hecha una de las ciudades ms feas del mundo lo saben y siguen apostando por el carro de no creer
1648,31855,feliz da del padre y del patriarca san jos
1649,31856,que san jos los bendiga a todos
1650,31857,guion solemnidad de san jos
1651,31858,la cofrada de los nazarenos y la cofrada de san jos llevan de regreso en procesin las imgenes de san jos de la catedral a su parroquia en la ciudad de puebla esimagen
1652,31859,feliz da a todos los jos efemride cada 19mar la iglesia catlica venera a san jos manoduracontraloscorruptos bonosdelapatria nicolasmaduro tuiterospatria tuiterosdelapatria mippcivzla
1653,31860,19mar celebramos el da san jos considerado el patrn de la iglesia universal patrn de los carpinteros ingenieros y trabajadores en general manoduracontraloscorruptos
1654,31861,19 de marzo da de san jos de nazareth padre adoptivo de jess de nazareth segn la religin cristiana catlica
1655,31862,la cofrada de los nazarenos y la cofrada de san jos llevan de regreso en procesin las imgenes de san jos de la catedral a su parroquia esimagen
1656,31863,san jos
1657,31864,quiero un san jos
1658,31865,lunes 20 de marzo san juan pablo ii el clima de silencio que acompaa todo lo que se refiere a san jos se extiende tambin a su trabajo como carpintero en la casa de nazaret con todo es un silencio que revela de una manera especial el perfil
1659,31866,sanjos con el nio murillo 1665 1666 museobase felizdiadelpadre diadesanjose diadelpadre
1660,31867,almomento en el marco del da de san jos la gobernadora del estado aragua soykarinacarpio junto al alcalde rafaelmaracay21 reinauguraron la redoma de san jos ubicada en san jacinto gobiernoaragua aragua araguareverdece manoduracontraloscorruptos
1661,31868,a los jos de mi vida feliz da del hombre hoy 19 03 23 diadelhombre sanjos
1662,31869, juvenil final en los pinos ud constantina 3 ad san jos 1 nuevo paso adelante de los nuestros que les permite mantenerse a un punto del lder campana bpie hoy anotaron david y alex en la primera mitad y marcos en la segunda vamos constantina
1663,31870,hoy es el da de san jos el da del hombre es el da de mi cumpleaos v
1664,31871,para sanar este mundo no necesitamos desaparecer a los hombres ocupamos mas hombres como san jose guias y lideres de familias amorosos justos de fe fuertes hombres de dios que guien a sus hijos a un mejor futuro diadesanjose
1665,66540,20mar los vecinos de sanjos caracas requieren remplazo mantenimiento del ads armario de distribucin secundario de cantv q se encuentra en psimas condiciones desde hace 2 aos urge solucin inmediata pdte jess aldana salaprensacantv venapp juntoscontralasmafias
1666,66541,agradecida porque encontr mi san jos
1667,66542,rompimos rcord de ventas escribe restaurantero de san jos debido al pblico que atrajo el festival transitarte
1668,66543,miradas al cielo video el asombroso poder de san jos dormido
1669,66544,oigan dejen de andar dicindole mi san jos a cualquier aparecido que el pobre jos desde los cielos debe estar que les pega
1670,66545,me compr unos zapatos re lindos pero tienen taco y yo nunca tengo eventos elegantes sale el finde ir al cumple en el san jos vestida de bratz
1671,66546,bienvenido san jos a mi mesa de luz y mis oraciones diarias intercede por todos nosotros por la paz y la concordia por todo padre adoptivo de jesucristo y junto a mara bendice a cristina por un mandato ms as sea
1672,66547,san jos el padre que form al redentor para ser un hombre libre y de firmes determinaciones siervo fiel y prudente ruega por nosotros
1673,66548,nuestro barrio san jos sur oriental
1674,66549,gracias madre por tu honestidad hoy da de san jos esposo de mara hijo de jacob
1675,66550,para que los habitantes de naucalpan cuenten con espacios pblicos seguros para la convivencia familiar cadetes de la academia de polica municipal recuperaron las reas comunes que se encuentran en la colonia san jos de los leones tercera seccin
1676,66551,as fue repelido por un carabinero de civil el fracasado robo al supermercado mayorista 10 ubicado en san jos de la estrella con santa raquel laflorida
1677,66552,buenas noches good night feliz noche oracin de la noche cuaresma semanasanta2023 sanjos solemnidad jos stjoseph saintjoseph sanjose2023 cuaresma2023 semanasanta diadesanjose
1678,66553,feliz da de padre y san jos muchas felicidades y felices 50 aos pap diego te quiero acepto que vas al cielo
1679,66554,himno a san jos por frailes dominicos
1680,66555,legislaturasconectadas hcdsanjose sesin ordinaria en el hcd de san jos se llev a cabo una nueva sesin en la cual se sancionaron diferentes normativas ms informacin legislaturas parlamentos concejosenred entrerios
1681,66556,saludos desde san jos iturbide guanajuato apoyando a la seleccin mexicana vamos la novena pudo naranjero y diablos rojos lacasadelbeisbol
1682,66557,hoy 20 de marzo del 2023 la iglesia celebra la solemnidad de san jos esposo de la bienaventurada virgen mara jacob engendr a jos el esposo de mara de la cual naci jess llamado cristo mt 1 16
1683,66558,glorioso san jos
1684,66559,hoy fui a la iglesia por el di de san jos feliz da del hombre
1685,66560,don mikel san jos siempre en el lado correcto de todo
1686,66561,jhsanchezjacome el santo patriarca tiene la gracia de la flor que sabe entregarnos con caridad su aroma a su lado florece la bondad arraiga la dulzura fructifica el sosiego san jos no es el santo de una poca ni de un siglo es el patriarca de todos los milenios luis
1687,66562,jhsanchezjacome vive en la cumbre de todas las elevaciones no en vano tuvo a jess en sus brazos le meci cuando pequeo se oy llamar padre por la sabidura y sinti el derretimiento producido por la contemplacin d aquel nio en cuyas manos haba florecido la pluralida
1688,66563,jhsanchezjacome san jos es un abismo de interioridad mientras su cuerpo reluce como dechado d templanza su alma preparada para recibir comunicaciones divinas se nos presenta como un trasunto del paraso como un reino de armona semejante a una lira pulsada por la mano
1689,66564,jhsanchezjacome ante este hombre que con su fe derrot al infierno y con su profunda caridad empuj la puerta del cielo fray nelson
1690,66565,boletn pmu pscn nacional festivo san jos 20 mar 23 18 00h read
1691,66566,jhsanchezjacome existencia discreta y de la solcita obediencia de este hombre con rostro de genuino creyente el escepticismo cnico de nuestra poca y la vanidad con que se quiere comerciar con todo desde el cuerpo hasta la conciencia han de frenar su mpetu
1692,66567,jhsanchezjacome el ansia de placer y el consumismo desbocado tienen que humillarse delante de la pureza y austeridad de este hombre limpio de corazn la ebriedad de soberbia y los deseos de venganza que marcan tantas vidas de nuestro mundo convulsionado podran aprender mu
1693,66568,jhsanchezjacome jos es un testimonio maravilloso de las virtudes que ms necesita nuestro tiempo la agresividad y el afn de lucro propios de nuestra vida acelerada se enfrentan con la mansedumbre la generosidad y la paciencia de este hombre sencillo y santo
1694,66569,muchas veces cuando hay ganas el dolor desaparece o no impide no llegar al objetivo bravo irune zorionak gran acompaante lokuras cada da haciendo ms mritos para tenerle muy en cuenta conquis10etb
1695,66570,el equipo de la coranzturven estuvo desplegado en la feria agroturstica anzotegui 2023 en el parque ferial san jos de guanipa para conocer las impresiones de todos los asistentes el lugar de procedencia y la afluencia de visitantes en el sur de la regin frankvalerap
1696,66571,hay muchos santos a quienes dios ha dado el poder para ayudarnos en las necesidades de la vida pero el poder que se le ha dado a san jos es ilimitado todos aquellos que lo invocan con confianza estn seguros de ser escuchados santo toms de aquino
1697,66572,san jos esposo se la virgen mara patrono de la iglesia universal y santo patrono de parral ruega por la salud y la paz del mundo entero
1698,66573,bello atardecer desde nuestro barrio san jos sur oriental
1699,66574,solemnidad de san jos todos ustedes en nuestras oraciones en la santa misa y siempre sagrado corazn de jess en vos confo dulce corazn de mara s la salvacin del alma ma san jos ruega por nosotros fe y ms fe todo va a estar bien buenas noches dios los
1700,66575,jydcordoba balance positivo de movilidad durante el puente festivo de san jos policiadecor transitopolicia region6policia
1701,66576,celebraron en coacoyula guerrero la fiesta patronal a san jos con un recorrido por la comunidad con el ballet folklrico yolotecuani y danzas tradicionales adems los sones de tarime de semita y toronjil
1702,66577,aument la presencia policial en los liceos donde hubo peleas anunci heber esto que se dio en dos das de violencia nos llam mucho la atencin dijo el ministro del interior la noticia sanjosahora noticias informacin sanjose uruguay
1703,66578,incensata consagrate a cristo no a san jos es un dolo y tras de un dolo hay un demonio
1704,66579,misa en honor a san jos patrn del municipio de brea baja esta tarde se ha celebrado la misa en honor a san jos no puedo ser en su da por liturgias eclesisticas pero hoy se celebr breabaja breabajafiestasanjose breabajadiasanjose breabajasanjose
1705,66580,a lo largo de los siglos un gran nmero de santos y beatos promovieron la devocin a san jos y a travs de sus escritos y palabras dieron testimonio de la poderosa intercesin del patriarca de la iglesia universal
1706,66581,unas ganas de jugar un san jose vs borges
1707,66582,misa en honor a san jos patrn del municipio de brea baja esta tarde se ha celebrado la misa en honor a san jos no puedo ser en su da por liturgias eclesisticas pero hoy se celebr breabaja breabajafiestasanjose breabajadiasanjose breabajasanjose
1708,66583,ser el rayo de senoracatolica sobre san jos
1709,66584,florencia faldn ex alumna del colegio san jos hizo los votos religiosos la palabra de julio pellegrino
1710,66585,comunidad monseor francisco ceballos pidi a comunidad de maicao imitar virtudes de san jos
1711,66586,tren elctrico para toda la gam y no solo una lnea entre cartago y san jos es el nuevo plan del incofer
1712,66587,imgenes de la divina liturgia maronita en la fiesta de san jos que se llev a cabo el 18 de marzo en la iglesia de san jos en australia la cual fue presidida por monseor antoine charbel tarabay obispo de la dicesis maronita de australia ms
1713,66588,alquiler apartamento amueblado san jos escaz guachipelin norte en escaz san jos costa rica en alquiler
1714,66589,donde estn los hijos de san jos y de la virgen mara
1715,66590,ac estamos im estima 50 000 asistentes 24 866 entradas vendidas y 19 645 de cortesa colectivos ollas programas de la comuna entre otros tuvieron libre acceso al festival de msicas nacionales e internacionales la noticia sanjosahora
1716,66591,la seccional de transitopolicia cesar ha venido desarrollando una serie de controles policiales durante el puente festivo da de san jos en articulacin con sectransitovpar y organismos de socorro concesiones viales que permiten que la siniestralidad vial disminuyan
1717,66592,este sbado 18 de marzo participamos del desfile de la confraternidad minea actividad realizada en el marco de la celebracin en homenaje al patrono de la parroquia san jos de minas construimos un quitoparavivir
1718,66593,20 de marzo solemnidad litrgica trasladada de san jos hoy 20 de marzo la iglesia catlica celebra la solemnidad de san jos esposo de la virgen mara este ao 2023 ha sido trasladada por haber coincidido con el iv domingo de cuaresma
1719,66594,por el da mundial de la salud bucodental se realiza salud va a la escuela por odontlogos de la misin mdica cubana en distrito capital
1720,66595,santa misa de hoy 20 marzo en vivo san jos esposo de la virgen mara a travs de youtube
1721,66596,san jos custodio de los tesoros de dios ruega por nosotros
1722,66597,suspendieron clases en un liceo de colonia por mal estado de salones tras la lluvia
1723,66598,dentro del marco de las fiestas tradicionales san jos 2023 la administracin municipal realiz el primer concurso del burrito choyero donde aproximadamente 10 equipos participaron en la realizacin de este singular platillo sudcaliforniano meganoticiaslcs sociales
1724,66599,gt gt el santo evangelio del da comentado el sueo de jos memoria litrgica de san jos 20 marzo
1725,66600,colocan 300 luminarias y 50 toneladas de asfalto en comunidad de san jos de aragua juntoscontralasmafias
1726,66601,actividades de prevencin y control en el plan retorno del puente festivo de san jos por parte de nuestros policas de la seccinal de trnsito y transporte nario garantizandoseguridad diosypatria esunhonorserpolica
1727,66602,decenas de pobladores catlicos celebraron al santo patrono san jos en el interior de la catedral de tula
1728,66603,nuestra transitopolicia en boyac garantiza la seguridadvial durante este plan retorno del puente festivo de san jos recuerde respetar los lmites de velocidad y las normas de trnsito diosypatria esunhonorserpolica
1729,66604,casa en venta en san francisco de dos ros en san francisco de dos ros san jos costa rica en venta
1730,66605,fiel cuidador y guardin san jos
1731,66606,disminucin del flujo vehicular en el puente de san jos en crdoba
1732,66607,saludos de cristo roto san jos de gracia aguascalientes laura patricia de la rosa y jos ngel quiroz palillo familia quiroz de la rosa arriba mxico vamos a ganar lacasadelbeisbol
1733,66608,les regalo un atardecer desde san jos centro
1734,66609,al ritmo del ao litrgico solemnidad de san jos
1735,66610,celebrando san jos con nuestros amigos y vecinos de boo boopilagos
1736,66611,desde la secretara tic estuvimos realizando una caracterizacin en el corregimiento de san jos de chiquito con el objetivo de identificar informacin relevante para el desarrollo de dos unidades productivas y la poltica pblica de trabajo decente
1737,66612,ac estamos im estima 50 000 asistentes 24 866 entradas vendidas y 19 645 de cortesa
1738,66613,coronacin y patrocinio de san jos jos de ibarra leo sobre tela siglo xviii antiguo colegio noviciado de tepotzotln
1739,66614,encuentros sacerdotales para celebrar sanjose seminario reencontrarme con mariano herrera despus de aos en cuba caminando a javier reencontrarme hoy en comida con don nicols despus de aos sirviendo en el tribunal reencontrarme con monxugomez97 despus de 4 das
1740,66615,as fue repelido por un carabinero de civil el fracasado robo al supermercado mayorista 10 ubicado en san jos de la estrella con santa raquel laflorida
1741,66616,san jos custodio de jess custodio de la virgen mara san jos custodio de la iglesia y de las vocaciones ruega por nosotros p santiago martn psantiagofm consultasfrmaria org franciscanosdemara portiseor
1742,66617,buenas noches good night feliz noche oracin de la noche cuaresma semanasanta2023 sanjos sanjose2023 cuaresma2023 semanasanta
1743,66618,buenas noches good night feliz noche oracin de la noche cuaresma semanasanta2023 sanjos sanjose2023 cuaresma2023 semanasanta
1744,66619,el santo patriarca tiene la gracia de la flor que sabe entregarnos con caridad su aroma a su lado florece la bondad arraiga la dulzura fructifica el sosiego san jos no es el santo de una poca ni de un siglo es el patriarca de todos los milenios luis morales
1745,66620,representacin panameista participando de la cabalgata en la feria de san jos de david chiriqu gracias por el cario que se le dio al presidente del partido panameista jos blandn y a copartidarios que lo acompaaron en este recorrido blandonjose panamenistas
1746,66621,buenas noches good night feliz noche oracin de la noche cuaresma semanasanta2023 sanjos solemnidad jos stjoseph saintjoseph sanjose2023 cuaresma2023 semanasanta
1747,66622,ms de 180 atletas participaron en el clsico ciclstico juvenil san jos de cagua juntoscontralasmafias
1748,66623,acompaamos a los usuarios viales en este plan xodo del puente festivo de san jos con todas nuestras capacidades institucionales en nuestros ejes viales quienes brindaran mensajes de prevencin y seguridad vial seguridadvial diosypatria
1749,66624,celebrando san jos con nuestros amigos y vecinos de boo boopilagos
1750,66625,apoyar adriana campos huirache a vecinos de san jos en jacona
1751,66626,el presidente de hotelesensmr omarhernang confirma que puente de san jos fue bueno para sector hotelero en santa marta y el magdalena ocupacin cercana al 68 con unos 33 000 visitantes entre viernes y lunes festivo
1752,66627,ayudacorreo el hombre de 68 aos de edad fue visto por ltima vez en san jos de la montaa salamanca lo has visto
1753,66628,aestahora desde la calle 13 con 128 trabajamos policiabogota en este planretorno de san jos no olvide la seguridad somos todos policiacolombia transitopolicia policia924fm
1754,66629,con mucha fe y alegra participe un ao ms en la fiesta de san jos patrono del centro poblado la libertad heronas toledo en concepcin que su manto protector proteja a todas nuestras familias peruanas esteves jorge
1755,66630,solemnidad de san jos esposo de la virgen mara ciudadojeda
1756,66631,la polica de trnsito y transporte de nario realiza actividades de prevencin y control en el plan retorno del puente festivo de san jos
1757,66632,mralo completo en va youtubelatam agradezco la difusin que se haga de este video padreferymaria 20marzo sanjose
1758,66633,trnsito lento km 0 al km 1 sector sabana hacia san jos por cantidad de vehculos evite accidentes y guarde la distancia
1759,66634,mi seor comenzamos una nueva semana bajo la intercesin de san jos patrono universal de la iglesia terror de los demonios padre nutricio de nuestro seor que sea para todos colmada de bendicin armona paz felicidad y bienestar bendito seas
1760,66635,empiezan a aparecer ms videos de los incidentes de ayer en san jos villa nueva al parecer un polica municipal le quit el telfono al vecino que increp al alcalde y los dems vecinos presionaban para que el pm lo devolviera
1761,66636,gracias mi amado san jos
1762,66637,nuestra transitopolicia contina adelantando actividades de prevencin y de control en los diferentes tramos viales del departamento de boyac en atencin al plan xodo del puente festivo de san jos seguridadvial diosypatria
1763,66638,trnsito lento km 2 al km 4 sector circunvalacin escaz hacia san jos por cantidad de vehculos guarde la distancia y evite accidentes
1764,66639,san jos ms de 25mil personas en bella vista en nuestras fiestas patronales gracias obispo roberto ferrari por su clido mensaje y haber podido compartir la misa y procesin
1765,66640,nuestra seccional de transitopolicia presenta el balance en materia de movilidad durante el puente festivo de san jos diosypatria esunhonorserpolica
1766,66641,en los evangelios san jos aparece como un hombre fuerte y valiente trabajador pero en su alma se percibe una gran ternura que no es la virtud de los dbiles sino ms bien todo lo contrario denota fortaleza de nimo no debemos tener miedo de la bondad de la ternura francisco
1767,66642,james reimer portero de los san jose sharks de la nhl se neg a usar una camiseta con smbolos del orgullo lgbt durante el calentamiento previo al partido contra los new york islanders lo atribuy a sus creencias religiosas reimer hizo una declaracin especial diciendo
1768,66643,con un gran cario los chiricanos saludaban a blandonjose en la tradicional cabalgata de san jos de david en la provincia de chiriqu teamopanam
1769,66644,san jos padre de jess portento de la verdadera masculinidad sostn de las familias protector invencible de la iglesia terror de los demonios ruega por nosotros
1770,66645,san jos del guaviare
1771,66646,listo el rebao tour debido al parn de la liga chivas ya tiene listos 2 amistosos para mantener ritmo vs pachuca mircoles 22 de marzo san jos california paypal stadium vs toluca sbado 25 de marzo los ngeles california dignity health sports park
1772,66647,positivo balance de movilidad en el quindo durante puente festivo de san jos
1773,66648,en este artculo examinemos y aclaramos 2 de los mitos ms comunes sobre san jos que han permanecido por siglos
1774,66649,concdenos seor una vida como san jos que siendo el varn justo jams se convirti en juez que con sencillez y humildad aprendamos a hacer vida el amor la justicia y la paz fruto del encuentro con cristo
1775,66650,va lctea de san jos en el torren de mesa roldn en cabodegatanjar almeria cabodegata playadelosmuertos carboneras andalucia andaluciaturismo andaluciaviva mediterraneo mediterranean espaa spain cabodegatanijar
1776,66651,les presento la imagen de san jos de mi parroquia
1777,66652,san jos padeci los dolores y trabajos completamente sumiso a la voluntad del altsimo sufre devoto todos los trabajos que dios te enve a lo menos con resignacin cristiana todo pasa y con estos trabajos momentneos si bien los sufres te ganas la gloria del cielo
1778,66653,este es el balance durante el puentefestivo de san jos de la seccional de trnsito de la polica metropolitana de tunja policiamtunja detalles aqu
1779,66654,no tengo ninguna foto de san jos sacada por m eso es muy fuerte
1780,66655,cuando sale el anuncio y dice lucia soltera cerca de san jos de guaymas
1781,66656,san jos siempre nos ampara con su auxilio paterno dijo el papa en una carta sanjose sanjos papafrancisco
1782,66657,festividad la iglesia catlica celebra hoy la solemnidad de su santo patrono sanjos esposo de la virgenmara por designio divino para criar junto a la mater a jess el hijodedios pastoraldelacomunicacin
1783,66658,diario la verdad sobre 19 da de san jos
