,Id,Tweet
647,93906,chiquillos bellos los traigo los crculos de invocacin de este nuevo banner genshinlmpact genshin genshinimapact shenhe ayaka ayakakamisato kamisatoayaka mika
648,93907,no sali shenhe pero est asegurada y estoy en la tirada 56 as que se vendr de aqu a que acabe el banner
649,93908,no me ha tocado shenhe que nadie me toque que le pego una pal1za
650,93909,luego puede devolverla pero es que yelan trabaja en horarios muy diferentes
651,93910,qu ganas de volver a casa para tirarle a shenhe por fin
652,93911,shenhe puedes quedrtela toda la noche
653,93912,de la emocin me olvid de sacarle bien la captura pero shenhe haver al finnn
654,93913,lo malo es q tmb me sali el arma de shenhe y ni la tengo v
655,93914,voy a tirar todo lo que pueda por shenhe peeeero llevo 4 50 50 ganados seguidos as que creo que me toca perder
656,93915,retiro lo dicho si quera a shenhe shenhe es mi amiga yo nunca dije que shenhe era una cunt
657,93916,tiraditas por shenhe y mika genshinimpact
658,93917,shenhe devulvele a yelan por la noche que tiene que trabajar haz lo que quieras con ella hasta tal momento pero que llegue de una pieza
659,93918,la carga tal y como a simba
660,93919,shenhe unindose junto a yelan nahida y yae miko a la lista de personajes para quienes tengo 0 unidades de artefactos
661,93920,el problema de tirar por shenhe es que pillas cons de mika y mika fucking sucks
662,93921,me salio shenhe tras 140 tiradas
663,93922,queria la de shenhe pero no me quejar
664,93923,bueno quiero la mindsplitter y hay tres posibilidades que me salga la espada y sea feliz que me salga alguna otra cosa y sea bueno o que me salga la lanza de shenhe y la queme subiendo un arma de 3 estrellas y odie para siempre el banner de armas
665,93924,porque puedo
666,93925,shenhe ta esta en casa y a secuestrado a mika
667,93926,consegu a shenhe
668,93927,bueno dentro de lo malo se vinieron ayaka y shenhe y me siguen quedando 11k protos pero viene nahida nilou pobre zhongli
669,93928,quiero a shenhe pero una tiene que ahorrar
670,93929,la ayaka esta super loca con la shenhe yo me quedo tiesa
671,93930,ayaka y shenhe a las 10 tiradas
672,93931,vaya pens que estaban sedientos de shenhe lo bueno es que tiene rate up
673,93932,amigas shenhe c2 y su arma y la ayaka dios soy la mas feliz
674,93933,solo 4 horas para ser shenhe haver
675,93934,he ganado el 50 50 con shenhe siguiente multi pierdo el 50 50 con jean y ahora estoy a 20 pulls de ayaka tengo solamente a mika c1 pero en las pulls del standard he sacado la claymore de diluc para eula he gastado suerte para un ao entero xd
676,93935,hola estamos en directo vamos a hacer unas tiraditas al banner de shenhe y seguimos con nuestro camino al platino de final fantasy xv
677,93936,tirara por mika pero me da miedo que me salga shenhe quiero a shenhe pero no se si querr tirar por baizhu
678,93937,como que se est tardando mucho en irse los banners de shenhe y ayaka no genshinlmpact genshinmemes
679,93938,no me esperana la shenhe me he quedado as
680,93939,me ha salido una shenhe healer chiquitaaaa
681,93940,c2 diluc no shenhe no diona
682,93941,me sali mika en 3 individuales pero yo quera la espada de ayaka a quien le pongo la lanza de shenhe si no tengo a shenhe
683,93942,ho perso la lancia per shenhe ma ho reso felice la mia jean
684,93943,he perdido el 50 50 con jean a pity 70 lueho me ha tocado ayaka a pity 80 no me quedan deseos para shenhe
685,93944,si no me sale shenhe i s w e a r que me arranco una teta
686,93945,no me ha salido shenhe me niego a seguir
687,93946,me quede sin shenhe y con c2 de tignari
688,93947,felicidades por sus shenhes yo la tengo desde el primer run as k solo ver como les va
689,93948,me meo porque record la ning de cathy es mi sufar mommy
690,93949,que me ha salido ayaka y a las dos tiradas shenhe estoy flipando todava q encima tengo mika c5 te amo mihoyo
691,93950,tengo a shenhe y ahora a jean y a mika lmao
692,93951,dios
693,93952,tardas en sacarme
694,93953,embeces todo lo que una chica necesita es solo
695,93954,shenhe literal dijo si haces un team conmigo va a ser tu team soado reina aaaaaaaaaakanhslqmbslalnslakhwnqlsl
696,93955,no se si tirar por shenhe que hago sper
697,93956,es hoy es hoy
698,93957,a tirarle lo que consiga cada da a shenhe a ver si hay suerte
699,93958,tengo shenhe y su arma
700,93959,me estoy cagando
701,93960,nada ermanos no hay shenhe y no hay nada ella m odia
702,93961,te cargo
703,93962,shenhe estaba destinada a ser mia aaaaaaah
704,93963,yo estaba tirando pa mika que cojones 5 50 50 ganados seguidos eso s he tenido que tirarle 31 deseos al pollo pa que venga shenhe pity 10 y pico estoy en trance
705,93964,la consegu estoy sper feliz an no me lo creo shenhe genshinlmpact
706,93965,recen por m que voy a tirar por shenhe
707,93966,empezamos directo sumeru en la 3 5 tiradas por ayaka y shenhe luego valorant genshinimpact genshintwt twitchstreamers
708,93967,nos hemos quedado sin shenhe
709,93968,aaa shenhe aaa yasasin aaaa deliricem aaaaa
710,93969,que fuerte me ha salido la skin de shenhe en fin me tocar hacer misiones de paypal
711,93970,me acaba de tocar shenhe y su arma en 30 pulls wtf
712,93971,good news tengo a baizhu asegurado bad news porque he perdido otra vez el 50 50 con ayaka ya van 3 good news pero no tengo a ayaka porque me he gastado este asegurado en mi nia shenhe
713,93972,deseadme esta suerte a m esta tarde que voy a por ayaka solo para poder ir a por shenhe
714,93973,ay la shenhe que no viene pero esta seora que las capturas de lo que me sali con calidad cuestionable porque no llega el internet bien
715,93974,nooooooooooo 60 deseos primera multi shenhe y mika y 50 deseos para el arma feliz genshinlmpact shenhe
716,93975,os lo cambio por shenhe
717,93976,la verdad la razon x la q no tir x shenhe
718,93977,otro 50 50 ganado viva shenhe
719,93978,si hago directo esta noche y no me sale shenhe aviso que no me lo voy a tomar a risa probablemente me ponga re triste pk tengo todo farmeado shshshshs
720,93979,ayaka y shenhe tirando 40 deseos estoy
721,93980,q me ha salido la lanza de shenhe porfvaor yo quera mistspiltter por que me hace esto el juego
722,93981,anyway no le digo adis al banner porque si el 3 6 no me gusta quizs le hago un ola wpa a shenhe
723,93982,no voy a tirar ni por shenhe ni por ayaka quiero a kaveh so bad
724,93983,omg viene ayaka y shenhe ahora que buen skip para mi pq ya la tengo es como cuando paso yae miko y vhilde
725,93984,shenhe ha venido con muchos regalitos debajo del brazo te amo shenhe
726,93985,solo voy a ir a comprar auriculares termine comprando auriculares una budinera delineador encendedor y un nuevo te
727,93986,si hoy me skippea shenhe me corto una teta guarden este tweet
728,93987,he perdido el 50 50 a tignari y me ha salido sper tarde estoy hasta el coo este juego me odia a ver si hasta que acabe la versin saco a shenhe
729,93988,martes de ayaka shenhe y mika genshin impact drops activos recompensas vamooooooooos que se viene
730,93989,shenhe haver en pity treinta ochoooooooooooo
731,93990,ya que venga shenhe
732,93991,vamos a tirar por shenhe y si sale prontito a por el arma tambin
733,93992,yo tmb quiero a shenhe pero con la mala suerte de q me salen todos en soft pity no la saco ni en pedo
734,93993,let s go toda la suerte del mundo a les ayaka y shenhe wanters
735,93994,si no me sale shenhe en todo lo que dure su banner sale castigo
736,93995,shenhe el personaje que literalmente me arrepiento de haber sacado y que no tengo buildeada porque no tengo donde usarla ahora con su arma que les costaba darme la otra
737,93996,perd el 50 50 con mona no puedo ms
738,93997,esperando a la shenhe de lu
739,93998,9 deseos para shenhe y un sueo
740,93999,por favor early shenhe y almenos un mika y soy feliz y me voy al de armas
741,94000,levanta a waterlyspy
742,94001,no me ha salido la lanza de shenhe sadge
743,94002,donde est mi shenhe
744,94003,pues ya tenemos a shenhe genshinimpact
745,94004,espero que a todos a los que les toque shenhe antes que a m vayan al infierno sin importar el qu
746,94005,estoy en directo gacha de shenhe y reflejo de las tinieblas genshinimpact
747,94006,directooo tiradas por shenhe y ayaka ban o se salva genshinlmpact
748,94007,se acab el match y se vuelve al icon de siempre para recibir a mi futura shenhe
749,94008,salirse del genshin todo el mundo que tengo que entrar yo shenhe me est esperando
750,94009,ni dormir puedo socorro
751,94010,un minuto psra shenhe me desmayo
752,94011,suerte a todos los que tiris por shenhe
753,94012,hoy vuelve shenhe gente
754,94013,tengo a shenhe hace un ao esperando alcanza el lvl 90 y ah va a seguir mi reina porque que paja matar esos dos boludos mil veces
755,94014,a tirar por shenhe se ha dicho
756,94015,banner de ayaka y shenhe en 5 minutos
757,94016,y si tiro por shenhe
758,94017,lol recuerdo cuando me fui por dos semanas a trabajar a un lugar totalmente incomunicado ni luz ni agua ni seal y cuando regres a casa el celular me explot en notificaciones xd y las pocas tiradas que tena las tire al banner de shenhe y me sali
759,94018,necesito que ya sea la tarde necesito a shenhe
760,94019,tirando por shenhe y mika
761,94020,tengo 10 deseos y 0 de pity para shenhe
762,94021,disculpe cloudretainer puede salir shenhe a jugar
763,94022,buenos dias en nueve minutos pulleo por shenhe
764,94023,venga coo shenhe sal ya
765,94024,aqu esperando 10 minutos para el banner de shenhe
766,94025,12 minutos para los banners me voy para el psiclogo y en cuanto vuelva tiro muchsima suerte a todos vamos a ser ayaka y shenhe havers
767,94026,ya estamos ready para las tiradas a por ayaka shenhe y mika corre ven a darme suerte
768,94027,ganyu tiene una cita con shenhe
769,94028,vamos a tirarle a shenhe a ver si hay suerte
770,94029,cabron falta un vergo para shenhe estoy sufriendo 7 putas horas
771,94030,la de shenhe pareca razor por unos segundos xd
772,94031,vegetta confirmado en el qsmp es una seal de que tambin me saldr shenhe en su banner
773,94032,a mis mutis que vayan a tirarle a ayaka o shenhe mucha suerte os pongo velitas
774,94033,cmo q hoy sale el banner de shenhe no tengo nada farmeado
775,94034,es hoy hoy me convierto en shenhe main
776,94035,hay un cambio de planes as que en media horita estar tirando a shenhe pero no ser en mi directo pity 74 50 50 35 tiradas y full fe todo a partir de las 18 00h tal que aqu
777,94036,shenhe sers ma
778,94037,ahora si me saldr shenhe tengo solo dos deseos y un sueo
779,94038,as viendo cmo algunos en una tirada le salieron como 2 ayakas y a otros shenhe mientras q a mi me faltan como 7 horas para que se vaya cyno
780,94039,gente a las 18 00 voy a estar en youtube tirando en directo por shenhe y reflejo de las tienieblas genshinimpact
781,94040,dios no aguanto ms esta agonia me voy a ehcar la siesta
782,94041,en el server asia o europa ya sali el banner de shenhe y ayaka mientras que en server america faltan 7 horas
783,94042,mucha suerte a tods para sus tiradas en unas horas por ayaka y shenhe excelentes personajes y ambas forman uno de los mejores equipos dps y el permafrost de genshin impact que tods logren ganar el 50 50 genshinimpact genshin genshintwt cryo inazuma liyue
784,94043,no puedo cambiar el layout de mi shenhe soy incapaz de tocarlo
785,94044,quiero tirar x shenhe pero igual quiero ahorrar pa scara qu hagoooo
786,94045,ya esta shenhe
787,94046,banda le tiro a mika es que tengo miedo que me salga shenhe
788,94047,ya saquen el banner de shenhe para tirarle a mika no puedo ms
789,94048,hoy hay banner de shenhe y como pierda el 50 50 voy a
790,94049,no se si tirar por shenhe y si pierdo me quedo con el asegurado para nahida
791,94050,podre
792,94051,acabo de decidir q voy a usar el asegurado en shenhe y la voy a llevar con chongyun pq no hay ningn otro cryo que me interese yeeei
793,94052,llevo mas de un ao esperando esto en su momento perd el 50 50 pero esta vez puedo llegar al hard pity si hace falta shenhe no se me va a escapar esta vez
794,94053,especial tiradas ayaka shenhe se viene ayaka c6 hoy os espero por all twitchgaming twitchgirls twitchstream genshinimpac
795,94054,me cago en la puta shenhe sale a las 18 00 gt
796,94055,esta tarde sacaremos a shenhe en la secundaria y rezaremos porque salga un mika chiquito mucha suerte en vuestras tiraditas genshinimpact
797,94056,si no consigo a shenhe en mis primeros 10 tiros desinstalo el juego
798,94057,el miedo que me da tirar al banner de shenhe por sacar a los 4 y que me salga early pity y gane el 50 50 es que solo hace falta no querer a un personaje para que te toque mihoyo es capaz de detectarlo
799,94058,utilizo mi asegurado para sacar a shenhe o me espero a baizhu
800,94059,mika c6 y shenhe yo confo
801,94060,unas ganas de tirar por shenhe pero no puedo
802,94061,me muero que en 1h y 9 min ponen a mi diosa shenhe aixnskx me muero genshin date prisa no soporto mas esta cosa llamada espera qzkkwkxnwk me muero
803,94062,me va a salir shenhe en el deseo 20 yo lo s yo s cosas si m va a salir no voy a perder este banner tiene que salir tiene que salir
804,94063,en unas horas se viene lloradera por si no me sale ayaka o shenhe
805,94064,una hora y 10 para tirar a por shenhe
806,94065,mi shenhe pronto
807,94066,estan aqu ms de 50 deseos para la cryo queen que nos falta si hay suerte shenhe arma y con muucha suerte ayaka en la parte final de la bennett cup ven y comparte tus tiradas junto a mariia910
808,94067,espero que no se me vayan todos los deseos por shenhe
809,94068,no me lo creo es el da de la preciosa shenhe vamos a tirarle todo hasta que salga vente que hay una sorpresita genshinimpact
810,94069,ya esta el banner de shenhe
811,94070,loco hoy saco a la shenhe vivan las lesbianas tetonas
812,94071,shenhe vino a casa el ao pasado
813,94072,hora y media para ser shenhe haver no entendeis el mono q tengo de tirar
814,94073,1hora y media pa shenhe vamos vamos
815,94074,shenhe y mika van a carrear esta versin completamente
816,94075,buen dia te amo hoy te traigo a tu amiguitaaaa shenhe
817,94076,es difcil ser yo quiero morder pixeles
818,94077,creo q fallec
819,94078,la necesidad de morder los cachetes de mika crece
820,94079,mika emojis lo voy a morfer
821,94080,no voy a poder tirar por shenhe enseguida se actualice el banner el universo no quiere que tenga a shenhe
822,94081,q hago m saco c1 d ayaka o a la shenhe o skipeo
823,94082,sabes que que le jodan a nilou ya la conseguire en su siguiente rerun yo voy a por shenhe pero bueno si pierdo el 50 50 mejor pa mi xd
824,94083,hoy se viene gachapon time primer triple 1 empezamos con tower of fantasy a por constelaciones de tian lang 2 luego pasamos a por shenhe en genshin impact 3 para finalizar nos acercamos peligrosamente al pity a por seele en los ltimos das de star rail ser ya en la noche
825,94084,no me digas eso q lo nico que quiero en este momento es a shenhe
826,94085,si necesitas una silla siempre tienes mi cara
827,94086,q se vengan a vivir aca si tan les gusta
828,94087,no me llega a salir shenhe y me abro el brazo
829,94088,no llevo 2 aos recolectando a los personajes del permafrost para que ahora me vengas con esto aguante shenhe
830,94089,si gano hoy el 50 50 maybe si tir por la shenhe tmbn
831,94090,estamos en directo tiradas por shenhe ayaka y mika genshinimpact
832,94091,ela ta de mugler
833,94092,jakjssjsjjssj mi post lleg hasta ac tkm bardo por informar a la comunidad xd
834,94093,ya salio rl banner d shenhe quiero a mika
835,94094,era todo lo que necesitaba porque ldjfdmfndmfn quiero tirarle a shenhe para mi ayaka atrs impulso de idiotez
836,94095,mi vida cambi cuando aprend a juntar deseos y tirar por x banner
837,94096,tomaaaa ahora lo escucho mientras hago el examen online t amo mi amor es q lo saca en el mejor dia q tengo 2 examenes y tb tirare por la shenhe luego
838,94097,bueno si no logro sacar a shenhe al menos tengo a rosaria de hecho mi main team es noelle bennett yelan rosaria y mi secundario es viajero xingqiu bennett xinyan
839,94098,y recuerden antes de tirar en permafrost rosaria gt gt gt gt gt gt gt gt gt gt gt gt gt shenhe
840,94099,no m acuetdo el nmero pero es cuando chuuya y atsushi se quedan en el ascensor
841,94100,igual si me toca la lanza d shenhe no me quejara algn da sacar el arco de yelan y tendr a mis novias con sus armas 3
842,94101,dazatsu no m escondo
843,94102,hoy ser shenhe haver
844,94103,se me est haciendo eterrrrna la jornada laboral y eso que est siendo productiva pero es que el hype por shenhe
845,94104,cuando llegue de clase voy a tirarle al banner de la shenhe even though no tengo absolutamente nada pa ascenderla pero si cae es ms que bienvenida y prometo seguir con la historia pa poder subirla de nivel
846,94105,hoy ser shenhe haver y posiblemente presente mi renuncia
847,94106,que bronca los que ya tienen a shenhe
848,94107,me guardo el bereal pa cuando saque a shenhe si y me la pela
849,94108,ahhhh hoy llega el banner d shenhe no voy a esconderme y sinceramente quiero tirar por mika con uno q me salga soy feliz
850,94109,en vista de la situacin nahida nilou dehya shenhe hoy se decidir ayaka
851,94110,primos please shenhe genshinlmpact fanart
852,94111,se me olvidaba de que tengo el arma de shenhe es que xddd
853,94112,rezando para que llegue el spook de archer fgo literalmente si me sale un archer tirando por morgan tambin lo acepto si lo tuviese np8 como a parvati ese man ya estaba a lvl120 pero sabes cuntas copias de l tengo 0
854,94113,q salga ya shenhe
855,94114,charlita de chill esperando para hacer las tiradas a shenhe y luego seguimos con las commis vtuber
856,94115,con un poco de suerte hoy sere shenhe haver
857,94116,mi amor por shenhe quema con la fuerza de mil soles
858,94117,a que hora dale shenhe que tengo 30 deseos
859,94118,el mejor regalo que me puede hacer la suerte por mi cumpleaos es que me salga shenhe
860,94119,q ya se acabe la escuela necesito tirar por shenhe
861,94120,suerte en sus tiradas hoy viajeros ayaka shenhe
862,94121,aaa dios quiero a shenhe pero literalmente no me sirve
863,94122,en un rato har directo de isaac y ms tarde tirar en el banner de shenhe
864,94123,hoy a ver al chorbo tirar por la shenhe mientras cree que no le va a tocar pero como tiene una potra que no se la cree ni l la conseguir hoy
865,94124,debo resistir baizhu est cerca no pullear por ayaka y shenhe
866,94125,directo de genshinimpact es hoy vamos a por ayaka en la cuenta main y a por shenhe en la bennettcup a las 18 00 junto a endikared ms panas y seguidores que quieran compartir sus tiradas
867,94126,te odio enkanomiya me tocar dedicarte horas para conseguir los cositos esos de shenhe
868,94127,me planteo tirarle al arma de ayaka porque la quiero de hace mucho y si sale la de shenhe tampoco me quejo porque como tengo a shenhe se la puede poner
869,94128,drops sorteoi ll tiradas ayaka shenhe ll mika no gameplay ll pasamos el abyss de mientras ll
870,94129,mucha suerte a los que tiran hoy por shenhe yo ya pierdo mi privilegio ueueue
871,94130,reimu qu tramas yo uy mira qu bonita esta ost bomba de humo
872,94131,super normal
873,94132,yo soy ese
874,94133,si viene shenhe soy feliz pero sino tengo una eula asegurada  
875,94134,en poco ms de 3 horas shenhe ayyyyy qu ganas
876,94135,jiji no se lo van a ver venir
877,94136,me imagino a haji echando espuma si gano la pull de shenhe
878,94137,nunca sabr lo que se siente pasa algo importante en mi cumpleaos pero con cuea hay personajes hasta de anime que cumplen ah no entiendo
879,94138,me fui a escondet al bao ok ya empez la clase as q voy
880,94139,de nuevo con esas caras
881,94140,da 0 de shenhe en la noche vemos que tal me va con 40 deseos
882,94141,no prometo nada pero puede y solo puede que haga directo esta noche y tirando por shenhe as me podris ver la cara de si pierdo otro 50 50
883,94142,shenhe hoy shenhe hoy
884,94143,hoy me sacar a shenhe y eso mantendr mi estabilidad mental a flote un par de das mas evitando as que me suicide en medio de un colegio infantil a las 11 de la maana
885,94144,al fin llego shenhe de genshinlmpact ame como quedo el dibujo genshinimpactfanart fanartcontest fanart genshinimpactart
886,94145,es hoy suerte a vuestras tiraditas a shenhe y ayaka
887,94146,que ganas de tener a mika y shenhe en 3 horas y media
888,94147,hoy cambian el banner os ir avisando pero creo que hoy ya podr abrir directo si alguien quiere hacer sus tiradas somos 4 gatos pero bien avenidos y t vas a tirar por ayaka por shenhe por mika banner de armas o vas a skipear para la siguiente actualizacin
889,94148,voy a tirar por mika y alguna constelacin de sucrose pero si viene shenhe no me voy a quejar
890,94149,mika y shenhe da
891,94150,hoy solo voy a hablar de sheneh todo el da
892,94151,mucha suerte a los que tiris hoy por ayaka y o shenhe no se que
893,94152,shenhe hoy shenhe hoy shenhe hoy shenhe hoy
894,94153,bonitos das hoy son las tiradas de ayaka y shenhe estis listos
895,94154,ojala yo en unas horas
896,94155,que dicen si se ganan 3 50 50 seguidos hoy para shenhe
897,94156,hoy salen los banners de shenhe y ayaka
898,94157,estoy rindome quieren q vaya a argentina como paseo de curso lol
899,94158,igual luego traigo a casa a shenhe mi ganyu y ayaka c1 la agradecern
900,94159,son novios
901,94160,estoy entrando en esa duda de si shenhe o baizhu
902,94161,es hoy vuelve shenhe un para verla tu tambin
903,94162,y siii le tiro a shenhe
904,94163,las tiradas de hoy irn con dedicatoria especial a zeus1123 y su fidelidad incuestionable a shenhe genshinimpact shenhe
905,94164,he s so cute bro me voy a matar
906,94165,hagan cadenas de oraciones para que te toquen mika o shenhe las necesito
907,94166,con todo lo que tengo que hacer hoy estoy que exploto mas vale que me salga shenhe porque puedo llegar a cometer una locura
908,94167,tengo 40 deseos tiro hoy a por shenhe o mejor me espero a kazuha hdjdsksjd probablemente ahorre pero he visto que shenhe es muy buena para otros personajes cryo
909,94168,hoy sale el rerun de shenhe
910,94169,76 de pity cuando me salga shenhe monto una fiesta estis todos invitados ok
911,94170,illo ha salido ya el banner de shenhe y el de ayaka en el server de europa
912,94171,ya amaneci hace fro y seguimos vivos exelente porque ya quiero tirar al banner de shenhe
913,94172,me agrada esa personalidad de shenhe por cierto van a tirar por shenhe y o su arma genshinlmpact
914,94173,me pregunto qu se fumar esta gente
915,94174,luego le tiramos por shenhe y mika y el viernes 24 si no se retrasa el envo os traer al canal una apertura de cartas de digimon que hace tiempo que no tenemos una
916,94175,5 horitas para el banner de shenhe
917,94176,yo en unas horas
918,94177,hoy shenhe haver o nahida asegurada lo descubriremos
919,94178,el beru es el q se salio de la partida nooooooo
920,94179,buena suerte en sus tiraditas de hoy ayakakamisato shenhe genshinlmpact
921,94180,te amooo
922,94181,na amigo q rankeds de mierda la mei asquerosa 13 10 nmo se cambiaba el cassidy ofendido pqla mei no cambiaba estamamos en la crga con ramattra y la mercy se quedo en base cuando me mori yo recienm ahi entro a ayudasr
923,94182,hoy ser shenhe haver por fin
924,94183,da chulsimo vi a mis fisios epiblas tuve una tutora fantstica con elaisa amor lquido sac un temardo hay segunda sesin de meterse en jardines y adems esta noche se consigue a shenhe yo es que no puedo pedir ms chiquis i am so happy guys
925,94184,hoy se viene shenhe
926,94185,quiero a shenhe y ojal tener su arma pero si me sale la espada moradita tampoco me voy a quejar eh que mi kaeya y ayaka aplauden
927,94186,shenhe versi bocil
928,94187,hoy salen ayaka y shenhe espero que todos los que tiren por ellas ganen sus 50 50 y disfruten de esas dos pedazo de mujeres lt 3
929,94188,hoy es el rerun de shenhe  o
930,94189,entonces ya le puedo tirar a shenhe o no
931,94190,hoy es el da hoy viene shenhe y la mistsplitter
932,94191,a ver si tengo suerte luego con shenhe
933,94192,tengo que tirar por shenhe 60 de pity sin asegurar gan 5 seguidos 43 deseos para tirar
934,94193,ojala gane el 5050 con shenhe hoy pq si no me voy a poner triste
935,94194,manca poco a shenhe alleluja
936,94195,esta tarde tenemos 50 deseos para shenhe y ayaka adems de otros 30 en la bennett cup y tiradas con seguidores en cuanto el banner nuevo disponible y lo haremos con la compaa de mariia910 nos vemos a las 17 00 por twitch
937,94196,alcanzar a sacar a nahida si tiro por shenhe es que mi ganyu y ayaka la necesitan
938,94197,5 horas para el banner de shenhe
939,94198,shenhe sonriendo porque es lo ms lindo del mundo
940,94199,es hoy es hoy banner de ayaka y shenhe probaremos el nuevo abismo y hablaremos de todo lo que ha pasado en estos dias que he estado fuera go go genshinlmpact
941,94200,hoy me sale shenhe manifestacin
942,94201,wqqqq como q pato y ella eran novios
943,94202,sara y yo esta tarde en la mesa de piedra de la montaa aozang invocando a shenhe
944,94203,el nuevo banner empieza hoy o maana o sea se acaba el de dehya y cyno e inmediatamente empieza el de shenhe y ayaka
945,94204,esta noche tenemos una cuenta pendiente con shenhe hoy tiradas al banner de shenhe i los que queris tirar estis invitados a hacerlo en directo tambin quiero hacer las primeras impresiones de mika muchas cosas genshinimpact kamisatoayaka ayaka shenhe mika
946,94205,el rerun de shenhe es en unas horas y yo solo tengo 45 deseos
947,94206,sera 3pico
948,94207,suerte a todos por los que tireis por ayaka y shenhe yo no tiro por que ya las tengo
949,94208,ya estan la ayaka y la shenhe puestas en el launcher del juego
950,94209,aguantndome el tirar por shenhe pero es que es una ta chulsima guapsima con un diseo brutal y buchona
951,94210,mihoyo no es gracioso
952,94211,vengo a bendecir vuestras tiradas por ayaka y shenhe cada fav es 1 50 50 mas ganado en el mundo
953,94212,porque justo el mio como ejemplo
954,94213,estpido de m cre que ayer liberaran el rerun de shenhe pero resulta que lo hacen hoy a las 18 segn le de la cuenta oficial me est matando la esperaaaaaaaaaa
