,Id,Tweet
153,88067,si te encanta la msica y la comedia no puedes perderte bocchi the rock una serie de anime que sigue a un grupo de estudiantes de secundaria que forman una banda para cumplir sus sueos musicales y superar sus problemas personales
154,88068,de la que safamos de que kevin tsujihara no siga de la que safamos de que joss whedon no siga de la que safamos de que hamada no siga no siga de la que safamos de que the rock no siga todos dejaron un poco de su basura y ac estamos por favor no seas el prximo jamesgunn
155,88069,the rock me pareca super carismtico aunque sus pelculas fueran medio pelo pero hace un tiempo parece empeado en confirmar que es un sorete
156,88070,increble que the rock no haya pensado no ser mejor ser recordado como uno de los mejores villano del dcu black adam vs jla black adam vs superman black adam vs shazam quin sabe pudo unirse a la liga del mal o a vndalo salvaje tena mucho por crecer en fin
157,88071,se ha revelado que el mismisimo therock influyo de manera negativa en las producciones de shazam y blackadam para que estos dos no se conectarn
158,88072,the rock no permiti el cameo de la js en shazam 2 segn el medio thewrap el actor dwaynejohnson prohibi el cameo de la justicesociety en shazamfuryofthegods adems tambin prohibi el cameo de zacharylevi en blackadam por el simple hecho de tener a superman
159,88073,the rock no quiso nada con shazam
160,88074,realmente the rock dinamit la jerarqua de poder en el universo dc s seor
161,88075,el giro de hroe a villano que ha dado the rock en seis meses es para estudiarlo
162,88076,the rock fue el nico actor con huevos que ante la falta de liderazgo quiso rescatar un barco que se estaba hundiendo las gallinas y los nerds groupies de gunn le llaman ego a tener cojones porque es algo que gunn ni sus nenas nunca tendrn en su vida
163,88077,definitivamente el atraco que the rock le hizo a muchos vendiendo la dizque gran pelcula geek fue enorme
164,88078,que s hombre que s que la culpa es de the rock por no querer grabar un puto cameo y no de copito de nieve por anunciar un reboot con pelculas an por estrenar por cierto este fracaso est producido por safran futuro brillante
165,88079,al final de todo therock si fue el villano de shazamfuryofthegods
166,88080,algunos o tienen muy poca memoria o se ren de nosotros es the rock el dueo de los derechos de los personajes y los actores vale pero voy ms all no tiene james gunn como ceo de dc studios el mximo poder
167,88081,ni cotiza quines son las fuentes de the wrap un medio esclavo de la mierda que les llega desde ejecutivos rabiosos que buscan limpiar su imagen nada de lo expuesto hoy en dicho medio es noticia todos sabemos qu pensaba the rock de cruzar black adam con shazam
168,88082,que snyder haya hecho cosas malas para dc en el cine no significa que no haya otros como hamada o the rock que no hayan hecho lo mismo la gente debe de dejar de pensar que estos son bandos y que debes de afiliarte a muerte con uno
169,88083,si somo sinceros le shazam de levi no parece competencia del black adam de the rock y si somos an ms sinceros pocos o nadie queran ver a levi en esa pelcula y las redes ardieron con la vuelta del superman de cavill
170,88084,jajajajaj josh teniendo un busto de the rock jajajajajaa cuando pienso que no puedo amarlo mas sale con estas cosas random
171,88085,el medio digital thewrap revel que therock fue el que no permiti a shazam aparecer como cameo porque quera forzosamente que estuviera superman de igual manera neg cualquier participacin de blackadam o la justicesociety en shazamfuryofthegods
172,88086,the rock en el ojo del huracn dwayne johnson acusado de boicotear shazam fury of the gods
173,88087,un nuevo reporte detalla cmo las decisiones de the rock tras bambalinas terminaron por hundir el potencial de ambas franquicias
174,88088,retrocedamos el reloj un ao atrs muchos no se atrevan a criticar el dceu de hamada y a the rock dganme perdieron el valor de apoyar ese plan o qu pas escuchen se por qu ahora se pueden criticar a aquellas pelculas y sus decisiones porque hay un nuevo dcu
175,88089,exacto therock fue el verdadero falso dios
176,88090,de verdad que ya basta de the rock l es bueno pero para absolutamente nada
177,88091,aprovechando que the rock es tt aqui una foto de ese we cuando empez a hacer musica grande la ceja in waaaaaaveeeeeees
178,88092,se a publicado en las redes sociales de japn una fotografa que muestra una variedad de guitarras que estn en segunda mano en venta los fanticos de la franquicia de bocchi the rock no tuvieron la paciencia para aprender a tocarlas comentan el personal btr anime
179,88093,thewrap reporta que dwaynejohnson prohibi a zacharylevi tener un cameo como shazam en blackadam porque forzosamente quera a superman asimismo therock se neg y prohibi a davidfsandberg tener un cameo suyo o de la justicesociety shazam 2
180,88094,se a publicado en las redes sociales de japn una fotografa que muestra una variedad de guitarras que estn en segunda mano en venta los fanticos de la franquicia de bocchi the rock no tuvieron la paciencia para aprender a tocarlas comentan el personal btr anime
181,88095,parece que the rock tena rencor con la manera en que se manej su personaje por haberlo atrasado tanto tiempo y darle ms prioridad a shazam
182,88096,john cena y the rock una inspiracin para top dolla
183,88097,creen que the rock vuelva a trabajar con dc jaja
184,88098,top 10 personajes ms buscados en google durante 2022 messi pele trump andrew harrystyles goku taylorswift badbunnypr therock google top1
185,88099,a the rock se le olvido que black adam es enemigo de shazam no de superman
186,88100,si van a aprender a tocar guitarra que sea de verdad no por puro fanatismo igual que viva bocchi the rock
187,88101,as que shazamfuryofthegods se pega una hostia en taquilla ninguna sorpresa warner trata de desviara atencin lanzando mierda sobre the rock y vosotros lo aceptis con los brazos abiertos si es que warner os da precisamente lo que queris
188,88102,se mojaba con henry cavill su ambicin de poder y deseo de manejar dc la otra vez lo escuch y todava no asume que si hay un reinicio es por qu hay un gran fracaso siendo the rock no movi la aguja en la audiencia general hoy ms que nunca banco a james gunn therock
189,88103,the wrap informa sobre las posibles injerencias de the rock en la franquicia de shazam y black adam aviso de spoilers de fury of the gods parece que the rock quera que la franquicia de black adam se centrar solo en el antihroe y en un enfrentamiento con superman
190,88104,me decepcionan si dicen que esa guitarra viene de bocchi the rock
191,88105,dwayne the rock johnson intent reestructurar el dceu centrndose en l y en el superman de henry cavill
192,88106,ha sido solo ahora que han dicho los insiders que el plan de therock siempre fue acaparar protagonismo que la gente se ha empezado a dar cuenta de qu pie cojea ese to cuando el lder de opinin de este fandom es el botellas y los suyos que se tragan cualquier cosa
193,88107,the wrap informa que therock se neg a aparecer en shazamfuryofthegods y no dej que zacharylevi tuviera un cameo en la escena post crditos de blackadam en general no permiti que ningn miembro de la sociedad apareciera
194,88108,mira que me encant black adam la vi tres veces en una semana pero si me dejas a elegir lo elijo a shazam tu ego es gigante therock me decepcionantes por tu anhelo por el poder y manejar dc la verdad si tengo que elegir prefiero mil veces lo que ofrece james gunn que a ti
195,88109,la gracia de bocchi the rock no era que bocchi tocar la guitarra si no sus ataques emocionales
196,88110,the wrap report que therock se neg que shazam haga un cameo en la escena poscrditos en blackadam a su vez prohibi al director usar cualquier personaje de la jsa para la escena poscrdito por lo que safrn le sugeri usar a harcourt shazamfuryofthegods
197,88111,veo a tanta gente quejarse de lo de the rock y casi todos apoyan el reinicio que les importa ya todo eso s gunn har lo que quiera en su nuevo universo adems yo no v quejas a warner en general cuando ellos si evitaron que snyder agregara cosas a su corte
198,88112,acabo de leer el artculo y la verdad es que la informacin que da la cogera con pinzas tiene fuentes poco claras y dudosas adems de carecer sentido the rock lleva implicado en shazam y black adam desde 2018 qu sentido tendra perder el inters de repente en todo
199,88113,por que ahora de repente es culpa de dwayne johnson que shazam se estrelle en taquilla si hubiese rodado la escena con hawkman invitndole a la jsa mejorara el inters x3000 o como va shazamfuryofthegods blackadam therock
200,88114,siempre voy a estar eternamente agradecido a therock por blackadam la pelcula que me hizo volver a disfrutar a los personajes de dccomics en pantalla grande sin mencionar el detalle que por unos das hizo que me ilusionase con el regreso de henrycavillsuperman
201,88115,se informa que la autora de bocchi the rock desminti el rumor del origen disfruta de nuestro contenido y entra a nuestra web como redes sociales para ver mucho mas corporativoarcanos elmundodeshiro
202,88116,de 0 a the rock con polera que tan hbil sos para ganarle una discusin a un semforo
203,88117,the rock cuando alguien le recordaba que era el villano principal de shazam y por lo tanto tena que interactuar con el
204,88118,esto seguramente eran ensayos para la poscreditos antes de que the rock se metiera y esto me pone de muy mala ostia
205,88119,segn parece que therock y su equipo no permitieron que nada relacionado a black adam o la jsa aparecieran en shazamfuryofthegods
206,88120,sobre el tema de the rock con black adam si esto llega a ser real la verdad estoy decepcionado con el porque hoy en dia la pelicula como intento de crear un nuevo universo es un chiste y encima lo de cavill me parece la mayor vergenza del dceu
207,88121,no dudo que haya algo de verdad en esto de hecho las palabras de the rock fueron no hacerle un flaco favor pero echar la culpa de que tu pelcula fracase a un cameo de un minuto no tiene sentido alguno
208,88122,el ego de the rock es tan enorme como el
209,88123,en redes en japn circula una fotografa que muestra una variedad de guitarras de segunda mano en venta parece que los fanticos de bocchi the rock no tuvieron la paciencia para aprender a tocar comentan algunos btr anime
210,88124,esto es todo lo que se sabe la polmica entre the rock y todo lo que tiene que ver con shazam blackadam y shazamfuryofthegods
211,88125,os estis rasgando las vestiduras por el ego de therock la frase de la jerarqua de poder est a punto de cambiar ya se saba porque iba
212,88126,tremenda cagada por parte de the rock parece que no le importaba tanto dc solo los personajes que a l le interesaban y como el quera que se hiciesen
213,88127,segn thewrap the rock fue el responsable de bloquear una escena post crdito de shazam en black adam y de la jsa en shazamfuryofthegods adems dwayne johnson intento ser el centro del dceu
214,88128,chismecito rico reporta the wrap que dwayne johnson the rock prohibi a zachary levi chayanne tener un cameo en black adam porque forzosamente quera a superman as mismo dwayne no quiso salir en shazam 2 y le prohibi al director tener un cameo suyo chale
215,88129,en un momento pens que the rock de verdad quera hacer algo positivo con el dcu ahora veo que solo quera convertirlo en su chacra
216,88130,vaya bofetn le daba a the rock segundos antes de que me destruyera de un guantazo
217,88131,dia uno la invasion el supr promo tambien esta the rock ya lo viste esta increible con james cameron
218,88132,soy el nico al que la noticia de que the rock vet a zachary levy de black addam y se neg a salir en shazam 2 no le pilla por sorpresa quiero decir puedes ver el ego que tiene desde la luna y lleva aos intentando sacar ba por supuesto que iba a hacer lo ms egocntrico
219,88133,lmao an me acuerdo de las exclusivas sobre the rock salvando el snyderverse xd
220,88134,eran tiempos grises y muy convulsos donde no haba liderazgo y ambicin l fue el nico que se preocup de los fans confi en l y sus palabras joder trajo de vuelta a cavill nunca lo imaginamos pero despus de todo lo que ha salido the rock se me qued un poco as
221,88135,bast que conviviera unos momentos con este tipo para que se le pegaran las malas maas therock
222,88136,yo entenda que en ese momento no haba nada ni organizacin ni ganas de ordenar dc en cines pero no puedes forzar el status quo de un personaje en los cmics sin siquiera contar ni asentar bien su origen the rock hizo lo mismo que snyder en bvs y jl todo mal
223,88137,segn thewrap una fuente de hollywood cree que the rock perjudic a dc y a dos franquicias por no asociar a blackadam con shazam y otros personajes establecidos que shazamfuryofthegods haya sido mal recibida por crtica y pblico tambin es culpa de dwayne johnson
224,88138,the rock se present as mismo como la persona que iba a salvar al universo dc y finalmente ha sido quien lo ha acabado de matar slo quera alimentar su ego y poder meterse de hostias con superman los fans le importabamos una mierda me siento decepcionado y estafado
225,88139,yo soy otro fan de dc q se siente engaado quise no creer en el ego de the rock se comprende ms por qu vin diesel no lo quera en fast and furious pero era incoherente lo q peda la roca black adam sin shazam y black adam solo vs con superman absurdo una pena
226,88140,osea que podramos haber tenido esta maravilla y por culpa de the rock no se dio todo mal
227,88141,creo que ahora es cuando ms entiendo a las crticas de vin diesel a the rock qu decepcin ms grande cmo se nota que no haba nadie al mando en dc
228,88142,pudieron salir juntos y tener una pelcula buena la ya conocida masculinidad frgil de the rock les dio como resultado 2 pelculas malas
229,88143,que curioso como se volte todo xd ahora los que defendan a the rock le dicen que tiene mucho ego curioso por lo menos
230,88144,tremendo el chasco que nos hemos llevado con the rock tremendo vendehumos
231,88145,se informa que the rock quiso ser el centro del dceu junto al superman de cavill al punto de rechazar una escena post credit que involucraba a shazam en blackadam el ego de the rock ser siempre recordado como una de las mayores razones del fracaso de su franquicia
232,88146,si the rock estuviera en argentina estoy seguro que estara feliz hablando con instrusos todo el momento
233,88147,han quedado bien ardidos los de la produccion de shazam2 tirando mierda a the rock como si fuera un obstaculo meter un cameo sin tener al actor para interpretarlo los de wbd estan fiando exitos cinematograficos a los cameos en vez de la calidad y guion de la pelicula
234,88148,si todo lo que ha salido de the rock es cierto pues qu bueno que sus planes con black adam parece que ya se fueron alv qu no entiende que interpreta al enemigo de shazam o qu verga lastima que eso incluy a henry cavill
235,88149,acusan a dwayne johnson the rock de egocntrico y envidioso un nuevo reporte indica que el actor se neg a que su personaje de black adam tuviera colaboraciones con el shazam de zachary levi shazam va 889noticias
236,88150,autora de bocchi the rock desmiente el supuesto origen del ttulo anime
237,88151,the rock es txico
238,88152,therock nunca me dio buena espina adems blackadam es un bodrio de pelcula inmamable lo nico rescatable es la aparicin de superman
239,88153,al final este video de cesarspielbergo tena razn con respecto a que the rock quera aduearse del dceu incluso incluye una entrevista que contradice que el tipo fuera fan del personaje
240,88154,defendi a the rock y me gusto bastante la pelcula de black adam que la voy a seguir disfrutando cuando y tambin que al menos regreso henry cavill como superman pero las ideas de the rock son psimos promocionaba ms a superman que por su propia pelcula
241,88155,the rock levanta pesas con su ego
242,88156,the rock se queda en la historia del dceu no para bien
243,88157,el caso de the rock tendria que ser un ejemplo cada vez que viene alguien con el por los fans es para desconfiar no le queda grande la palabra estafador
244,88158,the rock rechaz a shazam dwayne johnson rechaz un cameo de zachary levi como shazam en black adam y prohibi utilizar personajes de la jsa en la post crditos de shazam 2 planeaba ser el centro de atencin de dc junto al superman de henry cavill va the wrap
245,88159,yo no creo que the rock sea egosta solo tena un plan pero no funcion
246,88160,segn el medio de the wrap therock no permiti la aparicin de shazam en la famosa escena post crditos de blackadam donde tambin aparece el superman de henrycavill tambin sostiene que se neg a hacer un cameo en la recin estrenada secuela shazamfuryofthegods
247,88161,hoy es el da internacional de todo fan de dc odia a the rock un gran da si seor
248,88162,as como les advert de the rock con black adam recib mucho hate por cierto y insultos pero no me hicieron caso ahora james gunn es la misma basura o ms peor dejen de chuparsela cuando no ha hecho nada todava
249,88163,ayer lo de marvel y victoria alonso hoy es dc con the rock y el fracaso de shazam 2 la crisis en el cine de superhroes es real
250,88164,a eso se le llama politiqueo de backstage en el mundo de las luchitas de mentira pero eso no funciona en hollywood ahi se devoran vivos a gente como the rock
251,88165,mi opinin sobre este artculo s the rock pudo negarse a aparecer en shazam o a que shazam apareciese en black adam pero el tipo no es dueo de los personajes ni de los actores eso de que evit que los actores aparecieran en shazam se me hace absurdo
252,88166,vaya sorpresa esto me hubiera gustado ver que pudo haber ofrecido the rock pero despus de toda esta informacin no creo que habra sido buena idea solo hacer que el universo de dc tenga como base su personaje
253,88167,no es de extraarse the rock quera pelear contra henry cavill y lucirse como hroe no con un actor de comedia y quedar como el villano
254,88168,reconfirmado the rock boicoteo est pelcula rechazando ese cameo
255,88169,jajajaja the rock es dios tiene sentido me echis porque os sale de los cojones pues mi franquicia se va conmigo precioso
256,88170,le prohibi aparecer thewrap reporta que dwaynejohnson prohibi a zacharylevi tener un cameo como shazam en blackadam porque forzosamente quera a superman asimismo therock se neg y prohibi a davidfsandberg tener un cameo suyo o de la justicesociety shazam 2
257,88171,black adam ya avisaba de la estafa piramidal de the rock las pistas estaban para quien quisiera verlas
258,88172,atencin para thewrap el fracaso de shazamfuryofthegods se debe en parte a dwaynejohnson en el intento de the rock con blackadam de posicionarse en el centro del universo vet una escena post crditos con el personaje de zacharylevi y arruin ambas franquicias
259,88173,ya van a culpar a the rock que quizo hacer algo bueno en dc trayndonos de nuevo a cavill el culpable de este desastre es gunn y su estupido reinicio y ya veran este nuevo universo ridculo que va armar
260,88174,confirmado por the wrap dwayne johnson no permiti que black adam ni los miembros de la jsa aparecieran en la post crditos de shazam 2 ni en la propia pelcula the rock y su ego ms grande que sus bceps
261,88175,me da asco the rock a m genuinamente me gust black adam
262,88176,lamentable the rock se nota el ego no igual no iba a llegar a nada por el semi reinicio de james gunn
263,88177,creo que en los comics black adam se uni a la liga de la justicia tal vez iba por ese lado pero es the rock le encanta que todo se centre en el por eso fue por un black adam heroico y rival de superman en lugar de un black adam malvado y villano de shazam
264,88178,no me explico como un simple actor como therock tiene el poder para hacer que un estudio no pueda usar a los personajes de los que son los dueos cmo me arrepiento de haberme tragado el humo que nos vendi the rock con el cameo de henry cavill y sobretodo bancar esa pelcula
265,88179,o grande plano de the rock para a dc
266,88180,siempre hay que buscar un culpable y no se hace autocritica therock blackadam shazamfuryofthegods dcstudios
267,88181,parece que la historia de hoy en torno a dc y el fracaso monumental en taquilla de shazamfurryofthegods es echar la culpa a therock porque fue l quien no permiti que la jsa saliera reclutando a shazam todos los das una historia y la culpa siempre es de otros
268,88182,recuerdan cuando era una hereja llamar egocntrico a the rock muchos estaban vitoreando al hroe de turno pero como ya pas de moda y los hroes son otros le sueltan la mano sin pudor
269,88183,en dnde qued eso de estamos escuchando a los fans pudimos ver a shazam en black adam pero the rock no lo permiti pudimos tener a black adam en shazam pero the rock se neg a participar y ahora tampoco tuvimos a la jsa en shazam por l
270,88184,lo que ha hecho the rock hace que le de la razn a vin diesel
271,88185,de los creadores de la campaita cavill tambin tiene que querer y 20m y control creativo quin se cree que s llega la culpa de todo la tiene the rock
272,88186,black adam en el centro de un universo que tiene personajes ms reconocidos que l the rock se volvi un poco loco aqu
273,88187,podemos meter a the rock en el mismo grupo de snyder egolatras que trabajaron en dc con delirios de grandeza
274,88188,grande the rock el salvador de dc le llamaban
275,88189,segn fuentes annimas the rock tiene encerrando en el stano de su casa a todo el elenco de ba desde el estreno de esta las cortinas de humo de warner no tienen fin
276,88190,si esto es real me alegra an ms la llegada de james gunn y peter safran a dc este tipo de comportamientos y egos estpidos deben quedar fuera del nuevo dc parece que the rock quera crear su propio universo dentro del dceu donde l tuviera el control
277,88191,salen a la luz ms cosas que demuestran que the rock es lo peor que le pudo pasar a shazam pues se revela que el actor prohibi que shazamfuryofthegods utilizara a los personajes de la justice society para reclutar a billy batson en la escena post crditos
278,88192,hace unos das el directo de shazam david sandberg confirm que miembros de la justice society estaran en una escena post crditos pero se descart rpidamente the wrap report hoy que the rock fue quien neg el acceso a esos personajes
279,88193,mira que soy el primero que defendio black adam pero no por ba sino por la jsa y los tomaz the rock fue pesimo en ella y encima va con delirios de grandeza
280,88194,es una decepcin lo que estoy leyendo sobre estas ltimas noticias respecto a the rock con el dceu ya que lo apoy mucho en su momento al final despus de todo solo quera aduearse de una franquicia que estaba muerta y ausente de un presidente por aqul entonces
281,88195,the rock me ha decepcionado fuerte siento que empez queriendo hacer cosas por los fans y nos estamos dando cuenta de que lo nico que le importaba era su propio proyecto y su propio beneficio lo entiendo eh pero no vendas que has luchado por y para los fans porque nope
282,88196,altamente decepcionado con the rock crea en su plan y en su por los fans pero todos los reportes muestran que solo quiso hacer el protagonista por su ego otro da ms para los fans de dc
283,88197,el directo de shazam david sandberg confirm que miembros de la justice society estaran en una escena post crditos pero se descart rpidamente the wrap report hoy que the rock fue quien neg el acceso a esos personajes por lo que sandberg cambi los post crditos
284,88198,yo y todo el fandom de dc con the rock en estos momentos
285,88199,quin cojones mandaba en dc hamada o the rock no me jodas vaya descontrol haba
286,88200,segn informan the rock vet una escena post crditos en blackadam que presentaba a shazam en la escena shazam era reclutado por hawkman aldis hodge y otros hroes para unirse a la jsa fuente thewrap shazamfuryofthegods
287,88201,nadie quiso ver lo que en realidad intentaba hacer the rock porque el odio hacia los que defienden dc de la lacra es ms grande menos mal lo mandaron a tomar por culo
288,88202,segn fuentes the rock sera el culpable de bloquear la aparicin de la jsa en una de las poscreditos de shazamfuryofthegods en un intento absurdo de querer ser la gran estrella de dc recordemos que no fue sincero con la situacin de blackadam ni con wb cine noticia
289,88203,the rock sepult su propia franquicia
290,88204,pelcula mala ideas malas futuro ms malo aun pues mira te lo mereces un poco the rock xd
291,88205,todo mal el ego de therock es ms grande que sus msculos blackadam lo nico que hace es ser el malo de shazam la nica razn de su existencia es para recibir los madrazos del campen
292,88206,se informa que the rock quiso ser el centro del dceu junto al superman de cavill al punto de rechazar una escena post credit que involucraba a shazam en blackadam el ego de the rock ser siempre recordado como una de las mayores razones del fracaso de su franquicia
293,88207,silvergeeks the rock no permiti que zachary levi hiciera un cameo en una escena post crdito de black adam
294,88208,ele parecendo o the rock
295,88209,y me imagino tiana ser plida cmo eso no afecta sino no la capacidad actoral pues es lo lgico o que sea cameron dove o que sea the rock
296,88210,un evento h de bocchi the rock atrajo enormes filas de fanticos
297,88211,jaja est mal recortado the rock
298,88212,nuevo dibujito art goto fanart bocchitherock bocchi the rock bocchi
299,88213,creo que desde que he visto bocchi the rock he vuelto a escuchar bastante rock bocchi influenciandome ms que cualquier influencer fuera coas mirad bocchi the rock
300,88214,wwe 2k23 showcase ep 3 john cena vs the rock en wrestlemania 28 a travs de youtube
301,88215,anunciadas para weissschwarz spyxfamily bocchi the rock oshi no ko y an vamos por la mitad bushiroad quiere nuestro dinero
