,Id,Tweet
744,11981,no se avergencen de tenerla chiquita vergenza irle a las chivas
745,11982,son fanaticos de estas personas hay que leer ms clubamerica chivas herymartin
746,11983,las declaraciones post partido de lvaro fidalgo no me a tocado perder contra chivas nosotros hablamos en la cancha un orgullo vestir este escudo bonito ganar los clsico por la aficin que celebrar toda la semana la representacin exacta del americanismo
747,11984,siempre le has cargado alas chivas semifinal apertura 06 y varias expulsiones son pocas cosas de las q recuerdo
748,11985,no fueron porque son chivas sinnimo de chiva jaja
749,11986,triste porque ayer perdieron las chivas feliz porque hoy gan el barca
750,11987,que ganas de andar como el chivas bien cogidote
751,11988,que chinguen a su madre las chivas lopezobrador y vmvelazquez1 no importa cuando se lea esto
752,11989,sobre de luis puente chivas
753,11990,algunos estn acostumbrados a ser unas chivas cagonas
754,11991,el madrid y las chivas perdieron este no ha sido un buen fin para mi lado fifas
755,11992,chivas humillado mi opinin de los 3 clsicos en fb perduramx
756,11993,ser infiel es como irle a las chivas me da asco
757,11994,chivas femenil lleva 26 goles a favor en este torneo quienes han anotado te dejamos la estadstica alicia cervantes 6 caro jaramillo 4 adriana iturbide 4 gaby valenzuela 3 damaris godinez 2 kinberly guzmn 2 casandra montero 1 joseline montoya 1 3 han sido autogoles
758,11995,azulcremas de guadalajara estuvieron en compaa de federico vias luis fuentes y roger martnez en una firma de autgrafos la noche previa a la victoria contra chivas en elclsicodemxico somosamrica
759,11996,yo chinguen a toda su madre jugadores de chivas sin huevos procedo a comprar boletos para el clsico tapato
760,11997,luis puente joya que no termina por tener regularidad en la institucin de chivas por sus lesiones ahora pasa por otro momento de espera que tambin ser largo de alguna manera est desgarrado est en rehabilitacin pero se viene pequeo 1 de 6
761,11998,chivas se encuentran al maje que anda preguntando en la u
762,11999,en los aos ms recientes el nico que ha demostrado su amor a chivas ha sido rpizarrot por eso es un idolo ojala algn dia regreses
763,12000,de los ltimos 20 clsicos once los ha ganado chivas cinco fueron de atlas y 4 empates es decir atlas solamente ha ganado el 25 de los clsicos disputados en los ltimos 6 aos as mismo chivas ha anotado 24 goles atlas 16 un 40 de los goles anotados no han quedado 0 s
764,12001,el ampayita del chivas vs rayadas
765,12002,los 2 goles que pablito barrera ha anotado en el torneo han sido a baln parado el otro fue de tiro libre en la jornada 5 contra chivas
766,12003,amrica gan el clsico el da de ayer 2 para chivas 4 para el amrica
767,12004,apenas te alcanza para ganarle a un sotanero mejor hubiramos hecho el ridculo como las chivas pinche equipo mediocre
768,12005,las rayadas empatan en casa de chivas y mantienen el liderato
769,12006,las rayadas empatan en casa de chivas y mantienen el liderato
770,12007,momentos random del futbol mexicano juan pablo alfaro tcnico de chivas fue elegido jugador del partido del guadalajara monterrey de la liga mx femenil
771,12008,gan checo gan el barca solo faltaron mis chivas
772,12009,mi eterno capitn tiene razn literalmente nos orinaron en la portera y nadie hizo nada pechos fros pocos chivas amauryvz
773,12010,ser infiel es como irle al chivas me da asco
774,12011,gan checo gan el barsa pero perdieron las chivas dios da dios quita
775,12012,somos muchsima aficin para un equipo tan sin huevos como chivas plagado de jugadores intiles que son atlistas y americanistas equipo cagn sin huevos sin identidad sin amor por la camiseta que falta nos hacen jugadores como bofo 100 y ramonmorales11
776,12013,que ganas de andar como el chivas bien cogidote
777,12014,fue un mal fin de semana para ser de chivas y del madrid
778,12015,atencin fue accidente no fue atentado la cada del helicptero que se precipit a tierra en quibd comandante de la fuerza de tarea titn confirma la noticia y revela que dos de los tripulantes se lanzaron al vaco antes del impacto
779,12016,clausura 2023 de la liga mx chivas 2 4 amrica
780,12017,que raro ahora no veo que suban historias los influencers jugadores de chivas
781,12018,rayadas empata 2 2 con chivas en la liga mx femenil
782,12019,rayadas empata 2 2 con chivas en la liga mx femenil
783,12020,las rayadas de monterrey empataron en el estadio de las chivas de guadalajara y aunque perdieron su paso perfecto continuaron como lderes del clausura 2023
784,12021,rayadas empata 2 2 con chivas en la liga mx femenil
785,12022,america 5 chivas 1 la manada salada se derrumb a quitarse la blusitas del guadalajara esos chivahermanos tivios
786,12023,pin ches pechos friiios y pocos los jugadores de chivas tibasepulveda30 chiqueteorozco pochoguzmano6 miguel jimenez al no reclamarle algo a perro de henrymartinm pocos c u l oooo ss valen vrga
787,12024,si no es holan independiente tiene que ir por un dt ganador alguien con huevos y experiencia en agarrar momentos complicados river y chivas se hundan y l elev la vara con resultados en octubre de 2022 esto deca almeyda de un posible llamado del rojo
788,12025,rayadas empata 2 2 con chivas en la liga mx femenil
789,12026,pinches chivas la tenan que cagar y dejar de ser un fin de semana perfecto
790,12027,arribas mis pinches chivas perrillos
791,12028,el vestidor de las chivas
792,12029,alguien sabe si las chivas ya ganaron los tres puntos en la mesa porque fidalgo y dos santos traan el nmero 8
793,12030,maldicin con el desmadre de po olvid que tambin perdi chivas lpm
794,12031,luis pero al nefasto no le faltaba nada tena de todo hasta chivas qu te parece
795,12032,uno minutos despus sancionan un penal inexistente a favor de chivas para compensar el gol anulado rayadas ligabbvafemenil no urge el var en femenil urge mejor capacitacin e instruccin notable que la gente al cargo no hace bien su chamba
796,12033,clubdeportivoguadalajara chivas femenil rescata empate ante rayadas
797,12034,he sido americanista prcticamente toda la vida pero de mi parte le ofrezco una disculpa que como aficionado me corresponde al equipo de ftbol de chivas y a su aficin por la desafortunada accin de henrymartinm clubamerica ojal haya una disculpa del club y del jugador
798,12035,total que perdieron mis chivas mi real madrid y mi inter qu pinches ms quieres de mi dios
799,12036,que ganas de estar como el chivas
800,12037,en ligabbvafemenil la cosa tambin est complicada con el arbitraje aqu le anulan un gol legtimo a chivas la asistente con un psimo sealamiento
801,12038,en la buenas en las malas y en las peores siempre con ustedes halamadridynadamas chivas chivas realmadrid
802,12039,se vive un nuevo clsico tapato sabias qu pocho guzmn capitn de chivas le declar su amor al atlas en una entrevista con tudn
803,12040,mal da para ser del madrid y chivas
804,12041,esta es la realidad de chivas peloteros pq
805,12042,algunos jugadores de las chivas abrieron un poquito dems la boquita y los jugadores del amrica se las cerraron con goles qu bonito es lo bonito
806,12043,totalmente de acuerdo pechos fros toooodooos chivas amauryvz
807,12044,ya se fue rafapuente de pumas y tibasepulveda30 ronaldocm97 y carloscb 24 cuando chivas
808,12045,los americanistas ya cobrando las apuestas del clsico nacional que sigan llorando las chivas
809,12046,chivas femenil rescata empate ante rayadas futmx
810,12047,adivinen quien perdi el parley del ao les dar pistas sus trigliceridos estn arriba d 400 no puede dar ms de 10 pasos sin cansarse es poco objetivo tiene bien atorada la del rojinegro no dijo nada del ridculo del ftbol mexicano cuando al pachuca lo elimino el motagua
811,12048,hasta las de chivas festejan como el gober de morelia
812,12049,buenooo mnimo gano el bara nooooo que las chivas
813,12050,chivahermanoooos alguien que me ayude dicindome cmo se llama esa pirotecnia roja que usan los de la irreverente y dnde la puedo conseguir es para una tarea
814,12051,aun no comprendo que les pas ayer a los jugadores de chivas
815,12052,gan river el bara monterrey pero perdi chivas buen fin de semana
816,12053,dividimos puntos esta tarde en el estadioakron
817,12054,mucha aficin para tan poco equipo la limpia en chivas debe seguir se debe reforzar a la altura pilas amaury tienes que respaldar el proyecto hierro pauno
818,12055,finsima la banda que estaba esperando a chivas abucheando el camin de rayadas no todos noms 3 mensitos traumados
819,12056,elclsicodemxico djese de mmdas es clasiconacional y punto chivas chivasfemenil esporchivas
820,12057,gracias club america america 4 2 chivas espectacular
821,12058,irle al amrica y al barcelona es como irle a las chivas de espaa
822,12059,ha sido un fin de semana redondo e increble gan mi amrica a chivas checo prez gana el gp de la f1 en jeddah y mi bara gana el clsico de liga al madrid la felicidad no cabe en mi elmasfeliz
823,12060,mis condolencias a todos aquellos que le van a las chivas y al real madrid por suerte yo le voy al puebla y al bara si esta jodido el primero pero el segundo lo compensa
824,12061,y beto chivas sigue justificando lo injustificable thevoicechv
825,12062,no importa cuntas veces me falle tampoco importa cuntas veces caigas siempre estar alentando y portando este escudo con orgullo te amo club deportivo guadalajara chivas
826,12063,la narcopanista mzavalagc esposa del narcopanista felipecalderon no se indign por la quema de esta piata de amlo pero si se indignan por la quema de una pia ta de la scjn cdmx anerica chivas zocalo platanopower
827,12064,aqu estamos en cantaritos el guero de amatitn jalisco de aqu nos vamos al clsico nacional quien gana chivas o america clasiconacional chivasamerica chivasvsamerica chivas clubamerica
828,12065,henry martn pide disculpas el jugador americanista pide disculpas a travs de las redes sociales despus de su festejo al anotarle a las chivas en la victoria que obtuvieron en guadalajara
829,12066,empatan en el akron con goles de damaris godnez y carolina jaramillo para chivas empataron a dos ante rayadas christina burkenroad y carlee giammona descontaron chivas 2 2 monterrey liga bbva mx femenil jornada 10
830,12067,no pudieron con tanto amor y entrega de su aficin mis chivas de igual manera hasta que me lleve diosito estar aqu cabrones
831,12068,el clsico amrica chivas es ya un clsico de morbo de perversin se espera que gane alguna vez chivas para tener un poquito de dignidad y vergenza el arbitraje les ayuda frente amrica de lstima lo que ocurre pero es que chivas nunca ha sido grande en la era moderna
832,12069,el madrid y las chivas perdiendo un da tras otro lo nico que me levant fue el podio de checo prez unas por otras
833,12070,afortunadamente mi barcelona hizo lo que mis chivas no pudieron ganar
834,12071,como le urge un killer del rea a chivas
835,12072,los ganadores del fin de semana rayados fue al volcn y se llev el triunfo en el clsico regio amrica gole a domicilio a chivas la juve se impuso al inter feyenoord gan el clsico de pases bajos barcelona derrot al real madrid y se puso a 12 puntos
836,12073,dejando el arbitraje de lado eva tuvo una muy mala lectura de juego hoy los cambios pesimos y salir a dejar que chivas controlar el juego peor
837,12074,el pocho es el modelo a seguir y el capitn que chivas necesitaba
838,12075,veo chigays y periodistas doble cara ofendidos por festejo de henrymartinm a chivas q no mamen cuando hacen sus mamadas todos les parece gracioso la gente del club se burla y ahora les mean la portera frente a sus aficionados y lloran chspm america clasicodemexico
839,12076,no entiendo dicen que chivas no tiene dinero que los regios invierten mucho ms pero ahora resulta que hasta nos alcanza para comprar el arbitraje
840,12077,a m no me ofendi henrymartinm es un clsico y as se juegan y se viven los clsicos a m me ofendio mi equipo chivas toda la semana primero dejandolos entrar a ustedes a nuestra casa y se burlaran de nosotros y al final me ofendi el fro pecho de nuestros jugadores
841,12078,ms all del arbitraje de hoy chivas femenil asfixi a un monterrey que pareca inquebrantable
842,12079,rayadas empata 2 2 ante chivas y mantiene el liderato de la liga mx femenil carlee giammona y christina burkenroad fueron las autoras de los goles albiazules
843,12080,las chivas remontan y empatan a las rayadas 2 2 info7 info7deportes deportes futbol ligamx
844,12081,putas chivas
845,12082,pregunta sera hace 24 horas chivas se imaginaban que el que se las pagara le iba a dejar as
846,12083,me ver mal si maana me voy al uni de rayadas o con la de chivas o si el tigre me ve tambin me mentar la madre por no ser de tigres
847,12084,pequea resea del clsico andaban bien soberbios nos aventaron mil chelas luego se quedaron mudos y al final se salieron antes ustedes saben quien chivas son jajajaja love u clubamerica
848,12085,nooo mekor una de las chivas xq se nota q es bn guilas
849,12086,domingo de paseo y diversin
850,12087,mientras l anota gol en el mundial representa a mxico y se orina en tus chivas t vas seguir siendo una gata una fracasada q busca colgarse de la fama de otros ni el la prra vida te conocemos tu lechita y a dormir doa pedos la trae bien atorada desde anoche soporte
851,12088,chivas femenil le cort una racha de 9 victorias consecutivas a rayadas con la remontada de esta tarde que por poco termin en una voltereta pica
852,12089,que tengan un buen inicio de semana mis queridos amigos chivas efrenamador gerardorich canitapiju cc aehegewisch toledo fab jag mad gpborja emiliozamudior
853,12090,que pinche pattico jajajajajajaja con razn le va a las chivas mediocres
854,12091,1 gol de visita y frente a chivas en vivo y a todo color eso giammona
855,12092,q solo fue una forma divertida de festejar y tan no fue nada malo q ningun jugador de chivas reclamo
856,12093,no admitir que perdi bien el madrid es como no reconocer que amrica fue mejor que chivas se vale no siempre ganar
857,12094,rafa puente dt lobos buap director deportivo de chivas dt en gallos blancos dt en atlas auxiliar con tuca en jrz dt en pumas en todos menos en buap que tena un equipo ya armado hizo un papel espantoso parece que tiene el mismo representante que gulit pea
858,12095,vivanas chivas
859,12096,slo quedaron mal las chivas
860,12097,el ftbol mexicano es pasin es debate polmica alegra emocin bienvenidos a esta cuenta donde juntos viviremos la pasin del balompi nacional ligamx ftbolmexicano clubamerica chivas cruzazul pumas deportes futbol elclasicodemexico
861,12098,imagnate qu hay ms de 22 jugadoras que se rompen la madre en la cancha corriendo y peleando cada baln para que el jugador del partido sea el dt de chivas un wey que ni su propia aficin quiere jajajaja ligabbvafemenil se la volaron
862,12099,eso es lo que me cae mal de chivas y de la mayora de su aficin y en general de los equipos que se llevan y no se aguantan as es la carrilla futbolera y todos le entramos pero nunca faltan los que luego luego se indignan y lloran
863,12100,y ya lo ven y ya lo ven nos cogimos a las chivas en el akron otra vez
864,12101,empate agnico chivasfemenil y rayadas dieron un partido de alto nivel en donde empataron en el akron furiadeportiva furianeta ligabbvamxfemenil chivas rayadas
865,12102,y en chivas cuando corren al entrenador serbio que de verdad sigue sin dar resultados el rebao sigue perdido jugando igual o peor que la temporada pasada ni das una vergara
866,12103,jugado el clsico de mxico chivas 2 4 amrica
867,12104,inclusive con nuestro plantel limitado chivas se impuso
868,12105,es domingo crudo perdieron las chivas y el real madrid
869,12106,jams es fuera de lugar el gol de chivas femenil error arbitral que va al marcador
870,12107,carolina jaramillo suma cuatro goles con chivas femenil en este clausura 2023 de la liga mx femenil gol vs pumas unam doblete vs mazatln gol vs rayadas del monterrey
871,12108,y arriba el clubamerica pinches chivas culeras
872,12109,lo nico clsico son las verguizas que te acomodan en tu casa chivas
873,12110,christina burkenroad suma diez goles con las rayadas del monterrey en este clausura 2023 gol vs puebla hat trick vs mazatln gol vs cruz azul gol vs necaxa hat trick vs pachuca gol vs chivas
874,12111,es domingo crudo soltero perdieron las chivas y el real madrid la vida es re fea
875,12112,yo ayer con las chivas
876,12113,muy buena capacidad de reaccin de mis chivas femenil
877,12114,que sentido tiene esto y porque los jugadores de chivas no lo acorralaron ah mismo
878,12115,zona3deportes chivas empata ante rayadas en la jornada 10 los goles de caro jaramillo y damaris gdinez y de las giammona y burkenroad con este resultado ambas mantiene el invicto en el torneo liga bbva femenil
879,12116,que manera de festejarlo en su cumpleaos 29 caro jaramillo ejecut el penal que empat el marcador ante las superlderes rayadas este fue su cuarto gol del certamen felices fiestas carojaramillo94
880,12117,este fin slo falto que ganaran las chivas
881,12118,deportes celaya con este resultado se mantiene en la posicin 2 de la tabla general empatando en puntos a chivas tapato con 24 unidades
882,12119,no puede jugar carojaramillo94 en chivas que pedazo de crack
883,12120,humillaron a chivas al milan al madrid y encima eliminaron a po solo falta que los lakers pierdan para que sea el peor fin de semana de la historia
884,12121,no se que carajos va a hacer chivas se parten su madre entre ellos hacen un asado y cierran filas etc pero tienen 2 semanas para cambiar la actitud planteamiento y mentalidad si vuelven a jugar como ayer van a dar las nalgas en el clsico tapato
885,12122,ligabbvamxfemenil 90 chivas 2 2 rayadas ambos equipos se mantienen invictos en el torneo rayadas recibi 2 goles haba recibido apenas 1 en el resto del torneo damarisgodinez3 38 carojaramillo94 69 carlee giammona 9 cburky2 31
886,12123,el chivas como yo en el amor primero muy hocicon y al final valgo vrg
887,12124,con doblete de jonathan rodrguez y una gran ofensiva el clubamerica super a chivas en el clsico de mxico la crnica en adrenalina de excelsior
888,12125,tu te llevas y no te aguantas chivas
889,12126,deberan de hacer actividades as de chivas como transitarte ms seguido
890,12127,conclusin ellos pueden andar de hocicones calentando el clsico y los nuestros no pueden festejar un gol por qu se sienten las nias de chivas el que se lleva se aguanta
891,12128,quiero un jugador como henry en mis chivas
892,12129,caen las chivas ante el amrica en casa
893,12130,as se ve hacer pesar tu casa
894,12131,hablemos de la liga que si importa america 4 2 chivas
895,12132,que castrozo hijo de puta es agomezlunam brlate todo lo que quieras de chivas pinchi fracasado que siempre nos la seguirn pelando en todos los sentidos con tu equipo de 4ta
896,12133,sigue en vivo la conferencia de prensa con nuestro director tcnico patoalfaro23
897,12134,que ganas de andar como el chivas bien cogidote
898,12135,fuera de lugar en el primero gol de chivas penal no marcado a rayadas gol mal anulado a chivas penal favor a chivas q no era aaaaa y muchisimas faltas y muchas tarjetas q no salieron el juegazo de la jornada fue pesimo gracias al albitraje
899,12136,rayadas monterrey no logr conseguir su dcimo triunfo consecutivo tras empatar con chivas en el estadio akron con un polmico arbitraje abcdeportes 92 1 fm y 660 am
900,12137,oigan no anda lloviendo por dnde viven ustedes es que ac andan cayendo las lgrimas de los 5 aficionados de rayadas por el arbitraje
901,12138,cumple el mismo da que la jugadora de chivas naty
902,12139,se viene actualizacin de los goles de caro con chivas
903,12140,luego dicen que en las ligas femeniles no existe corrupcin chivas rayadas
904,12141,cmo era chivas no buscamos quien nos las hizo sino que por eso son segundos en todo se habla en el rectngulo verde elunicogrande clubamerica
905,12142,cabecita rodrguez tiene de hijos a la chivas el uruguayo no para de hacerle goles al rebao
906,12143,carolina jaramillo siempre ser mi jugadora favorita del guadalajara tiene el adn completo de chivas
907,12144,reportajeschv una vergenza las chivas para justificar la impuntualidad de los honorables a la sala con esas chivas en un trabajo normal los hubieran despedido de inmediato
908,12145,clubdeportivoguadalajara detrs de cmaras amrica le meti cuatro a chivas tudn
909,12146,jajajaja ya se pueden pelear el prximo partido tranquilamente
910,12147,rayadas y chivas entretienen en guadalajara y empatan en el akron hubo polmica en el arbitraje pero ambas escuadras se mantienen invictas en el torneo
911,12148,perdieron las chivas el bayern empataron las chingonas y gan el bayern bonito
912,12149,les robaron chivas femenil fue perjudicado por el arbitraje al anularles un gol legtimo de iturbide montoya puso un centro perfecto y boyi anot de volea pero el rbitro marc fuera de juego las tapatas anotaron 3 goles y tenan que haber ganado
913,12150,ahora s cueste lo que cueste tienen que salir a ganar el viernes el clsico tiene que ser nuestro no importa dnde jueguen o quienes sean las que jueguen
914,12151,primero chivas cae contra el amrica y despus cae pio fc contra aniquiladores est siendo un fin de semana realmente largo
915,12152,ps ya q podan hacer las rayadas con el arbitraje a favor de chivas va
916,12153,dos cosas deportivas pasaron para guadalajara jalisco pierden las chivas el clsico malo gana schecoperez en arabia muy bueno nadiemepregunto
917,12154,ahorita que estaba viendo el juegazo de chivas femenil investigu que hay 22 jugadoras estadounidenses jugando en la liga mx femenil no vea tal invasin desde 1846 1848
918,12155,pues resulta que golean a las chivas youtube ivoox chivas america clasico clasiconacional elultimo10 pochoguzman fyp veanfutbol
919,12156,y hay gente como javquezadar repitiendo una y otra vez en una transmin profesional que fue robo a mano armada contra chivas jajaja
920,12157,grcies bara viscaaa el bara ahora si vamooos chivas femenil dame una alegra ms por favoooor
921,12158,el dt de la seleccin mexicana femenil estuvo presente para ver el juego entre chivas y rayadas fabrizio alarcn
922,12159,ayer perdi mis chivas y hoy mi madrid as que hoy pierde mi familia
923,12160,si usted quiere ver a un equipo de chivas partirse la madre y venir de atrs sobre cualquier marcador entonces siga y apoye a chivasfemenil ellas llevan aos poniendo a chivas donde merece
924,12161,va muralcom las chivas se repusieron tras estar dos goles en desventaja en casa y empataron 2 2 con rayadas de monterrey
925,12162,va muralcom las chivas se repusieron tras estar dos goles en desventaja en casa y empataron 2 2 con rayadas de monterrey
926,12163,va muralcom las chivas se repusieron tras estar dos goles en desventaja en casa y empataron 2 2 con rayadas de monterrey
927,12164,el empate de chivas le conviene al amrica solo esperemos que maana se gan a las amazonas
928,12165,ahora dilo sin llorar fernandacortezm el gol anulado a chivas se podra interpretar que corrigi el error y el penal si era cacho va buscando a la jugadora y no el baln obstruccin le llaman ya vendr el anlisis de un gran rbitro como ramosrizo para aclarar eso
929,12166,con diego valds todo el partido amrica le gan el clsico a chivas de guadalajara por la liga mx clausura
930,12167,grande nuestro presi sacando la lana para el arbitraje
931,12168,jajajaja necesito el vdeo desde cancha
932,12169,las chivas se repusieron tras estar dos goles en desventaja en casa y empataron 2 2 con rayadas de monterrey
933,12170,da de la comunidad de togetic y el len vs chivas casi al mismo tiempo nada nada mal
934,12171,casi llor cuando v el festejo
935,12172,el mejor estadio con el mejor equipo chivasfemenil a mi parecer chivas debi ganar con ese gol mal anulado y sinceramente si fue un poco superior a rayadas pero el ftbol no es de merecer as que con ms fe que nunca al clsico
936,12173,no me sorprende que chivas no de la cara despus de la cagada el junior estaba en una fiesta bien agusto a el le vale dos hectreas
937,12174,tiene mucho ms carcter que cualquiera de los jugadores de chivas
938,12175,analista las jugadas faitelson 2 y 3 gol ha faltas previas y el 4 gol si detuvieron para revisar en el var el posible fuera de lugar de chivas en el 2 gol para cortarle el ritmo a chivas ese cuarto gol del se debera de haber revisado por un posible fuera de lugar
939,12176,las jugadoras que se hicieron un partidazo
940,12177,excelente juego entre chivas y monterrey un tiempo para cada quien de esos partidos que hacen que cada vez te enamores ms del ftbol femenil ojal est bien karol bernal
941,12178,primero el miln luego las chivas y el real al ltimo me quiero morir
942,12179,se gane o se pierda arriba mis pinches chivas
943,12180,me da mucho gusto haber visto a chivas as porque la prxima semana es el clsico nacional
944,12181,sin bajar los brazos esporchivas
945,12182,arriba mis chivas
946,12183,malsima valeria del campo no se porque no la saco eva la que peor jugaba la que se qued los 90 min espero que karol se recupere y juegue en esa posicin la prxima semana gran leccin que nos di chivas y nos hizo bajar de dnde estbamos
947,12184,que descarada la cm de la liga el arbitraje le regalo en empate a las chivas y pone a director como jugador del partido esta claro que debi ser el seor rbitro el mejor jugador del partido
948,12185,chivas empat un 0 2 y pudo ganar rayadas estaba presionando muy arriba esto ocasion que le hicieran mucho dao con el juego directo y que le ganaran casi todas las segundas jugadas por la distancia entre sus lneas no se dio la remontada por malas decisiones finales
949,12186,aficin de chivas chivasfemenil hay un equipo que se merece el respaldo y el apoyo por ahora son 2das de la tabla general no los ridculos y petardos del primer equipo
950,12187,deportes el equipo de rayadas no pudo vencer a las chivas en el estadio akron sin embargo sigue siendo lder del torneo
