,Id,Tweet
2064,38818,sigo muy feliz por el triunfo de ayer me encanta orinarme en las chivas pero tambin reconocer que al principio del partido se vio un amrica muy acelerado queran anotar un gol rpido y eso hizo que perdieran varios balones hasta fidalgo que es el ms sobrio estaba cayendo
2065,38819,ms bien no tuvieron los webos de festejarles igual y de dar un partido a rompe madres ya por todo quieren recriminar y decir hay eso no se hace me lstima es parte de los clsicos amrica lo hizo y a chivas les falt mostrar lo que tanto hablaron
2066,38820,que buen fin de semana pasa mxico a semifinal pierde chivas gana checo prez gana manchester
2067,38821,viendo el resumen entre amrica contra chivas emilio lara no sabe marcar cmete errores como un novato clubamerica hechos
2068,38822,amrica humilla a las chivas en su el amrica comenz ganando fcilmente el partido tanto que al minuto 53 ya iban goleando a las chivas 0 4 al final las chivas pudieron recuperar algo de honor al marcar 2 goles y acortar la diferencia a slo dos goles
2069,38823,lo nico bueno de anoche fue la aficin por nosotros no qued chivas delpalmerismonomebajo
2070,38824,ser infiel es como irle a las chivas me da asco
2071,38825,sigo viendo videos del clsico de ayer no puedo entender la falta de carcter de los jugadores de chivas te estn pintando la cara gacho y no hay nadie que ablande a esos perros as no se puede competir por nada y claro que la semana de amigos por siempre influye
2072,38826,puente vio ayer como le ayudo a chivas tener a alguien de banda de centro delantero y dijo ahuevo a ver si a m si me funciona pa que lo corran
2073,38827,lo nico grande que le queda a chivas es su aficin amauryvz que piensas que con ese humo que vendieron es suficiente chivas lleva aos fracasando y seguir as hasta que no pongan gente que quiera y sepa lo que es chivas los jugadores no tienen amor ni pasin ni mucho
2074,38828,si t culo fuera las chivas yo sera el america
2075,38829,as lo vi la realidadamericanista del clubamerica jugando frente a las chivas mira mis calificaciones y lobuenolomaloylofeo del partido disputado en el estadioakron link aqu gabyescribe 17titulosdeliga
2076,38830,donde van a pasar el rayadas vs chivas
2077,38831,que ganas de andar como el chivas
2078,38832,nosotros no hablamos previo a un partido sea el rival que sea con esta indirectota fue como fernando ortiz arranc con su participacin en una de las conferencias de prensa ms recientes clubamrica chivas fernandoortiz
2079,38833,esto es lo que se necesita en un ftbol como el nuestro chivas va a levantar felicidades al profe pauno por tener la categora y humildad que le faltan a muchos de nuestros dirigentes en el ftbol mexicano reconocer errores y ofrecer disculpas no cualquiera
2080,38834,que cierre el hocico y se ponga a trabajar lo de hoy fue un insulto a las chivas y a los chiva hermanos pauno si no puedes renuncia
2081,38835,irle a chivas es amarlos y odiarlos al mismo tiempo
2082,38836,los chillahermanos se ofendieron ms por el festejo de la falsa meada de perrito que por la verdadera meada que le pusieron a chivas en la cancha te amo clubamerica grande henrymartinm sguete meando sobre esas sidosas hociconas
2083,38837,chivas
2084,38838,hay gente que no sabe lo que es chivas
2085,38839,que chivas perdiera ayer me vale vrga hoy mi corazn esta roto porque el que pierda no pasa a playoff entre aniquiladores y pio fc
2086,38840,santi gimnez va a festejar donde est la bandera de mxico sin saber que son los que hinchan a edson y jorge snchez jajajajajajaja sin duda es ms mexicano que los 11 pendejos que actualmente juegan en chivas
2087,38841,ya ms en fro podemos concluir cosas por ejemplo somos la verga y que s los de chivas son cagones y llorones jona2118 gracias por los goles leito gracias por esa volea con externa espectacular y henrymartinm gracias por orinarte en ellos
2088,38842,jugamos al chivas amrica bueno cmo se juega yo en 2 y t en 4 pero que sea en tu casa hahahahahahaha vamosamrica
2089,38843,voz autorizada chivas necesita hacer algo con los petardos que hoy portan su camiseta las leyendas hablan
2090,38844,ligamx amrica humill a chivas en su propia casa y deja en claro quin es el ms grande gt
2091,38845,esto es lo que me imagino cuando oigo que dicen arriba las chivas
2092,38846,est derrota vergonzosa de chivas es toda del dt no puedes salir a jugar al tu por tu a un equipo que est muy por encima de ti en calidad de jugadores
2093,38847,se enojan por el festejo de henry martn mejor enojense con sus mediocres chivas nolevoyalamerica
2094,38848,te amo chivas no seas tacao amauryvz se nota a simple vista que el equipo le faltan ms refuerzos y en especial un mejor portero ms seguro sino inviertes los resultados siempre van a hacer los mismos y sin importar el dt que est en el banquillo refuerzosurgen
2095,38849,perdieron las chivas me quede sin dinero amanec regaado aparte con hambre y todava tengo que ir a trabajar
2096,38850,pobres pendejas chivas
2097,38851,veljko paunovic le pide perdn a la aficin de chivas despus del clsico nacional volveremos a ilusionarlos
2098,38852,amrica gana el clsico contra chivas
2099,38853,felicidades a mi comandante carojaramillo94 gracias por ser ese motor que impulsa a las rojiblancas por defender la camiseta con valentia siempre muchos aos mas en el guadalajara hermosa
2100,38854,una sola persona de chivas ayer vino a reconocer la victoria del amrica y no como otros chillones que no saben perder en vez de estar chillando peor que magdalenas por el festejo de henry y reclamando al rbitro reclamen de la actitud de su equipo abrazo labarbie
2101,38855,igual que en poltica en futbol los que ayer eran chivas hoy son guilas
2102,38856,feliz da del hombre a m mismo ms tarde me regalo una chivas 18 sorpresa
2103,38857,perdieron las chivas pero gan checo prez
2104,38858,ya quisiera yo que alguno de los jugadores de mis chivas sientan la tradicin como l siente la del ame quisiera ver a cualquiera celebrar como el bofo acepten que ellos fueron mejores y dejen de buscar fuera de lo deportivo
2105,38859,en las buenas y en las no tan buenas chivas
2106,38860,los mariachis callaron chivas clubamerica henrymartinm elclasicodemexico yosoytupadre losmariachiscallaron
2107,38861,jajaja le va a las chivas
2108,38862,falto la opcin que chivas juega sin huevos
2109,38863,un gran fin de semana se gan el clsico a las chivas se gole a nuestro mximo rival callando a esos bocones y se cierra con la victoria en formula 1 de un gran americanista cmo nuestro checo prez mejor imposible
2110,38864,mis chivas me podrn fallar pero checo nunca
2111,38865,que feo ha de ser irle a ls chivas
2112,38866,deportes el clsicodemxico an no acaba con el triunfo de clubamerica 2 4 sobre chivas viene la cruda con los memes hectorquispe con el recuento ccp laverdad
2113,38867,gran fin de semana para los mexicanos bisbol tu no chivas y checo
2114,38868,siempre apoyando a mis chivas en las buenas y en la malas tambin
2115,38869,deportes tena que ser del amrica el yucateco henry martin henrymartinm pidi disculpas a las chivas y la aficin por su comportamiento en el clsico nacional
2116,38870,los incomparables de tigresoficial y los chillahermanos de las chivas hoy domingo
2117,38871,apenas medio da de domingo y ya no es tt chivas ah pero la declaracin del hocicon drogo guzman guzmanpocho06 dur toda la semana as es el populismo nefasto para todos enriquevonbeas fercevallosf adalfrancoespn omarvv9
2118,38872,viva mexico
2119,38873,no me gusta el futbol varonil para nada pero ya hablando enserio en algn momento chivas y sus chiva hermanos sabrn aceptar una derrota sin hablar mal del rival
2120,38874,las chivas nos han fallado muchsimo en estos ltimos aos nos han arrastrado no han valorado todo el amor que esta gente les tenemos han jugado con nuestros sentimientos les ha importado un carajo y an as aqu estaremos todos porque ste amor no es para cobardes
2121,38875,cualquiera de la presente plantilla chivas y ni que decir de su nefasta directiva est al nivel de esta gente
2122,38876,atlas checo chsm chivas real madrid muy completo este fin de semana
2123,38877,si le vas a las chivas toma terapia por favor
2124,38878,te sientes el ms grande y el ms popular y en tu casa nos orinamos cada torneo hablan ms de lo que juegan cagones chivas
2125,38879,a ver ahora si ya ms en fro ah va 1 perder por dos goles contra una de las top 3 plantillas en mxico previamente habindole ganado a las otras dos no es algo que no estuviera presupuestado lo preocupante son las formas hay jugadores que se deberan ir hoy mismo de chivas
2126,38880,que ganas de andar como el chivas bien cogidote
2127,38881,dice mi concuo que si le debo a una tarjeta no me dan la visa yo digo a quin verga le pido que me den su puta visa chinguen a su madre putos gabachos y los pendejos de las chivas
2128,38882,mentira soy team chivas
2129,38883,que fin de semana ms verdura gano mi padre schecoperez y adems a las chivas les gan su pap mi clubamerica
2130,38884,fin de semana redondo el clubamerica humilla a las chivas y schecoperez se consagra como el rey de los circuitos callejeros
2131,38885,ahora resulta que meter menos goles qu el rival es perder perder es ser dominados el no ganar no es perder simplemente chivas tuvo mala suerte america no gano nadie ve a america como ganador la gente solo respeta ms a chivas despus de este partido
2132,38886,este tuit se cometa con la cantidad que todos los americanistas vamos a poner para pagarle a la ligabbvamx la amarilla de henrymartinm y as seguir humillando a las perras chivas inicio 1 000 00 para la bomba yucateca jajajaja
2133,38887,piensa que puede lastimarme pero yo le voy a las chivas
2134,38888,me alegra que martn nos haya meado la portera espero que le haya hecho saber a chivas que su semana de previa y su puta campaa de rivalidad sana son una mamada
2135,38889,puros corajes con chivas y scuderiaferrari cuando no es uno es otro pero este fin de semana fueron los dos
2136,38890,voto de confianza leo surez seguir en el xl titular hoy ante chivas el tano decidi por seguirle dando la confianza al argentino vamos leito
2137,38891,muchas felicidades henrymartinm por ser el jugador del partido de la jornada12 en el clsiconacional contra chivas elegido por la ligabbvamx
2138,38892,yo ah slo veo 2 de chivas v
2139,38893,muchas gracias ojal
2140,38894,ayer se reventaron a mis chivas mi estabilidad emocional recae en qu hoy pio fc se rife un partidazo
2141,38895,wowww que fin de semana vie mxico gana a puerto rico sab amrica gana a chivas dom checo gana en arabia
2142,38896,viendo al mejor fotgrafo de chivas las mejores tomas las encuentran con el the best juanch0plus
2143,38897,yo amo a las chivas siempre me hacen ganar dinero
2144,38898,toooooooodo lo que debes de saber previo al partido de esta tarde
2145,38899,se domino a chivas y se domino a max33verstappen todo fue perfecto
2146,38900,gana atlas gana checo jalisco bien representado tenas que cagarla chivas
2147,38901,la prensa anti americanistas quieren hacer a lo grande un festejo y cuando ponce le pic los ojos a henry y la cuenta oficial de chivas se burlo todos callaron y los gonzalo s ya pinches wilos no lo lesiono ahora resulta que piden moral esa bola de nacos hipcritas
2148,38902,mxico le gana a puerto rico en el clsico mundial de bisbol el amrica golea a las chivas checo prez gana lo pole y el gran premio de yeda manchester united le gana al fulham en la fa cup fin de semana perfecto
2149,38903,estoy ms orgulloso de checo que de mis chivas
2150,38904,das la neta ya ni ganas de hablar de chivas hoy ayer fue un pinche coraje y vergenza de juego a parte no mames ya no aguanto a los weyes que se sientan atrs de nosotros gente que se la pasa cotorreando y ni ven el perro juego ya urge cambiarme de lugar harta me tienen
2151,38905,gan mxico en el clsico mundial de bisbol gan el amrica a las chivas en el clsico gan checo en el gp de arabia saudita ya solo falta que le gane el barcelona al real madrid
2152,38906,amanec bien emperrada pinchis vatos chivas ya ni la chingan al menos le hubieran dado un madrazo al henry
2153,38907,fueron mas al partido de chivas vs amrica que los a careados del hocicon de palacio el loco lpez hablador kkks
2154,38908,primer clsico nacional juntos chivas arelybou
2155,38909,viva mi chequito prez y que chingue a su puta madre eternamente max verstappen y los pendejos de las chivas
2156,38910,puta madre en las malas es cuando ms de chivas me volv
2157,38911,ayer le ardi la cola a chivas y hoy a max verstappen facts
2158,38912,arriba las putas chivas
2159,38913,no ganaron mis chivas hoy pero gano checo prez venga gdl
2160,38914,mnimo sirvi de algo la vergenza que hicimos los chivas anoche se motiv prez porque gan su amrica jajaja ya mejor vamos a encontrarle el lado gracioso jaja
2161,38915,checo randy y la seleccin de baseball ya pusieron el nombre de mxico por todo lo alto ustedes cuando chivas
2162,38916,as o ms callados chivas enriquevonbeas omarvv9 j pietra odiamemas
2163,38917,ayer perdieron mis chivas no me fallen pio fc puropinchepio
2164,38918,veljko paunovic timonel de chivas habl en conferencia de prensa despus de la derrota en el clsico nacional ante amrica donde dio un mensaje de agradecimiento a la aficin por el apoyo ligabbvamx repblicachivas clausura2023
2165,38919,pero es que ninguno mueve como el chivas america
2166,38920,chivas vs amrica memes ridiculizan al guadalajara tras paliza recibida ante las guilas en el clsico
2167,38921,chivas 21 puntos leclerc 6 puntos chivas gt leclerc
2168,38922,dos tequilas por las chivas qu estn llorando y al america le vali verga salud
2169,38923,en la vida a veces se checo y a veces se chivas
2170,38924,ah se las dejo botando clubamerica chivas clasico expulsin
2171,38925,el amrica exhibi a las chivas viva mxico cabrones
2172,38926,as en estos momentos los de tigres los de chivas los que odian a checo prez
2173,38927,gole el atlas golearon a las chivas gole el arsenal perdi el psg gan el clsico el leverkusen gan checo y ya solo falta la victoria del madrid vaya fin de semana
2174,38928,fernando ortiz en clsicos desde que lleg al america ya le sac la partida a 3 dt de chivas en 3 torneos leao 0 0 cadena 2 1 paunovic 2 4
2175,38929,chivas loser
2176,38930,ayer no cene pq perdieron las chivas pero hoy mi pap si me da de comer pq checo qued en primer lugar
2177,38931,y la gente paga un boleto de 4500 para ver perder a su equipo clasicodemexico chivas
2178,38932,as la bandera que despliega la aficin de chivas previo al inicio de elclasicodemexico
2179,38933,en que se parecen las chivas y max verstappen en que los dos se la pelaron a un americanista
2180,38934,esto cala bien cabron chivas
2181,38935,el microbusero del checo gan anoto santi y edson se cogieron a las chivas gan el azul y maana le sacamos la mierda a los ojos de rendija el mejor pas del mundo hijos de la verga
2182,38936,chivas vs amrica memes ridiculizan al guadalajara tras paliza recibida ante las guilas en el clsico
2183,38937,fin de semana redondo golea el clubamerica a las chivas y gana schecoperez el primer lugar sobre max33verstappen en el saudiarabiangp
2184,38938,el resultado del chivas vs amrica de ayer solo fue un montaje
2185,38939,y las chivas despide el circo maroma y teatro de toda la semana con su excelente actuacin
2186,38940,ganaron checo prez y el manchester united las nicas que fallaron fueron las chivas varonil
2187,38941,la imagen que define mi fin de semana amrica paseo a chivas checo gan en arabia y se le puso bravo al equipo vamos carajo
2188,38942,los microbuceros ya festejan el triunfo del transportista mayor checo perez saudiarabiangp
2189,38943,no debera ser problema el arrastre del amrica genera un debate que no debera existir si henry martn llevara esos goles en el pachuca sera todava ms obvio que es mucho menos importante marcarle al mazatln o a las chivas que a la lazio y al ajax
2190,38944,sacrifiqu a las chivas y al bayern para verte ganar prez
2191,38945,amrica ganandole a chivas representacin grfica
2192,38946,mis chivas me quitaron la felicidad ayer pero hoy checo me la regresa
2193,38947,clsico nacional amrica 91 jg 36 84 chivas 77 jg 31 17 empates 79 31 99 clsico tapato chivas 107 jg 37 42 atlas 92 jg 32 16 empates 87 30 42 datososmar
2194,38948,ctedra callejera del dr sexo peres gracias por quitar el trago amargo de ayer con las chivas lpm
2195,38949,que ganas de andar como mis chivas bien cogido
2196,38950,el amrica siempre le gana a chivas eso es lo que es un clsico
2197,38951,me parece ridculo que a los aficionados de chivas les ofenda el festejo de un jugador del clubamerica a mi no me encanta pero es un festejo y ya y no les ofenda lo blandengue que sali su propio equipo el 0 4 en casa me parece mucho ms humillante que cualquier festejo
2198,38952,alguien pidi cuatro goles a domiciilio amrica derrota a domicilio a las chivas por cuatro goles y se mantendrn como segundo lugar en la tabla general el clsico es azulcrema clubamerica aguilasdelamerica chivas clasiconacional ligamx ligabbvamx
2199,38953,a dele mijo as a mamarla chivas
2200,38954,jornada 10 agendafutbolstica chivasfemenil rayadas 17 00 hrs estadio akron fox sports chivas tv vamosporellas
2201,38955,chivas me fallaron ayer pero chequito no
2202,38956,protagonistas de principio a fin la reaccin de fernando ortiz tras la victoria en el clsico nacional frente a chivas
2203,38957,mty se orino en los tigres el abejorro humillo a las chivas meti gol el bebote que pinta para idolo metio gol sexo lvarez chequito hizo su perra al holandes cagn al rato el madrid humilla al barceroba gran da para estar vivo
2204,38958,pinches chivas pocos huevos
2205,38959,ayer se cojieron a mis poderosas chivas pero hoy checo me acaba de alegrar el fin de semana letsssgoooo
2206,38960,putas chivas
2207,38961,gan el man u gan checo nomas me fallaron ustedes pinches sin huevos chivas
2208,38962,america vs chivas y conste que le voy a tigres
2209,38963,el viernes mxico en bisbol ayer la meada del ame a las chivas en la maana los goles de santi y edson y ahora checo ganando en la f1 fin de semana redondo
2210,38964,lo que las chivas rompen en mi checo lo compone
2211,38965,gan checo gan el amrica y que chsm las chivas y verstappen
2212,38966,que chingue a su madre max verstappen y las chivas
2213,38967,ptm y al rato es el clsico de espaa donde seguramente va a perder el madrid ms tarde chivas rayadas dnde seguramente van a perder las chivas y maana mxico japn dnde seguramente pierda mxico que feo fin de semana
2214,38968,a chingar a su madre las chivas y max verstappen
2215,38969,que fin de semana ganamos en baseball inundados el zcalo y gan el checo y lo mejor perdieron las chivas
2216,38970,hoy se amaneci con ganas de orinar la playera de chivas
2217,38971,que buen fin de de semana caray mexico en semifinales de bisbol clubamerica humilla a chivas en su casa schecoperez gana el gran premio de arabia ya nada ms falta que fcbarcelona haga lo suyo para que sea un fin de semana perfecto
2218,38972,este fin de semana gan yo 1 the eras tour 2 amrica 4 2 chivas 3 pole position y victoria de chequito
2219,38973,nuevo podcast expedicin rosique 172 chivas amrica gnesis de un clsico en spreaker america bofo bravo campeonisimo chivas clasico cuauhtemoc derby futbol historia leyendas rebano yayo zague
2220,38974,triste por mis chivas mi united estabas goreddevils
2221,38975,goleada a chivas de visita gol de edson lvarez 1r lugar para checo en el saudiarabiangp fin de semana redondo para el americanismo
2222,38976,gan checo las chivas qu jaja saudiarabiangp
2223,38977,ayer el amrica deshizo a chivas hoy el siempre guila checo perez va a ganar el gp maana mxico avanza en la final de baseball que bonito fin de semana
2224,38978,tuve una semana de la verga y le dije a dianita y a jorge todo va valer la pena porque nos vamos a golear a chivas y el himno nacional se entonar el domingo estoy llorando verga
2225,38979,atencin por falso positivo del gobierno duque y su mindefensa diego molano capturados 6 coroneles policiacolombia en rueda de prensa mostraron como olla de microtrfico la vivienda de humilde anciana de pereira que estaba abandonada hace aos y deba ser demolida
2226,38980,y contigo aprend el da que te conoc chivas aunque valen verga y por culpa de amauryvz seguiremos valiendo cine
2227,38981,las convocadas de chivas para el juego ante rayadas de est tarde sigue sin aparecer alicia cervantes que se espera pueda estar en el clsico nacional
2228,38982,naaambreee jefe le pusimos una putiza a las chivas somos los mas grandes que bueno aqu te qued algo sucio campen
2229,38983,circulaenredes amrica venci a las chivas por marcador de 4 2 en el clsico nacional y los memes no han perdonado
2230,38984,que chingue a su madre max verstappen y las chivas
2231,38985,que raro hoy no veo tanta raza con su playera de las chivas
2232,38986,amrica derrota con autoridad a chivas en el clsico del futbol mexicano
2233,38987,nadie ve al amrica como ganador la gente solo respeta ms a chivas
2234,38988,ha de ser horrible irle a chivas y ser el pendejo de todo mundo
2235,38989,feliz cumpleaos comandante que tengas un gran da y que sea un ao de mucha superacin carojaramillo94 que gane hoy la cumpleaera cumpleaos carojaramillo chivas
2236,38990,el amrica pasando por encima de chivas en el clsico mexicano el club ms grande de mxico lleva 2 victorias seguidas importantsimas fuera de casa ante tigres y chivas
2237,38991,el reporte del paseo del clubamerica ayer sobre chivas en el clsico nacional
2238,38992,henry martn celebr a lo cuauhtmoc blanco la goleada a las chivas y luego tuvo que ofrecer disculpas
2239,38993,ingeniero checo llevatela tranqui no necesitas acelerar baja el ritmo checo va a frenar tu puta madre que chsm verstappen y la chivas
2240,38994,chivas de siempre
2241,38995,tiene razn no duele la derrota lo que molesta es que nuestros jugadores fueran pechos fros amauryvz deben inyectarse el verdadero adn de chivas y te doy un ejemplo de alguien que si lo porta al bofo 100
2242,38996,dardo del tano ortiz luego de la victoria de amrica sobre chivas no hablamos
2243,38997,deportesth las guilas mostraron contundencia en la casa de las chivas y le perdonaron una goleada y son sublderes
2244,38998,hay pocos aficionados de chivas que saben reconocer una derrota y no se dejan llevar demasiado al fanatismo este seor que se dice analista como enriquevonbeas actua como un porrista frustrado y que no sabe aguantar la carrilla le sugiero que apague su cel mejor abusado
2245,38999,y las chivas
2246,39000,lista la convocatoria ellas son las elegidas para el partido de esta tarde en el estadioakron
2247,39001,es domingo traigo cruda no se puso el de los taquitos y ayer perdieron mis chivas la vida es triste
2248,39002,y se sigue insistiendo a chivas le faltan delanteros de calidad cmo es posible que en los ltimos dos partidos viniendo de abajo tus esperanzas para meter gol son un defensa central y el pendejo del piojo alvarado que no mete gol as le pongas a un portero sin piernas y brazos
2249,39003,como les amaneci ese culo roto y orinado amigos chivas
2250,39004,toda la defensa de chivas parecen hermanas de la caridad de tan buenos que son para no darles un estate quieto a los delanteros del america que se burlaban de ellos
2251,39005,lo peor de chivas es que aunque la realidad les de de cachetadas no hacen nada nunca desde hace 6 aos de hecho
2252,39006,cmo les amaneci el fundillo chivas
2253,39007,henry martn aprovech para festejar su gol ante chivas como uno de sus dolos el cuauh
2254,39008,que ganas de andar como el chivas bien cogidote
2255,39009,pum y re contra pum clasiconacional clasicoregio129 clasicoregio ligabbvamx chivas clubamerica tigresoficial rayados
2256,39010,henry martn se disculp con la aficin de chivas por su celebracin el delantero del amrica henry martn se hizo tendencia durante el clsico de clsicos entre amrica y chivas despus de su polmico festejo emulando a cuauhtmoc blanco donde posteriormente se disculp
2257,39011,vergonzoso lo que pas ayer en el akron chivas se encarg toda la semana de levantar la audiencia en una estrategia conjunta con los de amarillo para opacar al clsico regio que ni nos debera importar y se nos revirti feo los nuestros ya no saben jugar un clsico
2258,39012,si no fuera por la rrrrrremetida de verga que le metieron alas chivas mi noche hubiera sido casi perfecta
2259,39013,atlas 4 0 olimpia puebla 0 4 atlas chivas 2 4 amrica arsenal 4 1 crystal palace 4 mi nuevo nmero favorito gran semana para estar vivo a bailar mi gente
2260,39014,despus de ver el clasicoregio129 esta claro que orlandocity no es ni chivas ni clubamerica ni mucho menos rayados
2261,39015,ayer la aficin le qued grande al equipo punto chivas ccp tigresoficial
2262,39016,ser infiel es como irle al chivas me da asco
2263,39017,que bueno que sigues pensando en chivas ni con la victoria de tu equipo te sacas la del rebao
2264,39018,henry martn se disculp con la aficin de chivas por su celebracin el delantero del amrica henry martn se hizo tendencia durante el clsico de clsicos entre amrica y chivas despus de su polmico festejo emulando a cuauhtmoc blanco donde posteriormente se disculp
2265,39019,no se quien me hace pasar mas coraje mis r1 o las chivas hdspm
2266,39020,ayer perdieron las chivas as que ms le vale ganar al barcelona porque si no entro en depresin
2267,39021,lo nico grande que le queda a mis chivas desde hace aos es la aficin
2268,39022,justo en lo personal esperaba un partido ms parejo peleado y competitivo por ende un empate era el marcador ms viable y tendencioso pero el amrica tiene algo que no tienen ests chivas y es una ofensiva enchufada y un delantero en su peak
