,Id,Tweet
211,47819,no s quin ha sido una peor mentira si mozo o emilio lara vaya que son malitos en defensa
212,47820,cabecita se cans de atraer a mozo y atacar ese mismo espacio henry y diego por dentro hicieron cuanto quisieron a primera intencin
213,47821,not martinoli comparando a lara con mozo
214,47822,el olor horrendo que hay en el puerto de mar del plata pero por ver al mozo del minipez me banco ese olor mi vida entera
215,47823,a mozo lo llegaron a pedir para la seleccin solo por una buena eliminatoria vs america
216,47824,y tiene razn martinoli lara es una especie de mozo ms preocupado por atacar que por defender
217,47825,jajajajajaj ya se orino martinoli en ese pendejo y de paso a mozo
218,47826,lara es nuestro mozo
219,47827,mozo haba sido el mejor de chivas qu bueno por emilio que aprovech uno de sus centros lo que nadie de chivas supo
220,47828,no pudo desaprovechar un centro de mozo y meti autogol
221,47829,cisneros a marcado mejor al cabecita que mozo y ni lateral es
222,47830,quisiera decirle a mi amigo richard a quien su novia pblico una foto juntos que se ven lindos pero ella le pega cacho a mi amigo albeiro quien sube foto con su cuchy barbie que se le est tragando el colgeno pero yo digo eso cuando me tomo 50 cervezas y apenas llevo 49
223,47831,colombiavamal eso lo ve hasta un nio pero si los petristes votaron por un guerrillero terroristam19 pueden seguirles mintiendo pueden encontrar a la mujer con otro en la cama y el mozo les dice q es culpa del gobierno pasado y lo creen q nivel de fanatismo y de idiotez tienen
224,47832,ptm me quera mear en mozo con esta de lara y ya no voy a poder me lleva la chingada
225,47833,la asistencia de mozo jajajajajajaaj
226,47834,quejas como mozo la gente que se apoya apoya en la barra cuando hay bandejas para lleva y la que se queda en el medio de la puerta dejame pasar o te tiro el cafe encimaaaaaaa
227,47835,terrible lo del pocho terrible lo del oso terrible lo de beltrn terrible lo de mozo terrible lo de chiquete terrible lo de paunovic elclasicodemexico
228,47836,ese alan mozo no es el que fue vendido como el doble de roberto carlos
229,47837,dolorosa derrota pero q sirva porq andaban muy sobrados hocicones culpables todos porq pauno pudo cambiar despus del segundo gol
230,47838,esto no estuviera pasado si hubieran contratado un buen 9 para rematar los centros de mozo
231,47839,mozo le est jugando al verguero con el cabecita y ese wey lo va a volar alv jajaja y lo voy a gozar
232,47840,que chsm el wacho tiba y mozo
233,47841,alan mozo cuando ve que viene el cabecita
234,47842,yo viendo a alan mozo defender de la chingada regalar la espalda y ser la avenida de la defensa
235,47843,nadie absolutamente nadie el mozo que lindos son tus piecitos
236,47844,mozo y 10 ms pinches chivas sin identidad
237,47845,jugadores pocos huevos piojo mozo oso wacho los 2 pendejos cisneros chiquete guzman vega me dan asco nunca olvidar est humillacin putos jugadores tibios pocos huevos
238,47846,a qu hora se expulsa mozo por tirar una patada voladora
239,47847,mozo lo pueden confundir con un taco de cagada y no pasa nada es malsimo ajjajaja
240,47848,mozo quiere pelea no le queda de otra
241,47849,jajaja alan mozo sigue trayendo atorada la del cabecita desde que estaban en pumas y cruz azul
242,47850,mozo bien emputado jajajajja
243,47851,jajajajq el cabron de mozo anda emperrado
244,47852,calca de los tres anteriores pero ahora en derecha qu facilidad de mozo y caldern para ser atrados y qu psimo manejo tienen de la distancia contra su central cuando rival abre baln a banda y lo mismo de antes prdida drama en transicin aun as no es de 0 4
245,47853,alan mozo y sepulveda hoy jajajajaja
246,47854,que malo es ese mozo jajaja
247,47855,le dije a mi padrino que el mozo fue conmigo a la primaria y que siempre me pareci lindo y despus lo llam para decirle eso
248,47856,cisneros es un cono mozo y rodrguez se estn partiendo la madre peleando el baln y l noms se queda viendo
249,47857,jajaja ese mozo es un chiste
250,47858,hay que seguir atacando a mozo ah est la va libre
251,47859,mozo no sabe ni por dnde le pasa el cabecita los centrales vaya actuacin pocho habl antes del juego hasta el momento solo aline vamos a ver en el segundo tiempo la delantera de chivas no existe no pasa nada as es difcil el que intent fue alvarado
252,47860,cada ves me creo ms la de que alan mozo es el trent alexander arnold mexicano
253,47861,el amrica est haciendo ver las grandes deficiencias de chivas sobre todo en su delantera los nicos que juegan son nen beltrn y mozo los dems perdidos la defensa central un asco
254,47862,carlos cisneros no sabe ni a quin marca est perdido por esa banda todo es su culpa y adems de que mozo est bien menso
255,47863,lo de mozo hoy
256,47864,la verga del zague es ms grande que la carrera de mozo chisguete beltrn chicote
257,47865,alan mozo lateral de chivas es una verdadera papa ojal lo vea el tuca para cuando juguemos con las chivas es un lateral psimo que se lo trag enterito el cabecita por cierto gracias ordiales por evitar que el cabecita regresara a la mquina
258,47866,todo lo que pudo salir bien sali bien repito este amrica es demoledor en ataque cabecita est en un momento excepcional est detectando las carencias defensivas de mozo y logra ponerse de cara al arco adems ha resuelto a la perfeccin las jugadas
259,47867,lo lindo que era el mozo que nos atendi flechadisima quede
260,47868,te estan entrando por la banda de mozo por que este sale mucho el oso no tapa bien a valdes y el tiba esta mas centrado en tapar a henrry y dejas a cabecita solo as los 3 goles calleron y no diste rdenes para cambiar eso muy mal hoy paunovic
261,47869,cambiemos medrano por alan mozo
262,47870,se les dijo y se les dijo que alan mozo no defendia y era un problema y lo querian en seleccion y titular porque no eso no era tan importante
263,47871,viendo jugar a mozo me hace sentir que soy una verga en la lateral
264,47872,los dos cisneros oso mozo y guzmn lamentablemente en este primer tiempo del clsico se arrugaron tanto hablar para ests pendejadas chivas
265,47873,toy en el 15 de una prima y el mozo me dijo q la barra abre a las 2
266,47874,culpa total de los cisneros oso desaparecido mozo ni se diga ves a la banca y te encuentras a daniel ros la morsa flores y chapo snchez
267,47875,sigo viendo la repeticin y no entiendo que vergas quiso hacer mozo en cuanto valdez recibe el pendejo se echa un pique hacia adelante y deja al mesobas solo
268,47876,mozo chingas a tu madre
269,47877,y toda la plata que tiraron en la semana mejor en un centro delantero que te remate el 30 de lo que tira mozo al rea y pum
270,47878,nos queda morirnos de algo despus de este primer tiempo donde malos posicionamiento han sido los causantes de los goles mozo con su psrtido ms flojo al igual que pocho nos queda ir y pelear e intentar por difcil que parezca algo de este partido
271,47879,las guilas teniendo una fiesta por la banda de mozo poco y nada de guzmn en la primera mitad y sera algo imposible pedirle ms al oso gonzlez con lo limitado que es los jugadores del amrica son mejores y saben mucho mejor juegar este tipo de partidos
272,47880,le estn comiendo el mandado a don centros mozo ni sus luces y por ah estn chambeando
273,47881,foto con el mozo losquincededelficp
274,47882,una avenida lo que es mozo
275,47883,mira podran hacer un mapa de todas las provincias feasfeas en las que jugaron estando en la segunda a categora
276,47884,mozo no le ha visto ni el polvo ptm
277,47885,mozo y nene solo estan jugando esta muy disparejo el partido
278,47886,los dos cisneros deben estar fuera de chivas no se puede jugar con 9 desde el inicio y ms chicote vive de sus chicotazos beltrn slo sabe girar sobre el baln mozo no puede defender chiquete y oso hoy perdidos y el pocho se puso muy hocicn qu lamentable chivas
279,47887,gran partido de alan mozo
280,47888,el debut de luis puente es cuestin de tiempo igual el nombre de carlos cisneros en la lista de transferibles partido de pesadilla para mozo el amrica est haciendo una fiesta por su costado alvarado inicio mal pero cerr los primeros 45 como lo menos malo
281,47889,mozo es un muertazo no me voy a cansar de decirlo
282,47890,esa avenida llamada alan mozo como la extraamos en el pedregal
283,47891,mozo ha sido la perra del cabeza tiba y chiquete de los dos no se hace ni uno charal no es delantero
284,47892,espero que mozo despierte para el segundo tiempo
285,47893,el primer tiempo del clsiconacional ha sido una pesadilla para alan mozo duda en la marca del primer gol y lo superan en el mano a mano en el 0 3
286,47894,an me da risa que queran a alan mozo en la seleccin
287,47895,dice el cabecita que no tenia en el radar a alan mozo
288,47896,oso chiquete cisneros la avenida que deja mozo que pierdan por pendejos
289,47897,alan mozo haciendo una exhibicin digna del dedos lpez vs sambueza
290,47898,solo entre valdez y rodrguez han destrozado a mozo y orozco el chiquete de repente da unos partidos infames
291,47899,y dnde est el pocho guzmn s est jugando el cabecita tiene de hijo a alan mozo clasiconacional
292,47900,le echan la culpa a mozo pero siempre lo agarran entre 2 el dt nunca identific eso
293,47901,en diciembre no pudo ver a bad bunny y hoy no ha podido ver al cabecita alan mozo rodrguez
294,47902,el problema es que mozo te da un mal partido y su suplente es el chapo en fin parte del proceso
295,47903,mozo est jugando como la vez del 6 1 jajajajajajaj
296,47904,incluso yo con la rodilla chingada y todo mando menores centros que mozo
297,47905,que diablos pauno no se da cuenta que la lateral de mozo est siendo destrozada desde el minuto 5 que miserable se ve el ataque de chivas con los 2 cisneros ahora si vega va si o s
298,47906,partidazo de alan mozo con dos goles y una asistencia
299,47907,todo lo que se vena haciendo hoy desapareci salvo algunas irrupciones de mozo poco y nada para atacar y el capitn nada
300,47908,hoy paunovic ha pecado demasiado era claro que mozo iba a sufrir muchsimo ante rodrguez ni siquiera ajust antes de que viniera la tormenta y ahora est como est la cosa chivas tambin ha dejado de presionar alto que era su gran virtud ortiz le est dando un bao
301,47909,por eso a mi no me gustan esas mamadas que los jugadores salgan a calentar los partidos por que luego son los primeros jugadores en desaparecer claro ejemplo de mozo y el pocho guzmn que slo han dado ptina este primer tiempo
302,47910,jugadores como piojo nene guzmn caldern mozo etc hoy se deben de ver en estos partidos aqui es donde deben de pesar y resolver
303,47911,chivas le dur 41 minutos al amrica que paliza de los cremas el cabecita rodrguez ha hecho trizas a mozo hoy no le ha salido al rebao
304,47912,perdn pero america est aprovechando que tiba mozo y cisneros estn en saturno
305,47913,simplemente estn comiendo la banda de mozo cabecita est imparable nene beltrn no puede apoyarlo y adelante no est encontrando socio y pocho guzmn este 1 er tiempo se perdi chivas cada de realidad
306,47914,alan mozo quiso salir de pumas por mi que lo orinen jornada a jornada y eso siempre se va a celebrar
307,47915,metanme a jugar le meto mas que el mozo
308,47916,la semana pasada cabecita rodrguez se burl de diego lainez el da de hoy est humillando a alan mozo doblete asistencia ante chivas y figura del torneo seoras y seores jonathan cabecita javier rodrguez le di la 7 a cruz azul le dar la 14 al amrica
309,47917,alan mozo debe ser uno de lo peores laterales del ftbol mexicano es una avenida
310,47918,qu flojito alan mozo en el 0 1 y en el 0 3 en el primero falla en su posicionamiento duda en el tercero lo superan muy fcil en el 1vs1
311,47919,alan mozo da un asco indescriptible defendiendo que perro coraje
312,47920,lo que no se entiende de alan mozo es que desde que debut en pumas se sabe que defender no es su fuerte siempre ha sido ms de ataque pero alch ya debera de hacer algo para que no lo exhiban de esta manera es una pena porque es un gran jugador pero le cuesta esa parte
313,47921,una basura lo que esta jugando chivas esta noche pinche alan mozo infame clasiconacional chivas
314,47922,estn cagados estos morros principalmente el capitn solo mozo se present a jugar hoy
315,47923,y la lateral de mozo es una avenida madre ma
316,47924,cabecita rodrguez esta haciendo lo que quiere con alan mozo 2 goles y uno de surez y amrica golea 3 0 a chivas al medio tiempo marcador engaoso pero chivas no ha definido las que tuvo sobre todo 2 que tuvo
317,47925,pero que tal mozo cotorreando a toda madre durante la semana en el tiktok de chivas jajaj
318,47926,va pero no toquen a mozo por favor elclsicodemxico
319,47927,beltran y mozo contra el mundo
320,47928,mozo cada que se acerca el mesobas con baln controlado por su banda
321,47929,chivas le urgen cambios mozo es una coladera ambos cisneros son irrelevantes al menos 4 cambios para este medio tiempo
322,47930,el nivel de mozo hoy
323,47931,de verdad varios juegos seguidos jugando bien y con oportunidades buenas y en este mozo es lo salvable de la defensa los partidos importantes no se juegan as pendejos lptm de verdad les gusta no echarle ganitas
324,47932,es que no mamen tienen un portero que le dicen el wacho un defensa que le dicen chiquete al tronco de sepulveda y al briago de mozo en defensa as quieren competir y se los dice alguien al que su equipo le metieron 7
325,47933,mozo es una caricatura jaja
326,47934,a pocho a mozo y chiquete les peso de a madres el clsico pero de muy culero has de cuenta que con miedo obvio entra alexis hoy no
327,47935,bueno tengo que agregar al chicote al chiquete a mozo a l oso a sepulveda a ronaldo xd
328,47936,la diferencia sin duda la calidad en los de enfrente cabecita rodrguez ha exhibido la faceta defensiva de mozo
329,47937,mozo y guzmn una verdadera burla en todo el puto partido y sin centro delantero las chivas gdl 0 3 ame
330,47938,alan mozo otro invento ms de pumasmx jajajajajaa
331,47939,tres claves para la goleada del amrica sobre chivas el dinamismo no aparece el pocho y el baile que le est dando cabecita rodrguez a mozo
332,47940,y hay gente que nos quera pintar a mozo como el mejor lateral mexicano
333,47941,el cabecita est haciendo con mozo lo que quiere lo baila lo exhibe lo hace correr lo hace arrastrarse y as sin ms por su lado ya cayeron 3 goles maldita sea
334,47942,ni guzmn ni mozo ni wacho vyanse alv
335,47943,ay mozo ay mozo siempre entregndole las nalgas al me sobas rodrguez y media liga mx no s qu hubiera sido de mxico si hubieras ido a qatar que bueno que te fuiste de pumas puto tronco
336,47944,mozo es el nico que se present a jugar
337,47945,que horrible partido de mozo
338,47946,alan mozo viendo que los dos primeros goles cayeron por su banda y en el tercero lo dejaron como pendejo en los tres lo han dejado como pndjo
339,47947,madre ma cabecita rodrguez trae de cliente a alan mozo mejor dicho a todas las chivas
340,47948,el cabecita rodrguez est haciendo con mozo lo que el pony ruiz haca con el maza rodrguez
341,47949,la banda de mozo es una avenida rodrguez aparece siempre solo a su espalda
342,47950,ese mozo que le regalen la playera del cabezita por que es una avenida vamosamerica
343,47951,solo los pendejos de pumas mamaban a alan mozo
344,47952,hay que reconocer que memo ochoa le hizo la carrera a alan mozo sin el mozo ya ni jugador de primera divisin sera
345,47953,el partido de chiquete orozco es lamentable y el de mozo casi lo mismo desdelacuna clasiconacional chivas america
346,47954,le pueden ensear a mozo a defender y no hacer dinamicas pendejas
347,47955,tremendo baile que le est dando el cabecita a mozo jajajaja y el avestruz a las chivas
348,47956,qu baile le estn poniendo a chivas jajajakaja me quiero morir ni mozo ni chiquete y el otro wey no defienden nada xd
349,47957,avenida alan mozo liiiiiibre libre libre
350,47958,la fiesta que se est dando amrica por el lado de alan mozo s ese lateral que ya pintaba para el barcelona o real madrid
351,47959,jaja todos los goles por la banda del pendejo de mozo
352,47960,alan mozo es una cagada total jajaja
353,47961,exhibicin de jonathan rodrguez qu forma de destrozar la zona intermedia izquierda de chivas castigando a alan mozo atrayndole y usando su espalda y luego explotando genial la horrible defensa ante centro pase lateral y posible rebote as el 0 2 y 0 3 calcados
354,47962,que vergenza la defensa del guadalajara empezando con alan mozo hoy el cabecita se ha dado un festn con el ex pumas
355,47963,qu le pas a alan mozo
356,47964,alan mozo es la mayor basura que han visto mis ojos
357,47965,qu baile le estn dando a mozo
358,47966,qu pedo con alan mozo sali a tragar verga
359,47967,mozo es una avenida ya basta
360,47968,marcador quita tcnicos nada de solapar chivas est dando el culo jugadores como charal nene mozo alvarado
361,47969,el pendejazo de mozo y su copa elimin al amrica en cuartos de final
362,47970,ya mi pariente rodriguez est jubilando a mi tocayo mozo
363,47971,el cabecita se est vaciando en alan mozo
364,47972,alan mozo es una avenidaaaaaaaa no mamen
365,47973,jajaj pinche mozo como lo traen de a su perra
366,47974,insisto se estn tragando a mozo
367,47975,y su mozo jajaja pauno papito todas las jugadas son por ah
368,47976,pendejos
369,47977,mozo muertizimo hoy
370,47978,mozo nunca est en su lugar
371,47979,vali madres no haces cambios cuando te estan atacando esa banda por que mozo sale mucho por que el oso esta muy adelantado y el tiba se est aventado un 2 vs 1 entre henrry y cabecita
372,47980,otra vez la jugada por el lado de mozo
373,47981,jajajajajajajajajs mozo se acord cmo jugaba en el club universidad
374,47982,desde que empez el partido mozo se convirti en el chapo y no modificaron que chingados esta haciendo paunoy todo su ct ya van 3 goles no les quiero contar ms
375,47983,el nico que hace algo es mozo los dems son unos pendejazos
376,47984,ya mnimo que mozo le parte una pierna a cabecita
377,47985,ooootta vez por la derecha alan mozo est perdidisimo
378,47986,se estn comiendo a mozo y no hay reaccin vale verga que sea el primer tiempo scalo ya chingada madre
379,47987,se me hace que a mis chivas chivas el clubamerica amrica nos va a dar hasta pa llevar alan mozo trae un desmadre en la defensa
380,47988,la banda de mozo es una avenida
381,47989,alan mozo est regalando el partido con su peor actuacin en el torneo con chivas
382,47990,pinche equipo mierda chivas tiba mozo cisneros cisneros wacho lrguense son una basura
383,47991,pinche mozo vales v
384,47992,todo el ataque ha sido del lado de mozo y nadie lo cubre el wey muy bien al frente pero para defender madre ma
385,47993,el lado derecho de chivas es una avenida mozo sube mucho y cisneros se queda arriba y no baja toda responsabilidad del tcnico q no se a dado cuenta y nos metieron 2 goles
386,47994,chiquete y mozo has de cuenta que les robaron sus putos poderes a los hijos de sus putisimas madres
387,47995,ay mozo traveeeeeezzz
388,47996,se acab tanto andaban mamando y de habladores no hay defensa mozo un pechofrio lo mismo de siempre el archirival nos pinta la cara en nuestro perro estadio chinguen a su puta madre
389,47997,si mozo no puede que metan a mayorga esa banda es una avenida para las chivas
390,47998,amrica 2 mozo 0 los dems no se presentaron a jugar
391,47999,pobre mozo mandando 20 centros a 3 extremos metanme a mi de delantero no mames
392,48000,te veas mejor en pumas mozo
393,48001,pt mozo no te puedo odiar kbron
394,48002,mozo y 10 ms est noche
395,48003,pero sigue de puto mamador y hablador mejor ponte a jugar mozo pendejo
396,48004,puta madre se estn deborando a alan mozo
397,48005,mozo esta jugando cmo en mis pumas desdelacunaa aztecadeportes ojal ganen las chivas y maana mis pumas
398,48006,alan mozo muy bien en recuperacin y en ataque pero tres veces seguidas se la hizo el cabecita
399,48007,que lindo es el amor jajajajaja hoy me enamore de mi mozo jajajaja
400,48008,error y horror de mozo de primaria
401,48009,avenida mozo
402,48010,desdelacuna duro dos horas haciendolo bien rico como mozo
403,48011,mozo mozoooo que hermosoooooo alan mozo51
404,48012,bien mozo mal cisneros
405,48013,no te puede ganar un equipo que te juega con mozo y el oso jajajaja
406,48014,q golazo del cabecita pero que mala marca de mozo no puedes salir como defensa si tienes una marca en la espalda hace mucho no vea fut mexa q no fuera al atlas
407,48015,mozo tiene estas cosas por ms el buen nivel que vena mostrando despus cisneros tendra que ayudarle y pauno haberlo identificado fueron tres jugadas donde cabecita siempre tuvo la facilidad de decidir lo que l quera
408,48016,alan mozo en el gol del amrica
409,48017,amrica haba buscado un par de veces ese 1 vs 1 de cabecita contra mozo y le funcion aqu cambi la jugada a la izquierda otra vez y deriv en el 0 1 contra chivas buenos minutos del uruguayo al encarar y activar el desdoble de un compaero o enganchar y rematar
410,48018,mi pelo llega amor mi mozo se puso a llover pero no importa ya voy por usted mi amor
411,48019,2 jugadas prcticamente iguales que le aplican a mozo no mms
412,48020,mala marca de mozo pero golazo de cabecita rodrguez que recibe de diego valdz y con un tiro de billarista la pelota golpe la base del poste y entra a la portera de wacho chivas 0 1 clubamerica 17
413,48021,deseo que el cabezn le pegue un patn a mozo
414,48022,a mozo le quitas aquel juego contra el america en liguilla y te queda el chaka rodrguez
415,48023,mozo se burl solo en el gol
416,48024,mozo anda perdido
417,48025,mal el posicionamiento de los laterales de chivas mozo y chicote dejan espacios cuando se trata de defender america aviso y en esta si vacuna
418,48026,pinche mozo hasta pareciera que estaba jugando en mis pumas
419,48027,diego a los costados del oso mozo sale para tapar y descuida en su espalda a cabecita ya lo haba dicho y valds tard poco en confirmarlo est puede ser una de las claves para nuestro partido
420,48028,tres jugadas claras de peligro tres donde alan mozo ha sido atrado con mucha facilidad por hombre del amrica que llega a zona intermedia acaparando mirada y permitiendo a hombre abierto llegar profundo y cortar dentro una a la horquilla otra al palo y dentro terrible
421,48029,adis alan mozo te ir mejor en el guila de progreso industrial
422,48030,la papa est por la banda derecha con ese muerto de mozo y ya se dieron cuenta ptm
423,48031,excelente definicin del cabecita amrica explota toda las carencias en defensa de alan mozo desde el minuto uno
424,48032,error de mozo me parece sali a presionar y descuid su espalda cabecita pone el 1 0 lo que vi y la repeticin del monitor del palco
425,48033,y si le dicen a mozo que se vale marcar que de eso se trata su posicin
426,48034,jonathan rodrguez lleva 3 partidos haciendo casi el mismo gol contra atlas tigres y ahora chivas alan mozo no se la aprendi y seguir siendo el defecto eterno de mozo muy bueno al ataque pero en defensa cmo sufre
427,48035,tres veces hicieron la misma hasta que les sali me tiene decepcionado alan mozo
428,48036,y mozo pues
429,48037,iban 15 de absoluta superioridad del amrica diego valds ya haba puesto una en la horquilla y ahora otra vez encuentran espacio cero sorpresas a la espalda de alan mozo gran definicin de cabecita rodrguez
430,48038,ahi est tu mozo futboltuber siguelo inflando wey
431,48039,mozo hoy anda perdido
432,48040,que cagada es alan mozo para defender ya van dos jugadas donde queda como un verdadero pendejo
433,48041,el partido de mozo ha sido infame todos los ataques han llegado por ese sector aunque tambin hay que ver si es slo su responsabilidad o si tambin es responsabilidad del extremo que no le ayuda
434,48042,mozo perdido piojo que chingados hace jugando no hay idea carajo falta de huevos
435,48043,mozo te est quedando enorme el escenario cagones en el clsico no
436,48044,lo de mozo jajajaja
437,48045,3 veces el america intento la misma jugada y mozo nunca se dio cuenta charal no ayuda por esa banda chivas
438,48046,16 gooooool de clubamerica jonathan rodrguez aprovecha la desatencin de mozo y abre el marcador 0 1 clsiconacional
439,48047,este gol fue responsabilidad de alan mozo
440,48048,se comieron a alan mozo
441,48049,atlas tiene que atacar la banda de mozo
442,48050,qu puto golazo del ame en parte gracias a lo pendejo que es mozo defendiendo
443,48051,y el pendejo de mozo cagndola jajajajaja que gozada
444,48052,no mames mozo te han hecho la misma 5 veces no es posible que no te la aprendas
445,48053,malsimos minutos de alvarado error de mozo en el gol por anticipar deja solo a rodriguez
446,48054,error de mozo en la marca sobre el cabecita rodrguez y ya lo ganan aquellos 1 a 0 al 18
447,48055,mozo haciendo un anthony davis classic jajajaja es una maldicin bro
448,48056,al parecer mozo sigue sin entender como defender quiere atacar sin baln
449,48057,el vrtigo del amrica dej muy desajustada la zaga gonzlez se pierde con el pase clave mozo salta en un psimo relevo y rodrguez hace una joya de gol si bien eso era un riesgo calculado ya no hay margen de error
450,48058,mozo al nico que no lo tuvo en su radar fue al cabecita jajajajajaj todo idiota
451,48059,mozo intent hacer el 2 contra 1 pero dejo solo al cabecita pobre cabrn
452,48060,vaya remate muy buen gol de el cabecita rodrguez mozo corta mal en ese movimiento y le gana la espalda el extremo del amrica lejos de eso muy buen remate vaya perfil
453,48061,chivas le quit a mozo lo mejor que tena y lo puso a defender
454,48062,pinche mozo pendejo
455,48063,puto mozo como vas a dejar solo al cabecita ah
456,48064,que carajo intent mozo
457,48065,mozo ests perdido pap
458,48066,mozo perdiendo su marca no importa cundo leas esto
459,48067,jajajajajajajajajjajajajqjajajajjajaja cabeza mete el primero entre el oso y mozo hay un poooozo jajajaj
460,48068,mozo haciendo homenaje a trent alexander arnold
461,48069,que bonito gol del cabecita amrica estaba ms claro a la ofensiva creo que mozo se equivoca descuida la marca
