,Id,Tweet
0,3182,el club de los 100 podios estos son los pilotos que lo conforman 191 lewis hamilton 155 michael schumacher 122 sebastian vettel 106 alain prost 103 kimi raikkonen 100 fernando alonso rg internet press
1,3183,frontier esa generacin nueva tacoma tiene ms de diez aos solo con actualizaciones pero sin una una generacin y eso se nota en espacio manejo y equipo
2,3184,es muy bueno acabados el motor es genial solo no esperes mucho espacio o que sea rudo un vento es ms para terracera que un 2008
3,3185,este viernes hacemos reestreno revancha contra edesur con fiestaaaaa para perrear fuerte en planta incln quien viene
4,3186,la productora argentina victoria alonso dej marvel studios luego de 17 aos infobae
5,3187,alonso lo borro a ruglio y pearol queda fuera del ejecutivo de la auf
6,3188,un muy feliz cumpleaos para paolina100 psala bien paola
7,3189,del barco de emmanuel ojeda no baja nadie silencioso pero cumplidor
8,3190,un muy feliz cumpleaos para nat cv psala bien natalia
9,3191,hay cosas tan deliciosas como estas que no deben dejarse de ver
10,3192,se me ponen los pelos de punta cada vez que escucho las maquetas del disco que estamos haciendo
11,3193,lacasadelbeisbol saludos a tijuana familia lpez espinoza excelente transmision
12,3194,lacasadelbeisbol vamos mxico por el pase a la final
13,3195,wey quiero tatuarme jajaja
14,3196,comienzan a salir verdades detrs del despido de victoria alonso al parecer ella es la responsable del ambiente txico detrs de los efectos de las pelculas de marvelstudios premiando a los que la obedecan ciegamente y arruinando las carreras de otros va chris lee
15,3197,francia bien hara el actual gobierno francs en sentarse a dialogar con su pueblo y hacerlo pronto
16,3198,que se sepa en el ltimo periodo tenan un 17 de asistencia
17,3199,14 8 1984 olarticoechea nicosia borelli gay y teglia gallego enrique alfaro francescoli alonso y gordillo estadio luis casanova valencia
18,3200,este pequeo momento se llama felicidad
19,3201,matias vidangossy alcanz a estar 22 en arica en el partido de san marcos vs san luis sacadisimo y al borde de la expulsin estos los motivos para que bozan lo saque y cuide el 11vs11
20,3202,de ltimo momento el medio vulture da ms informacin sobre la salida de victoria alonso de marvel studios victoria fue particularmente responsable del ambiente de trabajo txico dentro de los departamentos de vfx de marvel
21,3203,lvaro muy grande has sido una nminacion fcil para tu equipo que o se dan cuenta quin es su equipo o lo pasarn mal conquis10etb
22,3204,abro hilo de personas con las que me he besado en la peda
23,3205,la mente divagante la mente del mono por braulio jatar
24,3206,alonso es buena opcin pero est por delante de ral lo de tuchel no lo veo tan claro
25,3207,mi estabilidad emocional depende de 9 weyes en un diamante
26,3208,guardiola es malo mourinho es bueno xavi es malo xabi alonso bueno un patron que viene desde traumas del pasado y que es bastante predecible
27,3209,hermosa la poca caldernica con la polica federal inundada de delincuentes preciosos tiempos aquellos a mediados del mes de noviembre de 2014 toda la polica federal destacamentada en el sur de tamaulipas toda estaba vinculada con los delincuentes
28,3210,como cuando dios te da el don de la es ay espera que dios no existe
29,3211,libertad y orden
30,3212,qu buena vuelta al defectuoso para ver a los chilipeppers
31,3213,xavi alonso como dt est sorprendiendo en alemania cuidado con el bayer 04 leverkusen
32,3214,me niego a la narrativa en que victoria alonso es la villana
33,3215,hijo de tigre sale pintado
34,3216,alonso ha hecho 2 podios si los juntas 3ro 3ro 33 ya paro perdon
35,3217,por fin en la realidad
36,3218,echa un vistazo al vdeo de gabriel alonso tiktok
37,3219,un presidente que divide a su pueblo no es digno de la investidura y si pasar a la historia
38,3220,hoja todos hagamos esto las cubanos se rrespetan abajo l9s singaoos dictadores echa un vistazo al vdeo de gabriel alonso tiktok
39,3221,como xabi alonso sea entrenador del real madrid os vais a enterar de lo que es la verdadera xabineta
40,3222,el primer punto de quiebre fue cuando de adolescente mi mejor amiga me dijo que su to era gay en mi vida escolar la homosexualidad era un insulto nunca una persona acaso le diras eso a mi to y pues no no podra sent vergenza empec a cuestionarme y nunca par
41,3223,pues habis quedado todos bien retratados con el tema de victoria alonso jojojojojojo si es que os pueden las prisas con lo buena que era la persona ms importante para la igualdad la nica que luchaba por la inclusin muy mal marvel
42,3224,oh fernando alonso la ilusin y la alegra desatada en el box de aston martin tras el segundo podio de la temporada para fernando alonso saudiarabiangp
43,3225,alguien puede re enviar esto este mitmano que escogieron es cosa seria
44,3226,si alonso ha vuelto a tener un coche competitivo pq mourinho no puede volver al real madrid
45,3227,fernando alonso i padre de espaa
46,3228,vaya instinto criminal no me gustara encontrrmela en un callejn obscuro o ustedes si
47,3229,xabi alonso tiene que ser el prximo entrenador del real madrid
48,3230,tener la cara de cemento armao descripcin grfica
49,3231,y esta es la cara q se t queda cuando fernando alonso t invita a unas cervezas
50,3232,para m es tarico
51,3233,ay wey victoria alonso pas muy rpido de hroe a villana de dolo latinoamericano a una mierdita de persona
52,3234,fernando alonso la fia me quita el podio y me lo devuelve de madrugada pensaron enterrarnos sin saber que ramos semilla
53,3235,son el himno nacional mexicano en arabia saud sergio checo prez consigui la victoria en el gran premio de arabia saud el mexicano obtuvo el primer podio mientras que su compaero de rb max verstappen qued segundo y fernando alonso tercero saudiarabiangp
54,3236,20mar con equipos para la salud bucal de la poblacin en losaltosmirandinos dotan al servicio de odontologa del hospital vsr verificaron su directora dra maricruz linares y el director estadal de hospitales dr alonso quevedo guillenmarelia juntoscontralasmafias
55,3237,cap semanal parece que quiere visitar el bloque de los 5570
56,3238,dios no te pido mucho solo quiero una relacin como la de jim y pam
57,3239,ya va ganando el bucaros
58,3240,chiringuitovar dice jos lvarez que nos hemos credo que roban al madrid por los guionistas de real madrid tv y lo dicen ellos que llevan toda la vida creyndose que espaa les roba porque lo dijo puyol ver para creer
59,3241,no pasan los 30 grados de ac a una semana chau soy felz
60,3242,ni enterado estaba que aparezco en el google maps jaja
61,3243,deportes alonso cometi un error a la hora de colocar su coche en la parrilla de salida por lo que fue penalizado con cinco segundos
62,3244,jajaja jairito o amigo de las chaquetas celebrando el primer gol del bucaros por win sport
63,3245,todo es muy trambolico s o qu
64,3246,esto es muy irnico de ser cierto alguien pensara que victoria alonso seria mejor persona al siempre estar promoviendo a las mujeres comunidades lgbtq y buscar la diversidad en marvel studios pero resulta que es una jefa txica con mal ambiente laboral para vfx
65,3247,dignidad
66,3248,victoria alonso productora argentina dej marvel studios tras 17 aos
67,3249,y ora pa onde nos mudamos porque el zcalo ya nos qued chiquo chiquo
68,3250,marcmarquez93 admiro mucho a fernando alonso cuando tienes el coche y ese talento nos hace disfrutar mucho
69,3251,estoy planificando mi primer viaje sola y nunca tuve tanta adrenalina junta
70,3252,la concha de tu madre alonso
71,3253,estoy muerto pero este fin fue una locura
72,3254,colombia patria te llevo con amor en corazn creo en tu destino espero verte siempre grande respetada y libre en ti amo todo lo q he querido tus glorias tu hermosura mi hogar las tumbas de mis mayores mis creencias el fruto de mis esfuerzos y las realizacin de mis sueos liberta
73,3255,pablo alonso logramos levantar la imagen de la liga correntina
74,3256,esto de las radios con mensajes distintos ya le ocurri a pechito37 con alo oficial en le mans 2018 se acuerdan conservar el ritmo durante la noche le dieron al cordobs y alonso volaba sin que el supiera ni pudiera defenderse politics
75,3257,shocker marvel studios veteran victoria alonso exits exclusive via thr marvel
76,3258,el telfono chao jajajaj
77,3259,el cagazo q me da q sea posta lo de victoria alonso
78,3260,bochorno en f1 fernando alonso recupera su podio 100
79,3261,los jugadores del barcelona que no fueran convocados con su seleccion ferran torres jordi alba eric garcia busquest ansu fati pedri ronald araujo frenkie de jong sergi roberto marcos alonso iaki pea dembele raphinha pablo torre
80,3262,que da de mierr
81,3263,los polticos siempre tendrn este capricho su opcin es dejar a los ciudadanos sin sus ahorros para poder ser ellos los beneficiados as que lo mejor es que ellos no toquen nuestra pltica con su mala reforma de pensiones lareformanosroba
82,3264,quisiera que entendieras lo que hiciste conmigo
83,3265,dembel debi ser expulsado ante real sociedad y getafe kessie ante elche raphinha y busquets ante cdiz marcos alonso ante valencia as estn 12 evitando expulsarlos para que ganaran 3 puntos y ante el madrid valen todo tipo de agresiones as ganan robando chiringuitovar
84,3266,como vas a hechar a victoria alonso estan del orto
85,3267,por compromisos no agarran voy a revivir este tuit en tres meses a ver cuales eran los compromisos de mohamed y alonso me suena todo a un plan maestro de decir que no quiso agarrar nadie para dejar al impresentable de monzn
86,3268,ya no te iba a ver gh23 hasta la final o capaz no por la pavada de los que ingresan y el acomodacho ahora con la complicidad del silencio en un caso de trata y abuso ya no te miro ms este programa de cmplices
87,3269,revelado victoria alonso fue responsable del ambiente txico dentro del departamento de vfx de marvel el informe revela que solo le daba trabajo a los equipos que a ella le gustaban y si la hacas enojar te congelaba para siempre
88,3270,chiringuitovar es como la sancin de alonso pone el gato pero no trabaja en el hasta que no pasa los 5 segundos
89,3271,dursimo cruce entre bordaberry y ruglio el presidente de pearol apunt contra l alonso y lugano
90,3272,logr terminar un ensayo que me estaba costando demasiado hacer
91,3273,mal aitor que te has cargado a un compaero que alvaro es de tu equipo y no tu enemigo conquis10etb
92,3274,maana a clase otra vez
93,3275,mmm lo de victoria alonso tiene pinta de fake pero al mismo tiempo estoy esperando que salga gente a confirmarlo porque me encanta el chisme jujuuuu
94,3276,una gran victoria aunque se qued un poco en la arrancada en dos vueltas checo rebas a alonso marcotolama lavozdeldeporte
95,3277,ay ya me tiene harto esto
96,3278,hay gente tan sumamente tonta que hasta cree que su opinin es la nica vlida
97,3279,fernando alonso en xtasis por nuevo podio en la f1 ya tengo ganas de que llegue la prxima carrera
98,3280,en el 2020 fue por el covid19 ahora 2023 ser por colombia
99,3281,pearol fuera del ejecutivo prendan fuego la auf con alonso y balbi adentro
100,3282,segn los informes victoria alonso fue responsable del ambiente de trabajo txico dentro de los departamentos de vfx de marvel segn los informes le dara trabajo a los equipos que le gustaban pero si la has enojado de alguna manera te congelarn fuente chrislee
101,3283,pero eso s tenemos que mantenernos u n i d o s alguna duda
102,3284,que triste eso de sentir que no le importas lo suficiente a las personas que te importan
103,3285,un 8 tiene cosas uno que otro fallo pero la verdad fue buena pelcula grandes interpretaciones de los actores e igualmente el doblaje y me gustaron los efectos y sin duda freddy freeman sigue siendo de mis favoritos igual que la pelcula anterior junto con mary y darla
104,3286,que hizo el frente amplio con el iva en 2007 se deroga la ley que creaba el cofis que le sumaba 3 al iva la tasa bsica pasa de 23 a 22 y la mnima de 14 a 10 el frente amplio redujo la presin impositiva del iva que es el impuesto que ms grava a los que menos ganan
105,3287,excelente
106,3288,todos caretas son
107,3289,una ofrenda de grandes emociones a veces lo sueos se cumplen gracias ofrenda2023 fallas2023
108,3290,alonso sos un corrupto hdp vos no podras pisar uruguay hijo de puta mungriento
109,3291,pues este hilo no s la veracidad pero hace un traje brutal a alonso y feige est ah no podemos hacernos los ciegos tampoco en fin algunos dirn todava que no haba problemas que los trabajadores exageraban ah y que unos no eramos tan verdaderos fans
110,3292,pero eso s tenemos que mantenernos u n i d o s alguna duda
111,3293,me llegan a abrazar y quebr en llanto
112,3294,ya qu nos queda por ver paquirrn recibiendo el nobel en astrofsica rosa villacastn el de literatura acaso anabel alonso terminando el graduado escolar
113,3295,pete alonso
114,3296,me alegro por la nueva relacin entre david y maria aunque elena no lo entienda que viva el amor laisladelastentaciones9
115,3297,mis amigas son asi
116,3298,la auf y alonso chupenme la verga pearol contra todos va bala
117,3299,un 2007 con alonso siendo raikkonen no sern capaces
118,3300,ojito vulture sobre la salida de victoria alonso de marvel studios victoria alonso fue particularmente responsable del ambiente de trabajo txico dentro de los departamentos de vfx de marvel
119,3301,sals de hacer piernas y te olvidas de como se caminaba
120,3302,me mato
121,3303,fernando alonso en xtasis por nuevo podio en la f1 ya tengo ganas de que llegue la prxima carrera
122,3304,puro pinch mxico alv
123,3305,seoras y seores q dirigen los partidos de la izquierda a la izquierda del psoe no incluyo a ms pais x razones obvias o hacemos un frente amplio encabezado por podemos x ser la fuerza con ms representacin pero con primarias o tendremos gobierno de derechas podemos
124,3306,dicen que salida de victoria alonso de marvel est vinculada a malos tratos con los equipos de vfx nunca sabremos la verdad y es cierto que esa rea hoy da pena ajena pero lo que s es seguro es que fue pieza fundamental para que marvel tuviera todo el xito que ha tenido
125,3307,si hay alguien en cali que quiera salvar al cali vamos pues nimo
126,3308,la que se te viene nacho alonso la q se te viene
127,3309,ral salvo que el castilla ascienda tuchel xabi alonso ancelotti pochettino en ese orden creo que van los tiros de entrenadores con ms opciones de dirigir al real madrid la prxima temporada
128,3310,perdi san lorenzo
129,3311,as entrenan las mascotas de lopezobrador que le hacen preguntas a modo
130,3312,taylor nunca tuvo que haber sacado the 1
131,3313,echa un vistazo a mi nuevo artculo en opensea a travs de opensea deepspace5 nft nftart cryptoart art alonso alonso arte polygonnfts
132,3314,shock en marvel victoria alonso deja el estudio tras 17 aos por el batacazo de ant man y la avispa quantumania
133,3315,me alegro que david haya escogido a mara aunque vino con elena que viva el amor laisladelastentaciones9
134,3316,alonso no envejece qu le pasa a ese tipo se baa en formol
135,3317,esto dice vulture medio oficial sobre la salida de victoria alonso victoria alonso fue singularmente responsable del ambiente de trabajo txico dentro de los departamentos de efectos visuales de marvel
136,3318,para despus darse cuenta que se puede caer ms bajo
137,3319,no me trago para nada que kevin feige no estuviera consciente de esto siento que disney est usando a alonso como escape para librarse de culpa
138,3320,nunca nos olvidemos de este hit de victoria alonso gt
139,3321,me ests vacilando
140,3322,silencio habla a la nacin el sr mauren javier franco alonso y se nos pone la piel ms naranja que nunca 39 aos y quiero que renueve re 9 por 10 aos ms sin clusula de salida la iasa no espero que lo entiendas
141,3323,feliz primavera
142,3324,llorando a mares engordando 10 kilos
143,3325,lomsledo la fia devuelve a fernando alonso su podio nmero 100
144,3326,la productora argentina victoria alonso no seguir en marvel studios
145,3327,que irnico hace poco les decian heroes de blanco
146,3328,siempre espectadora nunca protagonista
147,3329,oye pues la cancin de plex ni tan mal
148,3330,en los comentarios te das cuenta que la gente del per es una mierda
149,3331,600 aos en el palace
150,3332,primer imparable de la novena mexicana
151,3333,se me dobl horrible mi libro favorito
152,3334,en mi no hay amor para nadie mas
153,3335,que triste hermano
154,3336,per a das de que el presidente pedro castillo terrones sea liberado y reasuma el cargo de presidente ahora s pueblo hermano a poner en orden todas sus cosas y hacer que sus muchas riquezas sirvan para que todos tengan un presente y un futuro mejor nuevo congreso
155,3337,xabi alonso tiene cosas de ro pero no le llega
156,3338,larga vida al agita de coco
157,3339,victoria alonso responsable directa de la basura ideolgica en marvel a la puta calle
158,3340,vulture ampla informacin del supuesto despido salida de victoria alonso victoria tena una gran cantidad de poder tomando todas las decisiones creativas importantes de marvel kevin feige y ella aprueban personalmente
159,3341,balboa eres lamentable penoso dices ser madridista por estar algn partido en el banquillo del bernabu antimadridista chiringuitovar
160,3342,como am consiga reducir distancia con las mejoras y consiga q sea significativa alonso va a exprimir el coche al maximo y competir por carreras yo solo pido q consigan ferrari y am darnos carreras ms atractivas aunque el mundial sea para rb y q max y prez compitan
161,3343,el sorteo de la fase de grupos de la copa libertadores y copa sudamericana ser el prximo lunes 27 a las 4 00 pm per tiene 5 participantes alianza lima melgar y sporting cristal en libertadotes universitario y csar vallejo en sudamericana pitazofinal2023
162,3344,banda al parecer la salida de victoria alonso se debe a que ella fue la principal razn del ambiente txico que haba en el departamento de efectos visuales segn dicen que si no le caas bien te pona en lista negra ojo es un rumor por ahora
163,3345,que irresponsable bueno no voy a decir nada por el ftbol femenino porque si o si me van a funar
164,3346,ya es un pro en las lagartijas me acuerdo cuando no podan ni hacer 30 jdksskjd
165,3347,fernando alonso es el ms loco de twitter alonsismo estoy por el suelo
166,3348,unas ganas de sacarle fotitos a elllll
167,3349,te amo kuni
168,3350,un soldadao
169,3351,siempre vea maltrato a victoria alonso y me mantena escptico por si las dudas aunque no me inspiraba buenos sentimientos en sus entrevistas pero eso es llegar demasiado lejos una pena
170,3352,no puedo nachito mo carlosiberri
171,3353,pearol qued afuera del nuevo ejecutivo de la asociacin uruguaya de ftbol ignacio alonso ya present la lista de los siete integrantes del ejecutivo todas las novedades con buysan kesmanalberto y gonzaloronchi desde la auf
172,3354,que el tema arbitral del clsico haya sido ms portada en lunes y martes que el podio 100 de fernando alonso y la vuelta al n1 de alcaraz da que pensar
173,3355,a veces el del problema no son los dems eres t
174,3356,10 lucas las zapas mas mierda que podes conseguir me re cago en la puta madre
175,3357,el txico
176,3358,si opino sobre ignacio alonso pedro bordaberry h balbi etc en la jornada d maana me tengo que presentar con el fiscal a declarar
177,3359,vaya adems de negligente en su trabajo y responsabilidades resulta que victoria alonso era una hija de la gran
178,3360,qlia 20 minutos corriendo y ya estaba hecho agua
179,3361,shock en marvel victoria alonso deja el estudio tras 17 aos por el batacazo de ant man y la avispa quantumania
180,3362,vulture coment sobre la salida de victoria alonso victoria alonso fue singularmente responsable del ambiente de trabajo txico dentro de los departamentos de efectos visuales de marvel marvel marvelstudios marvelcomics viral
181,3363,con este hombre al fin del mundo
182,3364,vi recin el cap de la muerte del arturo en hijosdeldesierto y ctm medio captulo y la actuacin de marcelo alonso me encantooo
183,3365,victoria alonso deja marvel era la productora ejecutiva y presidenta de post produccin animacin y desde 2021 de vfx de marvel studios rumores indican que el problema con la gente de vfx escal tanto que la cabeza de victoria tena que rodar qu les parece
184,3366,el chicano quiere decirnos cual es nuestro vocabulario kek
185,3367,pero no puede ser esto es una explicacin razonable y lgica de por qu se va y a mi los expertos de twitter me han dicho que esto de que victoria alonso se va de marvel huele muy mal y que hay algo ms detrs
186,3368,os habis planteado que la salida de victoria alonso haya sido algo voluntario o por temas personales que si llevaba 15 aos en disney marvel studios con esa poltica malo ser el que ahora los homfobos hayan conseguido moverla por la inclusin
187,3369,el espaol fernando alonso hizo historia en el gran premio de arabia saudita al conseguir su podio nmero 100 en la frmula 1 otros cinco pilotos consiguieron este hito antes que alonso y en este video te contamos de quines se trata
188,3370,es cosa ma o si dura 20 vueltas ms fernando alonso llega a verstappen fijaos a partir de la vuelta 45
189,3371,gp arabia saud f1conguito fue buena carrera la del sbado pasado en la q a una vuelta hicimos p4 para la sprint hicimos p2 en la carrera principal al principio nos pusimos lderes y tena buen ritmo pero tuve muchos errores y bueno al final p7 siguiente parada
190,3372,marvel producer victoria alonso leaves disney superhero studio
191,3373,vulture da ms detalles sobre la salida de victoria alonso de marvel studios victoria alonso fue particularmente responsable del ambiente de trabajo txico dentro de los departamentos de vfx de marvel va chrislee
192,3374,de que color era el coche de alonso con el que gano los mundiales de 2005 2006 azul y amarillo y si juntamos esos colores que tenemos
193,3375,pues para m por mucho que seas hamilton alonso o verstappen me parece una guarrada de mucho cuidado es deporte y tiene que haber juego limpio y dejar espacio al rival es parte del juego
194,3376,andamos de villamelones
195,3377,cada da ms decepcionado de la gente y de la inseguridad de este pas
196,3378,variety informa que la productora ejecutiva de marvel studios victoria alonso ha renunciado a su cargo an se desconocen los motivos de su renuncia pero dejar en el hilo ms informacin sobre su puesto en marvel studios marvel marvelstudios marvelcomics viral
197,3379,ese chamo gaby es bien feo pero billetera mata galn
198,3380,actualizacin sobre la salida de la productora ejecutiva de marvelstudios victoria alonso vulture pblico una actualizacin victoria alonso fue singularmente responsable del ambiente de trabajo txico dentro de los departamentos de efectos visuales de marvel mcu
199,3381,un poco de las dos
200,3382,russell se vio beneficiado durante tres horas por la decisin de la fia de bajar del podio a fernando alonso escuadra lvg
201,3383,ojito segn vulture la salida de victoria alonso de marvel studios se debe a que era singularmente responsable del ambiente de trabajo txico que se estaba generando dentro de los departamentos de efectos visuales de marvel
202,3384,lagos se lanza contra indultos y sindica a boric como prncipe moderno el presidente est ejerciendo una facultad que viene del medioevo inoticiascl nacional elmostrador chile alonso josh tyler drake sergirobert
203,3385,orgullo que nico alonso me bloquee junto con el grande de piedrasmarcos
204,3386,al final lo de ayer fue una ms de la fia tenis en el canal un nuevo video explicando todo lo sucedido con las sanciones a fernando alonso en el gran premio de arabia saud
205,3387,me voy a trabajar por 8 horas y ya rompieron a victoria alonso falleci marvel studios
206,3388,el troleo pico de fernando alonso a george russell tras arrebatarle el podio en arabia saud
207,3389,libertad y orden siempre
208,3390,la cama que le hicieron a victoria alonso mamitaaaa
209,3391,te tqm fernando alonso
210,3392,yo falto un da al directo de reb todos
211,3393,fadeamos al fachero ro platense estoy llorando
212,3394,han pillado a anabel alonso con las manos en la masa via youtube
213,3395,la productora argentina victoria alonso deja marvel tras 16 aos de trabajo
214,3396,pero como si segn los argentinos victoria alonso era un ngel y lo mejor de marvel son un chiste
215,3397,alonso recupera el podio va diario as f1 alo oficial
216,3398,alonso
217,3399,el momento cuando se terminan los tamales verdes
218,3400,que ganas de cocinarle
219,3401,ver a checo a alonso y a carlos lt 3
220,3402,un hilo ms argumentando por qu r0ma gallard0 y los otros atontados estn mintiendo y me tiro por el puto balcn stop hacer famosos a estos subnormales por favor si ya sabemos que lo son y que lo van a ser toda su vida sin remedio
221,3403,uno tir que el cgi de marvel empeor porque victoria alonso se gast toda la guita en comprar la historia de messi hablando sobre argentina 1985
222,3404,victoria alonso con james gunn
223,3405,siglo xxi y todava se invaden pases violentamente con muchas muertes de civiles no hemos superado la era primitiva la onu y la cpi son tteres del poder norteamericano nos llevan a una guerra nuclear por codicia
224,3406,estoy nerviudo mexicobeis worldbaseballclassic
225,3407,vulture medio oficial comenta sobre la salida de victoria alonso victoria alonso fue singularmente responsable del ambiente de trabajo txico dentro de los departamentos de efectos visuales de marvel
226,3408,me duele todo
227,3409,la que le est por caer a victoria alonso
228,3410,atencin la plancha de neutrales que presenta ignacio alonso para integrar el ejecutivo auf ser alejandro balbi carlos manta andrea lanfranco hctor del campo matas prez y eduardo mosegui pearol no tendr representacin en el ejecutivo
