,Id,Tweet
700,22374,me veo como el pico con buzo plw
701,22375,jajaajajjaja no puede ser solo louis puede domar a las fieras
702,22376,louis recibiendo una chaqueta customizada para y sobre l vicka6
703,22377,que bonito yo tambin quiero
704,22378,louis con la fan que gan la entrevista en mxico va vicka6
705,22379,jajajajja
706,22380,tan yo cantando esa parte
707,22381,mi profesor dizque muchachos el taller les alcanza en una sola hoja examen mmm seor como le explico que ya voy para la segunda hoja y aun me faltan ejercicios
708,22382,tambien quiero que louis me abrac
709,22383,mi mam supo que louis se apellida tomlinson
710,22384,la cara de louis cuando abraza fans como nos va a querer tanto
711,22385,yo viendo a las louies que lo van a ver y a estar re cerca de l
712,22386,la atencion y la forma q la ve si yo queria ser esa mujer
713,22387,paren como as que se calmaron hasta que les pusieron msica de louis jahsjajaja el gran ejemplo de que louis tiene el control sobre nosotras
714,22388,tiene una vaquita
715,22389,louis yo te amo demasiado
716,22390,yo quiero estar ah cantando chicago
717,22391,ay dios seria yo lpm cuando cuando me va a tocar a mi
718,22392,louis tomlinson resolve tudo no mundo
719,22393,voy a llorar de nuevo
720,22394,yo tamb m calm con musica d louis pero en mi casa
721,22395,fuaaaa ojal louis las escuch
722,22396,yooooo yo necesito un abrazo louis ptmmmmmm
723,22397,rpido pongan dos cuchillos en cruz
724,22398,la abraza tan bonito y con un amor que hasta yo puedo sentr a travs de una pantalla
725,22399,pongan always you que quiero llorar y sobrepensar
726,22400,qu traje llevar louis hoy que emocin
727,22401,buen poto louis t amo
728,22402,a q hora se supone a sale louis
729,22403,por que no puedo ser tu
730,22404,lo nico que pido es q se comporten cuando aparezca louis
731,22405,creo que no me dio fiebre y era porque no haba comido desde el da anterior
732,22406,ya saca las fechas louis
733,22407,louis va a flipar amo
734,22408,yo tambien quierooo
735,22409,esa actitud la conozco ya
736,22410,es humilde y me tuvo una paciencia increble una vez que supo que era fan y no prensa me trat de la manera ms bella del mundo me repeta que no me preocupara por entrevistarlo fue la persona ms amable cuando se me quebr la voz dijo ven aqu necesitas un abrazo 1 2
737,22411,mi mejor regalo de cumpleaos es louis en mxico y bts en el concierto de harry
738,22412,aqu la pregunta es cmo era mi vida antes que diego del ro fuera mi maestro
739,22413,que linda la chica
740,22414,me fui a formar dos horas para recoger entradas que no son mas para ver la premier de louis no hay nada como yo
741,22415,lo siento pero la emocin es humana aqu el problema es que subestimaron a louis y a sus fans
742,22416,me voy a matar
743,22417,no les mentir q embeces tengo envidia a los coreanos pero luego louis viene a mexico cmo si fuera su casa y se me pasa el coraje
744,22418,sal en hl daily me subi amo todo
745,22419,no puedo ms con este sentimiento
746,22420,voy a conseguir diamante para el tour de louis
747,22421,ay amigas creo q a este paso louis ni va a llegar a la alfombre
748,22422,ni los los mexicanos quieren tanto al pas como louis hshdjs
749,22423,se va a abrir el suelo que da al garaje del centro comercial y a va a salir louis por ahi como en los conciertos
750,22424,ya denme mi turno porfavor
751,22425,el charlie jaksjaksjajajaes buensimo
752,22426,ojal estar por conocer a louis y no preparando una exposicin
753,22427,est chiquita y todo pero est bonita esa red carpet
754,22428,le tengo tanta envidia
755,22429,yo solo quiero un abrazo de louis
756,22430,si fuera una persona random de twitter y viera eso de que las fans se calmaron cuando pusieron msica de louis estara muy
757,22431,la diferencia con una fan a con una entrevistadora que seguro solo lo incomodo
758,22432,lo quiero tanto
759,22433,louis con un regalo que le hizo una fan vicka6
760,22434,porfavor pq si le pasa algo a louis me mato
761,22435,en fin si louis sale de fiesta despus de la premiere yo tambin pa festejar y eso claro porque yo tambin festejo sus logros
762,22436,el futbol femenino me pone mas nerviosa q el masculino locooo es una locura las arbitras son asquerosas y son unas ciegas de mierda aprendan a cobrar carajo q choputa esta nuestro futbol paraguayo no importa el genero encerio
763,22437,tipo antonella en diosa nica bonita sisi
764,22438,louis te amo mucho espero algn da conocerte
765,22439,admiro a todas las que ganaron entrevistas con louis y se vean re tranqui yo hubiera sido este
766,22440,acabo de llegar a mi casa y no entiendo que esta pasando con louis y las mexicanas
767,22441,amara tener esta oportunidad pero si tengo q conocer a louis y hablar con l me descompenso no podra con tanto
768,22442,perra madre de dnde sale tanta gente
769,22443,la cara de louis
770,22444,esto es literalmente un concierto me meo
771,22445,yo tambin quiero abrazar a louis y regalarle cosas
772,22446,temo x la vida de louis si llega a salir a la premier
773,22447,louis con una fan en el m amp g en mexico vicka6
774,22448,q se me hace q la doa q lo entrevist se quiso pasar de lista y por eso louis fue medio cortante
775,22449,la verdad es que me siento mal por la gente que no tiene a louis en su vida o sea como siguen su da a da sin el ser ms precioso del planeta
776,22450,man est pasandoooooooooooo
777,22451,louis te amo tanto
778,22452,louis con la fan ganadora para la entrevista junto a masquecinelatam vicka6
779,22453,te amo precioso
780,22454,louis tomlinson resolve todos os problemas galera
781,22455,estoy harta de fotos videos de louis con fans no quiero ver ninguna ms
782,22456,gracias tommy por comer rpido
783,22457,que risa la premier en latam ajajajjajajajjaj todo tan 3ermundista louis necesita sabor asi q se lo van a dar
784,22458,ay no que yo me estoy cortando
785,22459,jajajaja la verdadera solucin
786,22460,vete a la verga se me subi el chile y estoy llorando voy a aprovechar para llorar por louis
787,22461,wey aunque llevaba tacones louis era ms alto que lindo por la fan
788,22462,louis con una fan hoy via vicka6
789,22463,todos los idols
790,22464,ay m caga ese wey
791,22465,yo tmb quiero abrazarlo
792,22466,casi me pillan
793,22467,no me haba puesto a pensar por dnde carajos va a entrar louis a la alfombra si todo est hecho un mar de gente
794,22468,yo quiero un abrazo de louis
795,22469,ay no vamos a tener que seguir explicando la suntuosidad que habita en lo feo no nos lo haba dejado claro ya dor jenny savile vctor hugo umberto eco louis bourgeois cobardes les dira jean paul
796,22470,ms de louis hoy en mxico vicka6
797,22471,ms de la red carpet de allofthosevoices la espera por louis se hace eterna
798,22472,louis con una fan en el m amp g de mexico vicka6
799,22473,porfavor que todo salga bien que todo salga bien que todo salga bien
800,22474,de las pocas canciones que me gustan de louis
801,22475,es humilde y me tuvo una paciencia increble una vez que supo que era fan y no prensa me trat de la manera ms bella del mundo me repeta que no me preocupara por entrevistarlo fue la persona ms amable cuando se me quebr la voz l dijo
802,22476,que ganas de estar alli
803,22477,frogrry nadie te ama ms que yo
804,22478,ojal poder hacer como bri y quedarme en valla desde q se abra el asuncionico pero no puedo q putahqidlqhsiqbdjqoskqjlduq billie esperame a q me dejen salir con amigas y te veo en primera fila
805,22479,pero si hubieran investigado ms sobre louis se hubieran dado cuenta que los fans nos calmamos con 1 que nos pongan la msica de louis 2 que louis nos regae nos ponemos a llorar pero nos calmamos
806,22480,quiero llotar twnto
807,22481,harta de que salgan fotos de louis conociendo fans y ninguna soy yo
808,22482,extrao a ese juan al que veo en mol no porque ni siquiera s cmo es lol
809,22483,a mi que louis va a llegar a la alfombra saltando de un helicptero con juanpa zurita colaboracin inesperada
810,22484,ay no que lindooooo me estoy mordiendo el culo de la envidia
811,22485,mi motivo para seguir esta semana es que veo a val el documental de louis y el viernes es feriado
812,22486,louis con un regalo de una fan vicka6
813,22487,yo tmb quiero conocer a louis basta
814,22488,louis necesita presentarse en el foro sol para que vea todo el poder que tiene
815,22489,que risa porq todas gritamos en esa parte jajaja
816,22490,nmms a mi me vale madre q tengan la copa wey yo tengo a louis prefiriendo mi pas el futbol q hajajajaja
817,22491,alfombra roja de allofthosevoices en la ciudad de mxico falta una hora alfa913fm
818,22492,lloro
819,22493,alguien me consigue un link pa la pelcula de jujutsu lo la he vito y ya viene la 2da temp
820,22494,yo tambin quiero
821,22495,qu hermoso que es te amo shawn
822,22496,no gan en ningn concurso para la premier nunca gano nada por primera vez tena tanta esperanza de ganar y ver qu no pas me hace mierda
823,22497,1 hora para el inicio de la red carpet de allofthosevoices
824,22498,parece concierto wey
825,22499,come here you need a cuddle yo s que un da yo tambin lo abrazar
826,22500,ando bien celosa por que yo tmb quiero estar abrazando a louis
827,22501,fans cantando bigger than me mientras esperan a que inicie la alfombra roja de la premier allofthosevoices en mxico louswinter
828,22502,wtf pq lo abrazaba as sultalo
829,22503,solo 4 meses y 12 das
830,22504,neta la msica de louis es la solucin a todo
831,22505,mi sta venendo sonno louis entrs x favore
832,22506,no merecido
833,22507,ok pero por dnd entrara
834,22508,es una locura que louis salga ah
835,22509,as va a llegar louis a la alfombra roja hoy
836,22510,y hemos organizado cositas muy especiales
837,22511,jajajaj literalmente se calmaron soy yo cuando estoy triste aburrida pongo a louis y todo mejora
838,22512,billie se puso a cantar ole ole ole con nosotros louis hizo lo mismo ya est somos claramente sus favoritos
839,22513,que le agartas la cintura hdp
840,22514,louis con una fan en mxico vicka6
841,22515,louis conociendo a fans en mexico va vicka6
842,22516,hermanos mi amiga conoci a louis hoy est en la red carpet y de paso es la fotgrafa oficial de un radio invitada as que va a estar tomndole fotos se me caen las lgrimas
843,22517,la pobre pamela habr aprendido la leccin
844,22518,me enferma q se haga la boluda
845,22519,louis con la fan que gan la entrevista con el vicka6
846,22520,mi amigo no va a verse la de louis win pq ya si el no va yo tmpoco y no gasto pero si queria irla a ver
847,22521,siempre te voy a tener en mi corazn nille diecisieteaera literal el mejor ao de mi vida pude ver a louis en vivo
848,22522,un da eres joven y al otro da no queras lastimarme de gloria trevi cobra sentido
849,22523,vamaaaa
850,22524,porque no soy yo
851,22525,lo feliz que va a estar louis de ver toda esa gente ahi solo por el
852,22526,m pregunto como va a entrar louis yo lo veo imposible
853,22527,sultalo
854,22528,me da miedo que acabe lo de aotv y louis empiece a sacar fechas para latam hermanas no tengo ni un quinto ya denme beca o algo yo no me puedo quedar sin ver a louis otra vez
855,22529,no me importa
856,22530,quiero un abrazo de louis
857,22531,ya me emocion y ni fechas hay
858,22532,me mira as y me hago pis
859,22533,te amo louis
860,22534,quitaron mi hamburguesa favorita del men de kfc estoy muy triste
861,22535,se vio una vez ms que las louies solo necesitan la msica de louis para tranquilizarse
862,22536,por esto es que louis ama mexico louistomlinson alloffthosevoices
863,22537,alguien que me explique como va a entrar louis por favor
864,22538,louis con una fan hoy via vicka6
865,22539,que cague de risas la tarde con ender y lina
866,22540,yo quiero louis
867,22541,louis con una fan luego de haberlo entrevistado allofthosevoices vicka6
868,22542,yo solo quiero un abrazo de louis para que la vida se me reinicie allofthosevoices
869,22543,fans cantando chicago mientras esperan a que inicie la alfombra roja de la premier allofthosevoices en mxico louswinter
870,22544,dios bmg donde est mi foto abrazo con louis os odio
871,22545,as est actualmente la plaza oasis coyoacan soycoyoacanense
872,22546,la prensa ya se encuentra frente a la red carpet allofthosevoices
873,22547,tbt en decri tomndome fotos mientras la bitch responde
874,22548,jajajajajajaja
875,22549,definitivamente louis pertenece a latam
876,22550,yo tambien quiero abrazarlo
877,22551,recien vengo y miro el celular que paso como fue louis cuenten
878,22552,a esta gente les han metido en supervivientes no tengo pruebas pero tampoco dudas
879,22553,au larry donde louis tiene que hacer un trabajo con harry aunque lo odie o donde harry esta enamorado de louis desde que empezaron la secundaria
880,22554,que empiece yaaaaa
881,22555,la culpa no es solo d la organizacin hay muchsimas fans que no supieron respetar nada y que se les fue todo d control va d todo corazn q en serio ojal lo cancelen porq m parece cero seguro tanto para louis como para las fans breaking my silence
882,22556,louis deja todo para hacer el festival y estas mierdas se cagan en eso maldita blouie loummysta asquerosa cada da demostras que lo odias
883,22557,mexico dndolo toooodo por siempre y para siempre pas superior
884,22558,si te jode hubiesen ganado abz
885,22559,ms del interior de una de las salas de cine donde se har el q amp a con louis y charlie adems de proyectarse allofthosevoices perfectlightsup
886,22560,a qu hora sale louis
887,22561,te amo mi louis hermoso de mi alma y corazn
888,22562,an no sale louis
889,22563,se filtra llegada de louis a la premiere de mxico
890,22564,esta noche se celebrar mondaynightraw desde sant louis missouri en el estadio enterprise center cuando termine el show nuevo resumen anlisis en el canal estate atento terricolas wwe raw wrestling prowrestling luchalibre lucha
891,22565,ya suelta las fechas louis
892,22566,eleg q clem se quede con louis dios soy tan feliz los amo
893,22567,por donde van a meter a louis sin que lo asesinen
894,22568,louis preguntando si alguien ms quiere un abrazo es la razn de mi muerte amigo tan tierno va a ser
895,22569,todo un lo en la premiere louis vos pone m msica que ahi se calman
896,22570,la necesidad de escucharla ya en vivo
897,22571,caleta de gente ctm me encanta el impacto que tiene louis amo ver llena su premiere ignorando obviamente que estn aplastadas
898,22572,louis con una fan despus de haberlo entrevistado allofthosevoices vicka6
899,22573,okis gracias
900,22574,esq ni de coa louis se para a sacarse fotos esq se acerca y le dejan sin un ojo
901,22575,imagnense el traje de louis para la premiere de hoy santo cristo de solo pensarlo hiperventilooo
902,22576,louis paz
903,22577,estos tres van a volver al monumental
904,22578,soy sensible con todo esto m quiero ir con dios
905,22579,aaa estaba bien c9ntenta porque louis ya esta en mxico y le puse jn chingo de salsa a mi comidaa y ahora no salho del bao me arde hasta el almaaa
906,22580,despus del caos viene la felicidad las amo mexas
907,22581,pusieron canciones pq hacen referencia a q ya vienen los conciertos para los pases q faltan claramente
908,22582,yo tengo q ir al cine a ver el documental de louis
909,22583,sali a la calle sin bra la mejor sensacin del mundo amigas
910,22584,al parecer louis les ha enviado agua embotellada a fans que estn esperando en la premier de allofthosevoices owner
911,22585,para mi que louis no va a aparecer porque por dnde va a entrar y al final van a salir mostrando un mensaje de parte de l en esa pantalla y van a reprogramar la premiere para hacerla en un espacio ms abierto que eso
912,22586,todas las pelotudas que le dieron fab son larries harries louis ex directioners literalmente el fandom ms mogolico del mundo estn igual de pelotudas que hace 10 aos
913,22587,le dije a mi mam que me llevara por unos tacos para chingarmelos en honor a louis y me dijo q solo busco pretextos para ir a comer tacos pero si me llevo jajaja
914,22588,dios amo qudense asi siempre porfa
915,22589,amigas imagnense el ruido que harn cuando salga louis
916,22590,que lindo pensar que el desmadre lo controlo louis solo con su msica hasta parece irreal allofthosevoices
917,22591,que ganas de ver a louis
918,22592,aprendan a dar sb no soy fan de nadie
919,22593,me da mucha risa lo de que pusieron msica de louis y se calmaron jajajaja si sera
920,22594,ah bueno me sacaba en follow no entendi nada me voy a muay chau
921,22595,que increble se ve louis va a estar muy feliz
922,22596,me acabo de arruinar el da
923,22597,y aqu te cuento algo yo si tus preguntas no lo hicieron sentir cmodo o hacas chistes que ni al caso claro que ser as pero sin faltar al respeto me saludo de abrazo aja fue antes de la entrevista despus de eso debi de sentirse incmodo
924,22598,las amo alvvvvv
925,22599,nena en londres y en tokio no haba ni la mitad de guardias que hay ah y nada de eso pas la verdad es que ustedes no se saben comportar parecen locas y no se dan cuenta de que estan perjudicando a louis
926,22600,esto es tristsimo
927,22601,yo quiero
928,22602,sigo sin entender como louis no tiene streams
929,22603,dios miooo las amo haciendo mierdero y todo pero esto es hermoso solo de imaginar a louis escuchando esto y sintiendo emocin es lo mejor que me pas
930,22604,que louis lo vea y agregue chicago al setlist
931,22605,a louis en mxico le dan un estadio o vamos a tener problemas
932,22606,si tam solo se les hubiera ocurrido antes la musica ajsjsjajaja
933,22607,si yo quisiera estar ah
934,22608,yo tmb qiero cantar angels fly rodeada de louies
935,22609,dganle a louis que pruebe las palomitas con takis de cinepolis
936,22610,estar a media hora de louis y no poder ir no es algo sano para mi mentalidad
937,22611,el reconocimiento que tendr lugar maana martes incluye a bruce springsteen gladys knight y julia louis dreyfus va elnuevodia
938,22612,las fans calmandose del desmadre despus de que pusieran msica de louis me representan cuando me da una crisis y la nica solucin es escuchar su msica jajajsjjajaajja
939,22613,se viene hermanas
940,22614,louis mexicano
941,22615,ctm queria llevar la camara al cine para hacer la foto del louis y me acab de acordar q la pila cago
942,22616,la macarena estilo harry jajajsjaja
943,22617,ahuevo louis est escuchando a las fans vdd
944,22618,louis con fans durante el m amp g en mxico unotv
945,22619,lo ms cagado es que siempre son seores los q llevan al louis de cartn ajdksjd
946,22620,nunca subestimen el poder de las canciones de louis
947,22621,yo quiero estar ah
948,22622,no les voy a mentir me da envidia y una tristeza no ver a louis a pesar de que ha venido 9284829 veces a mxico diosmio
949,22623,ay ya no quiero ver nada de louis me pone muy triste
950,22624,que louis vea todos los videos pls pls se va poner tan feliz
951,22625,medio tw contra las mexicanas y charlie haciendo post okei
952,22626,te aword ms jajaja hdp
953,22627,quiero una pareja que adore el mismo piso en donde camino
954,22628,louis embajador de la onu
955,22629,no puedo
956,22630,fans cantando chicago mientras esperan el comienzo de la premiere allofthosevoices louswinter
957,22631,wey fuera de broma por donde mierda va a entrar louis literal todo est rodeado de gente
958,22632,entiendo q critiquen el comportamiento de las que estn ah porque actan como si estuvieran en el campo de un show pero literal qu esperaban que pasara si estn haciendo la premiere con entrada libre en un espacio chico sabiendo todo el alcance y revuelo que puede generar louis
959,22633,por pura nostalgica me voy a ver mis videos del concierto de harry y louis
960,22634,louis te amo que er lindo
961,22635,entonces louis a qu hora llega
962,22636,lo saludaban jajajajajaja
963,22637,louis salva vidas
964,22638,ya no estoy tan lejos
965,22639,ya estamos en la red carpet de alloffthosevoices en espera de louis tomlinson louistomlinson
966,22640,necesito escuchar chicago en vivo
967,22641,hablo la que no tiene plata para ver a louis aca en arg sacamos plata de dnde sea para verlos
968,22642,a louis lo van a terminar paseando en helicptero como hicieron con la seleccin ac allofthosevoices
969,22643,la situacin pas literalmente de esto a esto solo con la msica de louis
970,22644,las louis cantando miss you y just like you hace pensar que en la premier estn las personas correctas
971,22645,neta s esq la msica de louis es superior
972,22646,quiero llegar a los diez meses y voy diez minutos vamoss
973,22647,por un segundo pens que estaban grabando el cielo porque louis haba llegado en helicptero jajajajajaajja
974,22648,saber q hector trejo aka bully va a entrevistar a louis es un choque bn cabron para mi yo adolescente q era fan de los primeros youtubers
975,22649,eso mismo paso en el concierto d junio nopuedeser jalakalwkwlkwkwke
976,22650,acab de entregar 2 trabajos mientras trajimos a mi pap al hospital claramente en unos aos ms exagerare esta historia
977,22651,yo deberia estar estudiando
978,22652,y te amareeeee por siempre aunq jamaaas lo digaaaaa
979,22653,las louistas calmndose despus de escuchar las canciones de louis
980,22654,no puedo con esta depresin titulada louis est en mxico para la red carpet de su peli hay un chingo de morras conocindolo abrazndolo y tomndose fotos con l mientras yo estoy encerrada en mi puto cuarto alv viendo todo por las redes claro que estoy odiando a todos
981,22655,louis va a llegar volando verdaderamente
982,22656,louis envo agua a las fans que estn afuera esperando la premier de allofthosevoices owner
983,22657,venan unos manes super en el bus tipo vistiendo louis vuitton desde la gorra hasta los zapatos y cuando me baj uno de esos manes empez a decirme que estaba riqusima y me dio miedo porque los manes venan hablando de que se salvaron de la balacera de anoche
984,22658,versos que conversan algo en todo aprendiendo vas
985,22659,louis tomlinson con una fan despus de haberlo entrevistado vicka6
986,22660,putao louis tirate las fechas del tour
987,22661,louis salvando vidas
988,22662,por faaa la estoy pasando increble con los memes jajajjajajajajjajajajjajajaj
989,22663,no estoy soportando
990,22664,ay pero ya tengo traducciones cuando me inviten en ingle
991,22665,se puede saber x donde va a entrar louis sin que lo maten pregunta seria
992,22666,me da algo como ellas posan muy lindo y la serie es muy
993,22667,lo amo
994,22668,que coo hacen las de la premier de aotv
995,22669,jjaajjajajajajajjajajajjajajajaja
996,22670,opciones para cambiar el himno nacional mexicano por una cancin de louis tomlinson
997,22671,jajajaj que decian 0 prep
998,22672,se logr
999,22673,se que estn emocionadas por estar en la premier de louis y que quieren verlo y estar cerca de el pero tambin piensen en su seguridad morras la plaza no est diseada para tantsima gente como un recinto de concierto piensen en la seguridad de todos
1000,22674,wey ya se la estan tirando con las mexas de nuevo por culpa que es mayormente de la organizacion del lugar pero cuando lo mismo paso en espaa nadie dijo nada porque con ellxs si fue la verdadera culpa de la organizacin y no de las fans neta son re doble moral me tienen harta
1001,22675,louis fuente de tranquilidad comprobada
1002,22676,lloro que lindo
1003,22677,algo habr de haber hecho
1004,22678,ayer so q conoca a louis y se sinti tan real q me levante con un vaco existencial
1005,22679,me imagino a louis todo ah re enojado y diciendo mndenles agua pedazos de enfermos
1006,22680,era broma si estamos en la premier
1007,22681,y louis dnde mierda est
1008,22682,louis va a estar tan feliz de ver la cantidad de gente que est ah por el
1009,22683,que risa admi puedes ver qu ah estn mochilas pertenencias de fans lo dejan ah por el momento de pendejo uno se sale de dnde est para tirar la basura en un bote que est hasta atrs de toda la gente
1010,22684,hermanas me parece surrealista que se hayan calmado con la msica de louis akxnjska
1011,22685,me gustara poder decirle a mi yo de 13 aos que lo logramos vamos a tener a louis muy cerca
1012,22686,yo digo que hoy louis se anima con un toque de color en su traje
1013,22687,los de el staff viendo como solo tenan que poner la msica de louis para que se acabar el desmadre
1014,22688,si louis ve esto agrega 5 fechas ms de las q ya va a agregar
1015,22689,pusieron msica de louis en la plaza y las fans se calmaron la msica de louis salvando vidas como siempre jaja allofthosevoices
1016,22690,se escucha tan lindo cuando cantan sus canciones louis anuncia latam
1017,22691,quiero ver a louis ya
1018,22692,ojal louis traiga tapada la nariz verdaderamente
1019,22693,ya libera las fechas louis tomlinson
1020,22694,podrn haber muchas louistas en el liceo pero ninguna ha hecho un trabajo sobre el louis y menos sobre angels fly
1021,22695,yo louis yo quierooo
1022,22696,las louies que estaban haciendo desmadre son el verdadero terapia no silver tongues by louis tomlinson
1023,22697,dios soy yi
1024,22698,tienen bonita vibra ahorita que pusieron msica espero que cuando louis salga no se vaya todo alv
1025,22699,los fans que fueron invitados a la premiere les regalaron un pster del documental y ya entrada simblica itslwt91
1026,22700,lo que va a ser eso cuando salga louis
1027,22701,premiere o concierto amo
1028,22702,no me imagino lo feliz que va a estar louis cuando salga y vea que toda esa gente est ah por el
1029,22703,kjakskdkdd se calmaron porque pusieron musica de louis
1030,22704,mi pregunta es que va a pasar cuando se acaben todo fitf y walls
1031,22705,jajajajajaja
1032,22706,louis tomlinson conciertos en bilbao madrid y barcelona y trailer de su documental a travs de laganzuaweb
1033,22707,es el ms lindo
1034,22708,esto una vez ms demuestra que louis es la solucin para mxico
1035,22709,jsjsjsjs es que no mamen besties les pusieron msica de louis y se calmaron jajjajajajjajajajjajajajjaja weeey
1036,22710,vamos saaaal louis tomlinson
1037,22711,si yo necesito un abrazo louis
1038,22712,nunca lo habia hecho ahi
1039,22713,mucho lo miman ni hablando se atrevi a tanto
