,Id,Tweet
0,47608,lo del muchacho weigandt no se lo vimos a peruzzi en su peor momento
1,47609,hace frio el dia de hoy en veracruz mxico
2,47610,merda
3,47611,nunca una eternidad el mozo a 180 te trae cualquier cosa menos elpedido se entiende que es un caos pero una atencin de mierd pedimos una muzza con faina vino la muzza y la faina no a la medan hora se ve que se acord la trajo reseca toda recortada pareca de
4,47612,todava no soy consciente que en dos semanas me va a cambiar la vida
5,47613,me perd 15 del st y estamos 3 1 abajo y casi nos hacen el 4to es un papeln no tiene alma este pseudo equipo somos horribles bocajrsoficial diarioxeneize planetaboca
6,47614,todo pasa por algo
7,47615,ser el tuitero mozo yefmovich una vctima de aquello que mark fisher llama el trastorno que define el marco interior del capitalismo
8,47616,entre nos lo dije y lo sostengo que perillo vuelva a manejar un remis o a ser mozo
9,47617,eso con mozo yefmovich no os pasar porque mozo yefmovich no lee libros
10,47618,este es el mozo de piera y lusik
11,47619,nos miramos con mozo y gritamos el gol en silencio
12,47620,muri el ftbol del todo
13,47621,si se humillare mi pueblo sobre el cual mi nombre es invocado y oraren y buscaren mi rostro y se convirtieren de sus malos caminos entonces yo oir desde los cielos y perdonar sus pecados y sanar su tierra 2 crnicas 7 14
14,47622,una seora en el caf le hizo bajar el volumen del tv al mozo que haba puesto el partido nadie esta viendo y nosotros queremos conversar no escuchar el partido aplausos
15,47623,la importancia de los mozos fui a mousse y bsicamente con la forma asquerosa de responder del mozo nos corri pudiendo sentarme afuera me fui a la mierda
16,47624,llueva truene relampaguee o baje el anticristo hoy vamos al mozo
17,47625,descontrol en la conferencia de prensa de gimnasia qu desahogo de estos pibes que rompieron una racha tremenda viv dos aos en la plata cubr gimnasia y vi de cerca la locura que se vive en el clsico
18,47626,quiero q sea abril ya para haber cobrado ya y q sea el cumple de seonghwa quiero pillarme su merch dame cosas mozo
19,47627,el caballero blanco ancelotti el buen mozo
20,47628,siempre he parido cuando estoy estudiando como as que la gente si se goza esas jodas
21,47629,pero lpm q vergenza somos bocajrsoficial no tiene orgullo menos ideas es lamentable todo
22,47630,hoy no se salva uno
23,47631,aun tomo coca y fumo para mantenerme en forma humana
24,47632,mi domingo consisti en ver ftbol all day
25,47633,max steel deja de ser el mozo buenon de barbie y se convierte en el oficial como debi ser siempre sucesos histricos
26,47634,q pongan bizcochitoversion 10 horas
27,47635,el lunes celebr el cumple del marido huguito y el domingo celebr aniversario con el mozo
28,47636,consejo mio para ustedes llamen a un mozo por su nombre sean agradables traten bien a alguien que trabaja en gastronoma porque no saben la presin que se vive
29,47637,q robo al madrid
30,47638,te veo y digo que mujeeer
31,47639,f1 al niato de verstappen y su pap hoy
32,47640,nahh increble
33,47641,el candidato del psoe a la alcalda de pontevedra ivn puentes protagoniz ayer en el cafetn un caf mozo con medio centenar de miembros de las xuventudes socialistas de galicia al que tambin asistieron los nmeros 3 y 4 de la lista elec
34,47642,con una amiga del trabajo nos quisimos levantar al mozo de aguila roja como si tuviramos 15 aos jajajaja
35,47643,el problema con el beso es que hay gente que cree que se est tocando arriba para acceder al stano no necesariamente
36,47644,una sola letra llena mi corazn somos rumba merengue soyhinchadelau universitario unidosxlau sociouadherente unalocura1924 espacio crema habla crema
37,47645,que los catalanes estn gritando as gana el madrid no te creo viven en un mundo paralelo jajajajaja
38,47646,eso le presentan hasta el mozo a uno
39,47647,a todos los que tienen en casa por lo menos destornilladores martillo llave inglesa y taladro feliz da del hombre
40,47648,triple hija de puta as fue que t mozo chvez se mantuvo en el poder acabando con la economa y el pueblo el mal gob petrogustavo se ataca solito ms bien pngase pilas que usa la tiene en la mira narco guerrillera
41,47649,bromas a un lado spasi hoy da es mozo de almacn
42,47650,desactivada a alerta por desaparicin en vigo dun mozo buscado desde fai mis dunha semana
43,47651,feliz da pal mozo mo tambin te extrao beb
44,47652,vas al italy de carlos paz y no solo que te vas enamorada de la comida sino tambin del mozo
45,47653,la joya del bsquet de estados unidos que tiene madre rosarina es fan de messi y quiere jugar para la seleccin argentina por julin mozo
46,47654,qu vergenza estoy a punto de cumplir 24 aos y el mozo del restaurante le pregunta a mis padres si puedo tomar
47,47655,mozo sirvame otra copa
48,47656,por mucho que lo pongas en bucle no habr ms de 40 amigos
49,47657,el mozo de mi cumpleaos
50,47658,onte estivemos en pontevedra no caf mozo que realizamos co candidato  alcalda ivanpuentes un encontro no que falamos sobre as polticas a favor da mocidade para aplicalas no prximo goberno municipal
51,47659,que buena mariachis en vez de carmen wrclivees
52,47660,jajajaja que risa tambin disfrut ese momento
53,47661,grande checo
54,47662,jajajajaj esta super emocionado grande checo
55,47663,ogier es de otro planeta wrclivees
56,47664,estimada pendeja la ciruga esttica no es hereditaria
57,47665,solo para adultos
58,47666,la otra dndole el feliz da del hombre al mozo resptate yeme
59,47667,el mozo me ofrece dos postres suspiro lmeo o apalastado de chocolate voy por el aplastado de chocolate tena pimienta pens que era un error y no tiene 7 tipos de pimienta a quien le puede gustar
60,47668,que un rappi te pida aumentar la propina sin terminar el servicio es como q lo haga el mozo en un restaurante antes de traer la cuenta
61,47669,la joya del bsquet de estados unidos que tiene madre rosarina es fan de messi y quiere jugar para la seleccin argentina por julin mozo
62,47670,y el mozo del evento un bombonazo
63,47671,pensando yo ac andar con alguien implica dejar de coquetear con otros u otras no permitir faltas de respetos ni lisuras de ciertos mensajes o comentarios y respetarse as mismo y darle respeto a tu persona o compaa temporal si estoy errado me lo hacen saber gracias
64,47672,yo no soy celoso si t tienes novio no me importa ser tu mozo
65,47673,la estupidez no se disimula
66,47674,las crnicas del mozo gallego por soriani12 son muy graciosas aparte tiene un plus porque el hombre del repasador y la bandeja es cuervo ms q los primeros gallegos q bajaron por ac de los barcos
67,47675,la comida libanesa entro a mi top 5 tan cmodamente que no me di cuenta hasta que hoy nos reconoci el mozo del restaurant
68,47676,la joya del bsquet de estados unidos que tiene madre rosarina es fan de messi y quiere jugar para la seleccin argentina por julin mozo
69,47677,obvio que cambi el recorrido que hago caminando para volver a mi casa todos los das y camino una cuadra de ms solo porque me enamor del mozo de un bar
70,47678,cv de angel busco trabajo de operario de carpinteria logistica mozo carga descarga peon ayudante de construcci
71,47679,vine a comer a un lugar bien porteo comi pizza flan con crema y hable de ftbol con el mozo
72,47680,ya me dieron el feliz da del mozo y a ustedes
73,47681,la fiesta la ponemos nosotros rumba merengue universitario soyhinchadelau unidosxlau sociouadherente unalocura1924 nsa u12
74,47682,a correa le cantan las verdades y ni siquiera se inmuta no tiene sangre en el rostro este prfugo miserable
75,47683,qu de malas me ponen deberas
76,47684,la joya del bsquet de estados unidos que tiene madre rosarina es fan de messi y quiere jugar para la seleccin argentina por julin mozo
77,47685,tener buen nivel de ingls decirle al mozo un caf con leche frio porque me da vergenza pedirlo como iced latte
78,47686,ese momento cuando juegas a las peleitas con tu pareja y te das cuenta que te esta ganando
79,47687,todas las remeras mi favorita es esta me derrito no puede ser tan hermoso y no mozo gh22 gh23
80,47688,y motor de emprendimiento
81,47689,buenos das desde el infierno ya me pidi el diego 4 de barbacoa de desayuno no est tan mal como creen est peor el partido de alan mozo
82,47690,dicen que uno no escoge a su familia pero nosotros amamos a la nuestra rumba merengue universitario soyhinchadelau unidosxlau sociouadherente unalocura1924 habla crema espacio crema
83,47691,en su seccin nuevas formas de ligar presentamos pngale los cueritos de mi barbacoa a las perritas de la seorita hahahahahahahja gracias buen mozo
84,47692,cuando estaba en un hospital de barcelona para sacarme sangre y el mozo me dijo nom y yo bueno pues alicia y luego que ms y yo le dije que nac en febrero
85,47693,lo que me ofende es como juega cisneros como defiende mozo y que taylor swift no pele al disco debut
86,47694,desde su niez effy conoca acerca de sus dotes sociales y persuasorios exprimindolos con regusto si as se complaca entonces empero de este se olvid para deleitarse con holgura de la situacin al mozo emul al catar la pizza suspirando complacida ante gt
87,47695,un francs dejando 5k de propina unas ganas de ser mozo ac
88,47696,como persona que de vez en cuando ejerce de mozo de descarga los vampiros no pero las perras comen he notado que cada vez se os va ms la pinza para qu coo queris neveras de 3 metros colega asesinos
89,47697,feliz da do pai  meu mozo porque me coida acompame emocionalmente e  un espazo seguro que xa  mil veces mis que o que fixeron o resto de figuras paternas na mia vida xdddd daddy issues que se levante freud do nicho e que vea dicirmo
90,47698,ayer me dijeron que le ladre al mozo
91,47699,es decir esperemos cinco aos ms as y en 2028 volvemos a poner el tema no abusen por defender todo se pueden quedar sin nada
92,47700,ya para dieguito seguro fuiste a misa le diste la paz a tu co sentado y tragaste hostia y ahora me sales todo fumadote hablando disparate y medio para no hagas sufrir a tu s mozo s
93,47701,la trama de que ayer me pegu con una fea
94,47702,max y leclerc a la cola a checo le va a explotar el motor como se haga la 33 y la 100 a la vez el da del padre yo procedo a cagarme encima y a saltar por la ventana
95,47703,girar la jugada de derecha a izquierda para activar a cabecita rodrguez fue una de las claves de la victoria de amrica vs chivas apost al 1 vs 1 del uruguayo contra mozo y gan a veces para activar un desdoble otras para atacar su espalda
96,47704,feliz da para nosotros los sinceros
97,47705,os traduzco el gobierno desdelamoncloa sabe que el sistema de pensiones est quebrado pero no se lo ha notificado a los trabajadores
98,47706,arreglan las cosas con el marido y se olvidan del mozo pero bueno as es la vida
99,47707,mor si su novio solo quiere estar cul14nd0 y no hacer otro plan con usted eso no es un novio es un mozo
100,47708,de mozo a los medios de comunicacin darokneubu nos cuenta sobre la eleccin que tom a sus 18 aos y su pasin por la carrera
101,47709,tengo un crush con mozo can wtf
102,47710,concedido o programa obradoiro talento mozo con gran alegra informamos de que somos un dos 30 centros galegos seleccionados unha nova experiencia mltiples aprendizaxes eduxunta fpgalicia
103,47711,anoche en peuteo entro lil nas con todos sus bailarines y despus me chap a un mozo gran noche
104,47712,alfondohaysitio la mejor decisin alessia decidi terminar para siempre con el joven mozo
105,47713,el wacho 4 tiros 4 goles beltrn y pocho unos fantasmas mucha carrilla a los cisneros pero lo que estn apapachando a estos 2 alcohlicos es una mentada de madre anoche se cayeron las ms grandes mentiras de chivas mozo y chicote son una cosa lamentable en chivas
106,47714,la joya del bsquet de estados unidos que tiene madre rosarina es fan de messi y quiere jugar para la seleccin argentina por julin mozo
107,47715,en el peor momento y en el peor da el pocho guzmn y el nene beltrn desaparecieron adems el chicote y mozo volvieron a ser los de siempre no le sali nada a chivas
108,47716,otros 10 aos hasta que tengamos una lnea de metro porque esa es la excusa no como no hay metro llevo mi coche hasta el sitio ms cercano y all lo planto aunque sea el parque de todos o la casa del vecino no me identifico con este beticismo
109,47717,estaba escondida esa deuda el que llego no sabia es como que te fundas en un bar lo vendas el que te compra toma al mozo y 5 aos despues quieras que el que te vendi se haga cargo porque te fue mal algo as o sabias las reglas de juego es pregunta eeee
110,47718,mi novio ayer trabajo de mozo en unos 15 yo me dormi a las 1 30 de la maana no se en que momento de la noche agarrre el celular y le puse eso jajajajajajajajajaj lo que entend q le puse poner fue a q hora venis maana jajajajajajajaja
111,47719,empieza la semana de descarga de cafena deseenme suerte panitas
112,47720,19 3 14 07 mars xa tas pensando en poerme os cornos 19 3 14 09 vic si 19 3 14 09 mars quien 19 3 14 09 mars dime quien 19 3 14 09 mars para que yo pueda llorar con razon eu solo quera un mozo q nn me montara dramas
113,47721,y la tierra se contamin bajo sus moradores porque traspasaron las leyes falsearon el derecho quebrantaron el pacto sempiterno isaas 24 5
114,47722,simanic necesita estar punteado para meter de 3 solo tiene peor porcentaje este mozo
115,47723,escrib la historia de los adams y sus hijos marcus y mximo que pueden ser convocados para nuestras selecciones lo que opinan ambos las ancdotas de su madre cmo van los trmites y la visin de mariano marcos coordinador de formativas en cab
116,47724,adivinen quienes no comern habichuelas con dulce en s santa exacto gonzalo castillo el penco jos ramn peralta el rey del ajo y donal guerrero el buen mozo
117,47725,praga es blanquivioleta y con su verdadero escudo
118,47726,amigo termine mi fin de semana hermosamente bien dioos le volvi a ver el lado lindo a gg lrpm
119,47727,mi gestin de los comentarios en estos vdeos
120,47728,orgulloso de las amigas que tengo ayer discut con el mozo atine a irme y ellas se iban conmigo gente as
121,47729,un pcaro mozo
122,47730,la joya del bsquet de estados unidos que tiene madre rosarina es fan de messi y quiere jugar para la seleccin argentina por julin mozo
123,47731,cultivar kiwis mozo en sydney no me voy a enlistar en la armada australiana mir lo que es ese marketing perro yvanehtnioj
124,47732,que se espera
125,47733,onte tivemos xsgalicia xsgpontevedra un caf mozo en pontevedra con ivanpuentes a cidade precisa de ideas e proxectos novos que respondan s necesidade da cidadana pero en especial da mocidade sers un gran alcalde
126,47734,hip hip hip hip hip hip hip hip hip q peaaaa y perikonke estaria bebiendo cn el primer mozo de la nacion gustavobolivar el compaero sentimental clandestino d rosita jaja mariana38311921 jarizabaletaf lauraqc88 lauramedinaruiz claris1085 luchirincon3 luz 0226 ghitis
127,47735,buenos dias mis ninjas color carton es domingo y me levante como a las 6 30
128,47736,opinin sebastin ormazbal periodista imagen de jos hernn fuenzalida kiosquero por 40 aos vio el desarrollo de nuestra ciudad en las afuera de la estacin de trenes la gran oportunidad de recuperar nuestro barrio estacin en curic va vlnradio
129,47737,nuevo vdeoooo again
130,47738,empleopublico diputacin provincial de cuenca anuncia inicio plazo presentacin solicitudes provisin 1 plaza mozo a almacn oposiciones administracionlocal diputacionprovincial
131,47739,el mozo de la brincona un parasito que nunca a creado un solo empleo viene hablar mierda este ignorante que por su falta de educacin financiera y como buen socialista vive sabroso con el dinero del pueblo la cual se lo roba este hp
132,47740,la joya del bsquet de estados unidos que tiene madre rosarina es fan de messi y quiere jugar para la seleccin argentina por julin mozo
133,47741,llamo a mi abuelo y me dice como  que est o teu mozo aqu e ti non automticamente yo
134,47742,la joya del bsquet de estados unidos que tiene madre rosarina es fan de messi y quiere jugar para la seleccin argentina por julin mozo
135,47743,oferta de empleo mozo a campa vehculos en valladolid valladolid trabajo
136,47744,venga que todo el mundo est colgando fotos de sus padres pues yo tambin a presumir el mo es el buen mozo del fondo nunca le han gustado las fotos como a mi la guapetona a su lado es mi madre
137,47745,oferta de empleo mozo especialista 5 carretillas h m x 16h semanales en fin de semana meco trabajo
138,47746,oferta de empleo mozo de almacn con carretilla h m x molins de rei trabajo
139,47747,aun recuerdo cuando la psicologa de la asociacion espaola contra el cancer me dijo que era huerfano aquello me dejo completamente en shock y me dejo un nudo en el estomago totalmente cierto esto
140,47748,me enamore del mozo
141,47749,me encanta como se han hecho un equipo unido y que mozo es parte de eso verlo que se ha enamorado chivas tambin me encanta le haba puesto un chingo de huevos hasta ahorita elperro partido ms importante ptm
142,47750,pedimos jarra de fernet el mozo dice cargadito o tranqui lo miramos nomas sin miedo al xito
143,47751,estbamos comiendo en un bar y viene el mozo un pibe de nuestra de nuestra edad y dice disculpame la expresin pero estos pajeros se confundieron de orden jajajajajjajjaajja no pasa nada flaquito esperamos tranqui
144,47752,era mi primera cita tena 17 ella 19 no saba a dnde llevarla fuimos a lince entramos a comer le dije siempre vengo y no se acercaba el mozo era autoservicio luego la lleve a un casino porq no lo s no me dejaron entrar por ser menor igual fuimos pareja 1 semana
145,47753,es increble lo culero que se jug hoy chivas no se rescata a nadie pero no mames con el asqueroso juego de mozo y el oso tanto que los presuma
146,47754,mozo y 10 ms hoy en clsico
147,47755,no le ped el ig al mozo y ahora me arrepiento
148,47756,gracias al mozo q m dejo la bandeja s sanguches
149,47757,el mozo mientras levantaba la mesa me dijo sos tauro no jjajajaa queeee
150,47758,por cierto en el juego de esta noche antes de la masacre america ya habia mostrado las deficiencias defensivas en el lado de mozo tambien el delantero de chivas se comio un gol el tecnico fall y pues en la delantera se not la falta de calidad
151,47759,si los bombones son felicidad esta casa es una caja de bombones
152,47760,debo ser el mozo mas fachero de la patagonia
153,47761,me atendi el mismo mozo por segunda vez y me reconoci por dentro estaba
154,47762,ofertas trabajo mozo de almacn se busca mozo de almacn con experiencia demostrable
155,47763,me enamor del mozo
156,47764,no llores no llores
157,47765,la mejor parte de trabajar de mozo es cuando ya me quedo solo en la cocina me preparo un traguito y papeo los chegusanes
158,47766,cmo pisotear la historia con dinero pblico lo que se consigui en la expo92 lo han borrado utilizando ms dinero pblico en vez de reutilizarlo y divulgar a los jvenes de ahora lo que aprendimos y disfrutamos hace 30 aos
159,47767,para que algo enserio si ya soy tu mozo
160,47768,ya no hay jugadores de esos en chivas 5 canteranos y nadie fue a encarar a henry a veces hasta la gente de fuera es la que pone huevos chicote mozo pollo en su momento pulido y pizarro
161,47769,ms noches como la de hoy
162,47770,estoy trabajando y paso un mozo que labura en el centro y me regalo una caja llena de milanesas a la napolitana no le di un beso de lengua pero falto poco jaja un amor el tipo
163,47771,mi once para vs amargo tala olivas mayorga mozo briseo e torres prez bouquet oso cone tepa y ros 4 3 3
164,47772,mozo sirvame otra copa
165,47773,que ingenuo mozo yendose a las chivas solo para ser humillado por el amrica perfectamente pudo haberse quedado para ser humillado por el amrica con pumas
166,47774,que bueno que soy como mozo hasta que me pongo a hablar al pedo y ya que estoy me siento en la mesa y ya me olvid de lo que me pidieron tamb que labure otro
167,47775,lo de mozo hoy una vergenza haha
168,47776,el nico jugador que mostr hambre y ganas fue alan mozo no puede ser que un jugador que no salio de la cantera le meta mas webos que el pinche tiba seplveda y el charal cisneros
169,47777,entr al bar el mozo me ofreci una mesa para dos y le dije haceme una de 15 y me dijo obvio ya mismo te la preparo
170,47778,analizando el partido a malagon lo quiero para la seleccin israel r quedo poco por demostrar al nene siempre lo quiero pocho quedo a demostrar chiquete si o si mi nalgon igual mozo aun puede colarse
171,47779,retiro lo dicho lo nico era mozo
172,47780,una displicencia del cabecita rodriguez al no marcar con rigor a alan mozo origin el segundo gol de las chivas ojo ah clasiconacional
173,47781,me duele decirlo pero es una realidad mozo di un partido para el olvido junto con el chiquete y mi pocho guzman aunque fue todo el equipo en realidad pero ellos 3 son los que ms me duele
174,47782,mozo alan mozo51 seplveda gonzlez los cisneros el wacho y para rematarla un pendejo que se cree d t la neta que chingados pretende amauryvz con un plantel tan culero nada ms por que las gallinas tambin estn en un momento culero si no esto pudo ser peor
175,47783,muy completa la barra de comedia por parte de chivas para el clsiconacional arranc en la semana con franco esca jerofreixas y facufacundo y termin en la cancha con alan mozo el wacho jimnez y el pocho guzmn
176,47784,la palabra espectacularidad con chivas no cabe yayodelatorrem dej en claro que chivas debe trabajar los partidos y ser prcticos y ojo que lara y mozo tienen ms en la cabeza de lo que saben hacer guzmanjuegue salimgol ruubenrod santiago4kd lup
177,47785,dentro de lo malo de la goleada se agradece que el amrica haya desenmascarado la farsa de tres nombres propios del club tiba seplveda alan mozo y victor guzmn esperemos paunovic pueda sacar lo mejor del baile que les pusieron
178,47786,que gozada fue ver a mozo y guzman berreando de coraje
179,47787,no te vi mas q en la entrevista guzmanpocho06 y de piln roja wey qu alegan con el rbitro ni las uas metieron vaya forma de perder
180,47788,hoy amrica es muy superior sin duda pero creo que hoy el mayor factor se llama jonathan rodriguez el cabeza es un jugadorazo que hizo pedazos a mozo que vena jugando bien ah radic la gran diferencia
181,47789,a mozo se le dificulta defender aunque para mi en ataque se agregaba bien por eso en lnea de 5 hubieran controlado ms el juego abajo hubieran funcionado mejor con tiba por derecha morsa al centro y chiquete de lado izquierdo con chicote y mozo de carrileros al final as fue
182,47790,lo de mozo es triste llevaba varios juegos con nivel pero lo que demostr hoy opaca completamente el trabajo que vena haciendo
183,47791,sigan con sus pinches shows de mierda chivas hay maneras de perder ni las putas uas metieron cagados todos hasta el narizn de dt
184,47792,mozo a de almacen carretillero a las palmas pmp003 empleoya es
185,47793,me encanta cuando el tribunero mozo solo le aplauden los saques de banda
186,47794,chicote caldern pocho guzman piojo alvarado alan mozo todos ellos pueden irse del equipo chivas que vergenza tener jugadores como ellos no me imagino que un nio tenga de dolo a uno de ellos primero por sus apodos segundo por su actitud
187,47795,ver a mozo y a mayorga jugando juntos me trajo recuerdos
188,47796,alan mozo most spectacular skills vs amrica the new cafu
189,47797,se esperaba ms de ti guzmanpocho06 alan mozo51 oso ferbbeltran menos bla bla bla
190,47798,conclusiones mal da para que mozo y oso nos demostraran su realidad arrancaron cagados tiba calderon y los cisneros siguen dando una buena y 77 malas mientras la basura no se barra poco cambiar no merecen ms el pocho no lleg al juego ms importante una tristeza
191,47799,el chicote vive de 2 goles contra 3l amrica y mozo de unos centros contra el amrica hoy ambos valen madre
192,47800,mozo es ms malo que los pumas
193,47801,lo peor de este partido fue pocho guzmn y mozo carlos cisneros no lo mencion porque para mi no cuenta cmo parte del equipo
194,47802,el mozo de mi ex no me pregunto pero bueno cada quien
195,47803,una verdadera vergenza chivas tiba mozo cisneros ronaldo ros alvarado no se que hacen ah una mmda de jugadores revisen los videos y vean si rendimiento de pena y nuevamente en casa
196,47804,la neta es que para que alan mozo juegue tu contencin de ese lado debe cuidarle la espalda sin eso pasa lo de hoy aparte que nunca presion y es bueno en eso se desaprovecha
197,47805,pa que me invits a viajar contigo cuando tens novio siento que se est volviendo de moda tratarme como mozo y ahora que me comprs un departamento en la misma cuadra pa q me visits cuando quers las agallas que tens parce
198,47806,que tan mal andaba la seleccin hace un ao que mozo pensaba que le alcanzaba para ir al mundial
199,47807,invertir en cryptomonedas para comprar a mozo ah sido una judada de ajedrecista de parte de mu licenciado amaury vergara
200,47808,mozo no te mejora a adrian aldrete
201,47809,mucha risa con alan mozo que es una vergenza pero lara y reyes son una cagadisima tambin se le ve bien a los proximos laterales de mxico
202,47810,ay mozo con todo y tus carencias cmo quisiera que estuvieras en los pumas
203,47811,venga mozo t sabes como remontar partidos lo hiciste en pumas alan mozo51
204,47812,puedes sacar a mozo de pumas pero no puedes sacar a pumas de mozo
205,47813,saliendo de aqui me dirigo al pancho a ponerle un kersey de alan mozo esque es de ponerle un traje revolucionario a su par de webos nmms
206,47814,nms que wapo es alan mozo pero se vea mejor con el jersey de pumas
207,47815,es que mozo weeeey esa actitud
208,47816,as fue el centro de mozo que emilio desvi a propia puerta en vivo por
209,47817,al parecer mozo no tenia en el radar a el mesobas
210,47818,deportes cae el descuento alan mozo envi un gran centro al rea y emilio lara mand el baln al fondo de las redes de su propio portera chivas lo pierde 4 1 ante amrica rams alex tvaztecajaliscodigital
