,Id,Tweet
0,30207,felicidades a nuestro candidato a presidente que san jos le ilumine y acompae en este desafo que asumi por el bien de los argentinos juanjomalvinas
1,30208,sanjuansacatepquez feria en la aldea cerro alto la belleza est presente en las actividades de la feria de la aldea cerro alto que celebra al patriarca san jos aldea cerro alto
2,30209,hermoso desfile de san jos maracay excelente gracias a nuestro alcalde rafaelmaracay21 y a nuestra hermosa gobernadora soykarinacarpio estamos en das de ferias y tos ha sido mgico
3,30210,saba que hoy es da de san jos pero este otro es nuevo
4,30211,la procesin de san jos en elche recorre las calles amenizada por la banda de msica de torrellano
5,30212,la procesin de san jos en elche recorre las calles amenizada por la banda de msica de torrellano
6,30213,san jos patrono de paraguaipoa protege a todos tus hijos e intercede ante el seor para que siempre tengamos vida y salud hermosa eucarista que con fe y tradicin realizamos en este centenario de la llegada de tu imagen a paraguaipoa manoduracontraloscorruptos
7,30214,la procesin de san jos en elche recorre las calles amenizada por la banda de msica de torrellano
8,30215,19mar domingo y da de san jos de visita en el tejero estado monagas haciendo una revisin de la estructura de voluntadpopular eltejero preparando en monagas a la familia naranja todos unidos con jguaido
9,30216,vsperas de la solemnidad de san jos bendito patriarca san jos aumenta nuestra fe y protege a nuestras familias seor san jos tu sabes mis penas rogad al seor que se duela de ellas del tronco de jese nacer un bastago que dominar con cerro de hierro a las naciones
10,30217,no me acuerdo hasta ahora haberle suplicado cosa que la haya dejado de hacer santa teresa de avila sobre san jos
11,30218,para que oremos a san jos en su da cariosamente parroquia nuestra seora del carmen san fernando
12,30219,solemnidad de san jos oracin psanjuanbautistamcy cuaresma2023 cuaresma sanjos
13,30220,19mar venezuela conmemora cada 19 de marzo el da nacional de la llaneridad en honor al patrono de la ciudad de elorza en el estado apure las fiestas patronales en elorza se celebran en esta ciudad la cual fue fundada en 1774 y cuyo primer nombre fue san jos de arichuna
14,30221,para que oremos a san jos en su da cariosamente parroquia nuestra seora del carmen san fernando
15,30222,crisis de la virilidad sermn para el da de san jos a travs de youtube
16,30223,oraciones a san jos magnificattv franciscanosdemaria
17,30224,en el da de san jos les deseamos a todos los hombres un feliz da diadelhombre dadesanjos evu
18,30225,san jos ruega por nosotros y proveenos
19,30226,os escribo en su preciosa sangre con el deseo de veros verdaderos servidores fieles a nuestro dulce salvador     san jos jos de ribera 1591 1652
20,30227,nuevo cuscatln celebra sus fiestas en honor a san jos desde el pasado viernes
21,30228,resulta irnico que los organizadores de la gran feria de san jos de david hablen de que hay que rescatar los valores y nombren abanderado a una persona cuestionada precisamente por los valores que se quieren rescatar la poltica haciendo graciosa gala de su influencia
22,30229,las habilidades equinas y destreza criolla estuvo presente en el 5to festival san jos en yerbabuena una fiesta para la familia muniyerbabuena mariano campero festival tucumn
23,30230,actualizacin contina el combate al incendio en una recicladora de la colonia san jos del 15 en el salto sealan que el material consumido es plstico sin reportes de lesionados trabajan en coordinacin con pcjalisco los bomberos de el salto pctlaquepaque
24,30231,no es da del hombre es de san jos verdadero hombre pap y esposo los enemigos de dios inventan en los das de santas fiestas un da que vaya en contra de esas santas fiestas inventaron para tapar navidad al santa claus inventaron carnavales para opacar cuaresma
25,30232,san jos varn recio ruega por nosotros
26,30233,jess luz del mundo ten misericordia de nosotros san jos protector de la iglesia universal ruega por nosotros felizdomingo cuartodomingodecuaresma evangeliodehoy eucaristia
27,30234,feliz da tambin a vos que te dejas ese bozo sanjos diadelhombre
28,30235,san jos de paraguach
29,30236,me dio mucho gusto acompaar a vecins a celebrar a san jos de los dinamos en la col atacaxco la magdalena contreras gracias por la invitacin
30,30237,solemnidad de sanjos 20 de marzo 2023 la solemnidad de san jos fue trasladada en la liturgia para el da 20 de marzo por coincidir el 19 de marzo con iv domingo de cuaresma santodelda psanjuanbautistamaracay psanjuanbautista seguir viendo
31,30238,san jos ruega por nosotros
32,30239,efemrides 19mar se conmemora el da de san jos en 1847 fue nombrado san jos obrero como patrono de la iglesia universal por el papa po ix como modelo de padre y esposo custodio de la sagrada familia con jess nio y mara madre de dios guerracontralacorrupcin
33,30240,oviedopsuv celebramos desde la bms luchadores de san jose de cacahual los 50 aos del barrio junto a sus pobladores disfrutamos de un rico sancocho juegos deportivos y culturales una fiesta del pueblo en revolucion nos sentimos orgullosos de lo que hemos construido juntos
34,30241,mil planas no usar a san jos como amuleto
35,30242,con razn tanto pinch cohete y camarazos como deca mi abuela pinch gente idiota no puede ser carnaval si estamos en plena cuaresma al menos que se celebre san jos pero no es san baltazar campeche y cada ao es la mismsima chingadera con la plvora
36,30243,y hoy da de san jos por si se les haba pasado
37,30244,bomberos de tlaquepaque tonal y tlajomulco atendieron un incendio en una recicladora de plstico en la calle revolucin al cruce con 5 de febrero en san jos del 15 el salto indicaron que no hay personas lesionadas ms informacin en noticietoenpunto con alejandragomz
38,30245,san jos ruega por ellos bendicin a los varones de mi parroquia
39,30246,san jos intercede por los anhelos de mi corazn
40,30247,jhsanchezjacome jos fue verdadero esposo de la virgen y la am como un varn ama a una mujer mejor dicho como un varn santo ama a una hija de dios an mejor como un joven santo ama a una joven hija de dios jos f rey ballesteros
41,30248,esquela a causa de infarto falleci el reconocido tenor juchiteco edilberto regalado mientras cantaba en la misa de san jos en su natal juchitn descanse en paz oaxaca
42,30249,hoy la iglesia celebra lo que el espritu santo hizo en san jos porque toda la belleza de los santos es obra del espritu santo san jos nos muestra cmo el espritu santo puede transformar la sencillez de nuestra existencia cotidiana y hacer algo grande en medio de lo ocult
43,30250,feliz da del padre a los espaoles amigos del twitter y a los carpinteros que hoy en san jos
44,30251,hoy en la celebracin de san jos de tacata municipio guaicaipuro miranda movimiento agrario presente
45,30252,pero a quin le importa el da de san jos todos los que celebran o tuitean sobre el da del hombre aceptando pblicamente que son cacho contentos
46,30253,san jos terror de los demonios
47,30254,pablo snchez y alicia berzosa ganadores de la xl carrera de san jos
48,30255,hoy cumple dos aos nuestro hijo menor pablo quien ha sido un verdadero guerrero todos estos das que ha estado hospitalizado hemos sentido la maravillosa intercesin de san jos en la recuperacin de este pequeo gracias a todos por sus oraciones y sus muestras de cario
49,30256,sabas que el templo de san jos es el ms elevado de la ciudad hoy celebran al santo patrn
50,30257,meditacin de la noche seor mi dios aydame para que al despertar sea una persona nueva que sepa valorar todo lo que me das que mire la humildad de san jos varn santo y fiel a quien pido interceda por m y por mi familia abrzame seor te necesito sentir amn
51,30258,la ley y el orden son smbolos antropolgicos de la figura del padre ese es el smbolo perdido y ausente en nuestro pas sumido en el caos y rebelda san jos prncipe de la casa de david protege al ecuador
52,30259,evangeliodelda feliz da de san jos hermanos jos es la llave que cierra el antiguo testamento y abre el nuevo dios escogi un padre para que aprendieran que son depositarios de una gran responsabilidad esposadelespritusanto
53,30260,hoy es mi santo ra san jos y nadie me felicit
54,30261,existe el buen amor y hay un gran modelo feliz da de san jos
55,30262,laudes 20 3 23 lunes iv de cuaresma solemnidad de san jos esposo de la santsima virgen mara jos se estableci en una ciudad llamada nazaret as se cumpli lo que de cristo haban anunciado los profetas que sera llamado nazareno
56,30263,las fiestas patronales municipales en nic pasaron de ser celebraciones religiosas a actividades partidarias vista area de un pueblo norteo en celebracin de san jos derroche de recursos para una barrera y un bar putero el caramelo picante en uno de los barrios ms pobres
57,30264,dia de san jose
58,30265,feliz da de san jos
59,30266,video discriminacin en la telesecundaria de san jos manialtepec en la villa de tututepec oaxaca niegan ingreso a menor de edad por llevar pantaln
60,30267,san jos bendito alviame mis penas dile al buen jess que se apiade de ellas sanjose
61,30268,fiestas de elorza se celebran en la poblacin de elorza capital del municipio rmulo gallegos del estado apure todos los 19 de marzo en honor a san jos patrono de la ciudad manoduracontraloscorruptos
62,30269,a las 19 00 comenzamos la eucarista de este 4 domingo de cuaresma en devoto celebrando tambin a sanjos
63,30270,cmo manda la tradicin y me deca mi abuela hay que plantar los fiscus el da de san jos para que te agarren
64,30271,no haba cado en cuenta que hoy es san jos mi mam quera mandar a matar un puerco para festejar mi santo jaja el mejor regalo que pude tener hoy es la lluvia y saber que un animal no muri pot mi culpa
65,30272,seora presidenta dina boluarte premier alberto otarola ministro de justicia tello los ciudadanos que defienden la democracia familia paz tranquilidad les piden urgente gestionen y el per salga del pacto de san jos as todos los que cometan asesinatos deben ir preso
66,30273,feliz da san jos ruega por nosotros
67,30274,hoy es el da sanjos y en yerbabuena lo celebramos de forma especial esta tarde pude presentarle una ofrenda me acompaaron clara pistn y vecinas de la comunidad de san jos recibimos una bendicin dimos gracias y pedimos para que el santo patrono nos siga acompaando
68,30275,atencin colon sanjose cdelu necesito informacin de alguna vinoteca compaera para poder poner a disposicin del pueblo los vinos de factor francisco algn contacto para pasarme
69,30276,llueve llueve como llueve un da de san jos lluvioso verano y verano lluvioso en este pas nuestras 2 estaciones
70,30277,me da mucha ternura san jos
71,30278,el norte entrerriano est de fiesta por el bicentenario de san jos de feliciano junto a bordet participamos de la celebracin que honr 200 aos de historia y tradicin gracias al intendente damianarevalo por el clido recibimiento y felicidades a toda la comunidad
72,30279,me parece ideal que no quieran celebrar el da del hombre porque no es justo que sea un motivo de festejo el engao tan salvaje que le hicieron a san jos dizque una paloma a lo bien
73,30280,incendio en una recicladora en revolucin y privada revolucin en san jos del 15 el salto es un rea de afectacin de 30 x 50 metros ninguna persona lesionada trabajan en coordinacin con bomberos de el salto tlaquepaque tonal y tlajomulco tvaztecajalisco
74,30281,gran fiesta de nuestro pueblo san jos de los arroyos caaguaz jinetes esperanza y alegra lista 15 opcin 4 partido unmonos fernandocamposlopezmoreira senador
75,30282,fin de semana casillero con la celebracin de su patrn san jos martos encomiendadelvboras festejos sanjos
76,30283,trfico un motociclista y una camioneta chocaron en la 3 avenida sur del barrio san jos en zacatecoluca la paz el conductor de la moto sufri lesiones por lo que fue trasladado por una ambulancia de comandos de salvamento hasta un centro mdico tcsn
77,30284,hoy es el da de san jos as q feliz da a todos los jos q vean este tweet 3 ya es de noche pero igual jaja
78,30285,hoy es da de san jos el arquetipo del hombre padre en la religin catlica celebrados en espaa en un mundo donde se espera que el hombre sea responsable de todo lo que no funciona es buen momento para tambin valorarlos por lo que aportan contienen y comparten los amo
79,30286,fui a misa a pedir por mi san jos que sea tal cual lo que mi corazn anhela
80,30287,buenas noches feliz y bendecida noche da de san jos isa3095515419 solymart1 sergiohen10 dracortezmaria yulieee1111 alejita pics carmenjosefama3 ilsegueva lichis361 molandre23 nanunsc2 norelysr12
81,30288,feliz da del simp dia de san jos que cro a cristo como si fuese su hijo diadelpadre simp
82,30289,el da de las y los carpinteros es una tradicin catlica que se celebra cada ao el 19 de marzo da que en el calendario gregoriano corresponde a san jos padre de jess de nazaret y de oficio carpintero
83,30290,mi mejor regalo el sanjos prometido felizaniversario agradecidos
84,30291,qu san jos sea siempre modelo de hombre para los padres
85,30292,peregrinacin hoy se llev a cabo el recorrido de los jvenes voluntarios hacia la catedral metropolitana santuario nacional san jos como preparacin del da nacional de la juventud en ocasin al da del santo patrono san jos dnj radiomaria llenadeamor dnj
86,30293,prez vivas acompa procesin por el da de san jos y reafirm sus valores cristianos
87,30294,san jos de jchal fue fundada en 1 751 a orillas del ro jchal alrededor de la vieja capillita levantada en el sitio donde quiso quedarse la imagen de san jos en tu da san jos te pedimos que protejas a tu pueblo de la perversin de los codiciosos lamegamineriacontamina
88,30295,san jos tiernsimo padre de jesucristo nuestro seor protege a todos los nios de la ideologa de gnero la oracin es la mejor arma qu tenemos es la llave qu abre el corazn de dios buenas noches venezuela
89,30296,dejen de tomar a san jos solo para pedirle un novio san jos es mucho ms que eso
90,30297,ultimahora juchitn y oaxaca estn de luto vctima de un infarto muri el tenor juchiteco edilberto regalado el lamentable hecho sucedi en el fraccionamiento riviera de su natal juchitn justo cuando participaba en la misa de san jos seculta goboax
91,30298,san jos patrono de la iglesia y las familias
92,30299,da de san jos por qu se celebra el 19 de marzo de cada ao nacionales
93,30300,dios te salve oh jos esposo de mara lleno de gracia jess y su madre estn contigo bendito t eres entre todos los hombres y bendito es jess el hijo de mara san jos ruega por nosotros pecadores ahora y en la hora de nuestra muerte amn
94,30301,diadelhombre hombre es aquel que cada maana amanece con nuevos propsitos y retos por enfrentar alimenta el amor y brinda valor a quienes ama se celebra en honor a que este da en la religin catlica se festeja a san jos de nazaret padre adoptivo de jess felicidades
95,30302,los hermanos de la orden de los carmelitas de la santa faz cantando durante la misa pontifical en honor a la fiesta de san jos 19 de marzo sanjose iglesiapalmariana elpalmardetroya
96,30303,morales y sadir participaron en las honras a san jos en perico haga clic ver tambin
97,30304,invasin de pulgas provoc la suspensin de clases en un centro de la utu se hicieron varias fumigaciones la noticia sanjosahora noticias informacin sanjose uruguay
98,30305,todos los nios del mundo merecen tener un san jos
99,30306,me he pasado todo el santo da trabajando y no lo he pensado mucho pero ahora que ya he acabado este es el primer san jos tu santo iaio que no estis ni t ni la iaia aqu un beso al cielo para los dos
100,30307,19mar las fiestas de elorza son conocidas por los venezolanos como las ms criollitas del mapa se celebran en la poblacin de elorza capital del municipio rmulo gallegos del estado apure todos los 19 de marzo en honor a san jos patrono de la ciudad fanb gnb
101,30308,elorza celebr a san jos
102,30309,elorza celebr a san jos
103,30310,vecinos de azcapotzalcomx saquen botes y cubetas tlloc se apiada de nosotros azcapotzalcosinagua da 22 sanjos hazme el milagro
104,30311,color y mucha diversin as se vivi el recorrido de los reyes en caravanas como parte de las fiestas patronales de san jos de vargas nuestropuerto nuestracasa veracruz celebracion
105,30312,en la iglesia san jos estn jugando lotera tal y como indica en el credo catlico
106,30313,en un operativo en el km 76 7 aldea san jos el rinconcito santa rosa de lima policas de la comisara de santa rosa capturaron a deybi de 24 aos cuando se conduca a bordo de una moto desobedeciendo el alto y arrollando en la cinta asfltica a un oficial ii de la pnc
107,30314,orgullosos de nuestros festejos as disfrutamos de la cabalgata en honor a san jos de vargas nuestropuerto nuestracasa veracruz celebracion
108,30315,almomento lamntamos la repentina muerte de edilbertoregalado tenor internacional el cantante juchiteco edilberto habra sufrido un infarto cuando cantaba en la misa en honor a san jos en fracc la riviera en su tierra natal juchitn
109,30316,me he quedado a gusto feliz da de san jos
110,30317,voleyxmdeportes hoy se conmemoraba el da de los casados se conmemoraba a san jos representante de la familia y e su esposa mara un saludo desde paucarpata arequipa familia chacn pinto
111,30318,momentos especiales hoy domingo 19 de marzo se celebra da del hombre a da de san jose si felicidad de felicidad de redearme de amor u aroma vibra de calidez feliz da a momentos a ustedes hombres de esta tierra o universo
112,30319,ciudad gobierno transformara el sur de san jos
113,30320,y quin es seor para que yo crea en l jess le dijo ya lo has visto el que est hablando contigo se es l dijo creo seor y postrndose lo ador felizdomingo sanjose
114,30321,da de la llaneridad el 19 de marzo cuando el poblado apureo de elorza rinde tributo a san jos su patrono fue declarado como da nacional de la llaneridad
115,30322,wenas tardes desde san jos el llanito edomex
116,30323,laligaxwin hoy es el festivo de san jos un personaje mtico de una de tantas religiones que existen afirmar que por eso es el da del hombre es un disparate justo en el mes en el que se conmemora la lucha feminista por derechos civiles pisoteados por hombres durante milenios
117,30324,macarras f c
118,30325,feliz san jos para mi
119,30326,pedregal san jos de las matas 2023 joe different places via youtube suscrbete y dale like
120,30327,feliz da de san jos
121,30328,almomento atendemos un incendio en una recicladora en las calles revolucin y 5 de febrero en san jos del 15 el salto en coordinacin con bomberos metropolitanos es un rea de 30 x 50 metros totalmente propagada de momento no se reportan personas lesionadas
122,30329,con los recursos que maneja la municipalidad de san jos transitarte debera hacerse al menos dos veces al ao la cuidad le pertenece a los ciudadanos
123,30330,la cabalgata de san jos de david cabalga el millonario rico el pen poltico empresario y los que aquilan caballo para fantochar la idea es rendir tributo al patrono y a esta tierra llena de gente trabajadora
124,30331,himno a san jos msica catlica cancin a san jos va youtube un regalo para ud doc en el da de san jos sarubbibenitez
125,30332,san jos se podr seguir felicitando o habr que ser empticos con aquellos que no se llaman jos
126,30333,efemride cada 19mar la iglesia catlica venera a san jos considerado el patrn de la iglesia universal y de los carpinteros en venezuela es homenajeado en las fiestas de elorza estado apure gnbgarantedepaz
127,30334,madrileos os recuerdo que hoy es fiesta se pasa san jos del domingo al lunes
128,30335,felicidades a todos los jos en si dia findefinde sanjose
129,30336,vida mndame mi san jos
130,30337,san jos nunca te deja a pata
131,30338,todo un xito el inicio de las festividades en honor a san jos con la eleccin de diana herrera como la nueva reina de ests fiestas patronales realizada por todo lo alto para nuestra gente gracias al gobernador primitivo cedeo y la alcalda de araure
132,30339,me rehuso a creer que la municipalidad de san jos es responsable por transitarte es as
133,30340,san jos custodio amante de jess y de mara ensame a vivir siempre en tan dulce compaa
134,30341,san jos intercede padrefernandoabraham sanjudastadeolansbsas te esperamos hoy 19 3 a las 20 30
135,30342,la fe de san jos
136,30343,hay la lleva mi primera vara de san jos mexicali
137,30344,19 de marzo da de san jos patrono de flores ahora seguimos acompaando las celebraciones organizadas por la baslica san jos de flores en un da tan importante para nuestro barrio
138,30345,todo un xito el inicio de las festividades en honor a san jos con la eleccin de diana herrera como la nueva reina de ests fiestas patronales realizada por todo lo alto para nuestra gente gracias al gobernador primitivo cedeo y la alcalda de araure
139,30346,san jos hombre justo y sensible ante la voz de dios fue a quien se le encomend la inmensa responsabilidad y privilegio de ser esposo de la virgen mara y custodio de la sagrada familia
140,30347,hoy fui a misa 5 30 pm domingo laetare iv de cuaresma parroquia el santo cristo de la vega en parroquia la vega caracas este martes habr misa de san jos y el viernes confesiones 3 00 pm
141,30348,nos olvidamos que por san jos se celebra tambin el da del seminario en 2023 hay 84 seminaristas en madrid 36 en sevilla 7 en merida badajoz 1 en segovia
142,30349,reflexin dominical san jos acoge y protege el misterio de dios
143,30350,feliz diadelhombre gracias a dios y a la virgen por permitir a san jos ser parte de la familia fedegan jflafaurie cucutapasiongan cimitarraganado fedegansangil fngsur ganaderopl plbucaramanga
144,30351,como municipio tenemos la dicha de tener a san jos como patrono de nuevo cuscatln quien fue un hombre justo modelo de esposo y padre bueno
145,30352,he publicado un episodio en ivoox lunes 20 marzo 2023 san jos podcast
146,30353,santo va crucis parroquial todos los viernes de cuaresma 6 00pm novena en honor a nuestro padre y seor san jos
147,30354,chulada as los juegos mecnicos vistos desde el aire durante la feria de san jos 2023 en almoloya de jurez ubicados frente al auditorio municipal luis donaldo colosio de nuestro amigo y colaborador el chico dron en instagram oscar sanchezmx
148,30355,buenos noches bendecido domingo da de san jose guapas y guapos domingodeportivo etiquetas del da 19mar feliz dia para compartir en familia manoduracontraloscorruptos con todos los entes y organismos
149,30356,dizque el da de san jos da del hombre de santos y de hombres no tienen nada jajajaja
150,30357,manoduracontraloscorruptos san jos fue de condicin humilde y aunque no hay indicios ni datos claros sobre la fecha de su muerte es reconocido por haber fallecido en brazos de jess y mara por lo cual es actualmente tambin el patrono de la buena muerte
151,30358,rodrguez y duran mximos ganadores de la carrera atltica san jos a travs de elimparcialcom
152,30359,san jos colegio zurdo entonces tenemos la derecha ms burra del mundo meritorio
153,30360,19mar hugo chvez comandante de todos los tiempos un 19 de marzo un 19 de marzo as amanece cantando venezuela al ritmo del arpa cuatro y maracas celebramos las fiestas patronales de elorza en honor a san jos adolfop oficial gobiernodelara dsociallara01
154,30361,agradezco a la mayordoma por invitarme a la celebracin de san jos en la capilla de santacruzotzacatipan es un gusto compartir con ustedes nuestras tradiciones diputadodeldistrito2detoluca dippriedomx contigofirmeysolidario
155,30362,hoy da de su santo delante de ti mi dios mi sr sanjose
156,30363,este villancico de sor juana ins de la cruz para la solemnidad de san jos qu delicadeza el trato del tema de los celos de san jos que si a todos los celos quitan el sueo a mi josf el sueo quita los celos
157,30364,denuncia pblica llega a tu colonia en vivo desde la colonia san jos tern estaremos en vivo acompaa a felipe alamilla y al equipo de diariodechiapasmediagroup este 22 de marzo tu opinin cuenta
158,30365,yo si quise felicitar de corazn a mi marido porque es el da de san jos y l es un buen marido no por ser hombre si no por intentar cada da ser un mejor marido y pap en este hogar eso se valora mucho
159,30366,yo soy catlica creo en dios s q hoy se celebra a san jos pero por favor na que necesidad de no terminar ms con las bombas desesperados los nios pequeos mascotas q cosa che
160,30367,hoy 19 de marzo elorza celebra el da se su patrono san jos el santo manoduracontraloscorruptos
161,30368,excelente da es san jos y es domingo asi que tocaba misa eso ya es 1000 gan el arsenal alonso con podio confirmadisimo gan gimnasia gan el bara
162,30369,hoy es da de san jos
163,30370,19marzo san jos esposo de la virgen mara
164,30371,el 19 mar se celebra el da de san jos el 18 jun se celebra el da del padre el 19 nov se celebra el da del hombre de nada
165,30372,gracias san jos porque cristo al darnos a su madre te hizo a ti nuestro padre gracias san jos porque nos amas nos cuidas y proteges como hiciste con tu querida familia 19demarzo diadesanjose sanjose ilustracin davovillao
166,30373,oh patriarca santo humilde jos a ti mis plegarias dirijo con fe sanjose sanjos
167,30374,incendio de un terreno sobre la calle privada revolucin casi esquina con la calle revolucin en la colonia san jos del quince el quince elementos de proteccin civil y bomberos ya se encuentran en el lugar reportezmg
168,30375,patronales del pueblo de pes en la provincia de herrera viva san jose repost de pese
169,30376,5 san jos de la montaa le cobramos penalty a la leyenda higuitarene en la inauguracin de la cancha sinttica del estadio mpal no se nos olvida gracias al dolo y al empresario pablo zuluaga por acompaarnos en el norte del dpto compromiso sab 18 marz
170,30377,s t nuestro hogar san jos cuidanos solemnidad de san jos reflexiones desde el carmelo va youtube sanjos portiseor
