,Id,Tweet
494,43107,pocho calienta el clsico tambin el pocho
495,43108,henry martin marc alexis se fue en blanco y pocho se gan una expulsion fin de la historia
496,43109,ojitooooo ojitoooooooo el pocho de atlas vega del ame jajajajajajjaja pobres chivas
497,43110,pocho guzmn un tipazo va y le raya la madre al gato ortiz para evitar jugar contra el rojinegro tqm mi pocho
498,43111,yo creo que el problema del pocho fue que hablo de ms aunado a que ahora por ser nuevo todo se le perdona quitas de la ecuacin a guzmn y pones a vega y no me imagino como estara twitter chivas ahora
499,43112,hahaha el pocho loquillo
500,43113,usted me la va a pagar profe pocho guzmn
501,43114,el pocho mas atlistas que la calva de don david medrano
502,43115,que partido tan horrible del pocho guzmn no apareci en el momento importante
503,43116,ayuden porfavor cualquier noticia del pocho es apreciada
504,43117,honestamente traigo una decepcin bien cabrona con pocho chiquete y vega que hasta siento que me va a dar diabetes
505,43118,y la roja para el pocho fue la cereza en el pastel
506,43119,tiene mucha razn capi la distraccin la gnero la misma gente de chivas quien sali en todos los vdeos de la semana nada ms que pocho guzmn
507,43120,la peor versin del pocho hoy pas desapercibido
508,43121,no buscamos quien nos la hizo sino quien nos la va a pagar pinche pocho hocicn jajaja
509,43122,analizando el partido a malagon lo quiero para la seleccin israel r quedo poco por demostrar al nene siempre lo quiero pocho quedo a demostrar chiquete si o si mi nalgon igual mozo aun puede colarse
510,43123,dicen que el pocho sigue buscando quien se las pague jajajaja
511,43124,el pocho guzmn llegando al vestidor de las chivas
512,43125,la f sigue intacta en ellos los proyectos necesitan de sacudidas cmo stas para realizar las depuraciones necesarias en el plantel y as mejorar lo de hoy simplemente fue un mal da para ambos
513,43126,mi pocho guzmn prefiri que lo expulsaran a jugar contra su atlas respect
514,43127,como vez drzpitapita se ofendieron algunos per este festej de henry ya lo dijo el mismo es puro show oye y donde anda el pocho guzmn
515,43128,estoy muy triste la verdad es que nos ilusionamos a lo idiota sigue haciendo falta un referente y un delantero hoy pocho estuvo escondido mi modo a seguir adelante pero chivas yo te amo y siempre voy a estar a tu lado con todo el dolor dale rebao carajooooooooo
516,43129,mis amigos chamuyando menores
517,43130,a pocho guzmn lo hubieran expulsado en cuanto termin el partido de puebla por hozicon son una bola de intiles chivas
518,43131,bueno igual si nos estamos pasando con el pocho realmente nadie lleg a jugar hoy por ms corazn que se le haya visto a uno que otro al final la terminaban cagando de una u otra forma
519,43132,el pocho guzmn en estos momentos
520,43133,aqu se les dijo hoy victor guzmn ni sus luces ahora le van a dar hate a pocho por eso debemos de apoyar siempre
521,43134,el america va a sufrir decir el pocho jajajaja vamos a sufrir pero de tanto rer vamosamerica
522,43135,jajajaja que pendejo est el pocho
523,43136,del chavito que hablan es del drogadicto del pocho guzmn
524,43137,buscamos quin nos la pague del pocho la identidad de briseo ser el antecedente de un baile en su casa y con su gente
525,43138,mira cornejoberny el pocho aspirando las lneas del campo omarvv9 no te escondas
526,43139,jajaja 2 4 chivas desdelacuna hocicon pocho guzmn
527,43140,el pocho guzmn quedando
528,43141,america fue muy superior al guadalajara y lo derrot 4 2 en el mismsimo estadio rojiblanco en un marcador que pudo ser ms escandaloso adems al final fue expulsado el pocho guzman chivas se desinfla cae al quinto puesto y america sube al subliderato
529,43142,la ibamos a pagar pocho no apareciste por andar de cocainomano
530,43143,alguien vio al pocho guzmn anduvo muy bravucn frente a micrfonos y en el campo se hizo chiquito
531,43144,jajajaja adems de la masacre a chivas le explulsaron al pocho guzmn y no va a jugar el clsico vs atlas ms rojinegro qu el bigote pbico de hctor huerta siuuuu
532,43145,el pocho guzmn estuvo de hablador toda la pinche semana y hoy el amrica se orin en su cara jajajaja a mamarla pendejo
533,43146,el pocho guzmn yendo a reclamarle al rbitro
534,43147,el pocho expulsado se achic los dos cisneros dan pena el oso sac su pasado la defensa una vergenza no saben defender el mano a mano y les ganas siempre la espalda alvarado un tronco nene meh vega meh ros meh la morsa de lo poco rescatable vergenza chivas
535,43148,y a todo esto que reclamaba el pocho
536,43149,no s vuelen pocho no minti cuando dijo no vamos a buscar quin no la hizo vamos a buscar quin no la pagu vamos por el clsicotapato arriba las chivas
537,43150,pens que el pocho era de esos cabrones que sostenan sus palabras con hechos porque es un grandioso jugador y me llama la atencin bastante que literalmente haya desaparecido hoy
538,43151,no crucifiquen al pocho hoy tuvo un mal partido tiene que aprender que los clsicos se juegan diferente pero no fue el nico que no tuvo un buen partido lo que s veo mal y me preocupa es la expulsin porque no olvidemos que se viene otro clsico
539,43152,les dimos la vuelta a los honduchangos goleamos al puebla el huevo y julin ya son los mejores amigos a las chivas las prearon a pelo el pocho guzmn confirma su amor por el rojinegro me siento feliz
540,43153,pocho guzman expulsado desaparecido todo el partido desde el minuto 1
541,43154,as qued el amrica va a sufrir no buscamos quin nos la hizo sino quin nos la va a pagar pocho guzmn
542,43155,el pocho se fue expulsado victor guzmn reclam al final del partido y recibi la roja se pierde el clsico tapato
543,43156,con la expulsin del pocho guzmn alexis vega se prepara para su siguiente contrato multimillonario con las chivas
544,43157,pocho guzmn se fue a la fcil mejor hacerse expulsar que jugar el clsico tapato as tiene unas semanas de vacaciones sin presin alguna
545,43158,el pocho que ech de menos el pocho que tuvimos hoy
546,43159,pocho guzmn
547,43160,me voy a dormir a ver si cuando despierte el pocho ya haya encontrado a quien se la pague
548,43161,pocho guzmn se pierde el clsico tapato
549,43162,cuanta razn tiene diego cocca al no convocar al muerto de chivas pocho guzmn miseleccionmx necesita jugadores con carcter y lideres dentro y fuera de la cancha estos estupidos que solo calientan a la gente una semana antes y desaparecen en partidos determinantes sobran
550,43163,te entendemos pocho guzmn esa roja sin sentido la entendemos arribaelatlas
551,43164,eso es el pocho este partido lo refleja un da da un gran partido y al siguiente ni aparece
552,43165,el pocho guzmn era compaero de uriel antuna no dudo que est pensando que en la vuelta remontan
553,43166,pocho guzmn aplic un maana nos la vamos a rifar por ustedes j4j4j4
554,43167,me duele decirlo pero es una realidad mozo di un partido para el olvido junto con el chiquete y mi pocho guzman aunque fue todo el equipo en realidad pero ellos 3 son los que ms me duele
555,43168,no vamos a buscar quin nos la hizo vamos a buscar quin nos la pague pocho guzmn antes de desaparecer en el clsico nacional
556,43169,como que expulsaron al pocho
557,43170,as qued el pocho
558,43171,pocho guzmn ms rojinegro que federico vias
559,43172,pudimos amanecer un domingo con un subliderato seguro y vamos a terminar sptimos al final de la jornada
560,43173,bueno ya perdimos viene fecha fifa que nos caer bien para replantearse muchas cosas y recuperar al 100 a vega y al cone lstima la expulsin de pocho
561,43174,esta cabron no enojarse chivas te pone un baile el amrica y lo peor te vas expulsado terminando el partido pocho que falta de concentracin se viene el clasico tapato y para m duele ms perderlo que noche de terror
562,43175,alguien aabe donde anda el todopoderoso pocho guzman sigo esperando que venga y se las cobre al am
563,43176,al chile mejor ya lrgate pocho y que nos regresen a la chofis
564,43177,el pocho si no lo hubieran expulsado
565,43178,pocho no minti
566,43179,deportes mal y de malas vctor guzmn fue expulsado al terminar el encuentro tras reclamarle al rbitro el pocho se pierde el clsico tapato rams alex tvaztecajaliscodigital
567,43180,estan mame y mame y mame y mame y mame y mame valentones como el pocho guzmn sobran pobre iluso esto es a lo que todos estamos acostumbrados patticos chivas
568,43181,vs atlas no estar pocho pero estar vega espero no estn los cisneros prefiero a ros que igual no anota pero al menos estorba y en defensa no hay nada que hacer la banca es pollo mier mayorga y chapito igual o ms pendejos que los titulares
569,43182,hoy el pocho debut en clsicos era natural que le costar seguro el prximo ser diferente a ver cundo lo juega porque vs ratlas no estar
570,43183,logramos la remontada contra los changos del olimpia ayer montamos a pelo al pueblita y hoy golearon a los pendejos esos y mi pocho guzmn se sac la rojinegra al final que fin de semana mi gente que como me siento me siento felz
571,43184,y para completar el cuadro el famoso pocho no encontr quin le pague los platos rotos sino es que se top con un gato implacable mostrndole la tarjeta roja
572,43185,entonces ahora quien va pagar estas ves pocho
573,43186,que sigan buscando quien se las pague henrymartinm platic despus del clasicodemexico con miguel gurwitz y chermosillo27 sobre la gran actuacin del clubamerica en casa de chivas y tambin le respondi al pocho guzmn chivasentelemundo
574,43187,volvieron a sodomizar a las pendejas chibas sus porristas que estaban hociconeando ya estn llorando y el pocho guzmn no va a jugar el clsico vs el amor de sus amores
575,43188,pocho que dices alvaritomorales sigues de hablador
576,43189,muy completa la barra de comedia por parte de chivas para el clsiconacional arranc en la semana con franco esca jerofreixas y facufacundo y termin en la cancha con alan mozo el wacho jimnez y el pocho guzmn
577,43190,vaya semana tuvieron que aguantar aquellos y todava el pocho guzmn se hace expulsar
578,43191,el america nos comi en la media cancha donde oso qued solo y fue fcilmente superado pocho no sum ni al ataque ni defensa los cisneros son una basura y alvarado y beltrn generan pero siempre fallan en el ltimo movimiento dolorosa derrota y viene otro clsico
579,43192,chivas mucho que deber no hablaron en la cancha pocho guzmn se pierde el clsico tapato
580,43193,a intoxicarse pocho guzmn
581,43194,rale para todos los hocicones de shhhhivas empezando por el pocho y el chikatona calderon no chicotazos
582,43195,pocho guzmn a m4m4rl4 por si alguien tiene su tweter arrobenlo
583,43196,y a este quien le pidi su opinin qu busque junto con el pocho quien se las pagu jajaja ah no el pocho lo expulsaron jajajaja
584,43197,que grande el pocho guzmn no hizo ni verga y al final se gana una expulsin por nada para as perderse el clsico tapato
585,43198,hace unos das ya no queran a vega hoy ya no quieren a pocho ojal que as como piden a los jugadores qu se vayan ustedes tambin se vayan a chsm alv de este equipo pinches aficionados de ocasin yo con chivas en las buenas y en las malas
586,43199,pocho guzmn se fue expulsado al final del clsico nacional poco pudo hacer para evitar la derrota de chivas ms
587,43200,hasta que los expulsaron me di cuenta que jug el pocho guzmn
588,43201,abriste el hocico en la semana desapareciste a la hora buena y todava al terminar el partido vas y te haces expulsar de manera pendeja y te pierdes el clsico t tambin chingas a tu madre pocho
589,43202,y si jugo el pocho guzmn o nomas quera su tarjeta roja para no jugar contra el atlas
590,43203,el pocho qued
591,43204,parece que amrica se aborchon de ir ganando tan fcil y le di vida a un guadalajara desconocido 2 goles de regalo y amrica busc dormir el partido dej de atacar con determinacin 2 4 un festejo icnico del americanismo y la expulsin del pocho cerraron el clsico
592,43205,te amo vctor pocho guzman me quiero tatuar tu cara en el culo
593,43206,vctor pocho guzmn no jugo el clsico de la amistad y tampoco jugar el clsico tapato
594,43207,ahora para acabarla sin el pocho guzmn vs el atlas
595,43208,el pocho guzmn recibiendo la roja con la cual no jugar el clsico vs el equipo de sus amores
596,43209,el pocho guzmn no logr quien iba a pagar los platos rotos y encima se fue expulsado jaja pobre wey
597,43210,la neta pta defensa parecan nios de kinder que todos van a seguir el baln dejaban chingos de espacios
598,43211,el pocho no quiso jugar contra el equipo de sus amores
599,43212,y el seor pocho guzmn se vendi horrible
600,43213,lo que digas con la boca lo sostienes con los huevos con copia para el pocho guzmn pero an elijo creer
601,43214,se acepta que chivas jug de la vrg y america hizo un gran partido nunca se debe hablar antes de tiempo como lo hizo el pocho en fin buena victoria para el america
602,43215,y que se hace expulsar el pocho guzmn
603,43216,el pocho slo apareci para que le sacaran la roja
604,43217,no vemos quien nos la hizo sino quien nos la paga pocho guzman
605,43218,desastroso chivas cay en un partido donde sus propios errores le blindaron la libertad al rival miles de errores de charal poca presin de los medios tiba estuvo dormido y pocho se fue expulsado despus del silbatazo final por reclamos se ocupan refuerzos
606,43219,en el barco del pocho guzmn y el terrorista paunovi lo digo siendo las 11 30 del sbado 18 de marzo luego de perder un clsico nacional
607,43220,este torneo ya solo es de dos amrica y monterrey gran triunfo del conjunto de coapa ante chivas quienes siguen dejando dudas al sufrir su segunda derrota consecutiva el pocho guzmn se fue expulsado y no jugar el clsico ante atlas clasiconacional america
608,43221,y me vendieron que las mejores chivas en muchos aos iban a arrollar al amrica irregular de este torneo los encontramos en cuatro y en cuatro los dejamos lo que me sorprendi es que no metieran a jugar al pocho guzmn
609,43222,lo bueno de la expulsin del pocho es que tendr an ms tiempo para buscar quien se la pague
610,43223,del barco del pocho no se baja nadie lt 3
611,43224,el pocho sigue buscando quien se la pague jajajaja te la pelaste pto
612,43225,expulsaron al pocho guzmn al final prefiri hacerse expulsar que jugar contra el equipo de sus amores jajajja el pocho es ms rojinegro que don hctor el orales huerta ptm
613,43226,ni alexis vega ni pocho guzmn si chivas va a valer verga de esta manera prefiero mil veces ver en la cancha a sebas tepa y pvel al menos ellos s sentiran vergenza
614,43227,en su momento salieron los jugadores de chivas para dar la taquilla gratis despus de perder hoy debe salir el capitn del rebao el pocho guzmn y decir fallamos aficin les vamos a dar la taquilla gratis para el prximo juego de local para que sigan apoyando
615,43228,pues fueron a guadalajara y les rompieron toda la vajilla clasicodemexico y el pocho
616,43229,esta expulsin se la compraba si le hubiera ido a partir su madre a henry martin por orinarse en la portera de chivas que chingados reclamas al final del partido
617,43230,el pocho guzman despus de andar de hocicon toda la semana desaparecer en el clsico y hacerse expulsar al final
618,43231,en el barco del pocho guzmn y el terrorista paunovi lo digo siendo las 11 29 del sbado 18 de marzo luego de perder un clsico nacional
619,43232,el pocho guzman
620,43233,pocho se fue expulsado y se perder el clsico tapato el nmero 5 de chivas vio la tarjeta roja ya con el partido finalizado ya que insult al arbitro por lo que no estar disponible ante los rojinegros del atlas
621,43234,quien ser quien se la pague al pocho
622,43235,el pocho saliendo del akron
623,43236,al pocho guzmn se las va a tener que pagar un billete o una tarjeta llena de harina pinch drogadicto hosicon
624,43237,el pocho sigue siendo rojinegro
625,43238,viendo este programa futpicante y es bien chistoso como defienden a las chivas o ms bien los excusan por haber perdido contra el clubamerica y peor an no hablan de las estupideces que dijo el pocho antes de perder el clsico
626,43239,que grande mi pocho ahora si que defendiendo a mi atlas en la raya
627,43240,pocho no quiso jugar el clsico tapato por amor al atlas el lo sabe nosotros lo sabemos
628,43241,tal vez hubieran ganado si hubiera jugado el pocho guzmn el jugador del momento no se por que lo dejaron en la banca
629,43242,jajajaja al pocho le pas lo mismo que a vega en muchos momentos mucha frustracin por no hacer absolutamente nada y lo sac de la peor manera
630,43243,hoy extra a este pocho no puedes dejar que henry martin se orine en tu portera o que leo suarez te restriegue su escudo
631,43244,el pocho gzman ya encontr quien se las pague
632,43245,las chivas quedaron como por osiconas el pocho y sus mmdas jajajaja
633,43246,el peor partido del pocho guzmn desde que naci
634,43247,de acuerdo
635,43248,cmo era pocho buscabas quien te la pagara y terminaron humillados como siempre por hablar sabiendo quien es el equipo ms grande de mxico
636,43249,wey y ahora quin se la va a pagar al pocho
637,43250,hoy agarraron a pocho para defender a vega y el gey es literalmente el meme de te cambiara por cualquier pendejada una risa la vdd
638,43251,el pocho diciendo nos la van a pagar pas desapercibido y sali expulsado hablador
639,43252,el pocho guzmn tendr que esperar un par de semanas ms para encontrar quien se las pague j4j4j4j4
640,43253,aparte el puto guzmanpocho06 se hace expulsar por reclamarle una pendejada al rbitro que de tener razn no hubiera cambiado el resultado lo respetara si hubiera sido expulsado por romperle el tobillo a henry o zendejas
641,43254,y el pocho
642,43255,el pocho guzmn de bocn en la semana llega el clsico y no hace ni madres termina el partido y se va expulsado jajaja a mamarla ese wey y las putas chivas
643,43256,el pocho guzman no solo qued como osicon no tiro una sola ves a portera los humillaron en su casa lo expulsan al 97 y se pierde el clsico vs atlas
644,43257,bien por el pocho saba que no iba a quedar mal para el clsico tapato
645,43258,pocho y vega son grandes jugadores el problema es que equipos como el amrica tigres y rayados tienen a 7 8 cabronazos sudamericanos del mismo nivel que ellos mientras ac los ponemos a jugar con charal cisneros y esperamos obtener los mismos resultados
646,43259,oigan si jug el pocho guzmn no lo vi desde que estuvo de hablador
647,43260,expulsaron al pocho al final vdd
648,43261,no me d cuenta ni que jug ni que expulsaron al pocho
649,43262,por cierto alguien sabe qu fue de roberto alvarado del pocho guzmn y del yayirobe alexis vega es que no los vi para nada en el estadio
650,43263,voy a decir q fue porque expulsaron a pocho
651,43264,fuera de broma quien es el pocho guzman
652,43265,jajajaja alguien que suba cuando expulsan al tal pocho
653,43266,pocho sinceramente te ubieras callado el h
654,43267,clsico nacional chivas 2 4 amrica las chivas fueron bazofia esta noche oswaldo snchez es bazofia alexis vega pocho guzmn alvarado chicote y jimnez tambin fueron bazofia esta noche he visto muchas bazofias pero ellos son la mayor bazofia entre las bazofias
655,43268,el oso los cisneros y el pocho estab pa llorar
656,43269,el pocho consolandose por la derrota de su equipito verijasagrias 17titulosdeliga 1smael 1592 osvaldo ms8 alvaritomorales
657,43270,en resumen la noche de chivas la buena ya jug alexis vega la mala expulsado pocho y no jugar contra atlas la psima el humillante marcador
658,43271,hoy pudo ganarse el clsico pero a paunovic se le antoj poner de titulares al do cisneros y sentar al pocho y a vega y ni hablar de los centros cagados que terminaban interceptados por la defensa ya si la prxima fecha le siguen con el marketing de a huevo adis al ttulo
659,43272,el pocho ya habr encontrado quin se la pague
660,43273,tarjeta roja al pocho guzmn para terminar la noche vctor guzmn fue expulsado al finalizar el encuentro por el rbitro central tras ir a reclamar eufricamente por lo que se perder
661,43274,le dijo el arbitro saque de lnea el pocho guzman en corto
662,43275,el pocho ms rojinegro que el pistache torres
663,43276,ahora la banda reventando a pocho no mmr denle calma
664,43277,por eso creo la reaccin pero desde la mitad del primer tiempo estaba pintado ese acomodo pero creo a pauno le falta replantear los partidos y por eso hoy se perdi por eso pocho no debiste regalar esa roja ya acabado el partido era a tu tcnico el reclamo
665,43278,amigos estoy muy asustado el pocho guzmn nos dijo que se la bamos a pagar y no lo v en el partido ser que fu a hacer de las suyas mientras nadie lo vea
666,43279,termin el clsico nacional amrica se lleva los 3pts de manera fcil chivas intent pero no pudo al final pocho guzmn se va expulsado y no estar en el clsico tapato viene paro de la liga mx por la fecha fifa
667,43280,seguir el pocho guzmn buscando quien se lo pague
668,43281,pocho haciendo expulsar para no jugar contra el amor de sus amores pochitooooooooo
669,43282,se filtra lo que el pocho guzmn le dijo al gato la verdad que el equipo que toda la vida ha sido el amor de mis amores ha sido el atlas expulsame estupido gato no vale la pena jugar con estos idiotas ante el 2 veces
670,43283,puras pendejadas dices y haces pocho
671,43284,y pocho se hace expulsar y ahora no juega el otro clsico increble como un partido hace que todo un torneo se vaya a la mierda
672,43285,expulsaron al pocho guzman apoco si estuvo jugando digo vi ms a alexis vega en lo pocos minutos que tuvo que al pocho que estuvo mame y mame y mame
673,43286,porque no jugo el pocho guzmn
674,43287,no pocho para el clsico contra el atlas pero a veces los rbitros necesitan escuchar lo mensos que son
675,43288,tanto que se habl y poco se demostr chivas mal partido de todos pero que tienes que ir a regalar una tarjeta roja ya finalizado el partido guzmanpocho06 en las buenas se te aplaude admira y agradece pero esto hoy muy mal pocho
676,43289,alguien sabe quien se la va a pagar al pocho guzmn
677,43290,la realidad es que si tuvo culpa y mucha pauno qu alineacin tan horrenda en el primer tiempo ojo los jugadores deben ser profesionales hoy 45 minutos no lo fueron lo de el pocho guzmn vergonzozo no aparece en el clsico nacional y tampoco vs atlas
678,43291,y para acabarla el pocho no hizo nada en todo el juego no dio un solo pase decente en todo el partido no toc el baln pero al final llorando con el rbitro para irse expulsado pendejamente el carcter se muestra en la cancha no reclamando todo cuando te pasaron por encima
679,43292,la pendejada del pocho se hace expulsar y se pierde el clsico tapato es el turno de vega de echarse el equipo al hombro as que preparemonos para otra derrota
680,43293,alguien a visto al pocho guzman que dijo que amrica sufriria y que buscaban quien se las iba a pagar
681,43294,pocho guzmn se sacrific para no jugar en contra de el equipo de sus amores
682,43295,cuando deben marcar diferencia sucede lo contrario el pocho guzmn se fue expulsado por reclamos y no jugar ante atlas
683,43296,ay bueno que importa les ganamos su tifo y casa no les sirvi para nada henry se les me encima y al ltimo minuto les expulsaron al pocho y ni el imbcil de lara les ayudo para empatarnos
684,43297,da 1 preparndome para ser dt del rebao y regresarle la identidad a este equipo al cual los vergara le han hecho mucho dao
685,43298,diganle al pocho guzmn que hoy fue el partido del clubamerica vs las chivas ajajajjajajajajaj
686,43299,una pesadilla lo que se vivi est noche pocho guzmn habl de ms hace una semana y hoy estuvo desaparecido y de pas no estar en el clsico tapato
687,43300,ahora resulta que nadie quiere al pocho tampoco se mamen di un juego de la verga si y era uno importante pero tiene otros 11 partidos jugando a tope y siendo el goleador del equipo es el que nos tiene en puestos de liguilla yo estoy en el barco del pochismo
688,43301,tambin el rbitro exagera no se ve que el pocho guzmn le reclame fuertemente pero bueno no importa el momento siempre se trata de perjudicar a chivas ah pero recuerden que ortz es rojinegro con razn ahora todo tiene sentido
689,43302,lo del pocho es de pena de por s su partido fue psimo con nula participacin y encima de brazos cados desde el 0 3 pero la expulsin despus del pitazo final es ridcula es un absurdo total
690,43303,pocho guzmn se hace expulsar de la manera ms absurda con el partido finalizado discute con el rbitro y se pierde el partido contra atlas
691,43304,que bueno mejor que el pocho no juegue los clsicos porque se pierde
692,43305,lmao y al final expulsaron al pocho q gozada
693,43306,jajajajaja el pocho guzmn aparte de no haber hecho nada en todo el partido termino expulsado pero andaba de bocn y lo peor es que no aprenden a quedarse callados los pendejos
694,43307,el pocho guzmn entrando al vestidor despus de ser expulsado desaparecer en el clsico y hablar pendejadas a media semana
695,43308,lo malo pocho se pierde el clsico tapato la pasin le gano y perdi la cabeza
696,43309,tranqui pocho
697,43310,ahora si que el pocho guzmn se pas de la raya
698,43311,a chingar a su madre el pochismo el pocho guzmn las chivas los gonzalos paunovic los weyes que piensan que el clsico regio es ms que el nacional paty chapoy y los que le van a chivas
699,43312,en el 2do tiempo pocho guzmn se la paso reclamando constantemente acaba el partido y se hace expulsar y se pierde el clsico tapato ya habia acabado el juego y te permites que te expulsen y dejas aun ms diezmado al plantel para la siguiente semana
700,43313,vaya tontera la del pocho
701,43314,chulada de regalo del rojinegrisimo pocho guzmn ya se haba acabado el juego y se hace expulsar para no jugar contra atlas
702,43315,ningn jugador de los importantes apareci pocho se comi sus palabras se vio ms reclamando que jugando
703,43316,los nicos pendejos que han expulsado por reclamarle al rbitro cuando acab el partido son el pocho guzmn y rucorona
704,43317,el pocho guzmn se pierde el clsico tapato
