,Id,Tweet
364,27631,ltimahora nunca vuelvas rafa puente el momento que tanto esperbamos los que le vamos al pumas como el bufalotatanka1 es hora de brillar para el jimmy lozano hazlo realidad pumasmx
365,27632,bueno por fin se fue rafa puente y leopoldo silva cuando
366,27633,se fue rafa puente ahuevoooo
367,27634,rafa puente jr es igual que rafa puente pap habla muy bonito pero vale tacos de verga
368,27635,tras la salida de rafa puente del ro qu tcnico es el ideal para pumas participa en la encuesta de puntofinal imperdible show esta noche post clsicos
369,27636,se fue rafa puente no es ms el dt de los pumas
370,27637,pues ya se fue rafa puente de pumas y an as no es el nico cuando se van los directivos si algunos jugadores de pobre nivel y psimo rendimiento me refiero a extranjeros y canteranos que pese a recibir oportunidades no dieron la talla que suban a los que siguen
371,27638,ms detalles de la salida de rafa puente as se dio la salida de rafa puente de los pumas quin le comunic la decisin dnde lo cesaron cmo tom la noticia quin se quedar al mando ac se los cuento deporteswradio
372,27639,se acab la paciencia rafa puente fuera de pumas expresionsonoranoticias sonora hermosillo esn redessociales
373,27640,rafa puente consumando otro fracaso en su ya inestable carrera de dt se le mira de huevos a la joven camada de entrenadores mexas y eso sin contar a lozano
374,27641,la era rafa puente jr se termin es despedido por los pumas de la unam
375,27642,en otro twit kattyboom df haba dicho que le echaran miados al rafa puente ese si se cumpli y hoy mismo lo corrieron
376,27643,rafa puente es destituido de pumas tras derrota ante pachuca
377,27644,rafa puente y pumas 1 en primera instancia nunca debi llegar a pumas la aficin estaba emocionada con la idea de ver de nuevo a tuca ferreti y memo vzquez juntos dirigiendo a un plantel que sufra mucho en defensa an cuando se anunci que ellos se alejaban jimmy era viable
378,27645,rafa se va de puente y ya no regresa a pumas
379,27646,ya estn molestos los fans de pumas ya no quieren a rafa puente y hoy lo dejaron claro en cu
380,27647,por fin rafa cuentos se fue domingodeganarseguidores pumas rafapuente somospumas rafaeiramosv espnmx espncapitanes faitelson espn alvaritomorales rafa puente y pumas se divorciaron ligabbvamx asiesmonterrey domingodeantojadera
381,27648,se acab la paciencia rafa puente fuera de pumas futmx
382,27649,pachuca tuzos hunde ms a pumasmx con victoria de 2 0 en cu la aficin pide la salida de rafapuente
383,27650,fjate que ahora s se me antoja la maruchan que le aventaron al inepto del rafa puente
384,27651,festejo por renuncia de rafa puente pumasmx
385,27652,pero como que rafa puente fue despedido si poncho vera lo vendi como el nuevo guardiola
386,27653,acaban de anunciar el despido de rafa puente jr y la gente de pumas se est reuniendo en el estadio para celebrar
387,27654,quisiera ser rafa puente para no tener que ir a chambear maana
388,27655,se fuee se fuee rafa puente ya se fuee
389,27656,se acab el rafapointer pumas hizo oficial la salida de rafa puente jr como su entrenador puente los deja en la posicin 16 con 11 puntos
390,27657,llegaron los memes rafa puente ya no ser tcnico de pumas y la respuesta en redes no se hizo esperar
391,27658,oficial adis rafa puente jr es despedido pumas pumasmx ligamx ligabbvamx
392,27659,as se fue rafa puente de pumas por la puerta de atrs como llego
393,27660,la salida de rafa puente solucionar la terrible temporada de los pumas de la unam videos unam pumas rafapuente somospumas rockcervezapuma unam mx
394,27661,te decimos quien se perfila para dirigir a pumas tras el cese de rafa puente
395,27662,el hartazgo de la aficin de pumas reflejada en una sola imagen rafapuentejr rafapuente ligamx ligamx
396,27663,gan checo prez gan el bara se fue por fin rafa puente jr domingo completo
397,27664,ya se fue rafa puente pero el problema es ver si no traen a alguien peor jajajaja
398,27665,pues ya recuper mi sueo de los 3 das que estuve desvelndome ayer por fin pude cortarme el cabello me vea muy bien de traje como siempre y hoy corrieron a rafa puente chiquito un buen fin de semana
399,27666,rafa puente no volver a dirigir en 1a divisin en mxico hoy se sentenci esto bai bai rafa baiiiiiiii pumas
400,27667,urge una limpia en pumasmx de unam mx cae ante tuzos dos goles a cero es despedido su tcnico rafapuente los jugadores universitarios tienen prohibido seguir en la fiesta bubifest una manzana podrida los ha contagiado elpale supuesto abusador sexual
401,27668,se acab la etapa de rafa puente jr al frente de pumasmx el dt dej al club universitario en el fondo de la tabla de la ligamx
402,27669,fuera de pumas despus de la derrota ante pachuca rafa puente es cesado de los pumasmx furiadeportiva furianeta ligabbvamx c23 pumas rafapuente
403,27670,pumas confirm que rafa puente del ro dej de ser estratega del equipo esto ocurre horas despus de caer 2 0 ante pachuca lo que signific su sptima derrota en el clausura 2023
404,27671,rafa puente es el claro ejemplo de que por mucho que te apasione algo a veces simplemente no tienes el talento
405,27672,pumas rafa puente no tira la toalla no me atrevo a decir que hemos tocado fondo
406,27673,pues se tardaron en correr a rafa puente jr
407,27674,por fin se fue rafa puente de pumas muy tarde muy doloroso
408,27675,ya se fue rafa puente falta el patronato
409,27676,el club universidad despus de correr a rafa puente
410,27677,listo el space detalles de lo acontecido con rafa puente
411,27678,termino rafa puente y su cuerpo tcnico esta fuera
412,27679,rafa puente jr viendo a qu televisora se va ir
413,27680,que chingue a su cola rafa puente
414,27681,mi hiptesis es que a rafa puente le hizo falta tiempo para consolidar su proyecto de llevar a pumas a segunda divisin pero mientras sigan transmitiendo slo por vix me seguir ahorrando la mala experiencia de verlos hundirse pumas
415,27682,ahora ten huevos y dselo en su cara a su padre rafapuente espn en la mesa de ftbol picante
416,27683,craso error de pumas el correr a rafa puente jr con esa plantilla ni guardiola los saca del mal momento muy limitado el anlisis del trabajo de rafael de sus 4 defensas no haces uno decente y el mejor jugador del torneo es alguien de 34 aos que viene de romperse la rodilla
417,27684,ya corrieron a rafa puente
418,27685,ojal fuera rafa puente para no tener que ir a trabajar maana
419,27686,pumas los mejores memes tras la despedida de rafa puente
420,27687,jajajajaja adis rafa puente del ro
421,27688,clubuniversidadnacional se acab la paciencia rafa puente fuera de pumas
422,27689,top 10 tendencias de twitter en mxico madrid 490976 bara 289913 rafa puente none barcelona 307552 pumas none xavi 91166 rayadas none benzema 64001 pia 143179 checo 118704
423,27690,caray yo crea que rafa puente aspiraba a ms pero es un dt con un promedio del 26 de efectividad as est canijo
424,27691,rafa puente jr en pumas 12 juegos 3 triunfos 2 empates 7 derrotas
425,27692,la postal del da a rafa puente jr le llueve de todo mientras abandona la cancha de cu en el que fue su ltimo partido como entrenador de pumas
426,27693,ya se fueee
427,27694,mi teora de por qu rafa puente no funciona por ms preparado que este es que en amrica latina los jugadores de ftbol no te respetan como autoridad si no fuiste un futbolista decente y si se puede destacado el tipo no convence porque sencillamente no lo creen capaz
428,27695,mandaron a la mierda a rafa puente
429,27696,configura un recordatorio para mi prximo espacio
430,27697,oficial pumas anunci que rafa puente jr deja de ser el entrenador del equipo la derrota de hoy ante pachuca 0 2 fue la gota que derram el vaso 143 das en el cargo 12 partidos 3 victorias 2 empates 7 derrotas
431,27698,rafa puente jr fuera de pumasmx alberperiodista luciojoelblue funball mexico miguelvp171
432,27699,todos sabamos que as iba acabar la historia de rafa puente jr con pumas
433,27700,adis pumas inform que ha terminado la relacin laboral con el rafa puente jr
434,27701,pumas ech a rafa puente tras los malos resultados en el clausura 2023 de la liga mx
435,27702,deportes dicen que ya es un hecho rafa puente y su futuro tras el juego con pachuca
436,27703,el club universidad termina contrato con rafa puente jr tras resultados irregulares agradecen su trabajo y desean xito en futuros proyectos se espera anuncio del prximo entrenador pumas rafapuentejr futbolmexicano origendelapasin
437,27704,oficial ligamx rafa puente deja de ser entrenador de los pumasmx y se suma a la lista de entrenadores destituidos adis rafa
438,27705,por fin se da la destitucin de rafael puente ahora esperemos que estratega ser el que levante este barco rafapuente pumas soydepumas
439,27706,neta que bueno que ya corrieron al pinche putito de mierda de rafa puente que siga haciendo sus putas jotonovelas pinche wey puto maricon
440,27707,corrieron a rafa puente gan napoli perd mi cel estoy crudo que mas puedo pedir
441,27708,bien pues ya se les cumpli se fue rafa puente lo bueno que el problema era el tcnico verdad entonces ahora s viene el repunte y el campeonato para pumas qu emocin
442,27709,corrieron a rafa puente
443,27710,la salida de rafa puente de pumasmx solo nos deja con la incertidumbre de a quin se le ocurrir a la nefasta directiva traer y no es que queden muchas opciones decentes quin se atreve a tomar al equipo a 5 fechas del cierre cerrando con toluca amrica y monterrey
444,27711,tras la destitucin de rafa puente de pumas me informan que william levi y gabriel soto se encuentran entre los candidatos para tomar la direccin tcnica del equipo
445,27712,y con esta imagen rafa puente jr se va es cesado de pumas y ahora quin llegar al banquillo de pumas
446,27713,los tuzos fueron el verdugo de rafa puente jr
447,27714,pumas ya hecho a rafa puente pero clubpueblamx nunca va poner al auxiliar de eduardo arce apesar de las malas desiciones
448,27715,ya no ms rafa oficial a travs de un comunicado el club universidad inform que ha terminado el vinculo laboral con el seor rafa puente jr
449,27716,rafa puente deja de ser tcnico de pumas meta deportes ligamx
450,27717,hoy fue un excelente da checo gan y lo v con ferchis rafa puente deja de ser tcnico de pumas fernando alonso tiene su podio 100 y vine con ferchis a coyoacn
451,27718,lo de rafa puente jr se vea venir y creo es lo mejor que le pudo pasar a pumasmx una institucin con historia
452,27719,para mi hoy gan pumas porque por fin se va rafa puente
453,27720,ya despidieron a rafa puente jr pero cuando van a despedir a todos los jugadores y a la directiva del equipo llevan aos fracasando pumas soydepumas
454,27721,no ms rafa puente jr en pumas solo falta lazcano en pumas femenil
455,27722,pues era lgico rafa puente se fue y se dijo desde el principio no era buena opcin y ahora hay que rescatar la temporada soydepumas
456,27723,cesan a rafa puente jr como director tcnico de pumas a travs de youtube rafaelpuente pumas futbol futbolmexicano deporte ultimahora rebel tuca
457,27724,detalles de la destitucin de rafa puente aqu betobernard lo advirti antes que nadie esa reunin solo se vio interrumpida por la conferencia de prensa y acab casi dos horas despus de acabado el partido pumas deporteswradio
458,27725,gan el barca river va ganando y se fue rafa puente qu buen domingo la vd
459,27726,rafa puente fuera de pumas y levanta la mano para relevar a paunovic en chivas sera el plan b de amaury despus de la reimers
460,27727,quedaste como pendejo t y toda la prensa amiga de rafa puente chinguen a su madre rafapuente espn rafaelpuente
461,27728,los pumas no merecan tener a un tipo como rafael puente con un rcord perdedor que no le avalaba llegar a un grande del futbol mexicano el editorial de gvlo2008 sobre la salida de rafa puente como dt del club universidad nacional
462,27729,rafa puente deja de ser tcnico de pumas
463,27730,no es culpa de rafa puente jr l slo es un pen en el tablero de una directiva que solamente vela por los intereses de sus bolsillos y que han tenido as a pumas durante ms de 10 aos tard en verlo pero lo vi
464,27731,un junior fracasado lstima por rafa puente pap que es un tipazo y buen analista deportivo pero eso pasa por darle todo en charola de plata a los hijos
465,27732,rafa puente se va de pumas lopez sordo nos cuenta todos los detalles de su salida conlosprota pumas
466,27733,mi rafa puente descubriendo a la mala el sabor de la coca de pia
467,27734,adis rafa puente pumas despidi al entrenador tras caer contra pachuca expresionsonoranoticias sonora hermosillo esn redessociales
468,27735,rafa puente no era tcnico para pumas jams pero la necedad absurda de una directiva irresponsable lo hizo tcnico del club universidad ojal ya dejen de ser tan irresponsables
469,27736,ni cmo decir que quin fuera rafa puente para no ir a trabajar maana porque maana es puente
470,27737,de ltimo momento rafa puente deja de ser entrenador del club universidad nacional terminando el partido meja barn y leopoldo silva le comentaron la decisin
471,27738,estoy orgulloso de mis pumas a las 10 de la maana lo estar a las 4 de la tarde y pase lo que pase seguir estndolo a las 11 de la noche ha hecho historia una de las grandes gestas del deporte nacional hoy despidi a rafa puente si homero viviera hoy escribira del jr
472,27739,pumas inform que rafa puente dej de ser el entrenador del primer equipo luego de la derrota de hoy en ciudad universitaria
473,27740,quien fuera rafa puente que va a agarrar puente desde maana
474,27741,tsssss necromuerte rafa puente ya no es ms tcnico de pumas va onefootball leer aqu
475,27742,de ltimo momento rafa puente jr no es ms director tcnico de pumas
476,27743,deportes el exdirector tcnico rafa puente dirigi 12 partidos y solo logr obtener 11 puntos
477,27744,deportes el exdirector tcnico rafa puente dirigi 12 partidos y solo logr obtener 11 puntos
478,27745,estaba re guapo el rafa puente jajaja
479,27746,deportes rafa puente jr no seguir siendo el tcnico de los pumas el equipo universitario lo hizo oficial a travs de un comunicado en redes sociales
480,27747,rafa puente fue cesado la verdad es que nunca debi haber llegado a la institucin quiz que los partidos que faltan alcance para el repechaje ojal no sea demasiado tarde vamos pumas
481,27748,se fue rafa puente y claro que tendr responsabilidad pero creo que los problemas en pumas van mucho ms all del tcnico
482,27749,pumas agota su paciencia y cesa a rafa puente como su director tcnico
483,27750,deportes cae pumasmx ante tuzos vuelven a pedir salida de rafa puente pumas sufri su sptima derrota del torneo esta tarde cay 2 0 ante pachuca y una vez ms la aficin pidi la salida del tcnico rafael puente
484,27751,momentos que mantienen humilde a mis pumasmx la vez q contrataron a rafa puente creyendo que ese we iba a levantar al equipo si te mamaste pumasmx todos pero tooodos sabamos cmo iba a terminar esto que bueno q ya pasamos la pgina no cometan el mismo error los tqm
485,27752,rafa no paso del puente despedido de pumas hoy mismo
486,27753,rafapuente ahora s ya vete a ch tu re o madre pumas unam
487,27754,ya es oficial rafa puente es cesado de la direccin tcnica de pumas era insostenible el proyecto
488,27755,ya corrieron a rafa puente a bailar mi perro ponchovpof
489,27756,weyy ya mandaron a la verga a rafa puente
490,27757,rafa pumas lo corri despus de un vergonzoso torneo los pumas de la unam despiden a rafa puente jr la mezcla de malas desiciones tcnicas con los jugadores malos ocasionaron psimos resultados y por ende el cese del estratega drodeportes
491,27758,los pumasmx le dan las gracias a rafa puente son fuerte hoy en c u y en las redes sociales el grito de fuerapuente
492,27759,rafa puente deja de ser tcnico de pumas
493,27760,pumas agota su paciencia y cesa a rafa puente como su director tcnico latinus informacinparati
494,27761,tras perder contra pachuca rafa puente jr se atrevi a decir que no haban tocado fondo yo nunca me he atrevido a decir que se toca fondo cuando an puedes ir ms abajo cuando t puedes decir que tocaste fondo es que cuando ya subiste un peldao ahorita es un hecho que
495,27762,rafa puente del ro jams debi llegar para empezar pumas necesita un cambio a nivel estructural algo que no pasar nunca adios patronato entes privados y etc
496,27763,quien fuera rafa puente para no trabaj ah caray maana es feriado
497,27764,oficial fuera rafa puente tras la derrota de este domingo ante tuzos mediante un comunicado pumasmx hizo oficial que rafael puente jr ha sido cesado del banquillo auriazul los nmeros que dej puente en sus 12 partidos dirigidos solamente pudo ganar tres agenciajrf
498,27765,los pumasmx oficializaron la salida de rafa puente como dt del club
499,27766,despiden al inepto de rafa puente ya suena para el gabinete o para una embajada ya saben 10 capacidad vendehumo pumasmx
500,27767,rafa puente va a necesitar unos tres frascos de resiliencia
501,27768,los pumasmx informaron que de comn acuerdo finalizaron la relacin laboral con rafa puente quien dej de ser el dt del equipo
502,27769,oficial rafa puente ya no es entrenador de pumas
503,27770,michel no fue la respuesta andrs lillini no fue la respuesta rafa puente jr no fue la respuesta algo est pasando en pumas que de un tiempo ac las malas rachas no paran qu medidas est tomando la directiva para salir de este bache en el que solo paga la aficin
504,27771,y se tardaron ya que se es antepenltimo lugar de la tabla lo corren a quien tienen que echar es a meja barn por incompetente adems lineade2 pumas rafapuente pumasmx chafapuente chafacleta
505,27772,por fiiiiiin rafapuente fue lo peor que le pas a pumas
506,27773,rafa puente jr fuera de pumas tras un comunicado emitido por redes sociales pumas dio a conocer que el dt mexicano y su cuerpo tcnico ya no formarn parte del equipo mexsport
507,27774,ltimahora pumas se queda sin dt rafa puente deja de ser entrenador del conjunto auriazul tras la derrota frente al pachuca en la ligamx
508,27775,rafa puente jr mejor pon un restaurante y deja de hacerle dao al futbol mexicano
509,27776,rafa puente se va de vuelta a su zona de confort pero el dao en club universidad ya est hecho
510,27777,rafa puente en pumas 7 derrotas 3 victorias y 2 empates cul es el director tcnico que menos ha durado en pumasmx
511,27778,rafa puente deja de ser el dt de los pumas de la unam va record mexico
512,27779,rafa puente deja de ser tcnico de pumas ojal y puedan conseguir un tcnico con capacidad y digno del club porque el tcnico que venga a pumas tiene una de chamba deber sacar un barco que est a pique y hundindose en la tabla porcentual para el prximo torneo
513,27780,fuera rafa puente a dentro el chels
514,27781,lo nico rescatable de hoy es que el pendejo de rafa puente ya no es tcnico de mis pumas
515,27782,termin la era rafa puente
516,27783,confirmado rafa puente deja de ser dt de pumas de la unam
517,27784,adios rafa puente hola carlo ancelotti
518,27785,ligamx la derrota de pumasmx ante tuzos en el clausura2023 fue la gota que derram el vaso el equipo anuncia la salida de rafa puente como su director tcnico
519,27786,oficial rafa puente jr fuera de pumas los pumas anunciaron la salida de rafa puente jr del banquillo los malos resultados de pumas obligaron su salida solo 3 victorias en 12 partidos ligamx
520,27787,de manera oficial rafael puente del ro dej de ser el entrenador de los pumasmx al sumar 3 victorias en 12 fechas disputadas en el cl 2023 rafa dej a universidad en la posicin 16 de la tabla con tan slo 11 puntos 16 goles a favor y 24 en contra
521,27788,no se necesitaba ni media neurona para saber que lo de rafa puente y pumas sera un rotundo fracaso el club vive uno de sus peores etapas en la historia y no se ve una pronta salida
522,27789,rafa puente no volver a dirigir jams en su vida no a tenido ni un resultado favorable quitando a lobos buap claramente no tiene el nivel para liga mx
523,27790,lo de rafa puente debera de ser una suerte de leccin universal para que nunca nadie volviera a ser contratado por su retrica pomposa o su verborrea petulante
524,27791,rafa puente jr es cesado de pumas la derrota ante tuzos fue la bomba que deton su salida ms informacin en lavozdelfutbol
525,27792,se confirma lo que informamos hace unas horas rafa puente deja el puesto de director tcnico de pumas
526,27793,rafa puente ya se fue de pumas pero por qu siempre los equipo ponen de comn acuerdo es falso lo echaron la gente se puso muy brava al final del partido y no les qued otra que darle las gracias es falso que fue de comn acuerdo
527,27794,ltimahora se acab la paciencia para el junior rafa puente es despedido de pumas
528,27795,ligamx la derrota de pumasmx ante tuzos en el clausura2023 fue la gota que derram el vaso el equipo anuncia la salida de rafa puente como su director tcnico
529,27796,djame adivinar que va a pasar en futbol picante rafa puente padre va a defender a su hijo y hasta lvaro morales se va a quedar callado
530,27797,ya se fue rafa puente ya solo nos faltan freire aldrete diogo galindo y el mas importante leopoldo silva
531,27798,gracias por nada y xito en tus futuros proyectos rafa puente
532,27799,por fin se fue rafa puente no es el nico culpable de la psima situacin del equipo pero la realidad es que no debi haber llegado nunca
533,27800,nunca me he atrevido a decir que se toca fondo porque nunca sabes si vas a ir ms abajo dijo rafa puente tras nueva derrota de pumas ante los tuzos
534,27801,muy buen domingo gan el fcbarcelona es el clsico es ms lder que nunca viscabara la juventusfces tambin gan el derby d italia forzajuve schecoperez se lleva el gran premio de arabia saudita en f1 lo mejor rafapuente deja de ser dt de pumasmx aleluya
535,27802,nos deja en el lugar 16 y presume que se puede ir ms abajo esto es lo que se esperaba de rafa puente jr un acrrimo odiador del club universidad nacional nada ms que agregar a chingar a su madre y que no regrese
536,27803,oficial rafa puente fuera de pumas y ahora
537,27804,pumas despide a rafa puente se tardaron en hacerlo
538,27805,adis a la rafapointer tras la derrota contra pachuca en c u rafa puente fue destituido como director tcnico del conjunto universitario obtuvo 3 victorias 7 derrotas y 2 empates pumas pumasunam ligamx ligabbvamx
539,27806,rafa puente llega a su casa sin jale despus de que lo corrieron de pumas su esposa en corto
540,27807,y rafa puente jr
541,27808,y lo dije pumasmx se tena que esperar a que pasara lo peor para quitar a rafa puente no mmn cuantos torneos ms ahora van a ponerse las pilas hasta que los manden a segunda
542,27809,rafa puente jr deja de ser el tcnico de pumas tras los malos resultados
543,27810,rafa puente deja de ser tcnico de pumas a travs de el universal mx lo que deberan de hacer es cesar a todos esos morros jugadores que se hacen expulsar el tcnico es el ms culpable a quien pongan seguirn igual
544,27811,con rafa puente tambin tendran que irse leopoldo silva m b sosa bennevendo galindo freire aldrete rivas gutirrez diogo del petre huerta dinenno todo el patronato
545,27812,por fin rafa puente fuera inepto
546,27813,boletin informativo pumas lanza comunicado en donde da a conocer la salida de rafa puente jr del equipo universitario
547,27814,rafa puente jr deja de ser el tcnico de pumas tras los malos resultados
548,27815,rafa puente jr ha sido destituido despus de 12 jornadas donde no consigui los resultados esperados por la directiva de pumas
549,27816,rafapuente debe seguir engaando villamelones en la es muy bueno para eso de entrenador noms no
550,27817,la salida de rafa puente de pumas en una imagen ramonesto17
551,27818,rafa puente jr es cesado de pumas la derrota ante tuzos fue la bomba que deton su salida ms informacin en lavozdelfutbol
552,27819,que triste es irle a pumas cada da es ms y ms difcil irse contento del olmpico lo nico bueno del partido de hoy fue haber escuchado a unos vatos decir no se vayan falta ver como mojan a rafa puente
553,27820,gracias pumasmx algn da tenamos que hacer las cosas bien hasta que nos das una buena noticia que festeja la nacin universitaria se va rafa puente
554,27821,rafa puente jr deber hacer una reflexin profunda pumas es un plantel limitado pero su discurso y su accin estn en extremos opuestos
555,27822,es que lo rafa puente en universidad era insostenible habla muy bien aunque siempre dice lo mismo pero la realidad lo rebas no es dt
556,27823,ultimo momento rafa puente jr deja de ser oficialmente el director tcnico de pumas una noticia que se vea venir desde varias jornadas sobre todo porque universidad nacional no juega a nada espero que se piense con cabeza fra para decidir ahora si a un dt real
557,27824,rafa puente pero trabajamos incesantemente la aficin y lo felicitamos nunca vuelva
558,27825,que bueno que ya se fue alv rafa puente
559,27826,seor me has mirado a los ojos tres pinches meses tuvieron para hacer bien su tarea y salieron con rafa puente todo para quedarse sin dt en el transcurso del torneo a ver que pasa que se haya ido rafa ya es ganancia pero como l muchos jugadores tendran que irse
560,27827,rafa puente
561,27828,rafa puente del ro deja de ser director tcnico de pumas desdeelpebetero portiuniversidad clausura2023 ligabbvamx
562,27829,que al fin de una buena noticia alvaritomorales se va el pelele de rafa puente
563,27830,se fue rafa puente del ro de la direccin tcnica de pumas camos 0 2 en casa ante pachuca pachuca que vena de empatar 1 1 con motagua de honduras y ser eliminado de la champions en pumas suenan nombres de gonzalo pineda y efran jurez para nuevo dt
564,27831,no encuentro fallas en su lgica es un hecho que podemos ir ms abajo entonces en este momento hablar de se toca fondo sera irresponsable porque todava puedes ir ms abajo rafa puente jr pumasmx ligamx ligabbvamx
565,27832,rafa puente y todos los jugadores pecho fro deberan de estar fuera de pumas 12 aos sin un campeonato
566,27833,despus de que se confirmara la baja de rafa puente quien crees que sea el nuevo dt de pumas
