,Id,Tweet
719,30926,para los del dia de la persona especial os lo explico facilito a ver si os entra por que hoy es el dia del padre hoy es una celebracin santa san jos ese jos fue el padre de jess de nazaret por eso san jos es el dia del padre lo entendis ahora psoe podemos
720,30927,celebramos 133 aos de educacin humana y cristiana de calidad hoy conmemoramos el aniversario de fundacin de nuestro colegio san jos de la salle ubicado en medelln colombia
721,30928,tuvimos una jornada muy productiva en san jos de la montaa junto al senador germanblancoa el concejal de medelln babintonflorez y los exdiputados dalfredoj y callejasjcamilo entre otros amigos inauguramos la cancha municipal en la que se invirtieron 2 000 millones
722,30929,no se crean esta farsa hoy no es el da del hombre es el da de san jose no se dejen timar
723,30930,debemos ver en san jos el modelo de varn justo padre providente y esposo amoroso obispo
724,30931,impresionante desde siempre me ha hecho tremenda ilusin pasar la noche de san jos en un helicptero viendo el cielo de valencia nada ms bonito
725,30932,hoy desde ro acarigua llevamos a cabo la misa en honor a san jos santo patrono de esta importante parroqua araurea a ti quien llev la gran labor en la crianza del hijo de dios te pedimos que nos sigas guiando en el camino del trabajo al servicio de nuestra gente
726,30933,da 33 consagracion a san jose lo hizo seor de su casa y administrador via youtube
727,30934,cerramos el da de san jos con otro jos guerrero muy presente en esta subastadepintura adems del gran lote de portada contamos con estas dos obras suyas lote 660 monotipo pieza nica salida 2 000 lote 661 amarillo el alba salida 1 300 subastademarzo arte
728,30935,san jos es un ejemplo de confianza en dios y de alguien que cree y gua sus pasos segn su voluntad una de las lecciones que aprendimos al inspirarnos en l es la bsqueda de una vida sencilla llena de sentido y espritu de familia maristas soymarista familiaglobal
729,30936,el pontificado de francisco fue encomendado a la proteccin de san jos ya que comenz solemnemente el 19 de marzo de 2013
730,30937,agradecido de poder festejar el da de san jose con mi hijo calotada carnita asada alcachofas y fideua toda una experiencia de comida catalana santjosep
731,30938,feliz da de san jos patrn de brea baja y de todos los padres muchas felicidades a todos los padres y tambin a todos los jos buena semana breabaja breabajasanjose breabajadiadelpadre
732,30939,decirte que mi programa de acompaamiento y capacitacin a vendedores de consumo masivo con territorios asignados es bueno me quedo corto un staff de profesionales y las fases de aplicacin de backtobasics lo hace unico sanjose
733,30940,feliz da de san jos patrn de brea baja y de todos los padres muchas felicidades a todos los padres y tambin a todos los jos buena semana breabaja breabajasanjose breabajadiadelpadre
734,30941,eres sinnimo de todas las cosas bonitas que vivo da a da eres la razn por la que ro y sueo eres el amor que hace latir mi corazn feliz da del hombre mi san jos augustoocampo
735,30942,19mar celebramos el da de san jos patrono de la iglesia universal de los carpinteros y del pueblo de elorza protector de la familia y fiel ejemplo de obediencia de fe y de humildad venero en vos san jos que fuiste escogido por el espritu santo gnbgarantedepaz
736,30943,la grandeza de san jos consiste en el hecho de que fue el esposo de mara y el padre de jess
737,30944,por si se te pasa feliz da del padre sanchezcastejon diadelpadre sanjose fallas2023
738,30945,conoces la historia del san jos dormido que el papafrancisco tiene en su habitacin comunicarlafe
739,30946,antes que acabe el da hoy es el da del padre y san jos fin
740,30947,sanjositurbide la alcaldesa de san jos iturbide cindyarvizu inaugur la expo ganadera en la feria regional sanjo 2023 donde se realizar compra y venta de ganado e implementos agrcolas
741,30948,san jos modelo de humildad de trabajo constante de amor incondicional de fidelidad silenciosa y de paternal solicitud aydame a obtener esas bendiciones para que pueda crecer cada da ms en ellas y as poder imitar a mi seor jess
742,30949,barlovento rinde honores a su santo patrono san jos manoduracontraloscorruptos
743,30950,mi bautizo fue un 19 de marzo por eso mi santo favorito es san jos
744,30951,la segom puebla informa que est permitida la venta de antojitos en la zona del templo de san jos puebla
745,30952,hoy no se celebra el da del hombre se celebra el da del pap esposo o modelo de padre en muchos paises catolicos hoy se celebra en honor a san jos obrero
746,30953,el puerto san jos est perdiendo 1x4 ante la nueva concepcin dos goles de erick snchez y dos de luis tunchez por la nueva concepcin
747,30954,estoy totalmente seguro que este video es en san jos de los campanos
748,30955,benahadux pone el broche de oro final a las fiestas de san jos
749,30956,y es que un padre no es plenamente padre hasta que no pierde a su hijo y se lo confa al padre quien lo entregar al mundo ser padre con san jos f hadjadj
750,30957,hoy felicitamos a todos los padres que en san jos encuentren el modelo el apoyo el consuelo para vivir bien su paternidad rezamos juntos por los padres papa francisco
751,30958,el santo patrono de san jos de ur cmo que se mud a bogot tronco de aguacero
752,30959,feliz fiesta de san jos a todos
753,30960,corazn de mara solemnidad de san jos s j os mi predilecto ven a mi casa que te espero ven y mira t sabes qu falta ven y fjate trae lo que falta y si algo no es para mi casa ven y llvatelo maestro de la vida interior ensame a orar
754,30961,este 19mar nos fuimos a tacata miranda en conmemoracin al da de san jos donde asistimos a la homila impartida por el obispo de los teques freddy fuenmayor hoy ratificamos nuestro compromiso en defensa de la familia como institucin en el marco de los valorescristianos
755,30962,volvi al desfile de ferias de san jos ms de 60 agrupaciones culturales bandas show comparsas de distintas comunidades llenaron de alegra la av bolvar para el disfrute de todos los maracayeros rafaelmaracay21 maracayvanguardista feriasdesanjose
756,30963,stefannia alcubilla se coron reina de san jos manoduracontraloscorruptos
757,30964,muchas felicidades a todos los padres en su da y a las pepas y los pepes diadelpadre sanjos
758,30965,hoy alda ultimahora almomento domingo 19demarzo2023 colima estadodecolima sanjos hoy se celebra a san jos felicidades a todos los pepes
759,30966,gaspar el lugareo la parroquia de san jos por carlos a pen casas
760,30967,almomento maracay disfruta de nuestro desfile de las ferias de san jos un ambiente lleno de mucha alegra para toda nuestra gente que vivan las ferias en honor a nuestro santo patrono nicolasmaduro soykarinacarpio maracay
761,30968,templo dedicado a san jos patrono de talpa de allende a un costado se encuentra el pocito en el que en 1644 se prerenda cremar la imagen mariana por su mal estado fsico ah fue el sitio del primer milagro que se le atribuye a nuestra seora del rosario de talpa
762,30969,feliz da del patriarca san jose modelo de santidad
763,30970,regionales san jos el barrio que naci de la devocin hacia el santo patrono de maracay
764,30971,hoy acompaamos a nuestros mayores en la celebracin del da de san jos en el hogar del pensionista jose bueno felicidades a los jos y josefas y a todos los padres yoconjuanantonio seguimoscambiandobonares mayores yo bonares
765,30972,buenas noches gentedealicante nos despedimos de ste 19demarzo dadelpadre sanjos con stas preciosas vistas os deseamos una bona nit familia alicante lamillorterretadelmn provinciadealicante costablanca lanuvees ealicantinas enalicante
766,30973,san jos patrono de los padres
767,30974,u d san jos 1 atltico calatayud c f 1 final partido de mxima dificultad nuestro equipo ha peleado hasta el final contra todo el gol de pablo sebastin el mvp de hoy ha sido antonio sellares agradecer a todos nuestrs seguidors que nos han acompaado su apoyo un puntazo
768,30975,san jos viva la masculinidad y la virilidad via web hispanidad
769,30976,stefannia alcubilla se coron reina de san jos manoduracontraloscorruptos
770,30977,la devocin a san jos llega hasta los confines de china a travs de eldebate com
771,30978,19marzo dia de san jose en la urbanizacin el per sector 1 parroquia agua salada de ciudad bolivar se realiz un contacto directo con la gente casaxcasa andrs velzquez con primarias se construye la unidad
772,30979,feliz dia san jos
773,30980,gooooooooooooooooooooool vamos a poner a estos en su sitio espera que llama floren por telefono desechable y ya esta
774,30981,misa de san jos femfallaserdelvallemola infantilesdelvalle
775,30982,stefannia alcubilla se coron reina de san jos manoduracontraloscorruptos
776,30983,san jos por el padre tamayo sanjose adoracionyliberacion moheno29 mlperezven adoralibera
777,30984,manoduracontraloscorruptos da de san jos por qu se celebra el 19 de marzo de cada ao nacionales
778,30985,san jos modelo de esposo y padre corazndepadre
779,30986,sanjos se desarroll una misa en conmemoracin del da de san jos en la plazoleta san jos del barrio cerro cor particip en representacin de la municipalidad de lambar el director de gabinete abog tito valiente guidointendente reconstruyendolambar
780,30987,se requiere para el 2023 24 reinsertar reintegrar comercio y dibujo tcnico educacin para el trabajo nivel de educacin media es necesario para los estudiantes laavanzadora mppeducacion quijada silvino beisbolxteleven 19mar araujo sergi roberto san jos omar lpez benzema
781,30988,gatilleros asesinan a hombre en las afueras de un bar en el centro de san jos
782,30989,san jos tu construiste y protegiste la primer iglesia tu esposa y tu hijo sancte joseph ora pro nobis
783,30990,stefannia alcubilla se coron reina de san jos manoduracontraloscorruptos
784,30991,1 4 lo gana mi nueva yor al puerto san jos
785,30992,da de san jos por qu se celebra el 19 de marzo de cada ao nacionales
786,30993,quiero estar en san jos
787,30994,san jos ruega por nosotros
788,30995,estas frases de 14 santos y beatos aumentarn tu devocin a san jos
789,30996,siempre me sentir halagado con cualquier reconocimiento que se me haga en especial por parte de mi esposa e hijos habiendo expresado esto agradecimiento a mi reina esposa y al mejor error de mi vida lauralcmm por un da de san jos fenomenal
790,30997,movida de los 80 en brea baja con grupo atlantis y stereos en las fiestas de san jos gran noche de msica en la plaza las madres de brea baja donde dos grupos palmeros como son atlantis y stereos nos hicieron disfrutar de buena musica gracias breabaja
791,30998,junto a la feligresa este domingo en la festividad de san jos patrono de chacao cardenal baltazar porras bepocar presidi la santa misa y nos anim a orar por la familia la unin del pas y apoyar al prjimo a los ms vulnerables
792,30999,san jos ruega por nosotros felizsemanaatodos felizsemanaparatodos sanjose
793,31000,hoy es da de san jos y tambin de los hombres justos honestos bondadosos y apartados del mal luz vida y esperanza para todos ellos
794,31001,movida de los 80 en brea baja con grupo atlantis y stereos en las fiestas de san jos gran noche de msica en la plaza las madres de brea baja donde dos grupos palmeros como son atlantis y stereos nos hicieron disfrutar de buena musica gracias breabaja
795,31002,san jos podra ser un espacio apetecido por el turista nacional y extranjero no solo un sitio de paso revitalizar la capital es una tarea urgente favorecer es espacio pblico el comercio al aire libre la cultura la msica
796,31003,feliz da de nuestro seor san jos felicidades a todos mis amigos y familiares de la red que llevan su nombre un abrazo fuerte y muchas bendiciones para todos
797,31004,hoy nos inclinamos a tus pies humildemente para agradecer los favores recibidos san jos padre adoptivo de jess ruega por nosotros
798,31005,no puede ser es san jos y no he felicitao a mi pepe eh
799,31006,aqu os dejamos algunas imgenes en ocasin de la eucarista con motivo de la festividad de san jos gracias a toda la comunidad educativa y familias por acompaarnos en este encuentro tan especial para nosotrs eucaristasanjos fecsanjosvva colegiosfec
800,31007,feliz da de san jos
801,31008,diadelpadre leycarreramilitarunica 45confuturo sanjose muchos padres militares de tropa y compaeros red necesitan una solucin muchas gracias
802,31009,san jos es una figura emblemtica en la cultura popular venezolana conocido como el patrono de los trabajadores y protector de los hogares
803,31010,sanjose ruega por nosotros
804,31011,gracias san jos tu celebracin es la de todos los yerbabuenenses festivalsanjos yerbabuena parroquiasanjos muniyerbabuena mariano campero tucumn
805,31012,los comentarios jajajajajaja
806,31013,la solemnidad de san jos se celebrar maana lunes 20 por coincidir con el iv domingo de cuaresma no es da de precepto pero celebraremos la eucarista a las 10 a las 12 y a las 8 de la tarde felicidades a los que lo llevis en el nombres a los padres y a los seminaristas
807,31014,san jos ruega por nosotros sanjose sanjos sanjose
808,31015,feliz da de san jos que san jos sea custodio de sus corazones y sus familias sanjos modelodehombre esposodemara padreadoptivo catlicos
809,31016,esta noche en valencia ardern las fallas2023 sanjos
810,31017,yo admiro a san jos porque se hizo el que crey que a mara la pre el espritu santo en forma de paloma mis respetos
811,31018,hoy 19mar celebramos el da de san jos protector de la familia fanb gnb
812,31019,hoy es la solemnidad de san jos esposo de la virgen mara y custodio de la iglesia va aciprensa
813,31020,atardecer de celebracin con los amigos un san jos de reencuentro buenasnochesatodos
814,31021,si esta tarde gana el real madrid y millos sera un da de san jos perfecto a esta hora ya el ftbol comienza a ser tendencia desplazando a los que pensamos que vamos mal y a los que piensan que vamos bien llueve y es rico arruncharse calmarse y abrazar la familia
815,31022,qu lindo san jos si johnny araya no existiera
816,31023,feliz da de san jos celebramos el santo de algunos de los mejores toreros de la historia tauromaquia juventudtaurina jerez
817,31024,este domingo 19mar como todos los aos se celebra el da de san jos una de las festividades ms importantes del catolicismo 19mar fanb gnb
818,31025,municipios el alcalde duenasmeme encabez la cabalgata con unos hermosos ejemplares a lo largo de las calles principales del municipio de nuevo cuscatln como parte de las celebraciones en honor a su patrono san jos
819,31026,feliz san jos el primer gorreado por una paloma
820,31027,ciclismo clsico ciclstico da de sanjos en cagua edo aragua con mi hijo en competencia
821,31028,en el da de san jos se juega elclasico en el camp nou y se siente que al bara le falta messi los culs recurren a la violencia y ven pasar a vinicius corriendo como the flash formula1  sguenos somos una tienda geek instagram
822,31029,fiesta patronal san jose saladas
823,31030,trnsito lento km 24 al km 26 sector siquiares turrcares hacia san jos por cantidad de vehculos evite accidentes y guarde la distancia
824,31031,bendito san jos aumenta mi fe
825,31032,19mar da de san jos en venezuela fue obrero patrono de los carpinteros ingenieros y trabajadores en general modelo de padre y esposo patrn de la iglesia universal fanb gnb
826,31033,hoy estuvimos en el sector san jos km 7 de la prolongacin independencia un da con la comunidad nos acompaa el diputado orlando jorge mera actividades baloncesto voleibol karate voleibol domino vitilla ajedrez softbol parche aros la soga y la recreacin
827,31034,enhorabuena para nuestro deportista leones edgar ramrez por obtener el primer lugar dentro de los 800 metros planos en el cardinal classic 2023 con sede en san jos california somosgrandes somosfuertes somoslen capitalamericanadeldeporte
828,31035,que alegra celebrar el da nacional del artesano que coincide con el da de san jos hoy se conmemora el trabajo de todas y todos los artesanos que a travs de sus manos crean maravillas dejando un legado histrico en cada generacin de nuestro municipio
829,31036,esta noche acompaamos a nuestros mayores en la cena de la fiesta de san jos del hogar del pensionista jos bueno prez invitados por su junta directiva nuestros concejales begoa limon macias jernimo j limn coronel y santiago ponce popularesbonares bonares
830,31037,san jos para la alta calaa de colombia traduce yo s lo cri
831,31038,en elplan dedios sanjos tuvo un papel esencial la responsabilidad y privilegio de ser padre adoptivo delniojess y esposo virginal demara sanjos santo custodio de lasagradafamilia santo que ms cerca est dejess yvirgenmara ejemplo de esposo y padre sanjos aniv19mar
832,31039,eucarista en honor a san jos agradecemos la asistencia a la corporacin municipal hna m juana superiora provincial y a la coral san jos tambin gracias a todas las familias asistentes feliz da a todos los papis
833,31040,mara se viste de hebrea as est ataviada de hebrea en esta cuaresma mi reina del sbado de pasin de sevilla nuestra seora de los dolores de la hermandad de san jos obrero cuaresma2023
834,31041,cada 19mar la iglesia catlica conmemora un santo muy especial considerado el patrn de la iglesia universal san jos representando el papel sagrado de los padres como protectores y guas de las familias
835,31042,ya no vuelvo a decir que alguien es mi san jos
836,31043,san jos cuida de nosotros cmo cuidaste de jess ensanos cmo enseaste a jess manos como amabas a jess
837,31044,felicidades a todos los padres san jos con el nio cristbal de villalpando ciudad de mxico c 1649 1714
838,31045,segundo bloque de las elecciones en la falda nota completa en crnica sje en youtube
839,31046,oh dios que en tu inefable providencia te dignaste elegir a san jos por esposo de t santsima madre concdenos te rogamos que merezcamos tener por intercesor en el cielo al que veneramos como protector en la tierra t que vives y reinas por los siglos de los siglos amn
840,31047,lt san jos bendito esposo de la virgen mara 19 marzo virgen
841,31048,los chicos del colegio m cristina tambin han realizado estos preciosos trabajos para felicitar a sus padres sanjos dadelpadre
842,31049,todas merecemos un san jos en nuestras vidas
843,31050,celebramos san jos en la capilla en construccin de florenciovarela potente experiencia de una iglesia que crece
844,31051,lirios san jos perfectos para este dia
845,31052,cada 19 de marzo se conmemora el da internacional del hombre por eso reiteramos nuestro agradecimiento a los hombres por su dedicacin entrega y fortaleza en cada accin que realizan logrando ser un gran ejemplo para la sociedad felizdiadelhombre sanjose
846,31053,construirn un polo educativo en san vicente el opisu llev a cabo la apertura de sobres para la edificacin de un jardn de infantes y una escuela secundaria en el barrio san jos
847,31054,hoy es del da de san jos ese buen hombre que no habla acta si duda se deja guiar por dios asume su papel sin pretenciones y con diligencia
848,31055,el da del hombre es el 19 de noviembre b hoy es el da de san jos que el equivalente sera el da al buen esposo y el buen padre
849,31056,a propsito de san jos hoy hace unas semanas haba llegado de entrenar y me tir en la cama tom una imagen de san jos que tengo en la mesita de noche y comenc a hablar con ella ustedes saben que uno a veces es loco y hablando como a manera de oracin
850,31057,el patrn de moguer no poda ser otro que san jos diadelpadre bajo el cielo azul ail y la giraldilla se mezcla el olor a azahar y el del incienso ya huele a primavera
851,31058,que en antena 3 han explicado que hoy es el da del padre porque es san jos padre de jess
852,31059,alumnos de primero realizaron una bonita tarjeta de felicitacin para sus padres para celebrar san jos minmaculadamoga dee archimadrid diadelpadre
853,31060,en todas las familias del mundo necesitamos a un san jose cristo mismo tuvo una maravillosa familia su madre santa maria y su patriarca san jose benditos sean todos los hombres que emulan al patriarca san jose familia santa de nazareth venezueladicenoalaidelogiadegenero
854,31061,la iglesia celebra a sanjose
855,31062,19 de marzo festividad de san jos comitndelasflores chiapas sanjos
856,31063,vox san jos pontevedra qu mejor lugar y da para depositar ante la peregrina palabras de nimo y esperanza para el cambio poltico en galicia candidatos en las municipales de vigo pontevedra con diputados nacionales patricia rueda fjcontreras alvarojdiazmel1
857,31064,hoy celebramos a san jos esposo de la virgen mara y patrono de los trabajadores feliz da de san jos que su ejemplo nos inspire a ser responsables y entregados en nuestra labor diaria sanjos emas irapuato
858,31065,t forjaste a cristo como hombre tu grandeza brilla en tu sencillez bienaventurado san jos
859,31066,bomberos de nuestro bollenar se dirige a rescate de persona por posible paro cardiorrespiratorio en pasaje las golondrinas sector san jos acude la unidad r 5 noticia en desarrollo bollenar siempreatentos
860,31067,hoy no debera ser el da del hombre sino el da de los padres adoptivos como era san jos
861,31068,san jos en ti dios confo a su hijo en ti mara deposit su confianza contigo cristo se forj como hombre guame en el camino de la vida
862,31069,10 apariciones de san jos de ftima irlanda o cotignac a san luis orione y san juan de la cruz va relibertad
863,31070,los pequeos de infantil han realizado estos preciosos trabajos para felicitar a sus paps sanjos diadelpadre
864,31071,domingo 19demarzo en la parroquia san jos obrero diadesanjose
865,31072,hoy da de san jos finaliza una semana llena de grandes momentos ponemos el punto final con la eucarista paella las finales de los torneos y los hinchables gracias a la parroquia ampa colegio y familias por vuestra participacin viva san jos educsisjcastillayleon
866,31073,feliz da del hombre sanjose
867,31074,melipilla bomberos se dirige a rescate por persona en posible pcr paro cardiorrespiratorio sector fundo santa marta san jos redmelipilla
868,31075,aunque el 19 de marzo es el da de san jos ste ao por caer en domingo su precepto ser maana 20 de marzo
869,31076,hoy es san jos ser por m
870,31077,lunes 20 de marzo celebracin solemne en la festividad de san jos en la eucarista de las 18 30 horas
871,31078,feliz da de san jos nicolasmaduro carnetdelapatria y de las fiestas de elorza que viva el llano venezolano manoduracontraloscorruptos
872,31079,a ti acudimos seor san jos en nuestras muchas tribulaciones y despus de haber invocado el auxilio de tu santsima esposa ahora solicitamos confiados tu patrocinio capilla de san jos dentro de la inbguadalupe elimora84391737
873,31080,san jos ejemplo de hombre y de padre guanos y aydanos a tener una vida prspera de la mano de tu hijo jess para seguir velando por el bienestar de las comunidades dadelhombre
874,31081,hoy est en asturias vctor manuel sanjose casado con pilar cuesta conocida como ana beln este individuo nacido en mieres le hizo un disco al general franco a manuel llaneza a inguanzo y no s si alguno ms lo recorrimos todo y el corto de barbn abriendo la boca en avils
875,31082,feliz da del padre feliz da de san jose 2023 diferente porque me encuentro recuperndome de un esguince pero no ello deja de ser mi da
876,31083,yo s que valencia no es madrid y no todo el mundo lo sabe pero efectivamente el ayuntamiento hace meses estuvo de trifulca con los empresaurios para obligar a probar la semana de 4 das por cojones por eso no tenemos fiesta ni maana por san jos ni el 6 de abril
877,31084,msica para celebrar el da de san jos el coro de familias y profesores san jos ha puesto la nota musical a la misa de 13 15 de ruiz hernndez
878,31085,feliz dia del padre y san jose al cielo
879,31086,19mar gnbpedraza da de la llaneridad fecha para resaltar la cultura la msica y las costumbres autnticas de nuestra identidad en honor al patrono san jos de la ciudad de elorza en el estado apure manoduracontraloscorruptos invictafanb prensafanb cz33 prensa
880,31087,hoy es 19demarzo dadesanjos y dadelpadre en espaa padre pap jos foto iglesia de la parroquia sanjos en caracas venezuela archivo ayre
881,31088,a san jos esposo de mara y padre de jess muchos acuden como intercesor de todo sanjos
882,31089,san jos proteje nuestra familia san jos aumenta nuestra fe
883,31090,19 de marzo da del seminario levntate y ponte en camino felicidades a todos los sacerdotes y seminaristas riojavocacion iglesiarioja 19demarzo sanjose diadelpadre diadelseminario sacerdotes seminaristas felicidades seminariodelogroo logroo
884,31091,estado del tiempo san jose sanjose chepe centro temperatura 26 c condicin fair humedad 48 velocidad viento 27 kph direccin del viento east indice uv 11
885,31092,felicidades dobles pap por tu da de san jose y por ser nuestro padre
886,31093,en educacin primaria nuestros alumnos han hecho uso de la imaginacin y creatividad para elaborar estos maravillosos detalles a sus padres felizdiadelpadre sanjose
887,31094,gracias san jos california hermanossalvadoreos somosgana
888,31095,interesante ntese el parecido con san jos el viejo antigua guatemala por lo que se ve en el grabado el colapso del primer cuerpo tambin fue parecido al de la iglesia de santa rosa de lima tambin en antigua guatemala a sus autores
889,31096,san jos protgenos
890,31097,buenas noches espero que para tods haya sido un feliz da del padre y de san jos
891,31098,parcial nueva concepcin est derrotando 0x2 al puerto san jos con dos goles de erick snchez
892,31099,estuvimos en maicao asistiendo con mucho respeto a la celebracin de san jose acompaando a nuestros amigos vamos por qu vamos
893,31100,vecinos de la col san jos comunal llevaban 18 aos sin drenaje chente castellanos les cumpli entrate el presidente municipal de santa cruz xoxocotln entreg otra obra prioritaria
