,Id,Tweet
856,4038,he dormido 15h en total estoy reentadisima pero ha valido la pena fallas son fallas
857,4039,el vaco legal que us aston martin para ganar el podio de fernando alonso y que la fia cambiar
858,4040,de autentica coa que ms pruebas de garrigues se hagan en avenida fernando alonso de autntica coa
859,4041,el vaco legal que us aston martin para ganar el podio de fernando alonso y que la fia cambiar por geli casta
860,4042,xabi alonso cogi al bayer leverkusen penltimo clasificado y desde entonces ya ha completado una vuelta en bundesliga 17 partidos con su equipo esta sera su tabla 1 dortmund 38 pt 2 bayern 37 pt 3 leipzig 34 pt 4 leverkusen 32 pt
861,4043,en los mafiosos we trust
862,4044,alonso ha provocado que los fans de javi se alegren de los logros de su compaero
863,4045,hay un dicho que dice elige bien y te ir bien
864,4046,puente atirantado talavera
865,4047,yo el gp de australia lo veo asi verstapen se queda fuera porq a la 2 vuelta se da cuenta de q va en el monoplaza con una mamba negra y se caga mazo y sale del coche escopetao checo prez tiene problemas con el motor al ir a fondo porq sala 17 alonso gana la carrera
866,4048,el vaco legal que us aston martin para ganar el podio de fernando alonso y que la fia cambiar por geli casta
867,4049,crecin con los secretos shania twain the corrs e moita msica dos 90 etc vanme decir catro parvos que fan trap ou reggaeton o que teen que escoitar s nens
868,4050,se imaginan que vicky alonso haya dejado marvel para empezar a producir un universo de pelculas sobre la historia argentina desde las invasiones inglesas cerrando con la dictadura y la vuelta de la democracia tan solo un sueo
869,4051,lomsledo podio s podio no podio s explicamos el calvario de fernando alonso con la fia
870,4052,necesitando esto
871,4053,leo leo a los seguidores del real madrid pedir a xabi alonso como prximo entrenador con arbeloa de segundo y me viene la imagen de los dos corriendo la behobia san sebastn en octubre de 2017 arbeloa llevaba el dorsal 155 el asco que me produce la imagen es indescriptible
872,4054,el vaco legal que us aston martin para ganar el podio de fernando alonso y que la fia cambiar f1 spanishgp formula1 el espaol
873,4055,catedral cdiz
874,4056,victoria alonso presidenta de post produccin vfx y animacin de marvelstudios ha dejado su cargo
875,4057,kikovenenoeh a mi la cancin que ms me gusta es la de joselito y especialmente cuando la canta rafael
876,4058,libertad y orden
877,4059,hay que trabajar inteligente no duro
878,4060,kikovenenoeh me temo que nos van a poner como no digan dueas porque sois todo hombres
879,4061,porsiteloperdiste la fia afinar su reglamento tras el sinsentido de este domingo en el saudiarabiangp con fernando alonso y aston martin f1
880,4062,antes 199 ahora 177 95 11 honor x7 smartphone con android 11 4 gb ram 128 gb de almacenamiento pantalla fullview fluida de gavi firstdates20m carvajal benzema mendilibar alonso felizlunes
881,4063,ela saca msica nueva q esta ya me la aprend
882,4064,alonso buscando la victoria 33 y yo buscando el seguidor 33 quien quiere ser el afortunado o afortunada
883,4065,mircoles de tertulias internacional con la jinete victoria alonso desde espaa mujereshipicasv desde nuestra casa manyinghipico los esperamos
884,4066,lo ultimo que ve la pelotita antes de ser bien tratada
885,4067,cabildo de texmelucan aprueba la 1ra municipalizacin de una unidad habitacional va proyecto cinco
886,4068,por qu ha dejado marvel la argentina victoria alonso
887,4069,patrimonio desaparecido el octgono la antigua academia de caballera historia arquitectura patrimonio
888,4070,alonso
889,4071,los cm de aston martin y f1 han visto la panda de esquizofrnicos que apoyan a alonso y lo estn aprovechando al mximo
890,4072,cuba piden fin de las misiones medicas politicas castristas de invasion va youtube
891,4073,le devuelven el podio a fernando alonso
892,4074,es posible ir viendo la carrera por las pantallas mientras vas a 300 km h por las calles de jeddah si te llamas fernando alonso s y si ves el nuevo captulo de cdigo f1 con victorabadf1 te dars cuenta si es que le da todo completamente igual
893,4075,la verdad que el nivel se ve en la clasificacin deja de blanquear y contar que aqu manda mendes y no hay estructura deportiva ten dignidad y no hagas ms el ridculo
894,4076,he hecho mas ejercicio en fallas entre andar en traslado y ofrenda bailar saltar y todo q dolor de cuerpo
895,4077,mi novio infiel le habla a fernando alonso
896,4078,me puedo acostumbrar a catar podios de alonso cada dos semanas eh vuelve la espaa feliz
897,4079,nuevamente al borde del precipicio con la mirada puesta en el 2008 y sabiendo de que cada vez que el sistema se tambalea se sabe quienes sern los paganines ya que una vez mas la crisis se reproducen y se sale del agujero llevando a los mas dbiles a situaciones angustiosas
898,4080,llevo siglos diciendo que el error de alonso fue no tener un manager de dentro del mundo de la f1
899,4081,tengo unas agujetas en los muslos y el el brazo derecho q flipass
900,4082,no veas los jipis si son pesados con alonso ms de uno no a visto una carrera ni de scalextric fijo
901,4083,pues no se me parece que meterse estas rayadas a estas alturas
902,4084,repaso serio del mirands al eibar en esta primera mitad en anduva cmo serio es lo de ral garca de haro laligasmartbank
903,4085,calurosa acogida a los campeones si se pudo nos quedan muchas batallas por ganar
904,4086,hace un ao de la mayor ostia de mi vida
905,4087,puntal santander
906,4088,buenas tardes acompanos en lasnoticias con alonso es karlagamezavila y dementina en los deportes en punto de las 2 00 p m por el 12 1 de televisason visite nuestro portal
907,4089,hoy aprend que hoy es el ao nuevo persa
908,4090,muy grande el realbetis y juanmi9395 para ellos no cuesta nada tener este tipo de detalles y este chaval no va a olvidar en su vida ese da
909,4091,la vicepresidenta victoria alonso acaba de dejar marvel studios ella era la presidenta de post produccin vfx y animacin en el estudio fuente
910,4092,estoy en directo para contaros mi experiencia sobre cmo un mal da puede hacer peligrar tu salud mental venid al directo y os estar leyendo y comentaremos tambin alguna noticia de james gunn y victoria alonso
911,4093,el detallazo de alonso con el mecnico que casi le cuesta el podio
912,4094,la ideologa de alonso
913,4095,mi ranking de sustitutos de ancelotti 1 klopp 2 mourinho 3 tuchel 4 xabi alonso 5 pochettino 6 ral 7 luis enrique 8 arbeloa
914,4096,lo que peor llevo de este revival chusco de la crisis de 2008 en el que vivimos es volver a encontrarme a fernando alonso en todas partes
915,4097,pesar 96kg y montar en los karts no van muy bien de la mano me pasaban en rectas pisando a fondo como verstapen a alonso este finde no poda hacer nada
916,4098,veo que monchi es tt no s si fue idea suya deduzco que si es el director deportivo o de quien pero en serio alguin en sevilla no slo el club la ciudad entera pensaba que sampaoli era una buena opcin en serio no me lo creo
917,4099,victoria alonso deja marvel despus de 17 aos sin motivo aparente regstrategratis
918,4100,todas las nias gritando a gavi podra ser yo perfectamente
919,4101,como no bamos a ser campeones del mundo si es un cabaret todo gran plantel es as
920,4102,victoria alonso deja marvel despus de 17 aos sin motivo aparente regstrategratis
921,4103,flojos reculiaos vergenza ajena dan si uno llega 1 hr 1hr 1 2 tarde a la pega la pata en la raja te levanta hasta la luna a los lindos ni cosquillas
922,4104,es curiosa la gente que solo va a museos para tomarse fotos decir que fueron pero no disfrutar el arte que hay adentro
923,4105,fidel el mejor director del equipo cuba
924,4106,victoria alonso se despide de marvel studios despus de ms de 15 aos
925,4107,como alonso se marque un raikkonen 2007 este ao porque estos dos se enfaden este yo me voy de la vida
926,4108,si lzaro no se levanta con eso renuncia
927,4109,victoria alonso jefa de post produccin y efectos visuales dej marvel studios
928,4110,tuve un primer da de clases medio molesto pero llego a twitter y me sorprenden las divisivas reacciones al despido de victoria alonso porque se que la odian pero no que agradaba a muchos a mi no tanto marvelstudios est tomando muchos cambios y confo en que mejorar
929,4111,guadalajara las cruces concurso nacional de recortadores i trofeo primavera 2023 grupo 2 jonathan estbanez peta romn muoz eusebio sacristn use dany alonso ivn cachero venta de entradas online
930,4112,tal cul son farsantes
931,4113,este caballero tiene del ao que le pidan pero trabaja en cien indecisos jajaja programa que ya tuvo polmicas el ao pasado por la tendencia
932,4114,primer da de trabajo en csis encuentro con las autoridades locales presentaciones sobre sostenibilidad y una yincana por la ciudad erasmusplus mobilitycesis
933,4115,victoria alonso se fu de marvel definitivamente muri el mcu
934,4116,una sola piedra la nube tienen ms memoria que la humanidad entera
935,4117,mi madre ha echao al alonso del bao y eso q estaba dao la vuelta y yo le dicho q mas da si es gei
936,4118,ahora todo el mundo conoce a victoria alonso
937,4119,alonso recupera su tercer puesto alonso f1 formula1
938,4120,hace unos das un compaero me deca estuve meses aguantando a bar de lorazepam son los sectores del audiovisual la publicidad y el marketing malos para la salud mental es hora de contratar psiclogos en las empresas
939,4121,soy un imbecil si que tengo estacin de bicis dios soy idiota
940,4122,reportenlo y madreenlo
941,4123,cosat copa vendimia argentina g 3 14 aos toms alonso valladares y martn luengo se enfrentarn a gregorio boubila y benjamn meyer en 1 ronda de dobles
942,4124,han empezado a ladrar los perros del vecino y he pensado en fernando alonso putos autistas de twitter voy a tener qu dejar esto por mi salud mental
943,4125,gran premio de arabia saudita 2023 prez triunfa y alonso logra su podio nmero 100
944,4126,tenga mi voto sr presbitero y que comience a arreglarse este pais
945,4127,marvel studios veteran producer victoria alonso exits
946,4128,las imgenes de la liga las lleva mediapro mediapro es una empresa de la cual roures es el dueo roures es avalista del fc barcelona saquen conclusiones
947,4129,ese es el pueblo al que representa el equipo cuba los odiadores y gusanos de miami jams podrn opacar ese cario y respeto que sentimos los cubanos por nuestros deportistas siempre regresan a la patria con la medalla de la dignidad
948,4130,caf era buensimo es imposible que no sea el mejor lahm mi tipo de jugador
949,4131,lobato y comentaristas espaoles dazn resignados cuando checo perez rebasa a fernan alonso en arabia checoprez redbull fernandoalonso astonmartinf1 formula1 saudiarabiangp
950,4132,no nos afecta lo que nos sucede sino lo que nos decimos sobre lo que nos sucede
951,4133,victoria alonso deja marvel studios tras casi dos dcadas como directiva via pocket
952,4134,alonso y balbi cuando vean que pearol va ganar el campeonato
953,4135,posible entrada de nave nodriza extraterrestre nas inmediacions do sistema solar estos avistamentos ovnis recientes poden ser drones non tripulados inspeccionando o noso sistema solar
954,4136,porque desis mineros pero esquivas decir minera ancestral pero anuncias llegada de dragas y luegos hablas de empresarios por ningn lado te podras safar
955,4137,un dia mas siendo atlante meditarraneo iberico como disfruto de ser espaol viv franco cristiano ronldo y alonso
956,4138,deja marvel studios con informacin de thr victoriaalonso queda fuera de marvelstudios victoria alonso estuvo en el estudio desde 2006 y fue presidenta fsica postproduccin vfx y animacin pero sobre todo mano derecha de kevinfeige en el xito del mcu
957,4139,aaaaaa me voy a cambiar la foto de perfil unos das nuevafotodeperfil
958,4140,victoria alonso se aleja de marvel trabaj 17 aos desde la primera iron man y produjo argentina1985 1985
959,4141,esto ha hecho que alonso sea mi 4to piloto favorito de la f1 qu nivel de trolleada pico lo amo
960,4142,estoy viendo el reci de imagine dragons y no puedo creer que no haba nadie llorando con wrecked yo estoy llorando vindolo por flow como nena de 5 que se le cay el helado
961,4143,diremos que el paso de victoria alonso por marvel es la piedra fundacional de haber convertido un par de pelculas en una enorme telenovela de migr kevin feige could never
962,4144,fernando alonso es el mejor deportista espaol de la historia
963,4145,pasar revista a nuestras ideas sobre la circunstancia y forjar un plan estratgico ortega y gasset ensimismamiento y alteracin 1933
964,4146,finalmente han sacado a victoria alonso de marvel tambin le han dado nuevamente el puesto de ceo de disney a bob iger ante el desastre creado por chapek que est generando perdidas millonarias a la compaia solo falta que se quiten a kathleen kennedy de lucasfilms
965,4147,uy ojal que no
966,4148,ricciardo race in vegas hamilton race in miami alonso equal engines for everyone llevamos 2 3
967,4149,que victoria alonso qu
968,4150,el ndice de competitividad urbana icu2022 evala a 66 ciudades mexicanas a partir del anlisis de 69 indicadores agrupados en 10 subndices consulta toda la informacin aqu y conoce cmo le fue a tu ciudad
969,4151,en ciudades medianas con entre 500 mil y 1 milln de habitantes hermosillo cuenta con los salarios ms altos los trabajadores de cancn y villahermosa reciben alrededor de 2 pesos menos por cada 10 que ganan los de hermosillo
970,4152,cmo se comparan los salarios entre ciudades monterrey tiene los mayores ingresos promedio de aquellas con 1 milln de habitantes 11 390 por cada 10 pesos que gana un trabajador ah uno en quertaro gana 9 uno en guadalajara 8 y uno
971,4153,ok tratar de ponerte al dia de lo que paso en este pas esto si es corrupcin alonso camacaro cont
972,4154,no haciendo menos el triunfo de schecoperez lo que hizo la f1 con fernando alonso fue muy malo la penalizacin hubiera sido antes de la premiacion y no despus
973,4155,ac estoy mi amor no existe el olvido
974,4156,la troleada de alonso a russell tras recuperar el podio que va camino de las 2m de impresiones en twitter va diarioas
975,4157,nunca confes en nadie porque hasta tu sombra te abandona en la oscuridad
976,4158,victoria alonso leaves marvel studios iron man avengers producer
977,4159,victoria alonso dijo cuando arranc voy a dejar marvel el dia que gimnasia le gane a estudiantes y as fu
978,4160,victoria alonso se va de marvel studios despus de casi 20 aos como directiva enterate los detalles en esta nota
979,4161,victoria alonso se va de marvel studios despus de casi 20 aos como directiva enterate los detalles en esta nota
980,4162,una vez ms te pones en evidencia alvarito minera informal clan del golfo
981,4163,la brjula de radioestadio este lunes con el resumen del fin de semana las voces de los deportistas la canasta de andrea vilaro cbavenida el anlisis de jorge alonso 14 el salamanca r c rugby aranda el protagonista del fin de semana de vanesamartins
982,4164,podio nmero para fernando alonso daz y encima en el da del padre
983,4165,marvel studios victoria alonso exits
984,4166,calma qu sentido lleva este imperativo sencillamente el de invitarnos a suspender un momento la accin que amenaza con enajenarnos y con hacernos perder la cabeza suspender un momento la accin para recogernos dentro de nosotros mismos
985,4167,el jodido alonso va pilotando al lmite rozando los muros al mismo tiempo que va siguiendo la carrera fijndose en las pantallas que hay en el circuito para los espectadores es un jodido demente est loco como una polla
986,4168,por favor solo pido ver otra cosa en mi tl que no sea fernando alonso voy chiflar
987,4169,por que fernando alonso va a ser campen del mundo en 2023 segn la historia abro hilo
988,4170,el vacile de fernando alonso a russell el ingls lo celebr con el trofeo y el asturiano le responde ahora a travs de 20m
989,4171,ahora nuevas fuentes indican que victoria alonso habra abandonado marvel studios luego de la derrota de edlp contra gelp en el clsico platense la re concha de tu madre mndez morfn recit la oriunda de la plata en su nota de despedida
990,4172,no puede ser que estamos a 20 de marzo y ya est negro en mayo voy a estar hecho cenizas
991,4173,intentan vendernos que checo perez est al nivel de verstappen que tan difcil es entender que no no lo est ni checo ni hamilton ni ninguno del resto excepto alonso alonso est entre el escaln que hay entre max y el resto
992,4174,lean este hilo por favor
993,4175,me da miedo lo que va a pasar con marvelstudios ahora sin victoria alonso ya la fase 4 termin siendo un lo as que se me hace difcil que puedan reconectar todos los cabos sueltos que dejaron en el ucm
994,4176,cuando yo tena la edad de esos nios espaa era la octava potencia mundial y todas las familias tenan casa y dos coches y slo veas esa cantidad de bicis por la calle en pases por entonces subdesarrollados como china o la india
995,4177,victoria alonso deja su puesto como presidenta de produccin fsica posproduccin efectos visuales y animacin de marvel studios la cineasta argentina colabor en la produccin de prcticamente todo el universo cinematogrfico de marvel victoriaalonso marvelstudios
996,4178,red flags chilla te crtica por aburrimiento no se cuida tonta fuma bebe mucho solo sabe hablar de los dems no hace nada lo que te ensea andrew tate green flags fernando alonso tu padre todo lo contrario a las red flags
997,4179,con mi amiga no vas a flashar pedazo d mugrienta
998,4180,no se si ancelotti cumplira su contrato hasta 2024 si se ir si le echaran si vendr mou si vendr xabi alonso o subir ral o vendr tuchel mientras no venga pochettino
999,4181,al extremo que de puro haber perdido todo el mundo la razn resulta que acaban tenindola todos slo que entonces la razn que cada uno tiene no es la suya sino la que el otro ha perdido
1000,4182,que pasa con el agua para la parroquia alonso de ojeda nicolasmaduro
1001,4183,plomo al ampa
1002,4184,entrevistronme na revista iberoamericana oceanum estiven falando de literatura principalmente das novelas de laura mario de poesa e dos meus plans de futuro conto algunha cousa guai dixoa completa neste fo
1003,4185,el objetivo de la temporada va a ser intentar conjuntar la camiseta de aston martin de vettel con mi ropa habitual
1004,4186,las y los que seguimos el programa de gran hermano no queremos que haya abusadores en en el canal que se haga justicia para todas las vctimas y que todos estos enfermos paguen
1005,4187,as vemos hoy que una actitud absurda justifica el advenimiento de otra actitud antagnica pero tampoco razonable por lo menos suficientemente razonable y as sucesivamente pues las cosas de la poltica han llegado en occidente
1006,4188,solo venamos a ganar el clsico y terminamos rompiendo la relacin directiva aficion
1007,4189,la argentina victoria alonso dej marvel studios luego de 17 aos
1008,4190,conalep 149 de moyotzingo reconoce y agradece atencin del gobierno de texmelucan va proyecto cinco
1009,4191,siendole fiel sin ser nada
1010,4192,dislocada en esta forma de su normal coyuntura con la contemplacin con el ensimismamiento la pura accin permite y suscita slo un encadenamiento de insensateces que mejor deberamos llamar desencadenamiento
1011,4193,fernando alonso es dios dice que cree que verstappen llegar en la vuelta 25 a la segunda posicin se lo dicen a verstappen y este comenta que espera llegar antes vuelta 25 y verstappen se pone 2 simplemente nanobrujera
1012,4194,pero el falso es falso y el falso conmigo no camina
1013,4195,casasomosquito atahualpa ofrece el taller de nutricin y comida sana en el cual aprenders a cuidar tu alimentacin para vivir con salud lunes 10 00 a 11 30 av alonso de angulo y jipijapa comuncate al porunquitodigno
1014,4196,desde el 17 de marzo la productora victoria alonso de marvel studios fue despedida de su cargo alonso estuvo desde el inicio de marvel studios como encargada de los vfx actualmente era productora ejecutiva
1015,4197,fernando alonso daz es un excelente tuitero de 41 aos que tiene como hobby subirse a un coche de frmula 1 los fines de semana
1016,4198,fernando alonso no perdona a russell ni en redes sociales fernandoalonso alo oficial
1017,4199,en la vida bscate a alguien que te trate como aston martin est tratando a fernando alonso
1018,4200,al yo llegar a casa mi padre ha venido corriendo a ensearme el tweet de fernando alonso
1019,4201,afirmacin nos prximos meses ou anos contactaremos con vida aliengena tweet guardado
1020,4202,yo cre que era broma cuando victoria alonso dijo que namor en el ucm significa nio sin amor pero no no es broma as que teniendo en cuenta cmo ha ido la fase 4 y como ha empezado la fase 5 perdn si no me entristece su salida de marvel alguno ms tendra que irse
1021,4203,tcnico interino para pumas juan de dios ramrez perales qu les parece
1022,4204,todos chupandole la pija a alonso por el podio n 100 y hamilton tiene 191 ajajajaja
1023,4205,cuando me explicaron que yo sera el juguete pero an as jugu y en efecto fui el juguete
1024,4206,un da de estos escucharemos un pa y ser antonio lobato habindose cado de la silla por culpa del papa alonso
1025,4207,romina qu hicisteeeee
1026,4208,que victoria alonso qu
1027,4209,que victoria alonso qu
1028,4210,qu bien habla esta chica siempre
1029,4211,estuve husmeando para tratar de entender qu significan las tribunas de alonso en bahrin y arabia saudita los datos que encontr no slo son importantes para fernando sino para aston martin
1030,4212,lo inevitable volveremos pronto
1031,4213,hrmanas q paso c victoria alonso pq se fue d marvel dios
1032,4214,riqusimos
1033,4215,a consideracin para el vol 3 1991 2000 spotify
1034,4216,las escenas extras en harry potter 2 le dan mucho sentido a la peli
1035,4217,victoria alonso dej marvel studios
1036,4218,don fernando alonso daz sazo se retirar de la f1 con 45 aos aqu lo lesteis primero
1037,4219,el cuadro mujer primaveral del artista vigus jorge alonso refleja su expectacin ante la llegada de una estacin la mirada de una mujer gua una pintura de la primavera actual que rebosa el color de la nueva estacin y la viveza de las hojas de la vid
1038,4220,ajajajajajaja
1039,4221,marvel se queda sin la latina ms poderosa victoria alonso deja la plana ejecutiva
1040,4222,alonso sufri un fuerte golpe en la cabeza tras resbalarse frente a una tienda de conveniencia
1041,4223,creo sinceramente que el elche debera hacer contratos de una semana a sus entrenadores cada semana uno nuevo seguirian bajando a 2 pero la jornada que por mera estadstica les entrene bielsa o luis enrique sera un lolazo
1042,4224,ojal pronto haya una explicacin y sea algo positivo o normal porque la ausencia de un pilar tan importante como victoria alonso puede tambalear al estudio
1043,4225,en unos minutos nos vemos por navarratv hoy programa especial de zonamixta no se lo pierdan
1044,4226,si mis ojos vuelven a ver a alonso ganando derramaran lgrimas de emocin felicidad ms que la seleccin ganando una euro o mundial la infancia de la espaa feliz nostalgia de lo que jams volver y fernando como un santo nos volver a transportarnos al cielo
1045,4227,364 dias
1046,4228,aburrido
1047,4229,os debo una
1048,4230,acaba de publicar una foto
1049,4231,buenas noches soadores que los dulces sueos os acompaen yo creo que soar con tamames descansad bonito y maana si el creador lo quiere nos vemos no esteis hasta tarde os vigilo besis guapos inclusivo
1050,4232,noticia del momento victoria alonso renuncia a su cargo presidenta ejecutiva de marvelstudios la productora ejecutiva llevaba trabajando en el mcu desde avengers se desconocen las razones de su salida va hollywood reporte
1051,4233,jueputa 4 aos perdidos
1052,4234,ver a alonso haciendo podios de nuevo y todo me hace feliz porque me lleva a cuando era chiquita y vea las carreras con mi viejo y siempre festejbamos cuando haca podio
1053,4235,variety inform que victoria alonso se fue de marvel donde trabajaba desde 2006 donde empez con iron man era presidenta de fsica postproduccin vfx y animacin en marvel studios
1054,4236,ya no voy a poder gritar victoria alonso cuando termine una pelcula
1055,4237,la productora argentina victoria alonso dej marvel studios luego de 17 aos
1056,4238,segn diversos medios la vicepresidenta victoria alonso deja marvel studios despus de 17 aos de servicio la cosa esta que arde tasfandom marvelstudios
1057,4239,alonso me dijo virolo
1058,4240,mario alonso nos habla d e la felicidad desde uruguay
1059,4241,fernando alonso aston martin y el motivo que hace crecer el optimismo en cunto al rendimiento del amr 23
1060,4242,feliz equinocio de primavera
1061,4243,victoria alonso se fue de marvel aaaah todo arruinan
1062,4244,servirn con sus hermanos en el tabernculo de reunin para hacer la guardia pero no servirn en el ministerio as hars con los levitas en cuanto a su ministerio nmeros 8 26
1063,4245,pero desde los cincuenta aos cesarn de ejercer su ministerio y nunca ms lo ejercern nmeros 8 25
1064,4246,s habra ventas dolorosas como las de vini y valverde y otras no tan dolorosas como las de benzema y carvajal pero me he imaginado este real madrid y me he puesto cachondo y de entrenador don xabi alonso
1065,4247,luego habl jehov a moiss diciendo los levitas de veinticinco aos arriba entrarn a ejercer su ministerio en el servicio del tabernculo de reunin nmeros 8 23 24
1066,4248,as vinieron despus los levitas para ejercer su ministerio en el tabernculo de reunin delante de aarn y delante de sus hijos de la manera que mand jehov a moiss acerca de los levitas as hicieron con ellos nmeros 8 22
1067,4249,cusco fc ferreyra estrada alonso quina yovera barreto rodrguez vidales da luz ayarza fajardo carlos a mannucci heredia perleche amondarain cortave portales cossio correa viera carranza rasmussen gonzlez aperturaxovacion cus 0 0 cam
