,Id,Tweet
793,34899,algo que a verstappen le falta es humildad y el saber perder checo dijo que no hay preferencias y hoy quedo demostrado bien por chequito y la catedra que dio hoy
794,34900,misma sancin le pusieron a hamilton por mandar a verstappen al hospital que ahora a alonso porque un mecnico supuestamente toca el coche 0 0001s antes de cumplir los 5s lo llevo diciendo desde el ao pasado y lo repit a la f1 le quitas el marketing y es un deporte muerto
795,34901,notimaximas uno dos para red bull en arabia saudita perez verstappen
796,34902,el vato que deca que con un auto en iguales condiciones checo le ganara a verstappen saudiarabiangp chequito red bull f12023
797,34903,victoria de checo prez en arabia saud el mexicano logra su primera victoria de la temporada con una carrera espectacular verstappen que sala 15 ha sido 2 alonso termin tercero pero despus de la carrera la fia lo ha penalizado y russell sube al podio
798,34904,alguien que le diga a max verstappen que lo amo
799,34905,checo siempre cre en ti yo dicindole cada 5 minutos a mi pa que verstappen lo iba a pasar
800,34906,checo prez manda mensaje a verstappen hay que saber obedecer las rdenes que vienen desde el box f1 f12023
801,34907,increble la lucha a distancia de verstappen y checo perz enorme el mexicano manteniendo el gap con max al final max con una vuelta extraordinaria le robo la vuelta rpida a checo aqu la telemetra saudiarabia saudiarabiangp f1
802,34908,formula1 los red bull juegan otra competencia 1 2 en el gp de arabia saudita gan checo prez y max verstappen que sali 15 lo escolt fermando alonso complet el podio apenas van dos fechas de 23 pero comienza a haber una tendencia
803,34909,alto a la violencia contra la ministra norma pia y contra todas las mujeres saudiarabiangp formula1 checo prez red bull hamilton verstappen
804,34910,grande checo el mexicano se lleva el gp de arabia saudita se escuch una vez ms el himno nacional mexicano en f1 podio checo prez max verstappen fernando alonso schecoperez mxico cdmx edomex puebla texcoco
805,34911,me declaro anti max y jos verstappen
806,34912,ver la cara de emperrado de jos verstappen
807,34913,jos verstappen es de las personas ms txicas y que ms asco me dan de la f1 la verdad nada que ver con max
808,34914,meti gol schecoperez algo que no le gust al pap de verstappen
809,34915,en tanto el monegasco charles leclerc y el neerlands verstappen de ferrari y red bull respectivamente iban escalando posicin tras su inicio el zona baja de la parrilla
810,34916,checo prez logr un gran triunfo en arabia saudita verstappen complet el 1 2 de red bull y lidera el campeonato de la frmula 1
811,34917,a donde tan feliz seor verstappen
812,34918,joss verstappen no soporto a su verdadero patrn sergio michel
813,34919,verstappen sentndose en la silla del primer lugar como nio chiquito
814,34920,triunfos en la f1 pilotos actuales hamilton lewis 103 verstappen max 36 alonso fernando 32 bottas valtteri 10 leclerc charles 5 perez sergio 5 saudiarabiangp
815,34921,f1 saudiarabiangp quinto triunfo del piloto tapato dentro de la mxima categora verstappen se queda con el segundo lugar alonso sancionado con 10 segundos de penalizacin por no cumplir adecuadamente con su primera sancin el tercer sitio del podio pasa para russell
816,34922,apuesto por prez si trata bien su coche y se mantiene arriba y pasada la mitad de temporada pueda evitar sanciones por motor verstappen va ms rpido pero no da tregua a la mecnica y lo puede acabar ms adelante
817,34923,chinga tu madre jos verstappen
818,34924,los verstappen se estn ganando un enemigo muy fuerte y son los aficionados de latam no les conviene tenerlos de enemigos
819,34925,max verstappen fue elegido piloto del da remonto desde la posicin 15 hasta el 2do puesto y se llev el punto extra por la vuelta rpida saudiarabiangp
820,34926,solo dir que la fia es una p ndejada verstappen es un mal compaero envidioso y no sabe perder y chequito merece puras cosas buenas
821,34927,checoprez es campen del gran premio de arabiasaudita la escudera refbull hizo el uno y dos con max verstappen en la segunda posicin
822,34928,prez gana en arabia saud tras resistir carga de verstappen
823,34929,qu pas don verstappen le peg el bochorno jajaja urge una playera con esta imagen
824,34930,que chingue su madre jos verstappen
825,34931,domingo de violencia intrafamiliar en los verstappen
826,34932,felicidades schecoperez x esta victoria hoy en la 1ra carrera 2023 saudiarabiangp saliendo de pole y mostrando su capacidad para circuitos callejeros s q es de su equipo pero celebro mucho cuando le gana a verstappen 2do yes alonso 3ro ya su 5ta victoria y 28 podios
827,34933,checo paerez gana el go de arabia saud p2 para verstappen y p3 para russel alonso recibe penalizaciin de 10 segundos despus de los festejos del podio esto lo deja en p4
828,34934,comparto mi creencia personal diaria cuando observo personas que celebran y se alegran de victorias ajenas es que ya triunfaron por dentro mr verstappen es uno de tantos seres humanos que estn en ese proceso y se les encuentra en varios mbitos nevergiveup
829,34935,checo gana el gp de arabia el piloto mexicano sergio prez se lleva su primer carrera de la temporada en la f1 el de red bull vence en el gp de arabia saudita verstappen y alonso completan el podio eres gigante checo checoperez formula1 f1
830,34936,notimaximas gran remontada de max verstappen lo califica coo el piloto del dua en arabia saudita
831,34937,mi nuevo deporte favorito ver a jos verstappen emperrado cuando gana checo prez celebro saudiarabiangp f1
832,34938,son mis nervios o todo lo que aparece parece indicar que los verstappen son ojetes
833,34939,a 10 segundos de verstappen y a 5 de russell y dice mike krack que iban con el coche en modo de control yo es que no puedo ms
834,34940,la jeta de los dos verstappen jajajaja
835,34941,pap verstappen ya puso su cuenta privada en ig jaaa
836,34942,alguien saque el sticker de la cara de jos verstappen lo necesito
837,34943,el mexicano festeja su quinta victoria en la f1 sergio prez lidera el 1 2 de red bull en el gran premio de arabia saudita max verstappen realiza una gran remontada y fernando alonso se queda sin podio por una segunda sancin
838,34944,en trminos de soportar jos verstappen no soport la victoria de checo perez saudiarabiangp
839,34945,verstappen 13 posiciones empezando el 15 y termina 2 no lo dudaba ni alonso
840,34946,automovilismo saudiarabiangp victoria mexicana sergio checo prez se llev el gran premio de arabia saudita para sumar su quinta victoria en frmula1 su cuarta victoria con red bull y su quinto 1 lugar en la f1 lo escoltaron 2 max verstappen 3 george rusell
841,34947,checo prez hace historia primer mexicano en la historia que gana un gran premio estando en pole position max verstappen en la envidia acelera en la ltima vuelta para seguir de lder en puntos no le va durar mucho
842,34948,qu actitud tan ms mezquina de jos verstappen mientras todos los mecnicos celebraban y felicitaban a schecoperez jos ni siquiera volte a verlo a pesar de que checo pas frente a l
843,34949,el dibujo de verstappen es lo mejor
844,34950,un gato echa a alo oficial del podio y se queda en la p4 por marcosrobles91 fernandoalonso alonso checoprez maxverstappen verstappen f12023 f1 f12023 gparabiasaudita astonmartinf1
845,34951,me dijeron que tena la vuelta rpida las declaraciones de checo prez tras finalizar el gp de arabia saudita demuestran que sigue algo de tensin dentro de red bull hay pique con verstappen ojal sea capaz de mantenerlo en pista
846,34952,prez habl sobre la rebelda de verstappen al no hacer caso al equipo saudiarabiangp f1 f12023
847,34953,no seas el tpico mexicano que enfrenta a las dos excelente verstappen es un genio hizo una carrer rebasando a todo el mundo no los enfrentes no piques crestas los dos son un equipo que checo va a hacer todo lo posible te ves mal
848,34954,mexicano sergio prez gana en arabia saudita neerlands verstappen segundo tras gran remontada
849,34955,el mexicano checo prez tambin se impuso en la pole el vigente campen max verstappen fue segundo este domingo eldeber
850,34956,jos verstappen no soport
851,34957,termino el saudiarabiangp con victoria para schecoperez seguido de max verstappen y terminando el podio por decisin de la fia al darle una penalidad de 10sg a fernando alonso george russel
852,34958,soy el nico que piensa que el nico que no es feliz cuando schecoperez gana una carrera es max verstappen formula1
853,34959,mi conclusin es que en este 2023 checo y verstappen se van a dar hasta con la cubeta checo as
854,34960,imgenes inditas de checoprez a jos verstappen anda para all bobo viva mexico cabrones mexico
855,34961,papito verstappen no anda soportando jajajaja
856,34962,es lo mejor que se le puede hacer a la gente mal pedo bravooooo conozco a muchos verstappen
857,34963,checo cuando vio que tena a verstappen atrs saudiarabiangp
858,34964,qu cosas jos verstappen
859,34965,se cumpli y que tremenda carrera la de verstappen
860,34966,el asturiano que fue tercero detrs de verstappen fue castigado con 10 segundos al final de la carrera por no cumplir correctamente la sancin en la parada
861,34967,saudiarabiangp max verstappen no ha sido una remontada fcil
862,34968,la felicidad del pap de max verstappen no tiene precio saudiarabiangp
863,34969,checo prez demostrando que este ao a verstappen le van hacer falta manos pa pelarle la riata
864,34970,la cara de jos verstappen es lo que ms disfrut despus de la victoria de don schecoperez
865,34971,verstappen roba el liderato a checo de ltimo segundo
866,34972,epaera que hay gente que piensa que perez puede competir con verstappen
867,34973,max verstappen es un piloto de alto valor
868,34974,fernando alonso cuarto en el gp de arabia y eso que le metieron 15 segundos de sancin victoria de checo prez y verstappen segundo toda la informacin en formula1
869,34975,como me choca que manchen un momento tan bello que es ver a nuestro checo prez ganar con polmicas absurdas que solo generan mayor divisin y toxicidad en el deporte se ve que jos verstappen si quizo saludar a checo solo que este fue corriendo con los suyos
870,34976,max verstappen se lleva la p2 luego de largar en el lugar 15 y tener problemas en la barra de direccion del rb19 saudiarabiangp circuitomotor f1
871,34977,el papa de verstappen es manso payason
872,34978,sergio checo prez gan el gran premio de arabia saudita y logr su quinta victoria como piloto de la f1 podio checo prez max verstappen george russell ladinastacontina
873,34979,verstappen no disimula la envidia por el triunfo de schecoperez
874,34980,max verstappen fue difcil avanzar sobre todo persiguiendo a otros autos en el primer sector ya que hubo mucho deslizamiento al final viendo algunos sustos con la transmisin decidimos conformarnos con p2 lo cual es bueno viniendo de p15 f1 saudiarabiangp
875,34981,declaraciones de mx verstappen
876,34982,sergio prez gana en arabia saudita verstappen segundo tras gran remontada eldeber diez
877,34983,estaba que se lo cargaba la chingada jos verstappen a ver si no le da diarrea saudiarabiangp
878,34984,mi nuevo deporte favorito ver a la famila verstappen emperrados cada que gana checo prez amo celebro y lo gozo
879,34985,verstappen se queda con el reconocimiento de los fans tras su remontada saudiarabiangp f1 f12023
880,34986,se puso firme schecoperez piloto de redbullracing habl de su triunfo y la vuelta rpida de verstappen gparabiasaudita
881,34987,as se gana schecoperez con autoridad y talento con humildad y trabajo con experiencia y categora y a periodicazos en el hocico pal berrinches verstappen
882,34988,qu carita don jos checo prez celebr con todo su victoria pero al pap de max verstappen no le sac ni una sonrisa f1xfsmx
883,34989,los paps de verstappen son una cagada
884,34990,verstappen no est soportandooo
885,34991,max verstappen ha sido votado piloto del da f1 saudiarabiangp
886,34992,verstappen no pudo alcanzar a checo durante 20 vueltas con una diferencia de entre 4 y 5 segundos entre ambos este fin de semana red bull le dio a checo un auto en condiciones optimas para ganar carreras checo gestion la carrera impecablemente
887,34993,en trminos de soportar jos verstappen no est soportando la victoria de checo soporta panzona
888,34994,don too prez garibay dndole ctedra de categora a jos verstappen hay que ser grandes en la victoria como en la derrota saudiarabiangp
889,34995,el seor jos verstappen acaba de poner privada su cuenta de instagram por qu sera
890,34996,formula1 2023 carrera podio sergio perez max verstappen george russell tras penalizacin a alonso jeddah saudiarabiangp newsmotoec f1
891,34997,feliz porque checo mantuvo el ritmo y no dej que le dieran la instruccin de bajarlo cuando vena verstappen en segundo
892,34998,no soport jos verstappen
893,34999,a todo esto la sancin viene de una mala posicin en la salida verstappen suele dejar el coche mal cuadrado siempre aposta para salir con mejor traccin y no pasa nada mafia
894,35000,creo que jos verstappen no est soportando jajajajaja
895,35001,lo peor de todo esto es que totto wolf se ir hoy a la cama feliz eh como si no supiese que su mujer se hace dedos pensando en verstappen terrible
896,35002,jos verstappen tendr que tomar mucho melox para esta temporada schecoperez f1 saudiarabiangp
897,35003,gp arabia saudita penalizan a fernando y le dan su podio a russell checo prez queda 1ero verstappen remonta 13 posiciones y queda 2do safety car por stroll al presentar problemas en su auto los ferrari dan batalla pero se muestra mejor ritmo para los mercedes
898,35004,deportes el mexicano logr el triunfo quedando por delante de su compaero neerlands max verstappen
899,35005,los verstappen no estn soportando
900,35006,ltima hora foto indita de max verstappen celebrando el seguir primero en la wdc tras otro robo a su compaero sergio checo prez
901,35007,que la chupe verstappen y toda su perra familia
902,35008,foto de la esposa de checo durmiendo tranqui porque su esposo qued p1
903,35009,felicidades a checoperez schecoperez f checoperez formula redbullracing maxverstappen lewishamilton sergioperez redbull racing charlesleclerc formulaone landonorris memes verstappen mclaren sebastianvettel checo motorsport mexico carlossainz ferrari
904,35010,formula1 2023 max verstappen parti 15 y termin segundo fue elegido como el piloto del da jeddah saudiarabiangp newsmotoec f1
905,35011,prez gana en arabia saud tras resistir carga de verstappen
906,35012,estamos todos de acuerdo de odiar a verstappen y apoyar a checo por ser americano
907,35013,que alonso se haya quedado solo a medio segundo de prez y a tres dcimas de verstappen en ritmo de carrera guardndose dcimas en el bolsillo que me lo expliquen es el rey de esto
908,35014,la cara de jos verstappen cuando checo prez celebraba su victoria en el saudiarabiangp
909,35015,h7deportes el piloto schecoperez gan el gran premio de arabia saudita el equipo redbull racing claro hizo el 1 2 con el podio de max verstappen en tercer lugar lleg fernando alonso
910,35016,ahora s se la pel mi queridsimo max verstappen don sexo mejor conocido como checo prez lo mantuvo en promedio a 5 segundos desde que max estuvo en p2
911,35017,max verstappen llegando a casa saudiarabiangp
912,35018,checo prez se pone farruco alonso doblemente penalizado el mexicano se impone en yedda por delante de verstappen mientras que alonso recibe dos sanciones y termina el cuarto por uri puigdemont
913,35019,cmo me caga jos verstappen
914,35020,el verdadero protagonista de este gp es jos verstappen
915,35021,el betis gana verstappen remonta y sigue 1 en el mundial el sevilla pierde aun robando que alguien me explique este domingo
916,35022,me encanta ver a jos verstappen ser el primero que llora porque llora esta temporada ojala nos d para que se largue del pitwall para siempre
917,35023,cuantos adelantamientos en curva ha hecho verstappen desde hungra 2022
918,35024,la cara del pendejo de jos verstappen es poesa pura a mamarla puto menonita perdedor
919,35025,verstappen es un nio berrinchudo odioso que no sabe ser equipo yisus aguntate papi
920,35026,la cara de jos verstappen lo dice todo saudiarabiangp formula1 f1 f12023 redbull checoprez verstappen
921,35027,lo de verstappen no es normal
922,35028,saudiarabiangp estuvo entretenido pero faltaron buenas peleas checo gan de principio a fin verstappen en otro nivel parti 15 y llego 2 sin mucho esfuerzo alonso le robaron el 3 lugar con una sancin despus de la carrera alpine mejor mucho y mclaren se hunde ms
923,35029,schecoperez gana arabia saudita y hace una declaracin que pone en problemas a max verstappen
924,35030,carrera 2 23 buena carrera de los mercedes y de checo ferrari sin ritmo pero muy solido y lo peor de la jornada jos verstappen este tipo hace que yo no tolere a max
925,35031,max y jos verstappen son solo endeavor y todoroki de la vida real
926,35032,verstappen se qued con la vuelta rpida y el liderato en el ltimo suspiro saudiarabiangp f1
927,35033,jos verstappen no est soportando
928,35034,ahuevo me mama ver a los verstappen emputados
929,35035,yo tena que mantener mi ritmo max verstappen dijo que aunque no fue una carrera fcil logr salir de los ltimos lugares sobre la vuelta rpido seala que estaba tratando de recuperar lo ms posible y como equipo estn contentos por el 1 2 aunque no le gusta perder
930,35036,porque estar enojado josverstappen porque no gano su retoo o porque checo lleva ms carreras ganadas que el seor aaaaah no verstappen pap nunca gan nada f1
931,35037,un saludo en la cola a jos verstappen
932,35038,enojada por la carrera de ferrari y de ham pero contentsima por verles la cara de emptado a los verstappen
933,35039,tras dos carreras y tras la sancin a fernando en este saudiarabiangp el mundial est as 1 verstappen 44ptos 2 prez 43ptos 3 alonso 27ptos 4 russel 21ptos y 5 6 hamilton sainz 20ptos
934,35040,el mexicano sergio prez se alz con la victoria por delante de su compaero de equipo max verstappen
935,35041,la felicidad que me da ver a checo prez en 1er lugar y que el 2do sea verstappen que le gane a max
936,35042,me encanta ver la cara del pap de verstappen tragando bilis y coraje por qu no dejaron pasar a su hijo y no pudo ganarle a checo
937,35043,ltimahora sergio checoprez gan este domingo el gpremioarabiasaudita de la frmula1 desde la pole position para red bull mientras que el bicampen mundial max verstappen lleg al segundo puesto
938,35044,verstappen le rob el liderato a checo prez saudiarabiangp f1
939,35045,que manes tan desagradables los verstappen
940,35046,el mexicano sergio prez se alz con la victoria por delante de su compaero de equipo max verstappen
941,35047,por gente como jos verstappen el mundo esta como est
942,35048,el mexicano checo prez tambin se impuso en la pole el vigente campen max verstappen fue segundo este domingo seguido por el espaol fernando alonso diez
943,35049,checo ya paga renta en el cerebro de verstappen
944,35050,los red bull juegan otra competencia 1 2 en el gp de arabia saudita gan prez y verstappen que sali 15 lo escolt alonso complet el podio apenas van dos de 23 fechas pero comienza a haber una tendencia
945,35051,jos verstappen en modo tieso mientras checo celebraba a su lado la victoria saudiaarabiangp f1
946,35052,pobre verstappen en esto no hay colores le va a dejar la espalda roja
947,35053,jos verstappen el pap de max atrapado entre el festejo de checo prez se le ve el ardor
948,35054,jos verstappen 5 temporadas en la f1 y ni una sola victoria su hijo es un fuera de serie aqu vemos la cara de la envidia y la tirria
949,35055,checo prez con una gran carrera se apoder de gp de arabia saudita quinta victoria en frmula 1 verstappen estuvo espectacular sali en el puesto 15 y termin en 2do lugar mientras que alonso completo el podio f1 saudiarabiagp 19marzo gparabiasaudita
950,35056,resultados f1 clasificacin del saudiarabiangp y as va el mundial victoria para prez en yeda por delante de verstappen que remonta desde el 15 de russell y alonso que pierde su podio por una penalizacin
951,35057,un fuego verstappen
952,35058,chinga tu madre pap de verstappen
953,35059,fernando alonso pierde el podio en los despachos en favor de russell a la espera de una apelacin de aston martin la carrera la gan checo prez seguido de verstappen
954,35060,resultados del gran premio de arabia saud sergio prez     max verstappen 5 355s george russell 25 866s
955,35061,checoprez y alonso hicieron un carrern rn la f1 verstappen sigue sin caerme
956,35062,el pap de max verstappen no puede ocultar su odio por prez che gente antideportiva
957,35063,los memes de el pap de verstappen
958,35064,con la acotacin que checo prez sali de primero y verstappen de 15
959,35065,tremenda cagada que es jos verstappen que la mame
960,35066,jos verstappen victorias 0 poles 0 vueltas rpidas 0 ttulos 0 podios 2 puntos 17 y si le enumeramos lo ganado por checo saudiarabiangp formula1
961,35067,bue como si no se supiera como es jos verstappen
962,35068,lo de estar milimtricamente dentro del cajn de salida es nuevo de este ao porque verstappen siempre andaba en diagonal en todos sitios
963,35069,checo prez gana el gp de arabia saudita verstappen le roba el punto extra y el liderato
964,35070,jos verstappen a su hijo despus de la victoria de checo
965,35071,checo prez gana el gp de arabia saudita verstappen le roba el punto extra y el liderato
966,35072,conclusin red bull tiene el mejor coche de largo prez puede plantar cara a verstappen alonso es el mejor del resto del mundo despus mercedes y ferrari la fia sigue siendo una enorme mierda da igual cundo leas esto nos vemos en 15 das gp de australia
967,35073,checo prez gana el gp de arabia saudita verstappen le roba el punto extra y el liderato
968,35074,el viejo sabroso checo prez lo hizo de nuevo gan en arabia saudita orgullo mexicano el himno nacional con todo verstappen tragando sapos sigue al barn y te sigo ligadeguerreros saudiarabiangp f12023 formula1 redbullracing chequito fifis
969,35075,checo prez gana el gran premio de arabia saudita verstappen queda en segundo y gana la vuelta ms rpida conserva el primer lugar en el campeonato de pilotos
970,35076,checo ya no se queda callado pero sigue en la lnea de segundo piloto verstappen no obedeci rdenes de equipo y l si incluso red bull le dijo una cosa y al final fue otra
971,35077,quien es jos verstappen y por qu tiene cara de que se lo est llevando la goma
972,35078,el mexicano lider de punta a punta en la frmula 1 y supo aguantar la presin de verstappen que finaliz segundo alonso termin en la tercera posicin pero luego de la premiacin lo quitaron del podio por una penalizacin
973,35079,siempre que piensen que verstappen es un a hole recuerden que tuvo que crecer con ese como su pap
974,35080,verstappen es el mejor
975,35081,no le s a la f1 y ni ganas pero el odio que siento por verstappen es muy real y disfruto mucho de das como hoy
976,35082,ntese la cara de felicidad del pap del pendejo de max33verstappen fu incapaz de felicitarlo los verstappen son unos hdp grande schecoperez saudiarabia f1 saudiarabiangp redbullracing checoprez
977,35083,yo solo quiero dejar sentado en tw q dsps del sc ricardocarino estaba seguro q verstappen alcanzara a checo a pesar d q yo le plante mil y un escenarios favorables al mexicano y al final la q tuvo razn fui yo pero es q le voy a cruz azul se m da eso d tener esperanza
978,35084,rpido acta normal ah viene el que te cae mal checoprez checo gparabiasaudita verstappen
979,35085,sergio prez gan el saudiarabiangp segundo del mundial de frmula 1 por delante de su compaero neerlands max verstappen con quien arm un nuevo doblete de red bull el espaol fernando alonso aston martin haba terminado tercero pero fue recargado con 10s por lo que
980,35086,la cara de jos uns chulada ver a los verstappen encabronados
981,35087,checo prez logr un gran triunfo en arabia saudita verstappen complet el 1 2 de red bull y lidera el campeonato de la frmula 1
982,35088,max verstappen se marc un carreron remontando de 15 a 2 posicin y aun as est es la cara del seor no siempre se puede ganar saudiarabiangp
983,35089,as me gusta que se repita prez 1 verstappen 2 redbullracing y mantengan ese 1 2
984,35090,master de prez fue gran dominador de la carrera a travs de una graduacin que lo llev no solo a doblegar a alonso despus de haber perdido con l en la largada sino ponindose a resguardo de un arrollador verstappen y de rdenes de equipo
985,35091,checo prez y max verstappen hicieron el 1 2 en el gp de arabia saudita soberbia actuacin de los pilotos de red bull el mexicano mantuvo la punta y el neerlands remont desde la casilla 15
986,35092,sergio prez se qued con el saudiarabiangp es la quinta victoria de su carrera y la tercera con red bull max verstappen se qued con el 2 puesto y fernando con el 3 pero fue penalizado con 10 segundos por incumplir una sancin y george russell tom su lugar
987,35093,checoperez gan el gparabiasaudita de manera slida con redbull vivi una zozobra al inicio porque lo pas fernandoalonso astonmartinf1 luego fue firme cuando la recuper segundo verstappen larg 15 y remont hasta ser escolta cerr el podio russell mercedes
988,35094,grande checo prez y muy mal la cara de jos verstappen pero qu podemos esperar de l lo nico que me preocupa es que caldern tambin est en arabia saudita
989,35095,si asi es el pap de verstappen que podemos esperar del hijo
990,35096,ni a mi peor enemigo le deseo un pap tan malvibroso y amargado como el del verstappen
991,35097,cuantas veces vimos a verstappen el ao pasado y en 2021 inclinarse hacia un lado en la parrilla de salida para ganar ventaja dnd est la sancin a russel ayer por joderle la vuelta al ferrari
992,35098,verstappen usa 2018 hamilton brasil 2019 y ahora alonso arabia 2023 no es la primera vez que hacen esta injusticia pero en este caso han tenido media carrera para investigar
993,35099,la cara de joss verstappen es buensima saudiarabiangp
