,Id,Tweet
0,34106,yo realmente creo que prez tiene y es tremendo piloto pero verstappen es verstappen y hoy demostr x que es campen del mundo ms all de no llegar a p1 el campeonato contra lewis le enseo demasiado y es un perro viejo yo lo veo campen
1,34107,f1 tabla de posiciones tras el gp de arabia saud y las idas y vueltas de la fia as quedan las posiciones en ambos campeonatos red bull lidera a pleno crees que podr alguien hacerles frente f1 redbullracing verstappen checo saudiarabiangp
2,34108,hay si no cobra el penal
3,34109,pinche max verstappen ctm ya nos cagas a todos
4,34110,max verstappen se retira de redbull messi regresa al barcelona exmenes el martes qu ms falta
5,34111,espero que hayan tenido un felizdomingo como el de jos verstappen que claramente no caba de jbilo
6,34112,la cara de felicidad de jos verstappen padre de max33verstappen tras el triunfo de schecoperez en el saudiarabiangp refleja el grado de tensin y guerra civil que vive redbullracing entre sus pilotos f1
7,34113,ya es el tercer partido que boca despierta en el minuto 40 para buscar un empate o ganarlo harto
8,34114,hasta la jornada 2 de formula1 nuestro gran schecoperez se pone en el segundolugar del campeonato verstappen redbullracing checoperez redbullracing fernandoalonso astonmartinf1
9,34115,no se quien de los paps de los pilotos de rb me cae mas gordo jos verstappen o antonio prez garibay los dos viviendo de la gloria de sus hijos
10,34116,maxverstappen la indirecta de checo prez a verstappen de la que se arrepinti
11,34117,su compaero de equipo y bicampen de f1 max verstappen fue segundo y george russell mercedes termin tercero
12,34118,quteparece f1 checo prez festeja su triunfo con red bull y el pap de max verstappen muere del coraje video
13,34119,estoy viendo un video cuando estn felicitando a checo y el pap de verstappen ni le sonre envidiosos malos perdedores max33verstappen redbullracing vivamxico
14,34120,masdeportes checo prez domin de punta a punta el gran premio de arabia verstappen logr la vuelta ms rpida en el circuito corniche de jeddah justo al final para retener el liderazgo del campeonato de frmula uno por joinermartinez
15,34121,todos conocemos a un jos verstappen en la vida
16,34122,los verstappen son unos envidiosos egostas y psimos compaeros de equipo
17,34123,gran reflexin que comparto al 100 de alberto tello pd jos verstappen es un pobre imbecil
18,34124,clarn frmula 1 paseo de prez remontada de verstappen y enorme papeln de la fia con alonso
19,34125,le cont con toda la ilusin a mi madre que le devolvieron a alonso el podio y ella tal que bueno yo s que te gusta ms verstappen pero ilusionate por mi o algo
20,34126,prximas 5 carreras duelo verstappen prez cmo yo lo veo
21,34127,verstappen diciendo que no est en la f1 para ser segundo es todo lo que est bien bilardismo puro al final campen sale uno slo al que no le guste esa actitud puede ir a ver otros deportes de equipos que hay bastantes
22,34128,y los ganadores son jos verstappen fernando alonso y checo prez que se convirtieron en memorables memes que resumen el saudiarabiangp
23,34129,oye esto de que alonso se ha quedado a 50 milesimas de la mejor vuelta de perez en la ultima vuelta y a 3 decimas de verstappen tirando como un descosido que cojones es
24,34130,uds es que esperan mucho de un treintahijueputa que le pas un carro de f1 por encima a juan pablo montoya jos verstappen es un ser horrible desde antes que la mitad de uds nacieran
25,34131,pa como reaccion el pap de verstappen se sabe de dnd viene lo ogt de max
26,34132,es ms que evidente que verstappen y perez no se aguantan ni se llevan bien y desde ya hace un tiempo y aun quedan 21 carreras de mundial
27,34133,maxverstappen f1 checo prez festeja su triunfo con red bull y el pap de max verstappen muere del coraje video
28,34134,video jos verstappen padre de max ignora a checo pe rez tras ganar el gp de arabia y enciende las redes
29,34135,la fia devuelve a fernando alonso su podio nmero 100 la apelacin de aston martin hizo efecto y el asturiano recupera el tercer puesto tras el error del mecnico del gato recital de red bull con checo prez y verstappen al frente
30,34136,muchas felicidades schecoperez ninguna concesin a verstappen tienes el coche ve por el campeonato
31,34137,simplemente jos verstappen no soporto
32,34138,checo prez se lleva el gp de arabia y sube al podio checo prez da una gran carrera hace el 1 2 con verstappen saudiarabiagp felicidades schecoperez eres un orgullo nacional evocarsmx sergioperez redbullracing redbullf1 f1
33,34139,la alegra de jos verstappen en la celebracin de checo es otro nivel
34,34140,metete la vuelta rpida por la cola verstappen
35,34141,la indirecta de checo prez a verstappen de la que se arrepinti
36,34142,frmula1 en el gran premio de arabia saudita el piloto mexicano sergio checo prez de red bull contuvo a max verstappen para llevarse la quinta victoria de su carrera y la primera bajo las luces en jeddah
37,34143,frmula1 en el gran premio de arabia saudita el piloto mexicano sergio checo prez de red bull contuvo a max verstappen para llevarse la quinta victoria de su carrera y la primera bajo las luces en jeddah
38,34144,me parece que ibarra entro a twitter
39,34145,a verstappen se la pela su compaero de equipo
40,34146,esto no tiene sentido porque hay por lo menos 3 pilotos fuera del cajn y uno de ellos es verstappen y slo sancionan a alonso
41,34147,francamente verstappen es un tipo envidioso todo un crack pero le falta humildad compaerismo ojal el checo siga as
42,34148,max verstappen es el felipe caldern de la f1 para mxico
43,34149,fernando alonso alo oficial celebr al lado de checo prez schecoperez y max verstappen max33verstappen en el saudiarabiangp luego le quitaron su lugar y ahora se lo devolvieron es el nmero 100 en su carrera en f1
44,34150,el mexicano no se raja y menos checo prez el mensaje que le manda a verstappen tras ganar en el saudiarabiangp
45,34151,verstappen p2 gan el barita y ahora se va el ruso gracias vida por tanto
46,34152,entrate el mexicano obtuvo el primer lugar del gran premio de arabia saudita con esta victoria la primera de esta temporada el originario de guadalajara se encuentra solo un punto detrs de max verstappen en el campeonato de pilotos 2023
47,34153,max verstappen no obedeci la rdenes de equipo y se sent en el lugar de prez muy mal por el holands
48,34154,f1 max verstappen el objetivo era terminar en segunda posicin saudiarabiangp
49,34155,a ver que nos van a volver locos al final alonso recupera el podio el asturiano fue tercero tras prez y verstappen una sancin de 10 segundos le retras tras russell pero de madrugada en yeda la fia le devolvi la posicin formula1 fernandoalonso
50,34156,pero de verdad hay alguien que piense que este to puede ganarle un mundial a verstappen me parto los cojones
51,34157,lindo el safety car que le regalaron a verstappen
52,34158,y por cierto acabo de ver lo de jos verstappen ese to es un maleducado y tiene un sentido de la deportividad psimo no debera acudir a ms carreras que las vea desde casa por la contra el padre de checo es una alegra de ver por las pistas f1 saudiarabiangp
53,34159,la cara del jos verstappen es q sabe que con ese carro gana hasta albon sabe q su hijo puede pasarla mal esta temporada porque checo es menos impulsivo que mad max
54,34160,ojal a nadie le toque un pap tan txico con el de max verstappen
55,34161,yo pongo cara de jos verstappen cuando estoy cagando
56,34162,que cansino lo de la vuelta rpida el que avisa no es traidor y verstappen ya le haba dicho a gp que a l s le importaba la vuelta rpida
57,34163,verstappen no tiene palabra ni honor red bull no era ni es equipo que checo lo aprenda ya
58,34164,verstappen la porra del atlante te saluda
59,34165,por lo menos checo prez y verstappen van bien
60,34166,lo de max verstappen es de putos locos le dicen que en la vuelta 25 p2 pasando a fernando alonso y va y la clava jjajajajaja max max super max verstappen
61,34167,ya un poco menos eufricos parce max verstappen es un gran piloto qu carreron tiene un auto hecho a su medida pero igual le saca hasta la ltima gota ojal checo siga demostrando que tambin est para pelear por el campeonato
62,34168,pero sacalo a villa y a pol ibarra pelotudo
63,34169,la cara de jos verstappen lo dice todo que difcil ser para checo poder pelear por el ttulo f1 formula1 f12023 saudiarabiangp
64,34170,los verstappen se estn malacostumbrando eh
65,34171,max verstappen lidera el mundial de f1 por 1 punto sobre su compaero sergio prez tercero est el ex campen y 2 veces campen del mundo fernando alonso
66,34172,no me esperaba a verstappen en el documental de mrquez la vd
67,34173,yo como jos verstappen recordando en plena comida familiar que maana es lunes
68,34174,jos verstappen es un llorn malparido e hdp
69,34175,sergio prez gana el gran premio de arabia saudita segundo fue su compaero max verstappen y tercero fue fernando alonso f1
70,34176,tremenda remontada de verstappen pero igual tuvo media carrera para recortarle 5 segundos a checo prez y nunca lo pudo hacer
71,34177,lo de verstappen me sigue pareciendo increble lo odio tanto q amo a maxito
72,34178,que distintos jos verstappen que distintos somos
73,34179,fernando alonso recupera el podio de saudiarabiangp y queda a 14pts de max verstappen en el campeonato de pilotos de la f1 el neerlands se hace con el liderato tras conseguir la vuelta rpida el ritmo de los red bull en el inicio del campeonato es demoledor
74,34180,despus de dos carreras en circuitos supuestamente desfavorables y est a tan slo 13 puntos de prez a 14 de verstappen mucho que decir an
75,34181,prez gana en jeddah cuando verstappen pasa del 15 al segundo perez wins in jeddah as verstappen goes from 15th to second checoprez checo f1 fernandoalonso
76,34182,me encanta ver a fernando alonso y max verstappen juntos en pista pese a que sean dos pilotos de distintos equipos son mis dos dolos y mucho respeto f1 respect
77,34183,campeonato de pilotos 2023 tras resultados oficiales podio de alonso del saudiarabiangp f1 1 verstappen 44 2 prez 43 3 alonso 30 4 sainz 20 5 hamilton 20 f1latam
78,34184,y volvemos a nuestro juego presenciamos la gran final por un lado checo prez y por el otro lado el bicampen del mundo max verstappen quien de los dos gana con el mismo auto
79,34185,se acab el checo sumiso el piloto mexicano consigui su quinta victoria en la f1 en una carrera que demostr el carcter y las ganas de competir con max verstappen sin importar nada aqu el anlisis completo de luis enrique alfonzo f1 checoperez
80,34186,anda ya quita esa cara de jos verstappen
81,34187,jos verstappen me cagas de a madres
82,34188,verstappen explica porqu le quit la vuelta rpida a schecoperez
83,34189,la mujer de verstappen cuando verstappen pierde la mujer de checo cuando checo gana
84,34190,2 carreras malas de verstappen y checo es top 1 y campeonato eh
85,34191,est a literalmente 14 puntos de verstappen
86,34192,checo me cae super bien y es un pije piloto pero no sean tan ilusos miren las circunstancias de las poles y p1 de checo en rb adems 6 segundos verstappen le sac casi 12s a checo largando de segundo en bahrein
87,34193,cundo nos vamos a empezar a referir colectivamente a max verstappen como el general hux make it canon
88,34194,frmula 1 paseo de prez remontada de verstappen y enorme papeln de la fia con alonso
89,34195,as es como se compite y debers acostumbrarle a que sea ms duro de lo que pienses es la nica forma en que podrs tener oportunidad de que el equipo no pueda sin el q1 y drselo a verstappen no slo es lucha es ms que lucha lo que debes hacer dentro de rb verstappen marko
90,34196,sergio checo prez lanza indirecta a max verstappen tras doblete en arabia saudita hay que hacer caso al equipo
91,34197,vista la carrera ahora la salvajada de los pilotos de red bull tirando a cuchillo con los duros alucinante y que grande checo aguantando a verstappen a unos 5 segundos estn en otro planeta
92,34198,tengo la sospecha que un da de estos verstappen y checo van a chocarse a propsito y luego se van a agarrar a madrazos a media pista
93,34199,cada domingo odio ms a verstappen
94,34200,lo ms satisfactorio de mi domingo que hicieran justicia con el nano y que chequito le restregara en la cara su victoria a jos verstappen
95,34201,jos verstappen todo bien
96,34202,no puede ser
97,34203,debe ser horrible tener un compaero de equipo como max verstappen
98,34204,pap prez vs pap verstappen
99,34205,en la carrera de hoy checo prez ha demostrado por casi 30 vueltas que es igual o hasta mejor que max verstappen aun con los pedidos del verstappen para que obligaran a checo a bajar la velocidad no pudo darle alcance en red bull hay racismo
100,34206,checo prez se qued con el saudiarabiangp de formula1 el mexicano no tuvo rival en el circuito de jeddah para sumar su 1 victoria del ao fue su 5 triunfo en f1 y 4 con redbull el podio lo completaron max verstappen 2 y fernando alonso 3
101,34207,checo perez se bypase las ordenes de su escudera y gana el gparabiasaudita verstappen segundo alonso tercero ya que la penalizacin no tuvo efecto
102,34208,podium espaol en el gran premio de arabia saudita checo prez de la nueva espaa max verstappen de los pases bajos espaoles y fernando alonso del principado de asturias
103,34209,checo prez dice la fia que siempre s 1 checo prez 2 max verstappen 3 fernando alonso s se pudo don sergio prez saudiarabiangp formula1 f1
104,34210,sergio prez gan el gp de arabia saudita y se afianza como rival de verstappen en la f1 19mar checoprez gparabiasaudita
105,34211,as qued la tabla de posiciones del campeonato de pilotos por lo visto la pelea estar entre checo y verstappen se podr repetir lo del campeonato de 2016 quin te gustara que gane checoprez saudiarabia saudiarabiangp verstappen redbull formula1
106,34212,sergio prez gan el gp de arabia saudita y se afianza como posible rival de verstappen en la f1 19mar checoprez gparabiasaudita
107,34213,solamente un punto schecoperez gan en el saudiarabiangp pero max verstappen es lder debido a que obtuvo la vuelta ms rpida en jeddah importante ventaja de red bull racing sobre aston martin mercedes y ferrari
108,34214,pongo cara de jos verstappen cuando el taquero se brinca mi orden checoprez
109,34215,jjajajajjajajaja eh estos verstappen unos soretes
110,34216,espectacular carrera del mexicano schecoperez se lleva el saudiarabiangp con una extraordinaria conduccin que le permite estar solamente un punto a abajo de max verstappen en la pelea por el ttulo podr pelearle el campeonato a su coequipero msclaroquenunca
111,34217,nunca he negado que verstappen sea buen conductor pero me cae demasiado mal por su arrogancia
112,34218,sergio prez a pesar del sc red bull y max verstappen vuelve a poner en lo ms alto la bandera mexicana
113,34219,sigo sin entender porque le tiran tanta cagada a verstappen si la temporada pasada se equivoc pero hoy por quitarle la vuelta rpida a checo solo demuestra que es un cabron con mentalidad ganadora yo por siempre team max33verstappen
114,34220,lo que curran los de aston martin no tiene sentido alguno
115,34221,ojal ser jos verstappen para ver los festejos de la victoria de checo en primera fila
116,34222,este es un caballero georgerussell63 a diferencia de los verstappen
117,34223,checo prez iguala a leclerc en victorias a su lado verstappen con una gran remontada y alonso tras la eliminacin de su sancin es prez un claro candidato al ttulo montybm f1 saudiarabiangp
118,34224,en vista de la victoria de sergio prez en el saudiarabiangp creen se acerque un nico rosberg 2 0 verstappen 44 puntos prez 43 puntos recordar que en la temporada 2016 nico rosberg decidi revelarse a mercedes y sali campen ese ao contra todo pronstico
119,34225,frmula 1 paseo de prez remontada de verstappen y enorme papeln de la fia con alonso
120,34226,f1 resultado del gparabiasaudita de esta temporada por tvcarora tu canal online perez verstappen russell redbull astonmartin formula1 carrera fia motores circuitocallejerodeyeda yeda arabiasaudita saudiarabiangp tvc cacl theone f1xtvc
121,34227,en mxico podemos competir de t a t con cualquier profesional del mundo es claro que el mrito es resultado de perseverancia preparacin persistencia y experiencia bien schecoperez a pesar del desagrado de jos verstappen eres historia para mxico nevergiveup
122,34228,cinco veces checo schecoperez conquist el gp de arabia saudita para obtener su primera victoria de la temporada red bull volvi a hacer el 1 2 con verstappen esta vez en la segunda posicin mientras que fernando alonso complet el podio
123,34229,verstappen pap disimula tu coraje porque gano el viejo sabroso checoprez
124,34230,con esta vuelta a la 3 posicin el mundial queda as 1 verstappen 44 2 prez 43 3 alonso 30 4 5 sainz hamilton 20 y 6 russel 18 redbull queda con 87 aston martin empata con mercedes a 38 y ferrari con 26 saudiarabiangp
125,34231,y tambin la recuperacin de max verstappen
126,34232,en trminos de soportar la familia verstappen no est soportando
127,34233,maxverstappen video padre de verstappen ignora a checo prez en festejos por su triunfo en f1
128,34234,video padre de verstappen ignora a checo prez en festejos por su triunfo en f1
129,34235,pregunta seria es verstappen un mal compaero de equipo
130,34236,video padre de verstappen ignora a checo prez en festejos por su triunfo en f1
131,34237,uno mas ahora
132,34238,go la zo de payero
133,34239,el modo en el que ambos sufrimos con la carrera de hoy y se nos cerr el ojete al ver a verstappen subir 12 puestos en las primeras 10 vueltas
134,34240,alguien ya calle a verstappen por favooooorrrr
135,34241,dominio de redbull tras finalizar la fecha 2 de la frmula 1 max verstappen sigue en lo ms alto mientras que sergio checo prez le recort diferencias tras el triunfo de hoy podrn arrebatarle la hegemona a redbull
136,34242,estamos de acuerdo en que todos detestamos a max verstappen
137,34243,se dieron cuenta que verstappen se sent en lugar del 1 como para marcar territorio inmadurez por parte del compaero de checo
138,34244,prez se impuso en yeda tras un duelo mano a mano con max verstappen saudiarabiangp f1 f12023
139,34245,qu onda con jos verstappen
140,34246,jos verstappen y yolanda hadid me dan las mismitas vibes y curiosamente ambos son holandeses para pensar seores
141,34247,el piloto mexicano consigui una gran victoria en jeddah sobre su compaero max verstappen fernando alonso fue tercero papeln de la fia f1 formula1 f12023 saudiarabiangp
142,34248,voy con alonso y por lo que vimos en estas dos carreras creo que redbull est a aos luz mientras tengan fiabilidad si esta temporada termina as me gustara que checo fuera el campen la actitud de la flia verstappen hoy a pesar de su gran resultado no me gusta nada
143,34249,triunfo checo prez en el gran premio de arabia saudita contra un verstappen que lucho hasta el final checoprez formula1 arabiasaudita
144,34250,verstappen para mi es una mezcla del talento de messi y la ambicin trabajo duro de cr7 imo esa misma ambicin es la que puede jugar en su contra en un mundial apretado necesitas a tu compaero de equipo ya se vio hace dos aos cuando sin checo no hubiese sido campeon
145,34251,gan checo a verstappen y gan el bara al real madrid sin duda un fin de semana para enmarcar en el deporte
146,34252,sergioprez warpxf1 sergio prez vence a verstappen y se lleva el gp de arabia saud
147,34253,fue un sufrimiento ver a verstappen escalar posiciones como un animal acechando a checo pero finalmente gan el checobb
148,34254,siempre me va a dar risa como joe verstappen no soporta ver que checo le gane a su hijito no esta soportando definitivamente
149,34255,checo prez se llev el gp de arabia saudita y pone presin sobre max verstappen
150,34256,jos verstappen si sorio a checo f12023 f1 saudiarabiangp yhacbec atellodemeneses righsspeed racingteammx ivanexxposito francodiaz 6 ftotal rcm mx
151,34257,el papa de verstappen viendo que gan checo prez
152,34258,qu opinan del pap de verstappen malos perdedores checoprez
153,34259,ltimahora la fia devuelve a fernando alonso su podio 100 el asturiano que haba sido tercero detrs de verstappen fue castigado con 10 segundos al final de la carrera por no cumplir correctamente la sancin en la parada toniljorda
154,34260,mundo motor domingo perez a pesar de verstappen varrone de nuevo en sebring la nota en
155,34261,madridista y fan de verstappen para q luego digan q dios no castiga dos veces
156,34262,redbullracing hay que obedecer al equipo checo sobre la vuelta rpida que le quit verstappen en arabia
157,34263,ni verstappen ni leclerc ni hamilton pudieron con sus compaeros de este ltimo no es novedad pero de los dos primeros si lo es
158,34264,que puto fin de semana tan perfecto que la mame el madrid el deportivo zapopan verstappen y sus putisimas madres
159,34265,que hace ah parado verstappen aparta tronco que viene un oso asturiano vido de sangre
160,34266,llevamos 2 carreras de f1 en el ao mi prediccin es verstappen campen si checo gana ms carreras va a ser mayoritariamente por situaciones como la de este fin de semana cuando el auto de verstappen falla en alguna instancia
161,34267,checo prez sigue dando un fin de semana muy dulce para el deporte mexicano y gana en jeddah verstappen con otra madre de remontada y sigue lder del campeonato f1
162,34268,gana checo alonso es 3ro verstappen viejo est que le hierve el hgado y verstappen nio con su berrinche de envidia y la mafia tuvo que que regresarle su 3ro a alonso
163,34269,carrera dos y verstappen ya desobedeci en dos carrerar las rdenes del equipo creo que alguien no se siente cmodo
164,34270,universo diferente misma vibra personas que no son la misma pero s jos verstappen
165,34271,no necesito ms compaa para ver formula 1 con mi abuelo soy feliz enojndonos porque no podemos ni criticar bien a verstappen porque es un muy buen corredor
166,34272,doble p3 en dos carreras demuestra dos cosas el am23 es un muy buen coche y que alonso es el mejor piloto junto con max molara ver un verstappen fernando en igualdad de condiciones
167,34273,las razones de max verstappen a jos no le gusto tanto la victoria de checo prez lo capta la cmara y todo el equipo alrededor celebrando
168,34274,victoria de prez en arabia saud por delante de verstappen alonso es cuarto y sainz sexto
169,34275,oficial la fia es un circo y alo oficial recupera la p3 por marcosrobles91 fernandoalonso alonso checoprez maxverstappen verstappen f12023 f1 f12023 gparabiasaudita astonmartinf1 fia
170,34276,aqu la decisin oficial de la tercera plaza en el saudiarabiangp checo verstappen y alonso en el podio e deportivo f1 fia
171,34277,f1 2023 podios tras sergio prez 2 max verstappen 2 fernando alonso 2
172,34278,checo a verstappen no te dijeron que mantuvieras el mismo ritmo
173,34279,piloto del da verstappen triunfa sobre checo en arabia saudita
174,34280,campeonato de pilotos checo y verstappen quedan mano a mano
175,34281,el asco que se siente por jos y max verstappen de lejos lo peor que pudo pisar la f1
176,34282,ay como odio a max verstappen uds nunca van a entender cuanto lo odio
177,34283,fantstico el checo prez se exhibi por delante de verstappen en arabia saudita
178,34284,el mexicano sergio prez gan este domingo 19 m el gran premio de arabia saud el segundo del mundial de frmula uno en el circuito urbano de yeda donde lider por delante de su compaero neerlands max verstappen un nuevo doblete de red bull
179,34285,pelado hijo de puta
180,34286,alguien ya calle a verstappen ya sabemos que quiere ganar siempre
181,34287,qu difcil debe ser tener un compaero de equipo como max verstappen checo prez mis respetos por la madurez que muestra cada semana algo que le debemos aprender
182,34288,no puede ser el orto que tiene verstappen sigo indignada
183,34289,podio del gran premio de arabia saudita prez verstappen alonso f1 formula1 saudiarabiangp
184,34290,warpxf1 sergio prez vence a verstappen y se lleva el gp de arabia saud via warpmagazine schecoperez max33verstappen f1 redbullracing
185,34291,el gesto de verstappen padre con perez abrazado a un mecnico a su lado y en medio de la euforia del equipo red bull por la victoria del mexicano que ao nos espera
186,34292,verstappen anduvo ms rpido que checo todo el finde semana en carrera cuando los 2 estaban libres en la vuelta 23 el gap era 5 8 pasaron 18 vueltas en dnde los 2 estuvieron al mximo y el gap fue 4 4 despus de la vuelta 43 los dos levantan y bajan el ritmo y aumenta el gap
187,34293,todo mal todo mal
188,34294,igual que ayer con la qualy que todos estamos llorando y el sonriendo f1 saudiarabiangp verstappen
189,34295,la cara de max jajaja verstappen el cr7 de la f12023 mal perdedor a m no vengan con jaladas de que es muy competitivo por eso no le gusta perder ac son 2 cosas 1 max no sabe perder y 2 es un psimo compaero igualito a penaldo checoprez
190,34296,alonso a 14 puntos de verstappen aston martin 2 constructores
191,34297,as quedan las clasificaciones generales del mundial de f12023 tras el segundo gran premio de la temporada max verstappen es lder del mundial de piloto por 1 punto sobre su compaero red bull es lder del mundial de constructores saudiarabiangp formula1
192,34298,frmula1 en el gran premio de arabia saudita gan checo prez gan de punta a punta max verstappen remont trece posiciones tras haber roto el semieje el sbado y lleg segundo el tercer lugar fue para fernando alonso con aston martin
193,34299,el pap de verstappen no soport
194,34300,arabia saudita en el circuito callejero de la ciudad de jeddah el piloto mexicano domin durante casi toda la carrera a excepcin de las dos primeras vueltas el campen vigente y compaero de red bull el neerlands max verstappen fue su escolta
195,34301,prez cundo est detrs de verstappen en melbourne como venganza por robarle la vuelta rpida y el liderato en yeda
