,Id,Tweet
2460,67335,estuvimos junto a nuestro gobernador eduardopiate2 por elorza importantes obras para nuestro pueblo acompaados de toda la alegra de las fiestas en honor a san jos patrono de elorza y del 29 al 31 de marzo nos vemos la iiexpoferiaproductivaapure2023 juntoscontralasmafias
2461,67336,impresionante se retira nuestra seora y aparece san jos haciendo los s a travs de youtube
2462,67337,ya entregamos ms de 14 mil escrituras junto con juanofabiani nicolaspj80 riccierirosana y villaronganacho acompaamos en la firma de su escritura a 203 familias de san francisco de ass rafael calzada glew longchamps malvinas argentinas y san jos somosbrown
2463,67338,antes despus del da de san jos en valncia pareca que no haba pasado nada este ao un da despus de san jos debe ser que joanribo y el ajuntamentvlc siguen de resaca fallas23 fallas2023 ruzafa
2464,67339,resulta que san jos da del padre y da de pepes y pepas es o era tambin el cumpleaos de mi abuela se nos fue justo para que el funeral fuera el 8m y en 2020 un ao que no se le va a olvidar a nadie nunca as que lo de que cada una de estas fechas duela se pasar no
2465,67340,positivo gracias a denuncia a travs de  estudiantes del inst san jos del pedregal tgu reciben clases en pupitres nuevos y no en el suelo
2466,67341,20 03 23 primera actividad del ao 2023 para jvenes se retoma actividad presencial mircoles 29 de marzo 10 a 14 hrs saln de la hostera del parque ruta 3 km 92 500 san jos informes e inscripciones con su rz
2467,67342,sabas qu el 19 de marzo de 1697 san jos fue fundado por la compaa de jess en territorio misional de chiquitos sehacegestintrabajando esoficiallodiceelice
2468,67343,ltimo da para la subsanacin de documentos dentro de la sptima convocatoria para la administracin de los centros de desarrollo infantil quitocuna s parte de este proyecto en beneficio de nuestras nias y nios revisa las fechas del proceso
2469,67344,el mediocampista carlos gruezo baja por lesin muscular en latri para los amistosos ante australia la fef emiti un reporte mdico sobre el jugador del san jose earthquakes
2470,67345,nuestra querida iglesia san jos estuvo celebrando ayer sus fiestas patronales en la hermosa celebracin estuvo presente nuestro obispo rvdmo david alvarado iaes fiestaspatronales
2471,67346,las fiestas de san jos culminan con la procesin del santo por las calles de el pla sociedad elche elx
2472,67347,es hoy es hoy se te olvid que la gran solemnidad de sanjose se celebraba hasta este 20 de marzo an ests a tiempo de felicitar a todos los que llevan el santo nombre de jos y aqu te explicamos la razn
2473,67348,cura brochero fiesta patronal 2 el fin de semana se conmemor el 183 ao del natalicio de san jos gabriel del rosario brochero conocido como el cura gaucho el primer santo argentino que naci y muri en el pas la fiesta patronal tuvo lugar en ese pueblo de cordoba
2474,67349,el palancazo de gran soldador libertad y orden colombiavabien feid nariz del diablo otto serge valentina jennie san andrs san jos rappi felizlunes clan del golfo dadelhombre villa de leyva
2475,67350,cuando no se roba el dinero rinde luis no roba fueron ms de 30 aos esperando esta obra en la provincia de san jose de ocoa hoy gracias al presidente luis abinader ya ser una realidad que siga el cambio
2476,67351,tal vez me falta mucho para ser como maria y a mi futuro esposo mucho para ser como san jos pero me parece que goals que ambos luchemos cada da por eso y nada ms que eso un amor autntico
2477,67352,hoy 20 de marzo se celebra la solemnidad de sanjos esposo de la virgenmara y custodio de la iglesia revistasuroeste suroeste destino undacomohoy efemrides religin iglesia catolicismo sagradafamilia sociedad
2478,67353,mt 1 16 18 21 24a jos hizo lo que le haba mandado el ngel del seor sanjose osjmr
2479,67354,cura brochero fiesta patronal 1 el fin de semana se conmemor el 183 ao del natalicio de san jos gabriel del rosario brochero conocido como el cura gaucho el primer santo argentino que naci y muri en el pas la fiesta patronal tuvo lugar en ese pueblo de cordoba
2480,67355,en la historia jams alguien hizo tanto desde el silencio como san jos
2481,67356,consagradas a san jos abba jos
2482,67357,carlos aka rodney hojalata libertad y orden colombiavabien feid nariz del diablo otto serge valentina jennie san andrs san jos rappi felizlunes clan del golfo dadelhombre villa de leyva
2483,67358,con motivo de la fiesta de san jos patrn de la escuela sagesse de beirut el arzobispo de la dicesis maronita de beirut y pastor de las escuelas de la sagesse monseor paul abdel sater ms informacin maronitas iglesiamaronita maronites libano
2484,67359,apure la gmbnbt ejecuta la reparacin de la iglesia catlica san jos de elorza mcpio rmulo gallegos para seguir consolidando el 1x10delbuengobierno nicolasmaduro delcyrodriguezv graulparedes eduardopiate2 juntoscontralasmafias
2485,67360,las familias del barrio san jos imploran al patrono de maracay para que las autoridades atiendan a la comunidad
2486,67361,celebramos la solemnidad de sanjos padre jess y modelo de generosidad y humildad permanente acudamos al patrono de la iglesia para que sea un intercesor por la paz que tanto necesita el mundo imagen obsequiada por el papafrancisco a la baslica de san jos en flores
2487,67362,las familias del barrio san jos imploran al patrono de maracay para que las autoridades atiendan a la comunidad
2488,67363,las familias del barrio san jos imploran al patrono de maracay para que las autoridades atiendan a la comunidad
2489,67364,las familias del barrio san jos imploran al patrono de maracay para que las autoridades atiendan a la comunidad
2490,67365,las familias del barrio san jos imploran al patrono de maracay para que las autoridades atiendan a la comunidad
2491,67366,las familias del barrio san jos imploran al patrono de maracay para que las autoridades atiendan a la comunidad
2492,67367,trabajadores del boliche aloha se movilizaron frente a la isj a raz de la decisin de cierre
2493,67368,en miranda feligresa celebr con jbilo el da de san jos
2494,67369,en miranda feligresa celebr con jbilo el da de san jos
2495,67370,yo no le pido a dios un prncipe azul yo le pido a dios un hombre como san jos
2496,67371,nada ms lindo para comenzar la semana que un buen look y un caf bien cargado ven a ver lo nuevo para esta temporada san jos 548 juana manso 1671 25 de mayo 392 giorgioredaelli otoo amoreperlacamicia
2497,67372,santamisa online lecturas y video lunes 20 de marzo 2023 solemnidad de san jos eucarista en tu iglesia virtual
2498,67373,san jos habiendo tenido la envidiable suerte de morir asistido por jess y mara es considerado el protector de los moribundos durante nuestra vida tenemos devocin a san jos para que nos ayude en el momento de la muerte san juan bosco
2499,67374,la herradura celebr con xito sus fiestas patronales en honor de san jos
2500,67375,hoy da de sanjos recordamos sus cualidades como padre amado trabajador obediente y tierno capaz de poner la dignidad y vida de mara por encima de todo incluso de la reputacin supo acoger la propia historia en dios y acoger a quienes nos encontramos
2501,67376,tipodecambio de hoy en banco central de costa rica banco de costa rica bancobcr banco nacional banconacionalcr banco popular bancopopularcr coopenaecr bac san jos baccredomaticcr scotiabank
2502,67377,regional la crnica cdlasnavas 1 6 cdsanjosesoria contundentes a domicilio victoria abultada en un partido que se puso en contra en el minuto 3 los colegiales supieron reaccionar y terminaron goleando vamossanjos lasnavassanjos
2503,67378,desde el hyper jumbo mall queremos felicitar a todas las reinas de ferias de san jos 2023 maracay hyperjumbomall reinadeferiassanjose2023 alcdegirardot rafaelmaracay21
2504,67379,san jos la paz
2505,67380,otro ramillete de estelas por san jos en toledo est maana
2506,67381,caballeros de la virgen ecuador misa de hoy 11 00 lunes 20 de marzo solemnidad de san jos video ecuador
2507,67382,caballeros de la virgen ecuador misa de hoy 18 00 lunes 20 de marzo solemnidad de san jos video ecuador
2508,67383,san jos custodio y protector de los corazones unidos y traspasados de jess y de mara inflama mi corazn para que en l slo reine mi dios jess como rein en tu santo corazn jess jos y mara les doy el corazn y el alma ma
2509,67384,lunes 20 de marzo 2023 4ta semana de cuaresma 19 de marzo fiesta de san jos esposo de la santsima virgen mara san jos el hombre que hizo el sueo de dios realidad evangelio del santo evangelio segn san mateo 1 16 18 21 24
2510,67385,hace cuatro aos en el museo del prado
2511,67386,desde el hyper jumbo mall queremos felicitar a todas las mini reinas de ferias de san jos 2023 maracay feriasdesanjose hyperjumbo alcdegirardot rafaelmaracay21
2512,67387,san jos patrono de la familia y el trabajo bendice mi casa con salud prosperidad y proteccin
2513,67388,hoy es la solemnidad de san jos esposo de la virgen mara y custodio de la iglesia a travs de aciprensa
2514,67389,san jos proteja a nuestros seminaristas y ruega por las vocaciones sacerdotales amn
2515,67390,san jos patrono de la familia y el trabajo bendice mi casa con salud prosperidad y proteccin
2516,67391,uyyyy morros tengo 2 aos y pico sin tirar beef en insta a nadie y ahorita tengo pa deshacer a medio grullo neta pdanle a dios paq no se me olvide tomarme el clonazepam en la noche y despertar de malas pq destapo toda la mierda de todos en fa sostenido
2517,67392,se llama raul berzosa y es antiguo alumno de maristasmalaga cada da nos sorprende con joyas como las de este hilo sobre san jos nimo artista es un lujo disfrutar tu obra maristaalgemesi somoseducacin somosfamilia somosmaristas lafamiliaqueseelige fms champagnat
2518,67393,procesin de san jos en chinchn religion culturapopular tradicin
2519,67394,consejos de xitos para mente emprendedora 20mar emp100pre consejos silvino venezuela san jos pdvsa quijada
2520,67395,oh glorioso san jos ruega por nosotros de fiesta en el barrio de san jos y en las comunidades de zahuatln y carpinteros
2521,67396,rcnradio as se desarrolla el plan retorno este puente festivo de san jos en carreteras del rea metropolitana y bucaramanga la policiabmanga realiza controles en las vas con un dispositivo de 150 uniformados para acompaar a propios y turistas
2522,67397,seor san jos
2523,67398,en el da de san jos la hna dolores eugenio misionera laica de nuestra seora del encuentro con dios hace una reflexin sobre el patrono de la iglesia universal sanjos iglesiacatlica
2524,67399,despedimos las fiestas patronales con la emocionante final de ftbol cuadrangular jugada por profesores alumnos padres y antiguos alumnos en versiones masculina y femenina
2525,67400,ayer si haban eventos oye mi querido david chiriqu celebraba su cabalgata y una carrera de 5k en honor a san jos estaba la summer run series macrofest campeonato de automovilismo powerfit training primarias cd y haba gente para todo
2526,67401,me gusta que la ciudad gobierno vaya a transformar e impulsar en mucho aspectos a mi querida zona sur de san jos
2527,67402,este ao la fiesta de san jos se celebra hoy lunes ayer en la catedral de lugo descubr esta imagen que os comparto pero lo ms importante es quererlo y pedirle que nos ensee a querer cada da ms a jess
2528,67403,san jos el modelo ideal para todo varn a san jos encomendamos en este da especial a los hombres de mxico solteros esposos padres san jos ruegaporellos
2529,67404,ms 20 puestos principalmente de comida permanecen sobre la 2 norte entre la 20 y 18 oriente frente a la parroquia de san jos con motivo de la celebracin del santo patrono no hay paso a la circulacin va adamoraless setnoticias
2530,67405,sucesos en la castellana san jos pistoleros lo acribillan y polica los caza
2531,67406,san jos hombre de fe esperanza paternidad y ms
2532,67407,22 opositores de san fernando cdiz arcos y san jos del valle comienzan el curso de ingreso a polica local
2533,67408,te invito a escuchar el evangelio del da de hoy 20 marzo san jose
2534,67409,qu dudas vas a tener ramn y ms siendo economista todo el mundo sabe que 52 es exactamente igual a 176 y en cuanto salga un casero por ah lo tienes hecho presidente
2535,67410,hoy celebramos a san jose esposo de la bienaventurada virgen mara
2536,67411,hoy celebramos a san jose esposo de la bienaventurada virgen mara
2537,67412,concurso de carros alegricos invade de alegra y color las calles del centro de san jos del cabo
2538,67413,qu dudas vas a tener ramn y ms siendo economista todo el mundo sabe que 52 es exactamente igual a 176 y en cuanto salga un casero por ah lo tienes hecho presidente
2539,67414,vecinos de la col san jos comunal llevaban 18 aos sin drenaje chente castellanos les cumpli drccastellanos diario el fortn
2540,67415,homila de hoy solemnidad de san jos 20 03 2023 p santiago martn fm a travs de youtube
2541,67416,el seor nos dej todo preparado con grandes intercesores y acompaantes en este camino llamado vida uno de los mejores sanjos
2542,67417,solemnidad de san jos hombre justo y prudente nuestro amado san jos que nuestros lugares de trabajo sean reflejo de aquel taller en que tu da a da trabajaste que estos tambin sean honrados y bendecidos por la singular presencia de la sagrada familia
2543,67418,don douglas bracho triple coronado en el desaparecido hipdromo de la limpia con el caballo veseli conducido por el negrito de san jos juan vicente tovar stud crislida del sr guido mendez maracaibo zulia
2544,67419,hoy voy a disparar esta bala en basket colegial agarren san jose state 5 4pm 100 a ese sin miedo mi gente
2545,67420,ahora los sismos han sido parte de la historia de nuestro pas el 19 de marzo se cumplieron 150 aos del gran terremoto de san jos el cual provoc destruccin en san salvador y en otros puntos conozca los detalles en el enlace
2546,67421,feliz da de san jos
2547,67422,san jos del cabo est de fiesta y celebra sus tradiciones con sentido humano alcalde oscar leggs castro
2548,67423,19mar la festividad de san jos se conmemora en honor al hombre nacido en beln y al que dios le encomend la responsabilidad de tomar por esposa a la bienaventurada virgen mara y convertirse en el padre putativo de jess
2549,67424,homila de hoy solemnidad de san jos 20 03 2023 p javier martn fm magnificattv franciscanode franciscanosdemaria sanjose
2550,67425,san jos cudanos en la va seor conductor san jos fue modelo para su familia con el ejemplo educamos a nuestros hijos policiabmanga
2551,67426,provechosa jornada realizada por el cdi el palmar y personal de salud venezolana en san jos brindando una atencin con calidad a la poblacin juntos somos ms fuertes cubacooperabol2 cubacooperaven adanvillavicen5 cubaporlasalud cubaporlavida
2552,67427,el don de la paternidad a ejemplo de san jos
2553,67428,san jos intercede por nosotros
2554,67429,polmica en el hockey portero de san jos sharks se niega a llevar camiseta con alusin a lgbtiq
2555,67430,da de san jos quin fue y por qu se celebra el 19 de marzo de cada ao revtli respuestas el comercio per
2556,67431,csar prez vivas acompa procesin por el da de san jos y reafirm sus valores cristianos
2557,67432,volvi a maracay el tradicional desfile en honor a san jos noticiaselsiglo regionales
2558,67433,conmemoran a san jos en tepatitln
2559,67434,sin decir una sola palabra nos ensea actitudes dignas imitar asumir responsabilidad ofrecer proteccin practicar la justicia y actuar en obendiencia estas son 4 actitudes esenciales de san jos que son un ejemplo a imitar para todos harpa dei san jos ruega por nosotros
2560,67435,celebramos hoy a san jos esposo de la virgen mara padre adoptivo de jess y protector de la iglesia catlica
2561,67436,dolores y alegras de san jos
2562,67437,rezamos el rosario y despus celebramos la santamisa en la solemnidad de sanjos en yepes tambin te puedes unir por la emisoraparroquial y el canal youtube
2563,67438,fiestas patronales en honor a san jos esposo de la virgen mara en la parroquia san jos el naranjo
2564,67439,oye san jos quiero que en mi honeymoon me lleves a tu oratorio en montreal canad gracias desde ahorita
2565,67440,nunca se dijo por parte del director de la republicana porqu se le hizo un penhouse dentro de la guardia al narco y porqu iba a san jos y yi conyugal en serio es posible en esta layera no lo supiera oficialmente porque el aviso era directo cuantas cosas hay ah
2566,67441,el mundo de tupac caliban el papa francisco mand a flores una particular imagen de san jos dormido
2567,67442,jornada de salud en san jos en conjunto con el personal del hospital cdi el palmar cubaporlavida mejoresposible yovotoxtodos cubacooperaven minsaludve magagutierrezv minsapcuba adanvillavicen5 altunaga perez
2568,67443,san jos visto por benedicto xvi
2569,67444,procer de nuestra nacin juanborrelli2 saludos
2570,67445,en la vspera de san jos la iglesia de san pedro apstol de binfar reabri sus puertas don ngel presidi la eucarista con la que reanud el culto en este templo del siglo xv un ao despus del inicio de las obras por el desprendimiento de 2006
2571,67446,unidos a el en la oracin el seor le bendiga y san jos sea su protector
2572,67447,el portero de los san jose sharks james reimer se niega a usar una camiseta con el tema del orgullo gay citando creencias religiosas
2573,67448,mi amado san jos hoy te pido por todos los hombres del mundo para que seas t quien est colocando en cada uno de ellos tus virtudes de buen esposo y buen padre los edifiqus y hagas de ellos hombres virtuosos llenos del amor de dios que hoy mi oracin se refleje en ellos
2574,67449,orientados en garantizar el suministro de agua potable instalamos junto al equipo tcnico de aguasdeyaracuy nuevos componentes electrnicos en el pozo de la comunidad san jos de carpano parroquia san javier agradecemos a nicolasmaduro jleonyara
2575,67450,toda la tarde en hato viejo y en la noche en san jos tengo que bajarle dos
2576,67451,un verdadero hombre donde llega hace familia y eso hizo san jos cuando lleg a mi vida ciment en m a la trinidad celestial y a la trinidad terrenal hace un ao que la providencia prepar nuestro encuentro y cambiaste mi vida gracias pap espiritual padre de mi dios
2577,67452, 20 03 2023 lunes de la iv semana de cuaresma celebracin solemnidad de san jos esposo de santa mara parroquia santa teresa de l infant jess en barcelona espaa preside reverendo enric ribas presbtero
2578,67453,    lun de la iv semn de cuarsm   solemnidad de san jos esposo de santa mara  santa teresa de l infant jess en barcelona esp  r p enric ribas
2579,67454,felizlunes sanjos ruega por nosotros desdelafe
2580,67455,canal san roque amp multimedia rtvm remontada del cd san roque ante el atltico san jos 2 1 ms vdeos y noticias en app multimedia san roque
2581,67456,acusado de causar la mu3rte a un hombre en la localidad de san jos kuche
2582,67457,hoy celebramos la solemnidad de sanjos y este es el consejo de san josemara escriv de balaguer sobre la devocin que debemos tenerle
2583,67458,mensaje de nuestro arzobispo pablo salas en la fiesta de sanjos
2584,67459,en la solemnidad de san jos agradecemos su testimonio de fe y amor su valenta y docilidad a la voluntad de dios terciariascapuchinas
2585,67460,hoy celebramos la solemnidad de san jos hombre respetuoso y delicado a travs del cual dios se ocupa de los inicios de la historia de la salvacin dicesisdecabimas sanjos solemnidad
2586,67461,el pasado lunes 13 de marzo los dos grupos de 3 de eso asistieron a una actividad de divulgacin cientfica de la uma denominada adicciones cuidas tu salud mental llevada a cabo por el grupo de neuropsicofarmacologa del instituto de investigacin ibima en una primera
2587,67462,patriarca san jos artesano antonio parras 2022 2023 madera de cedro policromada al leo imagen de vestir tamao natural algeciras cadiz templo de la santsima trinidad miguel lorenzo y antonio parras ruiz escultura imagineria escultor imaginero
2588,67463,este domingo 19 de marzo el alcalde lisandrosegura junto con rodolfo molina presidente del concejo municipal camaramunicipalalbertoadriani acompaaron a la feligresa de la parroquia rafael pulido mndez con motivo de celebrarse el da de san jos padre ejemplar de
2589,67464,no s si funcione pero si twitter puede hacer su magia y regalarme una manita con algn mdico enfermero que trabaje en el hospital infantil universitario san jos y nos d una manita con agilizar un procedimiento le agradezco de todo corazn urgencias sanjos
2590,67465,predestinado para la gloria padre de su dios maestro del maestro salvador de su salvador sostn de aquel que todo lo sostiene ejemplo de masculinidad perfecta para el hombre dios mi san jos ante ti toda rodilla se doble y toda cabeza se incline
2591,67466,o bienaventurado jos muestrate padre tambin a nosotros y guianos en el camino de la vida concdenos gracia misericordia y valenta defiendenos de todo mal amn sanjose pontifex es
2592,67467,ojo los y las de la generacin de los 40 60 celebramos ya el da 19 de marzo como el da san jos obrero el da del padre
2593,67468,7 cualidades de san jos
2594,67469,san jos el santo del silencio
2595,67470,entrate fallece de un infarto el tenor oaxaqueo edilberto regalado mientras interpretaba una cancin durante la misa de celebracin de san jos en su tierra natal en la regin del istmo de tehuantepec
2596,67471,concurso de carros alegricos invade de alegra y color las calles del centro de san jos del cabo
2597,67472,san jos el hombre de la docilidad
2598,67473,histrica cabalgata en honor al santo patrono san jos de david la cabalgata en honor a nuestro santo patrono san jos de david ha sido considerada la ms grande del pas sin embargo en esta ocasin fue la ms grande de todos los tiempos sigue
2599,67474,san jos
2600,67475,lo que viene siendo un polica escolta tocho
2601,67476,hoy acompaamos en misa y procesin a nuestros vecinos y hermanos de san jos creemos en nuestras tradiciones y legado y lo defenderemos
2602,67477,ltima cita tour de despedida 1 de junio san jos civic san jos california estados unidos ultimacitatour cncomusic cnco cncoultimacita
2603,67478,parte del clero de la diocesismachiqs en la celebracin eucarista solemne en honor al custodio de jess y mara sanjos diocesismachiqs
2604,67479,san jos del cabo est de fiesta y celebra sus tradiciones con sentido humano alcalde oscar leggs castro
2605,67480,que no se nos olvide que un da como ayer mamelafialloflo llam p ta a la virgen mara y se burl de san jos
2606,67481,misa vsperas a san jos de paraguach 19 de marzo 2023
2607,67482,san jos escucha las splicas de todos los que confan en ti
2608,67483,obispo traza el retrato espiritual de san jos con motivo de su fiesta via aciprensa
2609,67484,chiringuitosgra el puente de san jos levanta el nimo a los empresarios de las playas de la costatropical de granada francisco trujillo si el tiempo sigue en esta lnea y no surge nada que lo impida tendremos una magnfica
2610,67485,oracin a san jos san jos modelo de esposo y pap s nuestro intercesor ante tu hijo para obtenernos de l la gracia de conocer comprender aceptar trabajar y permanecer en la misin que dios nos ha encomendado para beneficio nuestro y de toda la humanidad amn
2611,67486,jornadamdica seguimos gestionando consultas y medicamentos completamente gratuitos nos encontramos en la comunidad barrio san jos de mejicanos
2612,67487,hoy es dia de san jos santo canonisado por la iglesia catolica suvi jos a los cielos para declararlo santo los leo
2613,67488,nuevas fotos del escape room de ciencias organizado por el profesor manolo jimnez el pasado viernes en las fiestas patronales semanaignaciana23 semanaignaciana patronalessanjose23 jesuitas educsi genteesperanzada educsi ecatolicas ec andalucia ldefsj
2614,67489,con una misa peregrinacin y maanitas a mariachi familias honran al santo patrono en la misin de san jos
2615,67490,laflorida el suboficial quien frusto el asalto en el supermercado de santa raquel con av san jos de la estrella fue reconoci por el general director ricardo yez por su valenta y compromiso ante la flagrancia de un delito
2616,67491,esta es la imagen que ms se acerca a como yo me imagino a san jos joven fuerte firme intimidante por la grandeza y nobleza de su ser que nadie se atreva a tocarle un cabello a la sagrada familia y llevndole flores a mara y a jess puestos por dios bajo su cuidado
2617,67492,significacin de san jos por jos flix daz bermdez
2618,67493,titulareseep las familias del barrio san jos imploran al patrono de maracay para que las autoridades atiendan a la comunidad va cronicauno 20mar
2619,67494,nuestro prroco honeggermolina estuvo presente en la celebracin de las fiestas patronales de la poblacin de san jos de barlovento y presidi la santa misa en honor a su santo patrono sanjos
2620,67495,peatn atropellado por un conductor que se da a la fuga cerca de tully road y flint avenue san jos ca
2621,67496,4 valores que podemos aprender de san jos
2622,67497,felizlunes rincs group tiene para la venta memoria para computadoras nvme ssd 250gb disponible ya mas info aqui 20mar beisbolxteleven venezuela maracay aragua pdvsa alvarado sunacrip silvino omar lpez quijada san jos hugbel roa
2623,67498,1 casado con aquella que es llamada espejo de la justicia padre adoptivo del len de jud san jos deba ser un modelo de fisonoma sapiencial de castidad y de fuerza un hombre firme lleno de inteligencia y criterio capaz de asumir la responsabilidad de cuidar del secreto
2624,67499,los buenos deseos del papa a los padres san jos es modelo de paternidad vatican news
2625,67500,reporte pmu nacional festivo de san jose 20 mar 23 12 00 horas read
2626,67501,concurso de carros alegricos invade de alegra y color las calles del centro de san jos del cabo
2627,67502,concurso de carros alegricos invade de alegra y color las calles del centro de san jos del cabo
