,Id,Tweet
676,92447,aqu escuchando una joyita de los tigresdelnorte mientras espero que sigan a elalexquackity
677,92448,yo no me voy a poner a estudiar hasta q saque la cancin culia
678,92449,isla pato
679,92450,esto se siente irreal soy tan feliz
680,92451,la diferencia entre las icons kajdjajaja
681,92452,maana no voy a poder ver el qsmp por las clases quiero llorar
682,92453,ya tengo a quien ver en los qsmp
683,92454,pinche roier nos dice los amo y nos da besitos para despus negarnos
684,92455,porfa que carre este en qsmp
685,92456,igual si yo me viera as y me hubiera sacado una foto as tambin la podra de foto de perfil
686,92457,mi hermana es spreen y yo soy carre
687,92458,ay yo dije que habr estado haciendo hace un ao y vio una foto de su ex y ella teniendo un da feliz
688,92459,no me deja
689,92460,q buena foto escogi de perfil ksjdkskd
690,92461,yo tengo la ilusin de que rubius en algn momento cambie de escena y esta abierto minecraft y sea la invitacin a qsmp sisisi
691,92462,ya son familia mano
692,92463,alm el popurr de gente q hay en el qsmp estoy re emocionada x cmo se va a llevar a cabo
693,92464,cualquier cosa que haga espero sea una confirmacin para el qsmp d
694,92465,no aguanto un nio chiquito ms por dios
695,92466,cada vez que veo a los monsta con un animalito me siento la persona ms feliz del mundo os lo juro
696,92467,saca un documental sobre el afhf como el de 2021
697,92468,dream estar en el qsmp dream estar en el qsmp dream estar en el qsmp dream estar en el qsmp dream estar en el qsmp dream estar en el qsmp dream estar en el qsmp dream estar en el qsmp
698,92469,mis aroace favs estarn en el mismo server qbendicin qsmp
699,92470,fiel creyente de que si no se anuncian hoy ms participantes lo harn maana a ltimo min antes del evento
700,92471,imagen robada pero si porfa
701,92472,ayuda ya no me puedo salir de twt porque estoy ansiosa de que publiquen el prximo participante del qsmp
702,92473,ms lindo carre
703,92474,hoy es martes del mes marzo con m de maana empieza el qsmp
704,92475,carre dijo que no tiene un amigo con quien mandarse tiktoks y spreen le manda uno
705,92476,amigos de verdad admiro demasiado a quackity reparte su tiempo en un montn de cosas que si yo las hiciera seguro ya me hubiera tirado por la ventana de tanto estrs y an as se mantiene feliz y sonriente el rey es un chingn
706,92477,pero me dejaste a la mitad
707,92478,voy a dibujar a mi amada y a aidan
708,92479,necwsito un amigo como spreen
709,92480,la escuela me tiene tan estresada que ni me he acordado de decir lo mucho que quiero a quackity a mi se me hace que ya vali verga este pedo de citar cuanto quiero al patito pero bueno te quiero mucho quackity
710,92481,m sali q roier y george mis papitos jajsjajsjd m estoy cagando de risa
711,92482,anoche estaba viendo outfits de mj para copiarle y termine soando con l
712,92483,tengo los dedos pa la caga por la guitarra culia mi verdadero amor txico
713,92484,maana yunho cumpleaos basta deja de crecer
714,92485,estoy muy cansada
715,92486,le queda y quedar lindo todos los estilos pero alejenlo de las tijeras
716,92487,me voy a dormir espero que no anuncien nada ms
717,92488,para los hispanos que vayan a ver el qsmp y no conozcan a foolish foolish hace estas locuras no digo ms
718,92489,ok 2 pm maana qsmp nada nada me puede detener literal no tengo nada que hacer maana en la tarde universo porfavor dejame en paz una vez en mi vida te lo suplico
719,92490,mi novio
720,92491,lit estoy pensando seriamente en que carre est en el qsmp porque su ttulo hace una referencia a vegetta y pues todos sabemos que l ya es participante
721,92492,hoy es martes da de parche hoy confirmo q estoy en el qsmp chabale
722,92493,no s dibujar en digital no s usar los pinceles q bajn gt lt
723,92494,me parece muy lindo como todos le han dado ese voto de confianza a quackity pese a ni siquiera saber qu se viene exactamente con el qsmp definitivamente se ha ganado ese cario e incluso respeto en la comunidad estoy tan orgullosa de l
724,92495,me acaban de humillar con mi florecita que parece de nio de 5 aos
725,92496,ya que sea maana para el qsmp
726,92497,abro hilo de cosas que creo que hicieron un efecto mariposa hasta el qsmp no tiene un orden en especfico
727,92498,otra cosa es que siempre que veo las iniciales de la serie qsmp siento que es un insulto jajajaja en plan hdtpm jajajajja
728,92499,mi familia de twitter padres georgenootfound roiereal cnyuge tinahkiss nios auroncl0wn sptimn me via
729,92500,hilo de porque roier merece estar en el qsmp y su ticket
730,92501,a q hora anuncian a rubius el marina juan y roier en el qsmp
731,92502,revisa los nuevos integrantes anunciados para el qsmp
732,92503,q preciosa soy neta
733,92504,martes con m de minecraft no es obvi lo de vegetta es por qu vegetta est en qsmp y ahora carre nos va a revelar que est en qsmp qsmp
734,92505,descansa alexby11 gracias por el directazo de hoy estuvo re bueno y mas con lo de ende ring se te quiere mucho rey l
735,92506,rubn estar en qsmp me lo ha dicho esta maana
736,92507,encerio soy la nica que escucho el hmm puede ser
737,92508,yo y los farmacuticos cuando qsmp
738,92509,lo voy diciendo ya no puedo ver qsmp porque tengo clases y exmenes pero el jueves no tengo clases para evitar spoilers no voy entrar a twitter ni tik tok hasta el jueves por la tarde si desaparezco es por eso
739,92510,quackity por favor met a tubbo en el qsmp porq sin creo que me muero
740,92511,te odio reportera que le pregunt a cazzu si estaba embarazada lo peor es que solamente contestaba me veo ms gorda tal vez sub unos kilitos y luego preguntndole por canciones de belinda es que de verdad que ganas de
741,92512,quesadilla como isla quesadilla del qsmp sin duda jorge no encontrado es parte del qsmp no tengo dudas
742,92513,chiquis rubius si va a estar en el qsmp porque mi pap trabaja en quackity studios y l tiene informacin confidencial de los participantes tambin estar germn leak
743,92514,voy a llorar si no est rub en el qsmp primer aviso
744,92515,rubius dale abre el el minecraft
745,92516,carre es muy gracioso por dios
746,92517,yo necesito a karl y roier en qsmp
747,92518,hoy ganamos los del espectro aroace
748,92519,fuaa justo a la hora que empieza qsmp estoy estudiando
749,92520,ya lo nico que mantiene viva la esperanza de rubius en el qsmp es voluntad porque
750,92521,ahora carre y robleis van a ser anunciados en el qsmp juntos
751,92522,shadoune y carre tienen q anunciar hoy q estaran en qsmp porfavor
752,92523,lo q estaba pensando
753,92524,el qsmp deberia llamarse quackity y su ganado jajajajaja
754,92525,memes por si shad carta de esta en el qsmp suicidio
755,92526,me creo todos los edits q hacen de welcome to qsmp fulano detal
756,92527,ya no aguanto este sufrimiento llamado rubius no confirma que esta en el qsmp
757,92528,yo yo de verdad no creo que juan est en qsmp
758,92529,ojal quackity logr lo imposible meter a michael jackson al qsmp
759,92530,tengo f de que rubius si este en el qsmp
760,92531,soy una gata
761,92532,esto es arte puro
762,92533,weno no he estado tan activa xq estoy forrando los cuadernos xq si no lo hago me matan xd y no voy a tener tiempo para nada xq mn comienza en qsmp aaaaaaa byeeeeee
763,92534,mi cubito lista para maana galaqsmp qsmp
764,92535,esq aparte de que quiero que este en la serie tmb quiero ver su sep up version cubito
765,92536,ahora va a jugar al counter cierra el juego y ahora si abre minecraft
766,92537,quiero ir consiguiendo ms amigos q shippen luzbur o algo pa contarles mis ideas todas pendejas knjdsks bno solo quiero ms amigos pero no s como hacerle pipipi
767,92538,no caigo en cuenta q maana inicia qsmp
768,92539,enchiladas verdes y yo un solo corazn muy grande grande grande grande
769,92540,si veo una foto en la q confirmen a ranboo pero es falsa voy a comenzar a dar block eh aviso
770,92541,ya hasta andaba pensando en no ver el qsmp por mi horario y justo se mete vegetta me voy a ver todos los streams de vegetta y los resmenes alv
771,92542,nunca olviden
772,92543,como q rubius no va a estar en los qsmp lpqmp
773,92544,che nose pq pingo los yankis lo odian al chabon este onda el pelirrojo tira buenas canciones
774,92545,carre estar en el qsmp carre estar en el qsmp carre estar en el qsmp carre estar en el qsmp carre estar en el qsmp carre estar en el qsmp carre estar en el qsmp carre estar en el qsmp
775,92546,la locura me quede dormida un rato y so que alexby y rub se metan juntos a mc y anunciaban juntos que estaban en el qsmp
776,92547,quiero creer fielmente en la teora de que algunos no van a mostrar su invitacin porque en realidad ellos ya estan desde antes viviendo en isla quesadilla y no porque en realidad no van a estar participando
777,92548,y cuando llegue robleis a casa de carre y les llegue la invitacin del qsmp a los dos al mismo tiempo lt 333333333333333
778,92549,qu suerte que maana empieza qsmp
779,92550,yo tmbkiero flores amarillas
780,92551,mutuales que aciertan a los posibles participantes con teoras e hilos ustedes sern recordados o7
781,92552,yo solo voy a decir que de los youtubers que andan involucrados con el qsmp falta uno muy importante bilinge y que ltimamente anduvo activo por los squid craft games 2 qu tan factible ven a germangarmendia en el qsmp si tengo esquizofrenia
782,92553,necesito amistades para ver qsmp aaaaaa no soporto el no poder compartir todos mis ships y teorias pq no me van a entender el hype hablenme hablenmeeee quiero amigos fans de quackity y qsmp qsmp luckity tntduo dsmp slimecicle sapopeta memes
783,92554,para m spreen no prendi pq va a ir a la casa de carre con robleis para hacer el challenge de motores presentarse para el qsmp y hacer chupistream
784,92555,ponganle a sus hilos que ama a los gatos es muy importante
785,92556,est muy esquizo lo quiero mucho
786,92557,mi cubito materializndose por primera vez para presenciar el inicio del qsmp besitos a todos los presentes en la galaqsmp qsmpfanart
787,92558,quiero dejar de ser la tonta
788,92559,pol estar en qsmp
789,92560,oigan cuanto ira a durar el qsmp pens que esta semana sala de vacaciones pero falta esta y otra
790,92561,maana tengo escuela y me perder el inicio del qsmp
791,92562,maana el qsmp quackity qsmp
792,92563,rubius ya di que estas en el qsmp
793,92564,se imaginan q justo en este stream tanto carre como rob confirman su participacion en el qsmp
794,92565,okey alexby tambien estara
795,92566,el qsmp ser una maravilla
796,92567,ando de stream a stream a ver si alguno anuncia algo estoy re paranoico
797,92568,no tengo idea de q sea el qsmp pero esta vegetta asi q toca verlo
798,92569,unas ganas del cb para escuchar thirsty a todo volumen
799,92570,yo cuando no s mentir
800,92571,minequackt es god y tiene un toque de egolatria
801,92572,si jn no est en el qmp llor
802,92573,es vdd me habia olvidado jajajaja
803,92574,bueno ahora george dale confio
804,92575,llora en qsmp
805,92576,a juyar alexby alexbyfanarts spidermanalex fornite
806,92577,los sueos de carre son peores que mis alucinaciones
807,92578,de cierta manera tambin me imagino a q re nervioso por hablarles a las personas que tena pensadas para el qsmp y eso me da muchsima ternura
808,92579,tuve que agendar cita con el dentista y me dijo que no me reconoci por la foto que tengo dijo que no estaba seguro de si era hombre o mujer jdks la foto en cuestin
809,92580,y pensar que hoy despert a las 3 a m de un sueo donde vegetta entraba al qsmp y al final es una realidad wow
810,92581,tengo la leve teora que las imgenes publicadas son igual invitados al qsmp en si son personas que recibieron la invitacin pero no las veremos recibirla cmo por ahora es el caso de wilbur y slime a menos que hagan stream rubius tambin se comporto
811,92582,muchas gracias por el stream de hoy germangarmendia me divert mucho contigo y el chat intentando adivinar rindonos un rato y hablando de una que otra cosa me la pas muy bien en todo el stream ojal ms streams as te quiero mucho germn sigue siendo as lt 3
812,92583,yo poniendo mi playlist de lovejoy mientras escribo la historia de una chica aro ace para mi proyecto de psicologa
813,92584,tiene q aprender a mentir
814,92585,lo mejor de todo es que lo puedo leer con sus voces dios estoy mal
815,92586,oh dios mo soy una mujer tan ocupada matenme
816,92587,c van a conecer aaa wilburfanart luzufanart qsmp
817,92588,wtf porque en mi diario puse que es 21 09 2021 me fui muchsimo
818,92589,no se pero la palabla qsmp me suena a que simp xd
819,92590,me divido en dos o como
820,92591,maxo burlndose de rubius porque no lo invitaron al qsmp jajajskakajaajjajskajaajjskskajajjsakakajajajaj
821,92592,me desahogar aqu porque no puedo hacerlo con personas cercanas a m
822,92593,mi mano cuando quiero hacer un dibujo del kuakiris mi mano cuando voy a hacer a mi qbito por 12351 vez en el da
823,92594,anda rubius yo se que eres hombre pero no me puedes mentir yo se que estas en el qsmp
824,92595,no llego a ver el estreno de qsmp quiero llorar un ao
825,92596,los mas lindos de todo youtube y twitch en general
826,92597,pfffff rubius esperando el csgo 2 es yo esperando a que lo anuncien en el qsmp esta noche lo anuncian copium
827,92598,sera precioso que quackity metiera a technoblade en el qsmp aunque fuese solo de forma simblica al haber sido uno de los mayores creadores de contenido de minecraft de toda la comunidad inglesa lt 3 miss u techno
828,92599,va a confirmar que est en el qsmp sisisis
829,92600,as yo con mis parejas favs l es tan real por eso o como dicen las gringas
830,92601,si shadoune si llega a estar en el qsmp entonces rubius tambin de alguna forma como participante dios encargado vip hasta como presentador del premier de maana
831,92602,se siente raro tener muchas notis nomas tena 3
832,92603,manifestemos que karl haga stream hoy diciendo que esta en el qsmp
833,92604,a m se me hace que si estar en el qsmp
834,92605,rubius vamos abre el minecraft por favor te lo suplico
835,92606,nos quieren robar a la roier updates andamos de txicas con las admins
836,92607,vane creo k no puedo ir al cine
837,92608,che amigo que felicidad que empieza maana el qsmp el problema aqu es que aun no tengo idea que pov voy a ver
838,92609,ahora se abre el minecraft y pum qsmp
839,92610,si no lo dice ahora entonces lo har al final del stream
840,92611,vegetta en su stream hablando de spreen estoy destrozada
841,92612,no le creo no le creo no le creo no le creo no le creo
842,92613,ahora es cuando vuelve dice juguemos a algo y habr el minecraft
843,92614,vali mierda tdo
844,92615,no s sacar precios unitarios
845,92616,se quedo en el stream d crre
846,92617,omg y esas pintas se ve bello
847,92618,se estrena el qsmp y nueva colab del biza con arcangel bendito sea el 22 de marzo lpm
848,92619,la escena en donde pam se entera que est embarazada
849,92620,falta mucha gente por anunciarse para el qsmp todavia o los van anunciar a todos juntos en cualquier momento o va a ser una sorpresa para maana y nos vanos a enterar en vivo quienes son todos los que faltan
850,92621,un tauro y un cancer ahora amo mas a kaveh
851,92622,rubius ya di que estars en el qsmp
852,92623,todos felices pero dnde quedo yo si ya dijo que no va a estar
853,92624,tengo fe
854,92625,volknews qsmpes es el nuevo servidor de minecraft con famosos youtubers que lucharn en un survival quackity vegetta777 luzu missasinfonia spreen minecraft survival serie twitch qsmp
855,92626,entonces d german y juan en qsmp ya ni hablamos vdd
856,92627,nueva preocupaci el qsmp empieza empieza estoy en prctica
857,92628,creo que maxo acaba de spoiler a rubius en el qsmp
858,92629,cmo as que rubius no va a estar en el qsmp
859,92630,lo manifest cabrones ahhhhhh q emocin
860,92631,kmo qie maana e lo de qsmp
861,92632,ministro del tc explic voto a favor de requerimiento hacen que se vulnere el principio fundamental de dar proteccin inoticiascl nacional cnnchile chile trump google lagos qsmp iphone earthquake santiago santiago
862,92633,maxo se le salio que rubius si esta en qsmp jajaja
863,92634,rubius ya basta no ms
864,92635,la risa nerviosa jajajaja
865,92636,rub anuncia ahora su participacin al qsmp 5 lucas
866,92637,quiero mis flores amarillas maana q vaya a la escuela o voy a llorar muy feo gt
867,92638,les vengo a ofrecer escenarios ficticios que me surgieron sobre el qsmp durante mi lecho de muerte
868,92639,maxo sacando lo del qsmp jakajajja
869,92640,dijo que puese ser
870,92641,maxoooooo q dicessssss loco
871,92642,rubius est cerrando el elden ring ahora va a abrir minecraft yo lo se
872,92643,vieron q iba a estar
873,92644,carre yo tmb tengo sueos as
874,92645,rubius estar en el qsmp
875,92646,sprn le don a tubbo carola y ahora a carre cosa d gente con plata
876,92647,el team vaco legal tiene q estar en los qsmp
877,92648,me acuerdo q en ambos me tachaban d esquizo al decir que iban a estar
878,92649,igual me pone re feliz que en el qsmp est spreen missa maxo luzu wilbur lt 3
879,92650,yo an no lo tengo
880,92651,la mayor decepcin que he tenido en toda mi vida fue que el mctrio no est en qsmp qsmpes quackity roiereal aldogeotv elmarianaa
881,92652,no m pods hacer esto
882,92653,carre mira tubbo estoy llorandl
883,92654,vaya efecto domin que culmina con quackity vegetta y qsmp
884,92655,vegetta y spreen estaran juntos en qsmp ayuda estoy gritando de alegria
885,92656,de que hablar carre jajajajajaj
886,92657,quiero quedarme en casa para ver el qsmp
887,92658,recin vi que confirmaron a vegetta y ayer a missa
888,92659,no confieee
889,92660,la vd si es mejor qsmp perdname vegetta
890,92661,que bajn me dio que maana estar en la escuela y me perder el estreno de qsmp quiero llorar
891,92662,le don otros 30k que lindo que es
892,92663,spreen le dono 40 k de bits a carre ajjajsjajajajsjajajaj
893,92664,quackity lo logr vegetta y spreen en una misma serie no estoy soportando tqm quackity qsmp
894,92665,estoy llorando
895,92666,yo tena as de esperanza para que carre est en el qsmp muri mi esperanza
896,92667,hola hola
897,92668,carre no termina una idea y ya empieza otra es tan yo
898,92669,te quiero mucho vegetta mucho mucho
899,92670,spreen dono 40k en 30 segundos
900,92671,dejar as mi perfil x un rato
901,92672,qeu pura f y no tonteras
902,92673,1 9 11 y 12 aunque me dan ganas el 9 y el 1 por mis favs
903,92674,a los d la comunidad hispanohablante los conozco a todos as que punto a favor
904,92675,nomames es real no estpy soando verdadv
905,92676,callen a la gente que dice que wilbur no estar en el qsmp por favor me lastiman
906,92677,maana no tengo clases voy a ver el qsmp en paz
907,92678,me encanta como spreen siempre anda viendo a carre
908,92679,spreen hoy se levant con ganas de donar
909,92680,y a que hora anuncia al xokas en el qsmp ando muy esquizo ahorita
910,92681,que alguien ms confirme por favor no estoy soportando
911,92682,spreen le don 10k bits a carre
912,92683,carre dice q no gasten y viene spreen y dona 10k ajajaj
913,92684,me intriga tanto el lore de quackity dentro de qsmp ser presidente dueo de la isla el dios o un simple pasajero tengo muchas preguntas y ganas de ver ya
914,92685,ojal el qsmp no sea tan temprano recin salgo a las 16
915,92686,este vdeo me hizo recordar de la vez que a quackity le preguntaron cul era su palabra favorita en ingls a lo cual el respondi que era wednesday y que casualidad que justo el qsmp empieza maana mircoles
916,92687,l en su momento ms esquizo de problemas amorosos
917,92688,los streamers cada que les preguntan sobre el qsmp son literal esto
918,92689,mi sueo botelln con los monsta
919,92690,ella era mi animadora fav cuando estaba en primaria y secu esto es un sueo
920,92691,carre hoy va anunciar q esta en qsmp en menos de una hora eu confo
921,92692,gente y el dteam donde wsta
922,92693,enseando todo eso significa que enseara tambien la invitacion al qsmp
923,92694,me voy a morir gente
924,92695,llegu de la escuela apenas q pas
925,92696,ah bueno
926,92697,loco no puede ser q ewste lovejoy hijos de puta vengn
927,92698,me jode no conocer a tres de los anglos q van a estar pero seguro son super piolas y adems si quackity los eligi a ellos es por algo
928,92699,por favor necesito a karl y george en el qsmp solo pido eso
929,92700,chicos como llegue a los 7 millones quackity me mando esto dice qje me espera maana en el qsmp
930,92701,nunca me habia conectado e interactuado tanto en twt mira lo que me haces hacer qsmp me volvi virtualmente sociable por tu culpa tkm q
931,92702,rubius no esta en el qsmp
932,92703,quackity en las drogas
933,92704,no se q hacer con mi vida soy muy sociable y de repente estoy en tres grupos distintos de amigas y no con quienes juntarme porq me caen bien todas y no quiero dejar de lado a nadie
934,92705,qsmp quackity suputamadre mucho pretendiente
935,92706,dejen contar el sueo a carre jabsnjsjaa
936,92707,oigan a q hora es maana lo del qsmp hora chilena pls es q tengo liceo maana y tengo miedo de no poder verlo
937,92708,mutis qued en primera fila
938,92709,dale cuacks ya di que manueh si est en el qsmp
939,92710,galaqsm qsmp ahora s estoy lista para el estreno de el asombroso evento
940,92711,ser germanchelo el name guarden tweet
941,92712,cuidadores de gatitos
942,92713,recin llego a mi casa holaaaaaa que ya sea el qsmp gracias
943,92714,de tanto apostar en el stream de rubius ya m hice caleta de puntos kajfjf
944,92715,y anuncian que estn en qsmp vdd
945,92716,no mames no tengo internet y no me carga nada pero me entero por las notificaciones y no mames vegetta foolish dantdm jaiden ptm va a estar buensimo el qsmp muero
946,92717,mi fyp de tt est lleno de videos de flores amarillas wn v
947,92718,vomo les explico que aun no me lo creo vegetta en qsmp de vdd no es un sueo vege confia tanto en quacks estoy wue lloro mi yt fav y mi streamer de twitch fav me les voy
948,92719,acabs de decir kien sabe ahora aparece rob y confierman q estan en el qsmp
949,92720,a mi que me importa que les hayan dado sus flores amarillas envidia
950,92721,rubius deja de mentir gt qsmp
951,92722,cuch
952,92723,maana sslgo alas 6 no ver el qsmp
953,92724,amo verle as
954,92725,m voy a dormir un rato m avisan cuando anuncien q roier y tina estn en el qsmp
955,92726,se van a juntar los dioses del minecraft no voy a soportar qsmp
956,92727,confirmen a tommy o no se pero hagan algo qsmp anterior de irme a mimir
957,92728,quiero la beanie y la headband esoty triste
958,92729,el qsmp si tuviera buenos participantes
959,92730,maana no llego a ver el directo del inicio de qsmp asiq nose si verlo de a ratos en la escuela o esperar hasta q salga y despues ver el vod desde el inicio
960,92731,como que rubius y roier confirmaron que no van a estar en qsmp me duele el corazn
961,92732,todavia sigo esperando un welcome to the qsmp juansguarnizo
962,92733,los amo
963,92734,paren todo vegetta en su tiquet de qsmp tiene el 38 y folish tiene el 39 aaaaaaaaaaa
964,92735,ensendonos su invitacin al qsmp
965,92736,qsmp xd maana jsjs quien mas le emociona v ps luzu hacer stream a las 9 00 o 10 00 aca en argentina
966,92737,duermo la siesta y me suman dos participantes no puede ser no tengo idea quienes son pero welcome to the qsmp a los dos ultimos
967,92738,gn linduras nos vemos maana en el estreno del qsmp
968,92739,yo a kas 2 de la tarde estoy sufriendo en educacin fsica no kiero ir maana
969,92740,la esperanza solo se pierde hasta que maana sean las 1 pm y empiece el qsmp
970,92741,no puedo ser la unica q siente una ansiedad por maana loco apenas sabemos como unos 10 invitados del qsmp y todavia faltan probablemente una banda y recien maana vamos a ver a la hora q todos prendan stream
971,92742,que ondaaa como han estado
972,92743,estoy una tarde sin entrar a twitter y me sale que veg va a estar en el qsmp aaaa
973,92744,recien me doy cuenta que si va a estar vegetta
974,92745,el qsmp es la reunin de creadores de contenido que siento que ms voy a disfrutar
975,92746,me la cre
976,92747,soy esa
977,92748,maana nos vemos en qsmp gente efectivamente mi nueva serie quien sabe manco pendejo donde juego valoranto con gente que usa nicks como barack obama o mandarina
978,92749,maana comienza el qsmp maana comienza el qsmp maana comienza el qsmp maana comienza el qsmp maana comienza el qsmp maana comienza el qsmp maana comienza el qsmp maana comienza el qsmp
979,92750,actualizando el bingo del qsmp qued remal cuando vi a vegetta no le tena nada de fe por eso no lo puse fue tremenda sorpresaaaaaaaaaaa y dude de pasada foolish tambin aaaaaa toy muy feliz ayudaaaaaaaa dej al juan y ari juntitos por el veg ojal puedan ir
980,92751,si rubius aun se hubiera negado a la realizacion de los squidcraft 2 las interacciones entre ambas comunidades se habrian demorado ms y tener ese primer contacto sera ms dificil rubius tambien es importante en esto
981,92752,vamoo si es stream cn rob
982,92753,nunca sigo ninguna serie de las de streamers y no porque no me interese solo no me acuerdo o me da pereza pero s me quiero ver el qsmp
983,92754,ya anuncien a otro participante
984,92755,s se nota que soy horangdan o no
985,92756,de momento 4 chicos karmaland en el qsmp
986,92757,ojooo puede ser stream con robleis
987,92758,imagina que les paga para hacer musica para el qsmp
988,92759,acabo de hacer la mejor inversin de mi vida
989,92760,marti decime que hiciste vlog del lolla y que sale carre cusnd ven a billie
990,92761,jasdkjasnk ayuda ya le puso hc a mi cubito
991,92762,el sbado es mi cumple y este wey sigue tieso
992,92763,cmo que jaiden estar en el qsmp este ser el macro crossover solo falta que metan a sad ist xd
993,92764,q bna es la birria diosito ojal comerla diario
994,92765,yo el da de mi graduacin yo maana en el lanzamiento de qsmp qsmp quackity quackityqsmp
995,92766,en un rato rob va a estar en el directo de carre
996,92767,jams me imagine que jaiden animation y vegetta777 estuvieran en un mismo lugar gracias por hacer eso posible qsmp tqm
997,92768,uy diosito me enteraba que vegetta va a estar en el qsmp despus de 6 horas
