,Id,Tweet
359,22033,compramos un cargador para la computadora y puedo jugar a los sims que feliz estoy hoy me quedo de noche jugando
360,22034,nisiquiera habia visto el video y ya sabia q iba a ser un louis de cartn sjkskajka
361,22035,tal vez si alguien oasiscoyoacan hubiera puesto organizacin desde un inicio y se hubieran informado que mexico es el pas con ms oyentes de louis casi nadie estara deshidratado y perdiendo sus lugares cuando llegaron a las 5 d la maana
362,22036,chin me siento gorda de nuevo
363,22037,lo que va a ser chicago en vivo yo quiero
364,22038,una fan durante una entrevista hoy en mxico le regal a louis un chaqueta vicka6
365,22039,neta necesito que ya salga louis necesito un boost de energa muy cabron
366,22040,louis te amo un chingo
367,22041,tengo la oreja roja quien esta hablando de mi
368,22042,a mi con billie me pas q pens haber visto carteles promocionando q vena en el movisar arena cuando fui a ver a louis tipo en esas pantallas largas pero nada q ver pq lo cancel
369,22043,en el hospital en internet esta de la pirula wn q rabia
370,22044,dios mo
371,22045,ay q triste estoy
372,22046,q u e o d i o
373,22047,faith in the future world tour ser increble me perd ltwt no puedo perderme este no soportara
374,22048,se me quiebra la voz con louis y me largo a llorar
375,22049,lloro de lo bonito y buena persona que es
376,22050,pusieron msica de louis y se calmaron jajdksjsjjs literalmente mi vida
377,22051,no soy fuere
378,22052,silencio doa
379,22053,l abraza con tanto amor
380,22054,lo qu pas hoy con louis es lo mismo qu pas el ao pasado con joana las empresas sin hacer un estudio del pblico al que dirigen su evento subestimando a dos personas talentosas a dos fandoms enormes y encima a fans mexicanas que sorry pero somos muy escandalosas
381,22055,extrao la poca en q coma twistos
382,22056,au larry el vecino molesto donde harry tiene un vecino que ya hace meses viene dejando olor a porro todo su departamento y un da va a reclamarle o donde louis tiene un vecino que siempre lo molesta con notitas para que deje de fumar
383,22057,yo tambin necesito un abrazo de louis
384,22058,como olvidar que cuando louis vino a argentina tuvo como ocho patovas cuidndolo y no pudimos estar ni a dos metros aaa hijo de puta tanto te ibas a hacer
385,22059,no quiero que comience la premiere de louis
386,22060,ya que louis saque fechas ya tuvieron tiempo para ahorrar ni modo
387,22061,q pedo la historia q se avientan con louis
388,22062,plsss se los doy en oasis ahorita quiero ver a louis
389,22063,me duele que louis este aqu y yo no lo pueda ver
390,22064,y eso q faltaron muchos en ir
391,22065,wey q coraje q esa influencer va a ir no dijo ni pio cuando louis vino al pepsi y ahora se la da de fan d louis no bye
392,22066,hey yo tmb quiero un abrazo de louis
393,22067,yo tambin necesito un abrazo de louis
394,22068,ay si louis se lo perdi
395,22069,necesitas un abrazo
396,22070,donde quiero estar donde estoy
397,22071,la mejor persona del mundo
398,22072,no aguanto ms esta tortura quiero abrazar a louis
399,22073,yo tambin necesito un abrazo louis
400,22074,el estadio azteca reclama a louis
401,22075,madre nunca te voy a perdonar no haberme llevado a una de mis nicas oportunidades de ver a a louis as de cerca
402,22076,noooo que vergenza pero bueno todo por louis
403,22077,louilith t das cuenta q ests shadeando a louis vrd
404,22078,no pido ms
405,22079,es humilde y fue increblemente paciente conmigo una vez que supo que yo era fan y no prensa me trat de la manera ms hermosa del mundo me deca que no me preocupara por entrevistarlo cuando mi voz se quebr me dijo ven aqu necesitas un abrazo y me abraz
406,22080,gracias dios
407,22081,louis amor te amo
408,22082,muchos emojis algo me dice que louis saldra solo
409,22083,jajajjajajajaja se calmaron cuando pusieron msica de louis el poder de este hombre hasta la paz te trae
410,22084,argentina tenia que ser
411,22085,45 minutos y louis seguro que va tarde yo me mato
412,22086,ta chau me voy a llorar
413,22087,me estoy matando de risa que en verdad les pusieron msica de louis y todo se calmo jdjsjajajaja el real louis me calma
414,22088,imagnate que louis tomlinson te vea as
415,22089,nooo ayuda voy a manifestar mis boletos
416,22090,en 2 das veo a louis llorooooo
417,22091,su carita su sonrisita es tan hermoso
418,22092,vos porque no tenes la copa jajajajajjajaja muchaaaaaachooos
419,22093,louis espero que el 22 aparezcas de sorpresa en chile en el cine donde ir a ver el documental
420,22094,louis trame ya las fechas para latam no ves que estamos desesperadas
421,22095,es el ms lindo diosmio
422,22096,imaginen que vas por un caf y de repente ves a un vergo de morras cantando como si estuvieran en un concierto mientras esperan a que llegue dios sabr quin louis obvi
423,22097,qu se siente vivir mi sueo
424,22098,voy a llorar por louis por dcima vez en el da
425,22099,jajajaja que hdp est harold
426,22100,louis hoy ms temprano con las ganadores del m amp g de claro
427,22101,es humilde tuvo una paciencia increble una vez que supo que era fan y no prensa me trat de la manera ms bella del mundo me repeta que no me preocupara por entrevistarlo fue la persona ms amable cuando se me quebr la voz dijo ven aqu necesitas un abrazo y me abraz
428,22102,no se preocupen ya lo resolvi
429,22103,informacin sobre la premiere de allofthosevoices en ciudad de mxico proporcionada por cinepolis se dice que el cine proyectar allofthosevoices en sus 8 salas
430,22104,quiero ver a louis necesito ver a louis
431,22105,que ganas de estar en la premier del documental de louis en cdmx
432,22106,mi prima gano para ir a la avant premiere de louis por lo tanto yo ir
433,22107,yo quiero uno louis xfavor
434,22108,cinpolis despus de entrar en pnico por todo el relajo que se arm en las vallas y tranquilizar a la gente para que al final se tranquilizaran con canciones de louis
435,22109,sisi como anto en diosa nica bonita
436,22110,louis tomlinson la sala dos est solita mi vida ven a visitarnos
437,22111,cuando la voz de la fan se quedr louis le dijo ven aqu necesitas un abrazo y la abraz es un ngel
438,22112,noooooo es demasiado tierno basta
439,22113,outfit de todas las louies que no estn en la premier de all of those voices
440,22114,no puedo creeerrrrrr que aurora estubo en arg en el lolla y yo no la pide escuchar
441,22115,yo quiero que louis me de un abrazo
442,22116,no cortes el live amigaaa
443,22117,dejaron solo 3 sillas entonces nomas son charlie louis y el entrevistador
444,22118,que triste es estar en mi casa y no con louis en la premier alloffthosevoices
445,22119,mi vida eres precioso
446,22120,ya llegaron louis y charlie que bendicin
447,22121,se filtra louis llegando a la red carpet
448,22122,yo esperando a que louis llegue a la premier
449,22123,ya amigas ya todo esta bajo control gracias a la msica de louis
450,22124,lo amo mucho
451,22125,voy a llorar
452,22126,no se como lo hace pero axo siempre se acaba llevando el dinero sjdjsj
453,22127,cuando hemos pasado por delante de mi trabajo me han hecho sentir como si fuera la persona ms exitosa del mundo amo mucho a mis amigos
454,22128,cuando sera mi turno de abrazar a louis
455,22129,excelente sr asambleista villavicencio a pesar de todo siempre con mucho respeto sigue con recomendaciones comentarios sugerencias al gobierno y sus ministros poner atencion no dejen se siga manchando el nombre de todos uds autoridades designadas saludos y bendiciones
456,22130,cuando sigo yo
457,22131,yo tambin quiero una foto con louis
458,22132,louis tomlinson no puedes ser as de lindo
459,22133,te juro q nadie te merece louis eres el ser ms lindo te amo mucho ven a darme un abrazo tambin q necesito
460,22134,la pregunta del millon es por donde hptas va a entrar louis si esa vaina esta mas llena que concierto de taylor swift todo el mundo debe estar asi
461,22135,louis est viendo que convirtieron la plaza en un concierto me dan ganas de llorar ves la influencia que tienes
462,22136,una que necesita escuchar a louis ahora mismo o le va a dar algo
463,22137,louis evangelizndonos con su voz
464,22138,as louis la pudo pisado la nica q estar mal ser ella mi louis nunca hace nada mal
465,22139,yo tambien quiero que louis me de un abrazo
466,22140,pedro carreo el diputado louis vuitton para cuando atrapan a este est mansin dnde vive tambin la compro vendiendo avon
467,22141,voy a ir a ver la peli de louis con resaca si me ven durmiendo pguenme un cachetazo
468,22142,quiero tomarme un segundo para agradecer a lxs fans que se toman el trabajo de hacer lives hoy dicho eso latam s que podes ser desastroso y te sigo queriendo pero prtense bien por favor por louis y para que todxs puedan disfrutar no nos hagan quedar mal dale loco
469,22143,mexas ustedes son el clich ms raro que he escuchado en mi vida pero nos alegra y nos tranquiliza saber que la situacin ha mejorado que viva la msica de louis tomlinson
470,22144,la versin animada de disney de el libro de la selva es de tal calidad que en su formato original se us la voz del louis prima para el papel de rey louie no debi ser fcil un doblaje similar de la cancin quiero ser como tu y el resultado es increble 1967 56 aos atrs
471,22145,diosmio ya quiero ver las fotos de louis en la alfombraaaaaaaa
472,22146,obvio la vida se me solucionara con un abrazo de louis
473,22147,un 20 de marzo de 18208 nace el escultor louis sussmann hellborn
474,22148,los de seguridad viendo que las fans se calmaron con las rolitas de louis y ahora actan como si nada despus de armar un santo desmadre y desdesmadreada no hay
475,22149,ya que dalga louis weeeey
476,22150,wey la cara rojsima de la muchacha no mames
477,22151,vieron que louis calma a todos
478,22152,a quien mierda le tengo que vender mi alma para que louis me de un abrazo
479,22153,que louis te diga come here you need a hug yo me rompo ah mismo
480,22154,el jueves vamos con valen a ver el docu de louis estoy emocionada sinceramente
481,22155,esa era la solucin
482,22156,lo amo es el mejor
483,22157,mi vidaa
484,22158,louis sosteniendo una chaqueta vque le regal un fan durante el m amp g de hoy en la ciudad de mxico vicka6
485,22159,alguien que le corte el pito a este perro por dios
486,22160,louis calma a todos
487,22161,hermanas paraguayas asuncin tengo una entrada de ms para el documental de louis pero para el sbado a las 16 h por si alguien quiera
488,22162,yo yo yo quiero un abrazo y que me digas q todo va a estar bien
489,22163,estoy re nerviosa amigas y ni estoy ah
490,22164,escuchar a louis mientras veo foto de l con fans duele y duele mucho
491,22165,y por eso debi hacer la alfombra roja aqu
492,22166,esta premiere me est dando mucha ansiedad que ya se acabe
493,22167,mi pregunta es por dnde carajo va a entrar louis miedo espero que estas loquitas se controlen
494,22168,no entiendo por donde entrar louis
495,22169,louis est en mexico y maana no cruzar a chile
496,22170,yo tambin necesito un abrazo louis
497,22171,pens que no iba a llorar pero cmo no voy a llorar sabiendo que louis es la persona ms linda con sus fans
498,22172,quien dijo yo
499,22173,yo louis yo quiero
500,22174,tal cuallll louis veni a argentina y djame gritar eso
501,22175,estoy llorando te amo louis y te odio por no hacer estas cosas ac
502,22176,y a mi k que estn conociendo a louis y puedan hablar con l y y q lo puedan abrazar
503,22177,no estoy bien
504,22178,ya se que hacer para cuando vaya a ver a louis en concierto har un gafete falso de ser reportera y poder pasar hasta adelante
505,22179,como que louis ta va salir
506,22180,kiero ser linda
507,22181,soy llanto
508,22182,hasta ka madre de ser espectadora
509,22183,me quiero matar
510,22184,vola o en el g5 esto e louis v no levi s hey duro en espaa como ibai tomando titane como capitn levi wuh yo tengo esa grasa ribeye no los veo denzel libro e eli no yo ando winchester dy skrrt no confo en nadie solo en mi mai yeah tengo a biden en la mueca
511,22185,no hay persona ms dulce que louis
512,22186,es tan bueno porfavor lo amo tanto louis te mereces todo
513,22187,haganle caso al chico ese q habla dale
514,22188,come here you need a hug estoy rota yo tambin necesito un abrazo louis
515,22189,tu estss llorando yo no estoy llorando
516,22190,quiero conocer a louis
517,22191,no me puedo morir antes de ver a louis en vivo
518,22192,a qu hora empieza
519,22193,louis ti amo
520,22194,me meo es buensimo ajajajajajjaja
521,22195,tocara verlo justo ese dia y en el mismo lugar a donde vi a louis en concierto x primera vez el ao pasado premio o castigo
522,22196,louis es el ser humano ms lindo de todo el planeta
523,22197,es que no me lo puedo creer kakfkkakslsl
524,22198,estamos a 20 minutos de que llegue louis
525,22199,tengo una boleta libre para el documental de louis para el jueves a las 7 pm en atlantis por si alguien le interesa foto de lou para no morir ignorada
526,22200,louis ya lanza fechas
527,22201,literal algo hiciste mal t louis es la persona ms linda del mundo t debiste haber preguntado un tontera con la que le faltaste al respeto pero louis es un hermoso ser humano
528,22202,ya no cabe nadie ms en oasis coyoacn por la premiere de la pelcula de louis tomlinson louistomlinsonth2023 apenas hoy me enter de l pero se ve que sus fans andan con todo buen ambiente familiar
529,22203,tan lindo va a ser dios como lo amo
530,22204,no me entra ms amor en el cuerpo para este hombre
531,22205,venganse louis anda repartiendo abrazos allofthosevoices
532,22206,me di cuenta de que si abrazo a louis no va a apoyar su cintura contra la mia me quiero morir yo quiero que l sea parte de mi pegar todo mi cuerpo y alma a l
533,22207,weyes cmo va a entrar louis desde arriba de un helicptero o k pdo allofthosevoices
534,22208,me estoy yendo a dormir absolutamente si
535,22209,estoy destruida
536,22210,te amo niall estoy tan orgullosa de ti mi cielo
537,22211,les salen muy a la ligera este tipo de insultos bola de estupidas se creen muy superiores pero hay algo nuestro que jams van a tener y es el amor que louis le tiene a mxico
538,22212,toda la tarde weando con q no se controlaban y al final era wea de colocar las canciones d louis noma
539,22213,q bonito
540,22214,quiero regresar el tiempo y haber comprado ese pto boleto de camin en ves de sobrepensarlo como todo lo q hago
541,22215,para aclarar rumores es mi novia la que conoci a louis
542,22216,louis con campers d jean mo
543,22217,ms de louis conociendo a una fan vicka6
544,22218,jsajjajajajajajjaj el verdadero poder de la msica de louis
545,22219,cual convention louis tomlinson esta en mxico su pas favorito
546,22220,en 20 minutos vemos a louis en traje de vueltaaa
547,22221,ustedes tambin se arreglaron para la premier estando en su casa a kilmetros de louis o les falta esquizofrenia
548,22222,hijas d la verga les voy a hacer burla por esto toda la vida
549,22223,igual quemi
550,22224,send fuerzas para ser amable y decirle a la doa que est al lado de mi que me est empujado con su trasero y que me de mi espaciooooo quiero ver a louis en la alfombra por favooooor alloffthosevoices
551,22225,x algo louis hizo la premiere en mx es una locura
552,22226,escchame louis estoy lista para cantar esto a todo pulmn en tour ya dame las fechas por favor
553,22227,louis es la mejor personita en el mundo
554,22228,que da de mrd
555,22229,es que no puedo
556,22230,q vergenza
557,22231,louis con la fan ganadora para la entrevista junto a masquecinelatam vicka6
558,22232,a qu hora empieza la premier
559,22233,estoy llorando mucho
560,22234,feliz da de la felicidad a louis porque es el nico que me hace feliz de verdad
561,22235,acabo de ver un tiktok que dice que louis va a llorar en el documental y ya ando sufriendo
562,22236,eh no mamen voy a ir al cine a la hira aue louis sale lpm
563,22237,cuando va a ser mi turno una sola cosa te pido dios
564,22238,pruebas de que la msica de louis nos da paz
565,22239,no te lo puedo creer de verdad jajjdkskdkk
566,22240,me desgarre la garganta
567,22241,me los imagino todos desesperados intentando encontrar una forma de calmarlas y con msica se quedaron bien quietas jajajajajajaha
568,22242,mi cancin
569,22243,imaginense hablar con louis yo no vivo para contarlo
570,22244,amo como las fans se calmaron en el momento en que pusieron msica de louis lit lo nico que nos controla
571,22245,la neta lo amo mucho
572,22246,y el vergo de gente que todava falta por ejemplo yo
573,22247,se supone que como en 20 sale louis
574,22248,es que el es un ser muy bello me urge conocerlo
575,22249,esa deb de ser yo
576,22250,wey vete a la cola jjdjajajajak
577,22251,con esto se prueba que louis no hace las cosas de casualidad allofthosevoices
578,22252,q envidia a las nias q hoy conocieron a louis
579,22253,ay me encanta que linda campera
580,22254,hahajsja pusieron msica de louis y todas ya se calmaron
581,22255,alguien q sea d quilmes y este necesitando o quiera una entrada para el documental de louis el 25 3 a las 17 me avisa que tengo una dems
582,22256,12 louis con una fan durante el m amp g de hoy en la ciudad de mxico vicka6
583,22257,la cantidad de gente en la alfombra pero el panadero gt gt gt
584,22258,desde el interior allofthosevoices louis tomlinson en cdmx
585,22259,louis recibiendo un regalo de una fan hoy
586,22260,holii me siento sper mal ya estaba muy cerca de la alfombra roja pero me empez a faltar el aire me mare horrible y acabo de vomitar me siento muy mal yo si quera ver a lou
587,22261,oye estoy pensando la chica del space me dijo que deje el bardo y que haga stream como si no estuviera escuchando a louis todo el da
588,22262,alguien que sepa si van a hacer transmisin en vivo de la alfombra roja louistomlinson alloffthosevoices louis
589,22263,el vato idolatra dms a adrin marcelo acabo de decir q l y su opinin me da igual porq ambos son repugnantes y me dice verdad que si
590,22264,ahora tengo una mutual q tiene en el nombre no voy a ver a louis pero viva mxico hermana nunca tan yo
591,22265,da h4rry sos ms obvio que yo cuando me dicen mira disimuladamente y gir el cuello como el exorcista
592,22266,se nota q es como de esas entrevistadoras que le gusta el amarillismo pero con louis no mi reina
593,22267,muy celosa estooooy
594,22268,la presin que tengo de llegar a tiempoooo aydame diosito
595,22269,y maana viene aurora
596,22270,le plomeo la casa a la q no me devuelva follow
597,22271,yo tambien quiero un abrazo de louis
598,22272,basta no puedo seguir con esto llamado no gritar esa parte de chicago junto a louis
599,22273,se acaban de confundir el logo de louis vuitton con el de yves saint laurent me est agarrando un
600,22274,de hecho ellas deberan de estar en primera fila vindolo en vivo no desde una pantalla
601,22275,me toca me toca
602,22276,id wkemqisba mi cosita preciosa es un amor lo que te amo louisssss
603,22277,yo aguant
604,22278,no dios podra llorar enserio
605,22279,la carita de felicidad de ender contndonos lo de la premiere
606,22280,louis hoy con una fan en mxico vicka6
607,22281,estaba llorando y me sale esto baksiaiaiakakaksiwuqajjajaajjajaja
608,22282,oasis no va a aguantar el poder de louis tomlinson
609,22283,dios de mi vida es el hombre ms bello del mundo
610,22284,come here you need a hug estoy muy mal no me toquen
611,22285,a tus favs q no los haban acusado de plagiar a louis
612,22286,a q hora se supone q llega louis a la premier
613,22287,hermanas creo que yo no conoc a louis todava porque el universo sabe que si lo llego a conocer lo abrazo y no lo suelto nunca ms
614,22288,quin es ese lindo que atrae un chingo de gente para que me lo presenten
615,22289,noooo que bonitooo
616,22290,mi louis es el ms lindo lo amooo
617,22291,estoy harta de no vivir en cdmx
618,22292,a mi louis me ofrece un abrazo y no le suelto
619,22293,como lo abraza de la cintura
620,22294,la polet es deliciosa carisma pero deliciosa
621,22295,la gilipollas de atrs diciendo empujen empujen y los guardias dando todo de si mismos para que pibitas ests no tiren las vallas despus de que louis dijera que ama vuestro pas me parece una falta de respeto enorme la forma de comportaros parecis cras as lo nico que
622,22296,yo tambin quiero un abrazo de louis
623,22297,si yo conociera a louis renaceria como humana nunca volveria a tener ni un solo problema hasta lo bonito d la vida y el calor de verano veria
624,22298,las mexicanas somos las favoritas de louis y las que lo escuchamos ms y soporten
625,22299,una chica cont su experiencia conociendo entrevistando a louis y en su descripcin puso que louis la vi muy nerviosa y l le dijo ven para ac necesitas un abrazo
626,22300,bastaaaaaa jsjajjajajajjajajajjaja
627,22301,lina me trajo una camiseta de inglaterra un puto vaso del camp nou y un llavero la amo
628,22302,viejo idiota y el quien es o que
629,22303,te amo tanto louis
630,22304,louis yo tambin necesito un abrazo tuyo
631,22305,lo abraz se abrazaron hicieron fuck you juntos y habl con l esta chica gan todo en la vida
632,22306,literal estoy llorando pq larry nunca se va a confirmar al 100 por ellos y me da mucha tristeza
633,22307,hermanas la cinturaaaa
634,22308,entonces a que hora es lo de louis
635,22309,mi capacitadora ilusionada porque el problema con mi usuario est por arreglarse yo no queriendo que se arregle porque eso significa que no podr ir a ver a louis o sea que debo trabajar esos das de 2pm a 11pm
636,22310,louis con una fan que tuvo la oportunidad de entrevistarlo el da de hoy allofthosevoices vicka6
637,22311,y luego tenemos a harry
638,22312,louis sosteniendo una chaqueta vaquera que le regal un fan durante una entrevista hoy en la ciudad de mxico vicka6
639,22313,yo tambin quiero abrazar a louis d la cintura y q l m abrace
640,22314,yo viendo las fotos de las fans que estn en la alfombra roja de allofthosevoices esperando a louis
641,22315,q nervios ya casi es la hora
642,22316,quiero llorar porque no ver a louis
643,22317,le cont a mi mam y mi abuela a toda la gente k me encontr hoy y se estn riendo de mi
644,22318,basta quiero ver a louis
645,22319,no me equivoqu con harry y louis en serio son lo mejor que le pas al mundo no pongo las manos en el fuego por nadie pero por ellos me hago cenizas
646,22320,los fans cantando chicago durante la alfombra roja de allofthosevoices
647,22321,lo que no saben es que louis se teletransporta y entonces as va a llegar a la alfombra roja allofthosevoicesmexico
648,22322,yo necesito vivir eso con louis enfrente de mi y lxs louies
649,22323,si yo quiero ser esa mujer
650,22324,louis te mega amo alch es una persona super increble dios
651,22325,tengo que aprender a decir las cosas de otra manera que parece que siempre estoy enfadada
652,22326,wow que lindo yo era que me pas
653,22327,y a mi qu me importa que hayan fans conociendo a louis y yo no soy una de ellas me quiero suicidarrrrrrr
654,22328,dios mio mi amor te amo estoyltowodno louis xidosbosndiqmsismqosnwiqm
655,22329,lo que sufro con todo lo que le pasa al pobre de louis en suits
656,22330,si digo lo que pienso me funan
657,22331,me duele la cabeza
658,22332,ya no vi louis
659,22333,yo quiero diosmio
660,22334,ahhhhh me voy a tatuar estoooo
661,22335,no mamen jajjajajajajja
662,22336,que calorrr
663,22337,cuqndo sale louis
664,22338,se siente ver padre ver las cuentas de updates y saber que yo estoy ah
665,22339,yo solo quiero estar ah y no haciendo tarea en mi casa
666,22340,tatuajes patrocinados por to cinepolis ya reglame las entradas tambin para ver a louis tomlinson alloffthosevoices alloffthosevoicesmexico
667,22341,estoy llorando
668,22342,louis de el au de moda ve esto y se muere de literalmente
669,22343,y yo m di cuenta lo mucho que necesito conocer y abrazar a lou
670,22344,en agosto yo se
671,22345,todas gritamos en esa parte jaksjsk listas para el tour louis saca las fechas
672,22346,louis esta retrasando la prwmiee 30 minutos gente trancas
673,22347,que me costaba ser esa mujer xidos me queiro morir louis abrazame mo vida pesa
674,22348,wey que mala onda lo que est pasando en cinpolis lou ni se merece que cancelen el evento solo por la psima organizacin del staff por creer q a louis lo conoce 10 gentes pero tambin las fans que no se saben comportar y creen que es un concierto l viene muy emocionado
675,22349,la msica de louis tomlinson no slo es arte tambin detiene desmadres
676,22350,te perdon todo hasta te perdonara una infidelidad
677,22351,q bonito quiero ser ella
678,22352,jean louis ernest meissonier el final del juego de cartas 1865
679,22353,no abracen a louis por fa me dan celos
680,22354,extrao a louis devulvanme al 16 05
681,22355,yo digo que louis va a entrar volando en la nave de los little einsteins
682,22356,la concha de mi puta madre yo tambin quiero conocer a louis
683,22357,que vergenza con louis
684,22358,lo amo tanto esto es hermoso
685,22359,las mexicanas haciendo desmadre casi todo medio da nada ms pusieron la msica de louis y todas se calmaron jajajaja soy este
686,22360,tengo pnico por el momento en el que louis salga y empiecen a empujar
687,22361,buensimo komar y broun
688,22362,como a los bebs cuando les cantas para que se calmen
689,22363,louis vente yo te invito a una gallo
690,22364,lo amo tantoooo
691,22365,es que si as se escucha en un lugar abierto y con unas cuantas louies no me imagino como ser en un lugar con ms capacidad ya lanza las fechas louis xfavor
692,22366,yo hoy voy a fingir demencia solo quiero ver a louis en traje al menos en una foto y me retiro para no llorar
693,22367,ojal que louis se entere de esto y sepa el impacto positivo que tiene su msica en los dems
694,22368,ms de louis en el m amp g allofthosevoices
695,22369,me voy a dormir si dios quiere louis estar sano y salvo cuando me despierte o eso espero
696,22370,q risa los d seguridad intento x horas calmarla para q solo necesitaran a louis para estn en paz
697,22371,no puedo dejar de llorar
698,22372,jajajjajajajjajajajjajajajajjajajajja
699,22373,louis durante la entrevista con la fan ganadora de la dinmica con cinpolis allofthosevoices vicka6
