,Id,Tweet
439,3621,le ese dato ampla la imagen se encontr un zircn de 3446 millones de aos en cachi salta no me repongo todo esto y en el libro geologa calchaqu de ricardo alonso descubr cmo se form la tierra de los vinos de altura apasionante
440,3622,ahora mismo no s si llamarlo newton a ramonchu
441,3623,victoria alonso exits marvel studios via youtube
442,3624,hoy en lunesdereceta te traemos unas deliciosas legumbres en su jugo rinde para 5 porciones por lucas alonso haztevegana haztevegano lunesdereceta plantbased plantbasedreceipe
443,3625,dira que es la pregunta ms difcil que me han hecho en la vida
444,3626,a ver a ver qu pas con mi amiga victoria alonso yo soy amigo de ella pero ella no lo sabe
445,3627,200 000 000 de todos para intentar ganar las elecciones psoe again
446,3628,hoy no debera entrar nadie simplemente no debera haber programa debera haber explicaciones y responsables gh23
447,3629,nadie haba unido tanto espaa desde el mundial de sudfrica como lo est haciendo alonso ahora es que jajajajajaj
448,3630,pues que se lo digan a la fom ayer se enfoc ms durante la carrera a lando norris peleando por una p16 que a fernando alonso
449,3631,de regreso a casa felicidades campeones teamasere cuba
450,3632,oye que yo pensaba que deca la pantallita del volante si hombre fernando alonso est loqusimo
451,3633,si es un abusador mal dicho cliente de personas en situacin de explotacin por trata de personas y abuso de cualquier tipo es parte de la banda de la operacin y sobre todo generador de estas situaciones ah si y un hijo de puta noalatrata
452,3634,naomi formula1 fernando alonso leclerc carlos sainz jr max verstappen checo perez hamilton antonellavettel ferrari red bull steam mclaren league of legend otaku andaluca yo soy mas de cupra de ternura o con cupra aston martin sampaoli
453,3635,el idrd lamenta el fallecimiento de moiss alonso deportista paralmpico de rugby en silla de ruedas del equipobogot enviamos a sus familiares un abrazo de solidaridad y apoyo en este difcil momento foto idrd anndresrot
454,3636,jajaja ojala todos tengan una isa aiello en sus vidas
455,3637,por qu la fia ha devuelto el podio a alonso por luciap34 va libertaddigital
456,3638,hablamos de alonso y de fia formula1 nuevo video segun chatgpt pasaros y me explicais algo
457,3639,haciendo compaa a alonso
458,3640,no es desinters es que yo si tengo cosas q hacer
459,3641,me encanta como desde el principio ya tiene el pelo mojado es que te amo scorsese
460,3642,fernando alonso y sus penalizaciones
461,3643,yo saliendo del cine y enterndome lo de victoria alonso
462,3644,el indi llega a los a los indgenas de mariano roque alonso y luque en el marco de la elaboracin del plan de ordenamiento urbano y territorial seguir leyendo
463,3645,la argentina victoria alonso deja marvel studios luego de 17 aos
464,3646,victoria alonso se trataba de la nica productora de origen argentino presente en marvel studios aun as su carrera ir por otro rumbo
465,3647,legend of the galactic heroes es el mejor anime de la historia
466,3648,san jos y el nio talla de la escuela granadina obra de alonso cano procedente del convento del ngel custodio de la calle san antn de granada actualmente en el museo de bellas artes de granada
467,3649,ahora si que ya com puedo decir mi sueo soe que un pinche tigre me persegua bien enojado y me quera chingar y yo no saba ni como lo esquivaba y me trepaba en chingaderas hasta que llego la poli y lo durmieron alv
468,3650,antonella alonso es demasiado sexy de verdad es muy bella y todo pero siempre repitiendo que quiere que se la cojan que nunca lo hacen que no s qu est como repetida deseo y manifiesto para ella un hombre que de pana cumpla todas sus fantasas
469,3651,nueva solicitud de indulto de condenado del estallido informe revela mal comportamiento y liderazgo negativo inoticiascl nacional meganoticias chile alonso josh tyler drake sergiroberto geniusdancerhyunjin monsalve
470,3652,vendo el sueo de mi desvelo de antoni daimiel en wallapop
471,3653,fernando alonso 100
472,3654,mximas de hasta 36 c en los primeros das de otoo emiten advertencia para siete regiones por altas temperaturas inoticiascl nacional meganoticias chile alonso josh tyler drake sergiroberto geniusdancerhyunjin m
473,3655,alonso corriendo en arabia saud mientras se juega el getafe sevilla alo segundo del getafe ufff lo del sevilla pinta feo ingeniero concntrate en la carrera fernando ya lo vers resumido guarda el mvil
474,3656,este ao se vuelve a terapia indiscutiblemente
475,3657,los hombres se dividen en 4 personalidades porros y chandals por debajo del culo coches fernando alonso f1 motos lol elden ring god of war resident evil lil peep rojuu pelo largo y teido que les cubra toda la cara y comprar cadenas en ferreterias y ponerselas
476,3658,si echan al a angeloti y no viene mou xabi alonso as sin pan ni na
477,3659,fernando alonso y su capacidad para mirar las pantallas de jeddah mientras conduce a 300 kilmetros por hora qu ferrari ha parado dazn news espaa
478,3660,esta joyita es una de mis preferidas de bob dylan la compuso en 1965 fue xito internacional y a lo largo del tiempo la versionarian jimi hendrix the wailers rolling stones m clan y en espaol el grupo mam
479,3661,los 100 podios de alonso por equipos renault 41 mclaren 12 ferrari 44 alpine 1 aston martin 2
480,3662,bancochile wow que coincidencia que fueron a buscar la hz fuerte reaccin en los imbalances superior e inferior
481,3663,robo s ante la parsimoniosa inaccin teatral del histrin pacocuenca y su compaa de teatro psoegranada y con la otra empresa teatral vallisoletana la de ppgranada
482,3664,ahora 40 votos afirmativos en 46 le dan el aval a hctor del campo como representante del ftbol profesional propuesto a integrar el ejecutivo de auf ahora es ignacio alonso el que debe presentar la plancha correspondiente para tener la venia del congreso sport890
483,3665,los alonsistas encontris cualquier cosa suya y no de los dems y no no es desprecio a alonso ni mucho menos
484,3666,parece que la salida de victoria alonso de marvel studios se debe a que su comportamiento con los equipos de vfx era muy agresivo y cre mala relacin con ellos
485,3667,no olvidar que victoria alonso dijo qu se retire en santa paz no le recriminen ms nada que ha de ser conciente de lo que hizo
486,3668,ayer me dice mi mam que ve la carrera por cachitos en repeticin cuando sabe que gan el checo o similar y me dice oye es alonso ya es grande no si mami tiene 20 aos corriendo
487,3669,la respuesta de fernando alonso a mercedes que ha roto las redes sociales
488,3670,fantstica serie de entrevistas y anlisis en thesherwoodway sobre la nueva ley de cooperacin espaola esta de jos a alonso por ejemplo
489,3671,busco pareja requisitos que le gusten los coches
490,3672,tlam la argentina victoria alonso deja marvel studios luego de 17 aos
491,3673,victoria alonso deja marvel despus de 17 aos sin motivo aparente regstrategratis
492,3674,hoy en 1999 kiss me de sixpence none the richer saltaba del puesto 14 al 7 para conseguir su primer top 10 la cancin apareci en series y pelculas como she s all that not another teen movie how to lose a guy in 10 days be cool dawson s creek daria y the real world
493,3675,yo cansado fernando alonso padreando lola lolita fumando en un bar los del cartel do son do camio
494,3676,a no ser que salga espontneamente de tu corazn y de tu mente y de tu boca y de tus tripas no lo hagas
495,3677,fernando alonso hola
496,3678,ahora usuarios de la red social patria twitter denuncia que varios meses se a presentado un problema con el conteo de los retui tuit ya que algunos no le llegan los logros y algunos le llegan el logro mas bajo despus de haber trabajado una semana intensa ahora los usuar
497,3679,ya le este manga muchas veces deberas leerlo 3danimation mangacoloring comicbooks
498,3680,la argentina victoria alonso se fue de marvel donde tena un rol de peso
499,3681,se siente raro estar sin aldo y alex jaja
500,3682,vavava buenisima esta ahora slo tenis que cambiar la tartana que habis hecho
501,3683,va ser un placer ver a corleone una vez mas
502,3684,la productora ejecutiva de marvel la argentina victoriaalonso ha abandonado por sorpresa la compaa no queda claro si ha sido renuncia o despido victoria alonso llevaba en marvelstudios desde 2008 y haba trabajado en casi todas las pelculas del mcu hasta la fecha
503,3685,vaya leo
504,3686,antes de eso hay una antideportiva que son tiros y posesin a falta de 6 segundos pero bueno cada uno cuenta la feria segn le va en ella
505,3687,oye no es por nada pero esta cuenta llevar 2 aos a fuego y todava no tengo ni 100 seguidores considero que tengo opiniones ms objetivas y fuertes que muchos de aqu he visto a gente que se sacaba una foto con la camiseta de alonso y sin pantalones sigo
506,3688,the race ha vuelto a puntuar a los pilotos y esta vez ordenan del 1 al 20 de mejor a peor rendimiento ponen a alonso 5 por la sancin y no mejorar en q3 por detrs de leclerc y russell saquen sus propias conclusiones
507,3689,granada se lleva migajas comparada con la voraz sevilla
508,3690,buen consejo
509,3691,en pa182 parada 2 m santa luca muchos pasajeros suben sin validar en el bus evasin falta zona paga red movilidad
510,3692,cristina porta pierde la decencia ibero show
511,3693,que guapo es alejandro xdios vente conmigo yo te har feliz laisladelastentaciones9
512,3694,si es por conocer jugadores yo hubiese llamado a la seleccin a araya cloa fernndez ind del valle villagra u esp vsquez mag roco hua marcelo morales u altamirano hua avils racing assadi u cuevas uc fuentes ai hubiese dejado fuera en esta pasada a
513,3695,genial mi tiktok ha mutado de fornite y gatos a alonso y gatos
514,3696,es una puta locura de piloto fernando alonso disfrutemos del ms grande
515,3697,jajaja para m fue un gran chiste
516,3698,alonso es la luz en este mundo de tinieblas y oscurantismo proverbioalonsista
517,3699,los verdaderos mafias
518,3700,alonso es mi pastor con el nada me falta
519,3701,ostia en shock con lo de victoria alonso mala vibra me da
520,3702,mi padre midiendo una camiseta pap que haces me voy a comprar la camiseta de fernando alonso china
521,3703,victoria alonso mano derecha de kevin feige junto a louis d esposito ha abandonado marvel studios se desconocen los motivos de por qu ha abandonado el estudio marvelstudios
522,3704,la ministra estelaediaz junto a la secretaria de inclusin de mdsnacion laura alonso y a la directora daniela castro firmaron la renovacin del convenio de tarjetas alimentarias para personas travestis y trans en situacin de vulnerabilidad de la provincia
523,3705,tengo flojerisima de hacer gym hoy y no indoor pero pues ni modo toca papito
524,3706,lugar de la emergencia llanquihue avenida alonso de ercilla
525,3707,emergencia 19 05 10 1 1 fuego en vehiculo menor llanquihue avenida alonso de ercilla b4
526,3708,nueva clase magistral de fernando alonso a manos de su astonmartinf1 ayer se convirti en el 6 piloto de la historia con 100 o ms podios en el mundial de f1 1 hamilton 191 2 schumacher 155 3 vettel 122 4 prost 106 5 raikkonen 103 6 alonso 100
527,3709,lo hice destru al patriarcado
528,3710,un dato que considero relevante tras dos carreras alonso 30 puntos alpine 8 puntos
529,3711,por alonso morira y matara si fuera necesario
530,3712,victoria alonso quin es la alta ejecutiva que habra abandonado marvel studios
531,3713,como se va a ir victoria alonso de marvel mds es la peor noticia q me podran haber dado
532,3714,fi fernando alonso cumple la primera mision podio 100 y ahora a por la 33 y tercer mundial
533,3715,por favor xabi alonso y gracias
534,3716,fernando alonso despus del podio de bahrein
535,3717,como que victoria alonso se va de marvel
536,3718,fia pretende clarificar su reglamento antes del gran premio de australia luego de lo sucedido con fernando alonso en arabia saudita el espaol pas de festejar en el podio a ser relegado al cuarto puesto y luego volver a su tercera posicin
537,3719,a ver pablo que te veo molesto te explico arabia lo ms emocionante q tuvo fue la salida en la que alonso se puso p1 poco ms y en barin es quien estaba fuera de posicin y adelant a todo rival directo que tuvo e hizo uno de sus mejores adelantamientos a ham
538,3720,de sapo me puse a revisar el album del mundial de sudfica y corea del norte fue qued
539,3721,felizlunes yoonsanha saudiarabiangp dainternacionaldelafelicidad chivas zcalo verstappen alonso jisoo concept poster
540,3722,mi objetivo diario es no morir
541,3723,que pollas hace saviola con fernando alonso
542,3724,en el tren alguien est est escuchando what makes you beautiful
543,3725,cmo bo amante do bo cine espero con impaciencia a pelcula na que un oso enfarlopado mata pea
544,3726,la fia quiere clarificar su reglamento tras el lo con alonso en yed
545,3727,los iluminados que se alegran de la marcha de victoria alonso porque as se acabar lo woke les esperan disgustos xd
546,3728,mi gran amor acaso vendr a argentina de nuevo
547,3729,alguien sabe de programacin
548,3730,captulo 1 cazando tormentas navarrete va riojatormentas jaimeldome
549,3731,felizlunes yoonsanha saudiarabiangp dainternacionaldelafelicidad chivas zcalo verstappen alonso jisoo concept poster
550,3732,lomsledo explicado el calvario que sufri fernando alonso por culpa de la fia para obtener el centenario en la f1
551,3733,champa fue demoledor en el clsico champagnat abri la temporada con un triunfo de 50 23 sobre deportiva francesa en el predio de estancias alonso boto 4 y baca castex 3 fueron los trymen de la jornada
552,3734,felizlunes yoonsanha saudiarabiangp dainternacionaldelafelicidad chivas zcalo verstappen alonso jisoo concept poster
553,3735,alonso martnez a demostrar en la seleccin nacional su buen momento en europa
554,3736,no olvidemos que victoria alonso fue quin luch por proyectos como captain marvel black widow y ms marvel pueden gustar o no dichos proyectos pero es innegable que ella era una de las mentes maestras que hicieron grande al ucm te extraaremos vicky
555,3737,victoria alonso has durado 2 telediarios bien como me gusta
556,3738,jesucristo obeso os dice que la redencin empieza por quemar coches como en tui dani82908991 3 16 libro sagrado de montedegramo
557,3739,los liberales estn disfrazados los verdaderos cristianos no usan mscara
558,3740,la salida de victoria alonso es un golazo para marvel vengan de a uno
559,3741,top 10 tendencias de twitter en mxico dainternacionaldelafelicidad none primavera none vamos mxico none clashroyaleconreb none qsmp 70645 felizlunes 22851 japn 29200 geraldine 21002 puentegrancanal none victoria alonso none
560,3742,ftbol alejandro balde rescata ese carcter ofensivo y vuelve a poner en un buen sitio a la masia como fuente de talentos del barca anteriormente en su posicin estaban jordi alba y marcos alonso el hispano se gan la confianza de xavi hernndez
561,3743,porsiteloperdiste un equipo totalmente comprometido y muy inteligente dentro y fuera de la pista as se gest la recuperacin del podio 100 de fernando alonso en el saudiarabiangp de f1
562,3744,hay una d 23 q esta bn preciosa pero m da miedo q m robe
563,3745,el mundo de tupac caliban la argentina victoria alonso deja marvel studios luego de 17 aos
564,3746,gracias magic alonso por hacer que deje de estar triste
565,3747,no tenemos derecho a descansar mientras falte un voto q conquistar ese tiene q ser nuestro estilo para obtener no una simple victoria sino una enrgica y contundente un s por cuba por la patria y por la revolucin que resuene en todos los rincones del mundo latiravileo
566,3748,por favor no digas nada de fernando alonso te lo pido
567,3749,alonso por detrs de russell y leclerc
568,3750,cuba teamasere para mi son sper campeones
569,3751,yolanda daz teletubbie comunista un biquio primavera felizmartesatodos felizmartes mnica garca pablo iglesias mociondecensuraya ramn tamames
570,3752,victoria alonso renunci a su cargo dentro de marvel studios la argentina tena un puesto y una infuencia muy alta en la produccin del universo cinematogrfico de marvel y lo dej por motivos desconocidos victoriaalonso mcu marvelstudios marvel kevinfeige antman
571,3753,feliz lunes
572,3754,4 de junio suspendes todos los examenes de recuperaciones pero fernando alonso gana la 33 en el gp de espaa
573,3755,quien es tu influencie favorito y porque fernando alonso
574,3756,bucaros
575,3757,lo que dice la actriz para adultos venezolana antonella alonso sobre bad bunny video
576,3758,victoria alonso deja disney la fueron parece adis al nio sin amor namor
577,3759,la fia quiere clarificar su reglamento tras el lo con alonso en yed pars afp la fia quiere clarificar su reglamento antes del prximo gran premio despus de lo sucedido el domingo con el espaol fernando alonso a quien se priv de la
578,3760,lo de que en la serie de hasta el cielo salgan ayax dollar y el jarfaiter mola ojal salgan en otras temporadas el midas alonso jajsjsj
579,3761,natacha jaitt lo dijo y an falta que caigan unos cuntos que asco
580,3762,necesito volver a tener estos mdulos
581,3763,victoria alonso tras casi 2 dcadas ha abandonado su cargo en marvel studios
582,3764,despus de lo de alonso con aston martin
583,3765,motor alonso y su ejrcito de leprechauns o cmo celebrar tres podios en dos carreras david snchez de castro
584,3766,ganamos a las buenas o a las malas y a
585,3767,cosas que ahora tienen ms sentido ninguno de los dos acert con el cambio y cosas del destino slo cuando vettel decidi dejar aston martin alonso acert cogiendo su asiento lo curioso y enrevesado que puede ser el destino
586,3768,episodio disponible checo prez gana aunque no le guste al pap de max ferrari sigue preocupando mercedes sorprende al mismo toto y alonso gana pero no gana pero vuelve a ganar un podcast de frmula 1 sin filtro sin drs formula1 f1 saudiarabiangp
587,3769,pues si esta es la razn por la que victoria alonso se ha ido o la han echado de marvel studios porque lo que es indudable es que la calidad de los efectos especiales durante la fase 4 han sido lamentables en su mayora y que los propios artistas se han quejado de ello
588,3770,para todos los cabros que les gusta un buen podcast
589,3771,ella siempre fue una chica rock star pudo ser la kelly clarkson de disney
590,3772,ana maquiena
591,3773,recomiendo lectura sper entretenido el libro de ricardo alonso ms si conocs los valles calchaques mucha info los valles son un mundo apareci una piedra de 3000 aos imaginate flora fauna movimientos tectnicos agua hielo apasionante
592,3774,shock absoluto en marvel studios victoria alonso sale del estudio tras 17 aos ella es una de las grandes responsables del xito del universo cinematogrfico de marvel
593,3775,uuuuuuffffffff esto pinta muy muy mal victoria alonso ha dejado marvel studios tras 17 aos
594,3776,el decente y respetuoso pueblo estadounidense no deberan permitir que unos pocos maleantes de origen cubano intenten deslucir su fiesta del clasicomundialdebeisbol2023
595,3777,es que me alegras la vida lolaindigomusic
596,3778,ya sali el segundo misterbayern junto a cezar g brincamos desde la derrota ante los de xabi alonso hasta los cuartos de final contra los de guardiola pasando por la alemania de flick para ver para escuchar
597,3779,libertad y orden
598,3780,circulaenredes victoria alonso presidenta ejecutiva de marvel studios renunci a su cargo an se desconocen los motivos
599,3781,que costumbre tan pendeja de llamar malos entendidos a las mentiras y silencio a la indiferencia
600,3782,xabi alonso no es el nico entrenador que tantea el real madrid en la bundesliga el diario bild coloca a otro tcnico en la rbita de la entidad merengue
601,3783,necesito comer sanguchitos de miga no importa cuando leas esto
602,3784,alguien de aqu que le interese comprar vender relojes watches rolex relojeros relojes hublot patekphilippe cdmx edomex
603,3785,feliz y bendecida noche carrasquiistas a mi roco y a mi fidel de mi a todas las rocos del mundo sed fuertes luchadoras y valientes y recordar ni una mas sed felices feliz noche siempre fucsia apoyorocio20m admaltratador
604,3786,veremos la prueba de la tirolina un ao mas habr movidas y haber cuantos la pasan conquis10etb
605,3787,ojal que no la verdad zidane pochettino o xabi alonso
606,3788,the most recent bulletin put out by redmuqui has an article about the role of canadian mining in peru and in the current wave of state violence violencia estatal en el per y el papel de la minera canadiense miningwatch
607,3789,si me vas a remplazar mnimo que sea con algo chido
608,3790,lunes 20 de marzo de 2023 15 54 horas sicario justo sobre el techo y agrediendo disparando las lancetas a la boca para causar una inflamacin en las encas y as justificar un supuesto infarto algn pescador cerca voy a mover a la presa a un lugar ms a la vista atentos
609,3791,cmo harn ahora para cortar al esposo de esa tipa en ese panfleto despachoaam
610,3792,no te pierdas el conversatorio la utopa revolucionaria te esperamos dictaduranuncams sinmiedoydefrente vencimosyvenceremos somosfmln libertadparalospresospolticos frenteintercontinentaldelfmln
611,3793,el vacile de fernando alonso a russell el ingls lo celebr con el trofeo y el asturiano le responde ahora
612,3794,voten el cambio de la ra 2001
613,3795,yo preocupado cuando sale una bandera amarilla alonso de putsimu chill sabiendo lo que ha pasado hace 20 segundos porque lo ha visto en la pantalla de la curva 4 mientras le deca la estrategia a seguir a su ingeniero
614,3796,hice muy bien saliendo temprano
615,3797,segn thr la productora argentina victoria alonso ha dejado de trabajar en marvel estudios se desconoce el motivo de renuncia y o despido ms de 15 aos fue mano derecha de kevin feige gracias por todo victoria y xito
616,3798,naomi formula1 fernando alonso leclerc carlos sainz jr max verstappen checo perez hamilton vettel ferrari red bull steam mclaren league of legend otaku andaluca yo soy mas de cupra de ternura o con cupra shanks aston martin sampaoli
617,3799,no s rick el socialismo es lo contrario a la libertad donde est gobernando escasea la libertad el dinero la comida la sanidad la educacin la iniciativa privada mira los que llevan aos cuba nicaragua venezuela
618,3800,no veo razones para sancionar al estadio colo colo entreg antecedentes del superclsico ante fiscala inoticiascl deporte cnnchile alonso josh tyler drake sergiroberto geniusdancerhyunjin monsalve twentyonepilots
619,3801,yo es que al final le doy ms oportunidades a la gente de las que debera dar en realidad
620,3802,mis 3 favs en seleccin yo la ms feliz
621,3803,la defensa de la niez se renueva la direccin tremenda exposicin de marcelo sanchez de la fundacin san carlos de maipo
622,3804,hay quienes piensan que vivir sin robar no es vivir
623,3805,fidel la hora es de trabajar sin miedos ni temores la hora es de trabajar sin desconfianzas ni dudas de trabajar todos de trabajar todos los cubanos sin excepcin de trabajar todos por el bien de todos latiravileo yovotoxtodos
624,3806,cuando en marzo mayea en mayo marcea
625,3807,despus de hacer las perretas en la primera semifinal del clasicomundial los anticubanos no aumentaron simpatas y el socialismo sigue firme y ms fortalecido en cuba
626,3808,victoria alonso se va pero queda kary burke
627,3809,tres historias del 8m pero cuando pero cuando fernando alonso se hace una paja hay que subirlo verdad
628,3810,qu rolotaaaaa
629,3811,pero eleg el telefono y lo vendes arriba de los 200k mamita stonks
630,3812,thr informa que victoria alonso ha abandonado marvel studios la productora que recientemente haba sido promovida estuvo por 15 aos en el estudio siendo la mano derecha de kevin feige desde iron man se desconoce el motivo de su abandono
631,3813,y aveses soy bien mentirosaaa
632,3814,esto es muy importante eleccin de defensor a de la niez
633,3815,esto si que es mortal alonso es mi idolo
634,3816,he estado investigando lo de victoria alonso y he encontrado este artculo de cbr donde se la acusa de tener la culpa de la tan sonada explotacin de los artistas vfx no sabemos si ser verdad pero a m me da mal rollo todo esto sea como sea vienen cambios
635,3817,opinin popular el mclaren de alonso era ms lento q un paso de semana santa
636,3818,una vergenza el obsecuente juan gmez con jorge diaz y el fapit la fiscal sabrina flores sustituta de gabriela fosatti es funcional a j diaz cuando hace dos aos el gremio de fiscales vot un paro ella renunci a la asociacin para no tener la obligacin luego se reafili
637,3819,esto es una barbaridad es increble la capacidad de fernando alonso de seguir la carrera a travs de las pantallas en un circuito como el de jeddah
638,3820,naomi formula1 fernando alonso leclerc carlos sainz jr max verstappen checo perez hamilton vettel ferrari red bull steam mclaren league of legend otaku andaluca yo soy mas de cupra de ternura o con cupra shanks aston martin sampaoli
639,3821,buenas noches terminamos con maximas de c y mnimas de 9c en oviedo
640,3822,lunes 20 de marzo de 2023 15 38 horas imprescindible colocar el centro de operadoras del 911 y 088 bajo vigilancia y monitoreo estricto en tampico la delincuencia organizada tiene infiltrado el lugar y hay un sujeto amenazando a las operadoras sobre todo por las noches
641,3823,bajo el sol todos somos iguales la justicia tambin calcina
642,3824,una dupla alonso norris molaria
643,3825,que fuerte leer que victoria alonso mano derecha de kevin feige dejo a marvel studios la cineasta argentina era vicepresidente de marvel studios trabajo en todos los proyectos de marvel desde ironman 1
644,3826,lawrence stroll con la aficin alonsista despus de dejarse la mitad del patrimonio en recuperar la p3 de alonso sobornando a la fia
645,3827,la gente que va con aires de superioridad es la que necesita sentirse por encima del resto para valorarse realmente tienen un serio problema de autoestima y lo camuflan as lamentable
