,Id,Tweet
180,27447,el apantalla pendejos que le ense la palabra resiliencia a rafa puente
181,27448,rafa puente jr la armaba ms actuando
182,27449,la aficin de los pumas estall contra rafa puente y los directivos ya oficializaron su salida del club
183,27450,el club ideal para rafa puente jr es el santos ni perdiendo 10 0 lo correran
184,27451,rafa puente fue el pea nieto de mis pumas
185,27452,lamentablemente un tcnico mexicano se queda sin trabajo qu le pas a rafa puente en pumas el cuerpo tcnico que hoy est en cruz azul es el cuerpo tcnico que quera pumas lup
186,27453,se fue rafapuente pero la pregunta q sigue a los pumasmx es cundo se va mejiabaron l eligi a puente lo apoy y lo prefiri por encima de otros a pesar sus nmeros decepcionantes q lo marcaban como un dt perdedor y q vaticinaban un mayor fracaso por ende y mejiabaron
187,27454,pumas ech a rafa puente tras los malos resultados en el clausura 2023 de la liga mx
188,27455,su nombre rafa puente hijo fotgrafo desconozco hasta el da de hoy dt de los pumas anteriormente dt de quertaro y lobos dirigi 12 partidos en el actual torneo de la liga mx con un saldo de tres victorias siete derrotas y tres empates
189,27456,adis rafa puente luego de la derrota ante pachuca rafa puente es cesado de pumas no es el nico responsable lup
190,27457,rafa puente cuando se enter que maana ya no jala
191,27458,que gran domingo gan mi bara el clsico y corrieron a rafa puente
192,27459,sin duda alguna rafapuente es 1 de los 3 peores dts en la historia de pumasmx los nmeros de vergenza e infamia q deja 1 2 juegos 3 triunfos 2 empates 7 derrotas 1 6 goles 2 4 goles en contra apenas y logra el 3 0 de efectividad
193,27460,quien le dijo a rafa puente que poda ser tcnico jajajaja
194,27461,primeradivisindemxico bombazo oficial rafa puente jr qued fuera de pumas tras nueva derrota en liga mx futbol picante
195,27462,gracias por nada rafa puente pumas pumasmx
196,27463,hoy ahorre mi bilis y prefer ir a beber al san patricio fest total el fracaso y mediocridad de rafa puente y los jugadores era evidente as que s hoy fue un gran da benditodiosyasefuepuente
197,27464,se acab la mentira q es rafapuente nunca debi llegar a los pumasmx
198,27465,rafa puente estuvo a tres partidos ms de aferrarse al puesto de colocarlo con mario carrillo y david patio
199,27466,nms recin veo lo que le hizo pumas a rafa puente que ridculo y corriente de su parte cmo si el tuviera la culpa pumas lleva aos en la mediocridad
200,27467,dinenno cuando se enter que mandaron a la jodida a rafa puente de pumas
201,27468,lo ms sano es que no hubiera llegado pero bueno era insostenible lo de rafa puente hay gente que cree que se le tiene envidia o animadversin al dt por su personalidad estilo nombre basta ver sus nmeros para entender todo no est capacitado punto dato mata relato
202,27469,se perdi la jubiladora con momio 300000 pero el pendejo soy yo en creer que rafa puente le iba a empatar al pachuca al medio tiempo s iban empate ptm
203,27470,bueno en realidad rafapuente nunca debi ser director tcnico de pumasmx muy cara sali la terquedad de enrique graue un equipo sumido en la mediocridad despues de todo como no hay descenso pueden seguir perdiendo
204,27471,el malayo ya resucit un poco rafa puente ha fallecido el chima y el homerito ferruzca de la laguna ya no tardan por eso est ms chido comprarle espejitos a los tcnicos extranjeros
205,27472,las declaraciones de fentanes le copi a rafa puente jr modoguerrero fuerafentanes
206,27473,perdi pumasmx de nuevo pero se va rafa puente dios da y dios quita
207,27474,se nos fue la jornada 12 amrica vence a chivas en el clasicodemexico rayados sigue on fire y se lleva el clsico regio pumas no puede con pachuca y cesan a rafa puente cruz azul sigue sumando puntos fuente claro sports
208,27475,la forma en la que la aficin de pumas despidi a rafa puente
209,27476,se nos fue la jornada 12 amrica vence a chivas en el clasicodemexico rayados sigue on fire y se lleva el clsico regio pumas no puede con pachuca y cesan a rafa puente cruz azul sigue sumando puntos
210,27477,el menos culpable en pumasmx es el propio rafa puente las aspiraciones de la propia directiva fueron alejarse del descenso y hasta ah saben que no tienen plantel para aspirar a ms hoy le piden a rafa hacer magia hay que ver nada ms la defensa para saber que era imposible
211,27478,rafa puente jr agarra chamba por las pendejadas que dice en sus choros mamadores estilo orlegi curiosamente hoy se qued sin jale por las pendejadas que dice
212,27479,pumas cesa a rafa puente y ya buscan nuevo dt para el prximo torneo
213,27480,tan mal estuvo lo de rafa puente que ni una imagen con el gracias le hicieron
214,27481,se va rafa puente de pumas
215,27482,adis rafa puente pumas despidi al entrenador tras caer contra pachuca el sol de tampico
216,27483,yo opino que no deberan correr a fentanes hoy irarragorri y dantelizalde nos odian tanto que son capaces de traernos a rafa puente jr
217,27484,vengo a sacar teoras conspirativas los pumas de rafapuente estaban mal entrenados o nomas le queran tender la cama a su tcnico o ambas
218,27485,quien fuera rafa puente jr para no tener que ir a trabajar maana dichoso
219,27486,los pumas de la unam anunciaron hoy el cese de su director tcnico rafael puente jr tras una serie de malos resultados en la liga mi duda es realmente rafa es el problema o pumas es un equipo muy mal armado con jugadores de psimo nivel pumas ligamx rafapuente futbol
220,27487,wey no van al olmpico nunca nuncaaaaa y hoy suben sus historias aventndole vasos de chela a rafa puente jr desde las gradas la violencia nunca est justificada pinche banda naca
221,27488,no me pregunto cmo rafa puente jr logr dirigir a los pumas ms bien cmo logr volver a dirigir en primera divisin
222,27489,pase todo el da con ella y corrieron a rafa puente que excelente domingo
223,27490,estamos listos los esperamos en la jugada con todos los ecos de los clsicos la destitucin de rafa puente formula 1 con checo prez se viene mxico vs japn en la serie mundial de bisbol y ms
224,27491,lozano es otro rafa puente en primera divisin
225,27492,es verdad que rafa puente no tena las cartas para dirigir a un club importante de liga mx pero los aficionados se van contra l como si su equipo no estuviera lleno de jugadores que sin ningn problema podran jugar en expansin sin desentonar plantel malo resultados malos
226,27493,que mal pedo por rafa puente y neta que animales los aficionados del equipo al qu diriga
227,27494,pumas universidad nacional aguant lo ms que pudo pero el proyecto de rafa puente del ro era insostenible y tras 7 derrotas 3 victorias y 2 empates en liga anunci su salida del equipo
228,27495,rafa puente jr el parapeto perfecto para enmascarar el saqueo y destruccin del club universidad desde 1996 los actuales y anteriores directivos siempre al servicio de promotores de grupo orlegi televisa y greg taylor
229,27496,ni rafa puente ni nadie merece ser tratado as esto no es pumas son una bola de imbciles que no representan nuestros valores universitarios
230,27497,ahora que rafa puente jr dejo de ser dt de pumas que ni se preocupe seguro una televisora lo agarra de comentarista esa banda la tiene fcil
231,27498,ya se candidate hugo snchez para ser el reemplazo de rafa puente jr
232,27499,esos que dicen que los de la unam no tenemos educacin por lo de rafa puente flops yo estudi en la unam y no le voy a pumas o sea nada tiene que ver el ftbol con la escuela ven por qu nadie quiere a los fifas
233,27500,adis rafa puente es mejor analizar el ftbol en la televisin
234,27501,la aficin de los pumas est sumamente molesta con los jugadores y con rafa puente los ltimos partidos han sido un desastre total
235,27502,es nefasta la campaa que est orquestando la prensa patriarcal en contra de rafa puente cuando est teniendo los mismos resultados que lillini por esto y ms pido que se haga una revolucin femenina en los medios con lareimers como autora con el fin de sacar a los onbrez
236,27503,despedido la aficin del pumasmx no pudo ms y explot contra rafapuente en el ltimo partido en donde los felinos universitarios perdieron contra los tuzos
237,27504,yo no s ustedes pero con lo sucedido con rafaelpuente y pumasmx creo que esto en wikipedia es ms pico que todos los memes juntos y rafapuente espn defendiendo lo indefendible que estupidez
238,27505,pumas le da las gracias a rafa puente ser muy difcil que lo vuelva a contratar un equipo pero las televisoras se lo pelearn as el mundo del ftbol
239,27506,lo que mas me preocupa de que fentanes tambien se vaya es que rafa puente jr est disponible
240,27507,deja a los pumas pumas hace oficial la destitucin de rafa puente tras perder en casa frente al pachuca toda la informacin aqu
241,27508,bueno hoy supongo que todos aquellos que se ofendieron por la nota de los tenis de rafa puente al fin sern muy crticos pumas
242,27509,rafa puente es destituido de pumas tras derrota ante pachuca ms detalles en
243,27510,7 perdidos 24 goles en contra 11 pts de 36 posibles 16 lugar de tabla levanta muertos la burla de todos 6 expulsados y an no se toca fondo se puede ir ms hacia abajo rafapuente
244,27511,rafa puente puede ser una persona integra profesional trabajadora pero nunca ser un buen tcnico
245,27512,ya se fue rafa puente ahora s
246,27513,pumas despide a rafa puente
247,27514,jaime lozano como dt es otra de los grandes vendedores de humo dentro del futbol mexicano mucha medalla de bronce y la bergha para que sus nmeros como dt de liga con necaxa fueran una vergenza jimmy lozano rafa puente
248,27515,nunca me he atrevido a decir que se toca fondo porque nunca sabes si puede ir ms abajo rafa puente 19 03 2023
249,27516,jaime lozano es la versin de rafa puente pero tiene 1 partido menos perdido en su carrera hugo snchez es el nico e ideal que debera llegar al banquillo de los pumas
250,27517,por fin se tardaron 8 jornadas enhacer lo obvio directiva sosa y pitera pumasmx pumas rafapuente nunca vuelvas
251,27518,ojal rafa puente jr entienda que tal como su pap no est hecho para ser entrenador puede ser un buen analista habla bonito pero no se le da eso de ser tcnico que los ineptos directivos de pumas no pongan a uno peor
252,27519,oficial rafa puente se va de pumas los pumasmx hicieron oficial la salida del entrenador rafapuentejr adems de su cuerpo tcnico instagram pumas mx edicin propia por p4ulhernandez
253,27520,parece que contrataron a rafa puente jr para actuar como director tcnico porque esta madre no hizo nada de sentido
254,27521,con 11 puntos en 12 jornadas pumas marcha en el lugar 16 del clausura 2023 por lo que pumas anunci la destitucin de rafa puente como dt de los universitarios
255,27522,rafa puente debera repensar su carrera tomando un cargo como auxiliar de un dt con mayor experiencia para aprender sin tanta presin y foco sobre sus errores pero el hambre de protagonismo le gana si as va a estar en todos sus equipos mejor que se quede de comentarista
256,27523,pumas pumasmx no vayan a traer de dt a alvaritomorales o lareimers por favor ese discurso de rafapuente de que an no han tocado fondo y se puede estar peor no lo tomen literal
257,27524,siempre si le dieron gas rafa puente jr de la organizacin de pumasmx no estaba fcil independiente juego ante rival de los tuzos pero la aficin ya no aguantaba mas
258,27525,s se pasaron de idiotas los fans que baaron a rafa puente que as los despidan en su trabajo
259,27526,con 11 puntos en 12 jornadas pumas marcha en el lugar 16 del clausura 2023 por lo que pumas anunci la destitucin de rafa puente como dt de los universitarios
260,27527,dato el consejero presidente del instituto nacional electoral ine lorenzo crdova vianello dejar su cargo el lunes 3 de abril de 2023 achasm mxico sigueme pumas rafa puente checoprez siguemeytesigo edomex delfina amlo cdmx follow
261,27528,le deseo lo mejor a rafa puente espero mejore mis pumasmx
262,27529,adis rafa puente pumas despidi al entrenador tras caer contra pachuca
263,27530,rafa puente ya noo seguir como dt de los pumas de la unam pablocarrillol menciona que esto solo es la punta del iceberg de los problemas del equipo de la universidad autnoma ligamx
264,27531,nmeros muy mediocres de rafa puente pero lo ms probable es que encuentre trabajo en una televisora como comentarista criticando a otros tcnicos
265,27532,con la salida de rafa puente que es gran motivador se le acab su carrera en liga mx quizs pueda tener alguna oportunidad en ascenso pero despus de varios fracasos dudo tenga una ms con el nico equipo que le funcion al 100 fue con lobos buap y muy poquito con el
266,27533,con un contrato de 6 meses y con ese plantel de verdad esperaban estar hoy mucho ms arriba con rafa puente
267,27534,la ltima imagen de rafa puente jr como entrenador de pumas en c u a pedir chamba en la tv otra vez porque para el verbo es bastante bueno pero mover fichitas no es lo suyo
268,27535,correr a rafa puente jr en el puente
269,27536,rafa puente deja de ser dt de pumas
270,27537,rafa puente se despidi como director tcnico de los pumasmx
271,27538,rafa puente ya noo seguir como dt de los pumas de la unam pablocarrillol menciona que esto solo es la punta del iceberg de los problemas del equipo de la universidad autnoma ligamx
272,27539,estoy disponible para dirigir a pumas no se nada de direccin tecnica pero rafa puente tampoco pumasmx
273,27540,ftbol picante te recibe con tus porristas incondicionales incluyendo rafapuente espn
274,27541,mis pobres pumas haciendo el ridculo muchos intereses extranjeros que slo lo tomaron de congal por supuesto rafa puente ya est fuera no vayan a decir que los entrenadores mexicanos no funcionan y traigan a otro de su mafia sudk
275,27542,pumas confirm que rafa puente del ro dej de ser estratega del equipo esto ocurri horas despus de caer ante pachuca lo que signific su sptima derrota en el clausura 2023
276,27543,quin fuera rafa puente para no ir a trabajar ma esperen yo tampoco tengo trabajo
277,27544,aguantaron una semana ms a rafa puente es una lstima que su proyecto no pudo prosperar ha tenido ms oportunidades de las que mereca pero ya estaba ah y pudo demostrar al contrario creo que no va a volver a dirigir
278,27545,mediante un comunicado el club universidad inform que ha terminado el vnculo laboral con el seor rafa puente jr rafaelpuente como director tcnico de pumasmx
279,27546,hoy perdieron los pumas perdi el madrid pero gan el futbol rafa puente fuera de pumas
280,27547,creo que rafa puente no ser el nico que se queda sin trabajo
281,27548,si contrataron a rafa puente porque no contratar a otra persona que aparezca en la tv adems courtney es mejor lder que rafa bv dramatotal pumas
282,27549,seamos objetivos si un equipo gana un partido dicen el merito es de los jugadores si anda mal el equipo es culpa del dt rafa puente donde estn los ineptos que fallan goles los irresponsables que se hacen expulsar si traen a guardiola jugaran como m city
283,27550,rafa puente del ro deja de ser tcnico de pumas y rocelorio nos tiene todos los detalles en contactotudn qu nombres comienzan a sonar en vivo en tudn
284,27551,ya corrieron al dt pero ya se pusieron a pensar en los jugadores esos cabron3s ya cobraron puentesito fecha fifa playita regresar a valer madre 4 o 5 partidos ms y despus dos meses de vacaciones ese nivel de mercenarios en pumasmx rafapuente
285,27552,rafa puente jr deja de ser dt de pumasmx
286,27553,jajajajajaja naco estpido rafa puente de dt no tiene nada
287,27554,que paliza les estn dando los azules a mis rojos exatlon lo mismo que pachucha les dio a mis pumas pumasmx da gris por vergenza personal y dignidad ya debera renunciar rafapuente
288,27555,tras perder 2 0 contra pachuca rafa puente del ro es destitudo como dt de pumas
289,27556,top 10 tendencias de twitter en mxico laguneroprimero none vecinos none pia 158354 allstareliminacin none pumas 11375 rafa puente none noalodio 10258 mifamosoyyo none rayadas none barcelona 316682
290,27557,cosas buenas del da schecoperez gan y lo hizo con autoridad cosas malas perdieron mis pumasmx cmo siempre puro coraje la otra buena perdieron los pumas y corrieron a rafa puente por fin
291,27558,te hablan pendejo de mierda alvaritomorales rafa puente es perdedor como t
292,27559,sntesis de los 3 magnficos pumasmx pero al fin sali rafa puente realmadrid y en el clsico solo riverplate ah y mencin honorfica a schecoperez por haber ganado el gparabiasaudita
293,27560,a rafa puente lo corren en pleno puente extraas formas en que opera el universo
294,27561,un telfono inteligente sabra que maana es puente y quitara mi alarma del lunes automaticamente para los que como yo no tienen un telfono tan inteligente y no trabajan maana pues les recuerdo que apaguen sus alarmas y recuerden volver a activarla para el da siguiente
295,27562,debera existir alguna restriccin para entrenadores como rafa puente jr mercenarios sin preparacin o bien sin idea algun filtro que tambin permita a la liga mx tener gente al mando de los equipos con ms garanta
296,27563,se tardaron mucho gracias a dios bye rafa puente pumas
297,27564,esto nunca tuvo que haber sucedido rafa puente no se imagin a dnde se meta y gracias a la directiva hoy se fue como uno de los peores y ms rechazados tcnicos en la historia auriazul y de esos que patean la pelotita a ver cuntos lo siguen al fin del torneo eh pumas
298,27565,rafa puente viendo que ya corrieron a su hijo y ya no tiene que hablar bien del pumas
299,27566,tengo la creencia de que si no hubiera dicho esta mamada rafa puente seguira siendo director tcnico jajaja
300,27567,porsinosabias rafapuente se va de pumas con 12 partidos dirigidos en los que sum solamente tres victorias dos empates y siete derrotas
301,27568,lo de rafa puente nunca debi pasar podr ser bueno en mil cosas pero para director tcnico simplemente no sirve el problema es que ahora quien
302,27569,ahora que los pumas corrieron a rafa puente qu tal darle la oportunidad a la reimers sirve que le quitan el micrfono de la champions y la llevan a la vida real goya
303,27570,que ganas de ser rafa puente jr para no ir a trabajar maa ah es puente o
304,27571,el director tcnico que nunca debi llegar no s si neta alguien tena f en rafa puente no ha dado resultados en ningn equipo ya por favor que alguna empresa compre a mis pumas
305,27572,de las ultimascontrataciones que hizo la dupla polo silva meja barn ninguno funcion delprete salvio alves rafapuente tambin tienen qu irse fuerapolosilva
306,27573,jajajajajajaja adios rafa te ira mejor en la basura rafapuente
307,27574,ya que valentino lans tiene experiencia como dt en la novela el juego de la vida y la reimers tiene titulo de directore tecnique a quin eliges para sustituir a rafa puente para mis pumas
308,27575,de rafa puente aprend que siempre siempre se puede estar peor nohemostocadofondo
309,27576,se va rafa puente de pumas
310,27577,ya se fue rafapuente de pumas y tibasepulveda30 ronaldocm97 y carloscb 24 cuando chivas
311,27578,si rafa puente jr pudo ser entrenador yo tambin podr
312,27579,se acab la era de rafa puente y como dijo el poeta nadie es indispensable y menos para las tareas precisas del amor vamos pumasmx tu aficin es eterna goyaaa
313,27580,se va rafa puente y se reanuda la recurrente danza quin para estos pumas
314,27581,crnica de una muerte anunciada amigo se puso a rafa puente para tapar el sol con el dedo te ahorras una lana y sigues sangrando al equipo
315,27582,adis rafa puente a ver si ahora consigues un dt que sepa a que jugar pumasmx
316,27583,rafa puente jr sale de la direccin tcnica de pumas tras acumular la sptima derrota en el torneo
317,27584,que dice rafa puente jr que con su despido de pumas no ha tocado fondo porque an le puede ir peor en el futuro jajajajaja as las palabras de resiliencia y trabajo incesante
318,27585,ya fueron a rafa puente ahora falta que se vaya medio equipo y la directiva
319,27586,despus de la salida de rafael puente de los pumas ya quiero ver a los analistas de espncapitanes teniendo los para decir frente a su pap rafa puente que su salida era inminente por ser un psimo dt y no justificarla con el mal desempeo d los jugadores o directiva
320,27587,ltimahora pumas cesa a rafapuente como su director tcnico
321,27588,deportivo coatepeque la roma los putos pumas de rafa puente el xelaju motomami
322,27589,rafa puente no dur ni un torneo con los pumas
323,27590,realmente alguien pens que esto acabara diferente a parte de la directiva claro pumas rafapuente
324,27591,traen a rafa puente sabiendo que es un dt perdedor lo contratan por una temporada a la mitad lo corren y le joden al nuevo dt la oportunidad de armar un proyecto desde 0 con un equipo hundido sin dudar la directiva de pumasmx es la peor del futbol mexicano
325,27592,pumas anuncia la salida de rafa puente ralmente debi llegar a pumas
326,27593,regresar rafa puente jr a dirigir o este ya es su retiro como dt
327,27594,adis rafa puente te ir mejor en otra telenovela
328,27595,ligamx se quedan sin entrenador pumas tom la decisin de destituir a rafa puente abcdeportes 92 1 fm y 660 am
329,27596,ya estamos al aire en imagendeportiva por imagen mx clsico mundial de beisbol checo gana el gp de arabia saudita amrica gana con autoridad el clsico nacional rafa puente no es ms tcnico de pumas se va a poner sabroso
330,27597,nunca se entendi la decision de poner a rafa puente jr al frente de pumasmx y lamentablemente no funcion si fue por un tema de falta de ppto debieron haber dejado el equipo en mano c h gonzalez y dar seguimiento a los campeones sub 20 hoy solo tiraste un torneo al carajo
331,27598,rafa puente jr has left pumas unam
332,27599,solo en lobos buap le fue bien a rafa puente y eso cuando los ascendi de ah todo ha sido muy muy muy malo
333,27600,se termina lo que nunca debi empezar y el verdadero responsable de la crisis en pumasmx y la unam mx sigue en la rectora enrique graue rafa puente y su cuerpo tcnico termina su relacin laboral despus de volver al equipo en una caricatura mxico sigueme pumas cdmx
334,27601,los directivos de pumas emitieron un comunicado para dar las gracias a rafa puente
335,27602,al fin mis pumas corrieron a rafa puente rafapuente pumas ligamx unam
336,27603,pobre rafa puente pero mejor que se ponga a hacer novelas es muy mal tcnico
337,27604,el error ms grande no es rafa puente es de quin lo puso ah que bueno que ya lo corrieron
338,27605,me vengo enterando que el vende humos de rafa puente jr era entrenador de los pumas ja ja ja pinches caraduras
339,27606,te tardaste rafa puente es un tcnico perdedor en la liga mx no solo con pumas
340,27607,anuncia pumasmx cese de rafa puente jr una plantilla modesta pero desde hace varias semanas sin idea ni ganas a ver para quin les alcanza como nuevo entrenador
341,27608,as la ltima foto de rafa puente al mando de pumas
342,27609,pumas le ha dicho adis a rafa puente para sumarlo a una lista larga de entrendores que no han podido llevar al equipo al ttulo ligamx pumas
343,27610,por fin se fue rafa puente ya nams faltan los jugadores pero a ver qu sorpresa nos trae la directiva hugo snchez diego alonso jimmy lozano uno de esos tres por fis
344,27611,lo bueno rafa puente jr ya se va de pumas dejo un cajadero en el equipo pero ya se va lo malo los influencers pagados por tecate estaran mame y mame con respaldar al siguiente dt sea quien sea y pondrn la hugoneta lamborjimmy diegoneta
345,27612,gan el barcelona de ltimo minuto en el clsico contra el franquista real madrid corrieron por fin al bueno para nada de rafa puente jr de los gloriosos pumas y maana es lunes de puente fue un fin de semana redondo de buenas noticias
346,27613,de mal en peor adems de la salida de rafa puente pumas perdera a un jugador para lo que resta del torneo era titular
347,27614,rafa puente fue slo un eslabn fuera graue
348,27615,qu injusto rafa puente estaba haciendo un gran trabajo ccp taxmachinelaw
349,27616,un ciclo raro y por dems accidentado donde la mala suerte y la incapacidad de sobreponerse a esta fueron victimarios de la temporada en pumas una pena pumas rafapuente
350,27617,la culpa no fue de rafa puente jr ni de su presentacin de power point o de su manera tan bonita de hablar y motivar la culpa es que no sabe nada de ftbol
351,27618,rafa puente dt lobos buap director deportivo de chivas dt en gallos blancos dt en atlas auxiliar con tuca en jrz dt en pumas en todos menos en buap que tena un equipo ya armado hizo un papel espantoso parece que tiene el mismo representante que gulit pea
352,27619,rafa puente maana llegando a c u
353,27620,la cay la espada de damocles a rafa puente del ro
354,27621,extra extra se acab la pesadilla rafa puente jr regresa de comentarista
355,27622,irnico que el puente de rafa puente jr se alargara indefinidamente
356,27623,no solo era rafa puente para algunos aficionados hay varios jugadores de pumas que no rinden en el equipo y que incluso ya deberan salir
357,27624,en esta cuenta se habl de rafa puente y por que no gustaba como tcnico de pumasmx primera crnica de una muerte anunciada cumplida triste fracaso para el ftbol mexicano y los valores reales que deberan permear en unam mx y sus equipos deportivos
358,27625,el problema con rafa puente jr es que su sistema se basa en una retrica de lo que ha ledo y ese es el problema no es lo mismo conocer el camino que recorrerlo sus palabra son huecas sin sustancia porqu nunca ha corrido por un baln hace aos que vengo evidencindolo
359,27626,se termina lo de rafa puente del ro en pumas
360,27627,y todava rafa puente se fue molesto por que lo corrieron jajajaja nunca vuelvas ni a pisar un club eres un cncer rafaelpuente hasta nunca hijo de perra
361,27628,no fuera tcnico extranjero porque lo dejan dos torneos y le traen refuerzos rafapuente
362,27629,un proyecto que jams debi iniciar con rafa puente al frente gracias por nada
363,27630,cmo calificaras la etapa de rafa puente estos son los nmeros que dej rafael puente del ro tras su fugaz paso con los pumas
