,Id,Tweet
705,43318,y expulsaron al pocho y no jugar el clsico tapato ajjsjajajaja que pinche equipo olvidado por dios somos mejor vamonos a pistear destapese las heladas mi chuy
706,43319,y cuando juega el pocho guzman
707,43320,con todo el respeto que te mereces villa villa deberas de dejar de ser tan hocicn as como se maquill este partido se ha maquillado el torneo que llevamos y el pocho por hocicn hasta expulsado termin
708,43321,perdi la cabeza pocho guzmn se perder el clasicotapatio por una roja directa sabemos que les har falta pero quin podr reemplazarlo chivasentelemundo clsicodemxico
709,43322,no vamos a buscar quin nos la hizo vamos a buscar quin nos la pague pocho guzmn chivas
710,43323,el mejor jugador y por que ya no quieren a alexis vega se vino a cagar en el clsico no apareci y adems lo expulsaron bien el pocho ya est mostrando que merece estar en ese club
711,43324,no mames que si jugo el pocho hoy
712,43325,el pocho guzmn se hizo expulsar para no jugar en clsico contra el atlas cocainomano pero sentimental el hdp
713,43326,el pocho guzmn anduvo de hocicn todo el mes y hoy ni la oli
714,43327,el pocho se hace expulsar y se pierde el clsico tapato
715,43328,pocho guzmn ms rojinegro que el pistache torres jajajajajaja
716,43329,pnganse a trabajar y dejen de hablar y ms con el pocho guzmn habl no jug y adems se hizo expulsar
717,43330,que humilde pocho guzmn se hizo expulsar al final del partido ms atlista que el mismo aldo rocha
718,43331,con todo y franco escmilla jero freixas el bofo con el pelo pintado como el joker las declaraciones del pocho guzmn y su estadio lleno el verdadero espectculo lo dio el club amrica
719,43332,decias pocho jajajaja quien sufri quien se las hiba ah pagar jajajjaja lo nico que te llevaste del clsico fue tu tarjeta roja
720,43333,jajsjaja lo expulsaron al pocho guzmn menos mal que estaba buscando quien le pagu la derrota con puebla
721,43334,los platos la vajilla completa pocho
722,43335,no entend que discuta el pocho pero definitivamente ya era innecesario y al final se fue expulsado
723,43336,ya jugando con pachuca el pocho bajaba de nivel cuando enfrentaba al rojinegro orlegui cuando est en agencia libre porfavor fichate a este rojinegro
724,43337,por qu expulsaron al pocho guzmn
725,43338,no faltar el chiva que se la est mamando al pocho guzmn por andar de verguero y reclamando en la cancha jajaja al final el cabron no hizo ni verga
726,43339,el pocho guzman es ms rojinegro que andrs guardado alejandro fernndez lorena ochoa guillermo del toro el canelo lvarez el extinto jorge vergara
727,43340,ni biscimis quiin nis li hizi sini quiin nis li vi i pigir iiiii victor pocho guzmn delantero club deportivo guadalajara
728,43341,y entonces haba un hocicn llamado pocho guzmn que buscaba quien se las pagara y les pagaron con 4 pepinos
729,43342,expulsaron al pocho guzmn jug
730,43343,y el pendejo del pocho se sali del clsico tapato
731,43344,gan el ms grande doblete del cabecita rodrguez otro de henry martn y uno ms de leo surez chivas descont con autogol de emilio lara y sergio flores vctor pocho guzmn se fue expulsado chivas 2 4 amrica clausura2023 ligamx
732,43345,y ahora que equipo se la pagar al pocho
733,43346,qu le pas al pocho dnde dej los huevos
734,43347,joder pocho como pudiste perder la cabeza de esa forma no le piede reclamar de esa forma a los rbitros ya sabes que esos siempre pitan pal otro lado ahora la dupla vega guzmn tendr que esperar
735,43348,henry se orin en las chivas les metimos 4 en su casa el cabecita sigue marcando el pocho nada ms anduvo de hocicn y alexis vega no apareci
736,43349,grande pocho
737,43350,pocho guzmn paso de ser el nuevo referente a un pendejo en tan solo 90 minutos un profesional con autocrtica no puede hacerse expulsar as de fcil
738,43351,expulsaron al pocho guzmn que la succione el gryffindor
739,43352,y el pocho se hace expulsar despus del partido para perderse el clsico tapato estamos en la mierda
740,43353,lo cagado es que hoy el pocho no la cago en ningn gol
741,43354,que quera 30 ms para empatar chtm pocho
742,43355,gan el ame y expulsaron al pocho
743,43356,j4j4j4j4 pinch pocho se le frunci el asterisco y prefiri perderse el clsico tapato antes q julin lo agarre a cachetada con su vrg
744,43357,pocho guzmn habl fuera de la cancha pero dentro de ella no y al finalizar el juego se hizo expulsar chivas tuvo 6 opciones de gol y amrica 8 los de coapa ganaban 0x4 acierto a la quiniela
745,43358,el pocho se la pas hablando toda la semana y ni la oli mientras el diego dijo que iba hablar en la cancha y lo cumpli
746,43359,el pocho guzmn prefiero ser expulsados que jugar vs el equipo de sus amores
747,43360,que alguien le diga al pocho que ser capitn no significa ir a pelear a lo menso cada cinco minutos
748,43361,entonces victor pocho guzmn abri la boca sentenciando que el clsico sera de chivas y el amrica pagara los platos rotos del estadio cuauhtmoc pero ni siquiera se molest en jugar en el patio trasero de las guilas
749,43362,lo que si es que ya no tenemos que andar cuidando o protegiendo jugadores como hoy al pocho abre el osico que el america la va a pagar y el wey nomas anduvo con el gafete de capitn y no hizo nada as como se revienta a todo el equipo a el tambin hay que echarsela
750,43363,iniciando campaa para que sexbastian prez bouquet sea titular el prximo partido en lugar del pocho chivas chivas
751,43364,oigan y el pocho guzmn yo cre que se haba ido expulsado desde el minuto 1
752,43365,desaparecido todo el perro partido para al final ir a encarar al rbitro y hacerse expulsar y perderse el clsico tapato el pocho guzmn
753,43366,chivas volvi a ser un equipo vulgar ordinario opaco tano entendi mejor el juego a pauno le di fro sacar al pocho al medio tiempo y cambiar dibujo tctico los jugadores muy ansiosos y otra vez queda en evidencia que adelante no hay calidad justa victoria del ame
754,43367,le sacaron roja al pocho jajajajaja
755,43368,hoy chivas no supo jugar un clsico ante un ame que nos pas encima a pesar de quedar 4 2 falta de capacidad en la defensa y pocho guzmn contenido y lo peor expulsado hoy estoy dolido as no chivas as no
756,43369,y el pocho alguien sabe si jugo
757,43370,para cambiarla de chingar pocho se hace expulsar
758,43371,pens que pocho no haba jugado hasta que lo expulsaron jajajajajaja
759,43372,chicote caldern pocho guzman piojo alvarado alan mozo todos ellos pueden irse del equipo chivas que vergenza tener jugadores como ellos no me imagino que un nio tenga de dolo a uno de ellos primero por sus apodos segundo por su actitud
760,43373,qued no vamos a buscar quien nos la hizo vamos a buscar quin nos la pague amrica va a sufrir pocho guzmn tras perder vs puebla
761,43374,pocho guzmn a quien ms debi reclamar como lder que pretende ser es a su entrenador por esa terquedad de seguir jugando con lnea de 4 desde la mitad del primer tiempo cuando el oso no poda contener la morsa tiene ms sancada y por tanto cubre ms terreno
762,43375,oigan y el pocho se present al partido
763,43376,no saba que el pocho guzmn haba jugado de hecho lo expulsaron
764,43377,no puede ser lo del pocho guzmn hacindose expulsar al final no se pudo en la cancha ya no reclames al rbitro lo peor del capitn de chivas esta noche desde que lleg
765,43378,desaparecido desaparecido nombre pocho guzmn desaparecido 18 de marzo de 2023 vs amrica caractersticas dicen que es el mejor jugador de la liga pero no hace nada en partidos importantes
766,43379,jajajajaja ese pocho solo es bueno para abrir el hocico no jug un carajo pero anda de pedero
767,43380,pocho guzman quedo ni el atlas va a poder pagaslr los platos rotos bye
768,43381,quien dira que un vato al que le dicen la morsa seria mas importante en un clsico nacional que el pocho guzman
769,43382,el pocho guzmn haciendo expulsar para no jugar contra el equipo de sus amores para nada es queja
770,43383,pocho lineas locas solo habla fuera de la cancha porque dentro no puede
771,43384,jona fidalgo y valdez se orinaron todo el juego en la cara de oso beltran y pocho
772,43385,pocho queriendo defender con gritos lo que no pudo en la cancha le falta mucho para ser el lder que muchos creen que es
773,43386,y el pinche hablador del pocho guzmn
774,43387,el pocho sigue siendo rojinegro
775,43388,clasicodemexico se busca al pocho guzman para que se las cobre con el amrica chivas america clasiconacional
776,43389,pocho guzmn quien se la pas hablando de ms durante la previa y no hizo nada durante el partido termino expulsado jajajaj
777,43390,el pocho se cago y la sper micha planeada tendr que esperar
778,43391,tremenda y absurda expulsin para el mejor jugador de chivas el rebao sin el pocho guzmn vs el atlas en el clsico tapato
779,43392,lo del pocho guzmn al final del partido es increble despus de ser un fantasma en el clsico nacional se hace expulsar insultando al rbitro y se pierde el clasico ante al atlas de la siguiente jornada que irresponsable debera mejor analizar su psimo
780,43393,el pocho guzmn estuvo desaparecido en el clsico nacional y se hizo expulsar al final del partido para perderse el clsico tapato pero en toda la semana estuvo de hablador el pendejo jajajaja a mamarla
781,43394,despus del final del partido el pocho guzmn fue expulsado todo indica que fue por reclamarle al rbitro central chivas ligabbvamx clasicodemexico
782,43395,qu aprendimos hoy hay que saber cerrar la boca victor pocho guzmn fue el primer en hablar y su partido fue deleznable por si fuera poco termin siendo expulsado ya terminado el encuentro por insultos al rbitro
783,43396,jajaajajjaja y el puto pocho expulsado y se pierde el clsico jajajajajaja somos una puta burla
784,43397,alguien vio jugar al pocho guzmn el medio centro que le hace falta a la seleccin y que anduvo mame y mame que se iban a desquitar con el amrica
785,43398,hora de conseguir novio pocho
786,43399,por eso siempre hay que hablar en la cancha como deca le gran cuauhtemocb10 y no en las conferencias no crees pocho guzmn
787,43400,bienvenido a los clsicos pocho no se nos esconda para la prxima pd capi hoy perdi todo uno jugando y al otro ni se va a presentar al resto del equipo bah que poco se hacen respetar chivas
788,43401,que tendra mas grande el pocho el hocico la nariz o el cul que cogido imagen obra de akyanyme
789,43402,el pocho fue el ms bocon y fue el que menos hizo
790,43403,pocho guzman so dumb bruh
791,43404,pocho guzmn te me caste bro
792,43405,pocho guzmn solamente la hace de pedo por qu es la nica manera de sobresalir ya que en el campo nadamas no aparece que bueno que una vez ms pusimos a chivas donde debe de ir bien jugador clubamerica
793,43406,todo callado en el norte todo callado en guadalajara el pocho y el bofo callados solo uno haciendo ruido
794,43407,el pocho guzmn viendo a su atlas desde su casa en tonal en el clsico tapato
795,43408,el pocho guzmn crey que el clasicodemexico era uno de esos partidos pedorros que se aventaba con el equipo chico de los tuzos y hasta lo expulsaron
796,43409,ponche pocho guzman el amrica te cerr el hocico bocn no juegas nada eres la farsa ms grande del ftbol pochoguzman5
797,43410,el pocho reclamando como si el arbitraje hubiera influido en la forma tan asquerosa que jugaron no mames pocho
798,43411,el pocho apareci al final del clsico para ser expulsado no mamen
799,43412,pocho y vega se hicieron de tarjetas para as saber todos que jugaron de no ser as hubieran pasado desapercibidos
800,43413,pierdes por un baile acaba el partido te callas y te vas al vestidor con vergenza deportiva pocho no te haces expulsar a lo pendejo el arbitraje no influy en nada ganaron bien
801,43414,al final el pocho si apareci solo para reclamar y hacerse expulsar
802,43415,vctor el pocho guzmn expulsado al terminar el partido el capitn de chivas vio la tarjeta roja por reclamos al silbante
803,43416,al pocho le sacaron roja
804,43417,pocho guzmn prefiri ir a inventarse una roja a jugar contra el club de sus amores enfundados en esos miserables colores rojiblancos
805,43418,pocho ms rojinegro que nada se hizo expulsar para no jugar vs atlas el equipo de sus amores noesamoreselbicampon
806,43419,ojal pronto el pocho guzmn encuentre quien se las pague
807,43420,neta pa variar no buscamos quin nos la hizo sino quin nos la pague pocho expulsado se pierde el clsico tapato
808,43421,pobrecita de la familia del pocho guzmn han de estar bien preocupados que anda desaparecido desde hoy a las 9pm mis oraciones estn con ellos
809,43422,pocho mejor te hubieran expulsado por darle un putazo a henry por festejarnos as
810,43423,ay pocho a ver si aprendes en chivas se habla jugando ftbol dentro de la cancha y te haces expulsar
811,43424,lo del pocho al final terrible entendible la frustracin y el enojo pero no puedes hacerte expulsar ya terminado el encuentro y encima sabiendo que te perders el clsico tapato
812,43425,no puedes ir a hacerte expulsar as y menos cuando el siguiente partido es otro clsico mal ah el pocho se nos est viniendo la noche
813,43426,y el atlista pocho haciendose expulsar jajaja la ptm guzmanpocho06
814,43427,pocho guzmn siempre as sido y seguirs siendo un piojo
815,43428,pocho jugo cagada vs el ame y se hace expulsar para no estar vs atlas los dos partidos mas importantes de su equipo se le ve de huevos al nuevo idolo rojiblanco
816,43429,jajajajajajajaja no mamen que jug el pocho guzmn y que lo expulsaron
817,43430,para el pocho
818,43431,la nica imagen que tenemos del pocho en el clsico es recibiendo la tarjeta roja diosito nos volvi a abandonar
819,43432,as se deberan de poner 10apg les mienta la madre en su cara y se achican y como el pocho es mexicano bien envalentonado lo expulsa de inmediato
820,43433,mira vos el pocho guzmn mas rojinegro que todo twitter atlas
821,43434,pocho no puede estar quejndose de todo ya lo expulsaron y se va a perder el segundo partido ms importante de la fase regular
822,43435,lo del pocho guzmn en su primer clsico fue lamentable estuvo ms presente en las conferencias de prensa previas que en el partido en s y despus del silbatazo final se hace expulsar se perder el clsico tapato
823,43436,jajaja vale verga el pocho expulsado
824,43437,el pocho guzmn ama mas a atlas que nadie
825,43438,dicen por ah que el pocho sigue buscando quien se la pague
826,43439,como buen rojinegro el pocho coco guzmn haciendose expulsar para no enfrentar al equipo de sus amores
827,43440,estadsticas de pocho roja
828,43441,mira lo del pocho es que as no puedes ser el referente de chivas
829,43442,pocho guzmn es ms rojinegro que varios de aqu jajajajaja
830,43443,jajajajajajajaja el pocho guzmn no podr decir esto el 1 de abril que magia
831,43444,roja despus del pitazo final pocho gracias por echarte el equipo al hombro en los primeros juegos pero hoy fuiste uno igual al resto cagados
832,43445,el pocho jajajajaja
833,43446,pues dganle al pocho que siga buscando quien se las pague 2 4 gano el ave de las tempestades
834,43447,vena siendo referente de chivas y cuando lleg la hora de los clsicos tir todo a la basura desaparecido vs el amrica se hace expulsar de una forma estpida y se perder el clsico contra el atlas pocho pecho fro
835,43448,pocho guzmn expulsado
836,43449,pocho guzmn ms atlista que lico cortina
837,43450,pocho no es pendejo se hizo expulsar ese es su pinche dolo de 4 partidos
838,43451,avsenle al pocho q siga buscando quien le pague los platos rotos q se van acumulando fercevallosf j pietra odin ciani pepehanan
839,43452,y todava expulsaron al pocho jajajaja
840,43453,el pocho guzmn sin ser de mi agrado es tan rojinegro que se hizo expulsar para no enfrentar a su equipo favorito
841,43454,pocho haciendo un jess molina que lastima crea que al fin tenamos un capitn de verdad
842,43455,quizs el pocho aprendi que es mejor hablar dentro y no fuera de la cancha
843,43456,pocho fantasmeo todo en partido y decide aparecer ya terminado para insultar al rbitro y ganarse la roja mas pendeja posible brillante simplemente brillante
844,43457,jajajaja expulsaron al pocho guzmn
845,43458,finalizado el encuentro se fue expulsado el pocho guzmn fue a reclamar a marco antonio ortiz y el central le sac la roja chivas enfrentar en dos semanas el clsico tapato sin su capitn tudnradio
846,43459,termina el clasicodemxico chivas 2 4 clubamerica goles de jonathan rodrguez 2 leo surez henry martin autogol de emilio lara y sergio flores noche grande de las guilas y muy triste del rebao al final fue expulsado el pocho vctor guzmn
847,43460,pft el pocho
848,43461,as as se gana en la cancha y no hosiconenado aparte de que se fue expulsado el gran pocho ahora que dir la prensa amiga solapadora no los leo no los escucho que dirn los llorones que les arda el culo arriba el clubamerica
849,43462,se le sali lo rojinegro a mi pocho
850,43463,ay pocho
851,43464,expulsaron al pocho y el siguiente partido es el clsico tapato estoy al borde del colapso
852,43465,te quiero mucho pocho pero no mms como te haces expulsar cuando el partido ya se haba terminado cuando no tuviste participacin en el mismo y previo al clsico contra atlas
853,43466,el pocho es tan rojinegro que se hizo expulsar para no enfrentar al atlotas
854,43467,el pocho guzmn no apareci en todo el perro partido y se hizo expulsar cuando ya haban pitado el final
855,43468,el pocho se hace expulsar para no jugar contra el atlas
856,43469,que grande pochoguzman5 te haces expulsar para no jugar contra el equipo de tus amores el atlasfc el pocho ms rojinegro que el pistache torres
857,43470,pocho guzmn hacindose expulsar de la manera ms estpida posible y ahora se pierde el clsico tapato
858,43471,el pocho guzmn prefiero ser expulsados que jugar vs el equipo de sus amores
859,43472,pocho guzmn expulsado se pierde el clsico tapato no quiso jugar contra su equipo
860,43473,al pocho le hierve la sangre en el cuerpo pero no le lleg al cerebro se pierde el clsico tapato
861,43474,si sabes como estamos lo que menos necesitbamos era que nos quitaran al mas fuerte para el clsico gracias pocho
862,43475,si no poda ser peor el pocho expulsado
863,43476,bastante para analizar de este partido por parte del dt de mis chivas no puedes entregar un juego de esa manera hay jugadores que siguen sin sentir los colores del equipo la expulsin del pocho es sinnimo de la desesperacin tremendo error
864,43477,una vergenza lo del partido de hoy carlos cisneros no se que hace de titular la defensa psima dejando espacios al rival hoy el pocho no fue el de otros partidos y nunca se vio beltran equivocado en sus pases al menos se viene fecha fifa para replantear
865,43478,el pocho no jug y lo expulsaron jajajajaj
866,43479,el pocho guzmn se va expulsado se pierde el clsicotapato
867,43480,termin el clsico nacional con victoria contundente de amrica en contra de chivas malas noticias para el rebao pocho guzmn fue expulsado al finalizar el juego y se pierde el clsico tapato ante atlas
868,43481,no tiene vergenza pocho y por hablador lo mandaron a descansar la siguiente fecha este era un partido para demostrar lo que tanto venamos aplaudiendo y el que intent ms fue vega cllate y acta
869,43482,la cereza en el pastel pocho regalando una expulsin
870,43483,adems de la humillacin del 4 2 ante amrica tras el silbatazo final fue expulsado el pocho guzmn se perder el clsico tapato asmexico jornada12 clausura2023
871,43484,elclasicodemexico el clubamerica derrot a las chivas del guadalajara por 4 2 guadalajara sali de 0 3 y por recibir 3 goles en el primer tiempo no pudieron regresar el pocho fue expulsado al silbatazo final tudn desdelacuna ligamx vamosamerica
872,43485,el pocho sabe que no puede enfrentar a su nico amor entendemos tu sufrimiento vctor merecida roja
873,43486,al chile que bueno que expulsaron al pocho si va a desaparecer en partidos importantes para que vrgas lo queremos
874,43487,el pocho acaba de decir los hombres no sirven para nada el pocho jaksjskaallsksajqi
875,43488,el america con muy poco orden y toque preciso nos exhiben no es como que hayan corrido mas simplemente saben dar el pase a donde estn sus jugadores aca vega entro a madrear a un jugador pocho a pelear y la defensa una cumbia antes no se perdio 6 0 por los inventos de puano
876,43489,estas todo pendejo pocho guzmn
877,43490,expulsaron al pocho al ltimo quin te las pag marijuannno
878,43491,le reprochamos a diego cocca que no haya convocado al pocho guzmn pues hoy fue un fantasma no toc la pelota y termin expulsado de manera estpida
879,43492,pocho guzmn amrica va ha sufrir
880,43493,el mejor torneo en dcadas de chivas fue humillado en su casa otra vez as es la realidad el america tiene que levantar su ttulo 14 o de nada servir tanta celebracin pero por ahora pocho guzmn quien te la pagar
881,43494,el pocho guzmn hacindose expulsar al finalizar el partido para no jugar contra el atlas ese cabron es ms rojinegro que medrano
882,43495,pinche pocho en 90 no toco ni una y despues la hace de pedo con el arbitro
883,43496,no te viste en todo el p to partido hoy y ya terminado te haces expulsar guzmanpocho06 felicidades por perderte el clsico tapato pocho te gano la emocin muy cabron
884,43497,hoy el pocho aprendi que es mejor hablar en la cancha y no fuera de ella
885,43498,donde esta el pocho el pocho donde estas
886,43499,al pocho guzman le gano el corazn se hizo expulsar para no enfrentar a su casa jajajajajajajajajajajajajajajajajajajajajajajajaja el pocho mas rojinegro que el macue robles asi me gustan joootooos
887,43500,ojo que echaron al pocho cagon guzman al final del partido roja alv
888,43501,pense que no habia jugado el pocho hasta que le sacaron roja
889,43502,pocho fuera del clsico vs atlas para que ir a reclamar lo que ya estaba perdido no puede ser tanta pendejada en un solo partido aqu se not la novates de paunovic chivas
890,43503,ve el pocho hubieras jugado bien cabrn no apareciste nunca en el partido
891,43504,lo de pocho tristsimo
892,43505,pocho guzmn si te ardi la derrota que no se note tanto sin clsico y sin seleccin
893,43506,me agito ms la expulsin del pocho que la derrota
894,43507,si ya saben que le gana la malilla al pocho por que no le dan su pase apenas termina el partido
895,43508,yo creo que van a seguir buscando quin se las pague o no pocho
896,43509,pocho guzmn hacindose expulsar para no enfrentar al equipo de sus amores jajajaja jajajajajaja
897,43510,expulsin tonta de pocho guzman se pierde el clsico vs atlas
898,43511,espero que se le critique al pocho con la misma vara que con alexis hoy no jug como jugador del guadalajara
899,43512,y expulsan al pocho guzmn para acabarla de chingar todo mal esta noche
900,43513,jajajaja la expulsin del pocho guzmn lo que ms me gust del 2do tiempo somosamerica
901,43514,todos todos tienen la culpa les dio fro pero ac se pendejeo al vega y no se habl antes de tiempo con el pocho que hoy no se vio buenas noches
902,43515,el pocho guzmn solo habl en la previa en el campo fue un fantasma dignonde walking dead va reclama quin sabe qu y se va expulsado ni se la cobr al clubamerica y se pierde el clasico vs atlas menos bla bla bla y ms futbol
903,43516,por si algo le faltaba a la triste exhibicin del pocho guzmn lo expulsaron y se pierde el clsico tapato
904,43517,jonathan el mejor de america lira el peor y chivas sin duda pocho guzman jugo uno de sus peores partidos en el rebao 4 2
905,43518,el hocicn del pocho sigue reclamando cuando slo hubo un equipo en la cancha tantita madre chivas jajaja clubamerica y ya ganpap
906,43519,cada vez que veo al pocho
907,43520,chinga tu madre pocho
908,43521,el pocho guzmn fue el que anduvo de verguero primero y fue el peor de su equipo nunca falla
909,43522,expulsaron al pocho
910,43523,que pendejo el pocho jajajajajajajajaja
911,43524,el pocho guzmn no apareci en todo el clsico nacional y le sacaron roja al final jajajaja quin dijiste que te la iba a pagar wey a mamarla
912,43525,ya llego el pocho jajajaja y fue expulsado al finalizar el partido jajajajaja
913,43526,y el pocho guzmn lo nico que hizo fue hacerse expulsar omardepor
914,43527,el pocho guzmn adems de ser un drogadicto tambin es bocn y pechote fro
915,43528,los hombres no sirven para nada lo dijo el pocho asi que tiene razon
916,43529,adems de la derrota chivas pierde al pocho guzmn por expulsin y no estar contra el atlas 4 2 el clasiconacional fue amarillo
917,43530,pinches jugadores sin huevos empezando por ti guzmanpocho06 y ferbbeltran corren a lo pendejo nadamas estuvieron de hocicones toda la semana para que para dar vergenza si no pueden vyanse a otro equipo regresate a pachuca sino puedes pinche pocho
918,43531,parece que el pocho guzmn di su peor partido en el peor momento adems se escondi todo el partido nada ms para que lo expulsaran al final no chingues guzmanpocho06 concentrado
919,43532,porque no metieron al pocho guzman tal vez sigue buscando quien se la pague clasiconacional
920,43533,el pocho ya siente los colores rojiblancos qu curioso
921,43534,y por si no faltaba algo ms perdemos al pocho tambin
922,43535,y para terminar la orinada que nos dieron hoy el pocho pocos huevos guzmn se hace expulsar que fcil hacerse a un lado cuando sabes que no apareciste en el juego ahora no tendrs excusa porque no tendrs que jugar el siguiente partido un clsico por cierto
923,43536,expulsaron al pocho y no juega contra atlas
924,43537,jajajaja el pocho
925,43538,pos no que el pocho guzmn era cryuff reencarnado
926,43539,el pocho hacindose expulsar para no jugar el clsico
927,43540,seguir buscando el pocho guzmn quien se la pague
928,43541,y el pocho se hace expulsar para no jugar contra el equipo de sus amores
929,43542,el cocainmano pocho guzmn hombre ley prefiere no enfrentar a su equipo del alma vistiendo esos inmundos colores y se hace expulsar un juego antes
930,43543,que orinada hahaha y expulsaron al pocho hahaha
931,43544,el pocho guzmn mas rojinegro que el mismo chango almaraz
932,43545,por ese tipo de situaciones no llaman a la seleccin al pocho espero lo hayas visto a nivel de cancha querido enriquevonbeas
