,Id,Tweet
331,92102,ya mejor matenme no hay nadie que me emocione tanto ver en la serie perdn
332,92103,gente ayuda no que wea pero parece que se reevio de nuevo la caga de link no lo habran porfa
333,92104,pero pa que se menosprecia el sin tripita igual es genial
334,92105,roier el nico hombre que me hizo llorar fue mi pap no te voy a dar ese privilegio con tus mentiras
335,92106,quiero ser un chico qsmp
336,92107,ojala el tal quackity est en el qsmp
337,92108,todo sea por estar con ella
338,92109,recuerden no hacer spam en el chat sobre el qsmp hacerlo de broma en twitter es distinto a hacerlo en el chat de twitch no hagan spam de esas cosas all hagan caso a las reglas
339,92110,me voy a mimir tengo sueo
340,92111,aaaaaaaa mi animadora fav en qsmp waaaaa
341,92112,yooo juro q lloro si no esta
342,92113,que ganas de ver farfa en el qsmp
343,92114,roier se est burlando de los q creen q estar en el qsmp yo era esa gente
344,92115,que alegra si podr ver el inicio del qsmp
345,92116,ni modo ya me toca aceptar que no hay roier en el qsmp ann triste
346,92117,jajajajajaja no puede ser recin me doy cuenta que en lugar de escribir qsmp escriba qspm la menos dislexica todo mal
347,92118,ya empezo con sus webadas
348,92119,vegetta esta en el qsmp
349,92120,la primera gala de estos dos tontos lt gt c qsmp galaqsmp oc  aesthetics originalcharacter myart
350,92121,roier no digas eso
351,92122,est bien roier respeto todo pipipi
352,92123,q linda es dari merece todo lo bonito de este mundo
353,92124,nombre banda dejen de chingar al roier con el qsmp si no est no est y por mas presin social q le pongan no va a estar mgicamente no sean mamones
354,92125,nac por mi madre morir si roier no est en el qsmp
355,92126,dios entre q hoy vegetta entr al qsmp y pasaron muchas cosas en la escuela etcetc m voy a matar
356,92127,si el chat spamea sobre el qsmp los vergeo no anden chingando
357,92128,roier dice que no va a estar en el qsmp la comunidad entera
358,92129,acabo de entrar al stream ya dejenl0 o bala
359,92130,ni quiero abrir el stream
360,92131,para mi q los participantes del qsmp van a ir entrando de a poco si es eso
361,92132,que es eso de qsmp escuche que iba a estar
362,92133,carrera por favor me estoy volviendo loca ya di q estas en el qsmp necesito terapia
363,92134,creo que voy a dormir me estoy muriendo
364,92135,robloxdown me comis los huevos kiero jugar doors
365,92136,an no le creo
366,92137,alguien sabe a que hora empieza el qsmp
367,92138,entre ms dice roier que no va a estar en el qsmp ms pienso que s estar
368,92139,cuantos participantes son en el qsmp pq han revelado poquitos y empieza maana
369,92140,roier dijo que en serio no est en el qsmp
370,92141,cansao d la vida culeada
371,92142,mmm te creo roier
372,92143,basta plis no escucho soy sorda
373,92144,estoy cayendo en la locura
374,92145,roier ustedes creen que anunciando a vegetta van anunciarme a mi roier no digas eso
375,92146,oigan mi dm y mi cuenta esta totalmente abierta para que me compartan su emocin por cubitos y teoras de qsmp y los ships se que se siente que nadie comprenda tu emocin hacia las cosas menos hate ms hype y amor qsmp quackity luckity vegetta777
376,92147,una seal de que vas a entrar al qsmp
377,92148,lleg rooooob
378,92149,y ahora es cuando prende mariana y entonces los 4 entran mgicamente a minecraft oportunamente teniendo un server con el nombre de welcome to the qsmp y en donde hay una invitacin para los cuatro porque como son un mccombo no pueden recibirla por separado
379,92150,tena q hacer tarea pero me puse a jugar roblox msmsms
380,92151,1d y roier en el qsmp
381,92152,roier prendi reales es tiempo de manifestacin
382,92153,hoy roier anuncia que estar en el qsmp 1 probabilidad 100 f
383,92154,me dedique a no verte y me encerrw en mi mundo y no pudiste detenerme
384,92155,si roier y shadoune no estn en el qsmp voy a llorar como la persona sin amor parental que soy
385,92156,mienteeeeeeeeeeeeeeeeees
386,92157,y titi
387,92158,no puedo ver a roier pero sigo aferrada tengo fe malditasea
388,92159,lo que esta pasando ahorita me recuerda a cada vez que los skz han logrado algo y lo celebramos al momento de que los otros tambin lo hagan llegan las monas de una si porque ya mi fav lo logro ahora es mejor que el tuyo si porque ahora los tuyos son flop ect pero a los
389,92160,en pocas horas o minutos se decide el destino de mi vida me mu3ro
390,92161,que risa maana tengo clase hasta las 3 4 y no podr ver el qsmp jajajja
391,92162,dios porfavor ya drjen el qsmp no esten enfadando al roier
392,92163,roier va a hablar del qsmp
393,92164,carre se fue al pasto por lo que dijo recin jajsjsjsjsjjs lo amo porque no le tiene miedo a la funa
394,92165,roier participar en el qsmp roier participar en el qsmp roier participar en el qsmp roier participar en el qsmp roier participar en el qsmp
395,92166,hoy roier confirma que estar en el qsmp
396,92167,me voy a tener que exprimir el cerebro para aprenderme todos los nombres del qsmp
397,92168,todo parece indicar que roier no va a estar en los qsmp y este vdeo me define totalmente
398,92169,por favor que el mctro ft rivers confirmen su participacin en qsmp
399,92170,nervios nervios nervios
400,92171,basta de decirle lo del qsmp a roier malditos
401,92172,cmo que vegetta va a estar en qsmp
402,92173,tenemos feeee qu hay cuando se rompe un huevo una sorpresa o probablemente no pero hoy es martes con m de maana empieza el qsmp y la fe es lo ltimo q se pierde
403,92174,si pero solo para personas muy cercanas
404,92175,ahora es cuando roier confirma su participacin en el qsmp recuerden mis palabras
405,92176,no la puedo creer sr dantdm va a venir a qsmp no puede ser
406,92177,roier prendi
407,92178,recuprate pronto yo estoy viendo the glory y the mandalorian te juro que son buensimas
408,92179,carre en el qsmp
409,92180,creo que soy una persona q se enoja rapido siento q puedo estar enojada quin sabe minutos horas das o meses jffndnmsjska
410,92181,jajajajajjaja qsmp ahora en televisin amiguitos
411,92182,okay roier prendi es la ltima vez que le voy a creer a un hombre
412,92183,che pinta hacer un grupo de wsp para hablar de qsmp
413,92184,no webeen con el link del virus de nuevo de nuevo no
414,92185,en q momento cambiaron el banner del genshin jajaja
415,92186,roier prendi eso significa que est en el qsmp
416,92187,d vdd que no topan lo que significa que vegetta est en el qsmp jams haba hecho algo as
417,92188,como que fernanda shadow no va a estar en el qsmp
418,92189,an no logro procesar todo lo que esta sucediendo qsmp el primer server bilinge hecho por quackity literalmente el puente entre idiomas y la persona perfecta para esto donde estarn philza vegetta spreen missasinfonia wilbur soot jaiden maximus y mucha gente ms
419,92190,prendieron roier y aldo
420,92191,aqu va toda mi fe vamooos
421,92192,como desquiciada estoy yendo del stream de carre rubius rivers aldo y ahora roier para ver si pasa algo
422,92193,roier va a comenzar directo y es necesario recordar esto si quieres spamear roier en qsmp mejor hazlo ac en tw y no en su chat es incomodo y molesto ya cuando anuncie nos hacemos los sorprendidos aun tengo f
423,92194,siento q carre podra decir q esta en qsmp pero no se
424,92195,si ahora que esta en stream roier vuelve a decir que no est en el qsmp confirmamos que si est okey
425,92196,ya van a anunciar a roier
426,92197,me acabo de imaginar a perxitaa en qsmp y que as yo podra tener interacciones de perxas cubito y vegetta
427,92198,prendieron que pase lo que tenga que pasar
428,92199,maana salgo tarde de la escuela y no s si voy a llegar a ver el qsmp
429,92200,q rubius diga q va a estar en el qsmp
430,92201,breaking my silence auron estar en el qsmp hasta aqu mi reporte joaqun
431,92202,no voy a poder ver el qsmp pq voy a estar en el colegio que vida mas miserable
432,92203,momento gala en el qsmp me veo re fachero wachos
433,92204,pues yo ya estoy feliz con los integrantes del qsmp
434,92205,bienvenido a isla quesadilla qsmp qsmpfanart spreen quackity este es el ltimo
435,92206,prendi roier ya empez mi esquiozofrenia
436,92207,lo nico que me puede sacar de esta tristeza llamada farfa no va a estar en el qsmp son una milanesas con papas fritas
437,92208,roier hoy anuncia q va estar en el qsmp
438,92209,roier prendi pq va a confirmar qu est en el qsmp
439,92210,todava tengo esperanza de que rubius est en el qsmp ok djenme
440,92211,toier prendio mi fe en q este en el qsmp subi ms q antes
441,92212,pinche contestacin ms seca que un limn de taqueria
442,92213,dale quackity no seas tmido anuncia q est carre en el qsmp
443,92214,ola licenciado le quera decir q maana no podre ver el qsmp pq tengo clases y no me dejan ocupar el celular pero desde hace tiempo q tengo este dibujito y se lo quera mostrar eso bye qsmp qsmpfanart quackity
444,92215,maana es el qsmp ayuda a
445,92216,prendio roier ya esta
446,92217,ke buenita soi u u
447,92218,amo la chocotorta
448,92219,los kiero
449,92220,ojooooo roier en directo
450,92221,quackity que piensas tu eh wacho maana es el qsmp y va a empezar como a las 12
451,92222,maana me voy a perder el estreno de qsmp haganme bullying
452,92223,rezando para que el qsmp sea en la tarde por favor
453,92224,aldo prendi deseando deseando q diga hoy q si est en el qsmp
454,92225,todos andan canjeando cosas a lo pendejo en el stream de carre es grandioso
455,92226,las que comentan son las misma que despus andan diciendo que no les den importancia a los estados unidos por que slo son un pas xenofobico con los idols pero all estn chupando verga estadounidense
456,92227,duda hay video o clip de cuando recibe la invitacin es que no encuentro nada
457,92228,quesesoooo
458,92229,confirmen al rubius en el qsmp o los demando
459,92230,hoy el mctrio anuncia su participacin en qsmp
460,92231,me siento mal xd
461,92232,mana qsmp
462,92233,si se meten con chae me la meten a mi
463,92234,algunos d ustedes son como kpop gt moral
464,92235,no voy a poder ver el estreno de qsmp por tener q ir a levantar la pala
465,92236,no estoy lista
466,92237,termine mis proyectos tengo vacaciones y ahora pasa esto no soy la favorita de dios
467,92238,quackity sube el cartel de wilbur y charlie en el qsmp dale por favor
468,92239,fantasma captado 100 real no fake en la galaqsmp estn listos yo s qsmp
469,92240,prendi algo eso significa mctrio en el qsmp
470,92241,ando sad maana no ver el qsmp por la escuela ojal la suspendan o algo por los huaicos
471,92242,habr banquete verdad ready con muchos nervios galaqsmp qsmp quackityfanart
472,92243,rubius estar en el qsmp
473,92244,me gustara saber la gente nueva qu piensa cuando ve esto
474,92245,ya digan qnes ms estarn en el qsmp pspspspspsppspspssps
475,92246,q educado mi stremer
476,92247,grande messi emocionado pq vegetta esta en qsmp
477,92248,vamos a escuchar a carre cagar
478,92249,pasen la imagen de la gala qsmp quiero dibujarme tambien
479,92250,entre a tw y cmo q veg esta en el qsmp
480,92251,7 minutos para las 4 30 en los angeles
481,92252,soy solo yo o carre hoy est actuando ms pelotudo de lo normal eso solo puede significar que est en el qsmp
482,92253,amigo maana es el qsmp y sabemos menos d 20 personas nomas q prosigue llorar
483,92254,que clase de conversaciones tendran estos tres qsmp foolish vegetta philza
484,92255,carre en el cuesemepe
485,92256,yo maana suscribindome a los canales que estarn en el qsmp
486,92257,cancion del ao
487,92258,wey me caga que los profesores no digan clara las cosas que quieren y luego chinguen el trabajo de los dems por eso
488,92259,japi pq al menso en mi cum empieza el qsmp
489,92260,maana tengo toda la tarde libre voy a poder ver el qsmp en paz aaaaa q emocin
490,92261,que vegetta aceptar la invitacin al qsmp es un gesto muy lindo de su parte
491,92262,q lindo se ve mi ly en coso blanco
492,92263,tengo fe en que rivers diga miren estoy en el qsmp
493,92264,vayanse a la mrd con sus flores del orto se las pueden meter por el poto
494,92265,qsmp ya anuncien a rob o lloro
495,92266,maana es el estreno del qsmp ac estan los horarios se trasmite por
496,92267,hoy mi compaera se puso a escribir en la mesa que iba aprobar la prueba de hoy que justamente era oral y cuando se fue a que le tomaran borre eso y regres dicindome que se saco 7
497,92268,jajaja ya quiero ver
498,92269,lo de chaeyoung me dej as 0
499,92270,jajajansnans qu es esto por dios
500,92271,a las 15 00 es el primer da del qsmp y yo maana como 16 30 tengo q irme me cago en todoooo
501,92272,yo soy lulu 99
502,92273,no puedo mas de los nervios
503,92274,oye maana empieza el qsmp y son solo 10 gatos wilbur y slime q aun no los anuncian
504,92275,yooo si m dicen q mi vida va a ser una mierda les voy a creer ciegamente
505,92276,necesito un karaoke de puras canciones de robleis
506,92277,oigan ya pas mucho tiempo desde que anunciaron a otro integrante del qsmp
507,92278,ya quiero poner esto cuando anuncien a dtk en qsmp
508,92279,otra vez en casita de joss
509,92280,que pero me duermo tantito y vegetta ya esta en el qsmp bastaaaa estoy llorando
510,92281,es el cumple de edu como no le feliciteis voy a enfadarme mucho
511,92282,ya se pusieron a spamear lptm
512,92283,ok no dijo ms nada dudo q este roier ahora la puuu
513,92284,au heroes y villanos q jefe de una organizacin delictiva descubre la identidad del mas famoso heroe ligthu y se acerca a el con intenciones de pasarlo a su lado
514,92285,maana empieza el qsmp que emocin
515,92286,crculo de manifestacin rubius confirma que est en qsmp
516,92287,qu mierda es esta cosa
517,92288,yo siempre soy de apoyar las decisiones de rub pero no le creo que no est en el qsmp ya dilo por dios que no puedo con el hype
518,92289,si rivers o tina llegan a ser parte del qsmp ya va me muero muerta me encuentran
519,92290,me quieren llevar a guasabe en vacaciones ventaja elotes desventaja no qsmp
520,92291,quackity dijo que haba que estar pendientes en las pistas que iban a estar dejando sobre el qsmp y spreen subi de la nada una foto con un fondo verde atrs yo digo que maana se confirma dream
521,92292,noooo carre jugando getting over it sera buenisimo
522,92293,carre esta mas esquizo q nunca
523,92294,y si y si y si rubius si est en el qsmp y esto lo tienen planeando y harn un casino donde los dos lideren vuelve la personalidad de quackity en las nevadas y el oso ambicioso tremendo rolep
524,92295,mientras tanto voy a aprender a jugar valorant
525,92296,el directo de carre de hoy es mi hiperactividad materializada en forma humana
526,92297,aber si no muero primero
527,92298,que bendicin
528,92299,alguien por favor dgame que el clip de rubius es mentira y que si va a estar en el qsmp pq estoy a punto de arrancarme los tres pelos de la cabeza del colapso
529,92300,por qu nadie habla de la tremenda idea que tuvo quackity de presentar poco a poco a los participantes del qsmp donde ellos tienen su propio espacio con un mini puzle para buscar el boleto del tren tremenda la imaginacin de ese man
530,92301,se imaginan que los que mas dicen que no estan en el qsmp son los habitantes de la isla y nos llevamos la sorpresa
531,92302,jskjddk mi oc es medio raro pero est inspirado en mi mascota galaqsmp qsmp
532,92303,voy al gym y cuando regrese quiero ver que roier este en el qsmp
533,92304,quackity plane todo desde siempre
534,92305,sal de ah por favor te lo ruego
535,92306,lauraaaa se te ve la tanga
536,92307,es cine
537,92308,como lo kiero
538,92309,realizar un trabajo de dos semanas un da antes de la entrega es parte de la experiencia universitaria
539,92310,xime no m responde c
540,92311,recuerdan cuando quackity nos tuvo 2 das sin dormir resolviendo un quest de las nevadas bueno ahora van 4 das desde que nos tiene sacando teoras de los integrantes y el lore detrs del qsmp
541,92312,si rubius no termina el stream confirmando juro no llorar
542,92313,estas loki
543,92314,y titi wonydmc
544,92315,no me imagino la de lore que habr con quackity y wilbur en el qsmp
545,92316,vamos a tener ms luckity gracias al qsmp
546,92317,rivers est en directo
547,92318,vegetta habla el mundo obedece no ms qsmp puro pinche isla pato
548,92319,tina tambin estara en qsmp no la comfirmaron pero no tengo duda
549,92320,tucapel jimnez le enrostr a lagos el indulto al asesino de su padre debera guardar absoluto silencio inoticiascl nacional cooperativa chile trump google lagos qsmp iphone earthquake santiago santiago santia
550,92321,otra vez no por favor no otra vez
551,92322,voy a escuchar 862 cancin y meter como 100 a una playlist jaja
552,92323,soe que roier entraba al qsmp
553,92324,q deca xdios baksnsksnjs lo quiero tanto
554,92325,que miedo quedar en flop
555,92326,no te merece rey
556,92327,miren soy yo dibujo 100 realista galaqsmp qsmp
557,92328,carre ms hiperactivo que nunca se viene qsmp invitacin
558,92329,nooo carre jajjasjaja
559,92330,por lo menos saque a len
560,92331,son creadores muy buenos pegaran en cualquier evento son muy fluidos y espontneos aspiro tener su fluidez ugugugugug sonidos de trabajo bucal qsmp mctrio
561,92332,aaaaaaa foolish y veg estan en el qsmp
562,92333,no podr ver los qsmp
563,92334,1 da para el qsmp
564,92335,mi mami se recibi de tcnica en laboratorio felicitenla ya
565,92336,maana empieza el qsmp recuerden que quackity har directo de esto en su canal principal quackity creemos que maana seguirn anunciando participantes del qsmp que es lo ms probable nos vemos maana en el canal principal de quackity
566,92337,es q se ve en su cara q esta mintiendo
567,92338,me voy a burlar picamente como por una semana
568,92339,q ganas de haber sido ella para sentir y pensar lo q pens y sinti y saber por qu hizo lo q hizo
569,92340,hannah estar en el qsmp hannah estar en el qsmp hannah estar en el qsmp hannah estar en el qsmp hannah estar en el qsmp hannah estar en el qsmp hannah estar en el qsmp hannah estar en el qsmp
570,92341,primeras tiradas y mira todo esto papa
571,92342,literalmente maana voy a faltar a clases para ver el estreno del qsmp no me para nadie
572,92343,conter diciendo que es imposible no saber la voz de illojuan y ayer spreen sin poder adivinarla ajsjjak
573,92344,mi emo fav luzufanart qsmp qsmpfanart
574,92345,yo s que ese fondo verde significa algo dream maana anunciado yo lo s maana me despierto y tengo una notificacion k dice welcome to the qsmp dream
575,92346,yo no estoy loca se que rubius va a estar en qsmp yo lo s y va a ver rubegetta
576,92347,sherry liste pero nerviose para el estreno del qsmp ojo que en minutos empiezo stream de minecraft d galaqsmp qsmp doodle
577,92348,q emocion carajo
578,92349,los tigres del norte en el qsmp confirmado
579,92350,esperaba de todo menos esto jajajajajajaja gente se viene un lore pico en qsmp
580,92351,5 11 y an no pasa nada no pierdo la f
581,92352,tina estar en el qsmp tina estar en el qsmp tina estar en el qsmp tina estar en el qsmp tina estar en el qsmp tina estar en el qsmp
582,92353,esto significa bts en qsmp
583,92354,llore
584,92355,louis lleva 3 aos seguidos visitando mxico amigas
585,92356,qu pov van a ver maana gente yo probablemente spreen o vegetta vegetta est en el qsmp ya gritaron
586,92357,como encuentro mas mutis de carre
587,92358,lod extrao juanplay cubitos
588,92359,roier si va a estar roier si va a estar al borde de la esquizofenia
589,92360,y siempre q se vean le peda un besito en la mejilla
590,92361,oigan como algunas personas estn ocupadas y dijieron que ser una serie larga creen que metan an ya que ha enpezado qsmp sea que despus de un mes metan mas y ms gente
591,92362,dale quackity sub la lista de los miembros de una porfa estoy con la percepcin de la realidad alterada ya
592,92363,les regalo una flor amarilla amigitos de tuiter
593,92364,como se enojaba y empezaba a gritar pq le jodan las escaleras
594,92365,se dan cuenta de que quedan menos de 24 horas para el estreno del qsmp y cada vez queda menos y menos tiempo it s happening
595,92366,rub di que era broma y que si vas a estar en el qsmp
596,92367,carreraaa aprieta el puo de la rabia
597,92368,como que jaiden animations va a estar en qsmp
598,92369,maana qsmp maana qsmp maana qsmp maana qsmp maana qsmp maana qsmp
599,92370,cree que juan cubito va a estar en qsmp
600,92371,cmo que vegetta estar en qsmp y recin ahora me entero hsksvdkdvbdbd
601,92372,el stream de carre esta ms raro de lo normal ajjajajajajajajajja
602,92373,amo ver tanto hilos sobre vegetta para que la comunidad inglesa sepa quien es y porque es tan importante para nosotros
603,92374,si anuncian a robier hago fr
604,92375,se callo horrible jajajaja hasta me dolio a mi alv
605,92376,rubius estar en el qsmp
606,92377,mis fin de semanas adems de kings league sera para ver resubidos de qsmp
607,92378,que hacia akajaj
608,92379,que duolingo tiene un lmite de recordatorios
609,92380,se dio tremendo golpe noooooo
610,92381,vivo en una simulacin ewto no puede ser real
611,92382,voy a organizar mi ig tmb ojala q lo que les qued del da de hoy sea muy lindo lt 3
612,92383,todo es culpa del gobierno
613,92384,yo nams sirvo para procrastinar as que miren mi garabato en una servilleta niideaquees
614,92385,todos los de qsmp reaccionando maana
615,92386,tengo examen de matemticas miedo
616,92387,jajajaj
617,92388,amigo carre anda ms esquizo de lo normal
618,92389,simn qsmp y todo pero no pongan en cada tweet de un streamer qsmp ni en el chat termina siendo cansado y terminan poniendo modo sub en twitch y forzando una interaccin
619,92390,nunca en mi vida he estado tan feliz de tener distinto horario al centro de mxico para m el qsmp empieza aproximadamente a la 1 2pm
620,92391,est re agresivo carre jaja me encanta
621,92392,maana es el estreno del qsmp sera transmitido en el canal principal de twitch de quackity
622,92393,george estar en el qsmp george estar en el qsmp george estar en el qsmp george estar en el qsmp george estar en el qsmp george estar en el qsmp george estar en el qsmp
623,92394,no quierp k nadie mas m hbale d amor
624,92395,roieeeeeeeeeeeer a ti te estoy viendo roier
625,92396,martes con m de por favor rubius di que s ests en el qsmp
626,92397,pueden ser 3 cosas 1 qsmp 2 el video de los squids 3 las farlands
627,92398,ya durmete
628,92399,maana nos cancelaron las clases por una obra el destino quiere q no me pierda el qsmp
629,92400,es que de verdad quackity no debe ser consciente que va a tener al mismsimo vegetta uno de los primeros youtubers hispanohablantes e infancia de todos que es muy reservado pero que acept estar en la serie de lic
630,92401,ya saquen a otro integrante del qsmp ya pas mucho tiempo
631,92402,mis amigas de la u maana me cubrirn en clase para que pueda ver el estreno de qsmp son un solcito lt 3
632,92403,xfavor ya confirmen a george en el qsmp no puedo ms
633,92404,gente maana comienzan los qsmp maana tenemos stream de missa maana comienza el lore de missa cubito maana comienza una nueva era para los missauros missa nos dar de comer banquetes y no midajas
634,92405,carre esta igual que spreen ayer obvio que se viene confirmacin a qsmp
635,92406,es un ladron se lo acabo de decir en llamada
636,92407,karl estar en el qsmp karl estar en el qsmp karl estar en el qsmp karl estar en el qsmp karl estar en el qsmp karl estar en el qsmp karl estar en el qsmp
637,92408,es que solo quackity logra lo imposible
638,92409,no estoy lista para todas las interacciones que tendremos en el qsmp en los squid me andaba muriendo de emocin ahora voy a estar peor
639,92410,la gente guapa solo necesita una cosa una lista oficial de miembros del qsmp
640,92411,estoy triste
641,92412,ya rubius aplica la de spreen d que no te carga la partida de counter y abres minecraft picamente
642,92413,era feliz i no lo saba
643,92414,cndo le pintaba las escaleras a juan
644,92415,no hagan estas bromas q me pongo triste oq se que no va a estar
645,92416,sigo sin creer que taylor swift est en el qsmp bienvenida taylor
646,92417,dejen d hacer edits tan realistas q no ven q me lo creo y me humillo
647,92418,carreraaa cuando elige una foto de perfil para whatsapp su foto un dibujo animado eeh re lindo el carre
648,92419,buenas las matematicas
649,92420,esperando esperando a que confirmen a roier en el qsmp
650,92421,jaiden y dan en el qsmp diosss quackity se fue a lo grande
651,92422,ni que flores amarillas ni que nada yo quiero que vea el qsmp conmigo
652,92423,pa cuando anuncian al nauttv pa el qsmp
653,92424,disfruten el arte semi realista porque en cuanto empiece qsmp voy a dibujar a puros cubitos
654,92425,yo con roier
655,92426,hoy se confirma a shadoune y roier en el qsmp locura
656,92427,estoy rezando para q au este en qsmp
657,92428,amigo que ganas por tirar y conseguir constelaciones de diona cry
658,92429,jungkook confirmado en el qsmp amamos ver
659,92430,roier estar en el qsmp roier estar en el qsmp roier estar en el qsmp roier estar en el qsmp roier estar en el qsmp roier estar en el qsmp roier estar en el qsmp roier estar en el qsmp
660,92431,encontr esta imagen y desde entonces no la solt ms
661,92432,hoy graban el challenge de motores wuuuuuuuu
662,92433,genial y ahora empiezan a haber ruidos en mi habitacin
663,92434,tengp como 4 cuentas abiertas soy el xokas
664,92435,me acabo de dar cuenta que los anglo estn igual de equiso que nosotros por culpa del qsmp los amo
665,92436,pueden
666,92437,xfavor anuncien a los demas participantes
667,92438,spreen diciendo que conoce a young miko gan
668,92439,tengo clase ahi me gritan si rubius confirma que esta en qsmp
669,92440,me avisan si anuncian a alguien me ir a tirar por shenhe
670,92441,ir al colegio pero me van a retirar
671,92442,con esto de lo que dijo rubius la verdad es que ya estoy dudando de si vaa estar el roier
672,92443,recuerdos cuando ulteaba a the boyz
673,92444,dejen de spamear qsmp en el chat de carru
674,92445,si bueno y el mctrio cuando anuncia que va a estar en el qsmp
675,92446,no haba dicho nada pq no quera mufar pero neta ya m estoy espantando
