,Id,Tweet
302,88216,lo que quiero o espero para el final de wrestlemania es que gane wweromanreigns que el linaje ataque con todo que el jefetribal haga o diga algo muy detonante y que en ese momento aparezca therock con sus clsicos silencio y encare y marque el camino a wrestlemania40
303,88217,extrao bocchi the rock
304,88218,oh ahora se por que me gust tanto bocchi the rock desde el inicio
305,88219,fans de bocchi the rock molestos al creer que la autora est casada
306,88220,fans de bocchi the rock molestos al creer que la autora est casada
307,88221,fans de bocchi the rock molestos al creer que la autora est casada
308,88222,fans de bocchi the rock molestos al creer que la autora est casada
309,88223,bien alfin termine de ver bocchi the rock estuvo bueno no se volvio de mis animes favoritos y creo que esta muy sobrevalorado pero si es muy bueno me rei bastante mientras ms avanzaba xd aunque el inicio no me engancho segui y fue a mejor buen anime y grandes memes deja
310,88224,amo las pelculas donde the rock acta de pap
311,88225,ya haba hecho este tweet antes pero lo har nuevamente busco mutuals no soy nuevo en anitwt pero busco ms mutuals para interactuar algunos animes que me gustan dragon ball hellsing love live bocchi the rock death note y pienso verme animes populares como lycoris
312,88226,manapart el nuevo metal que triunfa en armenia a t d losmejoresrock manapart losmejoresrock misery tardigradeinferno armenia numetal soad manapartband man apartt ti metal am meta guide armeniaelen elvis the rock soad fans soadfanschile
313,88227,un evento h de bocchi the rock atrajo enormes filas de fanticos
314,88228,un evento h de bocchi the rock atrajo enormes filas de fanticos
315,88229,un evento h de bocchi the rock atrajo enormes filas de fanticos
316,88230,un evento h de bocchi the rock atrajo enormes filas de fanticos
317,88231,segn en los libros de mi pana santiago jara gt gt gt gt gt gt gt gt gt the rock
318,88232,cmo amo los memes de the rock
319,88233,lo de the rock cargndose el dc universe por no querer volverse un villano me toca profundamente las pelotas y que warner le de el visto bueno mas solo me ver the flash y pq aunque sea mala seguramente me haga una paja mental con los batman juntos con paso con los spider man
320,88234,the rock caga todo lo que toca
321,88235,oye soy yo o montez est obsesionado con the rock xd
322,88236,wweraw camino a wrestlemania extraaba verlo de nuevo desde las 8pm nowwatching rawiswar therock therock envivo foxsports foxsports2 foxsports2hd hd wwexfox
