,Id,Tweet
0,78007,se profundiza la crisis del psg las crticas del plantel a galtier el lamento por paredes y los cambios que se avecinan si no gana la ligue 1 soccer football champions league round of 16 second leg bayern munich v paris st germain allianz
1,78008,es una llave abierta ambos cumplen con la jerarqua con la contundencia espnf360chile gracelazcano y el cruce que animarn el manchester city de guardiola y el siempre candidato bayern mnich por los cuartos de final de la championsxespn
2,78009,hasta el 2023 el bayern munich y allianz prolongan contrato
3,78010,hasta el 2023 el bayern munich y allianz prolongan contrato
4,78011,que bueno que se lesion haaland as julian juega ms tiempo el hijo de puta de guardiola contra el mejor bayern munich de la historia
5,78012,bayern mnich dio el primer golpe ante el arsenal en la champions league femenina
6,78013,foto gracias capitn el exdelantero claudio pizarro quiere que dos estrellas del bayern mnich defiendan la gloriosa camiseta de la seleccin peruana
7,78014,el grfico de goles a favor de los clubes de la bundesliga la lnea de arriba es el bayern mnich muy superior a los dems
8,78015,barcelona y bayernmunich toman ligera ventaja en los cuartos de la champions femenina tribunadeportes
9,78016,hasta el 2023 el bayern munich y allianz prolongan contrato
10,78017,hasta el 2023 el bayern munich y allianz prolongan contrato
11,78018,resultados de los partidos de ida de cuartos de final de la uwcl un gol de lea schller al 39 le da la victoria al bayern mnich en casa por su parte el barcelona se lleva la ventaja gracias a una anotacin de sandra paralluelo al 34
12,78019,resultados en los partidos correspondientes a la ida de los cuartos de final de la uefa women s champions league el fc barcelona venci por la mnima diferencia a la roma mientras que el bayern mnich venci al arsenal por el mismo marcador uwcl
13,78020,ventaja mnima a londres ft bayern munich 1 0 arsenal partido de ida de los cuartos de final de la uefa women s champions league gol en solitario de lea schller la vuelta se juega el 29 de marzo en londres
14,78021,el ms rpido del bayern munich
15,78022,uwcl comenzaron los cuartos de final de la champions league femenina son ida y vuelta hoy bayern mnich 1 0 arsenal roma 0 1 barcelona maana juega el lyon de tiane endler recibiendo al chelsea 14 45 horas de chile
16,78023,champions femenina barcelona y bayern mnich sacan ventaja en cuartos
17,78024,el bayern munich y el fc barcelona se llevaron la ventaja en la ida de los cuartos de final de la uefa women s champions league lea schller y salma paralluelo anotaron respectivamente partidos de maana lyon chelsea psg wolfsburgo
18,78025,apuesta acertada muy cmodamente nos llevamos este apueston con 3 goles de ventaja en telegram el pronostico entero championsleague bayernmunich bayernpsg apuestasdeportivas abets laliga bundesliga
19,78026,uwcl el bara perdona y acaba sufriendo para ganar en la ida salma paralluelo anot el tanto del triunfo y sandra paos firm dos grandes paradas para mantener el triunfo as roma 0 1 fc barcelona bayern mnich 1 0 arsenal fc
20,78027,uwcl cuartos de final ida bayern munich 1 0 arsenal fc as roma 0 1 fc barcelona wsoccerplayers raffacarolina ffdeprimeira fem com futfem futfemdelmundo globalwoso futfemeninomas erafutbolfem sfutebol16 mundofutbol1 emdelfutbol
21,78028,lionel messi al bayern mnich el salario que puede ganar el 10 en la bundesliga
22,78029,uwcl comienza la segunda mitad en el olmpico de roma gana el bara gracias al tanto de salma paralluelo as roma 0 1 fc barcelona en juego bayern mnich 1 0 arsenal fc
23,78030,uwcl un gran gol de salma paralluelo da ventaja al bara tras los primeros 45 minutos de partido as roma 0 1 fc barcelona descanso bayern mnich 1 0 arsenal fc
24,78031,el bayern mnich femenino gana al arsenal en cuartos de la champions league
25,78032,el primer chico fue para bayern munich el elenco alemn se impuso por 1 a 0 sobre arsenal en el encuentro que abri su serie de 4tos de final en la uwcl lea schller la vuelta se jugar el 29 3 en londres
26,78033,bayern mnich dio el primer golpe ante el arsenal en la champions league femenina
27,78034,bayern toma la ventaja el cuadro del bayern mnich femenil venci por 1 0 al arsenal en la ida por los cuartos de final de la champions league femenina el nico tanto lo hizo lea schuller la vuelta se jugar el 29 de marzo femenino uwcl
28,78035,calendario partite olimpia milano in euroleague 24 03 vs bayern munich 28 03 vs anadolu efes 30 03 vs maccabi tel aviv 07 04 vs fc barcelona 13 04 vs virtus bologna olimpiamilano euroleague
29,78036,uwcl arranca el partido en el olmpico de roma el bara busca ganar ventaja en la ida de los cuartos de final ante la roma as roma 0 0 fc barcelona en juego bayern mnich 1 0 arsenal fc
30,78037,podemos hablar de esto en el partido de la uwcl bayern munich vs arsenal se pudo ver que en la seal alemana haba 32 106 personas vindolo en vivo por la seal inglesa 66 181 los 20 000 en la allianz arena
31,78038,por la ida de los cuartos de final de uwcl bayern mnich se adelanta en la serie por la mnima con gol de lea schller la vuelta ser el mircoles 29 03 el arsenal buscar revertir la historia en emiratos stadium 20 000 hinchas asistieron al partido en alemania
32,78039,bayern munich sent que me mora ese da
33,78040,apuesta acertada en telegram el pronostico entero championsleague bayernmunich bayernpsg apuestasdeportivas abets laliga bundesliga
34,78041,bayern mnich 1 arsenal 0 abierto esta cuenta ya haba pronosticado que el equipo ingls no se recuperara de las ausencias de mead y miedema pero bayern baja su rendimiento en instancias decisivas
35,78042,uwcl con el solitario gol de schller el bayern se marcha con ventaja en la ida de cuartos ante un arsenal que tratar de remontar la eliminatoria en londres bayern mnich 1 0 arsenal fc as roma fc barcelona
36,78043,a esta hora se disputan los cuartos de final de la champions league femenina bayern munich vs arsenal 1 0 ms tarde juega roma vs barcelona maana lyon vs chelsea y psg vs wolfsburgo pelaezdefranciscoenlaw eldoctorpelaez
37,78044,las chicas del arsenalwfc merecen por lo menos el empate ante el bayern mnich las estn pasando por encima a las alemanas en el segundo tiempo cmo extraan a mead y miedema
38,78045,lionel messi al bayern la posibilidad de que lionel messi llegue al equipo ms ganador de alemania se abri tras un like que el rosarino le dio a una publicacin del equipo bvaro la aficin tomo dicho acto como un guio al bayernmnich
39,78046,el boca del negro ibarra es milagroso es como la piedra filosofal que todo lo que tocaba se converta en oro este boca cualquier equipo que lo enfrenta se convierte en una mezcla del barsa del pep la naranja mecnica y el bayern munich lastima que el embrujo dura una semana
40,78047,uwcl en juego la segunda mitad en mnich schller adelant a las germanas en el minuto 39 bayern mnich 1 0 arsenal fc en juego as roma fc barcelona
41,78048,uwcl schller da ventaja al bayern con un buen cabezazo antes del descanso bayern mnich 1 0 arsenal fc descanso as roma fc barcelona
42,78049,pronostico 21 03 2023 clasificatorio inglaterra c vs wales c 20 45 cet menos de 3 5 goles stake 1 bet365 en telegram el pronostico entero championsleague bayernmunich bayernpsg apuestasdeportivas abets laliga bundesliga
43,78050,tiembla pep guardiola manchester city jugar el 11 de abril la ida ante bayern mnich en el etihad stadium
44,78051,impresionante centro de rall a schuller precioso gol del bayern munich se le pone cuesta arriba la eliminatoria al arsenal uwcl
45,78052,schller es demasiado buena que manera de clnteolar el juego areo 1 0 para el bayern munich
46,78053,uwcl 2022 2023 cuartosdefinal ida fcbfrauen arsenalwfc bayernmunich arsenal hoy 11 45 hrs tc 10 45 hrs tp 11 45 hrs 12 45 hrs 13 45 hrs 14 45 hrs daznfootball youtubelatam audio de orgen uwclondazn
47,78054,sabas qu el ceo del bayern munich rummenigge le dijo a toni kroos no te pagaremos ms de 10m al ao no eres un jugador de clase mundial sigue
48,78055,xabi alonso asumi con el bayer leverkusen penltimo de la bundesliga hoy estn 8vos a 3 puntos de puestos europeos y en 4tos de final de europa league y vencieron al bayern mnich el fin de semana
49,78056,alineaciones estas son las alineaciones con las que el bayern mnich y el arsenal se estn enfrentando en la ida de los cuartos de final de la uefa women s champions league quin ganar uwcl
50,78057,borussia dortmund es el nuevo lder de la bundesliga con un punto de ventaja sobre bayern munich tras la actividad de la jornada 25 de la campaa 2022 2023 los equipos unin berln y friburgo ocupan los restantes dos lugares para jugar la prxima edicin de champions league
51,78058,uwcl ya rueda el baln de las estrellas en juego el primer partido de cuartos de final en mnich bayern mnich 0 0 arsenal fc en juego as roma fc barcelona
52,78059,no canal da dazngroup teremos a partida das quartas de final da uefa women s league entre bayern munich vs arsenal women
53,78060,regresa la liga de campeones femenil y lo hace con las actuales campeonas visitando italia y un choque prometedor entre alemanas e inglesas uwcl bayernmunich arsenal roma barcelona
54,78061,maradona con la camiseta de bayern mnich claro que s fue en el partido despedida a lothar matthaus hoy cumple 62 aos en mayo del 2000 exhibicin y toques deliciosos de diego que cuando sali par a todo el estadio
55,78062,el bayern munich y allianz prolongan contrato hasta 2033 madurogolpeaaloscorruptos
56,78063,equipos de ftbol por el que simpatizas en cada pas sudamrica blooming river plate gremio nacional cerro porteo atltico nacional emelec europa barcelona manchester city milan bayern munich ajax porto psg solo por messi
57,78064,hoy accin en la champions league femenina juego muy parejo entre bayern munich y arsenal barcelona visita roma partido ir por el canal de rincondecruyff nos vemos en un rato por twitch
58,78065,ya tenemos las alineaciones para el primer enfrentamiento de cuartos de final bayern mnich vs arsenal a las 18 45 se podr ver en el canal de youtube dazn uefa women s champions league
59,78066,exequiel palacios es el segundo sudamericano en anotarle un doblete al bayern munich por bundesliga en la ltima dcada dato de optajavier
60,78067,hoy jugamos la ida de los cuartos de champions contra el bayern munich y salimos con este xi pijudo manu neuer lauraaa princess leah rafinha la tora snaky hips kim chiquita la jefecita we ve got mccabe ford blacksexius
61,78068,hoy empiezan los cuartos de final de la uwcl 14 45 bayern mnich arsenal 17 00 roma barcelona maana 14 45 lyon chelsea 17 00 psg wolfsburgo
62,78069,prediccin 100 real madrid vs chelsea chelsea elimina sorpresivamente al real madrid bayern mnich vs manchester city gana bayern sobrado ante el pep benfica vs inter de miln sorpresivamente pasa benfica a c milan vs napoli napoliskelia gana
63,78070,partidazo bayern munich vs arsenal se enfrentan este martes por la championsleaguefemenina entrate a qu hora empieza y por dnde verlo en vivo
64,78071,madurogolpeaaloscorruptos hay que hablar del leverkusen de xabi alonso el profesor tom al equipo cuando estaba en puestos de descenso hoy venci al bayern munich y ya est octavo a 2 puntos de copas europeas y lleva 7 partidos iralisailc apurehumana aolivero2002
65,78072,hoy hay uwcl arranca la etapa eliminatoria los cuartos de final con 2 partidazos 14 45 bayern munich vs arsenal 17 00 roma vs barcelona como todos los partidos de esta competencia estos se podrn ver en el canal de youtube de dazn
66,78073,el bayern munich y allianz prolongan contrato hasta 2033
67,78074,quieren quedarse con l segn sky sports alemania bayern mnich desea contar con joao cancelo y estara dispuesto a renegociar los 7 0 millones de euros que pide el manchester city
68,78075,allianz extiende su contrato con bayern munich hasta 2033
69,78076,jajajajja cuando ancelotti era dt del bayern munich y les ganaron con dos goles en fuera de lugar de cr7 y no quisieron expulsar a casemiro gracias var por llegar al futbol daberseg maovidalgarcia
70,78077,juegos de champions femenil para el da de hoy 11 45hrs bayern munich vs arsenal 14hrs roma vs barcelona juegazos
71,78078,pronstico favorito uwcl bayern munich y arsenal abren hoy los 4tos de la champions league femenina y nuestro tipster kenesisa69 ha dejado su pick con cuota gt 2 que ya es seguido por ms de 65 pronosticadores pasa a verlo aqu
72,78079,el bayern mnich y allianz prolongan su contrato de patrocinio hasta 2033 tenemos una historia comn de 20 aos de xitos a la que queremos agregar un nuevo captulo bundesliga industriadeldeporte
73,78080,les dejo una combinada para hoy en el ftbol solamente jajaj cuota 3 56 bayernmunich barcelona asroma arsenal wucl freepick apuesta apuestas futbolfemenino pronostico parlay
74,78081,pronsticos 21 03 martes vlez vs central crdoba bayern munich fem vs arsenal fem tepatitln fc vs cancn conoce ms pronsticos aqu
75,78082,xabi alonso subi la sanse a segunda cogi el leverkusen cuarto por la cola y le va a meter en europa habiendo ganado este finde al bayern munich y esta en cuartos de europa league no digo nada y lo digo todo
76,78083,minutos disputados por jugadores de 33 aos o ms de los cuartofinalistas de champions en todas las competiciones inter milan 9 557 real madrid 9 506 bayern munich 6 674 milan 5 556 chelsea 4 583 benfica 3 330 manchester city 0 napoli 0
77,78084,espectacular lo que pas entre el bayer leverkusen y el bayern munich el finde con el exe palacios como protagonista
78,78085,ftbolinternacional el juego entre bayer leverkusen y bayern mnich por la bundesliga tuvo un par de acciones en las que el rbitro tobias stieler se equivoc pero el var lo alert en ambos casos
79,78086,hoy cumple 62 aos lothar matthaus cromosvintage cromosdefutbol cromos borussia es bayernmunich go fcbayernes msfc official inter loversinter robertmdaws ftblsm 3retro footballarchive dfb team es germanysoccer cromosvintage84 1968tv
80,78087,pienso que en la libertadores el equipo que sea va ser un grupo como manchester city real madrid bayern munich
81,78088,tendencia duelos decisivos el sorteo de los cuartos de final de la champions league trae de favoritos al real madrid bayern munich npoles y benfica por encima del chelsea manchester city miln e inter de miln respectivamente viral helvinjeans parati sigueme
82,78089,imagino que sabrs que ese partido lo gan el madrid 3 0 que incluso sin esos 3 puntos hubiera pasado a la siguiente fase y que luego elimin a manchester united y bayern munich en eliminatorias con ida y vuelta que la realidad no joda tu tuit demaggico de un odiador
83,78090,el entrenador que dijo estar con fuerzas para revertir la situacin apunt contra marco verratti quien cometi un infantil error que termin en el primer gol del bayern munich
84,78091,el inesperado guio de lionel messi en las redes sociales que dispar nuevas especulaciones sobre su futuro puede ir al bayern mnich infobae
85,78092,bayern munich arsenal mujeres uefa champions league 1 4 final sportsmcw mcwsports footballnews mcwvietnam mcw predictions odds sportsbook uefa football sportsbetting
86,78093,martes de final mundial bayern munich f vs arsenal f roma f vs barcelona f barnsley vs sheffield wednesday estados unidos vs japn vlez sarsfield vs central crdoba independiente santa fe vs deportivo cali agendaplatinumus
87,78094,martes post puente bayern munich f vs arsenal f roma f vs barcelona f barnsley vs sheffield wednesday estados unidos vs japn tepatitln fc vs cancn fc mineros vs alebrijes atltico la paz vs dorados agendaplatinummx
88,78095,mi prediccin para las siguientes 10 champions league 2023 napoli 2024 arsenal 2025 manchester united 2026 real madrid 2027 barcelona 2028 bayern munich 2029 inter de milan 2030 real madrid 2031 real madrid 2032 barcelona 2033 chelsea
89,78096,arranca la liga cobach plantel 01 ya tenemos nuestro primer rival maana 21 de marzo bayern munich vs redbull fc vamos con todo bayern por los 3 puntos
90,78097,el inesperado guio de lionel messi en las redes sociales que dispar nuevas especulaciones sobre su futuro puede ir al bayern mnich
91,78098,la gente que ms reniega por una derrota es la que cree que alianza lima este ao es el bayern munich pero en realidad tenemos un equipo normaln a nivel internacional y que por ahora son ms nombres que hombres o un equipo alianza est haciendo todo para crecer
92,78099,top cinco equipos con ms posesin de ms cinco grandes ligas de europa 1 manchester city 65 2 bayern mnich 63 9 3 barcelona 62 7 4 arsenal 60 3 5 lille 59 6
93,78100,top 5 equipos ms goleadores de las cinco grandes ligas de europa 1 bayern mnich 72 2 psg 68 3 manchester city 67 4 arsenal 66 inglaterra 5 napoli 64
94,78101,el inesperado guio de lionel messi en las redes sociales que dispar nuevas especulaciones sobre su futuro puede ir al bayern mnich
95,78102,aaaj no entra la pelota y parece que nos estamos yendo a la b aflojen un poco que despus le ganamos 3 0 al prximo y somos el bayern munich estamos en un buen momento se viene el sorteo de la libertadores calma
96,78103,jamal musiala alemania se perder el duelo con per por lesin el jugador del bayern mnich presenta un desgarro de fibra muscular en el muslo izquierdo
97,78104,vi algunas crticas sobre su partido ante el bayern mnich derrota 2 0 y eliminacin del psg pero l no fue el nico muy a menudo ha sido decisivo esta temporada
98,78105,messi juega en el bayern munich y voy a ser mas feliz que el 20 06 07
99,78106,messi le dio me gusta a esta publicacin del bayern mnich
100,78107,por qu estn sacando el paraguas si son el bayern munich colombiano en esta liga no entiendo
101,78108,goles argentinos 19 3 exequiel palacios bayer 04 bayern mnich 2 leonardo surez amrica guadalajara 1 facundo bruera olimpia libertad 1 leandro garete unin espaola palestino 1
102,78109,la cantidad de ttulos de lionel messi 42 desde su debut en 2004 comparados con otros clubes europeos bayern munich 38 barcelona 36 psg 32 real madrid 27 chelsea 21
103,78110,seleccionesnacionales el atacante del bayern munich sufri una lesin muscular y no podr ser tenido en cuenta por flick
104,78111,el inesperado guio de lionel messi en las redes sociales que dispar nuevas especulaciones sobre su futuro puede ir al bayern mnich infobae
