,Id,Tweet
955,94214,mucha suerte a los que hoy vais por ayaka y shenhe
956,94215,solo tenia 10 deseos en el server de asia y como 10 de pity dije que si me salia shenhe volvia a usar la cuenta pues jajajaja
957,94216,diosito no te pido nada genshinlmpact rerun shenhe protogemas
958,94217,hoy se consigue a shenhe aaaa
959,94218,shenhe te lo ruego de rodillas
960,94219,buenos dias banda hoy sale el banner de ayaka shenhe y encima arranca el otoo
961,94220,yo he dejado genshin pero esta tarde pienso tirar por shenhe en teora tengo para pity pero voy 50 50
962,94221,k 3s esto tan bonito
963,94222,me re duele la cabeza
964,94223,creo q al final si tirare por shenhe
965,94224,es hoy
966,94225,gente que esta noche se viene mi reina shenhe
967,94226,que ganas de que sean las ocho y media y llegue a mi casa y pueda tirar por mi shenhe
968,94227,hoy al fin se terminan los banners de cyno y dehya muajajajsjajaj las amo ayaka y shenhe
969,94228,anoche lave como 17 vasos donde mierda estan
970,94229,mi nioooo
971,94230,hoy finalmente es el rerun de shenhe  o
972,94231,amanecimos re tranqui casi le hackean la cuenta del banco a mi vieja
973,94232,ay dios mio q verguenza ajena como te ibas a autocomentar
974,94233,hoy voy a avanzar historia en el genshin y a farmear porque si no es shenhe es nahida
975,94234,da de shenhe
976,94235,dorm 2 horas jajan t
977,94236,rara rasputin
978,94237,buenos dias soe q me entraba unnvirus en la pc
979,94238,veo a mi novio y no le suelto los labios
980,94239,hoy tiene que ser un buen da
981,94240,buenos das hoy se cierra un crculo hoy se saca a ayaka c6 y con un poquito de suerte a shenhe
982,94241,no doy ms
983,94242,odio al puto gusano de sumeru nada mas que decir
984,94243,mi shenhe les desea buena suerte a todos los que vayan a tirar por ella yo probara por su lanza pero quiero a nahida c2
985,94244,chilumi
986,94245,me alegra anunciar que despus de 400 das de espera hoy voy a tener a shenhe
987,94246,bueeeeenisimos das gentee como andan es de mi agrado informales que hoy acab la espera finalmente llegan los reruns de ayaka y shenhe
988,94247,es hoy es hoy shenhe viene a casa
989,94248,buenardos das se me ha ido el santo al cielo y me he olvidado que hoy vienen los banners de ayaka shenhe y mika as que estar un ratito para las tiradas a los banners nanse al directo para tirar conmigo y mucha suerte a todos 22 15 cet
990,94249,tentada a probar a tirar a shenhe en mi secundaria para ver si consigo a mika
991,94250,qn me transfiere para cristales gnesis
992,94251,qu ganas de llegar a mi casa abrir el genshin para tirar a por shenhe y ver como pierdo el 50 50
993,94252,mika y shenhe voy por y para ustedes
994,94253,a las 6 de la tarde se viene mi quinto 50 50 consecutivo con shenhe eu confo
995,94254,manifestando a shenhe y a mika
996,94255,hoy rerun de shenhe
997,94256,nota no volver a ponerme el pelo rizado mientras lo tengo corto
998,94257,ojooo hoy sale shenhe no s si tirarle a la tarde u otro da
999,94258,saquen eventos porfa que necesito obtener a shenhe
1000,94259,58 minutes till ayaka shenhe lezzgooooooooo
1001,94260,listo para shenhe y mika
1002,94261,se me ha ido el wifi en casa hoy que viene shenhe dia arruinado
1003,94262,cuando salga de las prcticas tiro a shenhe hoy se viene mi madre a casa
1004,94263,yo creo q si m voy por ayaka y a shenhe la intento sacar en lo q quede del banner 3
1005,94264,shenhe te amo pero es que ayaya
1006,94265,hoy sale shenhe
1007,94266,esta tarde sale shenhe y voy a tener que pasar de ella da troste
1008,94267,muy buenos das mucha suerte a quienes tiren hoy por shenhe yo la tengo asegurada y por fin podr tenerla
1009,94268,dios mo qu ganas del banner de shenhe conseguir por fin una sacarosa
1010,94269,toca shenhe estilosa y bailonga para ganar hoy el 50 50 y que venga lo antes posible
1011,94270,lo feliz que voy a ser hoy
1012,94271,creo que tirar al banner de shenhe pero aqu la mxima prioridad es mika y sus constelaciones
1013,94272,shenhe vieni a casa
1014,94273,la megi cuando tenga a shenhe
1015,94274,buenos das feliz shenhe dayyyyyyyy
1016,94275,buenos das solo a los que van a tirar por shenhe
1017,94276,deja a mi shenhe brillar quieres
1018,94277,ns si sacar a ayaka o a shenhe tengo pity para cualquiera
1019,94278,cosas que har al salir del trabajo 1 regresar a casa 2 hacer las diarias del genshin 3 tirar por ayaka 4 los que sobren por shenhe 5 ver la clase de la universidad 6 debujar a alguien del genshin os dejo a vosotros elegirlo 7 hacer artefactos para ayaka
1020,94279,hoy vienen ayaka y shenhe
1021,94280,hoy shenhe viene a casa
1022,94281,vi a alguien que tiene ms de 1200 deseos para shenhe y para ayaka yo quiero eso
1023,94282,el gachapn promocional de personaje advenimiento trascendental estar disponible a partir del 21 de marzo de 2023 a las 18 00 hora del servidor la probabilidad de obtencin del personaje shenhe la ermitaa sobrehumana cryo ser mucho mayor
1024,94283,momento para manifestar macumbear o que se yo para que shenhe venga a casa
1025,94284,hoy es el da hoy me sale shenhe y nos casamos
1026,94285,maana ya es el banner de shenhe rezando para que shenhe venga a casa en 50 50
1027,94286,maana me sale shenhe voy a hacer 500 macumbas
1028,94287,q ya llegue shenhe y ayaya aaaa
1029,94288,se perdon a s mismo
1030,94289,maana soy shenhe haver
1031,94290,vete ya plis quiero a shenhe y ayaka
1032,94291,mi nio bonito tengo 60 deseos listos para ti por lo que ms quieras ven a casa esta tarde antes de que me salte el pity que s quiero a shenhe pero quiero ms a baizhu y a kaveh
1033,94292,help creo que mi wifi se cort y justamente maana sale el banner de shenhe maldita seas
1034,94293,estoy farmeando como un puto enfermo para mi shenhe
1035,94294,maana soy shenhe haver
1036,94295,te amo desierto vivo por explorar el desierto quiero ms desierto the jungle has found death
1037,94296,en unas horas se viene el banner de shenhe y tengo miedo
1038,94297,que nadie me hable hoy a partir de las 18 00 pm mis dos citas me esperan solo estar disponible para ayaka y shenhe genshinlmpact
1039,94298,no me haba dado cuenta que nunca us los platos especiales de shenhe xd
1040,94299,est es una seal para los ganyu havers q an no tienen a shenhe y la van a sacar les va salir si o si pongan a ganyu en su equipo como ritual y eliminen a todo pj del permanente
1041,94300,30 de pity 33 deseos 50 50 y un sueo shenhe ven a casa
1042,94301,foto poto gratis ahora que tengo tu atencin quiero invitarte a mi extensible celebrando mi primer ao como streamer extensible vtuber vtuberuprsing twitchstreamer genshinimpact shenhe pokemon fiesta raidenshogun
1043,94302,maana ser ayaka y shenhe haver en early pity lo se yo lo saben ellas y lo sabe dios deca eso
1044,94303,bueno maana sale el banner de shenhe la quiero y solo espero pasarme la probabilidad por los huevos
1045,94304,gente hoy sale shenhe
1046,94305,mis estimados iniciamos directo de la semana poniendo nos al da con shenhe por que ya maana viene y me falta el set entre otras cosas xd
1047,94306,mi nena hermosa te amo noelle
1048,94307,ms primogems para shenhe qu bendicin
1049,94308,nuevo chibi art de shenhe y ganyu genshinlmpact shenhe ganyu
1050,94309,le dije a mi perrita q la sacaria a pasear hoy pq la bae y se veia linda y se me olvido soy la peor persona del mundo
1051,94310,despus de practicar puedes tener una pequea reunin con tus amigos genshinimpact shenhe
1052,94311,se me ocurri algo con mi propio tweet ayuda
1053,94312,mi no ex puso en privado la playlist k me haba hecho y yo justo entre para escuchar pq me trae inspiracin para el au rinsagi
1054,94313,pens quw el banner de ayaka y shenhe era hoy
1055,94314,maana sale shenhe y ayaka xfin
1056,94315,es hoy es hoy
1057,94316,este verano hizo tanto calor que me volv team invierno
1058,94317,no se si lo dije pero igual l cdigo yo creo q voy a tirar deseos para sacar a mika y si viene shenhe la vdd no me quejo pq la quiero mucho le re putee las habilidades pero le tengo cario y si pierdo el 50 50 entonces voy por baizhu mika ven a casa pedazo de pajaro
1059,94318,necesito ver un pixel de sae en el manga
1060,94319,maana me sale el arma de ayaka y shenhe owo
1061,94320,mucha suerte a mis mutis que maana vayan a tirar por ayaka shenhe o armas lt 3
1062,94321,perdname shenhe pero hoy tengo demasiado sueo como para hacer las diarias
1063,94322,es la primera vez q con mi mujer vamos a tirar planeadamente por un personaje shenhe nuestra reina
1064,94323,a mimir con el gordo mogolico de winston q me aplasta todosnlos pies
1065,94324,el da de hoy no habra stream ya que andamos actualizando las builds para los nuevos banners del da de maana maana nos vemos para las tiradas de seguidores que van por ayaka o shenhe
1066,94325,maana shenhe
1067,94326,seria demasiado iconic que este vegetta tmb manifestando
1068,94327,se imaginan el dream team enterito karl lloro
1069,94328,deje d hacer los resumenes d la facultad porque shenhe viene maana
1070,94329,interacciones entre luzu spreen wilbur y charlie es todo lo q necesito metan a tina asi interactua con missa y se convierten oficialmente en el duo intocableee
1071,94330,ayuda
1072,94331,yo cantando y luego leo eso
1073,94332,estoy yofsndo
1074,94333,dios ojala dormirme y no despertarme hasta las 19 50
1075,94334,george tenes q estar o me demencio
1076,94335,manifestando para maana que el weon me salude q sigamos hablando y si se puede ganar el 50 50 de shenhe pongo un cigarro pq no encuentro el emoji de velita
1077,94336,siento q falle cmo ser humano
1078,94337,shenhe va a estar igual q yelan con la build mas rara pero pro
1079,94338,no aparece shidou en el cap 24 m corto un coco
1080,94339,se viene el banner de shenhe y soy nervios
1081,94340,me acorde a mi novio
1082,94341,aaa 91 deseos q emoc
1083,94342,todes re emocion por el banner de shenhe y ayaka y yo esperando el de albedo mientras a la vez quiero tirar por mika y recibir a mi nuevo protegido cryo en casa
1084,94343,siento q me esta mirando muy fijo soy esto
1085,94344,maana los veo para llorar x shenhe a las 5 en el genshin ti
1086,94345,soy emo
1087,94346,lo voy a sacrificar en mi macumba para q m salga shenhe
1088,94347,q hot sae le como toda la pija aus agogokggok
1089,94348,ayuda
1090,94349,nunca haba querido chupar tanto una pij
1091,94350,shenhe diez tiradas
1092,94351,ayuda
1093,94352,chistoso es que en mi cabeza ya termine el au y le di como 3 giros de trama pero siempre lo pienso durante clase jasjsjsj
1094,94353,as es yo tambin tirare por shenhe maana  
1095,94354,no se si tirar por shenhe o no aaaaa
1096,94355,esto va a durar nada porque luego me va tocar subir a shenhe y mika sniff
1097,94356,viene shenhe y adivinen quin no tiene protogemas
1098,94357,no puedo seguir sintiendome mal maana sale shenhe
1099,94358,realmente es verdad que si viene ganyu primero no le puedo tirar porque necesito si o si nahida sin nahida no hay equipo de ganyu tendra que conseguir ahorrar mucho para tirar por las dos siendo ganyu primera y bueno para eso hay que sacrificar a shenhe
1100,94359,yo despus de soar q hacia xxx con mi novio siento un vaco en mi interior
1101,94360,a qu hora sale shenhe
1102,94361,mqana banner de shenhe
1103,94362,yaaa los weones maricones de tres vienen a matarme
1104,94363,maana llega shenhe y yo sin deseos shenhe come home
1105,94364,maana rerun de shenhe
1106,94365,actualizacion shenhe yelan kokomi arconte nahida cyno tignari alhacen
1107,94366,desde 2013
1108,94367,q se apure shenhe no tengo paciencia
1109,94368,hermano pq cada que busco sobre alguna molestia o sntoma que tenga google siempre dice que puede ser cncer basta
1110,94369,me voy a matar
1111,94370,y maana shenhe q ya le farmee todo
1112,94371,mira sapo culiao voy a ir y te voy a pegar senda pat en to el hocico conchetumare hijo e la maraca teni el pico como coliflor tanto que te pajeai porque no te pescan ni en baja desagradable culiao que te veni a hacer el muy muy fan de piera de que cazuela saliste pollo re qliao
1113,94372,maana shenhe
1114,94373,los voy a matar a todos me tienen las bolas bien llenas
1115,94374,quienes siguen despus del banner de la shenhe y la ayaka
1116,94375,estos banners han durado tanto me quiero arrancar los pelos denme a shenhe ya
1117,94376,nuevo video en el canal sobre ayaya y shenhe vayan a verlo
1118,94377,ya duerman luego el banner de dehya cyno quiero a mi shenhe y algunos mika fkkdkdk
1119,94378,tengo cncer
1120,94379,me hacia falta
1121,94380,maana es el banner de shenhe aaaaaaaaaaaaaa
1122,94381,aaa no se q pasa q no puedo gusrdar la partida del devil may cry carajoooo
1123,94382,toy q me cago
1124,94383,quiero a mi novio wuaaaaa
1125,94384,la cara de tonta que se me ha quedado al pensar que los banners de ayaka y shenhe eran el lunes
1126,94385,hola viajeros maana tenemos el nuevo banner aqu les dejo los materiales de mejora de personaje y talentos necesarios de shenhe genshinimpact shenhe
1127,94386,anyways lo importante es que maana sale el banner de shenhe
1128,94387,nk recuerdo q tengo malal a
1129,94388,me hcie un pan y ahora kiero vomitar
1130,94389,amo a rosala y rauw de vdd es que son mis papis
1131,94390,la mision de dehya me dio en los daddy yankee
1132,94391,a mimir hasta que salga maana shenhe ojal
1133,94392,a darle farmeo para shenhe sali 2 dorados hoy d
1134,94393,deberia sacarme a shenhe o no
1135,94394,pero shenhe te pienso
1136,94395,maana a esta hora tendr a shenhe o a una mona
