,Id,Tweet
907,5022,checo randy y la seleccin de baseball ya pusieron el nombre de mxico por todo lo alto ustedes cuando chivas
908,5023,as o ms callados chivas enriquevonbeas omarvv9 j pietra odiamemas
909,5024,ayer perdieron mis chivas no me fallen pio fc puropinchepio
910,5025,veljko paunovic timonel de chivas habl en conferencia de prensa despus de la derrota en el clsico nacional ante amrica donde dio un mensaje de agradecimiento a la aficin por el apoyo ligabbvamx repblicachivas clausura2023
911,5026,pero es que ninguno mueve como el chivas america
912,5027,chivas vs amrica memes ridiculizan al guadalajara tras paliza recibida ante las guilas en el clsico
913,5028,chivas 21 puntos leclerc 6 puntos chivas gt leclerc
914,5029,dos tequilas por las chivas qu estn llorando y al america le vali verga salud
915,5030,en la vida a veces se checo y a veces se chivas
916,5031,ah se las dejo botando clubamerica chivas clasico expulsin
917,5032,el amrica exhibi a las chivas viva mxico cabrones
918,5033,as en estos momentos los de tigres los de chivas los que odian a checo prez
919,5034,gole el atlas golearon a las chivas gole el arsenal perdi el psg gan el clsico el leverkusen gan checo y ya solo falta la victoria del madrid vaya fin de semana
920,5035,fernando ortiz en clsicos desde que lleg al america ya le sac la partida a 3 dt de chivas en 3 torneos leao 0 0 cadena 2 1 paunovic 2 4
921,5036,chivas loser
922,5037,ayer no cene pq perdieron las chivas pero hoy mi pap si me da de comer pq checo qued en primer lugar
923,5038,y la gente paga un boleto de 4500 para ver perder a su equipo clasicodemexico chivas
924,5039,as la bandera que despliega la aficin de chivas previo al inicio de elclasicodemexico
925,5040,en que se parecen las chivas y max verstappen en que los dos se la pelaron a un americanista
926,5041,esto cala bien cabron chivas
927,5042,el microbusero del checo gan anoto santi y edson se cogieron a las chivas gan el azul y maana le sacamos la mierda a los ojos de rendija el mejor pas del mundo hijos de la verga
928,5043,chivas vs amrica memes ridiculizan al guadalajara tras paliza recibida ante las guilas en el clsico
929,5044,fin de semana redondo golea el clubamerica a las chivas y gana schecoperez el primer lugar sobre max33verstappen en el saudiarabiangp
930,5045,el resultado del chivas vs amrica de ayer solo fue un montaje
931,5046,y las chivas despide el circo maroma y teatro de toda la semana con su excelente actuacin
932,5047,ganaron checo prez y el manchester united las nicas que fallaron fueron las chivas varonil
933,5048,la imagen que define mi fin de semana amrica paseo a chivas checo gan en arabia y se le puso bravo al equipo vamos carajo
934,5049,los microbuceros ya festejan el triunfo del transportista mayor checo perez saudiarabiangp
935,5050,no debera ser problema el arrastre del amrica genera un debate que no debera existir si henry martn llevara esos goles en el pachuca sera todava ms obvio que es mucho menos importante marcarle al mazatln o a las chivas que a la lazio y al ajax
936,5051,sacrifiqu a las chivas y al bayern para verte ganar prez
937,5052,amrica ganandole a chivas representacin grfica
938,5053,mis chivas me quitaron la felicidad ayer pero hoy checo me la regresa
939,5054,clsico nacional amrica 91 jg 36 84 chivas 77 jg 31 17 empates 79 31 99 clsico tapato chivas 107 jg 37 42 atlas 92 jg 32 16 empates 87 30 42 datososmar
940,5055,ctedra callejera del dr sexo peres gracias por quitar el trago amargo de ayer con las chivas lpm
941,5056,que ganas de andar como mis chivas bien cogido
942,5057,el amrica siempre le gana a chivas eso es lo que es un clsico
943,5058,me parece ridculo que a los aficionados de chivas les ofenda el festejo de un jugador del clubamerica a mi no me encanta pero es un festejo y ya y no les ofenda lo blandengue que sali su propio equipo el 0 4 en casa me parece mucho ms humillante que cualquier festejo
944,5059,alguien pidi cuatro goles a domiciilio amrica derrota a domicilio a las chivas por cuatro goles y se mantendrn como segundo lugar en la tabla general el clsico es azulcrema clubamerica aguilasdelamerica chivas clasiconacional ligamx ligabbvamx
945,5060,a dele mijo as a mamarla chivas
946,5061,jornada 10 agendafutbolstica chivasfemenil rayadas 17 00 hrs estadio akron fox sports chivas tv vamosporellas
947,5062,chivas me fallaron ayer pero chequito no
948,5063,protagonistas de principio a fin la reaccin de fernando ortiz tras la victoria en el clsico nacional frente a chivas
949,5064,mty se orino en los tigres el abejorro humillo a las chivas meti gol el bebote que pinta para idolo metio gol sexo lvarez chequito hizo su perra al holandes cagn al rato el madrid humilla al barceroba gran da para estar vivo
950,5065,pinches chivas pocos huevos
951,5066,ayer se cojieron a mis poderosas chivas pero hoy checo me acaba de alegrar el fin de semana letsssgoooo
952,5067,putas chivas
953,5068,gan el man u gan checo nomas me fallaron ustedes pinches sin huevos chivas
954,5069,america vs chivas y conste que le voy a tigres
955,5070,el viernes mxico en bisbol ayer la meada del ame a las chivas en la maana los goles de santi y edson y ahora checo ganando en la f1 fin de semana redondo
956,5071,lo que las chivas rompen en mi checo lo compone
957,5072,gan checo gan el amrica y que chsm las chivas y verstappen
958,5073,que chingue a su madre max verstappen y las chivas
959,5074,ptm y al rato es el clsico de espaa donde seguramente va a perder el madrid ms tarde chivas rayadas dnde seguramente van a perder las chivas y maana mxico japn dnde seguramente pierda mxico que feo fin de semana
960,5075,a chingar a su madre las chivas y max verstappen
961,5076,que fin de semana ganamos en baseball inundados el zcalo y gan el checo y lo mejor perdieron las chivas
962,5077,hoy se amaneci con ganas de orinar la playera de chivas
963,5078,que buen fin de de semana caray mexico en semifinales de bisbol clubamerica humilla a chivas en su casa schecoperez gana el gran premio de arabia ya nada ms falta que fcbarcelona haga lo suyo para que sea un fin de semana perfecto
964,5079,este fin de semana gan yo 1 the eras tour 2 amrica 4 2 chivas 3 pole position y victoria de chequito
965,5080,nuevo podcast expedicin rosique 172 chivas amrica gnesis de un clsico en spreaker america bofo bravo campeonisimo chivas clasico cuauhtemoc derby futbol historia leyendas rebano yayo zague
966,5081,triste por mis chivas mi united estabas goreddevils
967,5082,goleada a chivas de visita gol de edson lvarez 1r lugar para checo en el saudiarabiangp fin de semana redondo para el americanismo
968,5083,gan checo las chivas qu jaja saudiarabiangp
969,5084,ayer el amrica deshizo a chivas hoy el siempre guila checo perez va a ganar el gp maana mxico avanza en la final de baseball que bonito fin de semana
970,5085,tuve una semana de la verga y le dije a dianita y a jorge todo va valer la pena porque nos vamos a golear a chivas y el himno nacional se entonar el domingo estoy llorando verga
971,5086,atencin por falso positivo del gobierno duque y su mindefensa diego molano capturados 6 coroneles policiacolombia en rueda de prensa mostraron como olla de microtrfico la vivienda de humilde anciana de pereira que estaba abandonada hace aos y deba ser demolida
972,5087,y contigo aprend el da que te conoc chivas aunque valen verga y por culpa de amauryvz seguiremos valiendo cine
973,5088,las convocadas de chivas para el juego ante rayadas de est tarde sigue sin aparecer alicia cervantes que se espera pueda estar en el clsico nacional
974,5089,naaambreee jefe le pusimos una putiza a las chivas somos los mas grandes que bueno aqu te qued algo sucio campen
975,5090,circulaenredes amrica venci a las chivas por marcador de 4 2 en el clsico nacional y los memes no han perdonado
976,5091,que chingue a su madre max verstappen y las chivas
977,5092,que raro hoy no veo tanta raza con su playera de las chivas
978,5093,amrica derrota con autoridad a chivas en el clsico del futbol mexicano
979,5094,nadie ve al amrica como ganador la gente solo respeta ms a chivas
980,5095,ha de ser horrible irle a chivas y ser el pendejo de todo mundo
981,5096,feliz cumpleaos comandante que tengas un gran da y que sea un ao de mucha superacin carojaramillo94 que gane hoy la cumpleaera cumpleaos carojaramillo chivas
982,5097,el amrica pasando por encima de chivas en el clsico mexicano el club ms grande de mxico lleva 2 victorias seguidas importantsimas fuera de casa ante tigres y chivas
983,5098,el reporte del paseo del clubamerica ayer sobre chivas en el clsico nacional
984,5099,henry martn celebr a lo cuauhtmoc blanco la goleada a las chivas y luego tuvo que ofrecer disculpas
985,5100,ingeniero checo llevatela tranqui no necesitas acelerar baja el ritmo checo va a frenar tu puta madre que chsm verstappen y la chivas
986,5101,chivas de siempre
987,5102,tiene razn no duele la derrota lo que molesta es que nuestros jugadores fueran pechos fros amauryvz deben inyectarse el verdadero adn de chivas y te doy un ejemplo de alguien que si lo porta al bofo 100
988,5103,dardo del tano ortiz luego de la victoria de amrica sobre chivas no hablamos
989,5104,deportesth las guilas mostraron contundencia en la casa de las chivas y le perdonaron una goleada y son sublderes
990,5105,hay pocos aficionados de chivas que saben reconocer una derrota y no se dejan llevar demasiado al fanatismo este seor que se dice analista como enriquevonbeas actua como un porrista frustrado y que no sabe aguantar la carrilla le sugiero que apague su cel mejor abusado
991,5106,y las chivas
992,5107,lista la convocatoria ellas son las elegidas para el partido de esta tarde en el estadioakron
993,5108,es domingo traigo cruda no se puso el de los taquitos y ayer perdieron mis chivas la vida es triste
994,5109,y se sigue insistiendo a chivas le faltan delanteros de calidad cmo es posible que en los ltimos dos partidos viniendo de abajo tus esperanzas para meter gol son un defensa central y el pendejo del piojo alvarado que no mete gol as le pongas a un portero sin piernas y brazos
995,5110,como les amaneci ese culo roto y orinado amigos chivas
996,5111,toda la defensa de chivas parecen hermanas de la caridad de tan buenos que son para no darles un estate quieto a los delanteros del america que se burlaban de ellos
997,5112,lo peor de chivas es que aunque la realidad les de de cachetadas no hacen nada nunca desde hace 6 aos de hecho
998,5113,cmo les amaneci el fundillo chivas
999,5114,henry martn aprovech para festejar su gol ante chivas como uno de sus dolos el cuauh
1000,5115,que ganas de andar como el chivas bien cogidote
1001,5116,pum y re contra pum clasiconacional clasicoregio129 clasicoregio ligabbvamx chivas clubamerica tigresoficial rayados
1002,5117,henry martn se disculp con la aficin de chivas por su celebracin el delantero del amrica henry martn se hizo tendencia durante el clsico de clsicos entre amrica y chivas despus de su polmico festejo emulando a cuauhtmoc blanco donde posteriormente se disculp
1003,5118,vergonzoso lo que pas ayer en el akron chivas se encarg toda la semana de levantar la audiencia en una estrategia conjunta con los de amarillo para opacar al clsico regio que ni nos debera importar y se nos revirti feo los nuestros ya no saben jugar un clsico
1004,5119,si no fuera por la rrrrrremetida de verga que le metieron alas chivas mi noche hubiera sido casi perfecta
1005,5120,atlas 4 0 olimpia puebla 0 4 atlas chivas 2 4 amrica arsenal 4 1 crystal palace 4 mi nuevo nmero favorito gran semana para estar vivo a bailar mi gente
1006,5121,despus de ver el clasicoregio129 esta claro que orlandocity no es ni chivas ni clubamerica ni mucho menos rayados
1007,5122,ayer la aficin le qued grande al equipo punto chivas ccp tigresoficial
1008,5123,ser infiel es como irle al chivas me da asco
1009,5124,que bueno que sigues pensando en chivas ni con la victoria de tu equipo te sacas la del rebao
1010,5125,henry martn se disculp con la aficin de chivas por su celebracin el delantero del amrica henry martn se hizo tendencia durante el clsico de clsicos entre amrica y chivas despus de su polmico festejo emulando a cuauhtmoc blanco donde posteriormente se disculp
1011,5126,no se quien me hace pasar mas coraje mis r1 o las chivas hdspm
1012,5127,ayer perdieron las chivas as que ms le vale ganar al barcelona porque si no entro en depresin
1013,5128,lo nico grande que le queda a mis chivas desde hace aos es la aficin
1014,5129,justo en lo personal esperaba un partido ms parejo peleado y competitivo por ende un empate era el marcador ms viable y tendencioso pero el amrica tiene algo que no tienen ests chivas y es una ofensiva enchufada y un delantero en su peak
1015,5130,antes un dolo y referente del equipo era alguien que sala campen con chivas entre otras cosas ms ahora es cualquiera y algunos se enojan si se les critica yo si juegan bien lo digo juegan mal y tambin lo digo no me gusta el fanatismo ciego pero cada quien sus dolos
1016,5131,chimalover festeja en la macroplaza la derrota de tigres feliz por perder tambin contra chivas y amrica 2 empatitos y apenas 1 golecillo
1017,5132,por que perdieron las chivas ayer
1018,5133,as fue el llamadodelrebao con 19jonnymagallon clasicodemexico chivas america chivasvsamerica clasico fuerzachivas
1019,5134,henry martn celebr a lo cuauhtmoc blanco la goleada a las chivas y luego tuvo que ofrecer disculpas
1020,5135,henry martn le hizo un fatality a chivas con legendario festejo a lo perrito de cuauhtmoc blanco
1021,5136,a pesar de haber sido locales las chivas no lograron derrotar al clubamerica en el clsico nacional
1022,5137,salir a la calle es toda una aventura cuando te acompaa tu esposo con su playera del america en un estado con mayor porcentaje de aficionados de las chivas si da penita
1023,5138,liga mx chivas 2 4 america 16 amp 38 j rodriguez 42 l suarez 53 h martin 62 e lara e c c 72 s flores c
1024,5139,ayer a chivas le hubiera venido bien que paolo goltz siguiera en el amrica qu blooper
1025,5140,buenos das a todos excepto a los de las chivas que equipo tan malo
1026,5141,los nicos que quieren que gane verstappen es la gerencia de red bull los verstappen y la vieja de checo prez vamos pvto microbusero ponle huevos
1027,5142,le va a las chivas la exactriz porno sasha grey sali el da de ayer en su stream con el jersey de las chivas lstima de resultado para el rebao sagrado ligamx chivas
1028,5143,no haba visto el ridculo de la chivas ayer en el clsico ufff
1029,5144,top tendencias de twitter en mxico mar 19 2023 amrica zcalo taylor taylor putin henry lara chivas     hyunjinpaintstheworld
1030,5145,top 10 tendencias de twitter en mxico chivas 84321 verstappen 58645 checo 55242 hyunjinpaintstheworld 225271     228163 saudiarabiangp 166965 safety car 16569 felizdomingo 16227 norma pia 57141 norma pia 57141
1031,5146,una pena los aficionados de chivas an se siguen preguntando sobre la mala actuacin de vctor guzmn en elclsicodemxico tedamsemociones
1032,5147,chimalover detectado feliz por perder contra rayados america y chivas y 2 empatitos se le vi festejar en la macro la derrota quin es el tonto
1033,5148,tig 0 0 san luis tig 0 0 jurez tig 0 0 orlando tig 1 2 chivas tig 0 2 america tig 0 1 monterrey ahhh pero se encabronaron cuando les dijeron que el volcn no pesa
1034,5149,la educacin de un americanista promedio igual por los que lo festejan no me sorprende pero molesta ms que nadie de chivas tuvo los para hacerle frente
1035,5150,jajaja no mames estn bien daados ahora resulta que es culpa de vega por que salieron cagados el primer tiempo y ni lo jugo no lo van a admitir pero lo poquito que levant chivas fue cuando entro por que ni tiros hacan en el primer tiempo mediquense
1036,5151,jojo tambin aristegui aristeguicnn aristeguionline elimin el tweet donde inform de la retencin en la frontera de magaly mtnez y su hija agresora de justiciaparanormalizbeth qepd lopeznarcopresidente lamarchadedonpendejo acarreados qepd chaifa dos bocas chivas pemex
1037,5152,ptm chivas deje de ver tus partidos por esto
1038,5153,henry martn hizo el cuarto gol del amrica en la goleada frente a chivas en el clsico nacional en guadalajara tras un remate de palomita pero lo que aderez la anotacin fue el festejo que realiz tras emular a cuauhtmoc blanco el dolo histrico de las guilas clubamerica
1039,5154,tremenda humillacin del clubamerica a chivas y en su casa america chivas goliza segano
1040,5155,me pas de noche el besamanos al caudillito pero la gente de la oposicin se empea en difundir el acto en mi tl yo solo quiero ver tweets del amrica vs chivas vamos elon
1041,5156,y las aguilas volaron alto destazan a las chivas 4 2 y confirma su hegemona sobre el chivero elmasgrande clasiconacional al america no le vas del america eres
1042,5157,mi ren muchas gracias te encargo a mis chivas por favor
1043,5158,buenos das y que chinguen a su madre las chivas
1044,5159,awebo hijos de su perra madre jhernandez83 chivas
1045,5160,puro pendejo le va alas chivas
1046,5161,4 les metimos a chivas ayer
1047,5162,paunovic y la autocrtica tras la derrota de chivas con amrica en el clsico nacional
1048,5163,jojo resulta que ciro cirogomezl elimina tweets no est seguro de su labor periodstica este deca que haban retenido en la frontera a magaly martnez y su hija quien agredi a justiciaparanormalizbeth qepd chivas 2 4 amrica pumas len amloburlamundial scjn lcdlf3 qepd
1049,5164,en si esto es el clsico don enrique esta muy ardido le doli el festejo de henrymartinm que para mi esta bien un clsico es eso gvlo2008 mluiscastillo paco villa martindelp mauvila tranquilo don enrique ud est ms triste que los jugadores de chivas vivayucatan
1050,5165,amrica pint el clsico azulcrema al ganar en la casa de chivas marcaregistradanoticias deportes
1051,5166,la figura de las chivas perdido en el clsico contra amrica y se pierde el clsico contra atlas
1052,5167,y volvieron a perder las chivas
1053,5168,que puto coraje traigo atorado desde que un tik toker ayer me hizo preguntas para ganarme boletos para el clsico pero como eran de chivas no me las supe
1054,5169,fernando tano ortiz estratega de amrica hablo en conferencia de prensa tras la victoria ante chivas donde mencion la satisfaccin de ganar un clsico y dejo un contundente mensaje ligabbvamx somosamrica clausura2023
1055,5170,el manchester united como las chivas los estn regresando a su realidad equipos chicos
1056,5171,qu no es el mismo que peda a chivas como base de la primera convocatoria de cocca confirmen por favor
1057,5172,muchos pensbamos q chivas podra competir incluidos americanistas les han puesto un baile masivo no tan humillante como a cruz azul amrica los trae de hijos a ambos
1058,5173,ya wey regresamos al estadio jalisco ese estadio si pesaba a los rivales chivas
1059,5174,no es por lo de ayer ni por sus declaraciones es porque ni el quiere estar en chivas ni muchos aficionados lo queremos le ir mejor en otro equipo
1060,5175,las penas con pan laislamariscos chivas chamacoseguro
1061,5176,psimo henry y dnde estaban los jugadores de chivas que ni un reclamo le hacen que le hubieran hecho quirarte y madero
1062,5177,que los de chivas son malsimos y los del america son nacos ya lo sabamos todos
1063,5178,henry me cae bien y se me hace un gran jugador pero que nadie le haya dado unos vergazos ayer habla mucho de la pequeez de chivas
1064,5179,diositio ya me hiciste ver perder a las chivas contra el amrica dejame tener esto hoy
1065,5180,y chinguen a su madre los que rentaron el abono vs chivas america y rayados
1066,5181,ligamx el clsico se pint de amarillo clubamerica destroz en calidad de visitante a chivas y se qued con el clsiconacional chivas 2 4 amrica faltatctica mex
1067,5182,mi primer chivas vs america el seor al lado de mi se quiere aventar del tercer piso porque van perdiendo las chivas y la polica lo escolta afuera del estadio casuaaaal
1068,5183,creo que estuvo mejor el clsico regio al menos no hubo papeln como el de chivas ante amrica
1069,5184,chivas vs amrica memes inundan internet tras la goleada al rebao
1070,5185,psenla la vitacilina a las chivas
1071,5186,dos partidos seguidos donde a caseres se le ve bien en la defensa partidos complicados contra tigres h chivas en donde respondi bien
1072,5187,que triste a de ser irle alas chivas
1073,5188,america es mas grande que chivas ya suprenlo
1074,5189,qued claro que el amrica sigue siendo superior a chivas
1075,5190,les avis que iba a estar parejo el clsico regio y el que el amrica iba a pasear a chivas se los dije
1076,5191,perdiste con chivas america no le pudiste ganar a orlando ahora pierdes con monterrey haz clavado 3 miserables goles en los ltimos 6 partidos uno de ellos fue penal y el otro se lo comi el amigo guango estn jugando caca a mi me vale madre el perfil tigre
1077,5192,excelente domingo nada nuevo chivas perdi su partido desde que su mejor jugador dijo que jugara en el america su capitn ms rojinegro que yo en fin el equipo sin identidad y humillados que buen domingo nos vemos en la siguiente fecha
1078,5193,el united y las chivas se caen a pedazos
1079,5194,estamos orinados por un dinosaurio chivas
1080,5195,me vale madre si el rival gano el clsico a ti chivas con orgullo yo te amo y contigo siempre
1081,5196,el delantero del amrica aprovech para festejar su gol ante chivas como uno de sus dolos el cuauh
1082,5197,los jugadores de chivas ayer
1083,5198,ya son hijos las chivas
1084,5199,el chivas regal tiene tufo a vainilla o soy yo eh
1085,5200,as es hoy maana y siempre america clubamerica chivas emiliolara
1086,5201,yo viendo al taquero con su playera de las chivas jefe revintese 4 de birria con todo chale gero ni la burla perdonas yo pos no
1087,5202,ora queeeeee hasta los clientes se burlan de mi ahorita vino una clienta y de la nada dice y que pierde el chivas jajajaja
1088,5203,triste por que perdieron mis chivas
1089,5204,el america se orin en las chivas el arsenal sigue con paso perfecto por la premier y yo me estoy echando una torta de camarn empanizado que ms le pido a la vida
1090,5205,anoche las superguilas metieron 5 goles en la cancha del akron fue infinitamente superior que el espejismo llamado chivas elclasicodemexico
1091,5206,resumen chivas 2 4 amrica revive todos los goles que dej el clsico nacional en liga mx
1092,5207,los que se tienen que disculpar son los jugadores de chivas empezando por el capitn que no apareci ms que para irse expulsado es un clsico y es valido festejar de todos modos chinga tu madre noms por jugar con el rival
1093,5208,veljko paunovic se disculpa ante la aficin de chivas por humillante goleada del amrica vamos a volver a ilusionar
1094,5209,fernando hierro tiene muuuucho que trabajar en cuanto al plantel ojal se de cuenta de que no hay delantero que rios no funcion y que necesitan que le suelten billete para soldar el proyecto bien chivas
1095,5210,en otros temas el papel de la aficin rojiblanca fue brutal a pesar de ir perdiendo nunca dejaron de alentar todo lo preparado la manta las bufandas tambin la gente de chivas se luci con toda la preparacin sin duda fue impresionante a pesar del mal resultado
1096,5211,chiquivar en el fuera de juego por interferir a un oponente el rbitro debe tener conocimiento reglamentario pero sobre todo sentido de comprensin del juego en argentina ayer s y en mxico en el gol de chivas se dijo no y gol var
1097,5212,la chivas ya valen pa pura verga
1098,5213,jajajajajajajajajajajajaja todos los de chivas a media semana queriendo burlarse de que atlas uso pirotecnia por ganarle 4 0 a olimpia y vienen estos pendejos a usarlos perdiendo 1 4 no se mueran nunca pinches hocicones jajajajaja
1099,5214,estar viendo tiktoks de mi karolg es lo nico que me anima en este momento gracias chivas
1100,5215,habra que ponerle videos de henry martin a los jugadores de chivas de como se le da direccion con la cabeza al balon por que a como son de maletas especialmente los cisneros el piojo la defensa todos son malisimos
1101,5216,11 goles y 3 asistencias del cabecita rodrguez como americanista siempre jugando por banda le ha marcado a chivas cruz azul pumas tigres y rayados solo futbolistas de calidad siguen aportando an lejos de su mejor nivel y su labor de sacrificio no la tiene roger ni brian
1102,5217,pauno en puebla hizo un llamado para enfocarse en el clsico nacional por supuesto que la aficin lo entendi a la perfeccin menos la directiva amp jugadores de chivas
1103,5218,chivas humillado por el amrica pero al menos el villarreal me da una gran alegra despus del desastre en conference
1104,5219,en su casa malditas chivas para que vean quien sigue siendo su padre y el ms grande
1105,5220,claro que lo sabia
1106,5221,esta semana en el podcast de silbatazo inicial hablamos sobre el clsico nacional chivas vs clubamerica spotify itunes google podcast
1107,5222,dndole un baile a las chivas en el akron donde est el hablador pocho bien amrica america
1108,5223,amrica vence a las chivas del guadalajara en el clsico nacional
1109,5224,a festejar como slo t sabes micomandante con gol y triunfo ante rayadas carojaramillo94
1110,5225,amrica ante chivas en el akron 15 partidos 8 triunfos 4 empates 3 derrotas 21 goles 10 goles clsico ganar ahi
1111,5226,llegue del vive latino para enterarme de sus pendejadas chivas increble la humillada que nos dieron hdspm
1112,5227,nuevafotodeperfil de ronaldocm97 en lo mejor que ha hecho en chivas que fue en el partido vs tigres en lo personal si esperaba ms de l por lo que estaba haciendo en la mls pero en chivas nada ms no
1113,5228,mencin especial al gran nivel por el que est atravesando cabecita rodriguez y nos est regalando tremendas joyas a tigres y a chivas le recet la misma dosis
1114,5229,sigan buscando quien se las pague chivas vs america desde el estadio
1115,5230,goleada henry martn celebr a lo cuauhtmoc blanco la goleada a las chivas y luego tuvo que ofrecer disculpas
