,Id,Tweet
482,95259,no esperen menos luchll te amo floresamarillas floricienta
483,95260,jajajajjja mor floresamarillas
484,95261,ya les dieron sus flores amarillas una oyente del club de los madrugadores fue protagonista esta vez floresamarillas
485,95262,no sabemos ni qu pedo del por qu se regalan flores amarillas hoy pero hicimos que a la nia que le gusta a mi primo le llegaran sus flores amarillas flowers floresamarillas
486,95263,por si an no les dan sus flores amarillas este 21 de marzo les deseo un hermoso da 21demarzo flores floresamarillas yellowowers ramobuchon
487,95264,les traigo su flor amarilla por si su bueno para nada no les dio floresamarillas
488,95265,mi mejor amiga si entendi las indirectas del 21 de marzo mi complejo de floricienta fue sanado hoy te amo meliiiii floricienta floresamarillas 21demarzo
489,95266,21 de marzo floresamarillas
490,95267,hoy es da de floresamarillas por
491,95268,para que un novio si para eso estn las amigas floresamarillas 21demarzo
492,95269,yo amo el trend de floresamarillas de floricienta la neta es bien bonito que te regalen flores
493,95270,a m no me den floresamarillas con una entrada a la pelea de sal chiquito beb mi amor canelo lvarez me conformo
494,95271,y como es tu amiga floresamarillas
495,95272,gente si un vato les da las flores amarillas no le crean lo sacaron de facebook es ms ni saben qu significa floresamarillas flores amarillas 21demarzo
496,95273,yo hoy viendo como a todos les dan flores amarillas menos a m floresamarillas
497,95274,es hoy es hoy sabes por qu se dan floresamarillas hoy
498,95275,ella saba que l saba que algn da pasara que vendra a buscarla con sus floresamarillas
499,95276,este 21 de marzo se celebra el equinoccio de primavera en el hemisferio norte y lo reconocemos con una flor amarilla importante para la alimentacin animal ya conocan a arachis pintoi dnab 21demarzo primavera forraje cacahuatilloforrajero floresamarillas pyaf
500,95277,nunca me han gustado las flores ya que mi madre deca que las flores solo se dan cuando ya estamos bien muertos jajajaj floresamarillas
501,95278,me compre y le compre flores amarillas a mis amigas nohombres floresamarillas floricienta
502,95279,ya lo pens bien no quiero floresamarillas quiero ir al concierto de lassomusica
503,95280,todas hoy 21 de marzo segunos barriolocoshow floresamarillas floresamarillas primavera 21demarzo flordemonte flor flordezacate
504,95281,una vez le regale floresamarillas un 21 de marzo y en lugar de un gracias me cuestion del por que fueron amarillas en lugar de rojas qu putas por qu cuesta ver las seales
505,95282,flores amarillas para stay por si no les han mandado stay 21demarzo floresamarillas straykids pt 1
506,95283,buenos das felizmartesatodos floresamarillas primavera girasol amor pokemon hellokitty pikachu eevee
507,95284,hoy es el diaaaa y ella sabia que el sabia que algun dia pasaria y vendria con sus flores amarillas regalar flores amarillas significa que esa persona quiere pasar la vida contigo como ocurre en floricienta y hoy es el dia radioranchito megustamas floresamarillas
508,95285,y cmo cada primavera l est esperando por m floresamarillas
509,95286,hoy es el da perfecto para decirle lo mucho que la amas y para recibir la primavera regala flores amarillas y algrales la vida floresamarillas arreglosadomicilio regalosoriginales thegooldengifts primavera2023 florescdmx
510,95287,al fin soy protagonista y no espectadora 21demarzo floresamarillas
511,95288,apoco hoy se dan las flores amarillas floresamarillas
512,95289,saban que en mxico hoy es da para regalar flores amarillas 21demarzo floresamarillas
513,95290,21demarzo primavera floresamarillas detalles los chicos tambin deberan recibir sus flores amarillas yo ya le mand las suyas al chico que me gusta
514,95291,ac estn tus flores amarillas amorcito floresamarillas
515,95292,amigos si me me llegaron mis primeras flores amarillas y me las vino a dejar mi mejor amigo que suerte la ma floresamarillas 21demarzo mejoramigo
516,95293,no se quien chucha en la oficina puso o escuche la cancion floresamarillas de floricienta ahora estoy pegado con el tema por la conchetumare
517,95294,siempre llega el chico que te llena de flores y de alegra la vida no se conformen con menos floresamarillas 21demarzo
518,95295,por qu hoy se regalan flores amarillas en mxico conoce ms mxico floresamarillas mxico primavera dasfestivos
519,95296,que bonita boleyncita a donde vas tan peinadita a la chinga de la semanita ok ndale pues a darle que es mole de olla hoy andamos regalando y recibiendo flores amarillas floresamarillas 21demarzo primavera2023
520,95297,ya te regalaron tus flores amarillas hoy es 21 de marzo floresamarillas 21demarzo viral
521,95298,listas las floresamarillas para tu pareja aqu te decimos el por qu de esta nueva tendencia
522,95299,i can buy myself flowers s yo me regal mis flores amarillas floresamarillas
523,95300,si las recib 21demarzo floresamarillas
524,95301,hola mutid locas buenos das estas florecitas amarillas son para uds ustedes son mis noviecitas virtuales las tequeme stankpop stantwt army stay floresamarillas
525,95302,te mereces esto y ms mi amor floricienta floresamarillas
526,95303,aqui tienen su ramo de floresamarillas para alegrarles el dia con mucho cario 21 03 23
527,95304,por qu regalar floresamarillas hoy 21 de marzo qu significa dar un gran detalle cmo un ramito aqu te lo decimos
528,95305,por si no les llegan floresamarillas goodvibesonly
529,95306,a mi si me dieron mis floresamarillas
530,95307,para ustedes quienes vean esto flores floresamarillas
531,95308,hoy es el mame de las floresamarillas y un buen pretexto para cantar floricienta con todo el equipo de marketing equisde
532,95309,ya que hoy se regalan flores amarillas pues que mejor regalo que una foto de la seora anagabrielrl vestida de amarillo si ella es la flor mas bonita de todas floresamarillas flowersday anagabriel
533,95310,si llegaron banda ya no soy espectadora floresamarillas floricienta
534,95311,buenos das menos a la primavera porque en este pueblo siempre tengo fro alguien se sabe el ig de benito pa felicitarlo marzo primavera benitojurez floresamarillas edomex toluca
535,95312,21 de marzo da de las flores amarillas floresamarillas 21demarzo desamor amor sad
536,95313,flores amarillas para ti bonita art loveislove illustration artist sketch artwork drawing artsy anime corazon love lgbtq floressmarillas lunes 21demarzo sketch crush floresamarillas amarillas yellow
537,95314,ustedes me ven muy i can buy myself flowers pero en realidad soy ms flores amarillas floresamarillas flowers floricienta
538,95315,voy a jugar simn dice para que mis alumnos me traigan floresamarillas yaaunquesea
539,95316,con estas amigas no voi a tener una linda primavera floresamarillas daaluuhh
540,95317,floresamarillas ms all de la cancin de floricienta este detalle est lleno de grandes significados descbrelos
541,95318,mi nio precioso 21demarzo floresamarillas
542,95319,hola yo si tengo mi flor amarilla floresamarillas primavera
543,95320,feliz 21 kekeys se les quiere mucho mikey mikeylx micchan floresamarillas mxico flower lexobebe
544,95321,en el trabajo con las florcitas amarillas que me regalaron floresamarillas 21demarzo otoo
545,95322,de m para m floresamarillas
546,95323,para ti que te mereces todo floresamarillas
547,95324,tal vez no sean flores de verdad pero el sentimiento es el mismo floresamarillas primavera detalles
548,95325,oigan hoy no publiquen que les darn floresamarillas es que a mi no me darn y me incomoda
549,95326,hoy llega la primavera en los ltimos meses ha sido tendencia en redes sociales como tiktok regalar floresamarillas pero conoces la historia el 21 llega el equinoccio de primavera en el hemisferio norte y se dice que las flores amarillas se regalan a
550,95327,y llegaron las floresamarillas
551,95328,es hoy es hoy floresamarillas
552,95329,las flores amarillas significan vida alegra y energa por eso es comn que las regalen al iniciar la primavera floresamarillas
553,95330,yo tengo mis floresamarillas
554,95331,te regalo unas flores amarillas y en la noche una cogidota aceptas floresamarillas 21demarzo flores
555,95332,acaban de entregar un ramo de floresamarillas frente a mi esto de ser espectador no me gusta
556,95333,manifestando que tods recibamos floresamarillas el 21 de marzo
557,95334,te amo mi amor gracias floresamarillas
558,95335,es hoy es hoy floresamarillas
559,95336,muy buenos das hermosas hoy es 21 de marzo y aqu les dejo sus primeras flores amarillas del da espero reciban muchas mas 21demarzo floresamarillas iniciodelaprimavera
560,95337,sunflowers insertar cancin de floricienta digitalart dibujodigital yukayagami oc sunflower girasol floresamarillas snk furry furryart
561,95338,el saba que l saba que algn da pasara que vendra el a buscarlo con sus flores amarillas floresamarillas hyunin hyunjeong el dibujo lo hice de rpido x eso se ve mal echo
562,95339,no pido mucho solo quiero esto para ser feliz en un da como hoy y siempre bts bangtan floresamarillas army army
563,95340,feliz inicio de la primavera floresamarillas primavera
564,95341,maana mi novio y yo no nos vemos pero me dio mis flores amarillas por el 21 de marzo lo amo tanto floresamarillas primavera
565,95342,no soporte floresamarillas
566,95343,perdn mi ignorancia pero que putas de las flores amarilla storytime floresamarillas
567,95344,puedo morir en paz floresamarillas 21demarzo
568,95345,no se uds pero a mi ya me dieron mis flores amarillas 21demarzo floresamarillas
569,95346,en lugar de ir a regalar flores amarillas maana vayan y sobenle las patas floresamarillas
570,95347,tal vez quiz la suerte ha volteado para ac jumbo jumsmso elvatotatuado floresamarillas
571,95348,me cost hacerlas es para jaz que pasara si algn da con tus flores amarillas son girasoles si cuenta no floresamarillas    
572,95349,ya lo pens bien no quiero flores amarillas quiero un terreno floresamarillas
573,95350,que tanto maman con sus flores amarillas comprenselas ustedes cabrons floresamarillas
574,95351,preparando la msica para maana floresamarillas playlist21demarzo
575,95352,y porque esperar un 21 de marzo para regalar floresamarillas si se pueden dar en cualquier otra fecha no sean mamones
576,95353,manifestando flores amarillas para todos maana flores vtubers streamers twitch floresamarillas felizlunes
577,95354,ya casi es 21 de marzo y yo si quiero mis floresamarillas
578,95355,adivinen quien recibi sus flores amarillas 21demarzo floresamarillas
579,95356,este 21demarzo regalar o recibir floresamarillas es un smbolo de amor y prosperidad mis amigas van a tener sus flores
580,95357,ya casi es 21demarzo y yo si quiero mis floresamarillas
581,95358,y maana yo puedo comprarme mis flores amarillas 21demarzo floresamarillas
582,95359,solo para aclarar floresamarillas representa la primavera pero en el hemisferio norte ms especfico argentina y nosotros estamos en el norte
583,95360,alguien de aqu no tendr sus floresamarillas
584,95361,espero maana mis flores amarillas tambin floresamarillas floricienta 21demarzo
585,95362,ella saba que l saba que algn da pasara que vendra a buscarla con sus flores amarillas floresamarillas primaverabonita sunflower
586,95363,si quieres a alguien de verdad regalale tu tiempo y tu amor las acciones perduran ms que unas flores amarillas esas se marchitan floresamarillas frases
587,95364,flores amarillas no tienes twitter as que a ver si te enteras floresamarillas flores nadiedicenada
588,95365,alv ahora quiero mis flores amarillas pero please que no sean girasoles me cagan jajajaajaja floresamarillas 21marzo
589,95366,yo maana esperando que alguien me de flores amarillas fly parati foryou viral 21demarzo floresamarillas
590,95367,maana ser otra da mas siendo espectador y no protagonista floresamarillas
