,Id,Tweet
462,48070,pinche mozo pendejo no mames
463,48071,jajaja a donde sale mozo y lo pedan para la seleccin pnganse a tomar cerveza y aplaudan cuandl sea tiro de esquina
464,48072,ay mozo
465,48073,ya jubilen a mozo plis
466,48074,en 16 minutos ya haban atacado en ms de 3 ocasiones la espalda de mozo por fin lo aprovecha el cabecita
467,48075,la banda de mozo es una avenida yo s veo unos 2 ms del cabecita
468,48076,jajajaja traen de hijo en esa banda a mozo
469,48077,que bueno que vendimos a mozo es una avenida jajajajajajajajaja
470,48078,alan mozo o trent alexander arnold quin cuida menos su espalda
471,48079,mozo regalando la banda derecha
472,48080,mozo y su gran laguna de siempre qu bien la ajusto jona golazo
473,48081,prcticamente mozo se regala estoy harto es malsimo
474,48082,dios mo con alan mozo defendiendo es de primaria y se la come completamente
475,48083,se estn tragando a mozo
476,48084,eres cagada mozo
477,48085,mal mozo en querer buscar a valdes ese pequeo salto deja totalmente solo a rodrguez
478,48086,en 15 min a alan mozo lo han retirado del ftbol
479,48087,gran error de mozo
480,48088,mozo estaba perdido
481,48089,me recago en su re puta madre mozo hoy esta perdido que te pasaaa la puta madre
482,48090,mozo perdi la marca que err
483,48091,que gol del ame era cuestin de tiempo para que cayera se estaban deglutinando al oso gonzalez mozo y compaa jajajaja
484,48092,pinche oso y mozo se durmieron en el gol pendejos
485,48093,mozo de vacaciones como siempre
486,48094,que pedo pvto mozo todas se las han ganado
487,48095,alan mozo jakajajjdjajajjajdjjajkajajajajajajajajajjajaja
488,48096,que alguien le diga a cisneros que tiene que ayudar a mozo
489,48097,se estn comiendo a mozo por derecha y ya cobro factura
490,48098,cisneros nunca ayuda a mozo en la lateral derecha
491,48099,se estn bailando rico al mozo
492,48100,pinche mozo se lo estan cojiendo
493,48101,y mozo
494,48102,avenida mozo
495,48103,insisto se estn comiendo a mozo ya lo gana el ame
496,48104,es que de verdad mozo es agua
497,48105,mozo sigue jugando igual que en pumas defendiendo revienta todo alv atacando patea el baln y corre como imbecil aun as se le extraa a ese tonto
498,48106,en el ftbol mi corazn se divide en 99 pumas 1 chivas por alan mozo
499,48107,alan mozo me da pinta de ser mucho mucho mejor que cabezita rodrguez y que hoy el uruguayo tendr una tarea ms que difcil
500,48108,en seis minutos mozo es una avenida
501,48109,cabecita le est haciendo el amor al mugroso de mozo
502,48110,paunovic debe darse cuenta q el cabecita le est haciendo la misma jugada a mozo le deben poner a alguien ah a ayudarlo si no ah nos cae el gol
503,48111,hay una nueva avenida en guadalajara en estos primeros minutos se llama avenida mozo
504,48112,mozo no puede tapar a los doooos
505,48113,me da igual para mi ken era el mozo el verdadero novio era el max stell de mi hermano
506,48114,veo a alan mozo y me acuerdo de un hater
507,48115,mozo no te queda bien la de chivas
508,48116,mi vida por mozo
509,48117,era el mozo o hermoso
510,48118,mozo no se caga contra el abe
511,48119,acaban de jubilar a mozo asqueroso lo del lateral de chivas
512,48120,que lateral es alan mozo
513,48121,que mania con decirle privilegio a cualquier tonteria
514,48122,a quien le habr rezado la ximena para andar con alan mozo
515,48123,el cabecita se tiene que comer a mozo si no va por esa banda el tano estar cabron
516,48124,desdelacuna aqu apoyando desde tlaxcala vamos chivas familia mozo rojas
517,48125,mejor hubieran puesto a cantar a mozo
518,48126,qu bonito ver a mozo de titular
519,48127,omg q jot es mozo
520,48128,siempre que vengo a un restaurante me toca el mismo mozo y siempre nos trata re mal jajaksjsjs pero me da risa que odia que le hablemos cada vez que viene estoy asi
521,48129,mozo chiquete chicote pocho
522,48130,el hype que traen mozo y pocho uffas
523,48131,hoy y siempre yo le voy a alan mozo
524,48132,por qu el mozo siempre est re bueno
525,48133,as como estn sacando de nuevo scream espero scary movie nuevamente
526,48134,estoy en un bar tomando algo y el mozo recin me dijo don lo golpeara pero me duele la cintura
527,48135,los 11 de chivas vs amrica jimnez mozo tiba chiquete chicote oso beltrn pocho c cisneros alvarado y ronaldo la banca rojiblanca rangel briseo mier chapo mayorga flores pavel lalito vega y ros asmexico jornada12 clausura2023
528,48136,alineaciones chivas jimnez mozo seplveda orozco caldern gonzlez beltrn alvarado guzmn cisneros cisneros clubamerica malagn lara reyes cceres reyes snchez fidalgo surez valds jonathan rodrguez martn clsicodemxico chivasentelemundo
529,48137,alineacin oficial de nuestro rebao sagrado wacho mozo tiba chiquete chicote oso guzmn beltrn alvarado ronaldo charal a ganar
530,48138,me enamor de un mozo
531,48139,me quiero a mi misma de novia
532,48140,ay par favaaar ken era el mozo de max steel y se sabe
533,48141,el 11 inicial del rebaosagrado vs amrica clsiconacional jimnez mozo seplveda orozco caldern pocho guzmn nene beltrn cisneros gonzlez ronaldo cisneros alvarado vamosrebao
534,48142,xi chivas jimnez seplveda mozo orozco caldern guzmn gonzlez beltrn c cisneros alvarado y r cisneros xi amrica malagn i reyes cceres lara s reyes richard fidalgo valds surez cabecita y henry
535,48143,yo pidiendole la cuenta al mozo
536,48144,alineacin confirmada wacho mozo tibio chiquete chicote pocho oso nene piojo cisneros charal chivas
537,48145,alineacin chivas miguel jimnez caldern chiquete orozco gilberto seplveda alan mozo oso gonzlez fernando beltrn vctor guzmn ronaldo cisneros carlos cisneros roberto alvarado
538,48146,wacho mozo tiba chiquete chicote oso beltrn pocho charal piojo ronie el 11 del dt serbio clasiconacional que les parece chivahermanos
539,48147,me da mucha nostalgia ver tan feliz a alan mozo en chivas lo que hubiramos dado por seguir tenindolo en pumas pero feliz por el porque se merece todo lo increble por el gran jugador que es
540,48148,buenas noches dulces sueos
541,48149,sto me pasa por estar negada a volver a comprar en lo del mozo twink looking que no era twink
542,48150,me asust porque pagu la comida con la de dbito y me llega un correo con un consumo mucho mayor le pregunto al mozo qu onda si se equivocaron y me dice lo facturado son los vinos que me pediste y todava no te los serv jsjsj literalmente unas borrachas
543,48151,cuantas veces les gusto un mozo a en su vida ahre
544,48152,hoy vengo con una confianza plena en mozo
545,48153,vea yo saba que eras mitmano
546,48154,bustos aparte de tener de marido a piatares ahora ya tiene de mozo a bauman ese malo se traga el empate no juega a nada y lo mantiene en cancha
547,48155,creo q estoy enamorada de mozo
548,48156,el momento neurodivergente de hoy lo tuve al colgarme escuchando a un mozo tamborilear las uas en una botella de vino a varios metros de m
549,48157,22 06 acabamos de coimear un mozo mariyfran
550,48158,la mam del ex de mi vecina justificando a su hijo que quiso atropellar 3 veces a la actual pareja de mi veci al frente de donde vivo porque es el mozo representa bastante esta sociedad si tengo rabia no la gestiono por el contrario es una razn para ir y matar a alguien
551,48159,cuando tienen miel y lo hacen es ms top
552,48160,trabajo de moza y la otra vez fui a comer a un restaurante y me puse en el lugar del mozo de todo lo que debe hacer de como debe atender al cliente lo que hace para que toda su comida llegue bien a la mesa ah me di cuenta que la gente es una mierda no valoran el trabajo
553,48161,las conversacin betsy dan nastalgia al saber que se va
554,48162,mi sueo frustrado trabajar de mozo
555,48163,a nada de decirle al mozo quedate tranquilo que tu parte va a estar pibe
556,48164,sin dejar que la cosa se enfre los cipayos de la pluma mendocinos publican que un mozo le peg a un cliente en la arstides todo vale para distraer la atencin de los dueos de los bares y la zona liberada vip ahora nadie entrevist al mozo que es un trabajador no un siervo
557,48165,solicitan mozo a para local gastronmico ingresa desde aqu al aviso empleos trabajosihay trabajoar
