,Id,Tweet
1495,5610,ah est tu pinche campaita de andar de amiguis chivas lo peor que nadie tuvo los huevos de encararlo
1496,5611,querer quedar bien con su aficin est bien as se persive aqu se levanta la cara y aguanta ese tipo de cosas porque estamos hechos para no voltear y seguir adelante arriba las chivas
1497,5612,pues mi clubamerica se orin otra vez en las chivas
1498,5613,despus del festejo de henry martin me pregunto si la directiva de chivas volver a tratar a los americanistas como sus amiguis
1499,5614,anoche tuve una pesadilla so que mis chivas perdan 4 2 contra el amrica esperen
1500,5615,hoy buscan como salir de su humillacin y no lo de henry porque eso es lo menos que se merecen los hocicones sino la exhibida futbolstica que amrica le propin a chivas orinarse y mearse en ellos siempre ha sido enriquevonbeas omarvv9 fercevallosf adalfrancoespn
1501,5616,a mi me encanta muchsimo el nio que le va con el corazn a las chivas
1502,5617,foto de chivas anoche
1503,5618,a mi si me gusto tu celebracin y grandes las referencias al cuau pa que calen eres un crack y le metes eso que a las chivas les falto en el clsico henrymartinm eljefeaguila clubamerica clasicodemexico
1504,5619,gana amrica a chivas y es sublder del clausura 2023 va reforma
1505,5620,dice mi pap que que bueno que todos estn encerrados porque as no le estn chingando la madre con chivas jajaja
1506,5621,en un partido como ste extraamos al pollobv el hubiera tenido las agallas que le faltaron a los 11 que estaban dentro de la cancha chivas chivas clasicodemexico
1507,5622,girar la jugada de derecha a izquierda para activar a cabecita rodrguez fue una de las claves de la victoria de amrica vs chivas apost al 1 vs 1 del uruguayo contra mozo y gan a veces para activar un desdoble otras para atacar su espalda
1508,5623,compara los clsicos le deshacen su comparacin ridcula y falsa que pinche necesidad de compararlos que maromas mentales y que necesidad de demeritar a dos equipos con instituciones grandes para enaltecer a equipos mediocres como chivas cruz azul y pumas
1509,5624,saben dnde s respetan a mis chivas pues en playstation ah si mlp chivas tantita madre
1510,5625,a dnde vamos a parar con esta hiriente y absurda actitud chivas clasiconacional
1511,5626,ando bien contento porque anoche el ame le meti una chinga al equipo de las chivas
1512,5627,pocas sensaciones son mejores que misamadasguilas les ganen a los jalisquillos chivas
1513,5628,chivas arm la fiesta y amrica gan el clsico por goleada
1514,5629,clubamerica no tuvo piedad y domin de forma categrica a chivas en el clsiconacional
1515,5630,cuenta esa de que ahora s chivas a considerarlo como serio aspirante al ttulo anda haz lo tuyo bocn fercevallosf
1516,5631,el partido de ayer nos deja varias lecciones que chivas tiene que aprender 1 dejarse de mamadas de convivios con los putos rivales toda la semana 2 cuando la calidad no alcanza hay que poner huevos 3 para madurar el proyecto hay que hacer una limpia del plantel
1517,5632,hoy te quiero mas que ayer chivas
1518,5633,estoy desayunando en el hotel one de perifrico la comidilla es el clsico hay 5 camisetas del camarillo y ninguna de chivas nadie resiste la humillacin hasta las risas burlonas de satisfaccin de los amarillos molestan espero no me enferme el desayuno gracias equipo
1519,5634,nosotros dndonos en la madre con aficionados del amrica y a ustedes les festejo as el henry martin y no hicieron ni madres chivas pochoguzmano6
1520,5635,ndale chivas te ests tardando con tus shows para cuando los del elclasicodejalisco
1521,5636,vaya noche muchas llamadas visitas y burlas en mi cara gracias chivas
1522,5637,que le falt a chivas antander alinear al drogo hocicon guzmn guzmanpocho06 porque sus porristas analistas hocicones estuvieron previo claro a tope enriquevonbeas omarvv9 fercevallosf adalfrancoespn
1523,5638,el tema es que no tenemos siquiera a los mejores jugadores mexicanos otros equipos tienen mucho mejores nacionales que chivas el equipo ms nacional
1524,5639,deportes amrica vence a las chivas en el clsico nacional y los memes no se dejan esperar ac te dejamos algunos
1525,5640,mensaje henry martn se disculpa por festejarle a chivas como cuauhtmoc blanco
1526,5641,yo si soy chivas a muerte y siempre en las malas estare pero ustedes jugadores que van a saber si ni jugar futbol saben amauryvz ya ponte a trabajar rojiblanca
1527,5642,conclusiones de chivas vs america no puedes aspirar a algo cuando t defensa es un desastre y peor an no tienes gol tu lder que tanto hablo toda la semana justo en este juego desapareci muy triste la realidad de chivas
1528,5643,el clsico entre amrica y chivas tuvo el gol de un ex boca
1529,5644,alguien sabe si ya el paulochavira subi un video respirando agitadamente hablando del fracaso de chivas
1530,5645,como parte de las acciones de sueachivas acudimos junto a 200 beneficiarios a presenciar elclsicodemxico adems cumplimos el sueo de alberto que es gran aficionado de chivas y sebastin que es un gran fan del clubamerica niezsueosyhumanidad
1531,5646,por cierto chivas
1532,5647,pobre chuyazo la vida lo ha castigado muy severamente es prieto feo parece jabal le va a las chivas y todas sus predicciones son una mierda hasta cuando seor hasta cuando
1533,5648,no vale quejarse chivas si no pueden defender en la cancha los colores del equipo no lloren por una celebracin es el partido ms importante del ao y nos hicieron pedazos chivas
1534,5649,increble que no con todo esto se motiven para por lo menos dar un buen partido si alguien merece esto son nuestras chingonas chivasfemenil
1535,5650,e pronosticada muchas acciones como esta de chivas antes de que pasen lastima que no le puedo atinar a los nmeros de la lotera
1536,5651,sus clientes cabecita rodrguez ya le marc gol con amrica a chivas cruz azul y pumas
1537,5652,la bomba pidi perdn tras la goleada del amrica sobre chivas el goleador ofreci disculpas en sus redes sociales centralfox
1538,5653,gan mi atlas mis rockets en el bsquet mexico en bisbol y perdieron las chivas si gana el barcelona y checo prez fin de puente redondo
1539,5654,un baile del amrica las guilas golearon a chivas y henry martn dej esta postal para el recuerdo de los azulcrema
1540,5655,clsico nacional amrica 91 jg 36 84 chivas 77 jg 31 17 empates 79 31 99 clsico tapato chivas 107 jg 37 42 atlas 92 jg 32 16 empates 87 30 42 la realidad es que ambos son muy disparejos amrica domina por mucho a chivas y chivas domina por mucho al atlas
1541,5656,que chinga le pusieron a las chivas
1542,5657,beb qu fue shakira karol g chivas checo f1
1543,5658,ayer se culiaron a mis chivas que bueno que andaba pedo y no lo vi
1544,5659,las portadas de los peridicos tras la goleada del amrica sobre chivas crezcamosjuntos fcaguilas amrica y ya
1545,5660,ya es domingo 19 de marzo 9 15 am y sigues siendo el dueo de chivas amauryvz
1546,5661,lo qu pas ayer en el clsico nacional se traduce en que chivas ni era el mejor antes ni ahora el peor simplemente es la realidad de este equipo cuando se trata de competir al tu x tu con planteles de calidad lo que enoja es ver cmo se burlan del escudo y nadie hace nada
1547,5662,america realmente metio 5 4 a las chivas y uno a ellos mismos
1548,5663,increible como nadie de chivas se le acerca tibios
1549,5664,un tal edgarromogdl un hocicon ms de este mediocre chivas se le lee que ha llorado mucho es lo malo de ser fantico de un equipo populista el populismo es solo para estpidos por cierto solo dios sabe cmo ganaron el campeonisimo ah se apoya y olvida a santander
1550,5665,henry martn ofrece disculpas por festejo contra chivas celebr como mi dolo
1551,5666,hace tiempo deje de irle al amrica pero me siguen callendo mal las chivas y disfruto cuando los golean
1552,5667,como chiva hermano no me desgarro las vestiduras por el festejo corriente de henrymartinm me duele lo corriente en que se ha convertido chivas en los ltimos aos de gana nada se le sobreproteje estar entre los 1os no es un mrito es obligacin de un equipo grande o no
1553,5668,sigo sin entender por qu nadie fue a ponerle un vergazo bien plantado a henry el perrito mion martin incomprensible chivas
1554,5669,ya tiene buen rato que no podemos vencer al ame y eso es preocupante chivas venga chivas en las buenas en las malas y en las peores
1555,5670,lloriqueando y victimizndose de ofendida la aficin de guadalajara por un simple festejo de gol cuando tendran que preocuparse de que en su mejor momento se comieron 4 y un baile de su acrrimo rival miserables patadas de ahogado como siempre de la gente de chivas
1556,5671,creo que a henry martn solo le falta festejar as contra chivas para tener los festejos ms icnicos del cuau
1557,5672,a darle vuelta a la pgina nos humillaron pero va un buen torneo y si nos caemos poquito se van a la mierda las otras 11 fechas trabajo trabajo y ms trabajo chivas
1558,5673,la debacle se gest desde hace rato edgarmartinez hizo en la semana un circo donde presentaba a los jugadores como amigos a los de chivas siempre sobajados trajo a sus amigos de tudn a que le tendieran trampas y les sacaran declaraciones para crear polmica
1559,5674,ayer se cagaron en chivas y nadie hizo nada xd
1560,5675,mejor dicho no se puede jugadores de chivas de hoy aprendan de la historia de lo que es chivas
1561,5676,increblemente a la aficin rojiblanca le doli ms el festejo de un yucateco en alusin a un referente americanista que los cuatro goles que se llevaron en el clsico de clsicos por ltimo ningn jugador de las chivas hizo respetar su casa ante dicho festejo
1562,5677,amrica humill a chivas en su propia casa y deja en claro quin es el ms grande expresionsonoranoticias sonora hermosillo esn redessociales
1563,5678,no se gan pero aqu seguimos y de la paunoneta no nos bajamos chivas
1564,5679,siguen y siguen y seguirn chillando las chiv42 clubamerica chivas
1565,5680,chivas vs amrica memes inundan internet tras la goleada al rebao expresionsonoranoticias sonora hermosillo esn redessociales
1566,5681,se burlaban de mi 2 semanas antes cuando dije que el amrica le iba a ganar a las chivas y ayer solo demostr que en la cancha y en twitter seguimos domando a los chillahermanos
1567,5682,mucha aficin para tan poco equipo chivas les falta huevos y sangre en las venas
1568,5683,mi mayor davidpradino eradinosaurio excelente diaaa yaaaa andamos x ac checando tarjeta y pasando lista un abrazo yo ando triste perdieron mis chivas ni modos amrica jugo y gan
1569,5684,el pocho guzmn y su chivas quedaron como payasos nomas les metimos 4
1570,5685,luego de derrotar y golear a las chivas rayadas el club amrica dio un paso importantsimo en la tabla general clubamrica ligamx
1571,5686,blog de palma2mex chivas 2 amrica 4 en su segunda casa las guilas slo ha sufrido tres derrotas desde que existe el estadio akron este sbado el estadio akron amrica ratific lo bien que sabe jugar clsicos bajo el mando de ver resumen en video
1572,5687,buenos das ayer perdieron las chivas
1573,5688,amrica gan como visitante el clsico del ftbol mexicano sobre chivas por 4 goles a 2 en la fecha 12 del torneo clausura 2023 jonathan rodrguez en dos ocasiones leo surez y henry martn anotaron por las guilas equipo que est en segundo lugar con 23 puntos
1574,5689,ando crudsimo hasta la verga pinches chivas me quedaron mal hijos de su chingada madre pero no hay pedo
1575,5690,ligamx el amrica se llev el clsico mexicano tras derrotar 2 4 a las chivas en el estadio akron jonathan rodrguez x2 leo surez y henry martn anotaron por las guilas
1576,5691,hay que celebrar con henrymartinm lo que hace bien en el clubamerica como americanista se lo agradezco el festejo es lo de menos sobre todo si es con chivas
1577,5692,henry martn gener polmica por su festejo y despus de la goleada del amrica le mand un mensaje a chivas
1578,5693,no tengas cruda moral henry martn te saliste del guin del clsico de mxico pero al final fue bueno porque era una hermandad que ni cnica ni hipcritamente debe existir entre amrica y chivas
1579,5694,se llevan el triunfo cruz azul derrot a san luis rayados se impuso en el clsico regio a tigres y amrica vol en el clsico nacional ante chivas estos son los resultados de sbado en la jornada 12 de ligabbvamx porsinoloviste
1580,5695,a mamarla henry martn el padre de las cabras humillacin a chivas amrica el ms grande de este pas
1581,5696,en mxico sacan tarjetas por nada paunovic dt de chivas juzg al arbitraje por expulsin de pocho guzmn
1582,5697,gracias clubamerica por tener compasin de nosotros atte chivas
1583,5698,en uno de los mejores torneos de chivas en los ultimos aos los humill el ame en su casa a ver si asi van entendiendo quien es su padre
1584,5699,definitivamente chivas es mi relacin ms txica
1585,5700,mis chivas y yo tantas veces que ya hasta perd la cuenta
1586,5701,deportes henry martn enloqueci al americanismo y a las chivas por sus nuevos festejos a lo cuauhtmoc blanco primero al lanzarse hacia la red y despus al simular que orinaba la portera
1587,5702,das porque buenos los goles que le meti el amrica a las chivas
1588,5703,acciones de jonathan rodrguez vs chivas
1589,5704,clubdeportivoguadalajara chivas vs amrica memes inundan internet tras la goleada al rebao
1590,5705,pinches chivas yo les tena fe
1591,5706,feliz domingo estas son la portadas deportivas en mxico el da de hoy 19 de marzo con amrica como el gran protagonista tras golear a chivas en el clsico nacional amrica 19marzo
1592,5707,top tendencias de twitter en mxico mar 19 2023 amrica zcalo taylor putin taylor henry lara chivas presidente puro
1593,5708,score amrica gana clsiconacional saca a chivas de los 4 primeros y es sublder una vez terminado el encuentro vctor pocho guzmn fue expulsado del encuentro por reclamarle al silbante se perder el clsicotapato gt
1594,5709,top 10 tendencias de twitter en mxico chivas 81392 felizdomingo 11692 zcalo 355096 edson lvarez none lapatriasedefiende 77388 amrica 518709 taylor 746487 hyunjinpaintstheworld 38659     42657 ajax 15622
1595,5710,buenos das amigos un consejo ya no se burlen de los chivas dicen que andan buscando quin se las pague
1596,5711,das porque buenos los 4 goles que le meti el amrica a las chivas
1597,5712,qu le falt a chivas en el clsico meter los goles cmo siempre mentalidad no pudieron superar la presin no demostraron con hechos lo que hablaron en la semana jugar como equipo solo algunos aportaron lo que les toca y otros nada ms estuvieron presentes ponerle
1598,5713,clubdeportivoguadalajara amrica humill a chivas en su propia casa y deja en claro quin es el ms grande
1599,5714,pechos fros que vergenza que nadie tenga los para defender nuestros colores profesionales para ser un campen con chivas se necesita mucho ms que ser profesionales se necesita amor por la camiseta amauryvz chivas vargas wero los lideres
1600,5715,henry martn gener polmica por su festejo y despus de la goleada del amrica le mand un mensaje a chivas
1601,5716,con un doblete del cabecita rodrguez el amrica derrot a las chivas de guadalajara y se qued con el clsico nacional
1602,5717,alerta amber cualquier informacin  porfavor comunicarse al 01 800 1 2 3 4 nos pelaron toda la vrtebra clubamerica chivas
1603,5718,pasinntr el amrica mostr su poder ofensivo y gole 4 2 a las chivas en el clsico nacional resultado que lo catapulta al subliderato del clausura 2023
1604,5719,ya hablando con ms tranquilidad la displicencia en la defensiva americanista realmente preocupa urgen dos laterales de categora monterrey o len no creo que desaprovechen las oportunidades que chivas ayer no capitaliz
1605,5720,las portadas de peridicos tras la goleada del amrica sobre chivas
1606,5721,la diferencia de jugar con delanteros con oficio clubamerica y jugar con hombres adelante para completar los 11 chivas
1607,5722,amrica humill a chivas en su propia casa y deja en claro quin es el ms grande
1608,5723,dios los hace y ellos se juntan lgico
1609,5724,cuando volvern esos das en que chivas generaba miedo y respeto recuerdo que en todas las cancha en las que se metan se encerraban los rivales el profe pauno ha sumado mucho ms puntos de los esperados pero el da de ayer nos volvieron a la realidad
1610,5725,lo que me mantiene humilde es irle a las chivas
1611,5726,arriba las chivas
1612,5727,las guilas del clubamerica propinaron una goleada de 4 2 a las chivas en el llamado clsico nacional y en el mismsimo estadio akron aqu los detalles del partido
1613,5728,pochoguzman lo asusto el clsico chivas
1614,5729,se les olvidaron los en su casa chivas a muchos les sigue quedando grande la camiseta no entienden lo que significa jugar en chivas clasicodemexico chivas
1615,5730,una tristeza lo de estas chivas de los ltimos 6 puntos hemos sacado 0 y se viene el clsico con un atlas en ascenso probablemente terminen siendo 0 pts de 9 espero equivocarme
1616,5731,henry martn pide perdn por festejo a lo cuauhtemocb10 elclasicodemexico i chivas i clubamerica
1617,5732,deportes en feria de goles clubamerica venci a chivas en el clsiconacional golearon las guilas 4 2 al rebao en el estadio akron
1618,5733,deportes en feria de goles clubamerica venci a chivas en el clsiconacional golearon las guilas 4 2 al rebao en el estadio akron
1619,5734,igualito que mis chivas ayer chivas
1620,5735,que difcil asimilar lo ocurrido anoche cuando un equipo que haba sido slido en defensa se lleva 4 en pleno clsico y es superado de esa manera la gente respondi pero en la cancha no fuimos rival hay jugadores que no pueden ser de chivas que queremos ser protagonistas
1621,5736,las chivas miadas de cristal de guadalajara al menos los de antes los benjamin galindo ramn ramrez alberto coyote claudio surez etc nunca salieron a lloriquear despus de un partido perdido por un festejo por eso estn en la porquera en la que estn bien merecido
1622,5737,no quiero decir que alguien trae la sal en las chivas pero ayer jug alguien que no haba jugado y pues vean
1623,5738,ahora a pagar la apuesta y los tres edsonzuniga pepesegarra y politoluco a vestirse chivas
1624,5739,buenos das amigos tuiteros y a las chivas mi ms sentido psame jejejeje
1625,5740,ligamx amrica de fernando ortiz le gan 4 2 como visitante a chivas
1626,5741,nadie puede criticar a henry martin por orinar el estadio de las chivas siempre ha tenido forma de retrete
1627,5742,que ganas de andar como el chivas bien cogidote
1628,5743,muy feliz cumpleaos a la crack mas crack el oro de chivas femenil la mejor dupla de licha que hoy en tu cumpleaos lo celebres con un gol carojaramillo94
1629,5744,gano pap clubamerica chivas clasicodemexico
1630,5745,todavia no asimilo la derrota de anoche pero que hacemos a seguir adelante y nunca dejar de apoyar a chivas en las buenas en las malas y en las peores siempre contigo mi rebao sagrado
1631,5746,lo nico que se chingaron fueron a las chivas
1632,5747,portada de record mexico del triunfo de nuestras guilas sobre las chivas miadas del guadalajara por marcador de 2 4 como visitante
1633,5748,csate conmigo internet clasicoregio clasicomexico america chivas rayados tigres
1634,5749,hace 20 das decan que las chivas chillonas no jugaban a nada su tcnico pendejo no tenan gol ni defensa que eran un equipo de tercera y hoy celebran como si hubieran goleado al real mandril al city o al bayern no mamen le ganaron por 2 goles
1635,5750,chivas vs amrica memes inundan internet tras la goleada al rebao
1636,5751,no veo que la cuenta oficial de la fifa mencione al clsico de nl pues no que muy importantes es todo el pas jajajajajajajaja por cierto cmo disfrut cada victoria sobre las chivas
1637,5752,no exagero cuando digo lo feliz que me ponen las maanas del domingo con la premier league neta gracias paramountplusmx hasta se me olvido que ayer miaron a mis chivas
1638,5753,qu triste es lo de chivas pasar de ser el ms grande a estar ya tan debajo del verdadero gigante que no les ha quedado ms remedio que buscarse otro eslogan y tener que recurrir a esa payasada de el ms querido la popularidad es la prim fcil del prestigio
1639,5754,deportes amrica y ya las guilas se llevaron el clsico nacional ante las chivas luego de ganar en el estadio akron por 4 2
1640,5755,un contundente y dominador amrica se meti al akron y venci 4 2 a las chivas abriendolaconversacin
1641,5756,chulada de foto esta granja solar tiene reja para que no se salgan las chivas que pastan arse mx asolmexac camiloargelles1 mexicohidrogeno cvallejogalvan israelhurtadoa gmonroyenergy g pineda bernal abo gabo gabodingler oilgasmagazine energy21mx manuel rdgn
1642,5757,el espejismo de chivas no tiene con qu pelear partidos importantes america demostr estar en otro nivel y con jugadores a tope veo muy lejano un ttulo para chivas
1643,5758,despus de la pendejada de ayer chivas deberan correr al imbcil que se le ocurri la mamada del da de medios y a carloscb 24
1644,5759,ya vi el amrica vs chivas y ambos expusieron las debilidades del rival la defensa area cuando buscan las espaldas de los defensores americanistas y en chivas las desconexiones defensivas en contra golpe y descoordinacin del bloque bajo lo de cabecita y alvarado lo mejor
1645,5760,y luego no te la quisieron pagar guzmanpocho06 o te la hicieron de nuevo pero qu crees chivas 2 1 clubamerica 4 1
1646,5761,encontr un rollo que segn internet dice que no est usado as que lo ir a probar sino van a salir unas doble exposicin chivas
1647,5762,es neta tanto drama por el sper festejo de don henry martn pues no que queremos generar ms rivalidad e identidad del clsico es algo de lo que se hablar en la historia as se mantiene vivo un clsico hoy le toc al amrica ya tendr su oportunidad chivas
1648,5763,ayer no gan chivas espero que el madrid hoy lo haga diferente
1649,5764,amrica derrot a chivas y se qued con el clsico nacional de la liga mx
1650,5765,chivas
1651,5766,despus de la putiza de ayer a las chivas hoy tiene que ganar si o si el realmadrid
1652,5767,feliz cumpleaos a la dola del club deportivo guadalajara feliz cumpleaos comandante gracias por llegar a chivas gracias por haber elegido estos colores gracias por tu entrega a esta institucin y por tantas alegras feliz cumpleaos carojaramillo94
1653,5768,sea de cada quin pero que pechos fros los de chivas si yo fuera profesional y el rival me hace eso en mi cancha mnimo te aviento 5 putazos e inicio una campal estos weyes noms se le quedan viendo jajajaja no mames
1654,5769,paralelismos cinematogrficos clsico clsico es que don henry martn festeje a lo cuauhtmoc blanco ante chivas cuauhtemia banderillas y el perrito orinando la portera del akron un homenaje a su dolo y el dolo del americanismo en plena casa de chivas
1655,5770,que vergenza irle a las chivas la neta
1656,5771,deportes contundente triunfo de amrica en el clsico nacional sobre chivas
1657,5772,tras decepcionar en el clsiconacional ante su gente el estratega de chivas veljko paunovic ofreci disculpas a su aficin ligamx
1658,5773,estpidas chivas
1659,5774,ayer el clubamerica fue muchsimo mejor que chivas henrymartinm de diez en todo a este equipo solo lo friega el nivel de salvador reyes cuidado por qu con todo este ame puede salir campen por fin malagn si da mucha seguridad flacodann blancaboyzo
1660,5775,buenos das hoy pero ayer si la cagaste chivas
1661,5776,que equipillo tan pedorro es chivas
1662,5777,ya tambin andan llorando las chivas de cristal por el festejo de henrymartinm odiamems
1663,5778,as no chivas hay que tener dignidad no se puede perder contra el amrica y menos en nuestra cancha
1664,5779,hoy es el partido de mis chivas vs rayadas
1665,62307,no se a quien le vale mas verga el equipo de las chivas a mi o a ese cabron de alexis jajaja
1666,62308,otro chocolate de patrick sandoval que hoy se parece al mismisimo wily wonka clasicomundial2023
1667,62309,mejor habla de tus chivas
1668,62310,las chivas no dejarn de ser un equipo fracasado mientras su aficin siga justificando todas sus derrotas representan al tpico wey que cuando le va mal siempre hay un culpable menos l
1669,62311,lo que muchos pensamos muy fcil se sacan tarjetas aqu en mxico se sacan tarjetas por nada es ftbol es emotivo todo el mundo est afectado no se pueden sacar tarjetas as veljko paunovi tras la decisin de marco antonio ortiz de expulsar a vctor guzmn
1670,62312,dos cosas que pasan en el clasiconacional amrica chivas 1 siempre aparece un hocicon que lo tienen en un atad y lo reviven das antes al juego 2 pasando el juego inmediato se desaparece humillado y aporreado regresa a su atad bofo 100
1671,62313,a ver si aprenden bola de pendejos chivas
1672,62314,excelente chivas amauryvz estn haciendo justo las cosas que tu pap jams hubiera querido bien vega con eso vas a recuperarte al cien en unas semanas ms
1673,62315,yo cre que no andaban en el puto instagram por vergenza pero al parecer es por que andan en la peda chivas
1674,62316,entonces ya les dijiste que su referente el pocho se hizo expulsar para no jugar vs el equipo de sus amores jajajaja estn bien empinados chivas
1675,62317,por burlarse de chivas en festejo henry martn pagara una multa millonaria
1676,62318,ay ay ay a los de chivas lo vamo a garrar ay ay ah a lo de chiva lo vamo a garrar pinche chiva vigilante si corres en todas partes tus amigos en patrulla y tu son hijos de put4 ay ay ay hoy vinieron con la federal ay ah ay hoy vinieron con la federal
1677,62319,exactamente pero como se orinaron literal en las chivas estn mamando ahora la beben o la derraman pinches chillones
1678,62320,sabes que chivas es el equipo ms mimado de mxico cuando la prensa se dedica a criticar a henry por su festejo que criticar la actitud de los jugadores de achicas en un clsico chivas es el responsable de que el ftbol mexicano y medios sean mediocres en est pas
1679,62321,ojal pauno ante atlaz inicie cubriendo a quiones no lo haga en zona sino que ponga marca a l que ha sido el mejor de ellos ante pumas olimpia y puebla lo viene confirmando chivas debe aprender de los errores en marca del ltimo juego y saber defender para generar
