,Id,Tweet
1202,9217,por riesgo de fuga fiscala espaola pidi prorrogar prisin de hugo el pollo carvajal
1203,9218,el real madrid es un equipo que lleva aos sin tener laterales que den ofensivamente lo que merece un club como este y no se hace nada por solucionarlo el partido ayer de carvajal es dantesco
1204,9219,carvajal es la viva imagen de lo que es ese equipo del real madrid
1205,9220,new york arnau tenas y dani carvajal protagonizaron la pelea con ms revuelo de el clsico
1206,9221,carvajal es lo ms payaso del ftbol nacional y encima un cagon
1207,9222,carvajal es el smil de asqueroso de jordi alba pero encima es guarro jugando
1208,9223,en vivo lince estudiantes del colegio melitn carvajal inician el ao escolar
1209,9224,son tan penosos que en la primera foto la pelota ya sali de los pies de carvajal eres la peor escoria periodstica y mira y que hay gente peor eh
1210,9225,si miran mi perfil sabrn algo de mi casadoconhijos toleranciacero pedropascal despiertaconchv reportajeschv
1211,9226,carvajal 2023 est al nivel de marcelo 2022 honor para siempre pero no puede jugar de titular lo que queda de temporada
1212,9227,pocos jugadores me gustan menos que carvajal
1213,9228,fijaros en carvajal el lateral de la seleccin espaola
1214,9229,y el madrid destac para mal soy muy madridista peor tambin tengo autocrtica kroos benzema vini carvajal para m los peores y tenemos problemas tanto arriba como abajo a pesar de mantenerse el equipo a bajo siempre haba alguno del bara solo
1215,9230,la secuencia de carvajal es pattica propia de un benjamn pero ojito tambin al repligue colectivo nadie tapa el agujero solo tchou hace un mnimo amago de ir pero rpidamente vuelve a su zona terica obvio que el partido estaba roto pero joder
1216,9231,arnau se va a por carvajal por que le agarra del cuello hdp
1217,9232,ms sol bienvenida primavera
1218,9233,cmo usar los corchos de vino en tus plantas algunos de sus beneficios tal vez te interese un truco para poder reusar los corchos en tu jardinera y por eso es que te lo digo para que tus plantas reciban la primavera con el pie derecho as que toma nota abro
1219,9234,carvajal el nico jugador del mundo capaz de golpear dos veces en el mismo centro
1220,9235,ms gente como carvajal en mi equipo o por lo menos con su actitud
1221,9236,como ya me imaginaba este frame engaa porque si se mira desde otra perspectiva se demuestra que en ese momento ya carvajal no toca el baln que sale de la bota del jugador al primer contacto por lo tanto la imagen siempre ser la buena la del primer toque que no os embauquen
1222,9237,qepd alipio vera
1223,9238,ahora que decimos y la lewa a carvajal tampoco
1224,9239,hay varias cosas que han pasado piolita
1225,9240,esto y un viaje con el codo en la boca a carvajal y se fue sin amarilla una vez ms qu puto asco el golden boy por cierto quin da ese premio negreira existiendo bellingham o musiala no tiene ningn sentido que se lo llevara este ser
1226,9241,lo mas pegao musica wbcenfox dime que si en vivo peter manjarres camilo carvajal by desconocido colombia wbcenfox
1227,9242,hasta en la seleccin me voy a tener que comer a carvajal que horror de verdad pero es que mirando el ld en espaa no se si es peor carvajal o todo lo dems pero bueno espero que ponga a pedro porro
1228,9243,carvajal siempre ha sido un pandillero dentro y fuera del campo lo que no es habitual es que lo haga a la cara porque lo normal es que lo haga de forma sibilina como la rata de jordi alba perfiles muy parecidos me prest el pelotazo de kounde el ao pasado
1229,9244,que tipo estpido carvajal jugador recontra odiable
1230,9245,no es que son la mejor dupla del mundo el baln de oro y bueh carvajal mi no entender
1231,9246,carvajal tiene rato buscando que le metan su coazo
1232,9247,el favor se lo hicieron a carvajal porque le partia la cara facil
1233,9248,el da despus carvajal se puso a decir cosas y crack del barcelona enfureci tuvieron que agarrarle entre cinco para detenerle la agresin de gavi y vean el ex jugador cul que visit a sus excompaeros rosala le gan apuesta a rauw
1234,9249,y aado ms por qu benzema y carvajal terminaron el partido
1235,9250,como manipulan cuando es arnau el que le dice algo y se encaran vaya negreiros estn echos y eso que da agresiones de gavi fue a carvajal y otra a ceballos sin baln
1236,9251,todo el mundo ve que benzema est fundido menos ancelotti carvajal aunque ayer no estuvo mal fue un error su renovacin
1237,9252,gracias carvajal por la derrota de ayer me he levantado y me he acordado de ti subiendo a atacar sin ningn sentido
1238,9253,los que dicen que carvajal no llega en la ltima jugada porque estaba fundido de darlo todo precisamente se necesita alguien que aguante 90 minutos de mxima exigencia si no ests para eso no ests para titular
1239,9254,no entiendo que problema habrn tenido pero carvajal con un canterano
1240,9255,carvajal tiene serios problemas
1241,9256,la portada deberia ser para carvajal y su performance en el 2 1
1242,9257,carvajal se mete con carajito luego de perder en el descuento danicarvajal92 cmprate unas bolas
1243,9258,carvajal es escoria
1244,9259,carvajal es el peor jugador del madrid desde hace bastante muy madridista nos ha dado todo pero ya es hora del relevo
1245,9260,legaldealmaker se hace eco de la incorporacin de luis carvajal como socio de legal para reforzar la especialidad de m amp a y unirse al equipo de socios de mercantil de rsm es legal derechomercantil
1246,9261,carvajal es un muerto que no tiene nivel para jugar en este equipo desde hace aos pero aqu se le sigue idolatrando porque es muy madridista y porque en la ltima final de la champions la nica en la que no se ha lesionado defendi bien a luis daz
1247,9262,gaspar rivas se trata con mdicos su problema o est por la vida as no mas recursos no le faltan para tener un buen mdico reportajeschv
1248,9263,carvajal qudate con el calvo nacho te quiero mucho
1249,9264,la tangana final entre arnau tenas y carvajal via diarioas
1250,9265,esta jugada con un lateral como cancelo o achraf es gol al 90 pero mejor carvajal que no da un pase bien
1251,9266,es muy miserable vender lo de carvajal y arnau tenas como un enfrentamiento entre ambos de igual a igual cuando las imgenes evidencian todo lo contrario no se cruzan es carvajal el que va a por el portero le agarra del cuello y le dice algo que le hace estallar
1252,9267,enserio qe est semana tengo qe aguantar al payaso de carvajal y al retrasao d ceballos jugando con espaa encima ni rinden pero en cambio cn el madrid uno se cree iniesta y el otro dani alves jugando
1253,9268,el real madrid tiene un grave problema en el rb porque carvajal cada vez est peor sin competencia en su puesto enorme problema para ancelotti marca rmalive
1254,9269,en serio vamos a permitir que carvajal siga jugando
1255,9270,configura un recordatorio para mi prximo espacio
1256,9271,con el regreso de ferland mendy nacho ahora ser considerado como una opcin para rb las bajas actuaciones de carvajal son un gran problema marca rmalive
1257,9272,arnau tenas despus de los comentarios de carvajal y ceballos hacia los suplentes del fc barcelona ceballos y carvajal insultaron el banco de suplentes del bara como malos perdedores al finalizar el encuentro no me sorprende de esos dos
1258,9273,conoce cmo se propaga el clera cmo reconocer sus sntomas y cmo prevenir los brotes
1259,9274,carvajal lucas vazquez asensio mariano hazard
1260,9275,dani carvajal perdi la pelota 23 veces contra el barcelona ayer solo raphinha perdi ms 25 kroos 2 christensen 3 y modri 6 los jugadores que perdieron menos pelotas diarioas
1261,9276,arnautenas estall ante la provocacin de carvajal tuvieron que pararle entre 4
1262,9277,me reservo mi opinin de gavimiro pero precisamente ceballos carvajal y vini no pueden hablar de actitud poco deportiva
1263,9278,bajas kroos benzema carvajal fichajes reece james bellingham haaland contando a fran garcia que ya esta firmado y brahim que vuelve
1264,9279,arnau tenas quien conoce a este chaval saben que es un chaval de put madre los macarras como carvajal o caballos y sus blanqueadores de la central lechera nunca han sabido ganar menos an perder pues ya sabis hemoal tik tok cultofftbl
1265,9280,a tuchel no le puedes ordenar que acepte tener 4 jugadores que no sirvan ni para entrenar no te va a aceptar poner a carvajal de titular no te va a aceptar que benzema lo juegue todo y no te va a aceptar renovar a kroos y a modric es el perfil de entrenador antagonico a fp
1266,9281,lo de carvajal si eso lo tapamos no merengues eso no interesa
1267,9282,carvajal se la ha querido dar de abusn y ha salido escaldado la rabia con esta pea es que a araujo no le dicen nada oye por lo que sea
1268,9283,al fin inicia el cafeconnata en subelaradio estbamos esperando a valdebenitonata abrazos mones
1269,9284,una ms de carvajal que hace lo de siempre se habr encarado se habr desahogado insultando o algo por el estilo y luego se ve como un cagn porque saben que no le va a hacer nada cagn y mal perdedor
1270,9285,3 bueno si son 3 eden odriozola y vallejo bajas bellingam cancelo y vlahovic fichajes benzema carvajal y kroos y modric al banquillo
1271,9286,lo del lateral derecho si que no podemos quedarnos quietos es que me niego carvajal 2025 me niego son 11 s en cada partido
1272,9287,uno a uno del real madrid contra el barcelona ancelotti tiene un serio problema con carvajal el problema es exclusivamente hacerle jugar hace mucho que el madrid est para 3 centrales
1273,9288,ancelotti juega con un benzem que est para irse a jugar con cr7 con modric prejubilado y kross vinicius haciendo lo mismo de siempre y atrs con nacho y carvajal pero la culpa es del rbitro
1274,9289,este seor tuvo los cojones de sentar a isco marcelo y bale cuando eran muertos vivientes en el campo subi a vinicius cuando otro deca que le faltaba coccin quizs es hora de darle el equipo hasta junio para que haga lo mismo con modric kroos benzema y carvajal
1275,9290,hablarn y se llenarn la boca hablando de gavi pero se olvidan de que nacho como mnimo deba estar en la calle en el minuto 40 y que carvajal solo ha pasado haciendo el gilipollas
1276,9291,lo de ayer es muy sencillo si hay mil cmaras y nosotros mismos con nuestros mviles podemos parar la imagen en el momento exacto del centro de carvajal de verdad creis que el var no lo puede hacer y por ello emite una pantalla partida de dos fotos
1277,9292,hilo sobre el madrid planificacin deportiva vs gestin de ancelotti quin tiene la culpa de esta situacin lo que pienso porteria defensa carencias en los laterales mendy y carvajal son realmente los nicos laterales puros que hay el resto parches
1278,9293,el centro de carvajal para el gol de rodrygo contra el city debe ser el ltimo buen centro del lateral perdemos cada jugada de peligro con centros sin sentido
1279,9294,escandalosa en la sala de var tardaron 4 minutos en manipular la imagen real de la accin foto 1 carvajal golpea el baln no hay fuera de juego foto 2 carvajal preparndose para golpear la pelota s hay fuera de juego es realmente vergonzoso
1280,9295,el primero que va a provocar es carvajal pero como siempre el madridismo manipulando muy bien hecho arnau siempre en mi equipo
1281,9296,carvajal is so disgustng man
1282,9297,la caida de carvajal jajajajajajaj
1283,9298,odiar a carvajal es un deber moral
1284,9299,tienes que ser un putsimo enfermo mental para ver algo malo de carvajal en esta jugada ms all de fallar un pase como si los jugadores fueran infalibles minuto 92 piernas cansadas y el equipo repliega en ayuda ordenado para tapar huecos fin
1285,9300,no s explicar por qu pero me hace muchsima gracia la cada de carvajal al final
1286,9301,por una duda q tengo q dira rhm1947 yotambiensoychavez siguen siendo chvez rafael ramrez luisa ortega claudia daz rafael osea hugo carvajal pedro hernndez abraham ortega jos luis zambrano jorge toledo gustavo crdenas nelson martinez
1287,9302,carvajal debi estar afuera desde hace 3 aos
1288,9303,carvajal en todos los charcos jajajaj no te retires nunca
1289,9304,que se dejen de manipulaciones y de tonteras el primero que va a encararse es carvajal a arnau tras la celebracin del bara y que le d gracias a todos los que paran a arnau porque poco ms y lo deja en el sitio
1290,9305,q carvajal es un retrasado se vena sabiendo
1291,9306,todo el mundo te va a lastimar solo debes encontrar por quien vale la pena sufrir bob marley
1292,9307,20mar somos centinelas permanentes de la patria garantes de la paz la seguridad y tranquilidad del pueblo venezolano juntoscontralasmafias gnbgarantedepaz
1293,9308,expedienteroyuela ni grin ni ral morodo entran en prisin ladrones de andaluca y del petrleo de venezuela pdvsa pollo carvajal y la vicepresidenta delcygate carteldelossoles psoecorrupto psoeputeroycocainmano psoe quetevotetxapote acodap anticorrupcin
1294,9309,carvajal ya est para retirarse no aporta absolutamente nada
1295,9310,jajajajajajajajajaja carvajal golpea el baln cuando ya est a 1m sobrr el piso que gracia das payaso
1296,9311,qu esperis de un jugador tan chico e inservible como carvajal
1297,9312,buendia felizliniciodesemana bendiciones
1298,9313,van a encontrarse con ceballos nacho y carvajal
1299,9314,arnau tenas llega a enganchar a carvajal y lo deja paralitico no me queda duda alguna
1300,9315,alguien que responda gutirrez yamil miky y red falcn no financiaron campaa del prm y abinader si se est sometiendo por financiamiento ilcito a una escala sin precedentes y lavado de activo digan cul dinero es ms ilcito el de la droga o el del estado los leo
1301,9316,si carvajal va a ser el lateral de esta seleccin yo me bajo del carro
1302,9317,sois una pedazo de escoria inmensa fue carvajal el que fue a por arnau y le agarr del cuello os voy a hacer desaparecer la redaccin de vuestro peridico no va a quedar nada
1303,9318,me encanta escuchar lo que piensas
1304,9319,de esto no tiene la culpa ni ancelotti ni negreira ni el propio carvajal aqu el culpable es el septuagenario de acs
1305,9320,macho he visto el clip un montn de veces desde ayer y todava no s a quin pretende pasarsela a carvajal
1306,9321,carvajal en la seleccion eh
1307,9322,fun fact del da nacho ceballos y carvajal van a tener q ver a gavi en la sele despus del partido de ayer q risa
1308,9323,arnau se va hacia vestuarios y carvajal lo ve y va a encararse y lo coge del cuello roja directa pero el diario deportivo de mayor tirada de espaa te dice que es al revs la razn el objetivo no se pinsenlo
1309,9324,oh vaya en marca dicen que arnau fue por carvajal ups las imgenes dicen otra cosa
1310,9325,hablamos de lo mal que cae carvajal
1311,9326,sacan el video donde va carvajal por arnau y solo muestran ests imgenes ellos siempre son los buenos de la historia sisi como el dedo a tito como ceballos increpando a gavi y luego te hablarn que los del bara son lo peor de este mundo claro
1312,9327,las imgenes del clsico el empujn de gavi a ceballos la pelea entre arnau tenas y carvajal y los gritos contra vinicius as lo contamos en tjcope
1313,9328,como me gusta ver a carvajal haciendo lo que mejor se le da desde que toc un baln en este pas dar asco
1314,9329,sigue tirndotelas de avispado jjajajaja
1315,9330,llevo tres temporadas sin entender porque carvajal sigue siendo el titular de esa banda y no el reemplazo de un jugador top por este mismo error de l se han perdido varios partidos importantes
1316,9331,columna de luis carvajal en el espectador colombia economia politica
1317,9332,que tio tan tremendamente limitado es carvajal
1318,9333,carvajal siendo uno de los tos ms ridculos
1319,9334,creo que la solucin de 3 mcs valverde de ed tiene sentido pero en varios tramos parece agotada si fede no est bien pierdes mucho carvajal en derecha ayuda poco y adems solo tienes un desequilibrador en el campo el mejor pero solo 1
1320,9335,carvajal el seoro
1321,9336,la fiscala espaola ha solicitado que se prorrogue la prisin provisional en este pas del exgeneral venezolano hugo el pollo carvajal ingresa para ms informacin
1322,9337,odio a carvajal con toda mi alma
1323,9338,carvajal lucindose todo el partido
1324,9339,fuera nazionalismos e ideologas destructivas madafakas
1325,9340,gaspar rivas realmente est facultado para ejercer el cargo que tiene reportajeschv
1326,9341,no quiero ver lo que pas en la jugada de ayer en la sala del var ni quiero escuchar lo que dijo soto grado para que la toma elegida para poner las lneas fue cuando el baln an no sali del pie de carvajal
1327,9342,no es real el repliegue de carvajal skxkdkdkcmskckx deja en un 2 contra 1 a militao y se la pela xkskck
1328,9343,hay que hacer una campaa para que no nos cambien mas el horario uno se empieza a acostumbrar a una hora cuando paf nos cambian de nuevo la hora cambiodehora reportajeschv toleranciacero pedropascal
1329,9344,independizarte es un gran sacrificio
1330,9345,odiar al simio de carvajal debera ser obligatorio
1331,9346,23 prdidas viene ya varias temporadas a bajsimo nivel y luego vienen a retratarte por decirlo porque tiene un mes bueno daniel carvajal no puede ser nuestro lateral por decreto y necesita ya una alternativa que le dispute el puesto de forma seria
1332,9347,lo cierto es que las corruptas y los corruptos del color que se pinten son tan letales al pueblo como las sanciones gringas y el bloqueo pero en ambos casos dicen que actan por nuestro bien la hipocresa y el cinismo son sus virtudes nunca es tarde para hacer justicia
1333,9348,es q en europa no est negreira ni clos gmez ni toda esa banda de corruptos hoy le anularon un gol legtimo al real y la falta cochina de gavi a ceballos es roja igual hay falta contra carvajal en el gol 2 del farsa est liga ya est comprada por el fcf futbol corruption farsa
1334,9349,no solo hay que plantearse las renovaciones tambin la continuidad de algunos jugadores que no dan el nivel como es el caso de carvajal no puede ser que en una temporada haga un partido bueno y sea en abril
1335,9350,sois unos mentirosos carvajal va a por arnau mentirosos manipuladores y malas personas eso es lo que sois
1336,9351,carvajal debe ir a prision
1337,9352,lewandowski vs carvajal falta o sigan
1338,9353,dw espaol alemania putin viaj a maripol es la primera visita del mandatario ruso a la regin del donbs desde el inicio de la guerra el sbado lleg sin anunciarse a crimea una regin que rusia invadi y se anexion ilegalmente en 2014
1339,9354,radio comunitaria yapacani santa cruz bolivia conferencia de prensa del vicepresidente nacional del mas ipsp sobre el ix congreso ordinario realizado en el municipio de yapacan
1340,9355,brjula digital bolivia la polica retira al dirigente reynaldo ezequiel del congreso departamental del mas santa cruz despus de que fuera atacado segn dijo lo llevan en una patrulla policial para precautelar su seguridad dtv
1341,9356,unos ven aprovechable a modric otros a kroos muchos que como no vas a renovar a benzema que viene de ganar el baln de oro y hasta hay valientes inconscientes que creen que carvajal puede seguir ejerciendo la profesin de futbolista en el madrid pues nada
1342,9357,lo fcil es apuntar a carvajal pero se hace 70m de carrera llega al pase de asensio y luego va a una presin va mal evidentemente donde presiona prcticamente solo nadie ocupa su lugar hay jugadores que ni estn en el ataque ni estn al defender
1343,9358,a carvajal le quitas todas sus cargas legales no amonestadas a lo largo de los aos y se te queda un futbolista nivel prebenjamines
1344,9359,integrantes del frente francisco de miranda realizaron jornadas de embelleciendo a las paredes y reas verdes del c e i jos mara vargas tribiln mochila de los sueos de la red ezequiel zamora en cojedes laavanzadora ze cojedes vicent carvajal juntoscontralasmafias
1345,9360,carvajal el jugador ms toca pelotas que existe
1346,9361,cuantas ms imgenes veo del clsico de ayer ms me escandalizo la falta agresin de lewandosky a carvajal antes del segundo gol del bara no la ve nadie del var o slo retroceden en la jugada si esta perjudica al bara
1347,9362,y el codazo que le mete en los dientes a carvajal que hasta se hace dao en el codo pero no pasa nada
1348,9363,sextoretiro pamjiles necesitamos nuestro dinero
1349,9364,la justicia espaola prorroga la prisin preventiva de hugo el pollo carvajal
1350,9365,algunos me llamaban loco por criticar a carvajal
1351,9366,es increble la capacidad de la maquinaria madridista de ver robo donde no lo hay un claro fuera de juego ahora las lneas estn mal que si la pelota no ha salido es muy ridculo todo ven la agresin de gavi pero obvian la de carvajal y as con todo
1352,9367,lo de carvajal yo ya ni lo analizo
1353,9368,carvajal a un contrat jusqu en 2025
1354,9369,cuidemos el planeta
1355,9370,carvajal es el ser ms despreciable que existe no tengo ninguna duda por encima de lo que en su dia pudo ser cristiano ramos o casemiro se merece todo lo malo que le pase odio infinito a semejante mugreza de persona que se joda muchsimo y siga arrastrandose por los campos
1356,9371,carvajal siendo un gilipollas nada nuevo
1357,9372,carvajal el nico capaz de levantar 40 cm el baln del suelo con la mente para golpearlo en el aire
1358,9373,qepd eduardo ravani eduardoravani
1359,9374,los del bara son el demonio personificado pero el cebollin agarrando del pelo a gavi y carvajal yendo a por arnau a decirle cosas son cosas sin importancia de eso no se habla
1360,9375,todo el mundo diciendo arnau tenas se va a por carvajal arnau tenas provoca a carvajal mienten ms que hablan
1361,9376,carvajal demostrando lo que es un macarra
1362,9377,lo de carvajal algunos lo llevamos aos denunciando pero aqu le hacen la ola
1363,9378,eres un asqueroso carvajal
1364,9379,analizando en fro el clsico de ayer mendy y carvajal son ahora mismo un lastre en el once titular
1365,9380,mirad solo a carvajal
1366,9381,manda cojones jajajajaja carvajal va donde el chaval y le agarra del cuello sois basuraaaaaa
1367,9382,debera dejar de creer en dani carvajal pero seguramente la dinojunta trabaja en una renovacin hasta 2028 cositas
1368,9383,slo el pisotn es roja directa y el var no dice nada se queda con la amarilla claro luego le da este manotazo a raphinha y sigue sin pasar nada esto fue en el minuto 40 de partido y pocos minutos ms tarde gavi cubriendo el baln le da un manotazo a carvajal y si la pita
1369,9384,buenos dias la guardia nacional bolivariana diariamente ratificamos el compromiso con la defensa y proteccin de la patria 20mar
1370,9385,menudo llorn es carvajal
1371,9386,lloro con que an cogiendo una imagen manipulada el baln ya ha salido de la bota de carvajal siga siendo fuera de juego igual
1372,9387,ayer pensaba que era claro pero viendo esto se ve que no es fuera de juego el frame que se debe de escoger es cuando la pelota sale del pie del pasador en el frame seleccionado por el var la pelota todava est en contacto con el pie de carvajal
1373,9388,carvajal aparte de tonto no puede jugar ni 1 min ms en el madrid el ao q viene al lega
1374,9389,carvajal con 31 aos en los huevazos picao con balde 19 espectacular es todo un hombretn
1375,9390,me destruye saber que todo esto est pasando y yo no puedo estar ah
1376,9391,bueno empezamos a actuar haciendo algo que criticamos normalmente tener 0 autocrtica venga vamos a renovar a benzema a modric kroos y carvajal en verano un fichaje o dos como mucho y la temporada que viene hostia tras hostia de nuevo pero la culpa nunca es nuestra
1377,9392,dani carvajal persiguiendo sombras en el clsico
1378,9393,quieren elegir un fotograma pixelado en el que no se aprecia cmo el baln ha ha salido del pie de carvajal porque les conviene esta gente es la que habla de profesionalidad y la que pone el grito en el cielo cuando se critica el periodismo la manipulacin de siempre
1379,9394,que gavi ayer se marchase del clsico sin recibir ninguna tarjeta despus de agredir a carvajal agredir a ceballos simular un penalti varias entradas muy duras te demuestra la corrupcin de la liga y del fc barcelona barcagate
1380,9395,esta jugada viene precedida de un mal centro desde la izquierda en el que carvajal salva una prdida de saque de banda con un sprint en el 90 vuelve a atacar en esta jugada que ejecuta mal y vuelve a bajar a defender la contra del barcelona recibiendo falta no pitada
1381,9396,que mal me cae carvajal joder
1382,9397,se fue a por carvajal despus de que carvajal fuese a por l y agarrase de la cara
1383,9398,dos frames en el primero carvajal da el primer impacto al baln en el segundo el baln est fuera de su bota pues con dos cojones te tienes que tragar que les han robado la liga
1384,9399,arnau iba a su bola y vino carvajal a tocar los cojones como podis ser tan mentirosos
1385,9400,igual carvajal en las ltimas jugadas hubiese llegado a defender si valverde le ayudase alguna vez que aqu siempre se va a por los mismos
1386,9401,otra cosa que no me explico es que al carvajal prime se le fichara a danilo primero y luego odriozola y a este nada de nada que se ha dicho no a los repres de pedro porro y joao cancelo
1387,9402,te paras a pensar y te sale lo que todos sabemos un delantero acabado para el da a da que lleva 6 goles que no sean de penalti tus interiores tienen 70 aos entre ambos y los suplentes son jugadorcitos carvajal es una autntica ruina en general
1388,9403,es que es terrible necesitamos dos laterales que puedan llegar a lnea de fondo slo hay que ver a balde como en el minuto 93 llega a lnea de fondo y asiste para el gol basta ya del conformismo carvajal como segundo lateral est bien pero no puede seguir siendo titular
1389,9404,la limpia necesaria que yo hara se queda tib militao alaba nacho rudiger cama fede tchou ceballos vini rodry fuera vallejo lucas odriozola hazard benzema asensio mariano carvajal duda lunin mendy entre kroos y modric salvo a uno el otro fuera
1390,9405,disfruta de carvajal
