,Id,Tweet
0,94777,dime que soy feo sin decirme que soy feo quico elchavo quico humor humornegro floresamarillas espectaculos
1,94778,le dije a la vida ensame a entender mi vida dame esa luz de esperanza de no ser el mismo de siempre ensame guame el resto depende de m la postal que tom hoy siguemeytesigo floresamarillas diamundialdelapoesia
2,94779,me dieron mis flores floresamarillas
3,94780,soy hombre y tambin espero mis flores amarillas floresamarillas benitojuarez saludmental earthquake ukrainerussiawar
4,94781,la primavera entr ayer pero descuida a nosotros no se nos olvidaron tus flores es ms le agregamos unas deliciosas sorpresas porque s nosotros sabamos que t sabas que algn da pasara y vendramos a buscarte con tus floresamarillas
5,94782,en ves de regalar floresamarillas invitala al encuentronacionaldeteatro organizado por antorcha el cual tendr cede en el municipio de texcoco en el estado de mxico
6,94783,muchas flores amarilla pero aj hay que ponerse vivo jaja floresamarillas
7,94784,mi mejor amiga me hizo una flor amarilla feli floresamarillas
8,94785,x cmo encontraste mi perfil si solo sabes mi nombre yo you younetflix netflixandchill netflix younetflix netflixlat diamundialdelapoesia floresamarillas
9,94786,buenas tardes solecitos ustedes que hacen les mando saludos besos y bendiciones viral fyp foryou parati floresamarillas rubia trend mexico
10,94787,se la iba a hacer y de pedo a mi amorcito por que no me haba dado mis floresamarillas pero mejor ya no quiero nada
11,94788,ella saba que l saba que algn da pasara que vendra a buscarla con sus flores amarillas flores 21demarzo floresamarillas
12,94789,21 de marzo se celebra el mushuknina festividad que indica el inicio del ao nuevo andino conexin con la naturaleza y sus ciclos por otro lado las floresamarillas son una tradicin mexicana indica el inicio de la primavera adems es una tendencia en tiktok
13,94790,para las planitas tambin sus floresamarillas floricienta
14,94791,floresamarillas me voy a dormir llorando besitos besitos besos besitos
15,94792,no entiendo eso de floresamarillas y porqu hoy me deban dar una ella tampoco pero sin embargo no quiso que me quede sin la ma y la hizo en papel la amo s la amo
16,94793,si yo no soy feliz nadie lo ser floresamarillas traicion
17,94794,bienvenida la primavera si me dieron mis flores 21demarzo2023 floresamarillas floricienta
18,94795,no se si exactamente exista el da de las floresamarillas o el significado pero me quedo con lo bonito que es llegar de trabajar y que te espere as love
19,94796,hay esperanza con los jvenes los jvenes en un maldito temblor de inconsciencia cuando hoy es diamundialdelapoesia y de benitojuarez pero pregntales y no saben floresamarillas
20,94797,el acosoescolar s existe toleranciacero con el acosador floresamarillas temblor colectivodime educa2023 crisporta21m likecrazy jisoo
21,94798,cual es la onda de la floresamarillas que me perd
22,94799,todas las que no recibimos flores amarillas floresamarillas
23,94800,y el amarillo de sol iluminaba la esquina lo senta tan cercano lo senta desde nia floresamarillas
24,94801,vino a mi trabajo a darme unas floresamarillas te amooooo mi amooor gracias por consentir a mi nia interior floricienta
25,94802,ella saba que l saba que algn da pasara que vendra a buscarla con sus flores amarillas floresamarillas floricienta se que aunque tenas poco tiempo hiciste un esfuerzo por vernos y sorprenderme con este hermoso detalle en serio gracias te amo
26,94803,mis flores amarillas floresamarillas elsalvador
27,94804,soy edgar soy florista llevo 7 aos en esto y no tena ni idea de su trend de las floresamarillas ni preparado estaba
28,94805,likecrazy is coming flores amarillas para todas las hermosas armys army bts floresamarillas floresamarillas jimin
29,94806,solo a las cachonas les dan flores amarillas v 21demarzo floresamarillas
30,94807,hoy recib floresamarillas es todo el tuit infinitas gracias
31,94808,recibieron sus floresamarillas yo si
32,94809,hay mujeres que son madres y hay mujeres que tienen hijos vuelve y lelo temblor floresamarillas diamundialdelapoesia
33,94810,y la que soporte panzonasss floresamarillas soporten
34,94811,pnganle floresamarillas de primavera al santo amlo chairos que ya viene semana santa ya que anda enojado porque la zopi lo trae como lazo de cochino con eso del embarazo de geraldine as hasta benitojuarez se volvera a morir
35,94812,sus flores amarillas llegaron floresamarillas primavera spring2023 yellowflowers
36,94813,medidas urgentes en los colegios institutos raquel tamarit un dedreto ley ya actua hijoyositecreo acosoescolar niunsuicidiomas tierradenadie3 educa2023 colectivodime docentes likecrazy floresamarillas crisporta21m
37,94814,acabo de ver a un wey comprando flores amarillas y eso me da fe en la humanidad casi al mismo nivel q me deprime cansadadeserespectador floresamarillas amorfallido
38,94815,las nicas flores amarillas que necesito floresamarillas
39,94816,presumiendo mis floresamarillas
40,94817,mis flores amarillas floresamarillas floricienta yellowflowers foryou 21marzo 21march
41,94818,siempre so con mi momento floricienta y hoy por fin pas floresamarillas
42,94819,no queramos dejar pasar el da sin desearles que hoy y siempre nunca les falten sus flores amarillas que est primavera ser el inicio de nuevos comienzos para todas miuterofeliz flores floresamarillas floricienta yellowflowers primavera equinociodeprimavera
43,94820,ese compa sabe floresamarillas
44,94821,aqui esperando mis floresamarillas
45,94822,te animas a darte un baito en el salto la paila ven a caripe estado monagas diamundialdelapoesia floresamarillas valparaiso nicolasmaduro
46,94823,de mi para mi floresamarillas
47,94824,lo nico amarillo que v hoy fue un mango que me baj por los lados del trnsito floresamarillas
48,94825,tal vez no tenga ese novio pero tengo amigos increbles que me dan detalles hermosos en un da de floresamarillas y soy muy feliz porque tengo a mi lado amigos increbles y ya aprendi a no conformarme si no a sanar
49,94826,no me da flores y se queja que sea bandida floresamarillas
50,94827,no te apures no detengas el instante del encuentro est dicho que es un hecho no la pierdas no hay derecho floricienta floresamarillas
51,94828,quin ms est esperando sus flores amarillas floresamarillas
52,94829,ya les dieron sus flores amarillas o siguen esperando floresamarillas
53,94830,soy el nico que no le enviaron las floresamarillas ni por whatsapp
54,94831,hoy no fui espectadora amigues floresamarillas
55,94832,lo que hago por vos mi amorr marzo21 floresamarillas
56,94833,todos somos prd yosoyprd unidospodemos changuinola likecrazy floresamarillas jisoo viral parati
57,94834,hoy si vi a muchos regalando flores primavera floresamarillas y yo aqu te dejo estas
58,94835,porque estn regalando flores amarillas floresamarillas
59,94836,flores amarillas duxorethey duxo floresamarillas
60,94837,me sorprende que siendo 21 de marzo nadie haya salido con flores amarillas floresamarillas 21mars
61,94838,descubre el verdadero significado del regalar floresamarillas este 21 de marzo t a quienes les regalaras dichas flores
62,94839,floresamarillas por qu se regalan flores amarillas el 21 de marzo y qu significan
63,94840,todo es mas bonito si el amor es verdadero frases undia floresamarillas
64,94841,mi gordita sorprendindome siempre floresamarillas
65,94842,existe maltrato psicolgico de docentes hacia alumnos por supuesto que existe justicia kiralopez hijoyositecreo actua tierradenadie3 temblor floresamarillas crisporta21m colectivodime educa2023 actua hijoyositecreo
66,94843,un ao ms bangtan floresamarillas birthday
67,94844,mi novio me vino a buscar con las flores amarillas floresamarillas
68,94845,yo a los 5 min de haber entrado al curro floresamarillas meme
69,94846,este ao tampoco fue jajajaja floresamarillas
70,94847,realmente no es que quiera unas flores pero bueno el ao siguiente ser floresamarillas meme genshinimapact floresamarillasmeme
71,94848,ya tengo listo tu quiote de tepextate girasoles que 21demarzo2023 floresamarillas
72,94849,weeeyyyy quin verga se acab las flores amarillas en durango jajajaja le quise mandar flores a una amiga y le llegarn rojas csm floresamarillas durango hidalgo
73,94850,si me llegaron mis floresamarillas
74,94851,me acabo de enterar porque se regalan floresamarillas hoy y no lo creo son de mis favoritas porque me encanta todo en amarillo pero en serio
75,94852,pequeo recordatorio para mi gente todo lo qu hay en tu mente es una ilusion macn floresamarillas primaverabonita
76,94853,nunca vi la serie pero la cancin es linda y apenas hace unos meses la escuch por casualidad y de ah la agregu a mi playlist el da de hoy entiendo la historia de la cancin floresamarillas primavera
77,94854,floresamarillas gracias humano que me regal hoy flores amarillas
78,94855,a mi amiga al menos le dedicaron una flor amarilla y a m ni un pan floresamarillas
79,94856,feliz da de las flores amarillas a todas las damas hinchas del bi tri campen un muy feliz da 42knacionaltuv elmediomsrojo floresamarillas
80,94857,yo esperando mis flores amarillas pero lo nico que me paso hoy fue seguir esperando algo que no va a llegar ni me va a pasar ni por error tweets twitter tweet twitterfrases tendencia siguemeytesigo parati floresamarillas
81,94858,la floristeras hoy facturaron con las flores amarillas floresamarillas
82,94859,yo ya estaba de siempre espectadora jams protagonista y sorpresa floresamarillas
83,94860,a mi ningn hombre me va amar como lo hace el la mejor flor que me han dado floresamarillas
84,94861,los pibes tambin queremos flores amarillas floresamarillas
85,94862,alguien me puede decir que es esa mamada de las floresamarillas
86,94863,oigan es cierto me faltan mis floresamarillas flowers
87,94864,y no puede evitar perderse en el mgico mundo de su mirada como un dulce encanto que envuelve y atrapa evocando un tuit de all del 2015 con foto 2023 floresamarillas
88,94865,no me jodan acabo de ver a un chico re feliz llevando un ramo de flores amarillas me desintegro floresamarillas equinoccio primavera
89,94866,por qu la tendencia de las floresamarillas tomado de la red el origen de la ms reciente tendencia de tiktok tiene relacin con la cancin flores amarillas que musicaliza la novela argentina floricienta esta tendencia refiere a que justamente en la cancin d
90,94867,cada vez son ms los ecuatorianos que se unen a la moda del amor por los animales y por tal motivo muchos sentirn simpata por alguno de estos anormales cayendo en la trampa del discursito rancio en defensa de un miserable corrupto que empuja el pas al abismo floresamarillas
91,94868,yo ya no espero floresamarillas este 21demarzo porque la ltima vez que lo hice me terminaron por telfono
92,94869,top 10 tendencias de twitter en mxico scarlett camberos none normapiarepresentaalosnarcos 12299 aifa 29872 floresamarillas none benito jurez 21949 alenosune none diamundialdelsindromededown 12731 trump 1943390 floricienta none jaiden none
93,94870,floresamarillas por quienes recuerdan a floricienta en esta fecha
94,94871,veo en redes el que ridculas las rosas amarillas etc est bien se respeta pero dejen ser felices a las parejas q crean detalles as sea el da de la espumilla o no sea nada djenlos q se entreguen detalles si les llena el alma y son felices todo vale floresamarillas
95,94872,por si no os regalaron flores amarillas aqu les dejo unas 3 floresamarillas
96,94873,por si no os regaaron sus flores amarillas aqu les dejo unas 3 floresamarillas
97,94874,ella saba que el saba que algn da pasara que l vendra a buscarla con sus flores amaaaarillaaaas floresamarillas
98,94875,fun likecrazy floresamarillas gaming con la babysaaii sean bienvenidos apoyen con el follow
99,94876,aqu casual esperando mis floresamarillas y que suceda ese milagro de verlo parado frente de mi
100,94877,chicas deje de ser espectadora floresamarillas
101,94878,verdaderamente que bonito ir caminando y ver qu a muchxs si les dieron sus floresamarillas
102,94879,la envidia no pudo ser ms bella mientras el orgullo y la humildad caminan de la mano mv art8 juanaguadalupe floresamarillas envidia lmd6 juanaguadalupe juanaguadalupedejesus fashion fashionshow
103,94880,soy una mensa hubiera ido a echarme una chela yo solita solo porque primavera benitojuarez floresamarillas jajaja
104,94881,yo viendo a todos con sus flores amarillas floresamarillas meme
105,94882,de mi para mis amigas floresamarillas
106,94883,mis flores amarillas me las envo el amor de mi vida luisaomendoza floresamarillas
107,94884,a ustedes ya les llegaron sus floresamarillas o siguen esperando como yo primavera flores amarillas
108,94885,un brindis por esos amigos que tuviste desde la juventud que te admiraban y siempre queran estr contigo lstima que hubiesen crecido y conocido el dinero floresamarillas nohayamigos amigosde
109,94886,si nadie te ha dado tus flores amarillas toma yo te las doy ten un lindo da 21demarzo floresamarillas vtubers streamers twitch felizmartesatodos
110,94887,mi mami me dio mis floresamarillas
111,94888,hasta cuando espero que te des cuenta que vos y yo nacimos para estar juntos temblor  ep1         floresamarillas
112,94889,floresamarillas lilis en botn para mi amorcito
113,94890,no es sino hasta el 2023 que me vengo a enterar que se regalan floresamarillas un 21marzo investigu y resulta que es un asunto turbio y nostlgico para las mujeres que vieron floricienta de nias
114,94891,hazla sentir amada y reglale no solo flores amarillas sino tambin un body reductor primavera floresamarillas felizmartesatodos
115,94892,que tus hermanos te den tus flores amarillas es lo ms lindo del mundo 21demarzo floresamarillas
116,94893,yo despus de decir que no me importa que no me regalen flores amarillas de ver como a tods se la estn dando y a mi ni un dulce me regalan por error tweets twitter tweet twitterfrases tendencia siguemeytesigo parati floresamarillas
117,94894,floresamarillas por ningn lado
118,94895,ya llegaron mis floresamarillas
119,94896,ella saba que l saba que algn da pasara que vendra a buscarla con sus flores amarillas floresamarillas
120,94897,teeeengan sus floresamarillas ni crean que me da envidia que a ustedes si les regalaron
121,94898,la nica floresamarillas que quiero y necesito yoongimarryme
122,94899,hdsptm como se acabaron las floresamarillas ya no alcanc
123,94900,damundialdelsindromededown diamundialdelsindromededown floresamarillas napo 21demarzo todo queda entre los narcos aos 35 claro eso es lassoguillermo y la asambleaecuador si terminan su periodo cualquiera de los dos vendra mashirafael recuerden mis palabras
124,94901,ningn ramo de manzanilla por lo menos floresamarillas
125,94902,pero ni un ramo de manzanilla floresamarillas
126,94903,inicio de la primavera floresamarillas equinoccio primavera flores floricienta maracaibo zulia girasoles tendencias2023 21demarzo2023
127,94904,las nicas flores amarilla que recib hoy fueron las hojas de manzanilla para mi peste floresamarillas
128,94905,estoy bravsima las floresamarillas son solo para mi a mi me gustan desde que tengo 15 aos haha y ahora porq es tendencia a todas solomodasiguen grrr
129,94906,espereeeen en el ecuador el equinoccio de primavera empieza el 23 de septiembre porque es el hemisferio sur pero mis floresamarillas me las enviaron hoy por una tendencia y lo que cuenta es la intencin
130,94907,si llegaron mis floresamarillas
131,94908,mi mejor amiga me di mis flores amarillas floresamarillas
132,94909,ya recibiste las tuyas las floresamarillas son tendencia este 21 de marzo
133,94910,no me las di yo pero me las dio l y tambin se las dio a jimena floresamarillas
134,94911,hoy gan tal vez sea algo obvio pero qu es so de regalar flores amarillas hoy por qu o qu floresamarillas
135,94912,les dej su flor amarilla un lindo girasol para todos los que lo estn leyendo esto floresamarillas 21marzo
136,94913,les regalo un wallpaper de florecitas amarillas floresamarillas enjoy
137,94914,las floresamarillas son por el inicio de la primavera o por otro asunto por que recin otoo
138,94915,si quieres algn detallito o regalo personalizado visita nuestra web envos desde 3 floresamarillas likecrazy jisoo supervivientes2023    
139,94916,a propsito de las flores amarillas ae frases intelectuales floresamarillas
140,94917,me dieron mis floresamarillas
141,94918,la ignorancia da frutos y son felices y ms de les das floresamarillas
142,94919,el nico qu vo pruebas es este gran informador siquerodriguez floresamarillas
143,94920,si no eres de mexico no tienes porque ser un npc y regalar flores amarillas npc floresamarillas
144,94921,protagonista por primera vez floresamarillas
145,94922,pobreza mental floresamarillas
146,94923,no entiendo lo de las floresamarillas que alguien me explique
147,94924,girasoles floresamarillas imgenes ae frases intelectuales
148,94925,que se vaya quien no se sienta afortunado de tenerte en su vida floresamarillas
149,94926,si puedes llevale unas o una flor a tu esposa novia amor todas queremos flores aunque algunas digan que no todas nos podemos comprar flores pero nada como recibir una atencin un detalle y ms si es de tu persona favorita floresamarillas
150,94927,a ver aprovechando las floresamarillas de primavera 21demarzo
151,94928,no lo duden ella est sonriendo y tambin quiere sus flores amarillas doglover smile floresamarillas
152,94929,no me pueden ver tranquila porque ya empiezan los regalitos es lindo el detalle pero de verdad preferira no tener que andar adivinando floresamarillas
153,94930,floresamarillas 21 de marzo o 21 de septiembre igual no recibir pero es la duda de lo que me dijo google jajaja
154,94931,c derechos humanos 14 919474721 641323118 l s de 9 00 a 22 00 domingos de 9 00 a 21 00 ramos centros corona empanadas flores plantas m30 floresamarillas madrid regalos margaritas tulipanes
155,94932,jajaja pngale floresamarillas de primavera y hablenle a geraldine para que le llame y se serene es 21marzo y adems el clasicomundial2023
156,94933,todos vuelven pero t ya no estars floresamarillas
157,94934,hacer lo que ms te gusta no siempre te hace feliz solo likecrazy floresamarillas
158,94935,mutis aqu tienen su flor amarilla floresamarillas
159,94936,a m me gustan mucho de esas y dentro de una quesadilla floresamarillas
160,94937,que te regalen floresamarillas y un accesorio de blingyblang primavera felizmartes 21demarzo
161,94938,quitenle el casi no y descubrirn la tremenda bronca con todo y sus pastillas y floresamarillas 21marzo
162,94939,tendencia a raz de la tendencia que surgi en tiktok en el 2022 y con la llegada de la primavera regalar floresamarillas el 21 de marzo se est convirtiendo en una tradicin la tendencia surgi de una cancin de una telenovela argentina
163,94940,me da risa que el proveedor de mi mami le dijo no seora ya se acabaron las floresamarillas estos nios de ahora hicieron esa babosada ya da de mercadotecnia y ventas
164,94941,feliz ostara feliz primavera feliz equinoccio feliz temporada aries que todo lo que sea puro y desees con el corazn se manifieste en tu vida siempre desde el amor alejado de todo sufrimiento as sea floresamarillas springishere ostara
165,94942,mi flow es nico matiasgarciard showcarlosduran temblor  ep1 likecrazy afganistan    floresamarillas      jisoo
166,94943,eso ocurri en el parque de dajabn frente a utesa eso dos haitianos dndose amor haitham haitians haiti hait afganistan likecrazy jisoo floresamarillas haitiano
167,94944,mobilelegends likecrazy floresamarillas estoy en vivo en twitch ven a pasar el rato
168,94945,probablemente no haya nada en la naturaleza humana ms resonante que el flujo de energa entre dos cuerpos biolgicamente similares uno de los cuales ha estado en una dicha amnitica dentro del otro uno de los cuales ha trabajado para dar a luz al otro floresamarillas jisoo
169,94946,wey que triste que tenga que ser un da especial para que al desinteresado de tu bato te regale floresamarillas
170,94947,ya regalaron sus flores amarillas floresamarillas
171,94948,el amor floresamarillas 21mar amordemadre firstdates21m
172,94949,21 de marzo y yo emocionada con mis floresamarillas noloentenderas
173,94950,que carajos es esto gente es la zapatilla ms rara que vi floresamarillas
174,94951,ya les dieron sus floresamarillas
175,94952,las mas floresamarillas
176,94953,jajajaj intento de dibujo para el licenciado jajajaj aqu humildemente flowerforquackity flower floresamarillas
177,94954,a mi no me metan en los que yo no quiero tener problemas floresamarillas
178,94955,cada detalle cuenta floresamarillas
179,94956,no mamen se acabaron las floresamarillas en mi pueblo ta cabron
180,94957,tendencia ya regalaste flores amarillas an hay tiempo entrate aqu por qu dar este lindo detalle floricienta floresamarillas 104 5fm galowenriquez1
181,94958,ya lo pens bien no quiero flores amarillas quiero un terreno floresamarillas
182,94959,dicen floresamarillas y automticamente pienso en floricienta aaaaaaamo wey
183,94960,ya te dieron tus flores amarillas da del nowruz equinoccio de primavera todo invierno tiene su fin da 21 es haciendo alusin al 21 de marzo que es el da que llega el equinoccio de primavera en el hemisferio norte 21marzo2023 primavera equinoccio floresamarillas
184,94961,servicio de mantenimiento contacta con nosotros a nuestros nmeros 417 177 1508 417 177 8566 4171724129  floresamarillas anuncio promocion trabajo seguridad camarasespias
185,94962,mi vida mejor cuando encontr a un hombre que sabe que el mnimo esfuerzo no es suficiente floresamarillas
186,94963,manifestando mis floresamarillas
187,94964,cuando me enter que las floresamarillas tambin son un smbolo de arrepentimiento por traicin empec a ver todo distinto con personas que presuman darlas y mgicamente su relacin vala verga a la semana
188,94965,les dieron flores amarillas floresamarillas
189,94966,uyyy alguien quiere hacer puntos floresamarillas floricienta
190,94967,floresamarillas ni qn vrg las quiera alchhh
191,94968,floresamarillas mi nico deseo es que a todas nos quieran bonito floresamarillas flores primavera
192,94969,flores amarillas yo prefiero unos rosones floresamarillas
193,94970,nada mejor que una buena flor de un buen cultivo weedlovers green smokefree floresamarillas
194,94971,la mam de geraldine ponce tiene sendos salarios y compensaciones desde que la joven poltica lleg a cargos pblicos para quienes no lo crean ah est la nmina y las evidencias con todo y floresamarillas 21marzo
195,94972,hay amor en el aire y unas cuentas flores amarillas floresamarillas
196,94973,no me la van a creer juansguarnizo floresamarillas
197,94974,ustedes borran las fotos de instagram o las archivan floresamarillas
198,94975,un rbol podra sentirse vencido en pleno otoo pero volver a abrir sus hojas en primavera nuncaterindas floresamarillas reflexion motivacion psicologa motivationalquotes btc
199,94976,messi feliz da yo si te regalo las flores que quieras floresamarillas
200,94977,tuve fe floresamarillas
201,94978,todos hablando de las flores amarillas y mi hijo vio estas flores y agarro una y me la dio floresamarillas
202,94979,a mi si me dieron mis flores amarillas floresamarillas flowers ellasabia amor girasol
203,94980,las uas de las bestias isabellojo nftsale polygon nft nftgiveaways nftcommunity nftcollectors nftphotography nfts floresamarillas opensea
204,94981,jajaja que sad ni manzanilla floresamarillas
205,94982,para los que no recibieron sus flores amarillas 3 floresamarillas draw dibujodigital dibujo uwu
206,94983,yo nadie se acord de darme flores amarillas floresamarillas mi amiga
207,94984,no se porque ac andan dando flores amarillas no era para el hemisferio norte eso floresamarillas
208,94985,entonces las floresamarillas son por floricienta
209,94986,para todas las que no recibieron sus floresamarillas les ando un bello girasol 21demarzo
210,94987,por si aun no les regalan sus flores amarillas floresamarillas dibujodigital rubypollito
211,94988,y tu ya recibiste tus floresamarillas va esimagen tlax
212,94989,me dijo que se le perdi la cartera y bajo a buscarla en realidad sali a comprar esto no soporte y llor floresamarillas
213,94990,me dibuje mis propias floresamarillas
214,94991,da de flores amarillas pero mis tulipanes no podan faltar floresamarillas
215,94992,ella saba que l saba que algn da pasara que vendra a buscarla con sus flores amarillas camila cabello camilaaccess floresamarillas 21marzo
216,94993,hoy no fui espectadora fui protagonista floresamarillas yoonginista
217,94994,y si les llegaron con las soadas floresamarillas que mencionada floricienta
218,94995,ni se de donde sali lo de las floresamarillas pero yo tambin quiero
219,94996,dijo y me rompi el corazn jajajaja floresamarillas
220,94997,l la estaba esperando con una flor amarilla ella lo estaba soando con la luz en su pupila y el amarillo de sol iluminaba la esquina 21demarzo floresamarillas
221,94998,la ms feliz combinando con mis floresamarillas primavera
222,94999,flores amarillas floresamarillas primavera 21demarzo
223,95000,por si alguien no te a dado tus flores amarillas flores 21marzo 21demarzo floresamarillas kai kaininjago
224,95001,no te pude dar flores amarillas pero al rato te doy unos rosones frases que enamoran floresamarillas
225,95002,ella saba que el saba floresamarillas 21marzo 21m
226,95003,y mis floresamarillas
227,95004,entrate las floresamarillas son una tendencia en redes sociales descubre por qu leer ms
228,95005,villacoapa tiene abierta sus puertas para todos floresamarillas temblor earthquake
229,95006,busque en 4 floreras diferentes pero vali la pena verla tan feliz con sus floresamarillas
230,95007,dios mi hermano me regalo mis flores amarillas y amo demasiado dios son perfectas y me encanta todo ihhhhhhh lo amo es hermoso fenix floresamarillas marcoelfenix
231,95008,obvio las voy a presumir porque tengo el novio ms hermoso floresamarillas floricienta
232,95009,hoy es 21 de marzo da de floresamarillas
