,Id,Tweet
233,95010,mis propias flores amarillas floresamarillas floricienta nos dejo con la ilusin de que algn da alguien nos diera nuestras flores amarillas
234,95011,querido diario hoy me compr mis flores amarillas floresamarillas
235,95012,por si no te dieron floresamarillas aqu te ofresco unas feliz da
236,95013,aqu est tu flor amarilla floresamarillas
237,95014,que este inicio de la primavera traiga la mejor de las vibras para ti primavera equinoccio floresnaturales floresamarillas cdmx amarillo bali
238,95015,floresamarillas a las feas a las bonitas unas rosadas
239,95016,por si nadie te llevo tus flores amarillas floresamarillas
240,95017,mereces un campo de floresamarillas primavera
241,95018,ella saba que l saba que algn da pasara que vendra a buscarla con sus flores amarillas 21demarzo primavera floresamarillas floricienta
242,95019,son las cosas pequeas las que me recuerdan porque me enamor de ti floresamarillas
243,95020,y mis flores amarillas floresamarillas
244,95021,no que muy i can buy myself flowers y hoy andan chingue y chingue con sus floresamarillas
245,95022,me encandil el sol primavera floresamarillas
246,95023,y mi cogollo digo mi flor amarilla floresamarillas
247,95024,si es un sueo no me despierten floresamarillas
248,95025,ests como floricienta todos esperando sus flores amarillas algn da pasara vendra a buscarla con sus flores amarillas ya recibiste las tuyas noticia y entretenimiento en floresamarillas 21demarzo radiofuego
249,95026,una lavadita y para mi mejor amiga este 21 de marzo floresamarillas
250,95027,alguien que me explique eso de las flores amarillas no entiendo nadaaa floresamarillas
251,95028,21 de marzo floresamarillas
252,95029,dibujo rapido por el dia de hoy en realidad no me gustan las flores asi que puse mi favorita en amarillo hace rato no hacia algo para mi floresamarillas
253,95030,a mi no me regalen floresamarillas ya lo dijo divisin minscula no puedo prometerte un por siempre ni siquiera s si puedo un hoy en sognare bro i really feel that
254,95031,plebes si me dieron mis floresamarillas voy a llorar
255,95032,qu onda con lo de las flores amarillas quealguienmeexplique floresamarillas
256,95033,y si hoy 21 de marzo vuelve a ser tendencia floricienta y floresamarillas todos los que saben las razones les recomendamos visitar nuestro sitio web
257,95034,si an no regalan floresamarillas en este 21 de marzo pueden cortarlas de la plantacin en el colegio municipio de tarmbaro donde el seor eladio vzquez vende hermosos girasoles va margarita arreola notitrece
258,95035,hoy tambin me faltaron las floresamarillas pero no la poesa porque escribir saca las miserias de esta vida ma quisiera una flor solo si viene de un buen amor quisiera mil letras escribir y escupir los males de m da igual el da pero hoy que brille la poesia
259,95036,el novio ya nos dio flores amarillas y nimede mi amor toca soportar floresamarillas
260,95037,no llegaron las floresamarillas hoy 21demarzo primavera
261,95038,la cdmx est llena de lugares sorprendentes para visitar adems de personajes como chabelo y martha debayle comenta cul ser tu prxima aventura toyota polanco avanza floresamarillas worldbaseballclassic felizmartes
262,95039,listo con las floresamarillas
263,95040,porque esperar flores amarillas de alguien hoy el unico amor para toda tu vida eres tu misma ve compralas para ti o robalas de algun jardin 21marzo floresamarillas loveyourself
264,95041,el verdadero ramo de flores amarillas q necesitas floresamarillas
265,95042,no te olvides que la vida casi nunca est dormida floresamarillas
266,95043,en cuestiones de soportar mi yo de 12 aos no est soportando con tanta felicidad floresamarillas
267,95044,me puse a pensar es 21 de marzo y no tengo quien me mande mis flores amarillas pero en retrospectiva el ao pasado si tena quien me mandara e igual no recib floresamarillas
268,95045,holis linda personita te regalos unas hermosas flores amarrilas el dia de hoy puedes darle un vistazo aca al speedpaint vtuber floresamarillas floricienta dibujo art drawings
269,95046,tlaxcala floresamarillas lo sabas cada 21 de marzo las parejas se regalan flores amarillas como significado de que la persona que las obsequia quiere estar toda la vida junto a esa persona ms informacin y galera
270,95047,ai mis nios floresamarillas marzo21
271,95048,por qu floresamarillas y floricienta son tendencia
272,95049,floricienta es tendencia en redes sociales por su recordada cancin floresamarillas y por el inicio de la primavera las personas acostumbran a regalar dichas plantas rrss floricienta primavera fl2001
273,95050,la bicha de la abc acaba de decir que el rollo de las floresamarillas es por floricienta alv el equinoccio
274,95051,mi amigo me regalo una flor amarilla floresamarillas
275,95052,no te olvides que la vida casi nunca est dormida floresamarillas
276,95053,el verdadero da de dar flores amarillas es el 21 de septiembre fecha en q comienza la primavera en argentina pas donde inicio la tradicin ya dar flores amarillas el 21 de marzo es invento de los mexicanos ah van a disculpar jajaja floricienta floresamarillas
277,95054,a las que les regalaron floresamarillas hoy solo pase a decir que
278,95055,ella saba que l saba que algn da pasara que vendra a buscarla con sus flores amarillas floresamarillas
279,95056,ok ahora con lo de las flores amarillas me doy cuenta de lo solo que estoy tt floresamarillas primavera lgbt lloro
280,95057,el gobierno de gustavo petro es aterrador si no escucha este episodio del podcast libertad universal aterrador gobierno de petro floresamarillas colombiavamal colombiavabien colombia colombiapotenciamundialdelavida temblor messi
281,95058,soy la ms feliz del mundo floresamarillas
282,95059,floresamarillas paso de 38 a 7
283,95060,construye tu futuro en este paraso tenemos terrenos de inversin tenemos facilidades de pago para ti contctanos 954 129 9488 y 954 125 1588 beach playa puertoescondido inversin invertir futuro mar sea paraso floresamarillas
284,95061,para los que no les lleg su flor tranquilos aqu estoy para ayudar primavera floresamarillas
285,95062,check out la vecina de las flores s video tiktok floresamarillas flores amarillas
286,95063,iba pasando frente al colegio nacional y un chico de entre 14 15 aos iba con un ramo de floresamarillas y la sonrisa mas feliz que vi en mi vida piba e cuidalo o vamos todos a tu casa
287,95064,ellas saban que ellos saban que algn da llegaran con sus flores amarillas morelianas se pasean en el primer cuadro de la ciudad con sus ramos de flores amarillas morelia floresamarillas
288,95065,floresamarillas paso de 38 a 8
289,95066,hola twitter no hay floresamarillas porque nicaragua la nica primavera que tiene es el barrio la primavera bai
290,95067,estoy esperando a que mi viejo llegue de trabajar para darle este detalle las mujeres tambin podemos floresamarillas
291,95068,quedar floresamarillas
292,95069,aqu esperando que me traigan mis floresamarillas
293,95070,acabo de ver a una chica en la universidad con sus flores amarillas exijo las mas aunque no tengo a quien exigirle xd floresamarillas
294,95071,el libro perfecto para regalar con unas floresamarillas
295,95072,no te olvides que la vida casi nunca est dormida floresamarillas
296,95073,solo la unidad de los partidos de la oposicin sacan a luis abinader de no repetir 4 ms vamos a ver si se mantiene el acuerdo entre hipolito meja y danilo medina para no dejar que leonel fernndez vuelva al gobierno temblor earthquakes floresamarillas
297,95074,les deseo flores amarillas todo el ao no solo hoy floresamarillas
298,95075,chaaa un ao ms siendo espectadora y no protagonista fail floresamarillas jajaja te falle floricienta jaja
299,95076,feliz feliz porque me regalaron las flores amarillas floresamarillas simellegaron
300,95077,la vida es como una montaa rusa hoy puedes estar muy arriba y maana abajo pero existe un cinturn que nos sujeta de lo malo que nos podra suceder as que nunca tener miedo no darse por vencidos floresamarillas pazyequidad peru fyp likecrazy
301,95078,no me llegan mis floresamarillas
302,95079,como chingan con sus floresamarillas
303,95080,21 de marzo el da de recibir flores amarillas es la primera que recibo en toda mi vida siempre llega alguien mejor a tu vida floresamarillas floricienta love parejas
304,95081,me hace feliz que les regalen floresamarillas a las favoritas de dios hombres de alto valor
305,95082,las puestas de sol son la prueba de que los finales tambin pueden ser bonitos floresamarillas likecrazy
306,95083,amo este tipo de sorpresas floresamarillas
307,95084,yo esperando mis floresamarillas
308,95085,no soy de regalar rosas pero se siente bien ms cuando es par alguien que quieres mucho marzo21 floresamarillas
309,95086,este ao no fui espectadora me llevaron floresamarillas a la universidad
310,95087,mi mejor amigo me dio mis floresamarillas
311,95088,wario te ofrece unas flores amarillas que haces floresamarillas wario nintendo
312,95089,chica quisiese pero no pudiese mi carterese no me lo permitiese floresamarillas 21marzo 21marzo2023 benitojuarez graciasbeni tammy likecrazy
313,95090,llegaron mis floresamarillas
314,95091,trabajo a 1 cuadra de una preparatoria y acabo de ver a 4 morros con ramos de floresamarillas no se el contexto pero aqu siendo expectadora
315,95092,ella saba que l saba que algn da pasara que vendra a buscarla con sus flores amarillas sakuraharuno primavera floresamarillas fanart sakura haruno sasusaku
316,95093,vaya hermosa aqu est tu floresamarillas de la que tanto me estabas hablando el da de ayer
317,95094,feliz da internacional del sndrome de down     earthquake valparaiso dolar floresamarillas diamundialdelapoesia madurogolpealoscorruptos
318,95095,yo no necesito floresamarillas yo necesito un cartn de pacificomx tambin son amarillas
319,95096,a mi no me den floresamarillas a mi denme unos tacos y una cocacola porfa
320,95097,entre lenovo acer y hp que computador es mejor floresamarillas martes
321,95098,flores amarillas floresamarillas 21demarzo
322,95099,pa todas las viejas chulas de mi tl floresamarillas primavera
323,95100,21 de marzo imagen captada desde el centro histrico de xela ya recibiste tus flores amarillas floresamarillas la voz de xela anyeli meja
324,95101,ests como floricienta todos esperando sus flores amarillas algn da pasara vendra a buscarla con sus flores amarillas ya recibiste las tuyas floresamarillas 21demarzo
325,95102,esta bien que quieran sus floresamarillas pero prcticamente ya las estn rogando
326,95103,aqu no pas nada palomitas xd floresamarillas goose gooseduck duck maple goosegooseduck gamer gamergirl juegos pato2023 videojuegos moviles multijugador
327,95104,floresamarillas no estudies nicamente para pasar los exmenes estudia para que un pueblo nunca le falte el agua potable desde lo hidrulico estudia para que un edificio sea el hogar seguro de muchas familias
328,95105,contexto de las floresamarillas
329,95106,si eres alrgicx tomate una loratadina o que se yo floresamarillas 21demarzo
330,95107,hoy todos esperando sus floresamarillas y lo que deberan esperar es un viajecito si van a regalar uno hganlo con aerolneas confiables como aeromexico porque con eso de la temporada alta ya no se sabe
331,95108,yo el ao pasado ayyy que bonito que a las argentinas les regalen floresamarillas el 21demarzo lit yo un ao despus
332,95109,a pesar de la distancia mi novio se esforz para que yo recibiera mi flor amarilla te amo amor hector rmz04 floresamarillas
333,95110,y encontr la flor ms grande letrasbonitas letrasdeescritos frasesdeamor letrasenflores floresamarillas
334,95111,no me la regalaron pero se la robe a mi amiga d floresamarillas
335,95112,un dibujo sencillito unas flores amarillas para mitsuri por la primavera con mucho amor iguroobanai mitsurikanroji floresamarillas kimetsunoyaiba demonslayer mitsuigu   
336,95113,clsicos de primavera primavera mexico floresamarillas diamundialdelapoesia vieta
337,95114,como lo amoooo floresamarillas
338,95115,muchas floresamarillas para las que no tuvieron hoy las suyas
339,95116,echa un vistazo al vdeo de catalina giuffra tiktok floresamarillas
340,95117,no puedo mas con esto aun estando a 12 000km se distancia me envio flores 21demarzo floresamarillas
341,95118,no me regalan flores ni en mi cumpleaos qu chingados me van a andar mandando floresamarillas hoy 21demarzo
342,95119,no se que es lo de las flores amarillas pero quiero unas floresamarillas
343,95120,chiflando a mi flaquita preciosa con sus floresamarillas
344,95121,datocurioso en esta fecha las mujeres esperan sus flores amarillas te contamos su significado y cual es el origen de esta nueva tradicin cumple su sueo floresamarillas primavera floricienta
345,95122,de m para m floresamarillas
346,95123,ella saba que l saba que algn da pasara que vendra a buscarla con sus flores amarillas floresamarillas
347,95124,yo la ms feliz con mis flores amarillas justo el da que cumplimos mes floresamarillas
348,95125,ella saba que l saba que algn da pasara que vendra a buscarla con sus floresamarillas no te apures no detengas el instante del encuentro est dicho que es un hecho no la pierdas no hay derecho no te olvides que la vida casi nunca est dormida
349,95126,ahi esta su huevada por el da de floresamarillas cachudas investigacin mt
350,95127,elfinanciero supremacorte marthadebayle fentanilo galilea santiagogimenez floresamarillas ultimahora ultimasnoticias ultimominuto son unos hipcritas esto les dijo el presidente amlo a ministros de la scjncorrupta por desplegado
351,95128,para ti preciosa floresamarillas floricienta anuel 21demarzo
352,95129,ella sabia que el sabia que algn da pasara a buscarla con sus flores amarillas floresamarillas 21marzo davigle93
353,95130,como cuando te gustan demasiado las plantas dolar valparaiso floresamarillas diamundialdelapoesia likecrazy gfvip
354,95131,ella saba que l saba que algn da pasara que vendra a buscarla con sus flores amarillas 21demarzo floresamarillas
355,95132,creo que mis floresamarillas se perdieron en el camino porque otra vez no han llegado
356,95133,me regalaron mi flor amarilla floresamarillas
357,95134,tuve que salirme de la oficina porque mi hijo me pidi que le llevar dos ramos de floresamarillas misin cumplida
358,95135,amp no lo olviden cada flor es un sancho floresamarillas cha chau 21demarzo
359,95136,ya que estamos con el tema de la floresamarillas les dejo mi foto en la muestra de van gogh regalen sus flores amarillas
360,95137,floricienta influye favorablemente a floreras de pozarica floricienta floresamarillas floresamarillas xalapa veracruz y t ya tienes las tuyas recuerda apoyar al comercio local ms informacin
361,95138,paren porfavoooor que me derrito de amor amor entre hermanas floresamarillas
362,95139,ok ya entend floresamarillas
363,95140,y s me siento afortunada floresamarillas
364,95141,ya les dieron sus flores amarillas no que inconsciencia toma una florecita papi diamundialdelapoesia floresamarillas
365,95142,monagas es la prctica de turismo extremo conoce donde puedes practicar canyoning y disfrutar una estupenda cascada nicolasmaduro delcyrodriguezv gfvip floresamarillas diamundialdelapoesia chavezhechomillones monagas
366,95143,otro ao sin poder cantar ella saba que l saba que algn da pasara que vendra a buscarla con sus flores amarillas floresamarillas
367,95144,ella la ms creda la ms floricienta floresamarillas
368,95145,y se olvidaron de sus flores amarillas supersadly floresamarillas aypaluego
369,95146,por si an ests esperando tus floresamarillas te regal esta
370,95147,alenosune con algo ms que floresamarillas tiene todo lo que se necesita para afrontar el edomex y sus problemticas
371,95148,alenosune en esta primavera sus propuestas marcarn al edomex as como este da el gusto por las floresamarillas
372,95149,floresamarillas la tendencia en tik tok obsequiar flores amarillas un significado positivo de acuerdo a la tradicin regalar flores amarillas en el inicio de la primavera tiene un significado muy especial es darle la bienvenida a una nueva etapa llena de prosperidad
373,95150,flores amarillas para don tripitas roiereal roier floresamarillas necesitodinero
374,95151,ella saba que l saba que algn da pasara que vendra a buscarla con sus flores amarillas 21demarzo floresamarillas
375,95152,yo si quera mi amor pero mejor vamos a comer y as cuidamos las flores floresamarillas
376,95153,amigo tu si le sabes a la vida flowers floresamarillas 21demarzo
377,95154,llego el da de tener globitos en mi twitter hbdtome hbd march21st 21demarzo fc diamundialdelapoesa floresamarillas
378,95155,que bonitas y felices se ven con sus flores amarillas que las consientan hoy y siempre floresamarillas 21demarzo 21m
379,95156,flores amarillas no jersey amarilla s tigres futbol vs floresamarillas
380,95157,el da 21 de marzo marca el inicio de la primavera en el hemisferio norte del planeta y con l se ha creado desde hace unos pocos aos una curiosa tradicin regalar flores amarillas a la persona que ms quieres lo sabas floresamarillas
381,95158,le di un especial regalo ami mam floresamarillas 21demarzo
382,95159,necesito contexto de eso de las flores amarillas floresamarillas
383,95160,para ti que manifestaste tus flores amarillas 21marzo floresamarillas
384,95161,qu hay hoy y por qu las peladas color guatallarin piden flores amarillas una mata de ruda o 10 centavos de yerbita te puedo regalar baby floresamarillas
385,95162,saban que las floresamarillas tambin significan arrepiento por infidelidad aguas eh
386,95163,si las recib floresamarillas
387,95164,las amo muchisimooo floresamarillas
388,95165,si en este da nos une el gusto por las floresamarillas alenosune con su registro por la gubernatura alejandradmv felicidades
389,95166,se cancela sentirme miserable hoy es el da mundial de la poesa el da es bonito y me regalaron floresamarillas
390,95167,ella la estaba esperando con una flor amarilla floresamarillas
391,95168,las floresamarillas contrastan con el azul que porta alejandradmv en esta foto demostrando que alenosune
392,95169,hoy es un buen da para escuchar este himno floresamarillas
393,95170,no sern floresamarillas las que adornan tu blusa son rosas cmo el color del ieem mx alenosune
394,95171,y yo pensando que hoy nadie me dara una flor amarilla floresamarillas
395,95172,decirte que me brillan los ojos cuando te veo se queda corto t haces que me brille el alma ojos brillas girasoles floresamarillas
396,95173,me han mandado las primeras flores amarillas en mi vida siento que ya gan vean que lindos mensajes floresamarillas
397,95174,si su amigo no les regala sus floresamarillas ah no es
398,95175,esperando floresamarillas con la fe hasta el ltimo minuto jajaja
399,95176,preguntadelda que significa lo de las flores amarillas floresamarillas
400,95177,es un da especial en mxico pero este hombre lo hizo especial tambin en per ti amu floresamarillas
401,95178,soy la nica que piensa que lo mejor de este da adems de floresamarillas es que alejandradmv tenga su registro ante el ieem alenosune
402,95179,tendencias compartimos el significado de regalar floresamarillas este 21 de marzo
403,95180,alenosune as como nuestro amor a la primavera con floresamarillas
404,95181,yo no me compr floresamarillas hoy pq las estn dando caras y yo puedo esperar hasta maana
405,95182,army feliz 21 de marzo para ti las ms hermosas flores amarillas floresamarillas
406,95183,ando esperando mi pc amarilla con 1 de probabilidades pero 99 de fe o por lo menos las flores floresamarillas 21demarzo pcgaming gamergirl primavera
407,95184,como las floresamarillas alenosune
408,95185,espero que hoy te den tus flores amarillas pero si no es as y las quieres cmpratela t no te quedes con las ganas y te juro que las vas amar igual o ms amate tanto que cuando otro te ame no te sorprenda floresamarillas
409,95186,floresamarillas hoy soy protagonista
410,95187,ten preciosa tus flores amarillas floresamarillas 21demarzo
411,95188,dej de ser espectadora llegaron las floresamarillas
412,95189,si no me das flores amarillas dame unas rosadas floresamarillas
413,95190,yo quiero algo que me dure para siempre y pueda salir sin taparlo primavera floresamarillas lasertattooremoval
414,95191,gracias mi amor 21marzo floresamarillas
415,95192,cuntas esperando que les regalen hoy sus floresamarillas floricienta
416,95193,flores amarillas benitojuarez dolar diamundialdelapoesia johnwick4 likecrazy florbols 21demarzo floresamarillas
417,95194,ms feliz que 100 felices porque me regalaron mis floresamarillas que llevo esperando desde nia mi nia interna baila de felicidad
418,95195,mi alumna ya gan floresamarillas primavera
419,95196,qu pedo traen con las flores amarillas que es o que alguien me puede explicar floresamarillas
420,95197,hoy es da de floresamarillas
421,95198,toda la vida creyendo que dannapaola cantaba floresamarillas y no que es una tal florecienta
422,95199,cada 21 de marzo miles de personas regalan floresamarillas a sus seres amados por una peculiar razn
423,95200,si me dieron mis flores amarillas y yo soy la ms feliz floresamarillas 21demarzo primavera
424,95201,la felicidad floresamarillas
425,95202,que bonito lo bonito floresamarillas
426,95203,yo chingue y chingue que quiero flores amarillas y lo ms probable que me den es una puteada de tanto romper los huevos floresamarillas otoo2023
427,95204,mi guapo ya me dio mis flores amarillas floresamarillas flower amarillo 21demarzo
428,95205,floresamarillas en hotelcastell bonito martes
429,95206,si me di flores amarilla 21demarzo floresamarillas
430,95207,feliz da floresamarillas ojal nos lleguen flores este 21
431,95208,siempre flores felizmartes primavera floresamarillas
432,95209,l la estaba esperando con una flor amarilla ella lo estaba soando con la luz en su pupila y el amarillo de sol iluminaba la esquina lo senta tan cercano floresamarillas
433,95210,qu significa regalar floresamarillas este 21 de marzo este es un recordatorio para enviar flores a tu persona especial
434,95211,floresamarillas para la mujer ms hermosa del mundo mi mamita
435,95212,mi mejor amiga ya me dio mi flor amarilla floresamarillas 21demarzo
436,95213,quin ya tiene sus floresamarillas
437,95214,le hice estas floresamarillas a mi novia hermosa
438,95215,ella sabia que l que algn da pasara que vendra a buscarla con sus flores amarillas ocart floresamarillas spring oc sketchart
439,95216,yo si recib mis flores amarillas y ustedes floresamarillas flowers
440,95217,toda cachuda pide flores amarillas hoy floresamarillas
441,95218,deseo que les lleguen sus floresamarillas sino de cualquier color pero que les lleguen muchas muchas flores se las merecen preciosuras
442,95219,esperando mi flor amarilla floresamarillas floricienta
443,95220,acabo de ver a un chico en bicicleta llevando un ramo de flores amarillas jajaja quien pudiera floresamarillas 21demarzo
444,95221,no tena que ser una fecha especial yo siempre tena tus flores amarillas para ti floresamarillas 21demarzo aries
445,95222,floresamarillas y ah estn los bsicos yo me quedo con las azules
446,95223,no s que onda con las floresamarillas pero yo tambin quiero cansada de ser espectadora
447,95224,todos los de la poca de floricienta hoy floresamarillas floricienta
448,95225,hoy es 21 de marzo si nadie les ha dado an sus flores amarillas aqu tienen les quiero uvu floresamarillas
449,95226,feliz 21 de marzo army para ti las mas hermosas flores amarillas floresamarillas
450,95227,ella saba floresamarillas floricienta
451,95228,chica si an no te han obsequiado tus flores amarillas ten toma estas son para ti nomas por bonita floresamarillas flores
452,95229,ella saba que l saba que algn da pasara que vendra a buscarla con sus flores amarillas 21demarzo floresamarillas
453,95230,espero y le gusten floresamarillas
454,95231,de teus para una persona especial etiqueta en los comentarios a la persona que le quieras enviar unas floresamarillas
455,95232,ella saba que l saba que algn da pasara que vendra a buscarla con sus flores amarillas 21demarzo floresamarillas floricienta
456,95233,si me dieron floresamarillas el 21 de marzo y una taza de caf al despertar me derrito de amor
457,95234,alguien me hizo mi da floresamarillas 21demarzo primavera
458,95235,para ti floresamarillas vangogh arte vioncent vincentvangogh
459,95236,no soy de flores yo aqu pongo las reglas flower floresamarillas
460,95237,no ando soportando floresamarillas
461,95238,y mis floresamarillas
462,95239,ser q nos llegan flores amarillas hoy floresamarillas
463,95240,feliz 21 es nuestra song antes de tiktok floresamarillas
464,95241,ella saba que l saba que algn da pasara que vendra a buscarla con sus flores amarillas 21demarzo floresamarillas floricienta primavera
465,95242,flores amarillas contexto floresamarillas primavera 21marzo
466,95243,mi crush viste lo de las floresamarillas yo teus
467,95244,floresamarillas love girasol mi novio me dio mis flores amarillas
468,95245,sueo cumplido viral2023 floresamarillas
469,95246,se logr floresamarillas floricienta 21demarzo primavera
470,95247,lo ms hermoso de la naturaleza comienza a florecer equinocciodeprimavera floresamarillas 21demarzo2023 felizmartesatodos feliziniciodeprimavera
471,95248,arreglo para mi hija espero le gusten floresamarillas
472,95249,quien es ese hooombreeeee floresamarillas oriibrescia
473,95250,21 de marzo no se olviden q hoy es el da de regalar flores amarillas 21marzo floresamarillas floricienta
474,95251,a propsito de hoy y las flores amarillas floresamarillas 21demarzo
475,95252,a quin ya le regalaron sus floresamarillas
476,95253,y si me regalaron flores amarillas y mi flor favorita de verdad gracias universo por esa personita floresamarillas
477,95254,ya tengo mis flores amarillas y ustedes floresamarillas
478,95255,listo el ramo de floresamarillas para tu pareja aqu te decimos la razn de regalarlas el 21demarzo
479,95256,para ustedes mis amores floresamarillas 21marzo
480,95257,se logro floresamarillas 21demarzo
481,95258,si les llegaron sus floresamarillas
