,Id,Tweet
409,8424,arnau tenas y dani carvajal se engancharon tras el clsico este maton que tiene un cementerio propio de el esto son los valores que verguenza va sport
410,8425,la recalcada concha de tu madre carvajal qu te costaba regresar hijo de puta
411,8426,antes 1899 ahora 1399 26 bakeagel bicicleta elctrica innovadora de 26 x 4 pulgadas para adultos con motor sin escobillas bi gavi benzema carvajal alonso sergi roberto elclasico felizlunes
412,8427,pero por que chucha siguen rabiando por el gol anulado a asensio en el frame exacto en donde carvajal golpea el baln se deja ver an ms claro el fuera de juego
413,8428,carvajal y ceballos dan asco
414,8429,se pasan de idiotas los 5ubno0rm6l35 del real trampas de madrid segn ellos la bola de goma esta pegada al pies del llorn de carvajal sern idiotas
415,8430,increible que algunos aficionados del real madrid se idenfiquen mas con carvajal y lo que hace
416,8431,hablan los que tienen a carvajal en su equipo
417,8432,este equipo no hace tres cosas seguidas bien porque la mitad de sus jugadores los carvajal kroos modric o benzema han perdido para siempre el hilo de la continuidad y no hacen dos partidos buenos en la misma semana calentito lo de inakiangulo
418,8433,fcb jordi alba intensidad pasin y compaerismo sali disparado del banquillo para abrazar a balde tras el 2 1 levant a caballito a gavi y fue el primero en separar a arnau tenas de carvajal bonagerman
419,8434,tensin tras la derrota del real madrid en el camp nou carvajal se encar con arnau tenas deportesentuits1585
420,8435,aqu ana pardo de vera pardodevera cuenta como juan carlos i adems de las comisiones tambin hizo su fortuna millonaria con el trfico de armas a pases rabes junto a coln de carvajal y khashoggi felizlunes
421,8436,fichar a un ei y a un ed aparte de llegar brahim kroos y modric fuera fede al medio y fichar a bellingam y arribas benzema fuera subir a lvaro y fichar a oshimen o vlahovic fran garca va a llegar y con mendy el li va bien renovar a nacho y de ld cancelo y tobias carvajal fuera
422,8437,quiero pechiche
423,8438,vaya jodida manipulacin jajajajajaja es carvajal quien se encara cogiendo del cuello que asco de verdad
424,8439,q bebida del bien la cocacola lpm
425,8440,a carvajal no lo quiere ni su propia aficin
426,8441,el clima de bogot es horrible
427,8442,libertad y orden
428,8443,se debera poner frenos en su lengua mentirosa y en las nalghes que parecen cola de dinosaurio
429,8444,mendy defiende mal sus jugadas por alto es hasta cmico pero que daniel carvajal sea titular en este equipo es una falta de respeto
430,8445,cuntas veces os habis puesto el gol de kessi yo unas 247 taconazo del polaco con falta a carvajal balde penetra y la pone rasa atrs llega il presidente y acomoda todo el cuerpo para mandarla a guardar con mimo saludo militar vayan encargando la liga 27
431,8446,salgo que gane la champions mrancelotti no puede seguir como entrenador si no tiene huevos a sentar a benzema carvajal modric kroos chao realmadrid
432,8447,lo mejor del bodrio q todos vemos y que queremos cambiar son los comentarios en twiter juegodeilusiones
433,8448,imagnate como debe de tener carvajal florentino prez y jos ngel snchez de secuestrada la banda derecha del madrid que un tipo como malo gusto decidi en su momento competir con reece james ni siquiera sondearon su nombre ni el de frimpong ni mucho menos el de fresneda
434,8449,parece q os olvidis del codazo de carvajal hace unos partidos q se fue sin tarjeta tb
435,8450,el unico hijo de la gran puta que qued de aquellos cerdos mal intencionados asquerosos y hacheros es carvajal entre ellos ramos peppe coentrao marcelo carvajal casemiro varan tremendos cerdos carniceros en clsicos
436,8451,gracias a dios ya detuvieron a tres de ellos ellos como joselif ramirez hugo carvajal y nevis villalobos por corrupcion y traicion de la patria
437,8452,que arnau fue por carvajal hay videos donde se ve de otra manera pero sigan engaando de esa forma
438,8453,todas las balas para benzema que ayer hizo un partido mediocre pero hablemos de carvajal que prcticamente nos entreg en ataque y luego en defensa nos dej expuestos horrible partido y veo pocos palos para l
439,8454,lewandowski hizo falta a carvajal y bengoetxea mir hacia otro lado en el gol de kessi
440,8455,me rio para no llorar
441,8456,resumen de real madrid vs getafe cf 1 0 a travs de youtube este piscinazo de carvajal dio tres puntos al madrid decisivos rbitros siemprea mi lado
442,8457,antes 110 ahora 78 49 29 michael kors adrianna ii gafas de sol unisex adulto gavi benzema carvajal alonso sergi roberto elclasico felizlunes
443,8458,inconewsnyc indultado por boric alejandro s carvajal riquelme gobiernocorruptoymentiroso thevoicechv lollacl2023 eduardo ravani violeta parra toleranciacero reportajeschv monsalve alipio ver japenning con ja matamala zaartu corte de apelaciones gaspar rivas
444,8459,en la sexta llorando porque gavi sali impune del empujn a ceballos este sali igual de un tirn de pelo a gavi pero no he visto la repeticin de ceballos encarndose con ansu ni como empuja antes a lewy ni como carvajal coge del cuello a arnau manipuladores
445,8460,antes 199 ahora 158 21 kenwood multipro compact procesador robot de cocina bol de 1 2l batidora de vaso de 1 2l gancho para gavi benzema carvajal alonso sergi roberto elclasico felizlunes
446,8461,hace esto carvajal dentro del rea y dicen que no es nada se lo hacen a ellos y piden expulsin que poca vergenza
447,8462,la mejor noticia del mundooooooooo
448,8463,si viene a clapburguers en envigado la intermedia preprese para esperar mas de 50 min x una burguer mi teora es q priorzan a rappi para no quedar mal calificados muy lindo el lugar pero q psimo servicio clapburguers
449,8464,en vacaciones conoc la ciudad donde las mujeres son sordas
450,8465,el gol de kessi debi ser anulado por falta previa a carvajal que le impide defender el ataque del farsa en la segunda y tercera imagen se ve claramente
451,8466,que falta si es que carvajal es un acabado espero que le metan 15 partidos por coger del cuello a arnau tenas
452,8467,no conozco del tema pero quiero darle la razn adems a quin se le ocurre construir encima en un entorno con tanta agua pero bueno neveralandia y su horrenda climatologa
453,8468,entusiasmo de porristas
454,8469,futbol lomasvisto modo gamer carvajal desvela su aficin por el call of duty
455,8470,del fracaso de esta temporada tiene ms culpa la dinojunta que parece que se les ha olvidado fichar que de carletto sin delanteros y sin laterales hazard y mariano que parecen funcionarios de la agencia tributaria cobrando por no hacer nada y carvajal qno est ni pal castilla
456,8471,la temperatura inclemente la humedad incesante y en medio el agua relajante
457,8472,jaime mamani espindola viceministro de defensa social y sustancias controladas bolivia lapaz larinconada en presencia de representantes del ministerio pblico y la unodc la felcn procedi a incinerar la droga secuestrada en los ltimos das
458,8473,acabo de hacer cuentas y por supuesto que sacare una de buchanans para tomar con los vecinos porque mal vecino jams
459,8474,por culpa de un gobierno ideolgico e improvisador colombiavamal
460,8475,vaya manipuladores son jajajaja empez carvajal
461,8476,te repasas la plantilla en defensa y no hay ms que problemas carvajal ha bajado su rendimiento alaba lesionado vallejo no juega odriozola no juega lucas vzquez no juega mendy lesionado vivimos de courtois militao y rudiguer
462,8477,es que no fue solo el gol anulado es que fueron muchas cosas tuvo que expulsar a sergi roberto y gavi y el gol de ellos no debi subir porque hay falta de lewandoski a carvajal
463,8478,al grito de presidente presidente reciben al canciller marcelo ebrard en el palacio de minera donde realiz la presentacin de su libro autobiogrfico el camino de mxico video otilia carvajal
464,8479,radio antena 2000 sucre bolivia como ya ocurri en sucre tambien en cobija vuelo de boa dio media vuelta a cochsbamba boliviahoy pasajeros de boa denuncian que partieron en un vuelo de cochabamba a cobija la maana de este lunes y cuando estaban
465,8480,luego abres marca i te encuentras la noticia de tenas va a por carvajal i ponen solo las imgenes de l pero no ponen el vdeo como se ve el mal perder de patojal que va a por el seguir seguir que todo llega mientras en rmtv dicen que les han robado menudos periodistas
466,8481,ahora bomberos informa accidente de trnsito avenida alejandrina carvajal unidad br2 al lugar
467,8482,libertad y orden
468,8483,carvajal com no el frankista malparit de sempre que es foti
469,8484,justicia espaola prorroga la prisin preventiva para el pollo carvajal
470,8485,hay que ser mas elegante dice fuera de juego clarisimo el var por los pelos y sin coger cuando carvajal toca la pelota es clarisimo asi era en su epoca cuando el jugaba al futbol clarisimo negreira
471,8486,que carvajal jugo mal si que benzema jugo como el culo tambien pero no me vais hacer cambiar de opinin si los corruptos del var dan el gol de asensio expulsan a gavi dan el gol del bilbao y el penal del valencia y el penal a benzema en betis ganamos esta liga
472,8487,rafael ramirez era adeco el pollo carvajal copeyano joselit del mas eugenia sader del partido azul ninguno pero ninguno era chavista
473,8488,lo que no veras en el marca ni el chiringuito porque no es gavi aqu vemos cmo arnau defendi ms que el mismo carvajal a su equipo barcelona realmadrid bara fcbarcelona
474,8489,mi fiel aliado este finde es siigo facturacin electrnica jajajaja
475,8490,hasta en mi peor momento soy mejor que cualquiera
476,8491,mi vecino el de la msica de banda 20 10
477,8492,carvajal es super bueno
478,8493,de salida me acompaas
479,8494,en ambos frames es fuera de juego pero en el segundo carvajal lleva zapatos de payaso lo cual resta credibilidad al citado frame
480,8495,segn informes desde catalunya dani carvajal sigue tirado en el csped del camp nou despus de tanto seguir la pelota y chocar con lewandoski qued exhausto
481,8496,mateo carvajal ha sido invitado a masterchef celebrity esta es la razn por la que no ha participado
482,8497,soy carvajal en la vida jajaja
483,8498,gracias necesitaba est publicacin sin saberlo
484,8499,arnau tenas si llega a coger a carvajal
485,8500,si nos ponemos as el rbitro tena que pitar falta previa al segundo gol de lewandowski a carvajal pero no
486,8501,muy ilusionado por ver cmo les queda a asensio carvajal y compaa
487,8502,raro que no pidiera el var para que expulsaran a carvajal
488,8503,que carvajal qu por favor eh
489,8504,a tomar x culo carvajal
490,8505,la caida en desgracia de carvajal en los ultimos 3 4 aos es terrorifica lo que fue para el real y lo que es ahora
491,8506,carvajal en una misma jugada se une a la contra y pierde el baln en un intento de hacer un cambio de banda sabr dios por qu si tena mejores opciones no baja a replegar a tiempo deja la banda derecha descubierta se cae al suelo nos meten gol bochornoso
492,8507,antes 1140 15 ahora 979 14 apple ordenador porta til macbook air 2020 chip m1 pantalla retina de 13 pulgadas 8 gb de ram gavi benzema carvajal alonso sergi roberto elclasico felizlunes
493,8508,nada mejor que ver que a t equipo todo le salga bien cuando no mi hija en su rostro lo dice todo y corre a abrazarte la esposa corre y te abraza y algo adentro dice no pierdas la fe son capaces somos capaces vamospereira corpereira
494,8509,festivo de ver discovery con la abuela
495,8510,qu casualidad que de las personas que sospecho algo sus dm s los tienes borrados
496,8511,siendo objetivo de cara a que sean posibles mbappe haaland quedan out kvara un dc oshimen david lille vlahovic un ld frimpong porro salidas hazard mariano carvajal
497,8512,esther carvajal candidata del psoe garantiza un proyecto ilusionante para que el municipio avance y ocupe el sitio preferente que merece la socialista apunta a la recuperacin de la gestin de los servicios pblicos mejoras en el centro de salud
498,8513,ad portas de asumir como presidenta de la comisin de economa del senado chile analizando proyecto que moderniza las compras del estado
499,8514,me cuentan q en la mayora d los medios d comunicacin dieron como el mejor del barsa a sergi roberto y como mejor del madrid a carvajal es evidente q el entorno est al nivel d la liga
500,8515,libertad y orden
501,8516,la tangana al final del clsico entre arnau tenas y carvajal que no se vio por televisin
502,8517,la verdad es que estoy toda hormonal
503,8518,un poquito cnica la gente de estos lares
504,8519,solo queda la esperanza de que fran garca rinda y olvidmonos de limpiar a la mula andante de carvajal si ofrecieron a joo cancelo y dijeron que no
505,8520,el damundialdelafelicidad no puede caer en lunes hombre ya
506,8521,el tito berni y el pollo carvajal estn juntos
507,8522,me gusta la gente que entiende y respeta
508,8523,yo justo ahora
509,8524,aveces no necesitas hablar las expresiones hablan por si solas
510,8525,bendita salvacin
511,8526,tchouameni es un gran jugador y una gran persona cuanto tienen que aprender los carvajal vini ceballos etc de este tipo de jugadores
512,8527,y de repente uno se acuerda de eugenia sader motta dominguez eladio aponte el pollo carvajal rafael isea leamsy salazar vctor cruz w andrs izarra christian zerpa y muchos otros ms
513,8528,el real madrid est jugando con 9 jugadores y cuidado si con menos carvajal y benzema son unos muertos en el medio campo estan los zombies mucha ventaja se est dando
514,8529,esos ojitos
515,8530,carvajal volvi a quedar en evidencia en el partido de ayer es uno de los grandes malos perdedores le da rabia que gente como gavi o balde le superen lo de arnau tenas de lo ms lamentable que se ha visto ltimamente que sigan llorando
516,8531,que se puede hacer con este equipo que no funciona solamente por tener la batera mala todo lo dems est funcional macbook apple mac bateramala
517,8532,pochettino ya demostr en el psg que no sabe gestionar egos y no tiene carcter suficiente si viene va a ser otro ttere de carvajal modri kroos y benzema ral y xabi alonso tiene pintaza como entrenadores pero es pronto tuchel es el hombre
518,8533,el vdeo del pentgono que muestra al caza ruso soltando combustible sobre el dron estadounidense va diarioas
519,8534,cual es el futbolista ms asqueroso de todos y porque carvajal
520,8535,a poco en serio hay quin pague para tomarse una foto con el gero tenoch huerta ahhhhh si si si los chairos porque otros p3nsdjos no hay
521,8536,antes 670 29 ahora 575 14 hp color laserjet pro m479fdw w1a80a impresora lser color multifuncin imprime escanea copia gavi benzema alonso carvajal sergi roberto elclasico yoveosalvame
522,8537,toda la jugada de carvajal en el 2 1 es dantesca desde el ataque del madrid hasta el gol del kessie son 40 dantescos pero sigue sin ser uno de los principales problemas del madrid ni ayer fue de los peores del partido aunque esa ltima jugada es de amateur
523,8538,sois escoria arnau tenas se fue a por carvajal tras el pitido final cuando se claramente en el vdeo que el chaval incluso medio sonre pensando que vena a darle la mano y viene a empujarle y cogerle del cuello y vosotros os hacis llamar periodistas o medio de comunicacin
524,8539,daniel carvajal ramos tiene las mismas champions que tu mentira de club
525,8540,pensando que nuestros laterales han sido marcelo acabado mendy nacho improvisado carvajal lucas vzquez improvisado valverde improvisado camavinga improvisado alaba improvisado odriozola
526,8541,estamos muy mal acostumbrados a que carvajal sea incapaz de ganarle en carrera ni a joaquin con 42 aos y que mendy sea intil en ataque y en juego areo
527,8542,bueno eso de til carvajal generoso
528,8543,que chusma carvajal los mandriles cuando pierden siempre igual
529,8544,carvajal tiene menos clase que salir a tirar la basura en pijama lo sabemos desde hace aos tranquilidad
530,8545,antes 109 ahora 98 1 10 casio analgico digital gma s140m 7aer gavi benzema alonso carvajal sergi roberto elclasico yoveosalvame
531,8546,confirmado no se me ha pasado odio ese pitcher
532,8547,habra que ver los morros de carvajal cmo los de mick jagger en su juventud
533,8548,momentos que me mantienen humilde
534,8549,arturo carvajal vuelve a la carga retomando su reto personal el joven montaero ha reanudado su actividad montaera coronando el pico del obispo en murcia barbastro arturocarvajal montaero deportes
535,8550,igual se lo hizo pisando l a ceballos como el pobre gavi que se hizo dao con los dientes de carvajal segn los comentaristas en directo
536,8551,gran entrenador pero no tiene experiencia en equipos grandes de todas formas al real madrid le gusta la bundesliga all mand a carvajal achraf reinier vallejo y en 2018 se fij en nagelsmann reconocido por l mismo no me extraara que glasner fuera una opcin
537,8552,carvajal ya tenemos todos medio asumido que es retrasado la dinojunta va aparte pero coo mendy tiene fama de roca defensiva cuando desde la lesin de 2021 es de papel
538,8553,nommn ahorita ando viendo up y alch el seor fredericksen era una perra mamada jajajaj y el russell tambin jajajajaj
539,8554,vamo vamo vamoooo
540,8555,se pic entre dani carvajal y arnau tenas al final de elclsico va tt joancoloo
541,8556,feliz cumpleaos papito te amo
542,8557,ustedes son muy jovenes y nunca sabrn quien atropell a cosita
543,8558,20mar fiscala de la audiencia nacional de espaa pide mantener detenido al pollo carvajal
544,8559,prorrogan dos aos ms la prisin preventiva a el pollo carvajal en espaa
545,8560,la felicidad es una decisin que se toma todos los das da internacional de la felicidad
546,8561,esto no lo vers en los medios de comunicacin de la caverna no le gustara al ser superior basta ya de chulos como carvajal hay que ser deportivo en la victoria y en la derrota fcb clasico realmadrid
547,8562,me vuelvo hpta con los hombres
548,8563,ver jugar a mendy me da ganas de votar a vox hasta que veo jugar a carvajal y me dan ganas de votar a podemos
549,8564,logrado
550,8565,en un caso bastante irreal bajas mariano carvajal lucas vzquez fichajes don erling haaland bellingham alexander arnold esto contando con que posiblemente se retire don luka modric y kroos tome el papel de revulsivo
551,8566,te pido me ayudes por favor reservas 0984827910
552,8567,ser seguir trabajando an no cumplo ni el 25 de todas mis metas
553,8568,rudy rodrguez
554,8569,que gesto ms feo de gavi ah no que fue carvajal claro esto no interesa
555,8570,no lo visteis bien el que se fue a por tena fue carvajal y no al revs como lo explicis
556,8571,en serio carvajal convocado con la roja
557,8572,a mi modo de ver todo es mentira en la vida todo es vanidad
558,8573,tambin fue otra parte la falta de lewandowski sobre carvajal previa al gol de kesi y el rbitro no quiso ver
559,8574,detesto salir con el cabello mojado eso me coloca inmediatamente de mal humor
560,8575,luchito lmrendon puedes mandar a sacar cada estatua foto y recuerdo de nuestros heroes pero jams podrs borrarlos de la historia de chile ms temprano que tarde la ciudadana entender el valor y la obra de estos de hecho creo q ya empezaron
561,8576,porque fue el ltimo parto morocho
562,8577,jajajajaja s est curado el seguimiento a carvajal y ms por cmo termina tirado
563,8578,jajaja yo pedi hasta renivacion si seguia haciendo eso ayer jajjaaja que se se vayan del club ya kroos modric benzema carvajal rudiguer
564,8579,foto 1 carvajal ya ha jugado el baln se ve su pierna levantada y el baln en el aire foto 2 carvajal juega el baln en ese mismo momento se ve que el pie y baln estn en contacto en el suelo el fuera de juego se toma al jugarse el baln fuera de juego dejad de mentir
565,8580,que gavi sea tt n1 y carvajal o ceballos no es simplemente porque es un chaval y les quedan muchos aos por mamar de l
566,8581,amn amn y amn
567,8582,chuzo carvajal lucio feo feo en ese gol
568,8583,demostracin de como mediapro nos manipula en las repeticiones de las jugadas en el gol de asensio nos paran la imagen antes de que carvajal toque el baln si es mediapro el encargado de mandar las imagenes al var como nos vamos a fiar elclasico carvajal realmadrid bara
569,8584,lo de carvajal en esta jugada que fue pero luego nos lo venden como uno de los mejores del mundo realmadrid clasico laliga
570,8585,dicho esto autocrtica benzema ya no da para ms se nota la edad carvajal ya debiera terminar su etapa en el madrid al menos como titular mendy no juega bien desde hace meses el madrid esta temporada llega al suficiente y da gracias le salva solo la champions
571,8586,20mar lafanbesvenezuela diariamente ratificamos nuestro mximo compromiso patrio y la lealtad absoluta con la patria y principalmente con el pueblo venezolano somosguardianesdelpueblo
572,8587,los madridistas que os metis con carvajal
573,8588,libertad y orden
574,8589,hay todabia no golpeo la pelota carvajal en esta
575,8590,raul zz guti se fueron antes de acabar contrato no por lo q sea se echaron a un lado ojala carvajal lucas benzema hazard y alguno mas fueron justos con el club y aficion e hicieran lo mismo
576,8591,yop debera estar haciendo pereza en vez de estar viendo cmo carvajal cumple con los principios del pacto mundial tambin yop que chvere estudiar hagamos una especializacin y una maestra al tiempo why not
577,8592,carvajal esta tan acabo que se tiene que meter con un nene para sentirse superior
578,8593,estoy muy orgulloso de m porque he aprendido a sanar sin herir a nadie en el proceso
579,8594,el pri nacional se encuentra en una crisis a nivel nacional busca sobrevivir como fuerza poltica orbitando entre la oposicin y el gobierno de esto y ms en mi columna el doble juego del pri 1 6 puebla morena felzlunes 4t
580,8595,lo de carvajal y nacho es ftbol lo de gavi es que es un guarro
581,8596,aqu pensando en que donde me gusta comprar los pantalones estn a 39 000 y yo siento que necesito comprarme 3 pero mi bolsillo me dice mrk no ms pero mi cabeza me dice mrk obvio s eres joven y los necesitas
582,8597,por qu el mp no investiga el financiamiento de la campaa del prm y luis abinader que el mismo mp dice que capos del narcotrafico financiaron su campaa mimilo jimenez fue recaudador y financista de la campaa de hiplito en 2012 y tambin financi al prm y a abinader en 2020
583,8598,carvajal en la segunda mitad de temporada es dios activa el prime carvajal ayer
584,8599,en filas de bancos y en bancos de parques
585,8600,la humillacin que le hicimos a carvajal ayer fue muy divertida la verdad jsjajajsh y encima este ex futbolista ha sido convocado a la seleccion
586,8601,ya record porque no me gusta meterle corazn a las vainas
587,8602,un poco tarde pero q clasico de mrddd porque no fichamos a cancelo carvajal no da la talla y otro clasico mas donde vini no puede con araujo pero bueno la vida sigue total el madrid tiene 9 ligas mas y champions ni te cuento clasico motomami realmadrid
588,8603,hecho en buenaventura en aceite de no sabemos qu procedencia y antigedad julianmartineza
589,8604,se acab la promo de sesiones de perfil profesional individual pero regresamos con una promo para dos personas ideal para socios de trabajo o colegas tambin puedes venir con un amigx y aprovechar la sesin pilas que el valor regular es de 70 por persona
590,8605,carvajal fue a por arnau esto dice marca son lamentables
591,8606,aplica para todo hasta para los papitos txicos del colegio de mi hijo
592,8607,a esto me refera si bien es cierto que jugamos contra los rbitros tambin no se puede pretender ganar algo con jugadores tan malos como carvajal el gol del negreiras llega por un error suyo en ataque
593,8608,antes 299 99 ahora 253 16 garmin venu sq 2 music reloj inteligente con gps msica pantalla amoled ms de 25 aplicaciones gavi benzema alonso yoveosalvame carvajal sergi roberto elclasico
594,8609,falta de lewandoski a carvajal en el segundo gol hoy es uno de esos pocos das en que tuiter merece la pena que panz a reir me han apaado la tarde
595,8610,vendo alambrito para amarrar la bolsa del pan
596,8611,el video es igual de mierda que el marca carvajal se gira de forma muy brusca como si le hubiese dicho algo desde ese ngulo poco se puede sacar pero claro los que quieren pruebas para todo aqu les vale cualquier cosa
597,8612,video senadora ppd loreto carvajal ad portas de votacin de ley de las 40 horas laborales vamos a votar a favor para que ley se promulgue el 1 de mayo enlafontana senadoresppd bancadappd loretocarvajal ver video
598,8613,emcali al lado de la comunidad el grupo operativo conformado por william galvis jhon jeiner carvajal arles clavijo ingeniera luz mary vasquez pablo celeita juan carlos bolaos y luis alfonso aguilar realiz mantenimiento preventivo de podas en la red de media tensin
599,8614,los que dijeron que mourinho se carg la seleccin ahora callan con las agresiones de gabi a ceballos o carvajal
600,8615,libertad y orden petro maldito libertadyorden
601,8616,okey pero el nivel del afro en la electrnica
602,8617,no les vamos a entregar al pas vamos a dar la guerra de verdad ahora los que se tienen que morir e ir son ellos y los vamos a lograr vamos a quemarle no el pas vamos es a quemarlo a l y sus colaboradores vamos con el renacer de la defensa de colombia libertad y orden
603,8618,mi futuro 11 sera courtuois cancelo militao alaba o rudiger mendy o davies camavinga rodrigo saka tchouameni ceballos vlahovic endricki de reservas tener a kroos a arribas asensio carvajal etc un 4 1 3 2 camavinga solo ah
604,8619,si gonzalo castillo est sometido por recibir financiamiento ilcito de campaa entonces abinader debe ser extraditado por la dea de tantos capos que financiaron su campaa directa e indirectamente iniciando por miky yamil miguel gutirrez red falcn maldonado y ms
605,8620,una vez que iba bien trabado por el centro a las 8 de la noche me senta en una pelcula
606,8621,quien me compre mi carrito de zara le entrego mi virginidad
607,8622,arnau tenas y dani carvajal se engancharon tras el clsico
