,Id,Tweet
0,8015,creo que me gustan los hombres que me dominen jajaja
1,8016,el presidente dice que caldern y fox debieron estar enterados de lo que haca garca luna pero su director de segalmex fue engaado por priistas de malas maas otra ms de sus estupideces
2,8017,revisar la jugada del gol del bara leeandoaky tras soltar el baln hace falta a carvajal mediante obstruccin impidindole llegar a la cobertura del pase del golchiringuitovar
3,8018,no puedo con el cansancio y apenas es lunes
4,8019,sentirte tan roto y triste y aparentar que todo est bien no est siendo nada fcil
5,8020,ojal ser naomi pa estar con el napoli ou chiquillo
6,8021,chiringuitovar poner a carvajal cogiendo del cuello a arnau tenas a llorar a la llibreria
7,8022,los gitanos aparecieron en la dcada de los 40 y habitaron un descampado cerca a lo que hoy es la mayorista hicieron vida trabajando con metales y poco a poco se fueron casando con los paisas los gitanos de itag gabriel carvajal archivo bppiloto
8,8023,ramadn karim puedes ver la luna creciente
9,8024,chiringuitovar tengo un vdeo donde se mira bien que asensio esta adelantado trasan lineas y sale la imagen del golpe de carvajal y lo q hizo lobo esta bien explicado soy del real madrid pero hay q saber perder
10,8025,chiringuito var no hablis de carvajal coje por el cuello a arnau tenas
11,8026,chiringuitovar el var debe tener muchas mejoras para evitar estos errores esa falta de gavi a ceballos es merecida de amarilla o roja y el codazo a carvajal
12,8027,chiringuitobar no hablis nada del 2 1 del bara con clara falta a carvajal slo hablis del fuera de juego que es lo nico que no tiene razn el vdeo de real madrid televisin qu dira la barcel si fuera al contrario
13,8028,claro porque vinicius ceballos y carvajal son unos seores
14,8029,chiringuitovar y por que no se habla de lo que le hace carvajal a arnau tenas
15,8030,y de la falta de lebandosky a carvajal no se habla xd menudo robo tuvo que jugar contra diez jugadores el madrid quince minutos otro que le regalan la liga y se creer un genio como luis enrique el cientfico xavi chiringuitovar
16,8031,martes 21 de marzo independiente santa fe deportivo cali pon tuto a travs de youtube
17,8032,estos polticos son tan ineptos que no saben mentir pinochavallejo
18,8033,francasnoches hugo carvajal dice tener pruebas de los fraudes en dnde asegura que chvez solo gan dos procesos cmo se prepara la oposicin para enfrentar todo ese panorama donde el cne es el arbitro adems de la opoficcin activa y fan polticas
19,8034,que mentira es ms grave indultar sin tener antecedentes o indultar sabiendo todos los antecedentes pinochavallejo
20,8035,nunca hubiera podido imaginar que una ausencia ocupara tanto espacio mucho ms que cualquier presencia ana mara matute
21,8036,no veo a los pesos pesados del madrid hablar con vinicius nacho ceballos y carvajal que han hecho de las suyas cmo jalarle el pelo a gavi agredir a arnau carvajal vinicius encarar rbitros y nacho jugando nba y haciendo faltas que debi ser expulsado al min 40 mandan cojones
22,8037,chiringuitovar alguien puede garantizar q en ese frame y desd esa camara el interior dl pie d carvajal esta tocando el balon en ese momento y porque el var automatico lo hace en el momento q sale el balon
23,8038,chironguitovar para un pase bueno que da carvajal el 2 aos no lo anuleis pobrecito carvajal no esta para jugar de titular vean a vinicius del castilla
24,8039,tener en cuenta que el pase de carvajal es de primera entonces al tocar la pelota ya est pasando el baln a asensio chiringuitovar
25,8040,la confianza que yo tengo con el es inexplicable
26,8041,saludos al gato gonzlez tremendo aporreador y cuarto bate de la colonia esperanza en merida imagentvmex lacasadelbeisbol
27,8042,don orgulloso se enamor de doa no le ruego a nadie
28,8043,clsico caliente la pelea que no viste entre carvajal y un jugador de barcelona
29,8044,chiringuitovar el pase se produce cuando el baln sale del pie del que est centrando por lo que no es hasta ese momento cuando hay que medir el fuera de juego adems es independiente las lneas estn mal tiradas lewandoski hace falta a carvajal y gavi debi ser expulsado
30,8045,aqu guido gmez da la informacin oficial de que danilo medina sali del pas a cumplir con un tratamiento de salud previo al da de los allanamientos creo que esto puede calamar un poco laluzjose quien imagina danilo poda saber del operativo el odio y resentimiento mata
31,8046,esto result ser una fake news curioso por decir lo menos ya que ellos pregonaron y condenaron las fake news pinochavallejo
32,8047,20mar a lo largo y ancho del pas nos encontramos firmes contra la delincuencia organizada juntoscontralasmafias czgnb 43
33,8048,chiringuitovar tendrian que haber sido expulsados sergi roberto y gabi sergi por doble tarjeta amarilla y gabi por agresion a carvajal y me repatea ese tipejo dando clases de fuera de juego cuando es el que menos tendria que hablar qtenia que estar tapadito hala madrid
34,8049,chiringuitovar pero es que el centro de carvajal viene rozado por un jugador del bara eso anula el fuera de juego
35,8050,beisbolxteleven en sintona desde maracay budy beily ratificado para dirigir este ao a los tigres y les digo algo aunque es gringo a budy no le voltean ese juego frente a eeuu
36,8051,este hashtag tiene dls lecturas pinochavallejo
37,8052,o sea boric tena los antecedentes para indultar a delincuentes mintieron entonces asi con estos polticos
38,8053,oportunidad de negocio para emprendedores los enchufados guardan dolares en efectivo en sus casas a lo mejor coronas y te caen 100 aos de perdon
39,8054,si si teniendo en su vestuario a carvajal que reparte indiscriminadamente en cada partido o a dani el tirapelos ceballos que no fue expulsado por agredir a gavi vienen a quejarse con mensajitos a los jugadores del bara vayan a mamarla por ah hombre
40,8055,cualquier aficionado que sepa algo de futbol y sea aficionado del rm sabe que rudiguer ha de controlar sus subidas locas que carvajal hace 1 partido bien de 10 fede es de momentos y benzema nunca ha sido goleador pero no que pierden pk les roban 0 autocrtica
41,8056,carvajal en los partidos importantes cumple
42,8057,el proceso de extradicin de carvajal a estados unidos sigue pendiente ante el ltimo recurso presentado por el exgeneral quien ha acudido a distintas instancias para buscar poner freno a su traslado a norteamrica 20mar
43,8058,en el frame usado carvajal no ha contactado an el baln el pie tapa al baln chiringuitovar
44,8059,cem carvajal trujillo desplegado por todas las parrq del municipio llevando el mensaje del planprosperi para venezuela prospericarlos acompaados por los dirigentes el sec gral henryrangel1963 coord activismo antonio marn alirio rivero coord cap movilizaciontotalad
45,8060,se va la tarde
46,8061,chiringuitovar balboa no tiene razn carvajal an no ha golpeado el baln pero bueno de balboa que podemos esperar
47,8062,cuando se muestra la imagen del fuera de juego carvajal tiene la pierna encogida como se puede decir que ya le ha golpeado chiringuitovar
48,8063,pero en la prensa nacional el titular es que arnau tenas al finalizar el partido se fue directo a por carvajal claro vergenza marca diarioas
49,8064,en lara seguimos trabajando por la educacin del futuro con nuestros nios y nias laavanzadora adolfop oficial vicent carvajal mppeducacion juntoscontralamafia
50,8065,chiringuitovar balboa no tiene razn el baln en esa toma todava no ha sido golpeado por carvajal
51,8066,la ladrona que cobraba las latas de atun a 20 mil en el pae ahora viene a pedir libertad y orden
52,8067,chiringuitovar independiente del gol fuera de juego o no la expulsin del nio gavi y sergi roberto ms la falta de lewandowski a carvajal antes del gol de kessi es una liga balboa te equivocas
53,8068,la yaez va a imponer su ideologa por sobre su calidad de jurista constitucional polticamente es ms hbil que la cresta
54,8069,a we no entiendo tu falta de responsabilidad afectiva que incongruencia tan grannnnde la que vives
55,8070,chiringuitovar qu pasa que no se comenta nada de la falta de lewandiski a carvajal previa al gol del barca y que en bilbao la sealaron anulando el gol
56,8071,se ha llevado gavi el contacto con los dientes de carvajal jajajajajajaj jajajajajajaj que bochorno por dios hasta dnde llega esta gente
57,8072,as se compra el silencio y se arruina el estado gran trabajo de rosa carvajal para larazon es
58,8073,todo fue un antes y un despus
59,8074,carvajal soy yo en el polideportivo pegando pases al azar y rezando para que salgan bien
60,8075,ancelotti sabe que fue un robo el partido de ayer gol anulado legal gol ilegal del barcelona por falta a carvajal dos tarjetas rojas perdonadas a gavi
61,8076,eso lo sabe todo el mundo menos el mp y la pgr ah reside el abuso de poder de abinader y el prm ligado a leonel fernndez en la intencin de destruir el pld y a danilo medina quien crea que leonel est fuera de estas acciones est errado se equivoca
62,8077,los del madrid llorando por el empujn de gavi a ceballos pero se olvidaron de lo que hizo ceballos en la supercopa e ignorando lo de carvajal qu ganas metindote con un canterano
63,8078,sr javibalboa85 al ver anlisis r madrid entre otras jugadas fuera de juego asensio y recuerdo las palabras d xavier hernndez el fuera de juego es cientifico o algo as si se traza linea justo cuando el baln pierde contacto con pie carvajal no existe fuera de juego
64,8079,creo que me siento en la obligacin de comentarlo el clsico de ayer dio un muy buen rollo de parte de tchouameni y de vinicius ambos hicieron un partidazo y fueron muy buenos en todo sentido carvajal y gavi es otra historia
65,8080,el miedo a expresarnos
66,8081,que os cuenten lo que quieran cogieron justo el frame que les convena en el siguiente la pelota sigue en contacto con el pie de carvajal y asensio en linea y ya est y luego a ir de vctimas obviando que tienen todo esto comprado de hace dcadas as son
67,8082,en de vez notarias debieron llamarse reinos ya se heredaban de rey a principe deben si o si reformarse en beneficio de los ciudadanos y terminar con el oscurantismo de estas mafias legales latercera notaras una reforma que no se puede dilatar
68,8083,el marikon d carvajal como se kita del medio rapido el xivato
69,8084,s hablar y leer
70,8085,radio frmula mxico amlo asegur que en la reunin que sostuvo con legisladores de eu no se toc el tema del fentanilo por respeto pues ya qued claro que no lo aceptamos y quien mencione eso ofende a mxico abriendolaconversacin radioformulamx
71,8086,te ser sincera siempre me encantas pero no aportas en mi paz mental
72,8087,lo puedes tener todo pero siempre va a faltar algo
73,8088,siempre voy a querer lo mejor para ti pero si me tengo que ir me voy
74,8089,chiringuitoarbitros asensio viene de estar en posicin de fuera juego y cuando carvajal pasa el baln an esta rn fuera juego eso en la vida puede ser gol
75,8090,mami cmo te explico que no me gusta nadie
76,8091,hoy peque con un pudincito de chocolate
77,8092,te esperamos en la casaabierta de condominiofirenze este sbado 25 y domingo 26 de marzo de 10h00 16h00 financia tu nuevo hogar junto a mutualistaazuay ubicacin ngel carvajal y carlos arizaga misicata nuevohogar tucasalistaconlamutualista cuenca
78,8093,cuando pierde el madrid utiliza todas sus armas para desviar debates como el mal juego como que benzema ha estado a un nivel psimo como que carvajal siga siendo el lateral derecho del madrid como los 12 puntos poniendo el foco en una decisin acertada y en negreira
79,8094,albertopereiro en el madrid no hay mucha autocrtica estn cansados con el tema del var el fuera de juego de asensio la posible expulsin de gavi posible falta a carvajal en el gol
80,8095,y la de que carvajal es un coladero por esa banda te la sabes
81,8096,es increble la cantidad de veces seguidas y sin cansarme que puedo escuchar un coco
82,8097,tcnicamente es mentira no puede dormir en ms de una cama a lo mejor duerme con ms de uno en la misma cama y no la dejan salir sin darle una jugosa despedida
83,8098,arnau me representa y carvajal un mal perdedor
84,8099,uno comienza a unir cosas y se va aclarando la luz en medio de la oscuridad
85,8100,ay no qu da tan aburrido la prxima me ofrezco pa trabajar ms bien jajaja no ms festivos para m
86,8101,carvajal ya est viejo y la edad no perdona pero lo de mendy es xd
87,8102,no se lo deseo a nadieeeee
88,8103,yo solo llame para verte
89,8104,esto no se ve en el chirincirco carvajal agrediendo a arnau tenas el 3er portero del barcelona
90,8105,por lo menos hay buenas noticias para venezuela el gobierno produce otro tipo de queso ajjaj por eso hugo pollo carvajal est preso siguemeytesigo siguemeytesigotvmas felizlunes marzo2023 siguemeytesigocumplo
91,8106,lo mas pegao musica wbcenfox oscar gamarra y camilo carvajal by ese beso colombia wbcenfox
92,8107,los que peds que carlo se vaya pediris tambin que renueven a kross modric y carvajal no hay que ser gilipollas a las 3
93,8108,que triste tu comentario te refleja de tomo y lomo en tu ideologa perversa feliz serias tomando tu las armas y eliminar a tus adversarios eres una mera sombra impregnada de decadencia
94,8109,no me entra en la cabeza que seas periodista de futbol y vengas a poner una imagen de carvajal cuando el baln ya ha salido de su bota para justificar que no hay fuera de juego tienes menos idea que un crio de 2 aos
95,8110,os recomiendo encarecidamente este hilo sobre el pobre gavi que sali mal del codo pq carvajal le dio con los dientes
96,8111,chiringuitocuentaatras lo de gabi a carvajal falta cmo mucho tarjeta amarilla la entrada de nacho al borde de rea tarjeta amarilla siendo la segunda roja y espulsion
97,8112,dos asesinos una de nahuel y maldonado el otro junto con la hiena vidal asesinos de favaloro que pocos valores se manejan en este ispa
98,8113,justicia espaola prorroga la prisin preventiva para el pollo carvajal
99,8114,ante crisis policiaca consuelo cruz debe dejar el cargo de secretaria de seguridad dice carvajal
100,8115,lo traa de vuelta 100 enserio se mea en carvajal
101,8116,voz de amrica usa los mercados burstiles sufren por el fracaso de algunos bancos regionales en estados unidos hoy la crisis es global y varios bancos centrales incluida la reserva federal entraron en accin iacopo d luzi tiene lo ultimo
102,8117,yo no s a cuntos hay que renovar de kroos modric benzema sabiendo que ancelotti los va a poner todos los minutos de todos los partidos pero limpiarse a carvajal y lucas y traer un lateral derecho medio competente s que s que urge
103,8118,el ao pasado me hicieron un dibujito y me dijeron aqu tienes tus flores amarillas ya veremos dijo el ciego
104,8119,voz de amrica usa migrantes en nueva york eeuu se han encontrado con una iglesia en el corazn de la ciudad donde adems de impartirse misa se les asesora legalmente con sus casos migratorios ngela gonzlez nos cuenta de qu
105,8120,vovoz de amrica usa el ltimo diplomtico del vaticano que quedaba en nicaragua abandon el pas y clausur la sede diplomtica la unin europea asegura que el presidente daniel ortega suspendi de forma unilateral las relaciones diplomticas entre
106,8121,ya estn listos contigo puebla
107,8122,el ejemplo
108,8123,radio fides de bolivia la hora del pas vespertino 101 5  760 
109,8124,chiringuitocuentaatrs no vais a hablar de la falta de lewandoski a carvajal previa al gol del barca
110,8125,libertadyorden realidad y tendencia sin bodegas ni bots libertad y orden impuestos por nuestras gloriosas ffaa con el apoyo ciudadano libertad y orden en nuestra amada colombia fuerapetro
111,8126,lo de carvajal es intensidad y adn lo de gavi es juego sucio as va la narrativa de la caverna
112,8127,si uno quiere esperar que otr haga por uno lo que uno no quiere hcer por uno mismo entonces uno debe estar preparado para esperar toda la vida
113,8128,yo con plata soy lo peor que me puede pasar
114,8129,entonces lo q diga el mp en su relato fctico es cierto cosas cmo esas ha dicho el mp en cada uno de los casos y no ejecuta extrao es que siendo danilo el principal objetivo y el mp teniendo esa prueba no lo imputa por qu ese mp dijo q dicent era el cabecilla sin pruebas
115,8130,esto buscan china y rusia con su relacin va masinformacion
116,8131,siempre que tengo terapia es como un ya no s qu contarle aaaaah pero salgo dicindole lo que tenia guardado y que ni yo saba
117,8132,el dr julito hazim se pregunta si abinader puede explicar lo del helicptero de la vega lo del nombramiento de michel dicent en la lotera yo le agrego si abinader puede explicar lo del financiamiento a su campaa de miguel gutirrez y su hermano lo de yamil abreu
118,8133,my danny me escribi con los crisoles acadmicos que he acreedor en norteamrica desde miami lo siguiente papi no quiero que te involucre en las redes sociales en los ltimos temas del ministerio publico recurdate que ni abuelo frank y t han recibido nada de ningn gobierno
119,8134,los detalles la justicia espaola prorroga la prisin preventiva de hugo el pollo carvajal
120,8135,ayer carvajal estaba picaddimo al final iba mas caliente que un perro en celo el cabron
121,8136,me lleg hagamos fiesta
122,8137,como cambian las cosas en un ao
123,8138,falta de carvajal con los dientes
124,8139,libertad y orden colombiavabien
125,8140,el tnel de la lnea es una exquisitez de la ingeniera nuestra torre eiffel el tnel ms largo de latinoamrica poco se habla de ese xito de invias
126,8141,me voy a poner ms buena de lo que ya estoy
127,8142,y su suegra bien que la abraza de mayor quiero ser como ella
128,8143,todas
129,8144,necesitamos de vuelta estar en un pas donde exista la libertad y orden
130,8145,y sigue el resfriado
131,8146,mejor que t
132,8147,colombiavabien libertad y orden
133,8148,necesito playita y un mojito
134,8149,qu ocurre la justicia espaola prorroga la prisin preventiva de hugo el pollo carvajal
135,8150,que se vota el 7 de mayo estoy realmente desenchufado
136,8151,aveces extrao estar con mis amigos borrachos cantando las rolitas de christian nodal
137,8152,carvajal no tiene nivel de seleccin eh dios mo
138,8153,as viniendo de usted no podra ser de otra manera le estoy pasando la informacin a algunos organismo de seguridad del estado para que nos ayuden
139,8154,como que ron que asco jajaja
140,8155,otra roja perdonada al bara en el clsico barcelona vs real madrid carvajal y arnau tenas barca barcelona realmadrid elclasico
141,8156,la carita de maca de ah caray ahora dnde me meto
142,8157,onzee3 alg sap de que va el pique arnau tenas vs carvajal
143,8158,que asco me da carvajal
144,8159,en estas protestas de pedro botello los prmistas agredieron a pedradas a manifestantes que ejercen su derecho a protestar esas si son apoyadas por el gobierno de abinader y sus periodistas y comunicadores pagados estas acciones si son aceptadas por sociedad
145,8160,este es un respetuoso saludo y comentario a los colombianos q engaados votaron por el terrorista petro decan los griegos q un ciudadano se puede equivocar una vez votando por un satrapa pero si lo vuelve a ser el traidor a sus propias convicciones es el q vuelve a votar por el
146,8161,ahora te voy a poner a gozallll
147,8162,como algn capitn del bara le reclame algo a gavi no puede seguir siendo capitn del bara ms bien la respuesta si el mensaje fue cierto era que ms bien se preocuparan en controlar a su vinicius por ejemplo y a carvajal que hasta veterana debera mostrar
148,8163,ahora si se mam jajajaajajajaj
149,8164,y el barcelona tambin aparte el segundo gol no debi subir al marcador y como q no hay imgenes del codazo de gavi a carvajal nos quieres hacer tontos a mi y a los q vimos el partido ahhh claro seguramente estn manipuladas
150,8165,disfruta tu vida no tenemos lnea de interseccin
151,8166,no me acordaba de esta cancin hasta ahora
152,8167,saquelargowin el problema del cali es mental y el tcnico est en otro mundo saquelargowin
153,8168,por favor puntualiza es el jugador del barcelona quin va a buscar al del madrid a cada cual lo suyo las palabras se quedan en el campo ahora veremos si esta accin como las de gabi a ceballos y a carvajal sendas agresiones se entra de oficio y te pongo la foto de la anulacion
154,8169,i el chilln de carvajal
155,8170,uno se rie pero es de los nervios jajajjaajajjaa si lo humillo muy feo hahahahahahahahahaahaha
156,8171,el dato es espantoso recordar que el real madrid no fich a cancelo porque tenan plena confianza en carvajal prohibido olvidar
157,8172,que aparezca rpido las autoridades naciones que tomen las previsiones de lugar con respeto al tema
158,8173,libertadyorden es lo que le pedimos a nuestras ffaa fuerapetro
159,8174,piden roja a gavi por el tipico empujoncito que hace carvajal en el area todos los partidos y no pitan penalti pero no piden roja para nacho por estas dos entradas giraltpablo barbiefritzler alex candal jfurlanich turcohusain nachitotv
160,8175,frenkie de jong sacando a pasear a carvajal
161,8176,muy bien mejor qu t me quiere mas a m
162,8177,libertad y orden para mentir
163,8178,ovarios sobran esta noche vengo a una tt me quiere mas a mi
164,8179,la felicidad tiene nombre y apellido
165,8180,coaki angulo carvajal til el cooesumadre de carvajal
166,8181,el gesto de xavi a arnau tenas en el vestuario tras su bronca con carvajal via diarioas el xavi ese es un judas mal falso que un billete de 70
167,8182,imposible preparar los panes de yuca todos pegados y hecho una sola masa naturissimo
168,8183,libertad y orden
169,8184,ocupo mucho esto
170,8185,la historia es as de ingrata muchas veces luego de unas dcadas todo personaje histrico pasa a ser historia da lo mismo que quiten estatuas bustos cuadros etc la historia siempre ser una sola guste a quien le guste
171,8186,llega carvajal a hacer otra foto huevo de frenkie y me da un sncope
172,8187,nunca haba odo hablar a el pollo carvajal parece un analfabeta qu espanto qu pena con el mundo que ese sujeto haya llegado a general en vzla con razn chvez los manda dos mochos q se rascaban con razn maduro es presidente dlaraf
173,8188,si es cierto jajajaja
174,8189,subnormales
175,8190,dice el madrid que hablen con gavi por su comportamiento ajajajajajaajajajajajajajajaaja entonces ustedes que pepe ramos carvajal etc a chupirlaaaaaa
176,8191,alv con dos cojones
177,8192,para un simple mortal cuando uno muere pasan solo 2 o mximo 3 generaciones y ya nadie te va a recordar tnganlo presente as de simple
178,8193,que locutor el que celebra los goles del madrid como un forofo es que no hay imgenes de ningn codazo de gavi carvajal bueno pero estamos de acuerdo que el real madrid tena que haber jugado o sesenta minutos con uno menos no
179,8194,antes 94 95 ahora 85 79 10 zwilling pure cuchillo cebollero con hoja forjada de una nica pieza laisladelastentaciones9 crimsmarinatv3 firstdates20m gavi conquis10etb carvajal mendilibar
180,8195,20mar lafanbesvenezuela nuestra misin es protegerte denuncia cualquier situacin de riesgo tu seguridad es primordial     somosguardianesdelpueblo
181,8196,me siento bien porque hace rato vi un dnde tiraban de espaa y como buen hispano me sent ofendido
182,8197,quien chuta oliver atom o carvajal avalista dice jajaja miente que algo quedar debe pensar el personaje
183,8198,en estas protestas de pedro botello los prmistas agredieron a pedradas a manifestantes que ejercen su derecho a protestar esas si son apoyadas por el gobierno de abinader y sus periodistas y comunicadores pagados estas acciones si son aceptadas por sociedad
184,8199,este es el nivel de compromiso que quieren las empresas
185,8200,porque en los laterales tienes a mendy alaba nacho carvajal odriozola y lucas vzquez y en la delantera a vini rodry benzema hazard mariano y asensio todos con contrato
186,8201,los pasillos de bruselas reconocen en pblico y en privado que la oposicin que articula el pp en las instituciones comunitarias es un caso sui generis en la unin europea carvajal gavi
187,8202,quiero la camiseta del barcelona en colaboracin con rosalia
188,8203,que si que benzema no est que carvajal est jubilado que no dric y kross estn mayores pero an as necesitan la correspondiente ayuda arbitral es un puto escandalo
189,8204,bara s arnau tenas and madrid s dani carvajal in clsico bust up
190,8205,los pasillos de bruselas reconocen en pblico y en privado que la oposicin que articula el pp en las instituciones comunitarias es un caso sui generis en la unin europea carvajal gavi
191,8206,yo tambin tuve una conversacin que me doli mucho pero era necesario
192,8207,todos vamos por el mismo objetivo ser feliz sin tanto cuento
193,8208,buenos temas
194,8209,ests de acuerdo con esta decisin los jugadores y todo el banco de barnechea pidi penal por este contacto del portero yair bonnin sobre esteban carvajal en el barvsranxtntsports
195,8210,hay 2 acciones que no vern repetidas por ningn medio del nacionalmadridismo el pisotn de ceballos a lewy y el agarron por el cuello de carvajal a tenas no hago referencia al brazo en la cara de raphinha por esa accin si se vio y era la 2da amarilla en el minuto 41
196,8211,las botas de carvajal en las repeticiones merengonas por tal q la pelota salga lo mas pronto posible para encajar las lineas y demostrar q asensio estaba en posicion correcta
197,8212,carvajal enfrentndose a haaland el sbado va a ser de comedia fina este sbado
198,8213,si ese es el momento en que carvajal golpea el baln mete gol en propia
199,8214,creo que el codazo de gavi a carvajal lo dej gilipollas
200,8215,a mi me ponen a pochetino a entrenar y carvajal asensio benzema hazard a jugar y abandono la aficin por este deporte
201,8216,del codazo de gavi a carvajal no tienes imgenes verdad hasta el locutor deca que a gavi le dola el codo por darle en los dientes a carvajal histrico y como esa un puado ms
202,8217,muy grave igual que carvajal sea nuestro lateral derecho titular en pleno 2023 dilo todo
