,Id,Tweet
1040,22714,se desborda la pasin en oasis coyoacn con la visita de louis tomlinson
1041,22715,estoy en la premiere de louis empezaron a poner msica de louis y una morra atrs de mi dijo que dlibyh era de 1d
1042,22716,estoy pendeje
1043,22717,ven solo tenian que poner canciones de louis para que se calmaran jsjsj amoo
1044,22718,imagina que soy yo multiplicada por mil cantado tu cancin zjmgatito
1045,22719,lo hermoso que se escucha
1046,22720,por favor no se descontrolen cuando salga louis quiero verlo feliz por ver la cantidad de gente que hay solo por l y no quiero que se preocupe gritenle todo el amor que le tenemos pero piensen en la seguridad de l y de todos
1047,22721,no pero si me hubiera ido
1048,22722,lo confirmo estaban como locas les pusieron louis y le bajaron a su desmadre
1049,22723,yooooooo louis mirameee yoooooo yooooooo elegimeeeeee
1050,22724,no puedo expresar lo q amo a louis mi corazn podra llegar a explotar de todo el amor que siento por l hasta me lo sacara del pecho y se lo dara ahi mismo para poder demostrar todo lo q siento y an as se me hace q no sera suficiente para q entiendan todo lo q lo amo
1051,22725,mis paps se separaron hoy y lo nico que me mantuvo todo el da fuerte fue escuchar a louis
1052,22726,es como un mini concierto
1053,22727,no puedo creer q estoy a nada de ver el documental de louis
1054,22728,pero quien tuvo la grande idea de poner musica de louis
1055,22729,me ests diciendo que pusieron la cara de louis en el cuerpo de samuel garca jajajajqjqjqjqj
1056,22730,louis va a entrar volando
1057,22731,mi pap me dijo te hubieras ido ya no aguanto a este seor
1058,22732,una chica de mi prepa ver el documental con louis diosmio
1059,22733,los amooo
1060,22734,che antes haba un pasillo formado con vallas por donde se supona que louis entraba ya no hay tal pasillo por donde va a entrar se teletransporta
1061,22735,y despues dicen q louis no es dios si literal trajo la paz
1062,22736,no puedo creer q se calmaron cuando pusieron la msica d louis 8 aos cada una
1063,22737,este tipo de cosas son de las que se debe enterar louis
1064,22738,igual aguante qumica
1065,22739,estoy a 20 minutos de louis y nadie me puede llevar a verlo y no me dejan salir sola
1066,22740,que risa enserio como personas que menajan updates que no son de mxico saca de contexto algunos echos pero bueno
1067,22741,louis es la solucin
1068,22742,louis suelta las fechas porfvaof
1069,22743,quizs si tendrn razn en cuestin de deplorable comportamiento de las fans pero no pueden juzgar que hicieron de una premier un concierto muchas no pudieron ir por una situacin u otra pero esto es lo que louis necesita el apoyo de sus fans
1070,22744,ok eso lo hace an peor
1071,22745,lau dile a louis que deje de odiarnos y que ponga fechas en medellin y que lo amo
1072,22746,quin dira que estara viendo al louis en la cdmx perdon hermoso justinbieber pero t ya ni te apareces we
1073,22747,charlie lightening acaba de compartirnos en sus historias allofthosevoices
1074,22748,como que no era concierto para el pblico gratis
1075,22749,no ocupamos fechas louis tomlinson no es cierto ya anncialas
1076,22750,as qudense porfavor necesitamos todas que louis salga pero sin desmadre
1077,22751,dios mio el ser ms lindo
1078,22752,record que perd la botella de agua que nos dieron en el concierto louis regresa necesito otro plstico
1079,22753,louis llegando a la alfombra roja like
1080,22754,siento que si tuviese la oportunidad de conocer a louis en un contexto tan privado como un m amp g me le tirara encima y me tendra q decir flaca soltame es que te amo louis
1081,22755,vamooooooo
1082,22756,las louies calmndose con la msica de louis me recuerda al primer captulo de drake y josh donde dorman al beb cantndole
1083,22757,lo muchisimo que quiero a kei en tan poquito tiempo es para llorar 3 aos enteros
1084,22758,louis pudo calmar a las fieras
1085,22759,siempre envidi a los erticos esa gente libre louis aragon el coo de irene
1086,22760,pq decidi estudiar negocios internacionales cuando pude estudiar periodismo lptm
1087,22761,louis va a seguir amando a mxico que no cunda el pnico
1088,22762,todo bien con que la premier sea en mexico y estn todas emocionadas por ver a louis en persona pero flacas el resto tambin queremos ver a louis disfrutar de la premier y de la alfombra rojaaaa no hagan que la cancelen
1089,22763,louis domando salvajes
1090,22764,ests tienen la oportunidad que todas queremos de que louis vaya a su pas y siempre hacen boludeces
1091,22765,en dos das se estrena el documental de louis y estoy llorando mucho
1092,22766,y louis como va a entrar ah
1093,22767,weon ahora se calmaron con la musica pero quien les dice que cuando salga louis no van a hacer senda avalancha por la desesperacin ta organiza como el pico la wea
1094,22768,me acuerdo que hice lo mismo y en menos de un mes me termin
1095,22769,las louies mexas son estas cantando angels fly como si no se hubiesen gritado empujado y amenazado
1096,22770,louis tira ya las fechas
1097,22771,llevenle un micrfono a louis y que se haga el concierto
1098,22772,fans cantando chicago en el recinto donde ser la alfombra roja de hoy louswinter
1099,22773,volviii de que me perdi salio louis
1100,22774,a louis solamente se le ocurre hacer una premiere en latinoamerica
1101,22775,literal ellas se mandan una banda d cagadas y louis las re cuida dios las odio enserio
1102,22776,yo louis weon yo
1103,22777,las louies solo necesitan la msica de louis para calmarse pero aj los organizadores no lo saban jajakajsjajja
1104,22778,las fans se encuentran cantando chcago louswinter
1105,22779,y yo fui una estupida que compro una botella de 6 mil
1106,22780,la felicidad de que louis est en mxico
1107,22781,necesito cantar angels fly con louis y mis hermans louies
1108,22782,oye estoy flipando con lo de la premier de louis en mxico espero x dios q no salga nadie con una costilla rota porque estoy flipando de lo q estoy viendo por la tl
1109,22783,un momento histrico como ese se debe celebrar en la plaza de bolivar
1110,22784,neta q un abrazo de louis es todo lo que necesito para que vivir deje de ser tan estpido
1111,22785,la primera que de un spoiler le tumb la cuenta no me importa nada allofthosevoices
1112,22786,el poder de la voz de louis
1113,22787,a qu hora sale louis a cantar
1114,22788,al parecer louis y su equipo enviaron botellas de agua para darle a las fans owner
1115,22789,chicas louis y yo estuvimos en el aeropuerto a la misma hora pero el iba a mlaga y yo a valncia
1116,22790,verdaderamente mi nuevo nmesis es cinepolis por meter a influencers que ni conocen a louis y no conformes con eso los meten en primera fila verdaderamente nos mentaron la madre a todas nosotras que desde la maana estamos aquiiiii
1117,22791,porque sientocque 20 de marzo es un dia especial y porque me suena a harrys house
1118,22792,nanana el amor que le tiene a mxico en inmenso louis mexa me da vida
1119,22793,hay un poquito de premier en el concierto de louis
1120,22794,yo necesito un abrazo louis
1121,22795,jajajajjajajjanajnaa
1122,22796,se me declar
1123,22797,ay quiero estar ah
1124,22798,descripcin grfica de xomo louis se sinti despues de tuitear love this place refirindose a mxico
1125,22799,vivo con el miedo pnico terror de encontrar a louis en la calle y q se me olvide el poco ingls q se
1126,22800,cuando sera mi turno
1127,22801,igual boluditas que tienen 5 aos que las calman con musica me parece ridiculo cuando por su propia seguridad y la de louis tendrian que comportarse adecuadamente desde el momento 1
1128,22802,semillas de fe ii en la crcel de tu incredulidad la llave est e
1129,22803,nuestra colombiana anda en barricada mucha suerte lau
1130,22804,para mi louis va ir con alguna remera de hilo de esas q le gustan y pantalon de vestir no se si va a usar traje
1131,22805,semillas de fe ii dar es mejor que recibir cul es su realidad
1132,22806,qu bendicinnn
1133,22807,lo de corazza nada que ver con lo que paso en el club ferro
1134,22808,que louis este en tu pas y an as no verlo es un dolor que no le deseo a nadie
1135,22809,las amo louies argentinas no importa si louis tuitea sobre otros paises louis es argento le gusta el fernet y karina la princesita
1136,22810,yo solo se que louis tomlinson tiene a mxico a sus pies
1137,22811,semillas de fe ii qu lugar ocupa la palabra de dios en su vida
1138,22812,ya no estoy triste
1139,22813,que emocin que ya casi sale louis tomlinson a oler el sudor de las mexicanas louistomlinson cdmx alloffthosevoices louis tomlinson
1140,22814,me imagino estando en alguna de las salas y me da una depreeeee pero te veo pronto louis slo 1 da ms
1141,22815,porcodio
1142,22816,quiero abrazar a louis ya no aguanto ms
1143,22817,en donde me dediquen esta cancin me caso
1144,22818,las calmaron con msica de louis no pde ser
1145,22819,el reconocimiento que merece louis
1146,22820,aaa spreen est en el qsmp
1147,22821,spreen en el qsmppp vamooo
1148,22822,si quiere louis ahorita se arma un concierto con todaesa gente
1149,22823,el hecho de que louis ame mxico me dan mil aos de vida
1150,22824,pero dmosle el the best antes que a messi claro que si
1151,22825,que gran mujer natacha jaitt
1152,22826,yo entiendo que los paps quieran cuidar a sus hijos pero no mamen la neta s no van a ver a louis qutense con hate y ya se ponen de acuerdo para verlos cuando acab
1153,22827,me cague verga
1154,22828,tan lindo mi vida
1155,22829,bno volvamos a q m quiero aventar d mi ventana pq no soy yo la q est cantando sus canciones d louis junto a otras louies esperando a ver a louis frente a frente allofthosevoices
1156,22830,xfavor q me den el alta maana
1157,22831,nomames pinche cinpolis wey antes de nosotras las fans estuvieron metiendo a disque influencers
1158,22832,estoy as de comprarme boletos para ver a louis en las vegas
1159,22833,la gringa menos ardida viste
1160,22834,lo q ustedes no saben es q louis lleva horas ah en las vallas cantando sus propias canciones para camuflajearse y solo dar el brinco pq de verdad no se ve por dnde lo puedan meter
1161,22835,porque esas cara de melancolia acaso no recuerda como le decan a los que se quedaban que eran unos traidores y ahora juegan juntos a ellos liscuestacuba este ao se te jodio la louis vuitton y tu dictadura apenas esta sin oxgeno
1162,22836,dios mo ilumname o elimname pero ya
1163,22837,re lindo l
1164,22838,las empujonas pararon por la msica abdjnshsnqhsa
1165,22839,esto no hubiera pasado si bruno pinasco hubiera entrevistado a louis
1166,22840,meet amp greet de louis junto a algunas fans mexicanas esta tarde unotv
1167,22841,espero que o louis esteja vendo as louies mexicanas cantando as msicas do faith in the future
1168,22842,que vergenza con louis verdad de dios
1169,22843,por dnde ser que entrar louis si todo est lleno
1170,22844,de hecho hoy hubo da libre pq louis iba a hacer la premiere allofthosevoices
1171,22845,no mentimos con lo que se calmaron
1172,22846,semillas de fe hombre concete a ti mismo egosmo o humanidad
1173,22847,literalmente es un concierto q hermoso
1174,22848,hoy sal con mis pupilos arcnidos y mi novia y fue muy bnito demasiado noquierohijos noquierohijos noquierohijos noquierohijos
1175,22849,louis vente a la premiere de madrid maana
1176,22850,staff louis dice que se mantengan quietas hacen ms desmadre staff pone msica de lou todxs se calman y cantan
1177,22851,lo nico que me puede hacer feliz ahora es un cuddle de louis basta
1178,22852,semillas de fe quin controla a quin la boca
1179,22853,las que se estaban matando hace dos segundos cantando angels fly sisoy
1180,22854,lo ms cerca q estar d louis dps del concierto
1181,22855,la musica de louis lo arregla todo
1182,22856,las fans siguen cantando las canciones de louis mientras esperan el inicio de la alfombra roja que se pospuso hasta las 6 30 p m allofthosevoices jessica8384ny
1183,22857,cmo creen q vaya vestido louis
1184,22858,es tarde en la alfombra roja allofthosevoices louis tomlinson cinepolisdist
1185,22859,louis se va a cagar encima de la emocin cuando llegue
1186,22860,la verdad s estoy triste por no poder ir a ver a louis ni a la premier
1187,22861,me voy a arrancar todos los rganos
1188,22862,las ms cariosas por suerte
1189,22863,louis te amo con toda mi alma allofthosevoices
1190,22864,louies cuando les pusieron canciones de louis
1191,22865,jajajajajajja no puedo les tuvieron wue poner canciones de louis para calmarse
1192,22866,que desastre loco espero se comporten porque yo quiero ver a louis en la alfombra de nuevoooooo
1193,22867,lo que sea de cada fandom pero cmo quiero a las louies verdaderamente
1194,22868,dios mo lassito viene a puerto ordaz aaaaaaaaaaaaaaaa
1195,22869,si la msica de louis tomlinson es la cura pasa todo
1196,22870,y a vos q te jode lo q come o no en sus viajes pobre louis de tener una entrevista de mierda
1197,22871,esto se est saliendo de control me da mucha pena y todo pero prefiero que pospongan la premier a poner en peligro a louis y al montn de louies que ms de una ya est herida
1198,22872,alguien me puede decir a qu hora es la alfombra o ya empez
1199,22873,louis ya lleg al sitio o como no era mas tarde
1200,22874,joder como amo al gato con botasss
1201,22875,debera bajar volando el louis de un helicptero
1202,22876,ucrania an avanza seguir avanzando
1203,22877,entre 2 seg a wpp y en casi todos mis chats dicen que odian a las mexicanas o quieren cojer nadie habla de louis lpm
1204,22878,yo tambin quiero un abrazo louis
1205,22879,escchame louis pobre que no la pongas en el setlist
1206,22880,ta la caga con la alfombra roja de louis y yo a un paso de mword porque no gane niuna wea de concurso jajjaja
1207,22881,se puso bien padre el concierto de louis
1208,22882,que lindo cuando con las hermanas nos agarramos de las manos corte culto gritando esto que para cuando salio louis ya no nos daba mas la garganta
1209,22883,yo enojandome ac y ests al final se calmaron con msica de louis vtlv
1210,22884,las louies mas ardidas pq no aguantan q louis diga q ama mxico suelten a las mexas no es nuestra culpa q louis nos ame mas
1211,22885,ay que lindo lloro
1212,22886,as se ve actualmente la alfombra roja parece todo un poco ms en calma an as pedimos a las fans que estn all control y que piensen en su seguridad y a la de louis 28louuet
1213,22887,de verdad estoy experimentando sentimientos y emociones tan hermosas e inexplicables pero tambien alimentandome espiritualmente de una manera nica que solo puedo decir gracias dios
1214,22888,como va a entrar louis o que
1215,22889,pongan ideas random comenzamos nosotras la sptima
1216,22890,el invitado sorpresa es yordi rosadoooo
1217,22891,a la primera que lastima a louis voy hasta mexico y la mato no jodo
1218,22892,imagina a tour porra to pronta louis
1219,22893,claramente la persona que salv mil vidas el poderoso louis tomlinson en su premier
1220,22894,seguridad 0 1 canciones de louis
1221,22895,ustedes me ven tranquila pero en realidad ando as pq en 2 das veo a louis en pantalla grandeeeeeeeeeeee
1222,22896,aqui debe estar el amor de mi voda
1223,22897,louis ya se encuentra en la red carpet
1224,22898,louis realmente dijo paz
1225,22899,quiere coco chanel louis v bottega
1226,22900,me imagino a louis sacado de pedo viendo como primero se peleaban y q despus se calmaron con sus canciones
1227,22901,solo hay 4 artistas de los que depende mi estabilidad emocional 1 louis tomlinson 2 taylor swift 3 lany 4 gracie abrams
1228,22902,en trminos de soportar no estoy soportando yo tambin quiero conocer a louis
1229,22903,que habla en discovery channel cuando se enoja dice
1230,22904,algn da yo entrevistare a louis
1231,22905,estoy cansada de este trabajo de mierda ojal me echen y consiga en otra cosa
1232,22906,llegando a oasis sin saber que me topara con un montn de directioners esperando a louis yo solo quiero mis taquitos
1233,22907,creen que con el calor que hace louis vaya de traje miren que si se va en chanclas yo estara encantada igual
1234,22908,pues dentro de la incoherencia es lo ms coherente q se vaya con mara de hecho siguen juntos laisladelastentaciones9
1235,22909,a veces estoy tan tranquila y me acuerfo de esto y me empiezo a reir yo sola ownekwkdkd
1236,22910,me voy a dormir antes de que salga louis y a vers
1237,22911,uruguay es lo mejor y no se duda
1238,22912,cuando entre el louis se van a ir en avalancha weonn aa a aa
1239,22913,q louis venga a cancn otra vez
1240,22914,y si nos quiere o no
1241,22915,correr el 405 escuchando el estribillo de silver tongues arte
1242,22916,solo quiero ver la carita de louis al ver como tanta gente est ah para verlo solo a l
1243,22917,louis les mand agua
1244,22918,recordemos cuando louis me saludo louistomlinson
1245,22919,nms no me acordaba que tengo examen de qumica maana y no estudie an pero louis es ms importante
1246,22920,quiero llorar mucho yo quiero estar ah
1247,22921,estoy llorando mucho te amo louis te veo maana
1248,22922,jajajajjaa el poder de la msica de louis
1249,22923,otra cosa sera si toda esa gente hiciera por lo menos 1 vez stream al da
1250,22924,como van a ser la premier en un centro comercial publico mxico es el pas que tiene mas oyentes de louis eso de no pensamos que vinieran tanta gente es de tontos eh allofthosevoices
1251,22925,buajajajajaja vieron solo era poner musiquita de louis
1252,22926,mi momento ms humilde es venirme a vivir de veracruz a gdl para algn da conocer a louis y resulta que tena que irme a cdmx
1253,22927,aparezco
1254,22928,mientras tanto charlie est compartiendo en sus historias de instagram fotos y vdeos de la fila de la premier de allofthosevoices
1255,22929,a veces el fandom es una cosa asombrosaaaaaa
1256,22930,desenbocado a boneca
1257,22931,dale louis dnde ests
1258,22932,pero
1259,22933,como a louis le encanta el caos solo lo estoy viendo desde mi celular y ya me estrese
1260,22934,igual le agradezco porque as conoc a louis te amo tiktok
1261,22935,jajajajaja muerooooo jajajajaja el seor al final tome agua la regalo louis no la desperdicie anajajjajajaajajajaja valanwhistle
1262,22936,no se hermanas yo tengo un miedo por cuando salga louis
1263,22937,me voy a poner a llorar nomas porque yo quiero ver a louis en persona y el hecho de que este en mxico y yo no pueda ir a verlo es bien triste locooo
1264,22938,memeo les tenan q poner msica de louis para q se calmen jajajajajjaa
1265,22939,seguimos manteniendo nuestro perfil de crimnales
1266,22940,una q anda tranqui es eli
1267,22941,ni en los eventos de louis te salvas de hombres estupidos que te acosan
1268,22942,que la relacin de elena y david era a distancia madre ma madre ma laisladelastentaciones9
1269,22943,louis te amooooo
1270,22944,llvenme a ver a louis por favor
1271,22945,yo tambin quiero conocer a louis
1272,22946,ya ven que no nos equivocamos cuando dijimos que la msica de louis poda acabar con las guerras i m voting louies for bestfanarmy at the iheartawards
1273,22947,wey q lindo parece de esas reuniones entre fans
1274,22948,un abrazo de louis solucionara mi vida entera
1275,22949,yo habra gastado mi dinero estresarme en el trfico y por la gente llorar de tanto calor solo por escuchar canciones de louis y despus verlo de lejos
1276,22950,a todas las personas que estn en la alfombra roja por favor no empujen y sean conscientes de su seguridad y la de louis las quiero allofthosevoices
1277,22951,alm como queran que 6 dones cuidaran a toda esa gente
1278,22952,hoy berta y yo vemos el documental de louis chicas no estoy bien
1279,22953,estuve a nada de ver a louis tomlinson solo por vivir a 40 mins de oasis no lo vi
1280,22954,jahdjxbsksd es que javdjxbd me da risa qie solo poniendo a louis se calmaron es que es re loco
1281,22955,est tarde desde allofthosevoices louis tomlinson cinepolisdist
1282,22956,la voz de louis logr calmar a las fieras
1283,22957,es que neta louis llena el foro sol triganmelo
1284,22958,agus ahora con el dedo del medio y sos louis
1285,22959,se imaginan si hubieran puesto canciones cuando andaban en el mero desmadre en l premier se iban a hacer canon los videos d tipo fans peleando con saturdays de fondo ksjaksjsjaka
1286,22960,la neta que coraje que por no informarse louis tenga que estar en un lugar tan pequeo entiendan q louis ya no es el mismo que en la era walls y ahora tiene muchsimas ms fans y mas en mxico porque es el pas q ms lo reproduce como se les ocurre un lugar tan pequeo para el
1287,22961,no cantemos victoria todava falta que louis llegue a la alfombra y vemos como se comportan
1288,22962,ponan msica de louis para que se calmaran amo
1289,22963,louis pisa tierras mexicanas y automticamente salgo del flop
1290,22964,me cagan esos hvones que se la pasan con la pierna abierta pero louis gt gt gt gt
1291,22965,el miercoles veo a louis
1292,22966,yo viendo como en mi tl las fans de louis de espaa se estan peleando con las fans de louis de mexico sin enterarme de nada y metiendome en la pelea poraue hay que defender a espaa
1293,22967,yo al ver las fotos de louis en mxico
1294,22968,el mayor deseo de louis es se mantengan a salvo
1295,22969,hablemos lo increble que es el fandom de louis tomlinson
1296,22970,esta cancion
1297,22971,louis se va a poner muy feliz
1298,22972,que les valga verga si la premiere fue en mxico soy mexicana y siento coraje porque no se saben comportar y entiendo que es la emocin pero decir que no merecemos la premiere o que la merece otro pais bro si louis eligio mxico fue por algo
1299,22973,por favor ya traigan a louis
1300,22974,como en la ltima noche de louis en cdmx que llovi bwhdnshd nooo que recurdos
1301,22975,cmo que me funaron por poner hi baby digan que no puse otra cosa
1302,22976,soy llanto
1303,22977,hasta el louis de cartn est siendo aclamado
1304,22978,ayuda
1305,22979,jajsjajssj no puede ser la voz d louis es una nana
1306,22980,le estn mandando un reporte directamente a louis que oso amigas
1307,22981,jshajakajaj los de cinepolis ya han de estar hasta la verga despus de darse cuenta que slo necesitaban poner la musica de louis para todos se tranquilizaran
1308,22982,q bonito
1309,22983,es que yo no entiendo como pensaron que toda la gente iba a caber en esa plaza para la premier sabiendo que mxico es uno de los pases en donde ms escuchan a louis
1310,22984,louis envo botellas de agua con su equipo para las fans que se encuentran esperando en la alfombra roja
1311,22985,lo lindo q se ve louis en mxico
1312,22986,wey jajajajajjaajajajja
1313,22987,nmms que ya va llover
1314,22988,quiero ver a louis en vivo
1315,22989,louis despus de que las louies de mxico hayan roto dos vallas y hecho desmadre todo el da
1316,22990,es q son un chingo diosmio
1317,22991,otro mini tour de louis por mxico
1318,22992,sub de peso de amigos terrible de vdd
1319,22993,mmmmm yo siento que se est es como echando al agua ella por hacer malas pregintas si dice que louis es amable entonces el problema no fue el o su actitud si no haces preguntas buenas no puedes esperar respuestas muy extensas
1320,22994,jaajajajajajjajaajajajjaja weyy
1321,22995,es un montn que de verdad se hayan calmado desde que pusieron msica de louis
1322,22996,yo solo quiero abrazar a louis en esta vida louis tomlinson allofthosevoices louistomlinsonth2023 mexico
1323,22997,que bueno que todo est bien ahorita pero lo que se viene cuando louis llegue
1324,22998,les pusieron msica de louis y se tranquilizaron nunca hubo quilombo paz y amor d repente jajajajjsja tan real
1325,22999,louis tiene tanto poder que con solo poner sus canciones las tranquilizaron
1326,23000,la solucin a los problemas louis
1327,23001,amigas saben q m gan un concurso para la premier d el documental d louis maana
1328,23002,bueno louies no sabemos realmente cuando saldr louis pero este es nuestro momento para hacerlo tendencia comenten cuantas veces puedan allofthosevoices
1329,23003,por qu lo abraza tan equis wey es louis que pkm
1330,23004,odian mexico pq saben q louis tiene favoritismo con nosotras jahsjja y les arde q no sea su pas as o ms fcil
1331,23005,ya quiero que sea viernes para estar en el cine viendo a louis en la pantalla grande allofthosevoices
1332,23006,es que si por esto louis nos tiene cerrando las premieres definitivamente le vamos a cerrar el tour
1333,23007,todos mis favs estn activos yo la ms feliz
1334,23008,ustedes ven all of those voices el 22 o el 25 de marzo
1335,23009,louis es la solucin
1336,23010,aaaa louis despues ira a las salas bacaaan pasenlo lindooo
1337,23011,lo injusto que fue meter a las que tenan boletos a salas simplemente si no se saben comportar fcil se vuelve privada la premier de louis
1338,23012,louis me encanta el espacio personal y estoy soportando esto por ti
1339,23013,ya traigan a louis
1340,23014,ustedes son unas locas q nose quieren sacarse foto con louis en la alfombra un poco ms
1341,23015,ya lleg louis
1342,23016,ya se calmaron las cosas solo tenan que ponernos canciones de louis allofthosevoices
1343,23017,wey si sale algo de louis me avisan porfaaaaaaaaa
1344,23018,hakqjjqjqjq louis nos hace hipnosis no hay de otra
1345,23019,que hermoso esto
1346,23020,a nosotras nos dejaron sin ver a louis por mucho menos martin yo me acuerdo de vos garca
1347,23021,vyanse a la verga todas las que andan haciendo su desmadre en la mall por ver a louis neta que perra vergenza
1348,23022,ignorando que louis esta en mexico para no ponerme a llorar porque yo lo quiero conocer
1349,23023,est hasta la fregada
1350,23024,wey que bonito ver que muchas mutis van a ver a louis mientras yo estoy en mi casa trapeando
1351,23025,que las fans se comporten cuando salga louis
1352,23026,diosmio a este wey no me lo quito de encima ni siendo culera es masoquista o que
1353,23027,es un sol este hombre
1354,23028,tengo un antojo de comer spaguetti en salsa blanca con hongos
1355,23029,verdaderamente ctm cinepolis por poner influencers en la alfombra de louis que forma de faltarnos el respeto a nosotras las fannsss
1356,23030,con coraline no poda parar de llorar es que soy coraline dios
