,Id,Tweet
0,91771,badboyhalo en directo si esta el seor de los muffins en el qsmp me considero hombre loco con mis teoras quekjqks
1,91772,badboyhalo en el qsmp por favoooor necesito escucharlo necesito ver la imagen que lo confirma
2,91773,ahora solo falta la de wilbur
3,91774,como q missasinfonia va a estar en qsmp me muerooo
4,91775,dejen de donar para ke roier abra el minecraft estoy entrando en demencia
5,91776,y si me hago una card
6,91777,y si y si le dono a roier
7,91778,por qu las cuentas no siguen a wilbur
8,91779,he vuelto de comer y ya anunciaron a slime niceee d
9,91780,nojodas entre en el directo y roier de rndete rndete rndeteee
10,91781,ahora bbh est en stream okay no estoy lista para nada en este punto estoy al borde del llanto
11,91782,gente ya estoy perdiendo las esperanzas de que roier este en el qsmp
12,91783,bad prendio tengo fe tengo fe
13,91784,enfin cada quien vieron
14,91785,espera q ya sabemos qn ms va a estar en el qsmp
15,91786,emocionada por el qsmp
16,91787,bueno ya perd la esperanza ya no creo q farfa cris shad conter o rich esten en el qsmp
17,91788,bad boy halo estara en el qsmp yo lo se lo presiento
18,91789,badboyhalo hoy voy a hacer algo secreto que les dir ms adelante confirmamos bbh en el qsmp
19,91790,y ah me di cuenta de lo mucho que quera un abrazo de grefg
20,91791,manifiesto de que roier este en el qsmp manifiesto de que roier este en el qsmp manifiesto de que roier este en el qsmp manifiesto de que roier este en el qsmp manifiesto de que roier este en el qsmp manifiesto de que roier este en el qsmp
21,91792,recin m despierto y veo q jaiden h foolish estarn en el qsmp vamoooo
22,91793,a ti no te ha invitado qjsjjajs
23,91794,se viene confrimacion de badboyhalo ojo
24,91795,bad boy halo prendio streammmm y esta en mc qsmp
25,91796,sw vienen los tigres del norte a qsmp
26,91797,no respiren ni se muevan bbh ya inici stream y seguramente anunciara su participacin en el qsmp
27,91798,prendi roier qsmp
28,91799,bueno no estara en el qsmp pero funaron a los updates por andar ilusionado
29,91800,bbh prendi para mi q confirma su participacion en el qsmp
30,91801,si soy
31,91802,felicidaded
32,91803,necesito que anuncien a otro hispano en el qsmp siento que casi no hay
33,91804,yo al enterarme que aldo no estar en el qsmp
34,91805,tribunalaudiovisualpopular juristas convocados a contribuir con sus conocimientos para el fortalecimiento de esta herramienta qsmp merlano reunin hoy21
35,91806,me dieron florecitas amarillas
36,91807,tu tmb eres un grande corazn no digas eso
37,91808,ni siquiera m iba a ayudar si no les peda con que cara hacs eso en el 5to semwstre hermana
38,91809,dejen de hacer edits tan buenos loco
39,91810,roier diciendo q no estar en el qsmp el chat
40,91811,badboyhalo prendi stream si no es para anunciar q esta en el qsmp me muero
41,91812,ya van a confirmar a bbh en el qsmp
42,91813,prendi bad
43,91814,ya pero a q hora sale la participacin de wilbur
44,91815,callense estoy manifestando a bbh en qsmp
45,91816,gracias roier x prender directo es q estoy sumamente triste i necesitaba la noti de tu directo lt 3
46,91817,una semana y media sin internet que concha es qsmp
47,91818,nse q es pero s eres
48,91819,bjenle la cuenta para q no diga esas cosas literalmente estoy llorando roier te voy a meter una denuncia
49,91820,que bonita q soy me tarde 2 horas para tomarme 2 fotos y casi lloro
50,91821,los jvenes de hoy no quieren drogas quieren que carre este en el qsmp
51,91822,yo cuando yo cuando roier dijo q no va a estar en el qsmp pq hay gente ms importante q l
52,91823,ya me est entrando pnico de que rubius no este en el qsmp
53,91824,voy a sonar bien castrosa pero estaria bonito que metieran a mas mujeres al qsmp xd literal nadamas tenemos a jaiden suelten morras hispanas pls se los ruego
54,91825,ya dejen d hablarle sobre el qsmp pq cqda vez se menosprecia ms
55,91826,maana ay clases pasen excusas para no ir y ver los qsmp
56,91827,esto tiene que ver con su rol en la serie sisisisis no estoy loca
57,91828,bienvenido al qsmp jaidenanimations
58,91829,wilbur prende directo entra a minecraft obtiene su boleto d qsmp se confirma su participacin en el proyecto todos somos felices todos ganamos
59,91830,no se que poner aqu ya que es el primer dibujo que publico por aqu estoy muy emocionadx por maana qsmp galaqsmp
60,91831,le pedi el instagram a un w de mi escuela muy ligadora
61,91832,miren al guapo me esta dando seales de vida
62,91833,todos los nombres de duos trios y squads q van a salir del qsmp ya me lo imagino
63,91834,carre en qsmp carre en el qsmp carre en el qsmp carre en el qsmp carre en el qsmp carre en el qsmp carre en el qsmp
64,91835,no mamen me fui 3 horas y quackity ya tmb trajo a los tigres del norte para el qsmp eres grande quackity
65,91836,jaja wilbur faltas tu miamor jaja q haces pq no dices nada
66,91837,gracias dios por tanto gracias gracias gracias
67,91838,ola estoy apunto d llorar por lo q est diciendo rob
68,91839,lpm lo peor es q les acostumbr as y siempre terminan haciendo sus otras tareas mientras yo hago malabares hasta las 3am
69,91840,ya asum y acept que juan no estar en el qsmp
70,91841,q grande slime tqm mano eres increible
71,91842,lo amo tanto
72,91843,por fin pude poner a cargar el celular
73,91844,an no llego a mi casa y aun hago el qsmp gala ni el dia 3 del spiderbearweek rjzhdhzbhdux
74,91845,pq tiene la skin de las nevadas
75,91846,ya lo sabamos pero welcome to the qsmp slime lt 3
76,91847,ya m retiro m avisa si alguien nuevo va estar en qsmp nos vemos dentro 4 horas
77,91848,vergenza me va a dar con roier que al final no est y todos le estuvimos chingando mucho con el qsmp
78,91849,no voy a poder verlo pq tengo escuela
79,91850,soy este ahora mismo
80,91851,hdp me asust
81,91852,que linda charlita de robleis y carre me encantan los just chatting asi tranquis
82,91853,osea que hay probabilidad de que tambin saquen imagen de wil o ser que noms prest su voz miedo
83,91854,est con la skin de las nevadas
84,91855,se me antojaron unas papitas por culpa de rub
85,91856,cuantos lugares faltan en el qsmp
86,91857,a mitad d carrera no deberas dejar q tu compaera haga toda la investigacin para el proyecto solo pq no son planos digo un poco d verguenza para no involucrarse hay q tener
87,91858,slime esta en qsmp bienvenido amiguito
88,91859,no puede ser
89,91860,cuiden a rob se merece el mundo entero
90,91861,si charlie grab su ticket del qsmp en el set de tommy no me deja duda que wilbur tambin puede subir un video parecido
91,91862,ya extraaba la interacciones entre charlie y quackity
92,91863,los streamers diciendo que no estarn en el qsmp medio twitter no les crean porque son hombres
93,91864,roier como te hago entender que si te mereces estar ah y que eres un streamer enorme no digas eso papi
94,91865,yo se que va a estar juan estar en qsmp
95,91866,muy bien ahora wilbur
96,91867,ella y biyin se llevaran bien
97,91868,si no fue por las buenas la vdd nunca hice nada al respecto ser por las malas manifestar
98,91869,que mierda el chat
99,91870,ustedes le creen a roier eso de los qsmp con lo que ha dicho en los 2 ltimos streams el d ayer y hoy
100,91871,por si nos les dieron sus flores amarillas aqu hay para ustedes mutis
101,91872,wilbur soot na ms faltas tu
102,91873,farfadox esta en el qsmp farfadox esta en el qsmp farfadox esta en el qsmp farfadox esta en el qsmp farfadox esta en el qsmp farfadox esta en el qsmp farfadox esta en el qsmp farfadox esta en el qsmp farfadox esta en el qsmp farfadox esta en el qsmp
103,91874,yo le tengo mucho cario a slime desde las nevadas tqm slime
104,91875,dale wilbur prende y confirma q estas en el qsmp
105,91876,ah esta el pendejo que cree que george estar en el qsmp
106,91877,soy la persona ms feliz se demoro quackitys pero soi feliz
107,91878,gente yo estoy muy emocionada por el qsmp y lo ver y todo pero no creo que vaya a dibujar nada de la serie por el momento saben que ltimamente no eh tenido mucha inspiracin para dibujar streamers les digo por si acaso perdon
108,91879,cmo q es solo de streamers grandes cala boca
109,91880,musica ligera aaa nada nos libra nada mas queda
110,91881,el goopo
111,91882,vamooooo
112,91883,el chat est re pesado
113,91884,es un diosssss lo quiero mucho lo admiro por igual simplemente es una de mis personas favoritas y estamos con todooo para su nuevo proyecto
114,91885,no s si ver a carre que est con robleis o a roier
115,91886,confirmamos que ninguno del mctrio esta en el qsmp listo se acab
116,91887,yo esperando a que milagrosamente wilbur prenda stream para que vea su invitacin y le hagan la imagen con su cubito
117,91888,yo lo invoque ya deca yo que estaba muy silencioso esto
118,91889,dios m siento re culpable por todo esto de el colegio y los horarios de la tcnica no me da tiempo para estar atenta a la comunidad y a mis nuts perdon los tkm a todos
119,91890,confirmada ya la participacin de slimecicle en el qsmp
120,91891,me kanse shao ala mierda
121,91892,manifeste
122,91893,no hice el de cns pero ahora si quiero hacerlo por hobi
123,91894,de tanto edit en uno soy capaz de confundirme
124,91895,eh porque tiene su traje d las nevadas
125,91896,aldo no estar en el qsmp
126,91897,mi cubitooooo vamos charliee
127,91898,q emocin q emocin
128,91899,amigos cuantos participantes lleva el qsmp
129,91900,ya se confirmaron todas las voces q aparecan en el trailer d qsmp menos wilbur
130,91901,la fe es lo ltimo que se pierde para tener a carre en el qsmp
131,91902,maana es el qsmp no podr verlo estar en la uni tambin es la bizarrap x arcangel
132,91903,le regale flores amarillas a mi hermana
133,91904,todos los fandoms estn cayendo en la locura
134,91905,ya andan de pesados en el chat de carre q ganas de matarl9s
135,91906,q insoportable ese compaero
136,91907,no m importa siento presiento manifiesto al mctrio en qsmp
137,91908,busko a la mia de me perdio
138,91909,a m bestie del alma
139,91910,porque nadie me aviso que robleis estaba en el stream de carre
140,91911,oigan y wilbur maxo y slime ya dieron seales de vida y mostraron su ticket para el qsmp pero will no ha dicho nada
141,91912,en mi fro y sin sentimientos era
142,91913,ahora que lo pienso maana tengo clases valio verga el qsmp
143,91914,mirenlo vale que belleza lo amo mucho
144,91915,te quiero muchooooooo
145,91916,ya confirmen a carre en el qsmp
146,91917,hola se incluye a la fuerza y encima tarde galaqsmp qsmp
147,91918,slime recibi su boleto para qsmp
148,91919,por el tema del incendio se cancelaron mis clases maana justo q se estrena el qsmp ay k pena
149,91920,si lo dijo muy enserio y aldo tmb
150,91921,germn en el qsmp germn en el qsmp germn en el qsmp germn en el qsmp germn en el qsmp germn en el qsmp germn en el qsmp germn en el qsmp germn en el qsmp germn en el qsmp germn en el qsmp germn en el qsmp
151,91922,como hacer un challenge en tik tok sin q se te vea la cara yahoo
152,91923,ya sabiua pero estoy muy feliz igual
153,91924,gn ya no doy ms del sueo rob y carre en el qsmp
154,91925,pink tubbo pink tubbo pero que hermosuraa dibujito simple y tranquilito porque me encanto esta skin del tubbo tambien para calmare con el tema del qsmp jaksja tubbofanart
155,91926,maana dios miooo
156,91927,que aldo haya dicho muy serio que no va a estar en el qsmp hundi mis esperanzas
157,91928,wtf amigo jaiden en dl qsmp
158,91929,solo falta walter y listo siiiiiiiiiiiiii
159,91930,espero que aunque no este su streamer favorito en qsmp le den una oportunidad a este proyecto qsmp
160,91931,herma como vas a salir con esto cuando hasta enhypen llena mas que los txt
161,91932,todava no caigo que el jueves empieza el qsmp entienden que falta nada yo apenas proceso los participantes
162,91933,yo se que va a estar roier aunque desmienta todo aunque ya lo haya dicho mil veces tiene que estar pqpqppqpq muchas cosa yo se que va a estar
163,91934,eleg creerle a un hombre
164,91935,hoy ya george tommy y tubbo anuncian su participacin en el qsmp yo s george puso una quesadilla en sus historias de instagram fe muchachos ya quackity anuncia los otros participantes estoy entrando en estado de locura
165,91936,puro mame yo s que ahora va abrir mc
166,91937,yo tratando de hacer q todo lo q salga de mi bastarda boca sea sobre dream
167,91938,shadoune estar en el qsmp shadoune estar en el qsmp shadoune estar en el qsmp shadoune estar en el qsmp shadoune estar en el qsmp shadoune estar en el qsmp
168,91939,aylu nunca saco ni va a poder sacar red no compares helen
169,91940,el fondo de pantalla verde significa que dream va estar en el qsmp cranme
170,91941,para ustedes mutis y no mutis no soy la mejor dibujando pero igual quera darles sus flores amarillas
171,91942,que roier deje de decir que no es lo suficientemente grande para no estar en la misma serie que vegetta lo voy a agarrar a trompadas
172,91943,volv solo por el qsmp
173,91944,maana ya comienza el qsmp y siento que faltan muchas personas dale quackity avientanos a todos los participantes de putazo no hay pedoooo
174,91945,algo me dice que los participantes hispanos que van a anunciar ahora en el qsmp son rubius roier y rivers solo son suposiciones ya veremos dijo el ciego
175,91946,anuncios que me gustan
176,91947,dijo la frase
177,91948,por qu lo ley como si fuera el comn denominador acaso soy el enemigo
178,91949,x la re xuxs mna empieza el qsmp y yo voi a estar en clases ya no qiero dar mi discursoooo
179,91950,se me olvid que haba hecho esto jakajjs quackityfanart qsmp
180,91951,como que esta muy callado para ser el da antes del qsmp no quieren revelarse ms miembros por favor esque me da nervios que estn tan callados vudncif
181,91952,he visto muchas presentaciones de vegetta en qsmp para la comunidad angloparlante pero nadie ha mencionado lo ms importante que nos dice guapsimos todos los das incluso si no lo eres
182,91953,segn mi horscopo hoy sera un gran da y se equivoc el hdsptm
183,91954,carre y robleis en el qsmp carre y robleis en el qsmp carre y robleis en el qsmp carre y robleis en el qsmp carre y robleis en el qsmp carre y robleis en el qsmp carre y robleis en el qsmp carre y robleis en el qsmp carre y robleis en el qsmp manifestacin
184,91955,triste pq cada vez siento q es ms verdad que roier no estar en el qsmp
185,91956,dios esta aquiii que hermoso esss
186,91957,roier prendio es la nica oportunidad de que diga que si estar en el qsmp
187,91958,vegetta en qsmp la emocin m consume
188,91959,cuando acabe el directo sigo con esto si es que tengo ms de 5
189,91960,y si de la nada markplier anuncia que esta en el qsmp
190,91961,man tenes que ser muy imbecil como para mandar a alguien a que se mat por un ship
191,91962,ya aldo ya entend ya no lo digas as q lloro
192,91963,estoy 100 seguro de que farfa no est en el qsmp akdbaj
193,91964,posiblemente me pierda los qsmp m quiero dar de baja en todo hahahajajja
194,91965,ocupo un saludo de aimp3 para el comienzo del qsmp
195,91966,an tena fe de que aldo estuviera en el qsmp
196,91967,me hicieron entrar en duda si willbur si estar en qsmp o no ms si rubius roier o juan si estarn o no me largo a chillar
197,91968,donenle 17 bits a shadune para ver cual es la alerta de tubbo gracias
198,91969,me voy a poder los qsmp pq la tonta tiene facultad faaaaak
199,91970,bienvenidos jaiden y dantdm al qsmp
200,91971,buenos dias ya me levante de dormir un rato
201,91972,hola hate
202,91973,hoy el mctrio ft rivers confirman estar en qsmp
203,91974,yo todo chikito pero por dentro llorando desgarrado colapsando al no saber si de verdad estar willbur en el qsmp o si badboyhalo va a ser un participante o ms importante si podr ver el premier en mi casa o estar en clases welcometotheqsmp qsmp
204,91975,tan bonito chiquito y chaneque amoooooooooooo
205,91976,necesito fuerzas para estudiar
206,91977,crisgreen estar en el qsmp crisgreen estar en el qsmp crisgreen estar en el qsmp crisgreen estar en el qsmp crisgreen estar en el qsmp
207,91978,aigg chau no me hablen
208,91979,hay alerta de tubbo
209,91980,mis cabros as me mudo de cuenta o eso intentare si alguien les sige y tiene un perfil similar
210,91981,podran dejar de decir q sus favs estn confirmados en el qsmp es q raptor an no lo est y me incmoda
211,91982,se cuenta la leyenda que updatesroier se murieron por tremenda exposicin que les hicieron en frente de roier siempre los recordaremos ripinpis
212,91983,ya roier
213,91984,confirmado roier en qsmp
214,91985,voten a aiko y les doy un beso
215,91986,roier chat hoy vi que anunciaron a vegetta ustedes creen que anunciando a vegetta me van a meter a mi no van a nunciar a alguien grande alguien bien chingon si eres bien chingon tripon lo digas de verdad o en broma eres alguien chingonsisimo tqm rey
216,91987,ollie en llamada con tubbo aaaa
217,91988,que paja dormir sola mejor me mw
218,91989,aldo no va a estar en el qsmp ya lo dijo bien serio
219,91990,oigan dejen de hacer spam a los streamers sobre el qsmp yo se que todos queremos q estn nuestros favs pero es un poco imposible por fa dejen de meterles presin cada uno ir revelando su participacin con el tiempo sean pacientes
220,91991,aldo ya confirm q no est qsmp que no le invitaron y bueno pues ni pedo kqkfksk
221,91992,carola estar en el qsmp carola estar en el qsmp carola estar en el qsmp carola estar en el qsmp carola estar en el qsmp carola estar en el qsmp carola estar en el qsmp carola estar en el qsmp
222,91993,adis updatesroier les ir mejor en la funa
223,91994,queria hacer un dibujo asi de joda de como hacen que c quackity parezca un femboy y hasta lo termine detallando a fondo que me pasa skhsjaksj as de esquizo me trae el qsmp carajo
224,91995,entonces no hay mctrio en el qsmp
225,91996,1 voy a m0r r por favor q alguien me haga spam si confirman a alguien
226,91997,quien hablo de roier updates dejenloooos ellos no hicieron nadaaa
227,91998,en mi cabeza se est reproduciendo el edit de femenine rage
228,91999,llegue de la escuela y mi mam me dijo q iba a ver el qsmp porque va a estar vegetta yo feliz
229,92000,tengo sueo
230,92001,estoy perdiendo la fe del mctrio en el qsmp
231,92002,jajwwjwj que tierno carre
232,92003,uy ya le dieron un quemadon a roier updates
233,92004,no se q subir
234,92005,mandaron al frente a la cuenta de roier updates nooooo
235,92006,entre broma y broma la verdad si tengo miedo de que roier rubius karl y sapnap no estn en el qsmp
236,92007,porque tantos nmeros pista y justo ayer shadoune estaba sumando nmeros a ver 3 1 4 1 7 8 2 1 4 1 1 9 18 y 1 8 9 489 y ayer estaba leyendo teoras sobre el qsmp capaz y vio que estos nmeros eran importantes entonces nos dar un anuncio muy importante en su stream
237,92008,sigo sin creer que vegetta777 vaya a estar en qsmp weon en que mundo estoy viviendo
238,92009,jajajaja ya se los chingaron updatesroier
239,92010,por qu nadie del team sonidero tiene el gogoogogo de cupcakke me parece una falta de respeto
240,92011,hola ya volvi como que confirmaron a dan y jaiden llegaron a confirmar a mas alguno anda actuando raro
241,92012,okay pero shadoune y roier aparte que tubbo y spreen wn osea mantengan al tanto de sus directos que esto huele a reveal qsmp roier shadoune666
242,92013,q miedo q roier est en el qsmp
243,92014,sean humildes no porque qsmp empieza maana tienen que recalcar que qsmp empieza maana literal todo el mundo sabe que qsmp empieza maana saban que qsmp empieza maana porque si qsmp empieza maana
244,92015,rstoy as
245,92016,con razn me hacan bullying en la primaria
246,92017,joya sera
247,92018,q bonita es la vida cuando se q m llegaran mis 7pcs maana
248,92019,no s cuntos participantes quedan por presentar para el qsmp pero si son ms de 10 y quedan ms ser que algunos los vamos a saber cuando empiece la serie o no vemos la escena de la persona recibiendo el ticket ser que es porque las personas que quedan ya son de la isla
249,92020,todo esto de no voy a estar en el qsmp pq se me hace demasiado sospechoso
250,92021,ayuda siento que algo malo va a pasar en el qsmp
251,92022,amigoouuuus no me ignoren y cuntenme si les dieron flores amarillaas p a m no xd
252,92023,maana es el estreno del qsmp
253,92024,aldo acaba de decir que no estar en el qsmp
254,92025,bueno cul es su emote favorito del canal de roier
255,92026,se imaginan un show tipo tila tequila en en donde los participantes peleen por el amor de quackity ajsj qsmp quackity
256,92027,m re
257,92028,bueno ahora si ya no creo que roier este en el qsmp
258,92029,ya no le estn diciendo a aldo lo del qsmp
259,92030,pq dice eso ya me puse triste
260,92031,voi a prender velas y voi a empezar a tirar afirmaciones
261,92032,si los jugadores q han presentado para qsmp tienen de nmero treinta y pico donde estn el resto de nmeros q faltan quackity m pongo nerviosa anuncia a george karl rubius sapnap roier
262,92033,aunque no est roier se ve que l est igual de emocionado con el qsmp y que va a apoyar a quackity cmo siempre lo ha hecho
263,92034,pero rub esta en el qsmp
264,92035,se qued bug jakajak
265,92036,si m doli q roier se menospreciara as ya le creo q no es parte del qsmp
266,92037,adivinen qnes se juntaron
267,92038,llego rob
268,92039,no digas eso tripn
269,92040,tengo un tulipn amarillo de origami que me regal ro pero se le salio el palo llor tengo que pegarlo
270,92041,llora picamente
271,92042,no le creo no le creo no le creo no le creo no le creo
272,92043,q dijo roier no puedo ver el stream
273,92044,croe q le empiezo a creer a roier
274,92045,acepto la realidad pero no que se hable tan feo no eso no lo autorizo pipipi
275,92046,ok pero enamorada de miranda gt gt gt
276,92047,rubius dtk mctrio rivers alexby etc van a estar si o si en el qsmp no me importa que la mayora dijieron que no no les creo sinceramente pero bueno tocar ver tal vez no estn el primer da y aparezca acorde va la serie idk solo se que estara muy feliz si estn
277,92048,ay no
278,92049,alguien dgale a roier que es un streamer grande el pendejo an no se da cuenta
279,92050,aqu esperando a que prendan y anuncien su participacin en el qsmp
280,92051,ese algo ms anuncio d q est en el qsmp xfavor es todo lo q pido
281,92052,q curioso q me enferme justo maana justo cuando empieza el qsmp
282,92053,ojal ya lleguen mis pcs de chan quiero mis pcs de chan
283,92054,no est mintiendo lo vi en sus ojos
284,92055,solo me falta mi rubiales en el qsmp para poder ser la ms feliz
285,92056,pensando seriamente si faltar maana para ver el qsmp solo tengo dos clases ommmm
286,92057,mis casitas unidas
287,92058,agarrenme o me compro una sub de roier
288,92059,a lo mejor si es cierto k roier no va a estar en el qsmp
289,92060,odio tanto esta red social
290,92061,ahora sis mi cubito
291,92062,roier prendio y va decir q est en el qsmp
292,92063,vegetta ahora es tu momento no te vayas a ir del qsmp hasta no explotar la puerta de la casa de quackity vegetta777
293,92064,ahora que vegetta esta en el qsmp prometo hacer fanart y no como en karmland que hice como 3
294,92065,ptm estoy tan sensible que ya ni ganas me dio ganas de ver es stream de roier completo me cago en el qsmp joda
295,92066,amigos estoy tan mensa que pens que aqu mariana estaba disfrasado y es un edit alfqlafalsgs
296,92067,rpier directo
297,92068,hoy roier revelar que participar en qsmp lo s porqu soy experta en leer el futuro ya vern ya vern
298,92069,que es suena igual a qsmp ya vieron
299,92070,acabo de llegar de la uni y que emocin ya quiero que sea maana dkdldk maana empieza el qsmp siii si a todo
300,92071,nimodo no veo integrantes nuevos del qsmp as que me voy a mimir un rato espero no perderme nada en su momento pium
301,92072,si cambia d color capaz
302,92073,buenas noticias se logr 70 deseos cost traerla pero ahora tengo a shenhe y mika c3
303,92074,pati chapoy confirmada en el qsmp omg se junta ella con los tigres del norte y bob esponja
304,92075,puta madre
305,92076,maana se hace 1 mes que empezaron las clases y no falte ningn da y creo que me voy a permitir faltar un da para ver los qsmp
306,92077,mis plegarias fueron escuchadas
307,92078,ya lleg rob d
308,92079,me da vergenza mandar bits as d retrasada
309,92080,un ngel te cuida y puso en mi boca la verdad para mostrarte la salida y aljate de mi amor yo s q an ests a tiempo no soy qn en verdad parezco
310,92081,roier explicando pq no estar en el qsmp el chat
311,92082,ay se me trabo el cel por un minuto
312,92083,pongo toda mi f y esquizofrenia en q farfa estar en qsmp y si no est me hago kill
313,92084,no voy a dejar de creer en roier qsmp
314,92085,llego rob al stream de carreee lt 3
315,92086,yo si keria hacer lo de la gala qsmp pero no m anime pq ando con tremendo bloqueo wufbwunff
316,92087,por favor por favor por favor por favor por favor por favor por favor por favor por favor por favor por favor por favor por favor por favor por favor por favor por favor por favor por favor por favor por favor por favor por favor por favor q maana pueda ver el directo del qsmp
317,92088,no se pero si te enteras compartilo porque a mi me tiembla el derecho
318,92089,ahorita si o si roier anuncia su participacin en el qsmp
319,92090,era obvio que vegetta iba a estar en el qsmp me voy a mear lpm
320,92091,huesos core
321,92092,por qu no anunciaron a nadie ms de qsmp en cualquier momento me mato aydame loco
322,92093,no van ni dos minutos y ya mi tl se va a m4tar no quiero entrar al stream quiero estar emocionalmente bien
323,92094,perdn si les interactuo a la gente q no es mi muti interactuo mucho perdn si les molesta
324,92095,si en el qsmp no est roier es porque all odian a los sin tripa
325,92096,hermano esto es una puta obra de arte se me extruj el corazn slo de verlo
326,92097,creanme que no se como se envio
327,92098,estoi mal pq roier no esta en el qsmp
328,92099,roier menciona una vez ms que no estar en qsmp sto porque al parecer vegetta fue anunciado y dice que cmo creen que estar ah si hay puros grandes
329,92100,siempre tengo ganas secretas d cambiarme el ly pero amo esta foto de rob loco ayuda
330,92101,ya suelten al roier we de vdd no esta ysrdhdyrs
