,Id,Tweet
1386,38140,chivas 0 vs monterrey 1 al momento 25 minutos el rebao se ha acercado al rea regiomontana pero sin demasiado peligro j10cl2023 ligamxfemenil
1387,38141,si chivas no ha hecho gol es por chivas apliquese para todos los partidos de chivas y chivas femenil hahaha
1388,38142,que rico
1389,38143,chivas 2 a 4 amrica soy aficionado desde chico a las chivas pero ahora decepcionan por que estos jugadores no juegan por la camiseta si no por dinero que triste
1390,38144,esa cancha de chivas esta muy de la vg
1391,38145,ctm pierden mis chivas pierde mi rma solo falta q tmb el celaya
1392,38146,ni tigres ni chivas ni real slo mi mquina nos da alegras y con ese me basta a unicero pero vale por 3 pts muy buenos
1393,38147,juntos siempre te quiero y te apoyo en todas las circunstancias chivas
1394,38148,as es que chsm las cagabolitas chivas
1395,38149,estreno goleador carlee giammona marc su primer gol con rayadas y en la ligamxfemenil dicha anotacin pone a las de eva espejo con la ventaja 0 1 ante chivas vamosporellas
1396,38150,mexico women liga mx femenil matchday 10 20 chivas de guadalajara 0 monterrey 1 stream link
1397,38151,chivas 0 vs monterrey 1 al momento 20 minutos el rebao ya tuvo un disparo a puerta por parte de carojaramillo94 y la guardameta godinezalex contuvo el baln j10cl2023 ligamxfemenil
1398,38152,ni hoy se me pudo quitar el mal sabor de boca de ayer con chivas slo mi juve se pudo llevar su clsico mi madrid tambin hoy lo derrotaron chivas y madrid nmmn ya ni la muelan los clsicos no se pierden se ganan
1399,38153,recuerden chivahermanos chivasfemenil no tiene por qu cargar con la responsabilidad por la pifia de chivas en el clsico nacional cada quien sus batallas
1400,38154,las chivas me rompieron mi corazn ayer pero hoy el barcelona me lo volvi a sanar
1401,38155,rayadas ha extraado menos a la china que chivas a licha monicaarredondo natalialeon lmsauret
1402,38156,pienso q irle al chivas es un castigo pero luego veo a los q le van al pumas y cruz azul y creo q estoy bien
1403,38157,emilio lara regalando un gol a chivas debido a que estos mediocres ni idea tienen de como anotar despus en fuera de lugar le regalan otro chiquete orozco anduvo como wey todo el juego pero es chivas nada que mencionar fercevallosf
1404,38158,ese luis mario sauret y la porrista esa de chivas siempre le estn tirando a rayadas ahorita se deben estar atragantando con el 0 1
1405,38159,hoy vimos al compaero de trabajo de mi hermana que tambin le va a las chivas le preguntamos cmo ests y dijo decepcionado perdieron las chivas jajajajajaja te entiendo
1406,38160,son los aficionados y jugadores de las chivas
1407,38161,para sorpresa de nadie chivas esta jugando bien he
1408,38162,18 carooooooo buena jugada entre boyi58 y carojaramillo94 en la que esta ltima saca disparo pero es detenido por la portera visitante
1409,38163,vamos chivas femenil
1410,38164,18 remate de boyi58 que detiene la arquera rival daleeee chivaaaas
1411,38165,ligamx gol de leonardo surez titular en el triunfo de clubamerica dirigido por ortiztano 4 2 en el clsico ante chivas
1412,38166,fue el mejor fin de semana empezamos por sbado gan america a chivas y mxico le gan a puerto rico en el bisbol domingo checo primero lugar y barcelona le gana al madrid
1413,38167,chivas 0 vs monterrey 1 al momento se rebasan 16 minutos con el rebao tratando de responder y las rayadas buscando ampliar el marcador rebaovsrayadas j10cl2023
1414,38168,g l de las rayadas con este golazo de carlee giammona sorprenden a chivasfemenil chivas femenil 0 1 rayadas telemundo app chivasentelemundo ligamxfemenil
1415,38169,alianza boca chivas madrid mal fin de semana
1416,38170,tan bonita pero le va a las chivas
1417,38171,la vd ese gol es tramite pa que chivas empiece a meter los suyos se sabe
1418,38172,entonces las chivas de espaa le ganaron al amrica de espaa segun algunos ames
1419,38173,si as se queda l rayadas vs chivas y maana ganamos a tigres seramos segundo lugar a 4 de rayadas
1420,38174,lo que dara por estar viendo el partido de chivas femenil en el akron
1421,38175,fin de semana redondo goleada a las chivas y el realdemadrid a 1 2 del bara
1422,38176,el sonido del pblico en el guadalajara vs monterrey es increble ligamxfemenil rayadas chivas chivasfemenil rayadas ligabbvafemenil
1423,38177,gooolazoooo se estrena giammona con rayadas y de que manera rayados 1 0 chivas
1424,38178,pierden casa vs chivas america y monterrey ese inche volcn es un volcn apagado as tigres as no
1425,38179,seeee pinches perros con cuernos chivas vamosamrica somosamrica soyaguila somosaguilas clasiconacional guadalajajajara
1426,38180,qu poema nos regal giamonna rayadas quiere mantener su paso perfecto pero chivas femenil la va a vender cara
1427,38181,elclsico aficin de chivas abandon el estadio no quiso ver la celebracin del amrica por la goleada en el clsico
1428,38182,que mal da para ser aficionada del ftbol chivas fcbayernes
1429,38183,ya me regres el internet el america nos gan bien supo aprovechar los errores carencias de chivas por lapsos el rebao se miraba bien plantado en el campo pero no se miraba por donde nos urge un creativo y un delantero pero de las derrotas se aprende
1430,38184,chivas 0 vs monterrey 1 al momento golazo de las rayadas carlee giammona con un disparo de media distancia pone el baln en el ngulo superior izquierdo para dar ventaja a las visitantes a los 9 minutos j10cl2023 ligamxfemenil
1431,38185,giammonazo romazo de larga distancia y rayadas ya le gana 1 0 a chivas
1432,38186,la diferencia es que la de chivas si se tiro el etas no
1433,38187,el clsico de la liga mx se fue por una sola va amrica arroll a chivas y no dio tregua para golear como visitante por 4 a 2 a su eterno rival salvador aguilera analiza el partido y nos cuenta qu sigue para ambas escuadras
1434,38188,10 chivas 0 1 rayadas espectacular golazo de carlee se estren de gran forma
1435,38189,en el clasicodemexico sobrado est mejor america que el equipo chivas y es que no traer mexicanos lo he dicho no la va a hacer el equipo tapato
1436,38190,ya llevanos diosito
1437,38191,goooooolllazzzo de rayadas copiando a romo ya 1 0 a favor sobre las chivas al minuto 10
1438,38192,clsico clsico ya se convirti que el amrica derrote a chivas ellos siempre pelean por los primeros lugares y el rebao apenas da indicios de querer despertar en el 2023
1439,38193,gooooooooooooooool de rayadas golaaaazo de carlee giammona al 9 chivas 0 1 rayadas ligabbvamxfemenil arribaelmonterrey
1440,38194,9 rayadas toma la ventaja venga chivas no bajemos los brazos
1441,38195,no me doli la derrota de mis chivas me doli ver la falta de pasin por la playera dejar que en tu casa y tu mximo rival te humille y no hagas algo mnimo para defender tu honor as no chivas se burlaron de nosotros se dice y no pasa nada
1442,38196,games bucket list ver jugar a cr7 2015 america vs chivas en el azteca real madrid en ucl vs liverpool real madrid vs barcelona la liga
1443,38197,ligamxfemenil datogeb 19 vez que se enfrentan chivasfemenil y rayadas 5 guadalajara 6 empates 7 monterrey guadalajara suma 3 juegos sin vencer a monterrey no tiene 4 desde 2019 con 8 rayadas tiene 3 visitas a chivas sin vencerlas desde el 18 marzo 2019 por 0 1
1444,38198,no hay internet n no puedo ver el partido de mis chivas
1445,38199,ptm ayer mis chivas y hoy mi real
1446,38200,8 qu buena jaque2rdz nuestra central se interpone en el camino de la pelota y evita el gol de rayadas
1447,38201,9 chivas 0 0 rayadas derechaaaaazo de cburky2 que ataja la guardameta local
1448,38202,nadie los rbitros en las jugadas contra chivas femenil
1449,38203,chivas 0 vs monterrey 0 al momento disparo que se va desviado del marco visitante luego del cobro de un tiro libre al llegar a 5 minutos de juego j10cl2023 ligamxfemenil
1450,38204,venga chivas femenil
1451,38205,pinche fin de semana culero para los que le vamos a las chivas y al real madrid
1452,38206,ligafemenilxfsmx lmsauret monicaarredondo natalialeon venga chivas a sacar la casta xito en la transmisin por otro partidazo
1453,38207,las chivas perdi el clsico el madrid perdi contra el fc motomami estoy hundido cmo puedo depender emocionalmente de 22 buenos para nada
1454,38208,ahora viendo a mi chivas femenil vamos
1455,38209,perdieron las chivas perdi el madrid pero gan g2 dios da dios quita keria tuvo que ganar el mundial
1456,38210,solamente para andar de hocicones son buenos porque para jug4r ya vimos que no guzmanpocho06 chivas
1457,38211,chivas es mucho mas grande que un equipo de ftbol es identidad tradicin futbolera de un equipo 100 mexicano somos el alma de guadalajara y el corazn de mxico chivas soychivafan
1458,38212,perdieron las chivas y el madrid que fin de semana tan jodido
1459,38213,ehdeportes es turno de las rayadas de mantener el primer lugar de la tabla ahora contra las chivas del guadalajara en el estadio akron ligamxfemenil clausura2023
1460,38214,vamos chivas chivasfemenil cl2023 delcdgtodalavida mexicanas ligamxfemenil futbolfemenil futbolfemenilmexicano
1461,38215,chivas 0 vs monterrey 0 al momento se dio el toque inicial en el estadio akron donde el rebao y las rayadas se juegan el liderato del torneo j10cl2023 ligamxfemenil
1462,38216,vamoooos chivas
1463,38217,cmo les fue a sus equipos de ftbol este fin de semana chivas real madrid ac miln arsenal
1464,38218,ya me tienen harta el madrid las chivas y todooooos oficial me retiro de los deportes
1465,38219,futbol las guilas clubamerica dieron ctedra desde el estadio akron chivas
1466,38220,alguien tiene link para el juego de chivas vs rayadas que no sea de fb jiji c por que se me traba ah
1467,38221,vamos mis chivas
1468,38222,vamonos se mueve el baln en el akron transmisin por fox sports y chivas tv
1469,38223,1 chivas 0 0 rayadas arranc el partido en guadalajara vamos por ese triunfo rayadas a darle
1470,38224,inicia el partido chivas vs rayadas ligabbvamxfemenil
1471,38225,arrancaaaaaaaa el partido en el estadioakron sguelo en vivo por las seales de foxsportsmx y chivastvmx
1472,38226,resultado clsico clubamerica se impuso por goleada a chivas en su cancha elclsicodemxico contado por ellos las leyendas rojiblancas y azulcremas por jorgerubio99 chivas america clasiconacional ligamx
1473,38227,por iniciar chivas rayadas
1474,38228,todo listo en el estadio akron para el juego entre chivas y rayadas
1475,38229,vamos mis chivasfemenil plis ganen porque este fin con el madrid y chivas varonil no se arma ninguno chivasfemenil ligabbvafem
1476,38230,quin ganar el clsico nacional chivas vs amrica clausura 2023 a travs de youtube america chivas clasiconacional
1477,38231,se imagina lo que sera chivas con un delantero como mrquez lugo nunca me voy a cansar de decirlo las peores chivas en cunto a plantel ese seor se carg solo el equipo al hombro
1478,38232,que ganas de andar como las chivas y el real madrid bien cogidote
1479,38233,este fin de clsicos le saqu jugo con me llev todo con ambos anotan de chivas vs amrica barcelona vs madrid y ajax vs feyenoord un 415 ya te registraste
1480,38234,qu ganas de andar como el chivas bien cogidote
1481,38235,ya estamos en el akron para el chivas femenil vs rayadas femenil duelo de 1er lugar contra el 2do lugar de la ligabbvafemenil chivasfemenil rayadas
1482,38236,zona3deportes chivas enfrenta a las rayadas en el akron por el liderato del clausura 2023 ambas escuadras llegan invictas previa y reporte con michelle rosas
1483,38237,las rayadas listas para enfrentar a las chivas en el akron info7 info7deportes rayadas chivas ligamx
1484,38238,fin de semana redondo america gt chivas barcelona gt madrid
1485,38239,dicen en chivas tv que hoy le van a meter 3 a rayadas o sea no es imposible pero hay que ser realistas
1486,38240,henry martin le festeja a chivas como cuauhtmoc blanco aqu algunos de esas celebraciones
1487,38241,putas chivas puto realmadrid pinch semana negra
1488,38242,al menos gano el bara y el feyenoord pero las chivas y el chelsea ay mamita
1489,38243,doy gracias porque mi equipo de mis amores y mi corredor de f1 del cual soy fan desde su inicio han ganado a felicidades a ambos amrica vs chivas y checo perz en arabia y mejor cuando checo es americanista de
1490,38244,adems de haber desaparecido pese a ser el jugador ms importante de chivas el pocho guzmn fue expulsado contra el amrica y no estar en el clsico tapato contra el atlas
1491,38245,gan mi atlas perdi chivas perdi el madrid gan el bvb gan el wednesday mxico est en semis de worldbaseballclassic que buen fin de semana carajoooooo
1492,38246,es por el liderato esporchivas
1493,38247,a todo esto me pueden regresar los 1200 del boleto para el partido contra el atlas no quiero ir a ver un equipo sin huevos chivas
1494,38248,polemico periodista celebra la derrota de chivas en el clasico america es tu padre alvaro morales
1495,38249,fin de semana de clsicos al rededor del mundo y as se dieron las cosas amrica super 4 2 a las chivas rayados derrot 1 0 a tigres feyenoord venci 3 2 al ajax juventus le gan 1 0 al inter de miln barcelona se llev el triunfo 2 1 sobre el real madrid
1496,38250,ni mis chivas ni mi inter todo pinches mal este fin de semana
1497,38251,cuando pierden el clsico las chivas y el realmadrid en el mismo fin de semana
1498,38252,las contradictorias declaraciones de henry martin sobre su polemico festejo contra chivas
1499,38253,quin le manda irle a las chivas y al madrid
1500,38254,ni las chivas ni po fc ni el madrid
1501,38255,imagnense a las persona que le van a las chivas y real madrid
1502,38256,clasiconacional clubamerica el festejo de henrymartinm respondiendo en la cancha a las declaraciones de pocho guzmn amrica 4 chivas 2 marzo 2023
1503,38257,my weekend 1 mexico vs puerto rico 2 atlas vs puebla 3 america vs chivas 4 barca vs real
1504,38258,ayer chivas y hoy el real madrid no ha sido un fin bonito
1505,38259,si hay alguien a quien quiero aventar fuera de este barco llamado chivas es a ti omarvv9 por agachon pocos huevos solapador de pendejos tienes un micrfono y posicin privilegiada para cuestionar y exigir pero solo te dedicas a cuidar tus privilegios siendo comparsa
1506,38260,que feo da para ser de chivas y del realma
1507,38261,a mis queridos chivas y se lo digo con mucho respeto pero con todo lo que paso anoche hay que ser sinceros an nos falta bastante pero as se gana un clsico chivas
1508,38262,cuantas champions tienen una liga menos pela
1509,38263,como dije que naca es la aficin de chivas
1510,38264,el peor fin de semana vale verga pierden mis chivas y mi real madrid
1511,38265,en el ftbol como en la medicina justifican su profesionalismo pensando en l donde cobro ms all estoy se olvidan de la lealtad y la tica en chivas chivastvmx pasa eso le llamaron profesionalismo segn sus comentaristas en la medicina se les dice centaveros
1512,38266,confirmado chivas femenil saldr a la cancha con este once ante rayadas en bsqueda del liderato general equipo que gana repite si casandra montero o caro jaramillo son amonestadas se perdern el clsico nacional por acumulacin de tarjetas
1513,38267,entre el madrid y chivas no doy una
1514,38268,las chivas ayer me mataron pero hoy el bara me devolvi la vida
1515,38269,yo vi a boca quedarse afuera de la libertadores con chivas escandolo y escupitajo del tcnico y an as ese boca jugaba mejor que esto
1516,38270,mal finde para ser fan de chivas y del real madrid
1517,38271,pierden mis chivas y el madrid que agite
1518,38272,chivas vs america
1519,38273,mejor fin de semana no lo pude pedir el amrica humilla a las chivas y barcelona le sigue pegando al real mandril sper fin de semana
1520,38274,el viernes los lakers perdieron contra los mavericks saliendo de puestos de play in ayer las putas chivas fueron humilladas hoy el puto real madrid se cag y bueno solo falta que esta noche se vuelvan a cagar los lakers y adis a los play in vaya fin de semana de mierda
1521,38275,mal fin para irle a las chivas y al madrid
1522,38276,entre mis chivas y mi realmadrid no hay suficiente anticido en mi casa que me quite las pinches agruras diosnoshaabandonado
1523,38277,a faitelson le purga k gane america y mas a chivas meterle 4 ponte pomada faitelson
1524,38278,que semana para ser de las chivas y del real
1525,38279,ojito aqu chivas este tcnico sabe jugar y sobre todo a ganarlo todo
1526,38280,cmo te adoro mi guadalajara aunque me hagas envergar y desconocer gente pierde chivas pierde mi familia arriba las chivas
1527,38281,perdi chivas pero gan el bara visabara
1528,38282,el partido de america vs guadalajara refleja el estado actual del ftbol mexicano chivas sin poder anotar ante una defensiva intil del america mismos lara y reyes que son los que anota en su propia portera y el otro que se deja caer para ver si el rbitro marca algo
1529,38283,semana de clsicos negra perdieron las chivas y al madrid los remontan
1530,38284,perdieron mis chivas eliminaron a pio fc pero mnimo gano el clsico espaol fcbarcelona es
1531,38285,semana chingona 1 mxico avanza a la semifinal bisbol 2 amrica humilla a las chivas 3 checo gana el gp de arabia
1532,38286,a lo que apelan los chivas parte 1
1533,38287,en fin ganaron las chivas espaolas vamos mi barcelona
1534,38288,que buen fin de semana perdieron mis chivas y el real madrid
1535,38289,me dijeron arrogante por decir que el amrica le meti gol fcil a las chivas
1536,38290,ayer publico foto que fue con la de chivas y si lo e visto
1537,38291,pues perdieron mis chivas pero gan el bara unas por otras
1538,38292,ya llegamos el estadioakron para el juego de chivas ante rayadas
1539,38293,muy cierto chivas
1540,38294,mal fin de semana para irle a las chivas y al real madrid
1541,38295,dios ya llvame contigo pierde chivas 2 4 pierde el real madrid 1 2 pierde po fc 2 5 solo falta que me tiren mierda en tiktok a es cierto eso tambin pas mierda
1542,38296,almeyda a de estar bien decepcionado de las chivas de hoy
1543,38297,pues perdieron mis chivas ayer y estaba emputadisimo pero por favor como no amar y seguir confiando en estos colores
1544,38298,aqu no dijeron nada llorones doble cara chivas enriquevonbeas fercevallosf
1545,38299,a m ver se le viene tambin el partido ms bravo a mis chivas femenil no nos quitamos la camiseta arriba el guadalajara
1546,38300,liga femenil partidazo chivas f vs monterrey f 3 free picks que vamos a cobrar
1547,38301,colo aficionado de las chivas tambin me a dado alegras en el clsico nacional como habido tristezas tambin a llegados las alegras arriba las chivas
1548,38302,mal finde para ser fantico de chivas y de real madrid
1549,38303,henry martn envi mensaje por su celebracin ante chivas
1550,38304,rm y chivas separados al nacer
1551,38305,no me hablen perdieron las chivas y el real madrid
1552,38306,mal fin de semana para der de chivas y madrid
1553,38307,fin de semana futbolstico triste por chivas feliz por el fcbarcelona
1554,38308,fin de semana bastante jodido para ser aficionado de chivas y del real mnimo mi juve saco la casta
1555,38309,siempre ser as chivas esta gente no abandona y si siente los colores
1556,38310,sale a calentar el guadalajara esporchivas
1557,38311,perdi chivas rivers triste asi q va a ganar po nunca sub este tweet
1558,38312,perdieron los pumas perdieron las chivas perdi el madrid
1559,38313,mal fin de semana para irle a las chivas y al madrid
1560,38314,que ganas de andar como las chivas hahaha
1561,38315,que fin de semana de mierda humillan a las chivas y hoy el barca nos vuelve a ganar
1562,38316,perdieron las chivas y perdio el madrid chinguen a su madre todos
1563,38317,perdi tigres perdi chivas y perdi el real el peor fin
1564,38318,las chivas del guadalajara fueron el meme del clsico odienme ms
1565,38319,igual entiendo a las chivas los mexicanos somos adems de malos pendejisimos para el ftbol es una desventaja grandsima jugar con puro mexicano
1566,38320,pq el chivas y el bara no ganan en las mismas jornadas
1567,38321,q mal da para irle a las chivas y al real madrid
1568,38322,imagnate al pobre diablo que le va a las chivas y al real madrid
1569,38323,ni las chivas ni el madrid por eso me embriago
1570,38324,qu bueno que no apost porque solo iba a ganar el del checo pero los iba a perder con el real madrid y las chivas
1571,38325,el real madrid ya se parecen a mis chivas noms no levanta en los clsicos vaya vaya
1572,38326,primero pierden las chivas y ahora el madrid
1573,38327,1 gan gole y gusto mi atlas dos veces 2 perdieron las chivas 3 gan el fc barcelona 4 maana es puente la vida es buena
1574,38328,perdieron las chivas y perdi el real mal fin para este arriba
1575,38329,slo dir una cosa chivas no es grande en su casa 4 razones ya fueron mostradas
1576,38330,cuando tienes resaca por ver a mediocres jugadores con discapacidad movil de las chivas en un clsico arreglado y llega el domingo para curarse con el verdadero clsico as es as se gana de local el nico clsico que para el mundo entero para ver ftbol de 1a divisin no s
1577,38331,america gano el clasico el sexo perez gano el gran premio henry martin se orino en el estadio de las chivas y el barcelona le gano al madrid con goles sergi roberto y kessi menudo fin de semana
1578,38332,ganas de andar como el chivas bien cogidot3
1579,38333,no fue buen puente para el aficionado de chivas real madrid
1580,38334,pierde pio fc pierden mis chivas y pierde mi realmadrid no es mi mejor fin de semana como aficionado
1581,38335,lo que faltaba putas chivas
1582,38336,gan cruz azul perdi las chivas perdi tigres y gan el barca que ms puedo pedir
1583,38337,pues perdieron mis poderosas chivas pero gan el bara dios da dios quita
1584,38338,chingaron a su madre las chivas y el real madrid
1585,38339,qlv primero chivas y ahora el madrid ya bastaaaa
1586,38340,espero que mis chivas fem no pierdan hoy porque a como hoy me siento si entro en depresin
1587,38341,puro naco le va al chivas y al real madrid
1588,38342,siendo las 4 15 del domingo 19 de marzo un da despus del clsico nacional lugar que me pare me echan carrilla lo nico que me queda decir arriba las chivas
1589,38343,espero me transfieran todas las apuestas qu perd por su pinchi culpa chivas
1590,38344,humillan a mis chivas eliminan a pio fc y al madrid se ve la la liga vs barcelona que fin de semana
1591,38345,perdieron mis chivas perdi messi pero gan mi amado fcbarcelona
1592,38346,que buen fin me mandaron alv se follaron a las chivas y perdi el real madrid chao
1593,38347,fin de semana redondo pidan un deseo jaja gan mxico en el clsico mundial de bisbol gan el amrica a las chivas en el clsico gan checo en el gp de arabia saudita gan el barcelona al real madrid
1594,38348,gano el barca pero perdio chivas
1595,38349,largatevergara vergaraesteleviso chivas lrgate de una vez mediocre
1596,38350,jajajaja pues claro yo todava no concibo en qu le beneficia a chivas tener a don pendejo ah
1597,38351,lo nico que salv mi fin de semana deportivo fue chequito beb y el bara porque mis pinches chivas dieron pena
1598,38352,chivas and madristas
1599,38353,perdi chivas y el madrid semana triste
1600,38354,real madrid vs barcelona liga de granjeros chivas vs amrica en mxico no saben jugar cuantas copas tens lo nico que existe para mi es el ingls la cuna del football ggmu
1601,38355,fin de semana para el olvido en cuanto a ftbol se refiere ni pedo life goes on arriba las chivas y hala madrid por siempre
1602,38356,ve te a la verga casi me muero y por un susto
1603,38357,perdieron horrible mis chivas abuchearon al mejor jugador del mundo pero gan mi checo y gan mi bara
1604,38358,excelente fin de semana gan checo perez el gp el barcelona se lleva ooooootro clsico y henry orinndole en la cara a las chivas
1605,38359,que ganas de andar como el chivas bien cogidote
1606,38360,ni mis chivas ni mi po ni mi madrid no me hablen
1607,38361,definitivamente chivas debe buscarle sustituto a miguel jimnez
1608,38362,perdi ayer chivas hoy perdi mi real madrid no quiero saber nada de clsicos
1609,38363,la gran diferencia entre profesionalismo y mediocridad es fcbarcelona amp chivas laliga amp ligabbvamx en el orden que est escrito saber cmo ganar de locales este si es el clsico
1610,38364,hoy el barcelona si salio a jugar el clasico como se debe jugar aprendan pendejazos chivas
1611,38365,buen baile del amrica con chivas
1612,38366,las chivas me hacen llorar no como el barcelona que tmb me hacen llorar pero no hoy
1613,38367,psima semana para chivas amp real madrid byeeee
1614,38368,hoy no se duerme en guadalajara solo falto que las chivas ganarn el clsico en fin viva mxico
1615,38369,y a ningn pendejo del actual plantel de chivas le importa en lo ms mnimo
1616,38370,perdi las chivas perdi el ftbol
1617,38371,todo el mundo le hace el partido de sus vidas a chivas y al real madrid adis ya fue mucha decepcin deportiva
1618,38372,qu feo fin de semana para ser de las chivas y del real madrid
1619,38373,este fin ganaron los equipos corruptos y perdieron los ms grandes siempre en su barco chivas realmadrid
1620,38374,perdieron los pendejos este fin de semana siono chivas realmadrid
1621,38375,jajajajajaajajaja y asi se reian de chivas ayer
1622,38376,elclasico barcelona 2 1 real madrid mientras tanto en mxico chivas mira aqu es donde vengo a llorar
1623,38377,esta es la alineacin del guadalajara para el partido de esta tarde daleeeee chivaaaas apuestaporelrebao en calientesports
1624,38378,es un mal momento para irle a las chivas y al madrid
1625,38379,imagnate ser de las chivas y del madrid
1626,38380,mal tiempo para irle al madrid y a las chivas
1627,38381,menos mal gan mi barcelona no cmo los pendejos de las chivas
1628,38382,pierden las chivas y despus el real qu sigue
1629,38383,vali verga el real madrid y el chivas este fin
1630,38384,el america humill a chivas y el barcelona le gan al real madrid buen da para ser fifas
1631,38385,america humillando a las chivas checo ganando saudiarabiangp barcelona ganando a los mandriles fin de semana perfecto carajo
1632,38386,ni chivas ni fut piofc ni realmadrid pinche fin de seman para el olvido
