,Id,Tweet
2170,70267,mexicanos unidos unfollow a verstappen viva checo
2171,70268,prensa italiana expertos ayer incluso los ms optimistas entre los que esperaban una temporada un poco mas peleada se vieron obligados a darse por vencidos verstappen y prez estn compitiendo en un campeonato aparte de todos los dems hilo 1 5 f1 saudiarabiangp
2172,70269,contando que verstappen le va a superar en algn momento si este guaje decide retirarse en 2024 teniendo menos podios que vettel es para darle de chocados contra la pared
2173,70270,sergio prez gan la carrera de frmula 1 en jeddah su quinta victoria en el deporte con su compaero de equipo de red bull max verstappen en segundo lugar
2174,70271,jos verstappen checo prez saudiarabiangp redbullracing
2175,70272,ya sali en net de verstappen
2176,70273,no sean envidiosos como verstappen ya ven como les va pilas
2177,70274,necesito stickers de whatsapp de la cara del pap de verstappen jeje creo que tengo a muchos contactos a quienes responderles as
2178,70275,la familia verstappen es mala leche desde que el verstappen taita le casc a montoya en un gp de brasil
2179,70276,la imagen del da verstappen checoprez
2180,70277,prefirieron a verstappen checo prez molesto con red bull tras hacerlo perder la vuelta rpida segn la versin de sergio prez les dieron instrucciones diferentes a los pilotos
2181,70278,red bull en racha checo prez se impone en arabia saudita y verstappen se afirma en la cima por un punto
2182,70279,que quede claro van dos carreras del campeonato falta mucho y es un campeonato donde se premia la consistencia ms que cualquier otra cosa dejemos que la pista hable y sucedan las carreras mesura verstappen es la referencia de checo y toda la parrilla saudiarabiangp
2183,70280,mil veces ms apoyo para checo que para el tragapollas de verstappen
2184,70281,el pendejo de jos verstappen no ganaba ni en el gran turismo que no se quiera parar de culo ahorita
2185,70282,ayer le platiqu a mi novia el conflicto checo verstappen y bien linda y atento me escucho y chismeamos un ratillo de eso
2186,70283,max verstappen explota podemos pelear y que gane el mejor yo aqui no soy segundo advierte a checo a travs de youtube checoperez formula1 f1 maxverstappen gparabiasaudita redbull
2187,70284,al pap de verstappen no le gust mucho que el checo ganara f1 video deportes
2188,70285,que risa lo de verstappen pinche nio consentido jajajajaja
2189,70286,video cronologa del rompimiento entre checo prez y max verstappen
2190,70287,cuando hamilton verstappen vettel o el que queris haga ests mierdas comparamos mientras the goat still the goat
2191,70288,estimados amigos del chacoterof1 ya tenemos episodio nuevo del saudiarabiangp donde hablamos de todo y nada de lo acontecido en este gp recuerde no se quede como jos verstappen y escchenos no se van a arrepentir
2192,70289,este season de f1 solo hay dos nombres para ese campeonato perez vs verstappen ojala red bull los deje pelear y no esten con ordenes estupidas pa frenar a checo pero ahora sabemos lo limpio que es checo cuando pelea posicion lo mismo no se puede decir del otro
2193,70290,reflexin rpida seas de fer de carlos de verstappen es imposible odiar a este seor vive por y para la f1 qu manera de narrar lobatin alobatof1
2194,70291,f1 sergio prez se defiende de verstappen y gana un gp de arabia saud lleno de accin mientras alonso logra su podio nmero 100 lee ms saudiarabiangp frmula1 checoprez
2195,70292,de vayan a la mierda los verstappen
2196,70293,lo importante es empezar el da con positividad y una sonrisa yo como jos verstappen arrancando el lunes
2197,70294,checo prez acapara elogios por su triunfo y por no ceder a la presin de verstappen impresionante su mejor carrera latinus informacinparati
2198,70295,me dieron informacin diferente el mensaje interno en red bull que gener un tenso cruce entre verstappen y checo prez
2199,70296,si quieres conocer la historia de jos verstappen el padre de max que no soport la victoria de checo prez te la contamos
2200,70297,lanacin frmula 1 la tensa charla entre checo prez y verstappen que mantiene en alerta a red bull
2201,70298,no estoy aqu para terminar segundo max verstappen tras el gp de arabi saudita
2202,70299,el mexicano logr el podio luego de salir en la posicin nmero tres una arriba que su compaero de frmula max verstappen
2203,70300,luego de que checo se lleve el triunfo en el gp de arabia saudita verstappen confes que no se fue para nada contento
2204,70301,alonso le va a quitar el mundial en la ltima curva a verstappen y al tweet que suba alonso le va a responder con un ratio no tengo ni la ms minima duda
2205,70302,saudiarabiangp jos verstappen carga contra prez l no tiene la oportunidad de ganar tan a menudo
2206,70303,fernando alonso aston martin que este domingo volvi a causar la gran sensacin al acabar tercero el gran premio de arabia saud el segundo del mundial de f1 que acab por detrs del mexicano sergio prez y del neerlands max verstappen 20mar
2207,70304,top 10 tendencias de twitter en mxico felizlunes 14681     48086 checo 132037 yoonsanha 22867 saudiarabiangp 295980 norma pia 132457 chivas 20570 zcalo 174390 dainternacionaldelafelicidad none verstappen 114890
2208,70305,gana schecoperez y est a un punto de verstappen el jalisciense se lleva el gparabiasaudita su coequipero termina en segundo tras arrancar en ltimo disputa en redbull se prende ms
2209,70306,no ests tan bien sgueme humor y ms risas comedia humor felizlunes checo yoonsanha saudiarabiangp chivas patychapoy verstappen
2210,70307,un asco lo de verstappen ayer como piloto excelente y tremendo misil tiene como persona un asco el padre igual o peor me da cosa el ambiente que tiene alrededor el checo una verguenza
2211,70308,siempre lo mismo con verstappen l va solo cero compaerismo y apoyo con su equipo quitarle elpunto a schecoperez le urga siempre obviando su calidad como persona dentro de un equipo nada mas viendo la reaccin de su padre no se puede esperar otra cosa
2212,70309,que risa los memes de checo y verstappen
2213,70310,es evidente viendo las imgenes en la sala pre podio del gp saud que verstappen y checo se llevan mucho mejor con alo oficial q entre ellos el ambiente se poda cortar entre ambos red bull tiene el mejor coche de largo pero el gallinero revuelto de la f1 tambin de largo
2214,70311,verstappen hace berrinche por la victoria de checo prez en arabia saudita no estoy aqu para ser segundo latinus informacinparati
2215,70312,checo lo cuestion se revel video en el que sergio prez y max verstappen tuvieron una pltica sobre la vuelta ms rpida durante el gp de arabia saudita en f1xfsmx
2216,70313,no ests tan bien sgueme humor y ms risas comedia humor felizlunes checo yoonsanha saudiarabiangp chivas patychapoy verstappen
2217,70314,en la f1 comparan a max verstappen con los grandes de la historia fangio senna schumacher sin lugar a dudas tiene un talento prodigioso pero carece de algo muy importante calidad humana verstappen no sabe de equipo solo es l y al final va a recibir lo que est sembrando
2218,70315,jos verstappen si salud a prez pero la prensa la vende de otra forma
2219,70316,ese clan verstappen no vi la suya este fin chequito lo di todo seores
2220,70317,padre de max verstappen reprocha triunfo de schecoperez tras no felicitarlo maxverstappen checoperez f1
2221,70318,padre de max verstappen reprocha triunfo de schecoperez tras no felicitarlo maxverstappen checoperez f1
2222,70319,la pedrada de checo prez a verstappen tras robarle liderato red bull da una instruccin y no la respetan saudiarabiangp jeddah f1 f12023 formula1 checoperez redbull verstappen teamcheco redbullracing hamilton leclerc ferrari alonso
2223,70320,max verstappen estalla tras el gp de arabia y advierte a checo prez yo no estoy aqu para ser segundo saudiarabiangp jeddah f1 f12023 formula1 checoperez redbull verstappen teamcheco sainz leclerc ferrari alonso chequito astonmartin
2224,70321,max verstappen dice que red bull debe asegurarse de que sus coches sean confiables ya que es probable que la pelea por el campeonato sea entre l y su compaero de equipo
2225,70322,le tiran mierda a verstappen como si no se supiera que es su pap el que es mierda
2226,70323,me dieron informacin diferente el mensaje interno en red bull que gener un tenso cruce entre verstappen y checo prez
2227,70324,ayer verstappen dijo que el tenia muy claro que la competencia por el campeonato mundial iba realmente a ser entre dos coches o sea checo y l as que preprense para ver ms batallas internas en red bull
2228,70325,imagnense ser jos verstappen ser una basura corriendo f1 hacindose el digno porque le ganaron a su hijo y hacindole berrinche a un dos veces campen del mundo terrible
2229,70326,max verstappen segundo siempre fue el objetivo el coche de seguridad ayud un poco
2230,70327,max verstappen y fernando alonso
2231,70328,vale ahora que se ha calmado alguien me explica por que perez y verstappen pasan los limites del circuito en una curva acortando y sudando de la chicane ambos y nadie les dice nada
2232,70329,al igual que max verstappen yo tampoco estoy aqu para ser segundo
2233,70330,frmula1 la tensin entre verstappen y prez se ha disparado y el asturiano sabe que l puede ser el gran beneficiado en las prximas carreras
2234,70331,en la escala del 1 a los verstappen qu tan pinche envidioso y dlv eres
2235,70332,buenos das buenos das es asueto y hasta donald trump lo sabe lpez obrador lo sabe norma pia lo sabe checo y verstappen tambin menos en mi empresa an asi tengan felizlunes
2236,70333,checo prez fue contundente y se llev la carrera en jeddah el mexicano tuvo un ritmo imponente y se qued con la segunda fecha de la frmula 1 en arabia saudita verstappen hizo una gran remontada y lleg 2
2237,70334,las grandes diferencias entre la felicidad de un compaero y la envidia y fastidio de los otros que asco son los verstappen
2238,70335,medio mundo diciendo que perez y verstappen se enfrentaron y la gente normal dice cmo si ni se encontraron en pista y es correcto la batalla fue en los cronmetros la mitad de la f1 ocurre a nivel de datos las imgenes a veces solo muestran carritos dando vueltas
2239,70336,lo tengo que admitir soy verstappen y russel fan y me moriria por ambos
2240,70337,a checo le debe sobrar la energa de nico rosberg en 2016 si quiere tener un mnima posibilidad contra verstappen
2241,70338,que se espera de un padre que vive lo que no logro l a travs de su hijo es famosos por su hijo no por lo que el haya echo la glida reaccin del padre de max verstappen ante el triunfo de checo prez en arabia saudita
2242,70339,jos verstappen es insoportable adems de mal educado
2243,70340,verstappen y checo se odian esa relacin de compaeros en red bull va a terminar mal ojal termine como lo de rosberg con hamilton
2244,70341,no soport mi queridisimo jos verstappen
2245,70342,verstappen se piensa que los espaoles somos fans suyos porque le bancamos en la lucha con hamilton jajajaja veris que risa cuando tenga un roce con alonso y se tenga que cerrar instagram y salir escoltado a por el pan nos vamos a divertir mucho este ao
2246,70343,la cara de los 2 principales denotan que la prioridad para ellos es que verstappen gane siempre
2247,70344,jos verstappen y antonio perez garibay tienen la misma cantidad de carreras ganadas en frmula 1 y uno jams se ha subido a un coche de f1 es ms ya ni cabe nosoportocomojosverstappen
2248,70345,leo gente indignada esperando algo decente de jos verstappen el mismo que abandon a su hijo en una estacin de servicio a los catorce aos porque no gan una carrera de mierda yo no s si ustedes son boludos o se hacen
2249,70346,2003 fernando alonso x jos verstappen 2023 fernando alonso x max verstappen
2250,70347,crea que el tema checo vs max era mucha prensa mexicana hacindose amiga de perez porque asi pasa pero con lo de ayer qued claro internacionalmente que checo si es muy incomodo para los verstappen y que chingon ver que esta pa ganarle
2251,70348,jos verstappen prez no tiene la oportunidad de ganar tan a menudo la salsa tabasco en donde se le arruga cuero servir ese patan se siente piloto
2252,70349,jos verstappen va tomar no cu
2253,70350,molesto max verstappen no termin muy contento con su resultado en saudiarabiangp y fue tajante en la conferencia f1
2254,70351,decime que sos partidario obvio de verstappen sin decir que sos partidario de verstappen
2255,70352,q chingue su madre jos verstappen
2256,70353,cada gran premio verstappen se reafirma como el niato tonto del culo que es y de aqu no me bajo
2257,70354,la nica diferencia es que el pap de checo uso hasta la imagen de max para su campaa poltica pro eso siemrpe se hace el payaso djense de joder igual jos verstappen se puede ir a la puta
2258,70355,buenos das a todos menos a max verstappen tu chtm
2259,70356,no soy exactamente un fan de jos verstappen pero ac se desmienten muchas cosas lgicamente si ves a tu hijo perder no vas a estar muy contento no es excusa es la realidad los que son padres no ne dejarn mentir checo no necesita ayuda de nadie l solito se har camino
2260,70357,la actitud de verstappen es un claro ejemplo de cmo en la vida tenemos que toparnos con patanes que envidien nuestros logros hay que aprender a lidiar con eso buen triunfo de checo
2261,70358,hasta ahora red bull no ha tenido problemas entre sus dos pilotos pero en algn momento van a enfrentarse max y checo en la pista y ya sabemos como terminan esos enfrentamientos con verstappen
2262,70359,max verstappen siempre ser la regina george de la frmula 1
2263,70360,las duras declaraciones de verstappen contra red bull a travs de larazon es
2264,70361,para que se despejen las dudas de una vez por todas saudiarabiangp f1 hubo o no saludo entre checo prez y jos verstappen al final todo un caballero
2265,70362,don too fue criticado por sus demostraciones tan afectivas y como vive con felicidad y orgullo ser el pap de un piloto de f1 pero ver a jos me da asco nos da una idea de porque el hijo es as no saben perder son envidiosos no toleran que otros triunfen pobres verstappen
2266,70363,con lo aburrida que ser esta temporada con la superioridad de red bull solo espero que checo tenga el nivel para quedar delante en alguna qualy y hacerle frente en carrera como ayer es obvio que verstappen estar muy por encima en muchas carreras pero
2267,70364,despus de ver la reaccin de jos verstappen tras la victoria de checo entiendo por qu max tiene tan mala inteligencia emocional remonta del 15 al 2 queda en podio con vuelta rpida y reaccionan como si hubieran perdido el mundial
2268,70365,el piloto britnico se rindi ante el andar de los autos de checo prez y max verstappen
2269,70366,pnganse vergas amigues no sean un verstappen con un checo felizlunes
2270,70367,me dieron informacin diferente el mensaje interno en red bull que gener un tenso cruce entre verstappen y checo prez
2271,70368,me dieron informacin diferente el mensaje interno en red bull que gener un tenso cruce entre verstappen y checo prez
2272,70369,me dieron informacin diferente el mensaje interno en red bull que gener un tenso cruce entre verstappen y checo prez
2273,70370,hermano estoy dando vueltas
2274,70371,cuando verstappen vio que no poda alcanzar a checo empez a justificarse en la ltima vuelta sac el record de pista el holands as que no tena nada su carro
2275,70372,inesperado lewis hamilton siete veces campen del mundo dio una sentencia terminante sobre los red bull los detalles en la nota hamilton verstappen checoprez f1 saudiarabiangp redbullracing
2276,70373,se viene un 2007 inverso para fernando alonso y todo esto es culpa de max verstappen por no saber cundo tiene que ceder que checo le di un campeonato mundial as que a favor de esto
2277,70374,a max verstappen le regalaron el ttulo en el 2021 es un corredor que no sabe perder y hace todo lo que sea necesario para ganar incluso poner la vida de otro piloto en juego palabras ms o menos es un niito berrinchudo
2278,70375,seor perez gt gt gt gt gt gt gt gt gt gt gt gt gt gt gt gt gt gt gt gt gt gt gt gt gt gt gt gt abismo gt gt gt gt gt gt gt gt gt gt gt gt gt gt gt gt gt gt gt gt gt gt gt dad verstappen
2279,70376,dejo una resea de los asombrosos logros de jos verstappen en la f1 que ayer se vea muy molesto con la victoria de sergio perez jos verstappen aos 1994 2003 grandes premios disputados 107 victorias 0 poles 0 podios 2 puntos 17 vueltas rpidas 0 ttulos mundiales 0
2280,70377,los verstappen sern una leyenda la leyenda de la familia ms mamona y traicionera de la f1
2281,70378,alerta de episodio estreno f1ymotorchile anlisis gp arabia saudita victoria de checo prez remontada verstappen polmica fia x alonso debacle de mclaren y ms junto a kotysandoval rvaldebenito72 y feliperacing81 f1chile f1
2282,70379,que rechingue a su madre jos verstappen
2283,70380,fernando alonso logr el podio nmero 100 en su carrera con polmica incluida verstappen finaliz segundo a travs de crmundiario mundiario
2284,70381,no es bueno dar opiniones sin entender contextos y verificar informacin los europeos en su mayora son inexpresivos por naturaleza joss verstappen si salud a schecoperez por supuesto que eso no le quita lo txico y depredador pero no hay que hacer dramas innecesarios
2285,70382,que checo gane muchas ms por la satisfaccin extra de ver esta cara del pap verstappen mas seguido ardidsimo y sin sentido
2286,70383,derrot a verstappen con puro ritmo prensa elogia a checo prez tras sorpender en gp de arabia quieren ver una batalla entre pilotos de red bull
2287,70384,cada da me cae ms mal max verstappen mugre envidioso
2288,70385,entre la cara de pap verstappen la boca de los mexicanos y la arrogancia del salta muros me pregunto quin ser el 2 de red bull para 2024 ricciardo no creo
2289,70386,fernando alonso aston martin que este domingo volvi a causar la gran sensacin al acabar tercero el gran premio de arabia saud el segundo del mundial de f1 que acab por detrs del mexicano sergio prez y del neerlands max verstappen 20mar
2290,70387,no descartemos que sea el jos verstappen de cera
2291,70388,horner se refiri al rcord de vuelta marcado por verstappen que motiv la molestia de prez saudiarabiangp f1 f12023
2292,70389,top 10 tendencias de twitter en mxico felizlunes 12926 checo 131711 saudiarabiangp 298227 chivas 21819 zcalo 182211     19962 norma pia 133171 verstappen 115434 felizdomingo 14686 hyunjinpaintstheworld 317854
2293,70390,ltima vuelta de abu dhabi triple empate entre verstappen checo y alonso se marcha el safety car habr una vuelta de carrera los triples hpd de dazn
2294,70391,f1 excelente lunes amigos al parecer quien no est teniendo un gran lunes es max verstappen luego del triunfo de sergio prez el actual campen sigue sin llevar bien aquello de no ser no 1 formula1 saudiarabiangp sergioperez maxverstappen checoperez josverstappen
2295,70392,est quedando verstappen al descubierto lo qu hamilton tardo en sacar a la luz 5aos este tipo lleva dos aos ganando y uno gracias a checo
2296,70393,ese max verstappen parece wiro cagado solo berrinches
2297,70394,emocionalmente los verstappen son muy tontos con muy poco tendran a este chaval de su parte y creo que a checho ya se la suda bastante seguir o no en red bull
2298,70395,que falta de respeto jos verstappen al menos podra saludar o felicitar cordialmente pero no marce domenech
2299,70396,vuelvo a ver el video del pap de verstappen y me vuelvo a enojar vato ridiculo
2300,70397,y son el himno nacional mexicano en arabia saudita sergio prez celebr su primera victoria en la temporada de la frmula 1 al imponerse en el gran premio en una lucha con max verstappen quien remont desde la posicin 15 para terminar escoltndolo en el podio fox sports
2301,70398,ojal las radios de verstappen fueran as
2302,70399,jos verstappen me cae peor q max
2303,70400,yo lo de este to ya no lo entiendo yo soy muy crtico con checo y sus fans cuando se quejan de verstappen pero si tanto te quejas psalo en la pista y va para ambos qu quera max y su pap que le dijeran a checo que aflojara o qu vaya jetas
2304,70401,chinga tu madre jos verstappen
2305,70402,verstappen critica la avera del sbado en su red bull si el ttulo est entre nosotros hay que asegurarse de que los dos coches son fiables
2306,70403,les deseo a todos una excelente semana a menos que te apellidos verstappen a ustedes no les deseo nada por culeghos
2307,70404,chequito deberia ganar mas carreras no mas para ver como llora y hace berrinches el mariquita de verstappen
2308,70405,checoperez se lleva el granpremio de arabiasaudita y le sopla en la nuca a verstappen mexico va por la hazaa ante japon en el clasicomundial2023 echan los pumas a rafapuente
2309,70406,max verstappen no est feliz tras llegar detrs de checo prez no estoy aqu para ser segundo
2310,70407,ando ms insoportable que jos verstappen durante la celebracin de checo
2311,70408,con razn verstappen es as su pap es igual
2312,70409,y fue una pena el abandono de stroll porque estaban ambos coches arriba y encima tras ese sc se vio beneficiado verstappen que aunque yo creo que habra llegado igualmente pero de la otra forma no hubiera sido tan fcil
2313,70410,hoy por hoy para mi los mejores son verstappen alonso hamilton leclerc russell checo lando en ese orden aunque hamilton est desmotivado que se lo ve no desmerece su talento
2314,70411,el padre de max verstappen demostrando ser una persona irrespetuosa e incomoda no felicita sergio prez mas bien su cara lo dice todo cara de ano y molesto porque max no vecio saliendo de 15avo llegando de 2do txico el cabron
2315,70412,yo admiro a verstappen porque es uno de los mejores pilotos que han visto mis ojos y aunque es muy pronto para decirlo ahora en el futuro seguramente ser top 3 mejores pilotos de la historia del deporte sin embargo el y su entorno son todos unos becerros malas personas
2316,70413,max verstappen no qued muy feliz tras llegar detrs de checo prez no estoy aqu para ser segundo
2317,70414,verstappen es el verdadero villano de la f1 v
2318,70415,diferencia entre la familia de max verstappen y la familia de checo prez
2319,70416,un hamilton con el coche de 2021 max verstappen en 2021
2320,70417,no estoy aqu para terminar segundo verstappen pide a red bull que resuelva los gremlins de confiabilidad que plagaron al equipo en jeddah
2321,70418,prez detalla el final intenso despus de contener a verstappen para ganar en jeddah
2322,70419,lo volvi hacer verstappen
2323,70420,los verstappen poco a poco estn mostrando lo que verdaderamente son
2324,70421,los verstappen son bien poquitito que asco
2325,70422,video as le dijo verstappen a prez que le quit la vuelta rpida
2326,70423,primero que nada buenos das segundo max verstappen
2327,70424,me encanta max verstappen como piloto pero en esta guerra soy ms chequista que los propios mexicanos ojal tenga el ritmo para pelear con max y que gracias a eso alonso pesque muchos puntos
2328,70425,como odio a jos verstappen weon
2329,70426,cuando se retiren alonso y hamilton vamos a pasar unos aos de sequa en la f1 brutales kimi y seb ya se fueron y la next gen aburre a las piedras la mnima esperanza es verstappen
2330,70427,nos hizo mucha falta too garibay ayer durante la celebracion se lo imaginan agarrando al pap de verstappen enjetado y dndole un tremendo besote frente a las cmaras
2331,70428,es bueno para la f1 que checo prez y verstappen se peleen deportivamente la verdad es que max es insufrible por lo competitivo txico que es sino no sera lo que es y quiere todo para l imagino que el equipo no los dejar pelear hasta asegurar el ttulo de constructores
2332,70429,ya vereis cuando llegemos a spa y miremos a la rivalidad entre checo y verstappen de ahora y nos reiremos minimo le saca 100 puntos
2333,70430,y son el himno nacional mexicano en arabia saudita sergio prez celebr su primera victoria en la temporada de frmula 1 al imponerse en el gran premio en lucha con max verstappen quien remont desde la posicin 15 para terminar escoltndolo en el podio video foxsports
2334,70431,jos es un gilipollas ya lo sabemos pero too no es piloto de f1 y no tiene esa sangre competitiva que llevan los verstappen
2335,70432,asi queda la clasificacion del campeonato de pilotos de la f1 verstappen y perez pelando por la cima y alonso volviendo a la p3 luego del show de la fia
2336,70433,el momento de la f1 que se volvi tendencia jos verstappen pap de max ignora a checo prez durante su festejo en el gran premio de arabia saudita
2337,70434,jos verstappen tiene la misma cantidad de carreras ganadas que yo
2338,70435,red bull en racha checo prez se impone en arabia saudita y verstappen se afirma en la cima por un punto
2339,70436,el peor enemigo de max verstappen es su padre
2340,70437,lamentable f1xfsmx helmut marko justific la actitud de max verstappen luego de robarle la vuelta ms rpida a checo prez en el saudiarabiangp
2341,70438,buenos das dice jos verstappen que checo prez no tiene la oportunidad de ganar tan a menudo
2342,70439,checo prez ayer tena la leccin aprendida con max verstappen la reaccin de checo
2343,70440,no estoy tan de acuerdo en que redbull est en otra galaxia respecto a aston martin vuelta 50 con verstappen yendo a por la vuelta rpida y alonso intentando sacar tiempo a russell por la penalizacin tres dcimas en un circuito que en teora le iba muy mal a aston martin
2344,70441,max verstappen jbilo a hamilton l es el hombre
2345,70442,no es por nada pero estamos a 14 puntos de verstappen y a 13 de checo no es por nada eh
2346,70443,jaja est para reel la cara de jos verstappen oojalaaa me llev el diablo
2347,70444,sergio prez mand a verstappen al segundo lugar en el gran premio de arabia saudita
2348,70445,f1 saudiarabiangp 1 2 3 y paso la 2 fecha de vivomipodio felicitaciones a los 8 que acertaron el podio 7 de ellos se llevan todos los puntos 23 acertaron la pole de checo 27 por perez 1 16 por verstappen 2 y 110 por alonso 3
2349,70446,que antiptico el pap de verstappen
