,Id,Tweet
2057,62699,que madrina el puso el amrica a las chivas y en su casa henry igual de naco que cuauhtmoc
2058,62700,henrymartinm ofrece disculpas por el festejo del gol en el clsico ante chivas futbol ligamx
2059,62701,yo no veo ftbol y el algoritmo de twitter recomendndome a los fifas del amrica chivas y sus odiosos memes y quejas a weyes que ni los topan ush arruinaste twitter elonmusk bye
2060,62702,chale no les da vergenza con las visitas chivas
2061,62703,me quedaria 1 oro olimpico 2 canelo siendo libra x libra 3 medalla de soraya jimenez 4 chavez 90 peleas invicto 5 sub 17 2005 6 chivas tigres y azul final libertadores 7 hipotetica victoria de mexico hoy no me decido entre el 5 6 7
2062,62704,a henry martn le podra salir muy caro el festejo que realiz tras marcarle a las chivas en el clsico nacional
2063,62705,rayadas no logr vencer a chivas y empat 2 2 en el estadio akron sin embargo ya le dieron vuelta a la pgina y ya piensan en el clsico regio
2064,62706,amrica derrota a chivas y se lleva el clsico de mexico el ariete uruguayo jonathan rodrguez firm un doblete en el primer tiempo el sbado por la noche y el amrica no pas sobresaltos para enfilarse un triunfo de 4 2 sobre chivas en el clsico del ftbolmxico ligamx
2065,62707,no le pareci el arbitraje las palabras del d t de chivas despus de la derrota ante amrica furiadeportiva furianeta ligabbvamx c23 chivas paunovi clsico
2066,62708,lo bueno del clsico hubo 6 goles lo malo 4 en contra de las chivas chivas america elclasico humor felizlunes chistesdelapatada ligamx
2067,62709,pues que me manden su nmero de cuenta y yo le ayudo es un placer ver como se peino en esas chivas pedorras
2068,62710,que da tan chimba el sbado le baj cogimos deli comimos deli y mi ave derrot a las chivas
2069,62711,a esta hora hay gente que anda con campera de cuero no hace fro y si caminas rpido bajo el sol te chivas no esta para campera de cuero sacate eso que me haces mal
2070,62712,henry martn afronta dura sancin tras festejo ante chivas
2071,62713,buenos das pinch equipo sin huevos exhibidos y burlados por el mierdamerica si t chivas y t directivo de cagada amauryvz vpaunovic hasta cuando entendern que chivas no es cualquier equipo pitero
2072,62714,el amrica le gan a las chivas el bara le gan el real madrid volv a un vive latino fue un buen puentecito
2073,62715,top 10 tendencias de twitter en mxico felizlunes 14681     48086 checo 132037 yoonsanha 22867 saudiarabiangp 295980 norma pia 132457 chivas 20570 zcalo 174390 dainternacionaldelafelicidad none verstappen 114890
2074,62716,no ests tan bien sgueme humor y ms risas comedia humor felizlunes checo yoonsanha saudiarabiangp chivas patychapoy verstappen
2075,62717,no ests tan bien sgueme humor y ms risas comedia humor felizlunes checo yoonsanha saudiarabiangp chivas patychapoy verstappen
2076,62718,plumasdelesto hace ya muchos pero muchos aos el tinte del clsico ha perdido brillo y color el impresionante dominio azulcrema sobre chivas es tal que la condicin de clsico desaparece en automtico hablillas por angel parra
2077,62719,las canciones la dannapaola son bien chivas
2078,62720,que cruuuda pero ms crudos los que le van a chivas a pumas y al madrid y si le vas a verstapen te lo mereces
2079,62721,amrica gana clsico nacional saca a chivas de los 4 primeros y es sublder via zc noticias
2080,62722,es muy claro quien tiene que ser el portero titular de la seleccin mexicana ltimos 5 partidos ochoa juve monza sampdoria miln y bolonia 6 goles recibidos acevedo len tijuana chivas puebla y toluca 15 goles recibidos 27 goles en 12 jornadas
2081,62723,ayer el arbitraje perjudic notablemente a rayadas un fuera de juego al tamao del estadio y una mano en el rea de chivas clarisima pero ojo chivas las borr no hubo intensidad de otros juegos aparte los cambios no funcionaron pnganse las pilas xq tigres no son las chivas
2082,62724,se gan el partido ms importante para segn chivas as lo dicen ellos entonces hoy pueden decir que una vez ms han fracasado y clubamerica sigue dominando hay que hablar en la cancha y no andar de bocones en la previa se hicieron chiquitos esa es su realidad
2083,62725,puro pendejo le va a las chivas
2084,62726,me salv de ser la burla por irle a chivas pero voy a ser la burla por pndeja
2085,62727,casi me rompo el pie humillaron a las chivas y perdi el real madrid que tal su fin de semana
2086,62728,dos derrotas consecutivas tienen ahora a chivas en el lugar 7 de la tabla vpaunovic tiene que enfocarse en ganar a cmo de lugar al atlas ganando llegas a 24 pts y probablemente escalas algunas posiciones de aqu al final no queda ms que ganar todos los partidos
2087,62729,cre que el amrica era sper lder y resulta que con su victoria est a dos puntos arriba de las chivas
2088,62730,bonita semana servicio de 12 10pm info y pedidos por wa 2281079984 servicioadomicilio con cargo extra dependiendo zona promos vlidas lunes 20 a domingo 26 de marzo checo saudiarabiangp xalapa chivas felizlunes
2089,62731,lleg la encuesta de futbol picante podr chivas terminar dentro de los primeros 4 de la liga mx comenta y participa con alvaritomorales mariocarrilloy2 diesestrada y hctor huerta
2090,62732,curioso lo de sanoswaldo td en tudnmex incitando a la violencia diciendo que no entiende por qu los jugadores de chivas no se le fueron encima a henrymartinm por su festejo ese tipo no debera salir en televisin
2091,62733,con la playera de amrica cabecita rodrguez ya le marc a los otros 3 conjuntos denominados grandes del futbol mexicano chivas cruz azul y pumas el de los partidos importantes
2092,62734,qutate la playera de chivas
2093,62735,cocca lo dejara fuera del tri fue una vergenza con chivas en el clsico somos chivas noticias chivas
2094,62736,desaparecido desaparecido nombre benzema desaparecido 19 de marzo 2023 caractersticas haber tenido un prime ms corto que chivas en el mundial de clubes posibles ubicaciones en el bolsillo de gavi visto por ltima vez spotify camp nou
2095,62737,pero estaban a mame y mame y mame que las chivas calificaban directo y que el clubamerica estaba en zona de repechaje jajaja y ya estn de vuelta en su realidad las chiv42 jajajajajaja omarvv9 fercevallosf enriquevonbeas j pietra
2096,62738,ahora se entiende la forma tan desastrosa en la que se hizo expulsar chivas chivas pero se sabe que aqu no contestarn nada solo lo que les conviene
2097,62739,no se te olvide tu pastilla chivas
2098,62740,fernando ortiz manda una clara indirecta a las chivas luego de la victoria en el clsico nacional
2099,62741,chivas vs club amrica las guilas se volvieron a pasear en su jardn
2100,62742,henry martn debera ser sancionado por su festejo ante las chivas qu dicen faitelson espn joserra espn
2101,62743,felipe ramos rizo critic la actuacin del cuerpo arbitral del chivas va rayadas
2102,62744,televisa
2103,62745,buenos das felizlunes para todos disfrtenlo cudense y psensela bonito que esta semana inicie con grandes bendiciones para ti y los tuyos y tu trabajo sea productivo y lleno de xitos bendiciones nimo
2104,62746,la vida es corta como para dejar a lado lo que anhelas aunque aveces cueste y sienta que no se pueda
2105,62747,y yo me pregunto en todo mxico no existe otra persona capaz que pueda desarrollar su trabajo pero llendo con los estatutos principios gustos y filosofa de la empresa en la que laboras amauryvz chivas
2106,62748,amrica salt al segundo lugar con 6 victorias 5 empates 1 derrota y 23 puntos y chivas baj al quinto con 21 unidades
2107,62749,mxico
2108,62750,que tristeza ver que la gente salio triste del acron vergenza debera d darle a los jugadores d las chivas dar ese espectculo chivas necesitadelanteros d primer nivel chicharo vela tiene delanteros que no les corre sangre x las venas
2109,62751,todo ha vuelto a la normalidad la fiel fue un mito atlas no vive de copas y sus aficionados regresaron a vivir sus miserables vidas dependiendo en qu es lo que haga o deje de hacer chivas
2110,62752,no me queda duda que el clsico importante el nacional el del rating y el que ms ve este pas es sin duda el chivas vs amrica el comentarioalda con arizpemiguelz
2111,62753,tssss se vale sobar su temporada ms buena en los ltimos 50 aos y tienen tres puntos ms que el amrica temporadn de las chivas wow ral jimnez clubamerica chivas ligamx ligabbvamx
2112,62754,hace tanto fro para estar tan caliente
2113,62755,transcurridas 12 jornadas y con algunos partidos pendientes as se encuentra la tabla general de la ligabbvamx nuestro rebao baj hasta la posicin 7 prximo encuentro jornada 13 se jugar en nuestra segunda casa estadiojalisco atlasfc vs chivas vs
2114,62756,buenos das chivas como amanecieron hoy los jugadores sin huevos
2115,62757,top 10 tendencias de twitter en mxico felizlunes 12926 checo 131711 saudiarabiangp 298227 chivas 21819 zcalo 182211     19962 norma pia 133171 verstappen 115434 felizdomingo 14686 hyunjinpaintstheworld 317854
2116,62758,qu buenos clasicos tuvimos gano mi barcelona 2 1 real madrid gano mi amrica 4 2 chivas
2117,62759,qutate la playera de chivas
2118,62760,promet la semana pasada que pap clubamerica enviara a las chivas a su zona de confort la increble y fabulosa repesca pap amrica est en 2o lugar y el rebao ay dios mo en 7o felicidades
2119,62761,chivas se enfrent contra america en el estadio akron ubicando al guadalajara en el cuarto lugar de la tabla con 21 puntos abrelosojos con lopezolvera por imagentvmex
2120,62762,qutate la playera de chivas
2121,62763,promet la semana pasada que pap clubamerica enviara a las chivas a su zona de confort la increble y fabulosa repesca pap amrica est en 2o lugar y el rebao ay dios mo en 7o felicidades
2122,62764,ya pasaron los das de duelo venga cabrones chivas a por el siguiente clsico esto an no termina
2123,62765,no a todos les queda el puro noms a los hocicones chivas el clubamerica puro chile les dio felicidades hocicones ligabbvamx ligamxexpansion futbol clasico juegos
2124,62766,este fin de semana fue un mal momento para apoyar a las chivas y al real madrid xd
2125,62767,hermoso bien por henrymartinm y clubamerica pero el buen henry sabr que chivas su archirrival posiblemente tenga aficionados y seguidores enfermos de cncer lo dejo para reflexionar en ello
2126,62768,pobres chivas no podrn jams con el ms grande chicas haora ya saben quin es papa
2127,62769,si wey te voy a creer que la gente fue a llenar el zcalo por su voluntad en da de clsico nacional amrica vs chivas clsico regio jug cruz azul hubo gp de arabia checo perez y vive latino tambin te creo que la gente sabe un chingo sobre el 18 de marzo
2128,62770,en el ao 2023 finlandia lidera la lista de los pases ms felices del mundo mientras que costa rica ocupa el primer lugar en amrica latina como el pas ms feliz
2129,62771,un 20 de marzo de 1994 debuta joel snchez en duelo vs toluca tibu datos ilustracin manoalzada efemeridesrojiblancas chivas guadalajara joeltiburonsanchez
2130,62772,cmo amaneci la tabla de posiciones hoy ligamx clubamerica chivas diamems amricayya
2131,62773,buenos das mis mas o menos de la radio lalo leal poeta leovega lo mejor del fin de semana aparte del triunfo de schecoperez y el barcelona fue gritarle los goles en la cara a betoperezlanda y arriba las chivas aunque pierdan
2132,62774,humillacin ambos llegaban con altas expectativas al clsico y solamente uno estuvo a la altura amrica meti cuatro y pudo meter tres ms sin problema un baile les comparto mi ms reciente columna en adrenalina sobre la goleada a las chivas
2133,62775,una vez ms el clubamerica hizo mierda a chivas mira que siguen sin publicar nada desde el sbado en la noche no es para menos se comieron 4 su dolo dijo que si jugara con amrica henry los volvi a humillar linda fecha fifa para seguir puteandolos 2 semanas ms
2134,62776,porsiteloperdiste rayadas empat ante chivas en el akron
2135,62777,paunovic es culpable o inocente de la goleada del clubamerica a las chivas narradoraztec ethelcolato1
2136,62778,me quera burlar del jefe lalohdeza de la goliza de mi ame a las chivas pero me acorde que no le pague la ltima apuesta y que se me pas hahahahaha hahahaha hahahaha hahahaha
2137,62779,no habr nadie en chivas qu les ensee el oficio no puede ser que ni un jaln ni una sancadilla para detener el contragolpe qu deriv en gol que nadie les dir que tirarse para pedir la falta es irse a la fcil es cobarde y sin compromiso dejaron de presionar la salida
2138,62780,ahuevo putos chivas chillones culeros
2139,62781,y despus de la madriza del sbado que podemos esperar para el clasicotapatio contra atlasfc chivas parece haber vuelto a la senda del fracaso chivahermanomas losdechivas5
2140,62782,el legado histrico e inmortal del tigre seplveda con chivas pel no va youtube a el pdanle perdn paunovic chivas amauryvz cuando sean consientes de la historia que forjaron los campeonisimos se darn cuenta que no lo merecen
2141,62783,ojal hubiera apostado con alguien de las chivas para que pagara la apuesta
2142,62784,que bueno que no me burl de las chivas
2143,62785,esto deberan de cantarles a ustedes tambin pinchs sin huevos chivas
2144,62786,ltima hora cae helicptero del ejrcito en misin de abastecimiento en quibd
2145,62787,me llenan de vida los vlog del partido del amrica vs las chivas jaja
2146,62788,depcesionante el clsico nacional solo juegan por jugar por cobrar no aman la camiseta el escudo la originalidad del equipo como ellos lo dicen se les nota y que feo que no capten que chivas es el ms grande les pesa el escudo
2147,62789,mal fin de semana para ser de chivas y del madrid
2148,62790,liguilla adelantada naa es el tour rebao y las chivas le hacen los honores al campen en un par ti da zo ya sabes pa que no extraes el mejor futbol del planeta el de mxico es en vix plus
2149,62791,cunto amor por la playera le falta a los directivos de chivas el circo de hermandad que montaron termin con una orinada en su casa y con su gente qu tristeza por el club ms historico del pas
2150,62792,hoy no se habla de chivas ni real madrid en ecdqemsd
2151,62793,espero que los que le faltaron a chivas en el clsico los saquen en la liguilla ya dejen sus m y ya ganen partidos importantes caramba chivas
2152,62794,por lo visto el sbado queda claro que hoy slo hay cuatro jugadores que entienden lo que significa jugar para chivas ferbbeltran alan mozo51 alexis vega9 y guzmanpocho06 los dems empezando por el hombre falla carloscb 24 sobran estn de ms debotepronto
2153,62795,les habla un histrico pocos huevos chivas
2154,62796,amrica vence contundentemente a chivas en el clsico nacional amp 8230 lograron su sexto triunfo del clausura 2023 y se colocaron en el segundo sitio
2155,62797,en vivo lunes in the morning amrica golea a las chivas mxico juega su pase a la final del clsico mundial de bisbol checo prez gana en la formula 1 edgarr rv franglez1194 ericberry96 y claudio lg1 1030 am
2156,62798,los 20 clubes de amrica con ms interacciones en instagram durante febrero 2023 11 cruzeiro 12 colocolo 13 gremio 14 fortalezaec 15 sccpfutfeminino 16 clubamerica 17 scinternacional 18 botafogo 19 ecbahia 20 chivas
2157,62799,muy bien amrica o muy mal chivas
2158,62800,oye fercevallosf tengo una duda ahora quin est mejor clubamerica o chivas por qu por un punto decas que eran mejores chivas e iban a ganar no amrica gan todo demostr un mejor ftbol demostr como se juega un clsico y demostr quin es el mas grande
2159,62801,conjunto pants y chamarra chivas fit unisex adulto t xxg gt puedes encontrar una lista con ms productos aqu
2160,62802,top 10 tendencias de twitter en mxico checo 130667 saudiarabiangp 301886 chivas 23705 verstappen 115695 zcalo 200679 norma pia 131596 hyunjinpaintstheworld 350103 alonso 260031     347806 felizdomingo 17910
2161,62803,el floridense jonathan rodrguez anot doblete en el triunfo clsico de amrica sobre chivas por la 12 fecha del campeonato clausura de la liga mx el cabeza de gran partido marc los dos primeros goles a los 16 y 38 minutos de la primera mitad
2162,62804,cual es la novedad novedad ser el da que cumplan mnimo respetar horarios no faltar a la pega y que no tengan chivas tan buenas como canitrot para justificarse
2163,62805,feminismo a todo lo que da ayer las comentaristas de foxsportsmx comentaron aquel partido donde chivas goleo a rayadas 5 0 la derrota mas amplia en la historia de rayadas pero no dijeron el porque se dio ese resultado feminismo o ignorancia
2164,62806,pensaran que esto se trata de un chiste o una trolleada pero no si ocurri el tcnico de las chivas femenil juan pablo alfaro fue elegido como el jugador del partido al final del guadalajara vs monterrey de la jornada 10 del torneo clausura 2023 de la liga mx femenil
2165,62807,gracias chivas y gracias a cosas que le pas a un animalito ando anmicamente destrozado estoy triste
2166,62808,los mismos chivas que se quejan del festejo de henry aplaudieron esto a chuparla
2167,62809,sasha grey ex actriz porno pos con jersey de chivas para el clsico ante amrica
2168,62810,s esa persona que tus ex compaeros recuerdan por haber sido la nica que se port amable conmigo puente checo chivas noestassola taylor xavi seoul mondaymood
2169,62811,est fresco pero hay una humedad terrible caminas y chivas como panadero en pleno enero
2170,62812,de la chingada perdi chivas real madrid pio fc el peor fin de semana
2171,62813,inicia semana unos reportan a seleccin y otros regaados en verde valle de poder ser el 2 hasta el 7 de la tabla golpe de realidad de hoy al clsico por fa no hablen chivas sin disculpas ni amenazas solo salgan y ganen al atlaz les juro que con eso es suficiente
2172,62814,yo espero que este sea el ltimo ao de rayados con foxsportsmx este imbecil tiene toda la intencin de empinar a rayados si crees que amrica o chivas te da mejores ratings rale puetas transmite sus partidos y suelta a rayados
2173,62815,de nada sirve que tengas millones de aficionados chivas si tu no les devuelves tantito cada da crece mi familia rojo blanca pero as verte regalarte no esforzarte no entregado el corazn en cada paritido no vale la pena estoy triste por ellos no por ustedes
2174,62816,empatan chivas y rayadas
2175,62817,chivas 5 ame 7 el alma en la cancha y los chamacos adentro uno no es lo que quiere sino lo que puedes ser el ftbol da revanchas
2176,62818,top 10 tendencias de twitter en mxico checo 130020 saudiarabiangp 301410 chivas 24502 zcalo 206952 verstappen 116220 norma pia 129338 hyunjinpaintstheworld 332100 alonso 257563 bara 332243     335740
2177,62819,me parece increble que cataloguen de corriente el festejo de henrymartinm qu valor cuando chivas es el equipo ms corriente que he visto en mi vida
2178,62820,una disculpa a los que se ofendieron henry martn tras polmico festejo en partido amrica chivas deportes ligamx
2179,62821,que el clsico tapato se gane vamos chivas ustedes me hicieron enamorar de este deporte tan hermoso y me inspiraron para meterme a un equipo de ftbol ya que mi sueo siempre ser jugar en el rebao sagrado el equipo que me hizo enamorar del ftbol
2180,62822,y no noms aser ilusiones y hacer buenos fichajes como un centro delantero un mediocampista un defensa fichajes que hagan subir el nivel de juego en el equipo y no nos anden humillando en nuestra casa vamos chivas yo confo en ustedes siempre en las buenas y las malas y vamos
2181,62823,as que porfavor chivas est aficin merece tener un equipo que juegue con el corazn amor a la camiseta como en su tiempo era omar bravo el bofo bautista oswaldo snchez benjamin galindo ramn morales carlos reinoso claudio surez carlos salcido
2182,62824,me encantara que los directivos de chivas se den cuenta lo que pas este sbado fue espantoso y casi nadie se esperaba un resultado as me gustara que chivas se de cuenta que somos 11 millones de aficionados o tal vez ms que siempre los andamos apoyando
2183,62825,hoy amaneci de ptm buscando equilibrio e imparcialidad por lo tanto que chasm el team frio y el team calor chasm el feminismo chasm el machismo chasm las chivas chasm el america chasm adrianmarcelo y el chessman chasm tu yo y tu nueva funda hdtpm
2184,62826,tras decepcionar en el clsiconacional ante su gente el estratega de chivas veljko paunovic ofreci disculpas a su aficin ligamx
2185,62827,el amrica aplast a las chivas y qued segundo en la tabla de liga mx
2186,62828,top 10 tendencias de twitter en mxico checo 129739 saudiarabiangp 301657 chivas 24934 zcalo 208749 verstappen 116211 norma pia 128922 hyunjinpaintstheworld 328190 alonso 256302 bara 328149     331699
2187,62829,deportes amrica vence a las chivas en el clsico nacional y los memes no se dejan esperar ac te dejamos algunos
2188,62830,a toda la aficin de chivas da mucha bronca el festejo de henry pero que ningn jugador le pusiera un madrazo para que le bajara de huevos da mucho mas coraje malditos jugadores que no defienden los colores ch1nguen a su madre
2189,62831,lo lindo del ftbol ccp chivas
2190,62832,fidalgo fue el que le dijo a henry que se meara en las chivas como no vas a querer al pibe
2191,62833,empate en el akron en un trepidante encuentro celebrado en el estadio akron rayadas dejo escapar su marca perfecta al igualar a dos tantos con chivas gracias aun penalty de ltimo minuto anotado por carolina jaramillo
2192,62834,a ver yo no le voy ni a chivas ni al clubamerica la hacen de pedo por el festejo de henrymartinm pero por qu no hay pedo por qu le aventaron un encendedor o sea est de la madre el festejo pero tambin la aficin deja mucho que desear fmf
2193,62835,si se ha de sentir gacho irle a las chivas
2194,62836,top 10 tendencias de twitter en mxico checo 129326 saudiarabiangp 301452 chivas 25762 zcalo 211185 verstappen 116091 norma pia 128507 allstareliminacin none hyunjinpaintstheworld 324356 alonso 254819 bara 322679
2195,62837,ser infiel es como irle al chivas me da asco
2196,62838,te quiero hacer lo que el amrica le hizo alas chivas
2197,62839,ramn morales vislumbr un clsico muy parejo entre chivas y clubamerica la nota en adrenalina de excelsior
2198,62840,que ganas de andar como el chivas bien cogidote
2199,62841,guadalajara 2 2 monterrey chivas christian carolina jaramillo scores the equalizer in a powerful duel ligamxfemenil mexico futfem futbol futbolistas goals trending
2200,62842,como q le van a las chivas
2201,62843,veo muy callados a los de las chivas
2202,62844,hoy gan checo alcaraz el celaya pero perdieron mis chivas y mi madrid el ojo izquierdo llora de felicidad y el derecho de tristeza
2203,62845,luego de que clubamerica goleara a chivas por marcador de 4 2 en el clsico nacional javier alarcon nos da su anlisis y comentario de lo sucedido el sbado por la noche en el estadio akron adrenalina
2204,62846,caro despues de su pastelazo
2205,62847,chsm le voy a las chivas
2206,62848,tabla gral ligamx j 12 1 mty 31 pts 2 amrica 23 3 toluca 22 4 pachuca 22 5 len 21 6 tigres 21 7 chivas 21 8 cruz azul 16 9 santos 15 10 jurez 13 11 puebla 13 12 atlas 12 13 necaxa 12 14 xolos 12 15 atl san luis 12 16 pumas 11 17 quertaro 9 18 mazatln 4
2207,62849,somoscornermx chivas femenil le saca el empate a rayadas tras ir cayendo 2 0 chivas femenil se sac la espina del pie y logr rescatar un empate ante las lideres del torneo las rayadas quienes estaban a punto de lograr su dcima victoria consecutiva
2208,62850,deportes amrica vence a las chivas en el clsico nacional y los memes no se dejan esperar ac te dejamos algunos
2209,62851,la terraza chivas
2210,62852,te extrao todos los das de mi vida rafamloficial contigo no pasaban estas cosas chivas
2211,62853,los ganadores de los clsicos del fin de semana rayados se llev el triunfo en el clsico regio amrica gole a domicilio a chivas en el clsico de mxico la juve se impuso al inter feyenoord gan el clsico de pases bajos ante el ajax barcelona derrot al realmadrid
2212,62854,jajaja se imaginan la chivaloca de chivas en estos tiempo de cristalitos jaja se infartan esa agarraba a patadas piatas del rival salia con escopetas iba a la porra visitante y les mentaba la madre y arengaba a todos a abuchearlos y corear el fuera fuera
2213,62855,a ver si aprendemos un poco chivas menos marketing y ms huevos al rival se le presiona no se le recibe con das de anticipacin en tu casa no se arropa y se le deja pisar el campo el rival tiene que venir con nervios e incertidumbre no prestarle la casa
2214,62856,resumen de la jornada 12 de la liga mx 0 puebla vs atlas 4 3 tijuana vs toluca 3 0 mazatln vs necaxa 1 1 cruz azul vs atl san luis 0 0 tigres vs monterrey 1 2 chivas vs amrica 4 0 pumas vs pachuca 2
2215,62857,obvio chivas se dej ganar para que el america no llorara
2216,62858,jajaja en qu bullying me metera con esta arrastrada que le dieron a mis chivas
2217,62859,se esta terminando la fase regular rayados lder en solitario y ya asegur su boleto a liguilla clubamrica es segundo chivas es 7 cruzazul marcha 8 pumas sigue en mala racha futbol football ligamx mexico clausura2023
2218,62860,desmonsivais firmando un jersey de chivas ig jotaele fotos
2219,62861,lo preocupante no es que tigres haya cado hasta el sexto lugar de la general lo alarmante es que efectivamente merece estar ah y al paso que vamos no me sorprendera que chivas y hasta cruz azul terminen por rebasarlo pero todo bien jugado dira el jefe
2220,62862,ver jugar a las chivas mujeres me da vida
2221,62863,me siento muy enojado por la humillacin y arrastrada que nos puso el amrica en nuestra propia casa y como siempre mis chivas y los jugadores sin meter las manos no jugaron a nada no sienten la playera no la aman les pesa mucho jugar clsicos ligamx clasiconacional
2222,62864,mi novia public esto resulta que chivas pierde y hoy nos metieron la goleada de nuestras vidas en la campesina
2223,62865,toda la aficin de chivas femenil ya saquen al pato necesitamos dt por favoor la liga pato eres el jugador del partido
