,Id,Tweet
1068,4250,y los levitas se purificaron y lavaron sus vestidos y aarn los ofreci en ofrenda delante de jehov e hizo aarn expiacin por ellos para purificarlos nmeros 8 21
1069,4251,y moiss y aarn y toda la congregacin de los hijos de israel hicieron con los levitas conforme a todas las cosas que mand jehov a moiss acerca de los levitas as hicieron con ellos los hijos de israel nmeros 8 20
1070,4252,por ms que mientan no se convierte en verdad
1071,4253,candela y el paso de la motosierra no m hace falta nada mas cuando suena flying free
1072,4254,alonso 2023 es un si
1073,4255,y he tomado a los levitas en lugar de todos los primognitos de los hijos de israel nmeros 8 18
1074,4256,porque mo es todo primognito de entre los hijos de israel as de hombres como de animales desde el da que yo her a todo primognito en la tierra de egipto los santifiqu para m nmeros 8 17
1075,4257,porque enteramente me son dedicados a m los levitas de entre los hijos de israel en lugar de todo primer nacido los he tomado para m en lugar de los primognitos de todos los hijos de israel nmeros 8 16
1076,4258,a ver si hacen algo porque en mariano roque alonso parece estamos acfalos y en total desidia munidemariano karolinaranda
1077,4259,despus de eso vendrn los levitas a ministrar en el tabernculo de reunin sern purificados y los ofrecers en ofrenda nmeros 8 15
1078,4260,y presentars a los levitas delante de aarn y delante de sus hijos y los ofrecers en ofrenda a jehov as apartars a los levitas de entre los hijos de israel y sern mos los levitas nmeros 8 13 14
1079,4261,el teamasere supo lograr la unidad y cohesin en el grupo regalando alegra y esperanza al pueblo
1080,4262,y los levitas pondrn sus manos sobre las cabezas de los novillos y ofrecers el uno por expiacin y el otro en holocausto a jehov para hacer expiacin por los levitas nmeros 8 12
1081,4263,y cuando hayas acercado a los levitas delante de jehov pondrn los hijos de israel sus manos sobre los levitas y ofrecer aarn los levitas delante de jehov en ofrenda de los hijos de israel y servirn en el ministerio de jehov nmeros 8 10 11
1082,4264,luego tomarn un novillo con su ofrenda de flor de harina amasada con aceite y tomars otro novillo para expiacin y hars que los levitas se acerquen delante del tabernculo de reunin y reunirs a toda la congregacin de los hijos de israel nmeros 8 8 9
1083,4265,como nos jodieron el partido en este gol anulado
1084,4266,as hars para expiacin por ellos roca sobre ellos el agua de la expiacin y haz pasar la navaja sobre todo su cuerpo y lavarn sus vestidos y sern purificados nmeros 8 7
1085,4267,tambin jehov habl a moiss diciendo toma a los levitas de entre los hijos de israel y haz expiacin por ellos nmeros 8 5 6
1086,4268,el lo de la fia con la sancin a fernando alonso tras la carrera en arabia saud tuvo a dos pilotos celebrando el podio el asturiano se subi junto a verstappen y prez pero el trofeo terminara en manos de george russell despus de que los 10 segundos
1087,4269,y esta era la hechura del candelero de oro labrado a martillo desde su pie hasta sus flores era labrado a martillo conforme al modelo que jehov mostr a moiss as hizo el candelero nmeros 8 4
1088,4270,y aarn lo hizo as encendi hacia la parte anterior del candelero sus lmparas como jehov lo mand a moiss nmeros 8 3
1089,4271,por que yo me doy tan mala vida por los dems y me preocupo tanto por los dems si nadie lo hace por mi
1090,4272,habl jehov a moiss diciendo habla a aarn y dile cuando enciendas las lmparas las siete lmparas alumbrarn hacia adelante del candelero nmeros 8 1 2
1091,4273,pedazo de temon let her go
1092,4274,cundo es el congreso federal del ppopular obviamente con la asistencia de ugt comunica ccoo y sanchezcastejon
1093,4275,desnutricion relacionada con la enfermedad deteccin y manejo
1094,4276,pues ojal el que sea de los 3 como entrenador para m el mejor es tuchel pochettino me gusta mucho tambin y el caracter y la profesionalidad de xabi alonso siempre va a ser bien recibida en mi corazn xabi alonso con arbeloa de segundo y a la guerra con ellos
1095,4277,podcast gp arabia saud as le devolvieron el podio a alonso
1096,4278,non hai premio mis merecido xornalista top e programa top ningun coida aos nosos olmpicos mis co gran tonilopezgarci1 parabns toni
1097,4279,para los que mienten ana rosa y sus aclitos
1098,4280,victoria alonso se fue o la fueron de marvel luego de 20 aos no hay motivos an que ser
1099,4281,la cosa ha llegado a tal nivel que los tweets de nanosecso los podra subir perfectamente alonso
1100,4282,la corrupcin hizo metstasis no hay un enfermo de cncer es una pandemia
1101,4283,lo que pas la semana pasada se explicar en los libros de historia de la humanidad al tiempo nada volver a ser como antes
1102,4284,noche ochenteraaa toda la noche enteraa toda la noche entera era eeeeh
1103,4285,verstappen lder del ranking de pilotos en redes alonso sexto
1104,4286,antes 173 63 ahora 156 45 10 agv e2205 k1 solid casco moto integral hombre negro mate s gavi carvajal benzema alonso mendilibar elclasico primavera
1105,4287,yo entiendo que estas declaraciones son para que el fantico no deje de lado la f1 pero la verdad es que red bull est en un nivel superlativo ayer desde que max pas a alonso no hubo ms carrera
1106,4288,tengo que aprender a poner lmites
1107,4289,antes 173 63 ahora 156 45 10 agv e2205 k1 solid casco moto integral hombre negro mate s gavi carvajal benzema alonso mendilibar elclasico primavera
1108,4290,los cien podios de fernando alonso
1109,4291,acaba un primer fin de semana intenso d precampaa seguiremos con ganas sin dejar d recorrer una calle d majadahonda ni d ver a cualquier vecino q lo demande ni asociacin sin visitar gracias lola moreno y ppmajadahonda por confiar en m xa dirigir la campaa vamos
1110,4292,datos detallados del ritmo de carrera mostrado por los pilotos en el gp de arabia saud este fue el ritmo de los cinco equipos notablemente ms rpidos en 2023 93 48 prez 0 37 verstappen 0 56 alonso 0 80 russell 1 05 sainz 1 16 hamilton
1111,4293,mis top pilotos a da de hoy alonso clarsimamente despus verstappen poquito por delante de russell stroll aqu me aparece norris leclerc no lo s en que orden yo pongo por delante a sainz y a partir de aqu piastri yuki
1112,4294,marvel victoria alonso deja marvelstudios
1113,4295,nugget alonso despus de un bao
1114,4296,que se publica mucho afirma mientras promociona su ltimo libro
1115,4297,ahora antonio mohamed diego alonso y ariel holan estn descartados recientemente holan dijo que no que no puede salir ahora mismo de u catlica maana habr una reunin con el representante de guede para llegar a un acuerdo con independiente
1116,4298,ayy ya quiero escuchar heart attack rock version
1117,4299,mercedes aceptando con deportividad que la sancin est mal y que por tanto le devuelven el merecido podio a alonso los alonsistas forofos haciendo el unga unga contra los que se llevaron 8 mundiales seguidos muy atleti esa mentalidad la verdad y ahora pues venid a por m
1118,4300,hoy nuevamente vi el mural y me acerque para ver de qu se trataba la obra y es una pieza que que reconoce la historia el compromiso con los derechos humanos memoria justicia verdad y garantas de no repeticin segn lo que indica el qr de la placa en el metrodesantiago
1119,4301,leo sobre la salida de victoria alonso de marvel studios y dado que no sabemos si se ha ido porque le ha conseguido un trabajo mejor en otra parte o disney marvel la ha invitado a salir no tengo una opinin
1120,4302,chile el nico pas donde todos hablan de la falta de educacin financiera y al mismo tiempo dicen que la gente puede invertir mejor su plata que las afp
1121,4303,alonso lidera la carrera toni
1122,4304,no llamemos a no votar llamemos a pensar que las elecciones ni siquiera son una fraccin de nuestra potencia poltica y luego entonces a pensar sobre la efectividad misma de las elecciones
1123,4305,sorprendentes noticias llegan desde hollywood con la novedad de que victoria alonso abandona marvel studios despus de ser parte desde sus inicios
1124,4306,apoyo total al teamasere la capital en representacin de las dems pronuncias les di el recibimiento a los campeones mejoresposible
1125,4307,el da que fernando alonso daz y estos seores se retiren de comentaristas dejar de ver la f1
1126,4308,yo slo busco a alguien que me quiera lo mismo que los mecnicos de aston martin quieren a alonso
1127,4309,hoy tenemos a sexo maana tendremos a cacho universitario
1128,4310,des d quan fernando alonso s guapo estresada
1129,4311,se termino la era woke en marvel studios victoria alonso afuera del mcu de marvel disney luego del fracaso de fas a travs de youtube
1130,4312,sumado a holan diego alonso y el turco mohamed le dijeron que no tambin a independiente todos por compromisos el ms fuerte que puede agarrar es guede en donde maana se juntara la cd con su representante
1131,4313,marvel studios veteran producer victoria alonso exits via variety
1132,4314,vergenza vecinos realizan bache tour en las deterioradas calles de mariano roque alonso repudian la inaccin de las autoridades municipales ante la solicitud de reparacin de las principales arterias en la ciudad npy
1133,4315,antes 1219 ahora 975 20 apple ordenador porta til macbook air 2020 chip m1 pantalla retina de 13 pulgadas 8 gb de ram ssd de gavi carvajal benzema alonso mendilibar elclasico primavera
1134,4316,se fue victoria alonso de marvel cada vez ms lejos la posibilidad de ver a peter lanzani en el mcu
1135,4317,esos mercenarios no tienen principios siempre van a apoyar al que mejor les pague no les importa sus races ni la formacin que la revolucin les di todas esas payasadas es para poder subsistir dejando de ser por tener
1136,4318,su condena que se la compre quien le crea apoco la ministra presidenta es una adversaria el ejecutivo tiene que vencer a la corte o a su titular de plano pero bueno ac le siguen diciendo el presidente ms humanista de la historia
1137,4319,con ganas e ilusionpormajadahonda seguimos
1138,4320,vean blue lock de nada
1139,4321,estas fallas 10 10
1140,4322,casi hace la pole con un tractor y no la pudo hacer porque fue saboteado no me quiero imaginar lo que puede hacer con el aston martin dejarme soar
1141,4323,ahora mismo estoy entre tuchel y xabi alonso no saba el temporadon d xabi
1142,4324,cmo que victoria alonso se fue de marvel
1143,4325,pq coo t tienes q ir
1144,4326,marvel studios veteran producer victoria alonso exits va variety
1145,4327,la productora argentina victoria alonso deja marvel studios luego de 17 aos
1146,4328,puentecito
1147,4329,toda la gente que sale a frentear a la posta de forma pasivo agresiva nunca entendi el concepto de libertad de prensa y lo peor es que van a ser causantes de que un futuro gobierno de izquierda reintroduzca mecanismos de censura previa
1148,4330,bueno compaero entregu el pasaporte tambin demasiadas piedras trae ese ro
1149,4331,ayer un podio hoy una victoria semana ajetreada para los alonso del mundo
1150,4332,victoria alonso la mujer ms poderosa de marvel studios deja la compaa tras casi dos dcadas gt
1151,4333,ooohh fernando alonso me salen unas lagrimas de emocin f12023
1152,4334,vaya tiempo bueno que hemos tenido este finde familia finde excursin lunes picture pictureoftheday photo photography foto
1153,4335,no estara tan seguro porque pesa mucho el tema de que alonso sea espaol por nuestra parte porque tener a stroll ah arriba marcandose tremendos carrerones que nadie esperaba que fuera hacer obviamente no sera igual pero estara ah por ver hasta donde consigue llegar
1154,4336,de acuerdo con the hollywood reporter victoria alonso productora ejecutiva en marvelstudios que particip en todas las pelculas hasta la fecha deja la empresa por motivos desconocidos cmo afectar esto a las prximas pelculas marvel studios
1155,4337,los que festejan la salida de victoria alonso de marvel studios diciendo que es una buena noticia para los desarrolladores de vfx son muy pelotudos la explotacin que sufren estos trabajadores no reconocidos por industria no est determinada exclusivamente por gente de marvel
1156,4338,esta noticia me entristece
1157,4339,esta camiseta es de un tal alonso sabis quien puede ser no me suena
1158,4340,y esto es lo que pasa cuando la f1 es tendencia y la gente que no tiene ni idea se quiere aprovechar
1159,4341,se fue victoria alonso de marvel
1160,4342,dt antonio mohamed diego alonso y ariel holan estn descartados se hizo el intento por los 3 y por compromisos no agarran independiente holan directamente habl con doman y le explic que no puede salir ahora de catlica maana reunin con el repre de guede
1161,4343,descubriendo en el da de hoy que en shein tienen lencera preciosa claro tiene muchsimo sentido
1162,4344,a menos de 1 hora para el partido ya deben estar saliendo de la capital regional superrangerino con el fernando alonso del maule javierescanilla
1163,4345,el equilibrio tras lo de victoria alonso viene con un trailer de secret invasion y fecha de estreno no
1164,4346,te interesa
1165,4347,fernando alonso pudo perder el tercer puesto por uno de sus mecnicos pero el rencor del espaol es 0
1166,4348,no se que onda pero so que fernando alonso y yo salamos jajajajajaja dnde qued carlos sainz querido subconsciente
1167,4349,oficial bajas para el open de paraguay wptparaguaopen paco tello bela sanyo leal sanz ramrez cardona maxi campagnolo moyano gil coki lima alonso esbr bergamini ruiz ruiz rico del castillo bentez
1168,4350,a donald por putas y lvaro ni por el putas para cundo auv trump podra ser imputado en nueva york tan pronto como el lunes poltico via larepublica co
1169,4351,el grupo de guas y scouts de nuestro colegio grupoggs iae invita a reunin informativa ampliada a todos los padres de los estudiantes que este ao sern parte del movimiento los esperamos este mircoles 22 de agosto a las 18 30 horas en el sa
1170,4352,ainsa sin filtros familia lunes picture pictureoftheday photography photo foto
1171,4353,checo chucho prez lleva 4 victorias en 3 aos con el mejor coche por 4 victorias en 70 carreras tengo que aguantar en mi tl e incluso en comentarios a chuchistas decir es que checo es mucho mejor que alonso iros a t0mar por cvlo y c0merme el rbo pesados de los c0j0nes
1172,4354,ao 2025 mircoles 16 de mayo vuelta de las semifinales de la uefa champions league madrid vs bara el bernabu xavi hernndez vs xabi alonso en los banquillos 0 3 para los azulgranas el bara vuelve a una final de champions 10 aos despus el futbol vuelve a sonrer
1173,4355,sacrificandome x mi hija que quera a batman
1174,4356,el gobierno de primero los pobres con segalmex le estn robando el dinero del presupuesto pblico dispuesto para apoyar a los ms pobres ovalle debe ser investigado y llevado a juicio eso de que lo engaaron unos priistas maosos es una cortina de humo para protegerlo
1175,4357,me picha luego que toda la ropa sea chiquita 116 de teta vos pensas que el talle nico es para mi no verdad
1176,4358,pareciera que llegaron a tomarse un cafecito y nada ms
1177,4359,diego alonso y el to holan agradecen el inters pero no
1178,4360,comienza la cuenta regresiva para la eleccin a candidato del snte51 el mtro juan daz de len rivera acompaado del mtro luis alonso rodrguez presenta a los integrantes de su planilla asegura acabar con la corrupcin y arbitrariedades magisteriales planillaroja
1179,4361,la argentina victoria alonso presidenta de contenidos de marvellatam renuncia a su cargo y deja la empresa
1180,4362,victoria alonso una de las mentes pensantes del ucm deja marvel
1181,4363,te queremos mucho victoria alonso gracias x tanto
1182,4364,las inconsistencias de los comisarios de la f1 si existe un reglamento por que no lo cumplen lo de alonso era sancionable pero como a otros no los han sancionado por el mismo motivo se le devuelve el 3er lugar circo y mas circo
1183,4365,todos estamos contentos con la actuacin de fernando alonso y aston martin pero tambin debemos enfocarnos en ferrari y carlitos est claro que carlos no est pasando por un gran momento no sabemos que les est pasando a los ferrari pero carlos necesita nuestro apoyo
1184,4366,suena victoria alonso para dirigir a independiente fabin doman ya se habra comunicado con ella ampliaremos
1185,4367,mira sandracuevas
1186,4368,felicidadesssssssssssss jugador alonso meana alonso meana deseamos que ests disfrutando de este da tan especial salud cumple y
1187,4369,nos vamos a tragar a rulo pero el ideal es x alonso
1188,4370,bombazo victoria alonso vicepresidenta de marvel studios ha abandonado el estudio lleva produciendo pelis de marvel desde iron man marvelstudios
1189,4371,pues si de verdad no pensabas como los de las capturas es que llevas muy poquito apoyando a alonso lo normal era no creer
1190,4372,que dices ryuk 1921 tu club est en segunda y alonso est tercero precisamente para rerte no ests
1191,4373,en un caso hipottico tuchel mourinho o xabi alonso son los mejores candidatos bancan sheat
1192,4374,que ganitas de ver a xabi alonso dirigiendo al madrid
1193,4375,que pecha de filtros chacho
1194,4376,el cm de aston martin es fernando alonso no tengo pruebas pero tampoco dudas
1195,4377,este nuestra constitucin prohbe expresamente el desarrollo de la energa nuclear y de los transgnicos hasta el nashi quiso revisar eso en su momento
1196,4378,don fernando alonso
1197,4379,marvel se queda sin la latina ms poderosa victoria alonso deja la plana ejecutiva
1198,4380,es increble como la ilusin por la frmula 1 ha vuelto a despertar alonso con un chocheras competitivo siendo el primero del resto an lejos de red bull en las siguientes carreras irn llegando las mejoras para los equipos y seguro que todo cambiar
1199,4381,alonso
1200,4382,mi vida
1201,4383,arajo es una baja muy sensible creo que debe ir de central kounde con christensen aunque podra ir marcos alonso que ha respondido bien en la defensiva
1202,4384,un poco repentino lo de victoria alonso pero si es verdad que era muy agresiva con los estudios de vfx y el proceso de posproduccin no me sorprende demasiado evidentemente presionarles demasiado no ha funcionado y las consecuencias se iban a ver ms pronto que tarde
1203,4385,directo debate de la mocin de censura a travs de youtube
1204,4386,gobierno responde por lapidario informe sobre traslado de droga en puerto de san antonio se ha reforzado el trabajo inoticiascl nacional meganoticias chile alonso josh tyler drake sergiroberto geniusdancerhyunjin monsa
1205,4387,guaton conchetumare malo que se vaya luego
1206,4388,jajaja estoy oyendo en la tele ha ganao macron qu va a pasar aqui tamames for president
1207,4389,los luchones hacen una cosa y ya pretenden ser los padres del ao me hacen rer el ano
1208,4390,mxico nos necesita unidos presidente ya deje la maanera y pngase a trabajar y resolver los problemas del pas
1209,4391,ahora la productora argentina victoria alonso dej marvel luego de 17 aos
1210,4392,no podemos despedir el da sin felicitar por su cumpleaos a nuestro jugador del leb plata alonso meana esperamos que hayas pasado un buen da
1211,4393,maana martes 21 de marzo se conmemora en todo el mundo el da mundial del sndrome de down con el objetivo de generar mayor conciencia respecto del valor de la diversidad y la inclusin social de personas con esta condicin nuestro departamento de co
1212,4394,estn buenos sus controles de seguridad yo ni su cliente soy bbva mex
1213,4395,porque los padres no llevan a sus hijos a las pequeas empresas para que los enseen un oficio ayudando al autnomo con la seguridad social como la sociedad no espabile estamos kao
1214,4396,en mi opinin mourinho tuchel xabi alonso pochettino ral
1215,4397,sube el volumen y olvida lo feo eo cuando yo te diga put your hands up high
1216,4398,me la pela victoria alonso me apena david f sandberg
1217,4399,soc jo pareu per favor
1218,4400,un alonso feliz para una vida feliz te amo pequeo gigante
1219,4401,indy autonomous challenge la futura competencia para alonso y compaa
1220,4402,no s dnde est el nivel entre wrc y f1 rovanpera neuville alonso perez ogier hamilton eville katasuka etc etc
1221,4403,alonso firma uno de sus mejores inicos de temporada o quizs el mejor si tenemos en cuenta donde esraba aston martin y la superioridad del red bull
1222,4404,mi favorito sera tchel y que despus de unos aos le sustituyera xabi alonso van a subir a ral y vete t a saber a quin ponen despus a pochettino mismo
1223,4405,victoria alonso deja marvel con su salida marvel pierda a una de sus lderes principales durante 17 aos ella fue la responsable de muchos de los productos del mcu a ella le debemos muchsimo gracias por todo
1224,4406,victoria alonso una de las mximas responsables del mcu deja marvel tras 17 aos como directiva opiniones
1225,4407,la productora argentina victoria alonso dejar marvel despus de 17 aos en 2021 haba sido ascendida a presidenta de posproduccin efectos visuales y animacin
1226,4408,necesito dormr 1 semana entera
1227,4409,si el var hubiera validado el gol de asensio el realmadrid dira que de los rbitros no opinan y que hay que respetar su decisin como el var no valid el gol de asensio pues tenemos estos titulares la historia interminable con este club
1228,4410,troleo de alonso a rusell despus de recuperar el tercer puesto que le haba robado mercedes
1229,4411,la pereza baja el nivel de agotamiento
1230,4412,de esas opciones ral pero si no me quedo con xabi alonso y de segundo arbeloa
1231,4413,prendimos hay mundialito de lollapalooza 2023 y arrancamos charlando sobre la salida de victoria alonso de marvel la argentina que estuvo ah desde el inicio de todo el mcu
1232,4414,todos fuimos xabi alonso 10
1233,4415,eso es porque tenemos a un becario de preparador fsico que el nico mrito en su carrera es ser hermano de xavi
1234,4416,facundo alonso debut en su nueva categora con dos triunfos
1235,4417,a kant le parecera barato
1236,4418,lo sabamos y lo volvemos a confirmar
1237,4419,felicidades a ti pachito alonso y sus kini kini a travs de youtube
1238,4420,no se si reir o llorar de risa
1239,4421,100 podios para fernando alonso en la mxima categora f1
1240,4422,t amo ms q a mi ex
1241,4423,te busco en mis sueos y te veo sonriendo
1242,4424,yo cuando sea microbilogo jajaja
1243,4425,el detallazo de alonso que ya coment
1244,4426,ojo a la degradacin de la gestin de aena en el aeropuerto de vigo puede terminar alcanzando lmites vergonzantes atentos que puede ir a peor
1245,4427,alonso herrera trejo te comparte la informacin ms destacada del edomx en amxnoticias conctateconlaradio sintonzanos por todas nuestras emisoras
1246,4428,2a 4c 3a 1verdadero realmadridconecta
1247,4429,lo deca nanosecso llegamos a imola minimizando daos con verstappen y prez el redbull es tremendamente rpido pero alonso es capaz de hacer lo imposible un 2012 max es muy rpido pero prez parece que no est tan lejos se pueden repartir victorias y tener algun lo soad
1248,4430,otro legado cultural del kirchnerismo facho que hay que dar vuelta el escrache y el ataque a la libertad de pensamiento felicito a los que dan pelea por sus ideas con libertad como somoslibressoc
1249,4431,esto es una noticia mucho ms mala de lo que parece victoria alonso es la que ms ha luchado por la diversidad y la inclusin en el mcu ahora que se ha ido a saber qu pasa
1250,4432,voy a intentar prolongar el contrato de alonso un ao ms me va a pedir una barbaridad pero me la pela
1251,4433,su mercedes todava le llora jajajajaja
1252,4434,me gustara empezar a leer como usan este modelo davinci en clusters en produccin
1253,4435,que victoria alonso queeeeee diganme que es mentira
1254,4436,la salida de victoria alonso nos reitera que marvel studios est teniendo un declive bastante fuerte
1255,4437,del socialismo lbranos seor y hazme un hombre libre con una fe inquebrantable capaz de luchar por sus sueos
1256,4438,el primer wiseman que vi fue nationalgallery tres horas de arte mitologa y observacin que nos hicieron entrar en trance el tiempo en sus documentales tiene una dimensin espiritual
1257,4439,video de alonso gallardo seor borrell estallaron masivas protestas en el pas de las franjas azul blanca y roja excelente saba que tarde o temprano las sanciones quebraran a rusia las franjas azul blanca y roja pero verticales seor borrell
1258,4440,victoria alonso productora ejecutiva de marvel studios ha renunciado a su cargo de forma inmediata se desconocen las razones la verdad es que sorprende muchsimo esto
1259,4441,fernando alonso es un crack enhorabuena
1260,4442,kjjjjjjjjjjjjjj chiquito preocupate primero por cubrir bien el primer palo de boca lcdtm
1261,4443,la noche de anoche fue tan
1262,4444,me gustaria ral o xabi alonso
1263,4445,el baile de sanciones con fernando alonso el cabreo de leclerc con ferrari la ignorancia de verstappen las carreras en jeddah siempre traen historias y victorabadf1 te va a desvelar todo lo que no has visto preparado para un nuevo cdigo f1 pues corre ya a dazn
1264,4446,a valtteri en mercedes le destrozaron psicolgicamente desde esa noche se le nota muchsimo ms feliz
1265,4447,era re obvio igual que la iban a usar de chivo a victoria alonso
1266,4448,antes de que empezase el saudiarabiangp fernando alonso alo oficial dijo que max33verstappen lo adelantara en la vuelta 25 verstappen en el previo dijo que intentara hacerlo mejor lo adelant en la vuelta 25 ms sabe el diablo por viejo
1267,4449,aprovecho que despidieron a esa seora alonso de marvel para contarles que no vi ni una sola pelicula del mcu ni una vi una de spiderman esa con willem dafoe pero creo que no pertenece al universo de superheroes
1268,4450,noticias victoria alonso una de las productoras ejecutivas ms importantes y vicepresidenta de marvelstudios ha dejado la compaa se desconoce el motivo de su separacin
