,Id,Tweet
0,93259,le tengo una envidia enorme a las personas que tienen a shenhe cuando yo no voy a poder tirar por ella porque se me olvid ahorrar
1,93260,sufrir en shenhe lover pero ayaya lover
2,93261,no tengo deseos pa tirar x shenhe eto pasa x rehabilitarse
3,93262,con los artefactos de ganyu y su espada al nivel 1
4,93263,mi mika acaba de curar 6k por coso
5,93264,mi shenhe al 70 con dos artefactos sin subir si
6,93265,x quien tiro en mi main mgta ms shenhe k ayaka pero no tengo cryo
7,93266,llego a casa y tiro or shenhe
8,93267,algn sabe q build es para shenhe es q no pens q si m iba a salir y no tengo nada para ella
9,93268,voy a lanzar un poco por shenhe y me duermo
10,93269,ha pasado algo con shenhe en el genshin
11,93270,tengo 20 deseos para shenhe god
12,93271,pueden creer q consegu hu tao c1 homa yelan aqua y ahora shenhe ahorrar por medio ao vali la pena
13,93272,tengo 7 deseos ustedes dicen q llega shenhe
14,93273,todava no tire por shenhe pero ya me tiembla la mano
15,93274,voy a coronar a shenhe se acab
16,93275,os thomato ali
17,93276,no tengo nada para subir a shenhe auxilio
18,93277,quera a shenhe pero quien quiere mi segunda mistsplitter
19,93278,espero que sepis que si a alguno os toca shenhe que yo no me entere que aparezco en vuestra casa
20,93279,que ganas de tirar por shenhe aaaaaaaa
21,93280,genshinimapact ya sali shenhe y aunque no la consigue voy a hacer la prueba de personaje y solo puedo decir
22,93281,bueno ahora mi siguiente en la wish list es heizou c6 mika c6 y el alcn de jade para xiao
23,93282,me salio ayaka pero me toco el arma de shenhe me quiero morir
24,93283,acabo de ganar el 50 50 con shenhe vamoooos que feliz soy
25,93284,m quiero unir al mundo d alguien random para hacer las diarias pq quiero amistad doble para shenhe y mika pero m da vergenza socorro por favor
26,93285,seguir reuniendo por baizhu o lanzar por la c1 de shenhe y mika ausilio
27,93286,shenhe te amo gracias mi reina dios que feliz soy
28,93287,ayaka y shenhe en casa
29,93288,chicos aydenme quiero a nahida pero quiero a shenhe tambin
30,93289,aguanta puedo ponerle la mitsplitter aqu
31,93290,quiero tirar por mika pero tengo el asegurado y quiero a baizhu aunque me encanta shenhe pero necesito un dendro que sea 5
32,93291,ayaka vino en pity 73 y 70 deseos dsp tdv no vino shenhe toy chillando q mala suerte
33,93292,shenhe asegurada obtenida lt 3333333333333333 y aunque fui hasta las 70 tambien salieron 3 mikas megusta messirve umu xd
34,93293,voy a tirar en el banner de shenhe aunque no tenga cryos dps adis no soport
35,93294,a m no m van a convencer de poner a rosaria en vez de shenhe shenhe es hot y es lo nico q me interesa x algo tir x ella
36,93295,la idea era conseguir la mistsplitter y a shenhe pero termin sin ninguna aaaa jueguito de mierda estoy de mal humor
37,93296,no era el arma qu quera pero bueno shenhe gana en esta
38,93297,to todo cagado shenhe genshinimpact
39,93298,me sali shenhe vamooo lpm dios est de mi lado
40,93299,m sali shenhe con el 50 50 y 41 de pity s eme salio el xoraozn
41,93300,alerta alerta no me sali shenhe
42,93301,quiero tirar por shenhe pero tengo asegurado en la cuenta principal y en la secundaria guardo para kokomi
43,93302,yo sacando a shenhe en dos cuentas distintas
44,93303,quiere shenhe pero hace tres banners que saqu sin asegurado y la ante semana pasada saque a dehya ustedes dicen que me sale
45,93304,me niego a tirar ms porque no quiero a shenhe y tengo 5 de banner asegurado
46,93305,como coo voy a conseguir tantos deseos para shenhe c1 cuando ya tengo todo al 100 me mato
47,93306,akaya shenhe diluc c4 tignari c2 mika c6 el reflejo de las tinieblas y la pacificadora del desastre ganando el 50 50 con ambas armas he gastado muchas muchsimas protogemas pero ha merecido la pena
48,93307,esto fue 20 pity despues de shenhe btwwww plsssss
49,93308,ya sali shenhe y todava no me abre el genshin
50,93309,dato random para olvidar que no saqu a shenhe mi pap una vez quiso escribir en papel con el lapiz de mi tablet porque pens que era un marcador
51,93310,le tire los 20 deseos que me sobraron a shenhe pero me salio este pelotudo hdp nunca antes habia tenido tanta sierte como para que me la cague este loco
52,93311,quiero a shenhe pero no tengo ningn dps cryo
53,93312,ya lancen rerun de albedo hoyoverso de mrd quiero tirar por shenhe pero el no tener a albedo y el miedo a que venga cuando menos me lo espere me impide ser feliz aaaa
54,93313,yo no puedo creer que el hijo de puta de mi hermano tiro por yelan y la saco ahora tiro por shenhe y la saco y perdi el 50 50 as que su prximo 5 lo tiene asegurado
55,93314,ojal mnsalga shenhe
56,93315,en el 1 obvio
57,93316,joder quiero tirar por mika pero estoy en pity 63 con asegurado y no quiero ni a shenhe ni ayaka
58,93317,vamoo gan el 50 50 grande shenhe
59,93318,tenia 184 deseos y ahora tengo 48 pero consegui a shenhe
60,93319,yo s que voy a ser shenhe haver
61,93320,shenhe rerun pero a que costo
62,93321,tengo c6 sucrose c6 diona hasta c6 mika pero no shenhe
63,93322,se pudo falta shenhe shenhe me sale en los primeros 30 deseos
64,93323,me ha salido tignari en el banner de shenhe
65,93324,lloro de risa queria la de ayaka nomas pero me salio la de shenhe en 10 de pity cjkajdkas y la de ayaka en 20
66,93325,buenas noticias se logr 70 deseos cost traerla pero ahora tengo a shenhe y mika c3
67,93326,estoy que me muero me sali shenhe y con c1 aaahh
68,93327,me sali shenhe y 6 mikas mandlmeldmmd
69,93328,si ayaka tuviera el atuendo de shenhe en vez de la armadura no me la pensara 2 veces en gastar todo a por ella
70,93329,mi pareja consigui a ayala y shenhe en 30 deseos no tena asegurados as o ms ojete
71,93330,yahooo
72,93331,pensaba en sacar a la shenhe pero pah que solo la llevara con ayaka y su rol ya lo hace kazuha ms ahorros para himeko c6r5
73,93332,shenhe no vino a casita
74,93333,sigo sufriendo
75,93334,consegui tignari y shenhe con 100 tiradas pero me quede a un mika del c6 pipipipi
76,93335,grite cuando me salio shenhe
77,93336,pude sacar a shenhe y a mika y ahora tengo como 40 deseos para kaveh 3
78,93337,no sali shenhe pero tengo asegurado y ms o menos 30 de pity
79,93338,he visto q era las 12 y no me he aguantado y aun no me lo puedo creer llevaba 2 pitys ganados y estaba convencida que no iba conseguir a shenhe y por si fuera poco tire dos timidillas al de armas y me toc su arma
80,93339,no me sali shenhe nadie me hable
81,93340,chiquillos llegu a mi casa hora fe shenhe
82,93341,buah conseguir a shenhe me ha hecho pensar y ara a por quin voy como dije anteriormente ayaka y zhongli me los dejar los ltimos a menos que la situacin me exija un cambio so
83,93342,quin me regala a shenhe tengo ganas de llorar
84,93343,como vea una persona ms diciendo que ha conseguido a shenhe early me voy
85,93344,bueno chau hasta ke no tenga a shenhe no tuiteo mas odio hate masivo
86,93345,shenhe y mistsplitter en la misma noche esto es un sueo hecho realidad
87,93346,y tras 20 deseos de salir tignari salio shenhe yaaaaas
88,93347,encima tengo una bronca porque me sali el arma de shenhe y me quede sin deseos pero con asegurado y sin ganas de farmear protos
89,93348,perd el 50 con keqing c2 pero shenhe me vino luego de 40 tiros c2 mika total de wishes gastados 101
90,93349,se imaginan perderse la oportunidad de tirar por shenhe o ayaka en genshin yo me pongo a llorar porque son altas diosas
91,93350,hubo fe
92,93351,chequea como se menea myblvdxingqiu
93,93352,es en shenhe ven a mi eventos de la 3 5 parte 2 papus tiktok twitter ig
94,93353,no pienso tirar x ayaka ni por shenhe tengo un marido que obtener mas adelante kaveh
95,93354,quiero a shenhe pero quiero armas pq no tengo peroperoperopero
96,93355,tengo a todos los cryo hagamos como q layla no existe
97,93356,donde esta mi shenhe 1
98,93357,al fin que bonito es tenerla la ptm shenhe genshinimpact yelan
99,93358,sirvi el ritual para ganar el 50 50 shenhe genshin ps4share
100,93359,me sali shenhe ahora soy finalmente feliz
101,93360,me sali tambin la arma de shenhe acaso ser una seal para que tire por ella no
102,93361,me gast todo y ni la consegu encima tampoco voy a tener a shenhe
103,93362,he renacido cmo shenhe main despus de hacer sido hu tao main x tres semanas
104,93363,tengo a shenhe c1 asegurada pero de donde coo me saco yo 60 deseos mas aaaaaaah me voy a matar
105,93364,ahora yo como voy a irme a pegarle a los lagartos para yae y shenhe
106,93365,solo tengo 20 deseos para mami shenhe creo que le har skip e ir por nahida
107,93366,shenhe siempre fue mi personaje fav y la estuve esperando demasiado e igualmente perd el 50 50
108,93367,estoy pensando seriamente en meter plata al genshin para shenhe no puedo quedarme sin ella
109,93368,estoy sufriendo
110,93369,perd el 50 50 de shenhe me quiero morir
111,93370,hoy banner de ayaka shenhe 5 y mika 4 salen gachapones
112,93371,sacando a mika y shenhe
113,93372,vamooooooooooooooh genshinimpact shenhe
114,93373,tengo a shenhe
115,93374,yo despus de que no me saliera shenhe en los 5 deseos que tena
116,93375,shenhe te quero
117,93376,y perd el 50 50 con qiqi pero no m importa pq igual no quera a shenhe ni a ayaka 3
118,93377,keria el arma d ayaka pero tengo a shenhe as q m sirveee
119,93378,si no me sale shenhe en este 50 50 voy a chillar
120,93379,sigo flipando que me haya tocado a shenhe y su arma me haya tocado dos veces
121,93380,me sali shenhe ok
122,93381,bueno voy a tirar por shenhe
123,93382,no me sale shenhe pipipi mis 65 deceos pipipi
124,93383,bueno es mejor favonius o pacoficadora en shenhe x ah vi que decan que era mejor favonius pero no s de meta
125,93384,y estos randoms
126,93385,buenas suerte a los que andan tirando en los banners de ayaka shenhe y mika
127,93386,shenhe vino a casa
128,93387,es buen momento para flexear que tengo a shenhe desde el da 1 nunca pens que se volvera parte de mi equipo principal
129,93388,m sali re temprano shenhe eso significa que tendr para nilou
130,93389,alguien me simpea protogemas para la c1 de shenhe hahah
131,93390,mood por que mis deseos por shenhe fueron literal horribles jaja genshinimpact shenhe
132,93391,se vienen los madrazos
133,93392,47 deseos y no sali shenhe
134,93393,lanc todo lo que tena por shenhe y no vino chillo
135,93394,eleccin de directiva
136,93395,que mala sos shenhe pq sos as conmigo
137,93396,nuevo fijado shenhe te amo mucho
138,93397,me sali shenhe con los pocos deseos que me quedaban estoy muy feliz todo esta saliendo bien hoy
139,93398,ya esta shenhe k miedo
140,93399,medio rara mi shenhe c1
141,93400,hora de farmearle pity a baizhu tirando en el banner de shenhe
142,93401,ascendiendo a shenhe mi vida por la gorda
143,93402,20 deseos tengo para ver si viene mika o no miedo terror con que salga shenhe
144,93403,si vinieron a casas lt 33 tkmm mika y shenhe
145,93404,mi shenhe no alcanz los 3k de ataque
146,93405,ni modo me tocar buscar deseos para shenhe
147,93406,mis hijos en casa
148,93407,voy 89 deseos donde esta shenhe
149,93408,mentir mi amiga dijo q vaya por shenhe
150,93409,tengo a shenhe chau genshin ya no quiero nada mas d vos hasta q venga arlecchino
151,93410,se pudoooo
152,93411,quiero tirar x shenhe pq acepte esto ruaaa
153,93412,me vino como en pity 86 dios se me baj la presin
154,93413,quiero llegar a mi casa y tirar por shenhe carajo
155,93414,kskskdkdkekekekkdkrkekekekdkekekekfkkfkdkedkkekekekekekekrkekekekekek mommy socorro t na mo
156,93415,casi ochenta deseos o ms y shenhe no me sale estoy harto
157,93416,voy a tirar 1 deseo a shenhe y que sea lo que dios quiera
158,93417,me sali shenhe sin asegurado y su arma en las primeras diez tiradas
159,93418,momentos como este me hacen odiar el genshin con todo mi corazn 50 deseos y no toco shenhe
160,93419,voy a empezar a tirar por shenhe deseenme suerte
161,93420,bueno ahora ayaka tiene su arma r2 pero yo quera esa lanza para shenhe
162,93421,listo ya tengo a shenhe me queda kokomi y tengo mi team soado lt 3
163,93422,el lokito no m respondio pero para q necesito gente real cndo tengo a shenhe asi o mas virgen soy este
164,93423,yo diciendo q no voy tirar en el banner d shenhe pero ni yo m la creo y tire
165,93424,no me lo creo mi primer doble legendario aaaa shenhe genshinimpact
166,93425,me sali shenhe con diez deseos mika c3 y tengo un 5 asegurado
167,93426,asegurado y con 37 d pity y no me da salido la maldita shenhe
168,93427,ignoren que es mi ig pero shenhe c1 la suerte de no baarse gracias mikakus
169,93428,la verdad nunca pens que me pasara lo del doble legendario y con dos que quera shenhe mona
170,93429,ay hoy sala shenhe vd
171,93430,mi shenhe sali rara
172,93431,no hubo shenhe pero mikaaaaaaaaa ctmmm mi vida
173,93432,bno a ponerme los calzones d la suerte shenhe ya t siento
174,93433,51 d pity no shenhe se hace esperar
175,93434,me salio la c1 de shenhe a las 10 primeras osea me sirve pero quera a nilou y a mika tmb
176,93435,una tirada en el banner de shenhe dudo q salga
177,93436,pude conseguir a shenhe y el arma aunque me quede un poco corto de gemas pero espero que tengan suerte los que van a tirar en el gatcha
178,93437,oigan como que ya salio el banner d shenhe que
179,93438,shenhe vino a casa pero yo no quera que viniera a casa
180,93439,ok y si tiro por shenhe igual yo estoy ahorrando por nahida y kaveh pero es q soy adicta a pullear cuando un personaje me interesa en un 1
181,93440,drops on ar60 se acabaron las dudas lleg la ms tet deseos por shenhe ayaka mika 3 5 genshin impact genshinlmpact genshin twitch twitchtv twitchpartner twitchstreamers twitchaffiliated twitchgaming twitchgamer shenhe ayaka mika
182,93441,la puta madre
183,93442,quise hacer una tirada a ver si me llegaba a salir la espada de ayaka me sali la lanza de shenhe y no tendria problemas si no fue porque no tengo personajes de lanza para usarla todavia tengo un halcon de jade sin usar por eso mismo
184,93443,suerte sacando a shenhe o ayaka yo me veo con un mika c5 al finaliza la noche genshinimpact
185,93444,eliot donde estas tenemos q tirar x shenhe
186,93445,cay shenhe
187,93446,y si tiro por shenhe
188,93447,mi buen amorrrrrf
189,93448,me sobraron 20 deseos y me salio el arma de ayaka
190,93449,no me hablen no me sali shenhe
191,93450,no me aguant y tir unos deseos al banner de shenhe pero obviamente no me sali kasjd
192,93451,me salio shenhe y su arma
193,93452,bueno me gaste mis 60 deseos para kaveh en shenhe y me salieron 7 dionas but at last nahida asegurada
194,93453,me slai shenhe al pity 20 es el mejor da d toda mi vida
195,93454,ya sali el banner de shenhe
196,93455,gane el 50 50 loco
197,93456,primero me sali jean a 10 de pity y luego shenhe 33333
198,93457,amor mo viniste shenhe haver
199,93458,no me sali shenhe
200,93459,aaa los amoooo
201,93460,que lindo ayaka y shenhe juntas
202,93461,finalmente elq veio pea casa carlaho
203,93462,hoy se cierra un ciclo shenhe y el seor de la noche
204,93463,bueno pues se ha podido conseguir a shenhe con su arma ya est bien vestida p
205,93464,ms shenhe man que nunca
206,93465,no me sali shenhe
207,93466,pero nico no kiere k saque a shenhe hasta k est l
208,93467,ha llegado mika junto al cryoimpact de shenhe y ayaka asi que hoy tenemos gacha puro con genshinimpact ikarot streamer gamer twitch vtuber
209,93468,se fueron cyno y dehya ahora a ver que onda con ayaka y shenhe ya tengo el arma de ayaka asi que seguro pruebe por la ayaya
210,93469,mi shenhe es feliz
211,93470,mi hijoooo lt 3 lt 3 lt lt 3 lt 3 lt 3 lt 3
212,93471,me toco shenhe y el arma de ayaka con solo 30 deseos aaaaaaaaa
213,93472,53 pity me puede salir esta semana por favor encima soy re mogolica teniendo pity 79 con shenhe hice una multi y me salio al ochenta los 9 deseos q me sobraban los podria haber tirado en el de armas tendria 63 de pity
214,93473,esoy muy felixe
215,93474,piola mi shenhe
216,93475,ya estn disponibles los banners de shenhe y ayaka para amrica y con esto ya estaran todos los servidores suerte en tus tiradas
217,93476,saqu el arma de ayaka y tengo shenhe c1 ahhhhhhhhhhhhhhh
218,93477,me avisan si anuncian a alguien me ir a tirar por shenhe
219,93478,ya esta shenhe
220,93479,a mamaaaarlaaaaaa shenhe en el primer tiro lets gooooooool
221,93480,tiraditas por ayaka shenhe ojo
222,93481,amigos cumplo 1000 das con kyungmin
223,93482,con esta publicacin de ayaka y shenhe damos inicio a la segunda mitad de la versin 3 5 puedes comentar debajo como te fue con tus tiros los leo genshinimpact shenhe ayaka
224,93483,bueno pues veamos si mi bajn mejora o empeora dependiendo de si sale shenhe o no
225,93484,tiraditas x shen he y farmeito de chill en genshin genshinimpact twitch ayaka shenhe
226,93485,busco sacrificios humanos shenhe ya te siento
227,93486,ansioso
228,93487,banners ya disponibles los banners de ayaka y shenhe ya estn activos mucha suerte a todos
229,93488,voy a tirar con mi pap pq l fue el q me sac a eula lt 3
230,93489,quiero mi shenhe genshin mtele nitro
231,93490,estoy muy tentado en tirar por shenhe ya que tengo a ayaka muy bien buildeada y creo que con una shenhe ira muy bien
232,93491,dos miwndotos
233,93492,pity 0 en 50 50 alrededor de 22 deseos nada ms mika como objetivo sacar a shenhe ya es avaricia
234,93493,si no me sale shenhe voy a ponerme muy triste
235,93494,3 minutos
236,93495,5 minutosssss
237,93496,hilo de yo junto a mi perro tirando por shenhe y ayaka obviamente mika   acompenme a mi sufrimiento no
238,93497,que es esto o sea he tirado por shenhe me ha salido en la tirada 87 jean he perdido el 50 50 obviamente y llevo 74 tiradas desde que perd el 50 50 y no me sale reina ya son muchos deseos ahorrados
239,93498,pity en tirada 5 y sin asegurado 300 gachapones a por la c4 de ayaka y shenhe su c1
240,93499,ya estamos en stream tiradas de seguidores ayaka shenhe abismos de seguidores dudas y preguntas genshinimpact genshin ayaka shenhe adems de los drops que tenemos de genshin impact acompaanos
241,93500,ya est el banner de shenhe
242,93501,shenhe c1 haver soy amigos
243,93502,10 min para mi shenhe
244,93503,10 minutos
245,93504,localizacin de todos los santuarios de mondstadt y llaves cofres genshin impact genshin genshinimpact twitch mika mondstadt kaveh baizhu albedo hoyoverse vtuber momoka fontaine sumeru ayaka alhacen youtube youtuber shenhe eula
246,93505,saldr la ta shenhe ram redes tiktok sr streamr es
247,93506,hola chicos hoy como siempre estaremos tirando por ayaka y shenhe si alguno quiere compartir sus tiradas genshin
248,93507,yoro ya no se si tirar ayaka o shenhe
249,93508,shenhe en casitaaaaaa
250,93509,shenhe ya sali
251,93510,tiradas por shenhe mika y las armas 3 5 genshin impact deylux92 a travs de youtube
252,93511,ya andamos en directo amigos tiradas con subs por shenhe o ayaka
253,93512,mika va a venir a casa y si no es mucho pedir shenhe tambin viene
254,93513,me encanta porque estoy esperando que se vaya el banner de dehya voy a tirar por shenhe teniendo que ganar el 50 50 y seguro lo pierdo con dehya
255,93514,shenhe 76 de pity onde estas
256,93515,shenhe veni a casa reina mia
257,93516,quiero a la shenhe y lo nico q tengo son 20 deseos y mucha fe
258,93517,termin y 18 minutos antes omg
259,93518,mi susto
260,93519,se vino shenhe ya tengo a mi equipo ayaka permagod al completo
261,93520,seora lea o acaso es c8ega vieja tonta
262,93521,20 minutos
263,93522,tiradas por mommy shenhe y la frentona
264,93523,miren amigos soy tan feliz tmb estuve con carpinchos
265,93524,miren amigos un carpincho
266,93525,me voy a baar para recibir a shenhe oliendo bonito
267,93526,clamicore
268,93527,perd el 50 50 de shenhe con qiqi c3
269,93528,bueno pues shenhe en casa con 40 tiradas y mika c1 not bad
270,93529,estoy muy nervioso por el banner de shenhe dios
271,93530,23 lacres de distancia da shenhe
272,93531,pero te la sacoooo yo te la sacoooo a shenhe te la sacooo
273,93532,wow ya casi sale el baner de shenhe
274,93533,zen itsu ma manque
275,93534,todo el mundo shenhe en 35 tiradas yo
276,93535,shenhe c1 ahora a por su arma y gg
277,93536,una shenhe loco lo nico que te pido
278,93537,no estoy ni feliz por shenhe
279,93538,abro el genshin le tiro 30 deseos a shenhe y no me toca cierro el genshin
280,93539,otra noche a dormir ojal sea la ltima
281,93540,mucha suerte a todos los que vayan a tirar por shenhe excepto a keihimekawa04 hoyoverso cabrn ya dale una keqing
282,93541,yo siendo la persona menos nerviosa que cuando me ha salido shenhe y empezado a quitar todo por la emocin y me he quedado sin captura
283,93542,shenhe y si dios quiere tambin mistsplitter
284,93543,gente ya prendimos y vamor a tirar deseos por shenhe
285,93544,es que paso de hablar de lo de hoy
286,93545,37 minutos
287,93546,le dije a tomas q iba a sacar a shenhe cuando vaya a su casa o sea el jueves lo q una hace por amor y me arrepiento pq la quiero sacar ahoraaa
288,93547,por qu nunca quitan estoa banners me ests cagando pens q ya estaba el de shenhe
289,93548,buenas noches mi gente que me ha tocado la shenhe y tengo los emojis de corazones nuevos
290,93549,yoyoyo manifesto reclamo yo a las 8
291,93550,mhy explcame por favor como tengo 1 arco de 5 1 mandoble de de 5 1 espada de 5 y 7 putas lanzas de 5 encima de dos en dos s he tirado en el banner de armas por la espada de ayaka s me ha salido la lanza de shenhe
292,93551,con mi novia ya estamos de fiesta pre shenhe en nuestro servidor de ds
293,93552,pol tambin me he ayudado en sacar a shenhe uwu
294,93553,me levant pensando que ya era el banner de shenhe y es una hora
295,93554,shenhe ven en early pity pls que quiero sacar la espada d ayaka
296,93555,no puedo creerlo me han salido la lanza de shenhe y la espada de ayaka en el mismo tiro de 10 juntas estoy practicando
297,93556,ser shenhe haver y si no me mato
298,93557,me va a salir shenhe me va a salir shenhe me va a salir shenhe me va a salir shenhe
299,93558,capaz si llego para cuando salga el banner
300,93559,para mi shenhe es el personaje ms bonito y con la historia ms triste que hay en genshin y mira que mi main es y ser rosaria siempre pero es que shenhe es un trozito de pan
301,93560,shenhe vendr a casa
302,93561,tengo 4 deseos para shenhe el asegurado y pity en 61 creen q me salga
303,93562,tiradas de espectadores ayaka y shenhe sr
304,93563,me explicas la mrda de que hago tirada al banner de shenhe y me sale qiqi luego tiro al banner de armas y me sale la lanza de shenhe cuando quera la espada
305,93564,che quin dicen que haga rn rl banner de armas elijo la de ayaka o la de shenhe corte psicologa inversa
306,93565,esperando llegar a mi casa para tirar x shenhe no me sale en 10 tiradas y no juego ms
307,93566,fui a liyue a hacer el ritual para shenhe y cuando entro al gachapon faltaba 1 hora todavia nono
308,93567,no s si baarme y tirar por shenhe o tirar por shenhe y baarme
309,93568,shenhe te noto muy cambiada genshinimpact
310,93569,una hora para ayaka y shenhe
311,93570,una hora para shenhe
312,93571,una hora para ayaka y shenhe
313,93572,h ha llegado el m momento ay qu nervoiso estoy hilo de mis segundas ojal no suceda como en su banner de estreno tiradas por shenhe
314,93573,mi hermana acaba de ganar su quinto 50 50 seguido con la shenhe es que estoy tiesa
315,93574,delicadas manos que en dedos acunan pequeo racimo de flores mientras pies a paso delicado en montaa se inmiscuyen pequea figura elevando diestra mientras atencin de peliblanca busca captar expresin sonriente en rostro shenhe tengo algo para ti
316,93575,ya estamos en directo vamos por shenhe streamer twitch shenhe hoyoverse genshinimpact
317,93576,soy esto viendo la sala
318,93577,mtenme tambin me sali la lanza de shenhe mtenme 2 veces por favor
319,93578,que genial omg
320,93579,no llego al baero sigo arreglando el internet
321,93580,alguien me dice a que hora est el banner de ayaka y shenhe
322,93581,tiro x shenhe y pierdo el 50 50 con tighnari tiro x shenhe y pierdo el 50 50 con tighnari tiro x shenhe y pierdo el 50 50 con tighnari tiro x shenhe y pierdo el 50 50 con tighnari tiro x shenhe y pierdo el 50 50 con tighnari tiro x shenhe y pierdo el 50 50 con tighnari
323,93582,no juego al genshin pero le he ganado a mi compaero de piso a la shenhe y ya estoy contenta
324,93583,a nuevo banner estar farmeando ya que me deb de conformar con mi cyno pero segu tirando deseos a lo pendejo ayaka y shenhe voy a tirar por las 2
325,93584,lugares donde tirar por shenhe en media hora ritual para que ganen el 50 50
326,93585,ser q algn da voy a llegar temprano cuando me tiene q llevar mi pap
327,93586,quiero sacar a mika y como es un 4 estrellas en que banner me recomiendan tirar ayaka o shenhe
328,93587,ya casi shenhe oooooooo9ooooo
329,93588,pensando seriamente en tirar por shenhe o esperar al rerun de nahida
330,93589,hoy se viene shenhe
331,93590,maana me va a salir shenhe estoy segura delusional
332,93591,ha entrada una xavala a mi mundo del genshin y no para de hacerse la coqueta y la uwu kawaii seguramente se piensa que por mi foto de shenhe soy el tpico hetero waifu collector y me quiere sacar una bendicin lunar
333,93592,cumplo el mismo da que shenhe
334,93593,todo lo que tuve que hacer para shenhe y hoy mis esfuerzos dan sus frutos
335,93594,he llegado a casa despus de que el emil hubiera perdido su 50 50 le he obligado a tirar una ten pull y le ha salido la shenhe te juro que tengo poderes
336,93595,se puede saber que salvajada me ha pasado ocho 50 50 ganados seguidos genshinimpact ayaka shenhe
337,93596,anyways una hora y veinte para el banner de shenhe
338,93597,me siento tan mal por los chicos
339,93598,no puede ser
340,93599,1 hora y media para shenhe
341,93600,me met a coop con shenhe y se pusieron a yelan y saltaron delante de m que buen taste
342,93601,he tirado para conseguir a shenhe por si quera rescatar a ayaka en algn momento y me ha salido doble como el wanderer como itto no s por qu no salen de uno en uno que me joden los putos 50 50 que me interesan luego
343,93602,me salio el plan soy shenhe y ayaka haver y consegui mika c4
