,Id,Tweet
0,4115,vamooooos chingonaaaaaas esporchivas
1,4116,adis al labioso rafaelpuente de pumasmx quin le dijo que es entrenador profesional es un perdedor mal en chivas mal en pumas buena decisin de universidad
2,4117,perdi chivas perdi tigres pero lo nico bueno fue que nevo y gano barc
3,4118,en 11 das al fin se me har ver a mis chivas f en el akron
4,4119,mal fin de semana para irle a chivas y al real madrid
5,4120,mis chivas femenil andan jugando solo les falta concretar vamos que se puede
6,4121,ese pinche comercial en chivas tv donde sale el carpintero haciendo al jugador est ms chafa que los de la cadena multimedios se pasan de brga
7,4122,chivas acumula mucha gente en ataque y rayadas no ha podido desarrollar con comodidad su ftbol aunque cada llegada es peligrosa y ya clavaron dos es necesaria ms tranquilidad frente a puerta queda a deber caro el resto del ataque con cosas interesantes partido complicado
8,4123,ptm que horrible fin de semana
9,4124,estan jugando muy bien ahora que se refleje en el marcador dale chingonas sin bajar los brazos
10,4125,me encanta como los de fox siempre buscan con lupa lo que le tienen que marcar en contra a chivas
11,4126,y cmo sigui la carrilla pochoguzmano6 pochoguzman5 porque estabas t y tus shtvas chivas mame y mame y mame y mame as que soporten quedaron solo como porque los del clubamerica les aplic la del churrero con 4 j4j4j4j4 nimo hocicones
12,4127,mi sueo es ver a mario castaeda diciendo arriba las chivas usando su voz de goku
13,4128,que pedo a chivas si le marcan faltitas empujoncitos y cualquier jalada a favor ese penalote a ellas hasta se lo marcan dos veces no mms que pedo y el gol esta bien dudoso pero ni as van a poder
14,4129,amrica le pasa por encima a las chivas en guadalajara
15,4130,ayer chivas y hoy el real madrid que mal estoy pagando
16,4131,descont chivas las rojinegras se hicieron presente en el marcador con gol de damaris godnez de cabeza ligabbvafemenil
17,4132,era penalote y la comentarista dice que no le parece as foxsports nada imparcial en sus comentarios casi no se nota el favoritismo por las chivas femenil foxdeportes
18,4133,que alguien le diga al rbitro que est pitando el chivasfemenil vs rayadas que se quite la playera de las chivas y deje de ser localista se acaba de comer un penal a favor se monterrey y en el gol delas chivas haba fuera de lugar
19,4134,si tuviramos a licha otra cosa sera como hace falta la depredadora y reina del rea vamos chivas femenil
20,4135,fuera de lugar el gol de chivas y penal a favor que no se marca nada fuera de lo normal cuando se juega contra ellas
21,4136,al medio tiempo en guadalajara rayadas gana 2 1 a las chivas muy cerrado el juego son el 1 y 2 de la tabla
22,4137,una cosa solo voy a decir urgen refuerzos de calidad para chivas como para chivasfemenil y ah el nico culpable es amauryvz
23,4138,medio tiempo en el estadioakron a buscar el empate en el segundo tiempo rebao esporchivas
24,4139,chivas 1 vs monterrey 2 al momento nos vamos al descanso en este buen partido que tiene a las rayadas venciendo por la mnima al rebao despus de 45 minutos j10cl2023 ligamxfemenil
25,4140,parece que el amrica puso a chivas en su realidad son un buen equipo pero estn muy lejos de ser un aspirante al campeonato
26,4141,mis chivas femenil trapeando a las lideres dios si supieran definir pero seores estas son las chivas femenil que queremos ver siempre
27,4142,todo lo marcas a favor de chivas chtm
28,4143,pinches comentaristas de fox a wevo quieren q gane chivas era penalty clarisimo
29,4144,ustedes chivas sigan mamandola
30,4145,increble va perdiendo chivas fem y los rbitros se empiezan a equivocar marcando todo a favor y no marca do fuera de lugar y dems
31,4146,no se si es mejor q vengas a chivas o q estes ya mismo en el banquillo del 1er equipo del real madrid solo se q no puedo pasar un fin de como este de vdd q no
32,4147,45 chivas 1 2 rayadas termina la primera mitad en guadalajara ventaja parcial para las rayadas de monterrey timhortonsmx
33,4148,penal del tamao del mundo que perdonan a chivas foxsportsmx ayuditas
34,4149,medio tiempo chivas 1 2 rayadas ligabbvamxfemenil
35,4150,perdonan a chivas un claro penal y su gol fue en fuera de lugar
36,4151,no fue el festejo lo que realmente los tiene encabronados es que henry martn los trae de hijos henry el folla chivas martn
37,4152,chivas 1 vs monterrey 2 al momento cerca el rebao en un rebote que le dej el baln en el rea a gabrielavzla9 y tras recortar manda muy cruzado su disparo para no poder concretar lo que hubiera sido el empate para las tapatas j10cl2023 ligamxfemenil
38,4153,me juzgan mucho si me compr un pants de las chivas en el tianguis
39,4154,no mms rbitro es manota en el rea de chivas
40,4155,estn robando a mano armada en el rayadas chivas
41,4156,ligafemenilxfsmx natalialeon lmsauret monicaarredondo soy aficionado de chivas pero creo que se les escapa al momento del centro de evans michelle si separa la mano
42,4157,47 qu cerca gabyyyyy sigamos insistiendo rojiblancas
43,4158,mala semana para irle a las chivas y al madrid
44,4159,ligamxfemenil fuera de lugar damaris godnez entr a segundo poste y acerc a chivas en el marcador abcdeportes 92 1 fm y 660 am
45,4160,eshoyeshoy hoy juegan las chingonas las que sacan la cara por chivas las que juegan por amoralacamiseta amoralfutbol hoy juega chivasfemenil y para que sea ms perfecto hoy es cumpleaos de nuestra comandante carojaramillo94
46,4161,a sido una buena semana para el deporte mexicano solo las chivas la cagan pero yo no me bajo del barco
47,4162,es que es increble que nadie del cuerpo arbitral lo haya visto y estas jugadas son las que a deben marcar la importancia de que haya var en fase regular b deben de hacer que la aficin de chivas deje de decir que siempre les roban
48,4163,chivas 1 vs monterrey 2 al momento se anuncian cuatro minutos de tiempo agregado en este buen partido en la cancha del estadio akron j10cl2023 ligamxfemenil
49,4164,arbitrajes asquerosos y luego el de chivas vs rayadas super localista el pndjo
50,4165,podrn estar perdiendo pero que garra estn metiendo no bajan los brazos esa es la actitud que quiero siempre
51,4166,futbolista al ngulo el golazo descomunal de carlee giammona en el chivas vs rayadas de la liga mx femenil
52,4167,eva va a tener que corregir y regresar a rebeca a la central hoy la dinmica de chivas no es la misma que la de courage y pachuca valeria puede sacar el trabajo con franco en la contencin
53,4168,45 chivas 1 2 rayadas tarjeta amarilla para dianaevange
54,4169,damarisgodinez3 descuenta dama aprovech la jugada a baln parado y anot el primero para nuestra causa sigue el partido en vivo por la seal de chivastvmx
55,4170,ayer perdi mis chivas pero hoy gano barca algo es algoo
56,4171,y esto es todo lo que tengo que decir al respecto america vs chivas
57,4172,ptm estoy leyendo el partido de la rayadas vs chivas en facebook y al parecer me estoy perdiendo de un partidazo
58,4173,as se disculp henry martin de su celebracin ante chivas
59,4174,dos jugadoras de chivas en fuera de lugar rayadas 2 1 chivas
60,4175,los de foxsports pidiendo repeticin de todas las tomas posibles para inventarse un fuera de lugar en el gol de chivas
61,4176,a las chivas les paso lo que a mi tia salio aver a su novio y regreso con 4 chamacos
62,4177,como fue el amrica el que le gan a chivas nadie dijo nada y no v los montones de memes burlndose pero no hubiera sido al revs porque todava la naquiza se estuviera burlando
63,4178,g l de chivasfemenil lo buscaron y lo consiguieron damarisgodinez3 mete a las rojiblancas al partido chivas femenil 1 2 rayadas telemundo app chivasentelemundo ligamxfemenil
64,4179,chivas 1 vs monterrey 2 al momento 41 minutos se aproxima el descanso y las rayadas buscan una nueva anotacin antes de ir a los vestidores j10cl2023 ligamxfemenil
65,4180,fuera de lugar en el gol de chivas femenil no
66,4181,era fuera de juego de chivas en el gol
67,4182,uyyyyy pareca fuera de lugar el gol de chivas la toca iturbide y godinez ya estaba adelantada en ese momento aunque no han dado toma clara en parte por el sol
68,4183,era fuera de lugar el gol de chivas no
69,4184,fuera de lugar de chivas femenil clarsimo
70,4185,ligafemenilxfsmx chivas ya mereca un gol sali mal la portera de rayadas esto si es un duelo de campeonato
71,4186,damaris gondnez puso el 1 2 en el akron chivas femenil se acerca en el marcador antes de finalizar la primera parte 1 2
72,4187,fuera de lugar clarsimo en el gol de chivas femenil al momento del primer cabezazo estn dos jugadoras en fuera de lugar
73,4188,vaya fin de semana que nos aventamos los que le vamos a las chivas y al realmadrid
74,4189,ligafemenilxfsmx lmsauret monicaarredondo natalialeon hay una jugadora de chivas adelantada en el centro pero no participa si el gol no entra era penal de godnez y segunda amarilla
75,4190,tanto que me gustabas como que le vas a las chivas morra
76,4191,chivas 1 vs monterrey 2 al momento gol del rebao boyi58 peina el baln y damarisgodinez3 termina empujando el baln para el descuento de las locales a los 37 minutos en una jugada donde iturbide se lleva tremendo golpe en la cabeza j10cl2023 ligamxfemenil
77,4192,38 goooooool del guadalajara gooooool de damarisgodinez3 dama aprovecha una segunda jugada dentro del rea y descuenta en el marcador con un remate de cabeza por el empate rebao chivas 1 2 rayadas
78,4193,estas chivas s saben remontar espero rayadas sean ms ofensivas porque chivas no es un flan
79,4194,lleg el segundo g l de las rayadas con un remate de cabeza cburky2 adelanta a su equipo chivas femenil 0 2 rayadas telemundo app chivasentelemundo ligamxfemenil
80,4195,vamoooooos carajoooooo busquen otro ms
81,4196,ok ya reaccion chivas veremos
82,4197,femenil jornada 10 min 38 gol de chivas damaris godnez remat dentro del rea con la cabeza chi 1 2 ryds apuesta aqu acciones
83,4198,goooooooooooooool de chivas al 37 anota damaris godnez chivas 1 2 rayadas ligabbvamxfemenil esporchivas
84,4199,sto es chivas fem vamos por ms chivasfemenil ligamxfemenil
85,4200,38 chivas 1 2 rayadas gol de las locales
86,4201,que golazo y la portera de chivas minimo hizo por el baln no como otros
87,4202,gol de chivas
88,4203,ya regresa yo te dono mi pierna pero no soporto ver otro partido sin ti
89,4204,rayadas cabezazo de burky consigui el segundo gol del monterrey ante chivas y de pas anot su dcimo tanto en la temporada abcdeportes 92 1 fm y 660 am
90,4205,que horrible noche la de anoche como aficionado a chivas
91,4206,femenil aunque la profundidad de boyi iturbide comenz a hundir a rayadas del campo sigue con su finura en los cortes hay una accin donde retarda de gran forma a jaramillo no obstante burkenroad con su tanto 10 asistencia de yamil franco chivas juega rayadas finiquita
92,4207,chivas femenil ya lo pierde 2 a 0 ante rayadas
93,4208,zona3deportes ya lo ganan rayadas 2 0 ante chivas en el estadio akron
94,4209,chivas 0 vs monterrey 2 al momento disparo de gabrielavzla9 que se va por encima del marco regiomontano a los 35 minutos de juego j10cl2023 ligamxfemenil
95,4210,perdieron mis chivas po y el madrid vaya finde de mierda
96,4211,36 disparo de gabrielavzla9 que se va por encima del arco visitante daleeee rebaooo
97,4212,corrieron a rafa puente y que baile le est dando rayadas a chivas no tiene nada que ver una cosa con la otra pero pa ahorrar tuits
98,4213,ya lo pierde la femenil 2 a 0 se viene un fin de semana redondo en cuanto a corajes con chivas
99,4214,chinguen a toda su puta madre chivas chivasfemenil vpaunovic patoalfaro23 nellysimon amauryvz
100,4215,chivas de la mano de paunovic va a salir adelante de esta derrota se los firm
101,4216,34 amonestacin para alejandra godnez por hacer tiempo
102,4217,dganle a los pendjos de fox sports que mis chivas juegan hasta el ltimo minuto as que aqu nadie se raja
103,4218,blanca felix hace una wachada y rayadas ya nos chinga 2 0 chivas dejaron el estadio maldito ayer
104,4219,goleadora goleadora burkenroad hace el segundo con servicio de yamile rayadas 2 0 chivas
105,4220,a estas rayadas les sale todo bien cuando mejor jugaba chivas viene el gol de burky a secundar la obra de arte que se mand giammona 2 0 parcial y las de eva van muy bien
106,4221,en fin quera que mis aguilas le quitarn el invito a las chivas pero bueno ya que lluevan amarillas
107,4222,perdi po ayer perdi chivas masculino hoy pierde chivas femenina mi combinadas se arruinaron por un resultado qu bronca
108,4223,mejor voy por mis palomitas pens que solo seran ayer los corajes con chivas v
109,4224,se estn follando a a la femenil tambin ptm que mal fin de semana para ser de chivas
110,4225,chivas 0 vs monterrey 2 al momento gol de las rayadas cburky2 le gana el baln a blancafelixc y de cabeza aumenta la ventaja de las visitantes a los 31 minutos de partido j10cl2023 ligamxfemenil
111,4226,32 chivas 0 2 rayadas cburky2 se elev y de cabeza mand un fuerte remate al arco para anotar el segundo tanto del encuentro enorme burky
112,4227,jugadoras extranjeras estrenando la red con mis chivas femenil
113,4228,definitivamente no es buena semana para ser chivahermano
114,4229,ayer a las chivas y hoy a las chivasfemenil no meten ni las manos
115,4230,los fantasmas del da de ayer se hacen presentes hoy otras vez en el akron pero con chivas femenil
116,4231,as se celebr en el vestidor de mis guilas despus del clsico nacional y la humillacin en casa de las chivas
117,4232,yo digo que la generacin de cristal la hicimos los adultos de hoy ahora salen con que el festejo de henrymartinm es una falta de respeto chinguen a su madre cristalinos en tiempos aejos hacian eso y ms y no se criticaba tanto y soy aficionado de chivas
118,4233,goooooooooooooool de rayadas al 30 anota burky chivas 0 2 rayadas ligabbvamxfemenil arribaelmonterrey
119,4234,gol de rayadas burky de cabeza hace el 2 0 a chivas
120,4235,nombre ms chivas ya estn fuera
121,4236,bien por la gente que haya aplaudido a karol bernal por lo que hizo en chivas femenil aqu si se le reconocen lo que hicieron en el club
122,4237,31 rayadas duplica la ventaja
123,4238,30 chivas 0 1 rayadas vamos por ms oxxogas
124,4239,arriba las super chivas femenil chivasfemenil
125,4240,chivas 0 vs monterrey 1 al momento la guardameta godinezalex se queda por arriba con el baln en una buena llegada del rebao al cumplirse 30 minutos de juego con las visitantes al frente en la pizarra j10cl2023 ligamxfemenil
126,4241,a quin se supone que invocan las chivas con esto porque slo pasan vergenzas desde que empezaron con estas inauguraciones de partidos
127,4242,jajaja chivas
128,4243,ay a nicky y a la bichota no las abucheen ellas siempre sern bienvenidas con chivas
129,4244,ni a cual irle de rayadas y chivas equipazos q son
130,4245,perdieron todos los equipos que esperaba que ganaran hola tigres real madrid pio y chivas espero y estn bien
131,4246,tembl mucha
132,4247,chivas 0 vs monterrey 1 al momento 25 minutos el rebao se ha acercado al rea regiomontana pero sin demasiado peligro j10cl2023 ligamxfemenil
133,4248,si chivas no ha hecho gol es por chivas apliquese para todos los partidos de chivas y chivas femenil hahaha
134,4249,que rico
135,4250,chivas 2 a 4 amrica soy aficionado desde chico a las chivas pero ahora decepcionan por que estos jugadores no juegan por la camiseta si no por dinero que triste
136,4251,esa cancha de chivas esta muy de la vg
137,4252,ctm pierden mis chivas pierde mi rma solo falta q tmb el celaya
138,4253,ni tigres ni chivas ni real slo mi mquina nos da alegras y con ese me basta a unicero pero vale por 3 pts muy buenos
139,4254,juntos siempre te quiero y te apoyo en todas las circunstancias chivas
140,4255,as es que chsm las cagabolitas chivas
141,4256,estreno goleador carlee giammona marc su primer gol con rayadas y en la ligamxfemenil dicha anotacin pone a las de eva espejo con la ventaja 0 1 ante chivas vamosporellas
142,4257,mexico women liga mx femenil matchday 10 20 chivas de guadalajara 0 monterrey 1 stream link
143,4258,chivas 0 vs monterrey 1 al momento 20 minutos el rebao ya tuvo un disparo a puerta por parte de carojaramillo94 y la guardameta godinezalex contuvo el baln j10cl2023 ligamxfemenil
144,4259,ni hoy se me pudo quitar el mal sabor de boca de ayer con chivas slo mi juve se pudo llevar su clsico mi madrid tambin hoy lo derrotaron chivas y madrid nmmn ya ni la muelan los clsicos no se pierden se ganan
145,4260,recuerden chivahermanos chivasfemenil no tiene por qu cargar con la responsabilidad por la pifia de chivas en el clsico nacional cada quien sus batallas
146,4261,las chivas me rompieron mi corazn ayer pero hoy el barcelona me lo volvi a sanar
147,4262,rayadas ha extraado menos a la china que chivas a licha monicaarredondo natalialeon lmsauret
148,4263,pienso q irle al chivas es un castigo pero luego veo a los q le van al pumas y cruz azul y creo q estoy bien
149,4264,emilio lara regalando un gol a chivas debido a que estos mediocres ni idea tienen de como anotar despus en fuera de lugar le regalan otro chiquete orozco anduvo como wey todo el juego pero es chivas nada que mencionar fercevallosf
150,4265,ese luis mario sauret y la porrista esa de chivas siempre le estn tirando a rayadas ahorita se deben estar atragantando con el 0 1
151,4266,hoy vimos al compaero de trabajo de mi hermana que tambin le va a las chivas le preguntamos cmo ests y dijo decepcionado perdieron las chivas jajajajajaja te entiendo
152,4267,son los aficionados y jugadores de las chivas
153,4268,para sorpresa de nadie chivas esta jugando bien he
154,4269,18 carooooooo buena jugada entre boyi58 y carojaramillo94 en la que esta ltima saca disparo pero es detenido por la portera visitante
155,4270,vamos chivas femenil
156,4271,18 remate de boyi58 que detiene la arquera rival daleeee chivaaaas
157,4272,ligamx gol de leonardo surez titular en el triunfo de clubamerica dirigido por ortiztano 4 2 en el clsico ante chivas
158,4273,fue el mejor fin de semana empezamos por sbado gan america a chivas y mxico le gan a puerto rico en el bisbol domingo checo primero lugar y barcelona le gana al madrid
159,4274,chivas 0 vs monterrey 1 al momento se rebasan 16 minutos con el rebao tratando de responder y las rayadas buscando ampliar el marcador rebaovsrayadas j10cl2023
160,4275,g l de las rayadas con este golazo de carlee giammona sorprenden a chivasfemenil chivas femenil 0 1 rayadas telemundo app chivasentelemundo ligamxfemenil
161,4276,alianza boca chivas madrid mal fin de semana
162,4277,tan bonita pero le va a las chivas
163,4278,la vd ese gol es tramite pa que chivas empiece a meter los suyos se sabe
164,4279,entonces las chivas de espaa le ganaron al amrica de espaa segun algunos ames
165,4280,si as se queda l rayadas vs chivas y maana ganamos a tigres seramos segundo lugar a 4 de rayadas
166,4281,lo que dara por estar viendo el partido de chivas femenil en el akron
167,4282,fin de semana redondo goleada a las chivas y el realdemadrid a 1 2 del bara
168,4283,el sonido del pblico en el guadalajara vs monterrey es increble ligamxfemenil rayadas chivas chivasfemenil rayadas ligabbvafemenil
169,4284,gooolazoooo se estrena giammona con rayadas y de que manera rayados 1 0 chivas
170,4285,pierden casa vs chivas america y monterrey ese inche volcn es un volcn apagado as tigres as no
171,4286,seeee pinches perros con cuernos chivas vamosamrica somosamrica soyaguila somosaguilas clasiconacional guadalajajajara
172,4287,qu poema nos regal giamonna rayadas quiere mantener su paso perfecto pero chivas femenil la va a vender cara
173,4288,elclsico aficin de chivas abandon el estadio no quiso ver la celebracin del amrica por la goleada en el clsico
174,4289,que mal da para ser aficionada del ftbol chivas fcbayernes
175,4290,ya me regres el internet el america nos gan bien supo aprovechar los errores carencias de chivas por lapsos el rebao se miraba bien plantado en el campo pero no se miraba por donde nos urge un creativo y un delantero pero de las derrotas se aprende
176,4291,chivas 0 vs monterrey 1 al momento golazo de las rayadas carlee giammona con un disparo de media distancia pone el baln en el ngulo superior izquierdo para dar ventaja a las visitantes a los 9 minutos j10cl2023 ligamxfemenil
177,4292,giammonazo romazo de larga distancia y rayadas ya le gana 1 0 a chivas
178,4293,la diferencia es que la de chivas si se tiro el etas no
179,4294,el clsico de la liga mx se fue por una sola va amrica arroll a chivas y no dio tregua para golear como visitante por 4 a 2 a su eterno rival salvador aguilera analiza el partido y nos cuenta qu sigue para ambas escuadras
180,4295,10 chivas 0 1 rayadas espectacular golazo de carlee se estren de gran forma
181,4296,en el clasicodemexico sobrado est mejor america que el equipo chivas y es que no traer mexicanos lo he dicho no la va a hacer el equipo tapato
182,4297,ya llevanos diosito
183,4298,goooooolllazzzo de rayadas copiando a romo ya 1 0 a favor sobre las chivas al minuto 10
184,4299,clsico clsico ya se convirti que el amrica derrote a chivas ellos siempre pelean por los primeros lugares y el rebao apenas da indicios de querer despertar en el 2023
185,4300,gooooooooooooooool de rayadas golaaaazo de carlee giammona al 9 chivas 0 1 rayadas ligabbvamxfemenil arribaelmonterrey
186,4301,9 rayadas toma la ventaja venga chivas no bajemos los brazos
187,4302,no me doli la derrota de mis chivas me doli ver la falta de pasin por la playera dejar que en tu casa y tu mximo rival te humille y no hagas algo mnimo para defender tu honor as no chivas se burlaron de nosotros se dice y no pasa nada
188,4303,games bucket list ver jugar a cr7 2015 america vs chivas en el azteca real madrid en ucl vs liverpool real madrid vs barcelona la liga
189,4304,ligamxfemenil datogeb 19 vez que se enfrentan chivasfemenil y rayadas 5 guadalajara 6 empates 7 monterrey guadalajara suma 3 juegos sin vencer a monterrey no tiene 4 desde 2019 con 8 rayadas tiene 3 visitas a chivas sin vencerlas desde el 18 marzo 2019 por 0 1
190,4305,no hay internet n no puedo ver el partido de mis chivas
191,4306,ptm ayer mis chivas y hoy mi real
192,4307,8 qu buena jaque2rdz nuestra central se interpone en el camino de la pelota y evita el gol de rayadas
193,4308,9 chivas 0 0 rayadas derechaaaaazo de cburky2 que ataja la guardameta local
194,4309,nadie los rbitros en las jugadas contra chivas femenil
195,4310,chivas 0 vs monterrey 0 al momento disparo que se va desviado del marco visitante luego del cobro de un tiro libre al llegar a 5 minutos de juego j10cl2023 ligamxfemenil
196,4311,venga chivas femenil
197,4312,pinche fin de semana culero para los que le vamos a las chivas y al real madrid
198,4313,ligafemenilxfsmx lmsauret monicaarredondo natalialeon venga chivas a sacar la casta xito en la transmisin por otro partidazo
199,4314,las chivas perdi el clsico el madrid perdi contra el fc motomami estoy hundido cmo puedo depender emocionalmente de 22 buenos para nada
200,4315,ahora viendo a mi chivas femenil vamos
201,4316,perdieron las chivas perdi el madrid pero gan g2 dios da dios quita keria tuvo que ganar el mundial
202,4317,solamente para andar de hocicones son buenos porque para jug4r ya vimos que no guzmanpocho06 chivas
203,4318,chivas es mucho mas grande que un equipo de ftbol es identidad tradicin futbolera de un equipo 100 mexicano somos el alma de guadalajara y el corazn de mxico chivas soychivafan
204,4319,perdieron las chivas y el madrid que fin de semana tan jodido
205,4320,ehdeportes es turno de las rayadas de mantener el primer lugar de la tabla ahora contra las chivas del guadalajara en el estadio akron ligamxfemenil clausura2023
206,4321,vamos chivas chivasfemenil cl2023 delcdgtodalavida mexicanas ligamxfemenil futbolfemenil futbolfemenilmexicano
207,4322,chivas 0 vs monterrey 0 al momento se dio el toque inicial en el estadio akron donde el rebao y las rayadas se juegan el liderato del torneo j10cl2023 ligamxfemenil
208,4323,vamoooos chivas
209,4324,cmo les fue a sus equipos de ftbol este fin de semana chivas real madrid ac miln arsenal
210,4325,ya me tienen harta el madrid las chivas y todooooos oficial me retiro de los deportes
211,4326,futbol las guilas clubamerica dieron ctedra desde el estadio akron chivas
212,4327,alguien tiene link para el juego de chivas vs rayadas que no sea de fb jiji c por que se me traba ah
213,4328,vamos mis chivas
214,4329,vamonos se mueve el baln en el akron transmisin por fox sports y chivas tv
215,4330,1 chivas 0 0 rayadas arranc el partido en guadalajara vamos por ese triunfo rayadas a darle
216,4331,inicia el partido chivas vs rayadas ligabbvamxfemenil
217,4332,arrancaaaaaaaa el partido en el estadioakron sguelo en vivo por las seales de foxsportsmx y chivastvmx
218,4333,resultado clsico clubamerica se impuso por goleada a chivas en su cancha elclsicodemxico contado por ellos las leyendas rojiblancas y azulcremas por jorgerubio99 chivas america clasiconacional ligamx
219,4334,por iniciar chivas rayadas
220,4335,todo listo en el estadio akron para el juego entre chivas y rayadas
221,4336,vamos mis chivasfemenil plis ganen porque este fin con el madrid y chivas varonil no se arma ninguno chivasfemenil ligabbvafem
222,4337,quin ganar el clsico nacional chivas vs amrica clausura 2023 a travs de youtube america chivas clasiconacional
223,4338,se imagina lo que sera chivas con un delantero como mrquez lugo nunca me voy a cansar de decirlo las peores chivas en cunto a plantel ese seor se carg solo el equipo al hombro
224,4339,que ganas de andar como las chivas y el real madrid bien cogidote
225,4340,este fin de clsicos le saqu jugo con me llev todo con ambos anotan de chivas vs amrica barcelona vs madrid y ajax vs feyenoord un 415 ya te registraste
226,4341,qu ganas de andar como el chivas bien cogidote
227,4342,ya estamos en el akron para el chivas femenil vs rayadas femenil duelo de 1er lugar contra el 2do lugar de la ligabbvafemenil chivasfemenil rayadas
