,Id,Tweet
0,11237,no se a quien le vale mas verga el equipo de las chivas a mi o a ese cabron de alexis jajaja
1,11238,otro chocolate de patrick sandoval que hoy se parece al mismisimo wily wonka clasicomundial2023
2,11239,mejor habla de tus chivas
3,11240,las chivas no dejarn de ser un equipo fracasado mientras su aficin siga justificando todas sus derrotas representan al tpico wey que cuando le va mal siempre hay un culpable menos l
4,11241,lo que muchos pensamos muy fcil se sacan tarjetas aqu en mxico se sacan tarjetas por nada es ftbol es emotivo todo el mundo est afectado no se pueden sacar tarjetas as veljko paunovi tras la decisin de marco antonio ortiz de expulsar a vctor guzmn
5,11242,dos cosas que pasan en el clasiconacional amrica chivas 1 siempre aparece un hocicon que lo tienen en un atad y lo reviven das antes al juego 2 pasando el juego inmediato se desaparece humillado y aporreado regresa a su atad bofo 100
6,11243,a ver si aprenden bola de pendejos chivas
7,11244,excelente chivas amauryvz estn haciendo justo las cosas que tu pap jams hubiera querido bien vega con eso vas a recuperarte al cien en unas semanas ms
8,11245,yo cre que no andaban en el puto instagram por vergenza pero al parecer es por que andan en la peda chivas
9,11246,entonces ya les dijiste que su referente el pocho se hizo expulsar para no jugar vs el equipo de sus amores jajajaja estn bien empinados chivas
10,11247,por burlarse de chivas en festejo henry martn pagara una multa millonaria
11,11248,ay ay ay a los de chivas lo vamo a garrar ay ay ah a lo de chiva lo vamo a garrar pinche chiva vigilante si corres en todas partes tus amigos en patrulla y tu son hijos de put4 ay ay ay hoy vinieron con la federal ay ah ay hoy vinieron con la federal
12,11249,exactamente pero como se orinaron literal en las chivas estn mamando ahora la beben o la derraman pinches chillones
13,11250,sabes que chivas es el equipo ms mimado de mxico cuando la prensa se dedica a criticar a henry por su festejo que criticar la actitud de los jugadores de achicas en un clsico chivas es el responsable de que el ftbol mexicano y medios sean mediocres en est pas
14,11251,ojal pauno ante atlaz inicie cubriendo a quiones no lo haga en zona sino que ponga marca a l que ha sido el mejor de ellos ante pumas olimpia y puebla lo viene confirmando chivas debe aprender de los errores en marca del ltimo juego y saber defender para generar
15,11252,carnaaal te sigues burlando por que le ganaron a l chivas y pero a ti te ganaron a tu morra jajajaa buzo compa
16,11253,mejores defensivas 8 len 9 mty 9 tigres 12 toluca 13 cruz azul 13 chivas 15 san luis 16 amrica 16 atlas 16 necaxa 16 tuzos 17 quertaro 17 xolos 18 jurez 24 pumas 26 puebla 27 santos 28 mazatln
17,11254,eso es todo pompeyo4cr enhorabuena somosdistintos
18,11255,jonathan rodrguez fue elegido por la aficin azulcrema como el mejor jugador contra chivas clubamerica somosamerica siempreaguilas
19,11256,es la poderosa t tambin puedes verte as de increble y distinto desata tu glitch y adquiere la tuya
20,11257,henry martin y su vulgar festejo en el chivas vs amrica que escandaliza a los falsos puritanos de la tv estas chivas no hicieron nada porque les faltan huevos las anteriores hubieran echo una campal hoy en la mx puro deshuevado
21,11258,duelo de arqueros en sus ltimos 5 partidos ochoa juventus monza sampdoria miln y bolonia 6 goles recibidos acevedo len tijuana chivas puebla y toluca 15 goles recibidos ftbolmedia mexico
22,11259,worldbaseballclassic lacasadelbeisbol mxico
23,11260,gan el bara ganaron los rayados perdieron las chivas jajajajaja el contraste machn que tuvimos
24,11261,video miguel gurwitz los aficionados de chivas no solo se pueden fijar en la burla de henry marti n
25,11262,que intenso vamos
26,11263,con el dineral que roba en chivas la tristeza es lo que menos tiene alexis vega9 ja ja ja junto con la vergenza
27,11264,henry martin se cago en chivas dentro y fuera del campo mi padre
28,11265,el recado de leo surez a chivas luego de ganar el clsico nacional
29,11266,as se marcha chivas sin palabras
30,11267,toma chocolate y paga lo que debes
31,11268,worldbaseballclassic mxico ricardobsalinas
32,11269,al conjunto rojiblanco no le gust que el delantero emulara los festejos de cuauhtmoc blanco en la victoria de amrica sobre chivas
33,11270,worldbaseballclassic mxico imagen tv
34,11271,y tras perder el clsico nacional las chivas se preparan para viajar a estados unidos en la fecha fifa jugarn ante pachuca y toluca duelos amistosos
35,11272,el clsico tuvo seis goles pero fue un somnfero de los god lacascara ligamx chivas america monterrey tigres clasiconacional clasicoregio
36,11273,sabes algo del chino huerta si el que se quejaba que en chivas no tenia oportunidades
37,11274,unas bien chivas bien muertas alexis vega fue captado en una reunin despus del clsico que vergonzosamente chivas perdi el amrica ya decir algo est de ms que opinan chivas
38,11275,las chivas de omar bravo ramn ramirez oswaldo sanchez hector reynoso no lloraban cuando las haca cuau de verdad que se les pego la debilidad actual
39,11276,no fue mida chivas nmms es lechita de aguila cfamerica tmala clasiconacional espn foxsports futpicante lup
40,11277,diri operador mvil virtual se asoci con el club de ftbol monterrey y chivas de guadalajara para ofrecer un plan de telefona e internet
41,11278,osea gan amrica a las chivas y luego que sigue que se topen a santos pachuca o toluca en liguilla pa que los manden a la verga jajajajja como siempre as que ni se emocionen aymispendejos
42,11279,worldbaseballclassic mxico
43,11280,mxico
44,11281,se esperaba un clsico nacional ms parejo pero fue una gran diferencia amrica se adue por completo del juego contra chivas que fue decepcionante afectar la pausa de la fecha fifa a algunos equipos de la liga mx el anlisis de yayodelatorrem centralfox
45,11282,calienta el vdeo del 10 de chivas mi gente
46,11283,listo el rebao tour debido al parn de la liga chivas ya tiene listos 2 amistosos para mantener ritmo vs pachuca mircoles 22 de marzo san jos california paypal stadium vs toluca sbado 25 de marzo los ngeles california dignity health sports park
47,11284,es fair play o no el festejo de henry martin ms humillante para las chivas estn de acuerdo con faitelson espn herculezg y mauriciopedroza
48,11285,puro fracaso de las chivas
49,11286,ral pnches fachs hipcritas tmenla
50,11287,los aficionados de chivas en estados unidos tendrn otra oportunidad de ver al rebao esta semana el guadalajara se va hoy a california jugar 22 de marzo vs pachuca en san jos y el 25 vs toluca en carson
51,11288,las chivas ya fueron a llorar con la liga mx para que castiguen a henry martn por su festejo pero no fuera pizarro diciendo que chingue su puta bomba y negra madre el amrica ponce picndole los ojos a henry o guzmn dicindole cagn al rbitro porque hasta lo celebran
52,11289,quin decepcion ms en su respectivo clsico chivas o tigres ms decepcionante es tigres me decepcion el helado pecho de los jugadores del guadalajara imperdibles palabras de faitelson espn herculezg y mauriciopedroza
53,11290,tengo unos compas que le van al madrid y le van a las chivas y le van a mxico beisbol imagnate que pierdan sematan japan
54,11291,concuerdo chivas no mereces tu aficin
55,11292,cuando uno como aficionado mira este tipo de notas da coraje y tristeza porque es evidente q sigue adelante la destruccin de este club tan grande chivas de guadalajara an sin estar el esquirol miserable de ricardo pelaez sigue actuando desde fuera y x
56,11293,alexis venga festejando la victoria del equipo en el que quiere jugar vs las chivas
57,11294,las consecuencias del clsico mientras que para clubamerica su victoria lo catapult hasta el subliderato de la ligabbvamx para chivas la derrota represent salir del top 4 y caer hasta la 7ma posicin lograrn los 2 clasificar de manera directa a cuartos de final
58,11295,las vctimas del accidente del helicptero del ejrcito que se desplom cuando volaba sobre quibd qepd
59,11296,ya viene el recital de la novena mexicana que se prepare ohtani sasaki y todos los dems ojos de rendija que les vamos a dar para llevar viva cabrones worldbaseballclassic clasicomundialdebeisbol lacasadelbeisbol
60,11297,chal perdieron mis chivas y el real madrid pero mi comandante se mando un golazo de tiro libre no todo estuvo tan mal siiiiuuuuuuuu
61,11298,randy arozarena viendo cmo sigues hablando de las chivas cuando ya falta menos de media hora para que mxico juegue la semifinal del clsico mundial de bisbol contra japn
62,11299,que la mamen los chivas
63,11300,lo que viene en fecha fifa para chivas
64,11301,hasta ahorita estoy viendo el partido de chivas vs rayadas y debo decir que el arbitraje estuvo otra vez horrible entre errores y compensaciones se ensuci el juego
65,11302,maldito falla locas lrgate de chivas carloscb 24
66,11303,con plantel completo y en silencio chivas parti a los estados unidos donde se medirn a pachuca y toluca en amistosos brizuela est de vuelta y podr tener minutos
67,11304,en mi opinin rafa puente se quem por agarrar a un equipo perdedor sin dinero con jugadores sin identidad y la burla de mxico le hubiera ido mejor en otro equipo chico pero agarrar a pumas o chivas es quemarse
68,11305,chivas se aleja de la clasificacin directa la polmica deportiva est en silbatazoinicil spotify itunes google podcast
69,11306,no est para competirle al amrica chivas se sinti inferior no te pierdas   lo puedes ver x espn y en star plus
70,11307,rayadas y chivas tuvieron oportunidades de hacer dao pero se neutralizaron y firmaron la igualada
71,11308,espero que amauryvz y chivas corroboren los hechos s esto fue posterior al clsico nacional que no se trate de una descontextualizacin de lo contrario que de haga lo pertinente
72,11309,amrica salt al segundo lugar con 6 victorias 5 empates 1 derrota y 23 puntos y chivas baj al quinto con 21 unidades
73,11310,luego del triunfo del clubamerica en el clsico nacional ante chivas al ganar 2 4 hubo un momento del partido cuando henrymartinm festej al anotar un gol y fue a la portera rival e hizo el gesto de un perrito orinando podra ser sancionado con una multa de 155 mil pesos
74,11311,los repor fan de las chivas borgetti58 victor deportes ramosrizo laloeluna
75,11312,amrica repaso en el clsico a unas chivas que no pudieron con las aguilas bueno hasta tuvieron que ser ayudadas con un autogol de lara al 62 un marcador de 4 2 odisead aguilasmonu america vamosame1916
76,11313,la directiva de chivas est investigando a una promesa goleadora por presuntos actos de indisciplina almomento elunicodelsureste informacinparati
77,11314,se va chivas el rebao sagrado parte a estados unidos donde encarar los amistosos ante pachuca y toluca el mircoles y sbado
78,11315,henry martin y su vulgar festejo en el chivas vs amrica que escandaliza a los falsos puritanos de la tv
79,11316,o sea s ahorcamos a henry y le picamos un ojo para luego burlarnos de eso tanto jugadores como cm pero es que no se vale el festejo de henry el sbado pasado nos ofendi que la liga haga algo lgica digna de un equipo pendejo como lo es chivas
80,11317,oye chivas no hagan sus mamadas de semana de medios y convivencia con los jugadores del ratlas mejor que se concentren en entrenar y afinar la puntera los delanteros que buena falta les hace
81,11318,el tawhid el derecho de allah sobre sus siervos felizlunes yoonsanha saudiarabiangp dainternacionaldelafelicidad chivas zcalo
82,11319,chivas se queja con la comisin disciplinaria por el festejo de henry martn crezcamosjuntos fcaguilas amrica y ya
83,11320,felizlunes yoonsanha saudiarabiangp dainternacionaldelafelicidad chivas zcalo verstappen alonso jisoo concept poster
84,11321,hoy a las 21 00 hrs la neta del ftbol l amp l en vivo por facebook temas chivas no fue rival para clubamerica tigresoficial no mereca perder lo de pumasmx insostenible cruzazul sigue sumando fcbarcelona es cerca del ttulo schecoperez destacadsimo eduardotrelles
85,11322,felizlunes yoonsanha saudiarabiangp dainternacionaldelafelicidad chivas zcalo verstappen alonso jisoo concept poster
86,11323,felizlunes yoonsanha saudiarabiangp dainternacionaldelafelicidad chivas zcalo verstappen alonso jisoo concept poster
87,11324,mxico
88,11325,esta es la gente la puta gente la pinche gente que sostiene la grandeza de este club chivas
89,11326,viva la chivas
90,11327,ya que no puedo presumir a mis chivas ltimamente jajaja
91,11328,zonaviral el actor mexicano cristofernandez cuenta que jug futbol en guadalajara antes de participar en la serie tedlasso jugu futbol en mxico lo hice en diferentes equipos nac en guadalajara y le voy a las chivas resalt el actor en una entrevista
92,11329,video la millonaria sancin que pagara henry martn tras su festejo ante chivas
93,11330,no solo chivas uso nike si no que tambien su filial chivas tijuana quienes serian el primer equipo en usar nike en ascenso agradecimientos a uriel pea lopez
94,11331,este wey est en el top de los ms pendejos que me he topado de twitter chivas jajajaja prefiere tirarle mierda a la aficin que a los pendejos que no le pusieron huevos en la cancha
95,11332,este es el tour de chivas que se enfrentara a tolucafc en el dignityhealthsp todo esto por pizarra deportiva impulsamos t pasin chivas tolucafc
96,11333,creo que ya era para que la aficin del chivas mandara muy a la verga a alexis desde que presuma con su vieja tripona su ropa fea y que segn ambos si les decan algo era envidia tiene el derecho a comprarse lo que quieran pero me acuerdo de eso y me da un chingo de pena
97,11334,ya estn listos los aficionados de chivas para soplar la corneta en el clsico
98,11335,viene una semana con dos enfrentamientos de preparacin en territorio estos sern los rivales del guadalajara
99,11336,chivas va por el camino correcto jorgeramosfut ahora espndeportes seguimos en vivo
100,11337,tw chivas llenando el dm de fernando hierro con el vdeo de alexis vega pisteando slo para que lo regaen y lo vendan en verano
101,11338,dice la identidad de todo un pas el mexicanismo puro jajajajjaja la mayora de la aficin de chivas es puro pocho o chicano que le va a las chivas por que su abuelito cuando se fue para el otro lado les conto de chava reyes cada da es menos el mexicanismo
102,11339,disculpas mis huevos ya no lloren chivas
103,11340,y responsabilidad de quien esos cientos de miles de cdulas chivas
104,11341,no autorizo que carlos cisneros sea jugador de las chivas no tiene nivel y la calidad para pertenecer a este gran equipo amauryvz huerta cesar josemagarrido fercevallosf
105,11342,rayadas y chivas tuvieron oportunidades de hacer dao pero se neutralizaron y firmaron la igualada
106,11343,les falta sangre les falta valor lvaro morales expone a las chivas que no reaccionaron ante celebracin de henry martn
107,11344,la verdad los jugadores de chivas muy tibios en cualquier otro pas un jugador llega a hacer eso en un clsico y yo creo si se suspende el juego por la bronca que se armara
108,11345,seguimiento especial alexis vega frustrante y ansioso regreso con chivas clasico para el olvido
109,11346,club america embarrasses chivas in clasico
110,11347,idnticos los goles que meti cabecita vs tigres y chivas
111,11348,los beatles con la de las chivas
112,11349,este fin de semana estuvo lleno de clsicos en el ftbol alrededor del mundo y nosotros platicaremos de lo que nos dejaron clsicos feyenoord ajax amrica chivas tigres monterrey lazio roma inter juventus barcelona real madrid
113,11350,club america embarrasses chivas in clasico
114,11351,jajaja omarvv9 chivas clsiconacional
115,11352,jajaja omarvv9 chivas clsiconacional
116,11353,jajaja chivas desdelacuna felizlunes
117,11354,en el festejo de henry martn me decepcion el festejo no me gust pero tampoco me gust que ningn jugador de chivas fuera a reclamarle no a armar una bronca pero a decirle algo miguel gurwitz en clarosportsmvs 102 5 fm 336 dish
118,11355,dej mucho que desear la actuacin de chivas en la derrota ante el amrica nete al debate en clarosportsmvs y manda un mensaje al 5554022844 102 5 fm 336 dish
119,11356,ah que las chivas ya pidieron castigo para henry martn por el festejo jajajajajajaj result que los putitos son otros
120,11357,el otro dia vi una peli xxx que terminaba exactamente igual
121,11358,que chivas
122,11359,chivas necesita tener un plantel ms competitivo las ausencias de macas y vega s se notaron destaco la contundencia del amrica y el nivel de juego nicolasromay en clarosportsmvs 102 5 fm 336 dish
123,11360,este domingo reserva tu plaza para nuestro men con lamian y chivas
124,11361,vale s bad day esto me bas en una escena de conker s bad fur day me pareci que queda por lo del partido de chivas vs amrica me doli esa derrota conkersbadfurday furry furryart furryartwork furrygoat goat ibispaintx
125,11362,responsable esto sasha grey se hizo streamer y por qu trae la playera del chivas 0 sashagrey chivas streamer
126,11363,chivas est igual qu t mija se mueren por puro pendejo
127,11364,este fin de semana fue de clsicos en el ftbol mexicano y espaol el club amrica fue el vencedor en el clsicodemxico por marcador de 4 2 ante las chivas en el akron el fc barcelona se impuso al real madrid 2 1 para seguir de lder en la liga qu te parecieron
128,11365,ahora que dices omarvv9 que estabas a mame y mame con que tus chivas estaban en zona de clasificacin directa
129,11366,por supuesto que el festejo de perrito es una falta de respeto esa era la puta idea demostrarle al chivas quin pinches manda
130,11367,alexis vega se ve muy triste por la derrota de chivas en el clsico
131,11368,las chivas ya pidieron castigo para henry martn por el festejo en el clsico quieren defender en el escritorio lo que no pudieron en la cancha
132,11369,amrica vs chivas lunes de cobrar apuestas ni modo chivahermanos les toca pagar tras perder en el clsico nacional el monero de qucho
133,11370,el prximo 25 de marzo nos enfrentamos ante chivas en los ngeles california sbado 25 de marzo 17 30 hrs hl dignity health sports park chivas amistoso demivida
134,11371,en vivo amrica humill a chivas en el clsico de mxico la octava sports
135,11372,conjunto pants y chamarra chivas fit unisex adulto t g gt puedes encontrar una lista con ms productos aqu
136,11373,la reflexin de un aficionado de chivas cmo le voy a decir yo a mi hijo que le vaya a este equipo un padre racional
137,11374,soy chivas jajaja
138,11375,amrica humill a chivas en el clsico de mxico sintoniza el mejor programa luego de elclsicodemxico 1030 am tedamasemociones ligamx
139,11376,es lunes crudo soltero gan el atlas gan el barcelona y perdieron las chivas la vida es re bella
140,11377,servicio a la comunidad no se sabe nada de esta persona se vi por ltima vez minutos antes del partido amrica vs chivas seas particulares habla mucho corre menos que los porteros y le gusta soplar cornetas
141,11378,y entonces las televisoras repitieron hasta el cansancio el mejor clsico es amrica vs chivas jajajajjaa ni llenaron su estadio clsico clsico129 clsiconacional arribaelmonterrey
142,11379,amrica golea 4 2 a chivas y se lleva el clsico nacional cabecita y martn anotan
143,11380,nuevo episodio de    merece castigo el festejo de henry martn en el clsico diesestrada lo de chivas no fue un accidente alvaritomorales el enemigo estaba en casa para rafa puente
144,11381,alguien puede explicar el festejo de nuestra comandante carojaramillo94
145,11382,qu mensaje motivacional le diras a emilio lara tras su error contra chivas clubamerica somosamerica siempreaguilas
146,11383,despus de la derrota ante amrica no es hora de que amaury haga eso
147,11384,benito jurez y todo oaxaca son cagada ojal pronto otro temblor a esos indgenas huevones
148,11385,las jugadoras del chivas
149,11386,todos fueron unos putos golazos contra chivas pero no supero este golpeo este movimiento de cuerpo que pinch golazo
150,11387,edgarmartinez no est capacitado para ser jefe de medios de chivas chivas conferencia de prensa conjunta con los jugadores del clubamerica amrica qu burdo espectculo fue eso por querer hacerle al ocurrente
151,11388, en vivo clsico nacional feria de goles con un definitivo triunfo del america frente a chivas chivas 2 4 america final canal28nl
152,11389,maldito genio el que cuadr empezar a hacer todos los clsicos mundiales el mismo fin de semana chivas america juve inter lazio roma barcelona real madrid ajax feyenoord y el clsico de los nuevosricos irraragori vs chucho martinez len santos
153,11390,no era este tipo junto con capitanfc13 los que en un space dijeron que amrica perdera con tigres y chivas
154,11391,esta ser la multa a henry martn tras la polmica celebracin ante chivas ms
155,11392,nunca hubo clusula de compra a duras penas dieron chance de extender el prstamo pero no pasa nada se fue karol pero seguimos desarrollando juveniles ah est anacamila hernndez
156,11393,as qued el historial clsiconacional jj245 ganados por clubamerica 89 empates 79 ganados por chivas 77
157,11394,tanto los chairos como los americanistas que parecen lo mismo sacan el cobre en la gran marcha de amlo y el clsico del ftbol mexicano as no chairos as no americanistas los leo zullydeportes clsicodeclsicos clsicodelftbol chivas amrica
158,11395,siempre a tu lado chivas
159,11396,pinche equipiy aficion chillona se las dan de vergueros y cuando les toca tragar no aguantan saludos chivas
160,11397,hablaron en la cancha amrica le dio un repasn a las chivas que ni las manos metieron en el clsico nacional pudo ser ms abultado el marcador lo debaten miguel gurwitz raulorvananos rodolfolanderos y raoulpolloortiz en mothersoccer
161,11398,la neta gente que este con su lloradera por lo de henry da vergenza deben entender que es futbol y as como la tribuna se divierte los jugadores tambin son humanos tienen derecho de sacar su euforia estoy seguro que si chivas hubiera ganado no dirian nada por ese festejo
162,11399,que ardidos estan los chivas gay y buscan palabras frases y no las encuentran la grandeza del america es desde aos atras sus titulos han sido bien ganados y no por pertenecer a una gran televisora pongan de pretesto quesus titulos son de una telenovela el ame no compra
163,11400,multa millonaria lo que tendra que pagar henry martn por su festejo ante chivas
164,11401,como era de esperarse chivas y rayadas ofrecieron un gran juego de goles igualado a dos las regiomontanas mantienen el invicto gracias a los goles de carlee giammona y cburky2 mientras que las tapatas empataron con damarisgodinez3 y carojaramillo94 chivasfemenil
165,11402,en alma canchera asilascosasw wradiomexico hoy presentamos estoy triste el clsico amrica golea 4 2 a chivas va wradiomexico
166,11403,alberto medina defendi el escudo de chivas durante ms de una dcada
167,11404,chivas ni las manos meti los hijos de su mothersoccer le entran a las reacciones tras el clsico nacional en donde amrica pase al rebao escucha el episodio del podcast disponible con miguel gurwitz raulorvananos rodolfolanderos y raoulpolloortiz
168,11405,cmo amanecieron fercevallosf chivas enriquevonbeas edgarromogdl faitelson espn y ah viene el atlasfc que les acabar de romper los vasos para que ya se complete la masacre
169,11406,que chsm el puto calor y las pedorras chivas tambin
170,11407,lo paila que es ver que con otros si pero contigo no
171,11408,el futbolista mexicano y en general el que est en ligabbvamx no respeta la jerarqua o los conocimientos de algn dt que no fuese futbolista en el pasado le paso a leao en chivas a chelis cuando sus chicos crecieron en puebla y le est pasando a fentanes
172,11409,si tus besos fueran las chivas yo soy este peligroso
173,11410,se rompe algun codigo si me cambio de equipo de ftbol estoy pensando dejar los tigres y unirme a las chivas tigres chivas
174,11411,los ms fieles somos los que le vamos a las chivas
175,11412,una leyenda de chivas critica fuertemente a los jugadores del club tras la derrota ante america
176,11413,un aficionad de chivas quera la firma de desmonsivais y ella lo cumpli la rivalidad se queda en la cancha as es el ftbol
177,11414,cumpliendo el sueo de todo aficionado de las chivas estar en la cancha del rebao sagrado gracias newmix por invitarme al clsico del futbol mexicano para apoyar al equipo esdeclasicosmezclar
178,11415,puro pendejo le va a las chivas
179,11416,el recado de leo suarez a chivas luego de ganar el clasico nacional
180,11417,es increble con q poco hoy en da se puede vestir la playera del rebao sagrado una vergenza lo q amauryvz y familia han abaratado a chivas
181,11418,tanto los chairos como los americanistas que parecen lo mismo sacan el cobre en la gran marcha de amlo y el clsico del ftbol mexicano as no chairos as no americanistas los leo zullydeportes clsicodeclsicos clsicodelftbol chivas amrica
182,11419,al trmino de la jornada12 de la ligabbvamx con la victoria en el clsiconacional ante chivas el clubamerica sube a la segunda posicin venga guilas a levantar mas ese vuelo vamosamrica
183,11420,fue mejor que las aguilas del america no hubiera super goleado a un rebao mediocre y soador porque asi la aficion de las chivas seguira llenando el estadio aunque nunca sean campeones en una decada mas ni con los millones se hacen campeones a los equipos y soverbios chivas
184,11421,muchas felicidades jona2118 por ser el jugador del partido de la jornada12 en el clsiconacional contra chivas elegido por la aficin
185,11422,es increble e inaudito que en chivas carlos cisneros es ms que bouquet pvel o zahid
186,11423,el colorido que le dan estos maes a la finca increble lo chivas que son cortez amarillo
187,11424,al menos la portera de chivas hizo el intento
188,11425,los jugadores de ftbol como henry martn necesitan cultura general esto tiene ms valor que la fama y el dinero y pobre criterio de los que apoyan acciones como la que tuvo en jugador en el juego contra chivas
