,Tweet Id,Datetime,Tweet,Username
1150,1637804760332894210,2023-03-20 13:14:18+00:00,Porque no le quitan el celular a Coloma ?? Lo están pauteando por wazap en @ContigoCHV @chilevision,1969Carvajal
1151,1637804527859429376,2023-03-20 13:13:23+00:00,"-Dibujan la raya mal
-No es que esté mal, es que se la ha metido Carvajal
https://t.co/XmDF1SpGoE",luysen
1152,1637804309839585283,2023-03-20 13:12:31+00:00,"Yo no digo que los jugadores del Tottenham no sean culpables, pero contre, ahí donde va, crea un ambiente hostil.

El cree ser el amo y dueño del fútbol.",AlexCarvajalV_
1153,1637804242072223744,2023-03-20 13:12:14+00:00,uno que sabe perder es carvajal,swiftndaya
1154,1637804073721135107,2023-03-20 13:11:34+00:00,Carvajal rima amb subnormal,sants_marc
1155,1637803904833318913,2023-03-20 13:10:54+00:00,"Pierdo un seguidor diario.
¡VETE A LA PUTA MIERDA, ELON!",Wily_S
1156,1637803875921952769,2023-03-20 13:10:47+00:00,En todos los informes de gestión de los gobernadores del psuv ellos viven en otro mundo porque no están acordé con la realidad que viven los habitantes de sus estados https://t.co/Hv1ywte6PT,ArbenisCarvajal
1157,1637803700264525830,2023-03-20 13:10:05+00:00,"👀 | Ayer un gesto muy antideportivo de Dani Carvajal provocó a Arnau Tenas y estalló.

🔜  Tras el pitido final, Tenas iba a celebrar el triunfo culé, pero Carvajal se interpuso y le pasó la mano por el cuello. Jordi Alba estuvo atento y les apartó.",Kiraki_GOD
1158,1637803693012668416,2023-03-20 13:10:03+00:00,Tengo a Carvajal en el fantasy 💀,Camavinismo
1159,1637803576918523904,2023-03-20 13:09:36+00:00,"#20Mar #LaFANBEsVenezuela

En La GNB #SomosGuardianesDelPueblo y trabajamos con tesón para garantizar sj seguridad y protección.

.@GNBNvaEsparta https://t.co/uK3nz5GORa",CarvajalBravoC
1160,1637803549387108352,2023-03-20 13:09:29+00:00,"#20Mar #LaFANBEsVenezuela

Los centinelas permanentes de la patria seguimos protegiendo nuestro territorio nacional.

#SomosGuardianesDelPueblo
.@zulia_gnb https://t.co/wAo6xY6sbM",CarvajalBravoC
1161,1637803485428154368,2023-03-20 13:09:14+00:00,"Los colombianos estamos hasta el copete con tanta polarización, el país lleno de necesidades y algunos políticos perdiendo tiempo  en Twitter. Más bien pónganse a trabajar para que volvamos a ser la Suiza latinoamericana que éramos antes de @petrogustavo #ColombiaVaBien",EdwinC_Espana
1162,1637803402959757317,2023-03-20 13:08:54+00:00,"Q putísimo asco da el fascista de Carvajal y el madri como siempre demostrando su gran perder como siempre, menuda fiesta es leer el marca hoy",AlJotaEme
1163,1637803332063379456,2023-03-20 13:08:37+00:00,"1.                                   2. Si el var hubiese
El var trazo las.        Pausado justo 
Líneas antes que.  Cuando Carvajal 
Carvajal tirará el.   Tira el centro no 
Centro claro.            Era Offside.
Offside ✖️.               ✔️. https://t.co/cx7ITXBMZB",euri_pozo
1164,1637803270365233152,2023-03-20 13:08:23+00:00,"Lo dije en el momento del partido que ocurrió, el segundo gol del Barça debió de ser revisado por el VAR y anulado por falta de Lewandowski a Carvajal, pero no hay nada.

Vergüenza de ganar una liga así...😅 https://t.co/kFfAB7s8AA",SrDanielito_
1165,1637803206733443073,2023-03-20 13:08:08+00:00,"Jugar con Carvajal es peor que jugar con 10 es jugar con uno en tu contra. Jugada en ataque que acaba en centro sin sentido, pierde la posición, toda la defensa tiene que bascular, centro por su banda a 2º palo aprovechando el movimiento, gol. Y esto ha pasado en muchos partidos.",drakkar_blanco
1166,1637803121450659840,2023-03-20 13:07:47+00:00,"a los llorones de #ElClasico os acordáis de alguna parada de merito de ter stegen por que yo de courtois si, vuestro único gol fue sin querer, que den gracias que no hayan expulsado a nacho y carvajal aunque vete tu a saber que es peor, regalo es que haya madridistas en la roja",ja2sm1
1167,1637803088235974656,2023-03-20 13:07:39+00:00,"Luis de la fuente ha preferido llevar  a Carvajal antes que a Arnau Martínez, vamos a volver a ser la floja https://t.co/rbVREnieac",cholobus
1168,1637802990588313603,2023-03-20 13:07:16+00:00,Lo de Carvajal en el gol 2-1 del Barça es pura poesía y este es el lateral derecho de la selección. https://t.co/riOQZ8sfnt,antoniioo_mg
1169,1637802977741111298,2023-03-20 13:07:13+00:00,"Bajas: Benzema, Carvajal y Hazard Altas: Cancelo, Saka y un 9 tipo Vlahovic/ Oshimen",_aleeexx3
1170,1637802957847638017,2023-03-20 13:07:08+00:00,"#20Mar #LaFANBEsVenezuela

En la #GNB trabajamos diariamente para garantizar la Paz del Pueblo Venezolano.

#FANB al servicio de nuestro pueblo. #SomosGuardianesDelPueblo
@GnbGaranteDePaz https://t.co/LYS93wWHJ5",Cmdte71E
1171,1637802878579490820,2023-03-20 13:06:49+00:00,"#20Mar| #LaFANBEsVenezuela
El GAES 71 NUEVA ESPARTA le exhorta a la ciudadanía a no responder llamadas de números desconocidos, así previenen ser víctimas de Extorsión. 

#GNB 𝐍𝐮𝐞𝐬𝐭𝐫𝐚 𝐦𝐢𝐬𝐢𝐨𝐧 𝐞𝐬 𝐩𝐫𝐨𝐭𝐞𝐠𝐞𝐫𝐭𝐞.
#SomosGuardianesDelPueblo
#FANB @GnbGaranteDePaz https://t.co/NEsHx2H0fR",Cmdte71E
1172,1637802574823800834,2023-03-20 13:05:37+00:00,Arnau Tenas y Dani Carvajal protagonizaron la pelea con más revuelo de El Clásico https://t.co/1V1hIdtf26,eldiariony
1173,1637802488073011204,2023-03-20 13:05:16+00:00,"A saber que le diría a Carvajal, para que vaya a por un random que ni juega, encima luego se pone matón tratando de perseguir a Carvajal.
Como echo de menos a Mourinho, Pepe y Ramos…
Porque ese random se iba calentito anoche",Sora_97
1174,1637801995170983937,2023-03-20 13:03:19+00:00,"Tan marica, pues morirme igual que todos 🤷🏻‍♂️",CarvajalHeison
1175,1637801953517346820,2023-03-20 13:03:09+00:00,"Carvajal y Nacho siguen en pleno 2023 en el Real Madrid por llenar el cupo de  españoliiitos y canteranos. Pero qué malos son, me cago en mi puta madre jajajajajajajaajajsjsjs",DGutierrezzz
1176,1637801792267341828,2023-03-20 13:02:30+00:00,En Madrid dicen que Arnau Tenas y Carvajal se cruzan e incluso que Arnau Tenas va a buscar a Carvajal.,gbsans
1177,1637801757014196224,2023-03-20 13:02:22+00:00,"Me flipa que los cuñaos hayan llegao juntos la verdad jajajajaaj, seguramente carvajal dormiría en casa de Joselu anoche https://t.co/1cdPdoiA2d",malaideaESP
1178,1637801593058861056,2023-03-20 13:01:43+00:00,"Un gesto antideportivo de Carvajal provocó a Arnau Tenas 🤬.
👉🏼 El jugador del Madrid lo señaló con el dedo y luego se pasó la mano por el cuello. https://t.co/b4zlOOiPaK",FtbolPasion10
1179,1637801356927877120,2023-03-20 13:00:47+00:00,🇻🇪 La fiscalía española pide prorrogar la prisión provisional del Pollo Carvajal https://t.co/FuABK64uey,ALnaviocom
1180,1637801224706588674,2023-03-20 13:00:15+00:00,Piden a la Audiencia Nacional prorrogar la prisión provisional de Hugo Carvajal en España  https://t.co/Frr2mFXrrh,Aperturaven
1181,1637801223339364352,2023-03-20 13:00:15+00:00,I've just posted a new blog: Piden a la Audiencia Nacional prorrogar la prisión provisional de Hugo Carvajal en España  https://t.co/DHaFQfN5XJ,Aperturaven
1182,1637801223276445696,2023-03-20 13:00:15+00:00,Piden a la Audiencia Nacional prorrogar la prisión provisional de Hugo Carvajal en España https://t.co/58PSARPKFe,Aperturaven
1183,1637801186559401984,2023-03-20 13:00:06+00:00,"Bajas: Hazard, Odriozola y Mariano fijos. Mendy, Carvajal y Asensio si alguno tira oferta.

Altas: 3 de alguno de estos: Haaland, Davies, Cancelo, Bellingham, Salah, Kvraskchelia, Osimhen. 

Seguramente no ficharemos a nadie de esos y lo que nos venderán será el regreso de Hazard",pedrocarreras12
1184,1637801128506040322,2023-03-20 12:59:52+00:00,"Valverde está en mal momento, juega porque hace de lateral en defensa ya que Carvajal no sirve y suple el físico que le falta a Modric por dentro.

Nos quedamos sin extremo derecho para tapar otras carencias.

Estamos en banda derecha sin ataque y Rodrygo en el banquillo.",sacy_
1185,1637800962608840705,2023-03-20 12:59:13+00:00,"Hasta el más bobo (elige a quien quieras: Carvajal, Ceballos, Rudiger...) sabe que cuando habla José Félix quien lo hace realmente es el Don.
Seguro que Laporta ya lo sabe de sobra.
La guerra contra la mafia es dura, pero también gratificante. 

https://t.co/OoRTMFS8yr",Camalus_G
1186,1637800943365267457,2023-03-20 12:59:08+00:00,"El partido de varios jugadores titularísimos del Madrid da para replantearse muy mucho su futuro.
Carvajal, Benzema, Modric, Kroos,...",DontLookBackin6
1187,1637800560186257410,2023-03-20 12:57:37+00:00,Como no es Gavi el que fue a buscar pelea la prensa española seguirá callada. Carvajal agarra del cuello a Arnau Tenas tras el pitido final del partido.,messilloso
1188,1637800258804629504,2023-03-20 12:56:25+00:00,carvajal por dios esq me voy a pegar un disparo en la nuca https://t.co/Omos4GFvO6,rmcfvs
1189,1637800027841069057,2023-03-20 12:55:30+00:00,poco se habla pero carvajal es de lo más guarro del madrid tb,_realitiesfan
1190,1637799813226934272,2023-03-20 12:54:38+00:00,Me van a odiar pero para mi Carvajal no tiene nivel de selección.,Natalia___1016
1191,1637799730905337856,2023-03-20 12:54:19+00:00,"Creí que solo yo había notado esto, lamentablemente lo de carvajal",FrankieRecinos
1192,1637799711976423427,2023-03-20 12:54:14+00:00,"El único que tiene algo de honor, Daniel Carvajal.",Y0sevaJartangas
1193,1637799700681113600,2023-03-20 12:54:12+00:00,En esa imagen  ya hace “media hora “ que el balón saliós del pie de Carvajal. https://t.co/6g3buJi8Q9,BaraGirls1
1194,1637799617914892288,2023-03-20 12:53:52+00:00,"Literalmente Carvajal fue a por Arnau y él respondió como es evidente.

Menudos payasos con su relato https://t.co/GMRjOVauOj",ImReyEtooFCB
1195,1637799464428527618,2023-03-20 12:53:15+00:00,Nunca he soportado a ese carvajal de mierda,AugustoGuardia
1196,1637799437639602178,2023-03-20 12:53:09+00:00,esse carvajal merece uma surra q odio,sofiaa_nunees
1197,1637799433029951488,2023-03-20 12:53:08+00:00,El pasado #19Marzo los y las estudiantes voceros @FEVEEM de las parroquias #Caracas disfrutaron y compartieron en la formación. @MPPEDUCACION @_LaAvanzadora @vicent_carvajal @gracielamarilis https://t.co/EutytV4OyU,CDCECaracas
1198,1637799342126792704,2023-03-20 12:52:46+00:00,"Carvajal estaba más preocupado de cogerle del cuello a uno del banquillo que de jugar al fútbol.

Ahora se entiende todo. https://t.co/Fdk6QqNUnL",cesaar25__
1199,1637799139810373633,2023-03-20 12:51:58+00:00,"➡En esta nueva entrada del blog del Centro Jose Guerrero, el poeta granadino Antonio Carvajal ha elegido la obra de José Guerrero, Penetración (1961), para interactuar con ella desde la poesía. 

https://t.co/XW3ZZSwSP3 https://t.co/JKCsvMkZEz",centro_guerrero
1200,1637798898080030725,2023-03-20 12:51:00+00:00,Carvajal es un meme en esa jugada  😂😂,kansa_liebres
1201,1637798767050014723,2023-03-20 12:50:29+00:00,Carvajal es una rata de cloaca no lo vamos a descubrir hoy....,IsmaOvd
1202,1637798708870893568,2023-03-20 12:50:15+00:00,Un guarro Carvajal. Nunca ha sabido perder.,icecube1396
1203,1637798643905495042,2023-03-20 12:50:00+00:00,"¡Por riesgo de fuga! 🧐 | Fiscalía española pidió prorrogar prisión de Hugo ""El Pollo"" Carvajal https://t.co/ptT0wSAdh9",Elpolitidog
1204,1637798639077666819,2023-03-20 12:49:59+00:00,El Real Madrid es un equipo que lleva años sin tener laterales que den ofensivamente lo que merece un club como este. Y no se hace nada por solucionarlo. El partido ayer de Carvajal es dantesco.,lamoradaRM
1205,1637798631183974401,2023-03-20 12:49:57+00:00,Carvajal es la viva imagen de lo que es ese equipo del real Madrid,EusebioRecoge
1206,1637798285896482816,2023-03-20 12:48:34+00:00,New York: Arnau Tenas y Dani Carvajal protagonizaron la pelea con más revuelo de El Clásico https://t.co/C6sKQBZraz,digital_fv
1207,1637798248348786690,2023-03-20 12:48:25+00:00,Carvajal es lo más payaso del fútbol nacional. Y encima un cagon,Jorgeatleti11
1208,1637798203633418245,2023-03-20 12:48:15+00:00,Carvajal es el símil de asqueroso de Jordi Alba pero encima es guarro jugando,cape_marcos
1209,1637798178626912259,2023-03-20 12:48:09+00:00,EN VIVO | Lince: estudiantes del colegio Melitón Carvajal inician el año escolar. ►https://t.co/CQqGke3fCf https://t.co/QP36lbHsjj,noticias_tvperu
1210,1637798098800979968,2023-03-20 12:47:50+00:00,Son tan penosos que en la primera foto la pelota ya salió de los pies de Carvajal. Eres la peor escoria periodística y mira y que hay gente peor eh.,alejoropeza
1211,1637797949123051522,2023-03-20 12:47:14+00:00,"Si miran mi perfil, sabrán algo de mi 😅

#casadoconhijos #ToleranciaCero #PedroPascal #despiertaconchv #reportajeschv",Leo_Tuitero
1212,1637797717161177089,2023-03-20 12:46:19+00:00,Carvajal 2023 está al nivel de Marcelo 2022. Honor para siempre pero no puede jugar de titular lo que queda de temporada.,Ragolay
1213,1637797701621280772,2023-03-20 12:46:15+00:00,Pocos jugadores me gustan menos que Carvajal,lucasazp19
1214,1637797402475110400,2023-03-20 12:45:04+00:00,"Fijaros en Carvajal, ""el lateral de la selección española""

😂😂😂😂😂😂

https://t.co/2KgMyReJd2",cesaar25__
1215,1637797401808306176,2023-03-20 12:45:04+00:00,"Y el Madrid destacó para mal, soy muy madridista peor también tengo autocrítica. Kroos, benzema, vini, carvajal para mí los peores. Y tenemos problemas tanto arriba como abajo, a pesar de mantenerse el equipo a bajo siempre había alguno del barça solo.",naiaraatrrss
1216,1637797258635689984,2023-03-20 12:44:29+00:00,"La secuencia de Carvajal es patética, propia de un benjamín. Pero ojito también al repligue colectivo. Nadie tapa el agujero. Solo Tchou hace un mínimo amago de ir, pero rápidamente vuelve a su zona teórica. Obvio que el partido estaba roto, pero joder…",GLP_87
1217,1637796930427256837,2023-03-20 12:43:11+00:00,Arnau se va a por Carvajal por que le agarra del cuello HDP,miguecabreracc1
1218,1637796924773355520,2023-03-20 12:43:10+00:00,Más sol!!!! Bienvenida Primavera!!! 💐🙏🏽,mcarvajal1966
1219,1637796729662717958,2023-03-20 12:42:23+00:00,"¿Cómo usar los corchos de #vino en tus plantas?

 Algunos de sus beneficios, tal vez te interese un truco para poder reusar los corchos en tu #jardinería y por eso es que te lo digo para que tus plantas reciban la primavera con el pie derecho. Así que ¡toma nota!

Abro 🧵🧵",andres43156
1220,1637796654945271813,2023-03-20 12:42:05+00:00,"Carvajal, el único jugador del mundo capaz de golpear dos veces en el mismo centro.",pmanso15
1221,1637796568223940609,2023-03-20 12:41:45+00:00,más gente como Carvajal en mi equipo o por lo menos con su actitud,anarosalp14
1222,1637796487525482500,2023-03-20 12:41:26+00:00,"Como ya me imaginaba este frame engaña porque si se mira desde otra perspectiva se demuestra que en ese momento ya Carvajal no toca el balón,que sale de la bota del jugador al primer contacto,por lo tanto la imagen siempre será la buena la del primer toque.
Que no os embauquen. https://t.co/PcQX5m2zDL",BaraGirls1
1223,1637796422408912899,2023-03-20 12:41:10+00:00,QEPD Alipio Vera,Leo_Tuitero
1224,1637796407187853312,2023-03-20 12:41:06+00:00,ahora que decimos y la lewa a carvajal tampoco !!!!!!!!!!,yuan_24
1225,1637796373566308355,2023-03-20 12:40:58+00:00,"Hay varias cosas que han pasado piolita.

https://t.co/8ZfmQHeEcW",Leo_Tuitero
1226,1637796194838536194,2023-03-20 12:40:16+00:00,"Esto y un viaje con el codo en la boca a Carvajal... y se fue sin amarilla, una vez más... qué puto asco el Golden Boy... por cierto, quién da ese premio? Negreira? Existiendo Bellingham o Musiala no tiene ningún sentido que se lo llevara este ser...",E_Dominici
1227,1637796177910411264,2023-03-20 12:40:12+00:00,LO MAS PEGAO #Musica #WBCenFOX Dime Que Si En Vivo ®Peter Manjarres Camilo Carvajal by Desconocido #Colombia #WBCenFOX 👇 https://t.co/kwqcd6vhGG,ZuliaVallenata
1228,1637796054543261699,2023-03-20 12:39:42+00:00,"Hasta en la selección me voy a tener que comer a Carvajal... que horror de verdad.

Pero es que mirando el LD en España no se si es peor Carvajal o todo lo demás. Pero bueno, espero que ponga a Pedro Porro.",iamGuTy
1229,1637795963396915201,2023-03-20 12:39:21+00:00,"Carvajal siempre ha sido un pandillero. Dentro y fuera del campo. Lo que no es habitual es que lo haga a la cara, porque lo normal es que lo haga de forma sibilina, como la rata de Jordi Alba. Perfiles muy parecidos.
Me prestó el pelotazo de Kounde el año pasado.",alfredoarmal
1230,1637795902411661318,2023-03-20 12:39:06+00:00,"Que tipo estúpido Carvajal, jugador recontra odiable",Deku_NicoZ
1231,1637795851807367168,2023-03-20 12:38:54+00:00,"No es que son la mejor dupla del mundo? El balón de oro? Y… bueh, Carvajal? Mi no entender 🤷🏻‍♂️",Barca_u_s_a
1232,1637795806768922625,2023-03-20 12:38:43+00:00,Carvajal tiene rato buscando que le metan su coñazo,Santavy_
1233,1637795681107599360,2023-03-20 12:38:13+00:00,El favor se lo hicieron a Carvajal porque le partia la cara facil,Sergiodq_05
1234,1637795481223823360,2023-03-20 12:37:26+00:00,"El día después: Carvajal se puso a decir cosas y crack del Barcelona enfureció, tuvieron que agarrarle entre cinco para detenerle. La agresión de Gavi y vean el ex jugador culé que visitó a sus excompañeros ¡ROSALÍA LE GANÓ APUESTA A RAUW! 

https://t.co/SbS7FsHSjS",DiarioDiezHn
1235,1637795358804672514,2023-03-20 12:36:56+00:00,"y añado más, por qué Benzema y Carvajal terminaron el partido…",miguelcssc
1236,1637795220195627008,2023-03-20 12:36:23+00:00,Como manipulan cuando es Arnau el que le dice algo y se encaran 🤣🤣🤣 vaya negreiros están echos y eso que día agresiones de gavi fue a Carvajal y otra a ceballos sin balón,ViniDor
1237,1637795219893547009,2023-03-20 12:36:23+00:00,"Todo el mundo ve que Benzema está fundido menos Ancelotti, Carvajal aunque ayer no estuvo mal fue un error su renovación.",RSanz52
1238,1637795117732855808,2023-03-20 12:35:59+00:00,gracias carvajal por la derrota de ayer me he levantado y me he acordado de ti subiendo a atacar sin ningún sentido,borchsanchez11
1239,1637795008173441026,2023-03-20 12:35:33+00:00,Los que dicen que Carvajal no llega en la última jugada porque estaba fundido de darlo todo... Precisamente se necesita alguien que aguante 90 minutos de máxima exigencia. Si no estás para eso... No estás para titular,Eduardo26311370
1240,1637794865273552903,2023-03-20 12:34:59+00:00,No entiendo que problema habrán tenido pero ¿? Carvajal con un canterano,Moidzh
1241,1637794639984971777,2023-03-20 12:34:05+00:00,Carvajal tiene serios problemas.,luispelle97
1242,1637794374259027974,2023-03-20 12:33:02+00:00,La portada deberia ser para Carvajal y su performance en el 2-1,EstamosEnLaBe
1243,1637794216058273792,2023-03-20 12:32:24+00:00,Carvajal se mete con carajito luego de perder en el descuento. @DaniCarvajal92 cómprate unas bolas.,ASerritiello22
1244,1637794096436637696,2023-03-20 12:31:55+00:00,Carvajal es escoria. https://t.co/4DbFxdaXt3,14_flying_dutch
1245,1637794077256155139,2023-03-20 12:31:51+00:00,"Carvajal es el peor jugador del Madrid desde hace bastante, muy madridista, nos ha dado todo, pero ya es hora del relevo",mg_octa
1246,1637793950147788800,2023-03-20 12:31:21+00:00,"#legaldealmaker se hace eco de la incorporación de Luis Carvajal como socio de #Legal, para reforzar la especialidad de M&amp;A y unirse al equipo de socios de Mercantil de @RSM_es https://t.co/z70GUONKgz
#Legal #DerechoMercantil
https://t.co/F4vRv9Dlvx https://t.co/kk2pzbOHax",RSM_es
1247,1637793421023641600,2023-03-20 12:29:14+00:00,"Carvajal es un muerto que no tiene nivel para jugar en este equipo (desde hace años) pero aquí se le sigue idolatrando porque es muy madridista y porque en la última final de la champions (la única en la que no se ha lesionado) defendió bien a ""Luis Díaz"".",dabiz_24
1248,1637793389121789952,2023-03-20 12:29:07+00:00,"Gaspar Rivas, se trata con médicos su problema o está por la vida así no mas?  Recursos no le faltan para tener un buen médico.

#reportajeschv",Leo_Tuitero
1249,1637793301347680259,2023-03-20 12:28:46+00:00,"Carvajal quédate con el calvo. 
Nacho te quiero mucho 😌🫂",Pablooo0606
1250,1637793259509411842,2023-03-20 12:28:36+00:00,La tangana final entre Arnau Tenas y Carvajal https://t.co/J8aLjng1rO via @diarioas,FFm5030
1251,1637793166651805701,2023-03-20 12:28:14+00:00,"Esta jugada con un lateral como Cancelo o Achraf es gol al 90%, pero mejor Carvajal que no da un pase bien",SergioNietto22
1252,1637793133214744577,2023-03-20 12:28:06+00:00,"Es muy miserable vender lo de Carvajal y Arnau Tenas como un enfrentamiento entre ambos de igual a igual cuando las imágenes evidencian todo lo contrario. 
No ""se cruzan"", es Carvajal el que va a por el portero, le agarra del cuello y le dice algo que le hace estallar. https://t.co/0D4wOQdCbG",ap_angelperez
1253,1637793128575893505,2023-03-20 12:28:05+00:00,enserio qe está semana tengo qe aguantar al payaso de carvajal y al retrasao d ceballos jugando con españa? encima ni rinden pero en cambio cn el madrid uno se cree iniesta y el otro dani alves (jugando),samuueel10_
1254,1637793110410383362,2023-03-20 12:28:00+00:00,🚨 El Real Madrid tiene un grave problema en el RB porque Carvajal cada vez está peor sin competencia en su puesto. Enorme problema para Ancelotti. @marca #Rmalive https://t.co/5Dr9hgNRVY,universemadrid1
1255,1637792978835046400,2023-03-20 12:27:29+00:00,"En serio, vamos a permitir que Carvajal siga jugando?",Rattatalba
1256,1637792839420477444,2023-03-20 12:26:56+00:00,Configura un recordatorio para mi próximo Espacio. https://t.co/GNEApwUcqw,AlvaroC63558417
1257,1637792661493932041,2023-03-20 12:26:13+00:00,"📍Con el regreso de Ferland Mendy, Nacho ahora será considerado como una opción para RB. Las bajas actuaciones de Carvajal son un gran problema. ❌ @marca #Rmalive",universemadrid1
1258,1637792643043192832,2023-03-20 12:26:09+00:00,"👉 Arnau Tenas después de los comentarios de Carvajal y Ceballos hacia los suplentes del FC Barcelona.

📌 Ceballos y Carvajal insultaron el banco de suplentes del Barça como malos perdedores al finalizar el encuentro, no me sorprende de esos dos. https://t.co/RmNPLE8buI",FabianLB07
1259,1637792639612321794,2023-03-20 12:26:08+00:00,"Conoce cómo se propaga el cólera, cómo reconocer sus síntomas y cómo prevenir los brotes.
https://t.co/Np5WAyUYdo",AlvaroC63558417
1260,1637792520259219456,2023-03-20 12:25:40+00:00,Carvajal Lucas vazquez asensio Mariano hazard,MichaelCucurel1
1261,1637792515217580032,2023-03-20 12:25:38+00:00,"❗️Dani Carvajal perdió la pelota 23 veces contra el Barcelona ayer. Solo Raphinha perdió más (25).

Kroos (2), Christensen (3) y Modrić (6) los jugadores que perdieron menos pelotas. @diarioas https://t.co/UwgKMOJuOw",universemadrid1
1262,1637792485211553794,2023-03-20 12:25:31+00:00,#arnautenas estalló ante la provocación de #Carvajal tuvieron que pararle entre 4,SaquedeBanda5
1263,1637792425920847873,2023-03-20 12:25:17+00:00,"Me reservo mi opinión de Gavimiro, pero precisamente Ceballos, Carvajal y Vini no pueden hablar de actitud ""poco deportiva"".",Lemarckismo
1264,1637792369327177729,2023-03-20 12:25:04+00:00,"Bajas kroos benzema carvajal
Fichajes reece james bellingham haaland (contando a fran garcia que ya esta firmado y brahim que vuelve)",Aitorgarriido22
1265,1637792207120867329,2023-03-20 12:24:25+00:00,"♨️♨️Arnau Tenas ♨️♨️

Quien conoce a este chaval, saben que es un chaval de put@ madre, los macarras como Carvajal o Caballos y sus blanqueadores de la central lechera, nunca han sabido ganar, menos aún perder.
Pues ya sabéis HEMOAL 

Tik Tok : cultofftbl https://t.co/58HqMUqPiZ",juan_jcrestino
1266,1637792168386387970,2023-03-20 12:24:16+00:00,"A Tuchel no le puedes ordenar que acepte tener 4 jugadores que no sirvan ni para entrenar. No te va a aceptar poner a Carvajal de titular. No te va a aceptar que Benzema lo juegue todo y no te va a aceptar renovar a Kroos y a Modric.

Es el perfil de entrenador ANTAGONICO A FP.",sptkrld
1267,1637792092217802754,2023-03-20 12:23:58+00:00,"Lo de Carvajal si eso lo tapamos no merengues?, eso no interesa",David89867572
1268,1637791995916689409,2023-03-20 12:23:35+00:00,"Carvajal se la ha querido dar de abusón y ha salido escaldado. La rabia con esta peña es que a Araujo no le dicen nada, oye, por lo que sea…",valdiviamiguel4
1269,1637791936340799488,2023-03-20 12:23:20+00:00,"Al fin inicia el #cafeconnata en @subelaradio. Estábamos esperando a @ValdebenitoNata, abrazos mones",majocas
1270,1637791785857564672,2023-03-20 12:22:45+00:00,"Una más de Carvajal, que hace lo de siempre, se habrá encarado, se habrá desahogado insultando o algo por el estilo, y luego se ve como un cagón porque saben que no le va a hacer nada.

CAGÓN Y MAL PERDEDOR. https://t.co/wASc51bDiK",godcule_
1271,1637791678823034882,2023-03-20 12:22:19+00:00,"3?
Bueno si son 3 Eden Odriozola y Vallejo bajas
Bellingam Cancelo y Vlahovic fichajes
Benzema Carvajal y Kroos y Modric AL BANQUILLO",Ricardogomez104
1272,1637791661433430017,2023-03-20 12:22:15+00:00,"Lo del lateral derecho si que no podemos quedarnos quietos, es que me niego Carvajal 2025 me niego, son 11-S en cada partido",22Kampyon
1273,1637791578424066049,2023-03-20 12:21:55+00:00,"Uno a uno del Real Madrid contra el Barcelona: Ancelotti tiene un serio problema con Carvajal https://t.co/iIWYWIEn6D 

El problema es exclusivamente hacerle jugar.

Hace mucho que el madrid está para 3 centrales.",Roberto_Montesa
