,Tweet Id,Datetime,Tweet,Username
386,1637905333409525760,2023-03-20 19:53:56+00:00,"Para mí el gol de Asensio está mal anulado, pero digo yo que habrá que hacer autocrítica si el Barça nos ha bailado en los tres últimos Clásicos.

Lo de Benzema y Carvajal es insostenible, Rüdiger es una de cal y otra de arena, seguimos con Kroos y Modric juntos…

CAMBIOS JODER",TheBrazilianRM_
387,1637905147807551489,2023-03-20 19:53:12+00:00,"Es una barbaridad lo tonto que fue siempre Carvajal, pero nació con el don de hacer historia en los grandes partidos",cirodimarzio0
388,1637904777739640832,2023-03-20 19:51:44+00:00,Carvajal coje del cuello a Arnau hay un vídeo en Twitter#DeportePlus,DioniBorja
389,1637904462009479169,2023-03-20 19:50:29+00:00,Nacho Fernandez &amp; Daniel Carvajal &amp; Dani Ceballos #EURO2024 https://t.co/C46AY07SFV,HQpcrt
390,1637904445806718976,2023-03-20 19:50:25+00:00,"🇪🇸 🇻🇪 La Fiscalía española ha solicitado que se prorrogue la prisión provisional en este país del exgeneral venezolano Hugo ""El Pollo"" Carvajal.

Ingresa para más información 👇🏼
  https://t.co/N4Sz0Z7tfW",Elpoliticonews
391,1637904095657771008,2023-03-20 19:49:01+00:00,"Literal ayer fui Carvajal en Académicos

https://t.co/ABiCfU1qar",Marquezismoo
392,1637903602399301632,2023-03-20 19:47:04+00:00,"Voz de América (USA)
Capellanes del Desierto, la organización de voluntarios que recorre áreas de la frontera de Arizona en busca de migrantes reportados como desaparecidos, se prepara para el aumento de las temperaturas. Paula Díaz de la Voz de América...
https://t.co/EKmQDJFq9e",AlvaroC63558417
393,1637903199318208513,2023-03-20 19:45:28+00:00,Hace años que Carvajal no es nadie,ChejoPerez_
394,1637902716906377216,2023-03-20 19:43:33+00:00,"Bueno ya casi al cumplirse las 24 horas del desastre de ayer lo tengo claro, Carvajal fuera, Benzema fuera, Kroos fuera y Valverde espabila socio ya esta bien",Emporrauw_RM
395,1637902525990076416,2023-03-20 19:42:47+00:00,Libertad y orden para robar! Q asco🤢🤮,CmarcaFederal
396,1637902280715280389,2023-03-20 19:41:49+00:00,que alguien me explique que pretendía Carvajal con ese pase por favor,fffffernandez
397,1637902171713724417,2023-03-20 19:41:23+00:00,LIBERTAD Y ORDEN 🇨🇴 https://t.co/ejeHAD6IUq,RubenCarvajalG
398,1637901966041817089,2023-03-20 19:40:34+00:00,"Primera fotografía. Tomada en Francia. Vista desde la ventana en Le Gras. Joseph Nicéphore Niépce, Junio 1826 https://t.co/V6KyKANKCz",psicocamilocely
399,1637901945024258048,2023-03-20 19:40:29+00:00,"Lo siento por Iñaki Peña pero Arnau Tenas tiene mucha más proyección, y repito que no es porque se quisiera comer a Carvajal.",Sextetista
400,1637901804251021312,2023-03-20 19:39:55+00:00,"Fiscalía española pidió prorrogar prisión de Hugo ""El Pollo"" Carvajal 📌
https://t.co/oBWJm6ka05",Elpoliticonews
401,1637901783631646720,2023-03-20 19:39:50+00:00,Carvajal tiene 31 años y de coeficiente intelectual 12,PinoHormail
402,1637901546032701440,2023-03-20 19:38:53+00:00,Y cómo uno trabaja así? https://t.co/5JVBVXMLLF,NeilCarvajal_
403,1637901256625913863,2023-03-20 19:37:44+00:00,que conste que me gusta el madrid y a carvajal lo quiero pero FUE EL A POR ARNAU TIOOOO,mireexgavii
404,1637901245217120263,2023-03-20 19:37:42+00:00,Arnau Tenas y Dani Carvajal se engancharon tras el clásico https://t.co/7xr7OSipjF vía @sport,dacalongarela
405,1637901153483538439,2023-03-20 19:37:20+00:00,Momentos buenos de la vida✨🥹,Nanagarciac3
406,1637901070503673862,2023-03-20 19:37:00+00:00,un hombre me ha enseñado una camiseta del barça con la firma de carvajal me da algo,blarlosteam
407,1637901050207248385,2023-03-20 19:36:55+00:00,🟢🚨 SIN LATERALES el REAL MADRID no es COMPETITIVO | CARVAJAL un LASTRE 📢🔥 https://t.co/LPynokBb5t vía @YouTube,19Cassano
408,1637900996478136322,2023-03-20 19:36:42+00:00,Donde esta Carvajal????  https://t.co/XMnvv0NUld,MadridM07
409,1637900962877833217,2023-03-20 19:36:34+00:00,Al pobre Carvajal le dejaron los morros como los de la Veneno.,4059aniceto
410,1637900918933839872,2023-03-20 19:36:24+00:00,"Arnau Tenas y Dani Carvajal se engancharon tras el clásico..Este maton,que tiene un cementerio propio de el,esto son los valores,que verguenza 😬😬 https://t.co/qNfBQ6Hrvr vía @sport",BarrancoCazalla
411,1637900804639145985,2023-03-20 19:35:57+00:00,la recalcada concha de tu madre carvajal qué te costaba regresar hijo de puta ?????? https://t.co/17AE8kbP7C,idkatp2213
412,1637900750373232642,2023-03-20 19:35:44+00:00,"Antes: 1899€
Ahora: 1399€ 😱📉 -26% 😱
Bakeagel Bicicleta Eléctrica Innovadora De 26 X 4 Pulgadas Para Adultos, Con Motor Sin Escobillas, Bi...

👉https://t.co/4IqWhDlI38

Gavi Benzema Carvajal Alonso Sergi Roberto #ElClasico #FelizLunes https://t.co/KDSuFAIoKi",economame
413,1637900621931249664,2023-03-20 19:35:13+00:00,¿Pero por que chucha siguen rabiando por el gol anulado a Asensio? En el frame exacto en donde Carvajal golpea el balón se deja ver aún más claro el fuera de juego.,GamesLoquendoGL
414,1637900509607591936,2023-03-20 19:34:46+00:00,Carvajal y Ceballos dan asco,Stephanmurawsk
415,1637900351163494401,2023-03-20 19:34:09+00:00,"Se pasan de idiotas, los 5ubno0rm6l35 del Real trampas de Madrid 
Según ellos la bola de goma esta pegada al pies del llorón de carvajal, serán idiotas https://t.co/MTmq82MIaB",Carlo51lva
416,1637899739969486848,2023-03-20 19:31:43+00:00,Increible que ALGUNOS aficionados del Real Madrid se idenfiquen mas con Carvajal y lo que hace.,Albear_NFL
417,1637899577222397956,2023-03-20 19:31:04+00:00,Hablan los que tienen a Carvajal en su equipo,luispelle97
418,1637899558914260993,2023-03-20 19:31:00+00:00,"❌ ""Este equipo no hace tres cosas seguidas bien porque la mitad de sus jugadores, los Carvajal, Kroos, Modric o Benzema, han perdido para siempre el hilo de la continuidad y no hacen dos partidos buenos en la misma semana"".

Calentito lo de @inakiangulo

https://t.co/4W95J9n0v6",alacontra_es
419,1637899308300132354,2023-03-20 19:30:00+00:00,"🔵🔴 | #FCB 

🤩 Jordi Alba: intensidad, pasión y compañerismo.

🙌 Salió disparado del banquillo para abrazar a Balde tras el 2-1, levantó a caballito a Gavi y fue el primero en separar a Arnau Tenas de Carvajal

✍️ @bonagerman

https://t.co/3EAn4ZcZr0",sport
420,1637899308283592704,2023-03-20 19:30:00+00:00,Tensión tras la derrota del Real Madrid en el Camp Nou: Carvajal se encaró con Arnau Tenas. https://t.co/NL3vBdBiH1 #DeportesEnTuits1585,DeportesEnTuits
421,1637899308187156489,2023-03-20 19:30:00+00:00,"Aquí Ana Pardo de Vera @pardodevera cuenta como Juan Carlos I. además de las comisiones, también hizo su fortuna millonaria con el tráfico de armas a países árabes junto a Colón de Carvajal y Khashoggi... 

#FelizLunes ￼￼￼ https://t.co/jDdYUK5EUy",MiercolesRepubl
422,1637899303254654976,2023-03-20 19:29:59+00:00,"Fichar a un EI y a un ED aparte de llegar Brahim
Kroos y Modric fuera
Fede al medio y fichar a Bellingam y Arribas
Benzema fuera, subir a Álvaro y fichar a Oshimen o Vlahovic
Fran García va a llegar y con Mendy el LI va bien
Renovar a Nacho
Y de LD CANCELO Y TOBIAS
Carvajal fuera",Ricardogomez104
423,1637899184652034050,2023-03-20 19:29:30+00:00,Quiero pechiche😣,CarvajalTv
424,1637899112174559233,2023-03-20 19:29:13+00:00,"Vaya jodida manipulación jajajajajaja, es Carvajal quien se encara cogiendo del cuello, que asco de verdad",alejadroatm1903
425,1637899112006795269,2023-03-20 19:29:13+00:00,Q bebida del bien la cocacola lpm,Eliasncarvajal
426,1637898777020301314,2023-03-20 19:27:53+00:00,A Carvajal no lo quiere ni su propia afición.,Sextetista
427,1637898679196565504,2023-03-20 19:27:30+00:00,El clima de Bogotá es horrible. ❤️,CarvajalAltaJus
428,1637898657973272577,2023-03-20 19:27:25+00:00,Libertad y Orden!!! https://t.co/75BnEAvw9U,AlexCarvajal_P
429,1637897737629728777,2023-03-20 19:23:45+00:00,Se debería poner frenos en su lengua mentirosa y en las Nalghes que parecen cola de Dinosaurio 🦕,Ignacio31717255
430,1637897494817284099,2023-03-20 19:22:48+00:00,Mendy defiende mal sus jugadas (por alto es hasta cómico) pero que Daniel Carvajal sea titular en este equipo es una falta de respeto.,HikkkOkko
431,1637897429851815937,2023-03-20 19:22:32+00:00,"¿Cuántas veces os habéis puesto el gol de Kessié? Yo unas 247. Taconazo del polaco con falta a Carvajal, Balde penetra y la pone rasa atrás, llega Il Presidente y acomoda todo el cuerpo para mandarla a guardar con mimo. Saludo militar. Vayan encargando la Liga 27.",PLF_2008
432,1637897157209407490,2023-03-20 19:21:27+00:00,"Salgo que gane la champions, @MrAncelotti  no puede seguir como entrenador… si no tiene huevos a sentar a:Benzema,Carvajal,Modric, Kroos… Chao 👋 @realmadrid",19Cassano
433,1637897107204915201,2023-03-20 19:21:15+00:00,Lo mejor del bodrio q todos vemos y que queremos cambiar son los comentarios en twiter #JuegoDeIlusiones,jorgewildoc
434,1637896629121437696,2023-03-20 19:19:21+00:00,"Imagínate como debe de tener Carvajal, Florentino Pérez y José Ángel Sánchez de secuestrada la banda derecha del Madrid, que un tipo como Malo Gusto, decidió en su momento competir con Reece James.

Ni siquiera sondearon su nombre, ni el de Frimpong, ni mucho menos el de Fresneda",Sergio22Mr
435,1637896412456263680,2023-03-20 19:18:30+00:00,"Parece q os olvidáis del codazo de Carvajal hace unos partidos, q se fue sin tarjeta tb",ireeene_atm
436,1637896089175982081,2023-03-20 19:17:12+00:00,"El unico hijo de la gran puta que quedó de aquellos cerdos mal intencionados asquerosos y hacheros es Carvajal... 

Entre ellos, Ramos, Peppe, Coentrao, Marcelo, Carvajal, Casemiro, Varan... 

Tremendos Cerdos Carniceros en clásicos.",ElMagiicoSama
437,1637895696341778432,2023-03-20 19:15:39+00:00,Gracias a dios ya detuvieron a tres de ellos ellos como;Joselif ramirez.Hugo carvajal y Nevis villalobos por corrupcion y traicion de la patria,Alejandro359342
438,1637895675940577284,2023-03-20 19:15:34+00:00,Que Arnau fue por Carvajal? Hay videos donde se ve de otra manera pero sigan engañando de esa forma.,ylich_360
439,1637895648384090112,2023-03-20 19:15:27+00:00,"Todas las balas para BENZEMA que ayer hizo un partido mediocre. 

Pero hablemos de CARVAJAL, que prácticamente nos entregó en ataque y luego en defensa nos dejó expuestos. HORRIBLE partido y veo pocos palos para él.",Jimmy_Romer0
440,1637894460343308298,2023-03-20 19:10:44+00:00,🤬 Lewandowski hizo falta a Carvajal y Bengoetxea miró hacia otro lado en el gol de Kessié https://t.co/a49TCqHwW1,ElChiringuitoHD
441,1637893799685902348,2023-03-20 19:08:07+00:00,me rio para no llorar,Carvajal25Jime
442,1637893650762833922,2023-03-20 19:07:31+00:00,"Resumen de Real Madrid vs Getafe CF (1-0) https://t.co/Wj5XVUcpqT a través de @YouTube
Este piscinazo de Carvajal dio tres puntos al Madrid, decisivos
Árbitros siemprea mi lado..",Gaboemerin
443,1637893610845642752,2023-03-20 19:07:22+00:00,"Antes: 110€
Ahora: 78.49€ 😱📉 -29% 😱
Michael Kors Adrianna Ii Gafas De Sol Unisex Adulto

👉https://t.co/hegBKKDCsE

Gavi Benzema Carvajal Alonso Sergi Roberto #ElClasico #FelizLunes https://t.co/aEUg4IhAzE",economame
444,1637893591681867795,2023-03-20 19:07:17+00:00,"👉#IncoNewsNYC 

Indultado por Boric

ALEJANDRO S. CARVAJAL RIQUELME

#GobiernoCorruptoyMentiroso
#thevoicechv
#LollaCL2023 
Eduardo Ravani
Violeta Parra
#ToleranciaCero
#reportajeschv 
Monsalve
Alipio Verá
Japenning con Ja
Matamala
Zañartu 
Corte de Apelaciones 
Gaspar Rivas https://t.co/lRb8MwKQrE",incommunicadoDP
445,1637893546446299140,2023-03-20 19:07:06+00:00,"en La Sexta llorando porque gavi salió impune del empujón a ceballos, este salió igual de un tirón de pelo a gavi, pero no he visto la repetición de ceballos encarándose con ansu ni como empuja antes a lewy ni como carvajal coge del cuello a arnau 

manipuladores",luvsfcb
446,1637893518143135753,2023-03-20 19:06:59+00:00,"Antes: 199€
Ahora: 158€ 😱📉 -21% 😱
Kenwood Multipro Compact Procesador Robot De Cocina, Bol De 1,2l, Batidora De Vaso De 1,2l, Gancho Para...

👉https://t.co/IZbnDNPxX1

Gavi Benzema Carvajal Alonso Sergi Roberto #ElClasico #FelizLunes https://t.co/isNIrOxdhB",economame
447,1637893451424342032,2023-03-20 19:06:44+00:00,"Hace esto Carvajal dentro del área y dicen que no es nada, se lo hacen a ellos y piden expulsión. Que poca vergüenza",sorga4
448,1637892891258265619,2023-03-20 19:04:30+00:00,LA MEJOR NOTICIA DEL MUNDOOOOOOOOO 😍😍😍😍😍😍😍😍😍😍😍,Luis_MCarvajal
449,1637892728666173440,2023-03-20 19:03:51+00:00,Si viene a #clapburguers en envigado la intermedia prepárese para esperar! Mas de 50 min x una burguer. Mi teoría es q priorízan a #rappi para no quedar mal calificados. Muy lindo el lugar pero q pésimo servicio #clapburguers https://t.co/TXjc2MTTzv,Juanjucarvaj
450,1637892695795310625,2023-03-20 19:03:43+00:00,en vacaciones conocí la ciudad donde las mujeres son sordas 😅,Leo_Tuitero
451,1637892307335651344,2023-03-20 19:02:11+00:00,"El gol de Kessié debió ser anulado por falta previa a Carvajal, que le impide defender el ataque del Farsa

En la segunda y tercera imagen se ve claramente https://t.co/4he1YTC5ja",Azor1960
452,1637892256509075462,2023-03-20 19:01:59+00:00,Que falta? Si es que Carvajal es un acabado espero que le metan 15 partidos por coger del cuello a Arnau Tenas,DIEGOMORILLO71
453,1637891905290641465,2023-03-20 19:00:35+00:00,"No conozco del tema, pero quiero darle la razón... 

Además: ¿A quién se le ocurre construir encima en un entorno con tanta agua?
Pero bueno, Neveralandia y su horrenda climatología.",CarvajalAltaJus
454,1637891852828286998,2023-03-20 19:00:22+00:00,"""Entusiasmo de porristas"".",CarvajalZuniga
455,1637891778341642246,2023-03-20 19:00:05+00:00,#Futbol #LoMasVisto Modo gamer: Carvajal desvela su afición por el ‘Call of Duty’ - https://t.co/nehRHjiNiX https://t.co/ce9YWqCv0g,visionnoventa
456,1637891677414105114,2023-03-20 18:59:41+00:00,"Del fracaso de esta temporada tiene más culpa la dinojunta que parece que se les ha olvidado fichar que de Carletto. Sin delanteros y sin laterales, Hazard y Mariano que parecen funcionarios de la agencia tributaria, cobrando por no hacer nada y Carvajal qno está ni pal castilla",Alvarocxca11
457,1637891419950948369,2023-03-20 18:58:39+00:00,"La temperatura inclemente, la humedad incesante y, en medio, el agua relajante. https://t.co/aUcOe7kBtN",CarlosBCarvajal
458,1637891407435145257,2023-03-20 18:58:36+00:00,"Jaime Mamani Espindola (Viceministro de Defensa Social y Sustancias Controladas Bolivia)
#LaPaz
#LaRinconada
En presencia de representantes del Ministerio Público y la #UNODC la #FELCN procedió a incinerar la  droga secuestrada en los últimos días...
https://t.co/nlYVpjJGst.",AlvaroC63558417
459,1637891205026422815,2023-03-20 18:57:48+00:00,"Acabo de hacer cuentas y por supuesto que sacare una de buchanans para tomar con los vecinos, porque mal vecino jamás",mau_carvajal7
460,1637891057638580233,2023-03-20 18:57:13+00:00,Por culpa de un gobierno ideológico e improvisador #ColombiaVaMal,carvajalatl
461,1637891030950223886,2023-03-20 18:57:06+00:00,Vaya manipuladores son JAJAJAJA. Empezó Carvajal…,TraaKzZ_
462,1637890939606671376,2023-03-20 18:56:45+00:00,"Te repasas la plantilla en defensa y no hay más que problemas.

Carvajal ha bajado su rendimiento.
Alaba lesionado.
Vallejo no juega.
Odriozola no juega.
Lucas Vázquez no juega
Mendy lesionado

Vivimos de Courtois, Militao y Rudiguer.",_sistemablanco
463,1637890865434599424,2023-03-20 18:56:27+00:00,"Es que no fue solo el gol anulado,es que fueron muchas cosas.
Tuvo que expulsar a Sergi Roberto y Gavi.
Y el gol de ellos no debió subir porque hay falta de Lewandoski a Carvajal...",Dolores55377207
464,1637890854957228058,2023-03-20 18:56:25+00:00,"Al grito de ""¡Presidente!, ¡Presidente!"", reciben al canciller Marcelo Ebrard en el  Palacio de Minería  donde realizó la presentación de su libro autobiográfico ""El camino de México""

Video: Otilia Carvajal https://t.co/ekKia6KPaJ",El_Universal_Mx
465,1637890691182239747,2023-03-20 18:55:45+00:00,"Radio Antena 2000 (Sucre Bolivia)
COMO YA OCURRIÓ EN SUCRE TAMBIEN EN COBIJA VUELO DE BOA DIO MEDIA VUELTA A COCHSBAMBA
#BoliviaHoy Pasajeros de BoA denuncian que partieron en un vuelo de Cochabamba a Cobija la mañana de este lunes y cuando estaban...
https://t.co/SLL9dIRgsS",AlvaroC63558417
466,1637890683821236242,2023-03-20 18:55:44+00:00,"Luego abres @marca i te encuentras la noticia de “ tenas va a por Carvajal “ i ponen solo las imágenes de él pero no ponen el vídeo como se ve el mal perder de patojal que va a por el ? Seguir seguir que todo llega mientras en RMTV dicen que les han robado, menudos periodistas",Carlitos2121087
467,1637890659603324937,2023-03-20 18:55:38+00:00,"(AHORA) Bomberos informa accidente de tránsito Avenida Alejandrina Carvajal,  unidad BR2 Al lugar https://t.co/6ZNkFfMil0",PutaendoInforma
468,1637890635280556053,2023-03-20 18:55:32+00:00,Libertad y orden https://t.co/zqu75qF4VW,carvajalatl
469,1637890581283086347,2023-03-20 18:55:19+00:00,"Carvajal, com no, el frankista malparit de sempre 😆, que es foti ✊💪",dolores23311049
470,1637890542372528132,2023-03-20 18:55:10+00:00,🇪🇸 Justicia española prorroga la prisión preventiva para el Pollo Carvajal https://t.co/RHJ6zq011F,ALnaviocom
471,1637890158048452633,2023-03-20 18:53:38+00:00,"Hay que ser mas elegante. Dice fuera de juego clarisimo,el var por los pelos y sin coger cuando Carvajal toca la pelota. Es clarisimo asi era en su epoca cuando el jugaba al futbol. Clarisimo negreira",444rokero
472,1637889784864448524,2023-03-20 18:52:09+00:00,"Que carvajal jugo mal SI, Que Benzema jugo como el culo TAMBIEN, pero no me vais hacer cambiar de opinión, si los corruptos del Var Dan el gol de Asensio, expulsan a Gavi, dan el gol del Bilbao, y el penal del Valencia, y el penal a Benzema en Betis!!.
Ganamos esta Liga.",pacocrego
473,1637889750752174081,2023-03-20 18:52:01+00:00,"rafael ramirez era adeco, el pollo carvajal copeyano, joselit del mas, eugenia sader del partido azul, ninguno pero ninguno era chavista 🤡🤡🤡",joseperales07
474,1637889701401993255,2023-03-20 18:51:49+00:00,Lo que no veras en el @marca ni el Chiringuito porque no es Gavi… Aquí vemos cómo Arnau defendió más que el mismo Carvajal a su equipo🤣🤣🤣 #Barcelona #RealMadrid #Barça #FCBarcelona https://t.co/oASo1eeiNa,MadameFutbol
475,1637889447520772104,2023-03-20 18:50:49+00:00,Mi fiel aliado este finde es siigo facturación electrónica jajajaja 😂,mau_carvajal7
476,1637889128216797198,2023-03-20 18:49:33+00:00,"Hasta en mi peor momento, soy mejor que cualquiera.",mau_carvajal7
477,1637888879716868111,2023-03-20 18:48:34+00:00,Mi vecino el de la música de banda 20/10,mau_carvajal7
478,1637888837362806784,2023-03-20 18:48:23+00:00,Carvajal es super bueno 😂😂😂😂😂,Bryan_ors
479,1637888812708667406,2023-03-20 18:48:18+00:00,"De salida, me acompañas ? 😏 https://t.co/7hmteygO38",Th3niggan
480,1637888539688837149,2023-03-20 18:47:13+00:00,"En ambos frames es fuera de juego, pero en el segundo Carvajal lleva zapatos de payaso, lo cual resta credibilidad al citado frame. https://t.co/5DTaYc4ePm",juanan_cv
481,1637888190450114573,2023-03-20 18:45:49+00:00,"Según informes desde Catalunya, Dani Carvajal sigue tirado en el césped del Camp Nou. Después de tanto seguir la pelota y chocar con Lewandoski, quedó exhausto",gianking
482,1637888149287215122,2023-03-20 18:45:39+00:00,"Mateo Carvajal ha sido invitado a ‘MasterChef Celebrity’, esta es la razón por la que no ha participado https://t.co/URtcDaPXC6",infobaecolombia
483,1637888033046274050,2023-03-20 18:45:12+00:00,Soy carvajal en la vida jajaja,jeanlg27
484,1637887922576793600,2023-03-20 18:44:45+00:00,Gracias. necesitaba está publicación sin saberlo... 🥺❤️,CarvajalAltaJus
485,1637887795011133444,2023-03-20 18:44:15+00:00,Arnau Tenas si llega a coger a Carvajal https://t.co/L7fapPlgyj,ChemaGalan02
486,1637887779836182529,2023-03-20 18:44:11+00:00,Si nos ponemos así el árbitro tenía que pitar falta previa al segundo gol de Lewandowski a Carvajal pero no…,Sergio__
487,1637887587330277378,2023-03-20 18:43:25+00:00,"Muy ilusionado por ver cómo les queda a Asensio, Carvajal y compañía.",Lagartman_
488,1637887306848673799,2023-03-20 18:42:19+00:00,Raro que no pidiera el VAR para que expulsaran a Carvajal.,mangarro
489,1637887286460162048,2023-03-20 18:42:14+00:00,Que Carvajal qué? Por favor eh,David_14pb
490,1637887118209851405,2023-03-20 18:41:34+00:00,A tomar x culo Carvajal,arisjoelq19
491,1637887087490768916,2023-03-20 18:41:26+00:00,La caida en desgracia de Carvajal en los ultimos 3-4 años es terrorifica. Lo que fue para el Real y lo que es ahora.,PablitoMtnez
492,1637886938676965377,2023-03-20 18:40:51+00:00,"Carvajal en una misma jugada:

- Se une a la contra, y pierde el balón en un intento de hacer un cambio de banda, sabrá dios por qué si tenía mejores opciones.

- No baja a replegar a tiempo.

- Deja la banda derecha descubierta.

- Se cae al suelo.

- Nos meten gol.

BOCHORNOSO. https://t.co/NbSt9wAIWH",Corazonblanco7_
493,1637886855730307098,2023-03-20 18:40:31+00:00,"Antes: 1140.15€
Ahora: 979€ 😱📉 -14% 😱
Apple Ordenador Porta Til Macbook Air 2020 : Chip M1, Pantalla Retina De 13 Pulgadas, 8 Gb De Ram, ...

👉https://t.co/I7hUyomqpS

Gavi Benzema Carvajal Alonso Sergi Roberto #ElClasico #FelizLunes https://t.co/E4Vu2TsEqW",economame
494,1637886745134899230,2023-03-20 18:40:05+00:00,"Nada mejor que ver que a tú equipo todo le salga bien, cuando no,  mi hija en su rostro lo dice todo y  corre a abrazarte, la esposa corre y te abraza y  algo adentro dice no pierdas la FE, SON CAPACES.! SOMOS  CAPACES!!  #VamosPereira @Corpereira https://t.co/7CFLumYUWi",TUTOGOL
495,1637886707759456259,2023-03-20 18:39:56+00:00,Festivo de ver Discovery🌏 con la abuela.,jennifer_carvaj
496,1637886075648483329,2023-03-20 18:37:25+00:00,"qué casualidad, que de las personas que sospecho algo, sus dm’s los tienes borrados😵‍💫",_andreacarvajal
497,1637885877283069952,2023-03-20 18:36:38+00:00,"Siendo objetivo de cara a que sean posibles (Mbappe/Haaland quedan Out) 

- Kvara 
- Un DC: Oshimen/David (Lille)/Vlahovic
- Un LD: Frimpong/Porro 

Salidas: 

Hazard
Mariano
Carvajal",TheSouri7
498,1637885623225688086,2023-03-20 18:35:37+00:00,"Esther Carvajal, candidata del PSOE, garantiza un ""proyecto ilusionante para que el municipio avance y ocupe el sitio preferente que merece""

La socialista apunta a la recuperación de la gestión de los servicios públicos, mejoras en el centro de salud...

https://t.co/ujd239Vgoz",alboloteinforma
499,1637885492854136840,2023-03-20 18:35:06+00:00,Ad portas de asumir como presidenta de la Comisión de Economía del @Senado_Chile analizando proyecto que moderniza las compras del Estado https://t.co/r0fZm5Sa7B,loretosenadora
500,1637885489725186056,2023-03-20 18:35:05+00:00,Me cuentan q en la mayoría d los medios d comunicación dieron como el mejor del Barsa a Sergi Roberto y como mejor del Madrid a Carvajal. Es evidente q el entorno está al nivel d la Liga!,walter_garcia_
501,1637885190293823515,2023-03-20 18:33:54+00:00,Libertad y Orden https://t.co/azUK73Uiu6,Marce_Carvajal1
502,1637885111533182980,2023-03-20 18:33:35+00:00,La tangana al final del Clásico entre Arnau Tenas y Carvajal que no se vio por televisión: https://t.co/K05bjaa6E2,franmacos
503,1637885032185339912,2023-03-20 18:33:16+00:00,La verdad es que estoy toda hormonal😣,CarvajalTv
504,1637884897741119492,2023-03-20 18:32:44+00:00,🤠🤠un poquito cínica la gente de estos lares,jessu10ccr
505,1637884704262070279,2023-03-20 18:31:58+00:00,"Solo queda la esperanza de que Fran García rinda, y olvidémonos de limpiar a la mula andante de Carvajal, si ofrecieron a JOÃO CANCELO y dijeron que no!!!",_Lucas_Fa_
506,1637884372597481485,2023-03-20 18:30:39+00:00,El #DíaMundialDeLaFelicidad no puede caer en lunes... ¡Hombre ya! 😂😂😅😅,MariloCarvajal
507,1637884223821324288,2023-03-20 18:30:04+00:00,El Tito Berni y el Pollo Carvajal están juntos??? https://t.co/66wJREcQGx,Taber_nario
508,1637884087800320000,2023-03-20 18:29:31+00:00,Me gusta la gente que entiende y respeta.,YeneSanchez
509,1637884038840045568,2023-03-20 18:29:19+00:00,Yo Justo ahora,CarvajalFavio
510,1637883976575492121,2023-03-20 18:29:05+00:00,"Aveces no necesitas hablar, las expresiones hablan por si solas",paula_carvajal7
511,1637883902466334740,2023-03-20 18:28:47+00:00,Bendita salvación 🖤,_meeelssss
512,1637883601541898240,2023-03-20 18:27:35+00:00,"Tchouameni es un gran jugador y una gran persona, cuanto tienen que aprender los Carvajal, Vini, Ceballos, etc. de este tipo de jugadores.",FaliMoreno
513,1637883566649384969,2023-03-20 18:27:27+00:00,"Y de repente uno se acuerda de:
Eugenia Sader
Motta Dominguez
Eladio Aponte
El Pollo Carvajal
Rafael Isea
Leamsy Salazar
Víctor Cruz W
Andrés Izarra
Christian Zerpa
y muchos otros más",dalmata2
514,1637883251069952004,2023-03-20 18:26:12+00:00,El Real Madrid está jugando con 9 jugadores y cuidado si con menos.... Carvajal y Benzema son unos muertos... en el medio campo estan los zombies....Mucha ventaja se está dando...,antoniogonpa
515,1637883145453182991,2023-03-20 18:25:46+00:00,Esos ojitos 🫒😍,Thali_Carvajal
516,1637883034417373196,2023-03-20 18:25:20+00:00,"Carvajal volvió a quedar en evidencia En el partido de ayer, es uno de los grandes malos perdedores. Le da rabia que gente como GAVI o Balde le superen. Lo de Arnau Tenas, de lo más lamentable que se ha visto últimamente. Que sigan llorando!! 😢😭",Pnalvideos
