,Tweet Id,Datetime,Tweet,Username
0,1637967190807703553,2023-03-20 23:59:44+00:00,"Esa carita de ""ya lo destruí, ahora sigo como si nada""😂😂😂😂😂😂😂😂😂 https://t.co/2lK5f6hytq",TopsValentina
1,1637966753178300421,2023-03-20 23:58:00+00:00,Creo que me gustan los hombres que me dominen JAJAJA,CarvajalTv
2,1637966447539544064,2023-03-20 23:56:47+00:00,"El presidente dice que Calderón y Fox debieron estar enterados de lo que hacía García Luna, pero su director de Segalmex fue engañado por priistas de malas mañas. Otra más de sus estupideces.",jesuscarvajalm
3,1637966436202053636,2023-03-20 23:56:44+00:00,Revisar la jugada del gol del Barça. Leeandoaky tras soltar el balón hace falta a Carvajal mediante obstrucción impidiéndole llegar a la cobertura del pase del gol#ChiringuitoVAR,Fresko80
4,1637966034580774912,2023-03-20 23:55:09+00:00,No puedo con el cansancio y apenas es lunes 🤡,Clauscarvajal_
5,1637966000120291329,2023-03-20 23:55:01+00:00,Sentirte tan roto y triste y aparentar que todo está bien no está siendo nada fácil.,AllCarvajall
6,1637965759145037824,2023-03-20 23:54:03+00:00,Ojalá ser Naomi pa estar con el napoli ou chiquillo,cristinaacarval
7,1637965535760482307,2023-03-20 23:53:10+00:00,#chiringuitoVAR poner a Carvajal cogiendo del cuello a Arnau tenas! A llorar a la llibreria!!,RoigJacint60805
8,1637965409461628928,2023-03-20 23:52:40+00:00,"Los gitanos aparecieron en la década de los 40 y habitaron un descampado cerca a lo que hoy es la Mayorista. Hicieron vida trabajando con metales y poco a poco se fueron casando con los paisas.

Los gitanos de Itagüí
📷 Gabriel Carvajal. Archivo @BPPiloto

https://t.co/MJ2Z1JZAKe https://t.co/ODfcRgIBIa",UniversoCentro
9,1637965295519162368,2023-03-20 23:52:13+00:00,¡Ramadán Karim! ¿Puedes ver la luna creciente? https://t.co/4H9F3QqdT3,mcarvajal1966
10,1637965252061954048,2023-03-20 23:52:02+00:00,"#ChiringuitoVAR tengo un vídeo donde se mira bien que Asensio esta adelantado , trasan lineas y sale la imagen del golpe de Carvajal y lo q hizo lobo esta bien explicado soy del real Madrid pero hay q saber perder",ma41096344
11,1637964695125602304,2023-03-20 23:49:49+00:00,"Chiringuito var
No habláis de carvajal coje por el cuello a Arnau tenas!!",RoigJacint60805
12,1637964679409541121,2023-03-20 23:49:46+00:00,#ChiringuitoVAR El VAR debe tener muchas mejoras para evitar estos errores esa falta de Gavi a Ceballos es merecida de amarilla o roja y el codazo a Carvajal.,LaLigaData123
13,1637964630180937728,2023-03-20 23:49:34+00:00,@chiringuitobar no habláis nada del 2 1 del Barça con clara falta a Carvajal. Sólo habláis del fuera de juego que es lo único que no tiene razón el vídeo de Real Madrid televisión. Qué diría la Barceló si fuera al contrario,AngelPr96233250
14,1637964625365852161,2023-03-20 23:49:33+00:00,"Claro porque Vinicius,Ceballos y Carvajal son unos señores...",CruyffismoV
15,1637964585075351553,2023-03-20 23:49:23+00:00,#ChiringuitoVar y por que no se habla de lo que le hace Carvajal a Arnau tenas?,Futbolhero1
16,1637964540825546752,2023-03-20 23:49:13+00:00,Y de la falta de lebandosky.a Carvajal  no se habla ????Xd menudo robo ..tuvo que jugar contra diez jugadores el Madrid Quince minutos ..otro que le regalan la liga  y se creerá un genio como Luis Enrique ...el científico Xavi #chiringuitoVAR https://t.co/C3wE8Gbku6,josemanuel30470
17,1637964486345719808,2023-03-20 23:49:00+00:00,"#Martes 21 de Marzo🔴🔴 INDEPENDIENTE SANTA FE 🆚 DEPORTIVO CALI 👉 PON! https://t.co/TAn4mKwwf5 ""Tuto... https://t.co/8vYR1m9uY5 a través de @YouTube",TUTOGOL
18,1637964182577373185,2023-03-20 23:47:47+00:00,"Estos políticos son tan ineptos, que no saben mentir 🤔 #PinochaVallejo",Leo_Tuitero
19,1637964179708493826,2023-03-20 23:47:47+00:00,"#FrancasNoches Hugo Carvajal dice tener pruebas de los fraudes en dónde asegura que Chávez solo ganó dos procesos ,cómo se prepara la oposición para enfrentar todo ese panorama donde el CNE es el arbitro Además de la opoficción activa y FAN políticas.",JMALABE
20,1637963976129511429,2023-03-20 23:46:58+00:00,"Que mentira es más grave?

Indultar sin tener antecedentes, o indultar sabiendo todos los antecedentes ?? 🤔

 #PinochaVallejo",Leo_Tuitero
21,1637963611732582406,2023-03-20 23:45:31+00:00,"Nunca hubiera podido imaginar que una ausencia ocupara tanto espacio, mucho más que cualquier presencia.

~ Ana María Matute",mangelc_
22,1637963343615909892,2023-03-20 23:44:27+00:00,"No veo a los pesos pesados del Madrid hablar con vinicius,nacho ceballos y Carvajal que han hecho de las suyas 
Cómo jalarle el pelo a Gavi, agredir a Arnau Carvajal, vinicius encarar árbitros y nacho jugando NBA y haciendo faltas que debió ser expulsado al min 40 
Mandan cojones",simancasjuan97
23,1637962864068526082,2023-03-20 23:42:33+00:00,#chiringuitoVAR alguien puede garantizar q en ese frame y desd esa camara el interior dl pie d Carvajal esta tocando el balon en ese momento?y porque el VAR automatico lo hace en el momento q sale el balon?,Rayas013
24,1637962802664026112,2023-03-20 23:42:18+00:00,"#chironguitovar para un pase bueno que da carvajal el 2 años, no lo anuleis, pobrecito, carvajal no esta para jugar de titular, vean a vinicius del castilla",Carlosmarotol75
25,1637962740835790849,2023-03-20 23:42:03+00:00,"Tener en cuenta que el pase de Carvajal es de primera, entonces al tocar la pelota ya está pasando el balón a Asensio #ChiringuitoVAR",Marchione1985
26,1637962481824931843,2023-03-20 23:41:02+00:00,La confianza que yo tengo con el es inexplicable🤍,JovennyyXc
27,1637962457518944263,2023-03-20 23:40:56+00:00,"Saludos al Gato González, tremendo aporreador y cuarto bate de la Colonia Esperanza en Merida. @ImagenTVMex #LaCasaDelBeisbol",La_Bolsa
28,1637962235304615941,2023-03-20 23:40:03+00:00,"""Don orgulloso"" se enamoró de ""Doña no le ruego a nadie""",giecarvajal
29,1637962230598709249,2023-03-20 23:40:02+00:00,Clásico caliente: la pelea que no viste entre Carvajal y un jugador de Barcelona https://t.co/PKusPvLNeg,FutbolazoCL
30,1637962152114880513,2023-03-20 23:39:43+00:00,"#ChiringuitoVAR El pase se produce cuando el balón sale del pie del que está centrando por lo que no es hasta ese momento cuando hay que medir el fuera de juego. Además es independiente, las líneas están mal tiradas, lewandoski hace falta a Carvajal y Gavi debió ser expulsado.",Javier_Gordon_
31,1637961481718202368,2023-03-20 23:37:03+00:00,"Aquí Guido Gómez da la información oficial de que Danilo Medina salió del país a cumplir con un tratamiento de salud previo al día de los allanamientos.

Creo que esto puede calamar un poco @laluzjose quien imagina Danilo podía saber del operativo.

El odio y resentimiento mata https://t.co/EYmkX7NS2r",HRCC07
32,1637961452764946440,2023-03-20 23:36:56+00:00,"Esto resultó ser una fake News 

Curioso por decir lo menos, ya que ellos pregonaron y condenaron las fake News. 

 #PinochaVallejo https://t.co/3f6vZyFabn",Leo_Tuitero
33,1637961418275168257,2023-03-20 23:36:48+00:00,"#20Mar A lo largo y ancho del país nos encontramos firmes contra la delincuencia organizada.

#JuntosContraLasMafias
.@CZGNB_43 https://t.co/OpDbh3pZc4",CarvajalBravoC
34,1637961317872021504,2023-03-20 23:36:24+00:00,"#ChiringuitoVAR TENDRIAN QUE HABER SIDO EXPULSADOS SERGI ROBERTO Y GABI SERGI POR DOBLE TARJETA AMARILLA Y GABI POR AGRESION A CARVAJAL ,Y ME REPATEA ESE TIPEJO DANDO CLASES DE FUERA DE JUEGO CUANDO ES EL QUE MENOS TENDRIA QUE HABLAR QTENIA QUE ESTAR TAPADITO¡¡HALA MADRID!!!",PradasLoly
35,1637961280068763651,2023-03-20 23:36:15+00:00,"#ChiringuitoVAR pero es que el centro de Carvajal viene rozado por un jugador del Barça, eso anula el fuera de juego?",ferfootball18
36,1637961278093250560,2023-03-20 23:36:15+00:00,#BEISBOLXTELEVEN en sintonía desde maracay. Budy beily ratificado para dirigir este año a los tigres y les digo algo aunque es gringo a budy no le voltean ese juego frente a EEUU,apure01
37,1637960853822504960,2023-03-20 23:34:34+00:00,Este hashtag tiene dls lecturas 😅 #PinochaVallejo,Leo_Tuitero
38,1637960652068093954,2023-03-20 23:33:45+00:00,"O sea Boric tenía los antecedentes para indultar a delincuentes. 

Mintieron entonces. 

Asi con estos políticos.",Leo_Tuitero
39,1637960631906185217,2023-03-20 23:33:41+00:00,"OPORTUNIDAD DE NEGOCIO PARA EMPRENDEDORES.
LOS ENCHUFADOS GUARDAN DOLARES EN EFECTIVO EN SUS CASAS.
A LO MEJOR CORONAS Y TE CAEN 100 AÑOS DE PERDON...",CarbajalTorbay
40,1637960485210341382,2023-03-20 23:33:06+00:00,"Si si, teniendo en su vestuario a Carvajal que reparte indiscriminadamente en cada partido, o a Dani ""el tirapelos"" Ceballos que no fue expulsado por agredir a Gavi, vienen a quejarse con mensajitos a los jugadores del Barça. Vayan a mamarla por ahí hombre.",AsisteOusmane
41,1637960429191192576,2023-03-20 23:32:52+00:00,"Cualquier aficionado que sepa algo de futbol y sea aficionado del RM sabe que Rudiguer ha de controlar sus subidas locas, que Carvajal hace 1 partido bien de 10, Fede es de momentos y Benzema nunca ha sido goleador. Pero no, que pierden pk les roban… 0 autocrítica.",EnzoGiner
42,1637959916823486469,2023-03-20 23:30:50+00:00,Carvajal en los partidos importantes cumple:,Dieguiklk10
43,1637959705405554688,2023-03-20 23:30:00+00:00,"El proceso de extradición de Carvajal a Estados Unidos sigue pendiente ante el último recurso presentado por el exgeneral, quien ha acudido a distintas instancias para buscar poner freno a su traslado a Norteamérica #20Mar https://t.co/i76WlMiHn8",Analitica
44,1637959682143711232,2023-03-20 23:29:54+00:00,"En el frame usado, Carvajal no ha contactado aún el balón. El pie tapa al balón. #ChiringuitoVAR",jacquesdelouiss
45,1637959670106140672,2023-03-20 23:29:51+00:00,"CEM Carvajal Trujillo desplegado por todas las Parrq. del Municipio, llevando el 
 mensaje del #PlanProsperi  para Venezuela @prospericarlos Acompañados por Los dirigentes el Sec.Gral @Henryrangel1963 Coord activismo Antonio Marín , Alirio Rivero Coord. CAP.
#MovilizacionTotalAD https://t.co/GNS6WXXH0b",joseamado01
46,1637959596600860674,2023-03-20 23:29:34+00:00,Se va la tarde... https://t.co/WW0Qp6pgtK,alitoscor
47,1637959124628512768,2023-03-20 23:27:41+00:00,"#ChiringuitoVar Balboa no tiene razón, Carvajal aún no ha golpeado el balón, pero bueno de Balboa que podemos esperar",LuisCon33735929
48,1637959024317456385,2023-03-20 23:27:17+00:00,Cuando se muestra la imagen del fuera de juego Carvajal tiene la pierna encogida ¿como se puede decir que ya le ha golpeado ? #ChiringuitoVAR,malmandao1
49,1637958993099325441,2023-03-20 23:27:10+00:00,pero en la prensa nacional  el titular es que Arnau Tenas al finalizar el partido se fue directo a por Carvajal claro... Vergüenza @marca @diarioas,saulin1986
50,1637958978272481283,2023-03-20 23:27:06+00:00,"En Lara seguimos trabajando por la educación del futuro con nuestros niños y niñas.@_LaAvanzadora @AdolfoP_Oficial @vicent_carvajal @MPPEDUCACION 
#JuntosContraLaMafia https://t.co/NNpx0WFR2i",supervisionlara
51,1637958823636787200,2023-03-20 23:26:30+00:00,"#ChiringuitoVar Balboa no tiene razón , el balón en esa toma todavía no ha sido golpeado por  Carvajal,",LuisCon33735929
52,1637958621915906048,2023-03-20 23:25:41+00:00,La ladrona que cobraba las latas de atun a 20 mil en el PAE ahora viene a pedir libertad y orden.,iracundomaniaco
53,1637958586730008576,2023-03-20 23:25:33+00:00,"#ChiringuitoVAR independiente del gol fuera de juego o no, la expulsión del niño Gavi y Sergi Roberto, más la falta de Lewandowski a Carvajal antes del gol de Kessié... Es una liga. Balboa te equivocas...",AngelOteizaLpez
54,1637958210291105792,2023-03-20 23:24:03+00:00,La yañez va a imponer su ideología por sobre su calidad de jurista constitucional... Políticamente es más hábil que la cresta 😡😡😡,Guiller02276814
55,1637958197225857025,2023-03-20 23:24:00+00:00,"A we no entiendo tu falta de responsabilidad afectiva, que incongruencia tan grannnnde la que vives",AnaCarvajal24
56,1637957351901626368,2023-03-20 23:20:39+00:00,"#ChiringuitoVAR ¿Qué pasa que no se comenta nada de la falta de Lewandiski a Carvajal, previa al gol del Barca y que en Bilbao la señalaron anulando el gol?",MaelaMon
57,1637957235526496257,2023-03-20 23:20:11+00:00,"“Se ha llevado Gavi,  el contacto con los dientes de Carvajal” JAJAJAJAJAJAJ JAJAJAJAJAJAJ QUE BOCHORNO, por DIOS!!!!! Hasta dónde llega esta gente!!!!",Elchymou
58,1637957150445039616,2023-03-20 23:19:51+00:00,"Así se compra el silencio… y se arruina el Estado.
Gran trabajo de Rosa Carvajal para @larazon_es 

https://t.co/XPm5kDVsOa",igsaavedraceu
59,1637957097949102082,2023-03-20 23:19:38+00:00,todo fue un antes y un después,alma__carvajal
60,1637956784479518723,2023-03-20 23:18:23+00:00,Carvajal soy yo en el polideportivo pegando pases al azar y rezando para que salgan bien.,Soldado_Blanco7
61,1637956748085694464,2023-03-20 23:18:15+00:00,Ancelotti ...sabe que fue un robo el partido de ayer gol anulado legal ..gol ilegal del Barcelona por falta a Carvajal ..dos tarjetas rojas perdonadas a Gavi .... https://t.co/14JW72YhiQ,josemanuel30470
62,1637956628904288256,2023-03-20 23:17:46+00:00,"Eso lo sabe todo el mundo 🌍, menos el MP y la PGR.

Ahí reside el abuso de poder de Abinader y el PRM, ligado a Leonel Fernández en la intención de destruir el PLD y a Danilo Medina.

Quien crea que Leonel está fuera de estas acciones, está errado, se equivoca. https://t.co/YwLW58yqY0",HRCC07
63,1637955918577975299,2023-03-20 23:14:57+00:00,Los del madrid llorando por el empujón de Gavi a Ceballos pero se olvidaron de lo que hizo ceballos en la supercopa e ignorando lo de Carvajal 😭😭😭 ¿qué ganas metiéndote con un canterano?,nickwhb
64,1637955832322170881,2023-03-20 23:14:36+00:00,"SR.@javibalboa85 AL ver análisis R. Madrid, entre otras jugadas, fuera de juego Asensio y recuerdo las palabras d Xavier Hernández
""El fuera de juego es cientifico"" o algo así 
Si se TRAZA LINEA justo cuando el balón pierde contacto con pie Carvajal NO EXISTE FUERA DE JUEGO",LuisFer02584817
65,1637955821643395074,2023-03-20 23:14:34+00:00,"Creo que me siento en la obligación de comentarlo.

El clásico de ayer. Dio un muy buen rollo de parte de tchouameni y de Vinicius.

Ambos hicieron un partidazo y fueron muy buenos en todo sentido.

Carvajal y Gavi es otra historia...",samuray1221
66,1637955756916977664,2023-03-20 23:14:18+00:00,El miedo a expresarnos :(,AlmaCarvajal10
67,1637955240845508610,2023-03-20 23:12:15+00:00,Que os cuenten lo que quieran. Cogieron justo el frame que les convenía. En el siguiente la pelota sigue en contacto con el pie de Carvajal y Asensio en linea. Y ya está. Y luego a ir de víctimas obviando que tienen todo esto comprado de hace décadas. Así son.,Mike_Starkiller
68,1637955182213431296,2023-03-20 23:12:01+00:00,"En de vez notarias debieron llamarse reinos ya se heredaban de rey a principe,deben si o si reformarse en beneficio de los ciudadanos y terminar con el oscurantismo de estas mafias legales.. @latercera Notarías: una reforma que no se puede dilatar https://t.co/q6j4cdD5wH",jcarvajalsoza49
69,1637955163175505921,2023-03-20 23:11:57+00:00,El marikon d carvajal como se kita del medio rapido el xivato,pedrogp86
70,1637955122490662918,2023-03-20 23:11:47+00:00,S hablar y leer,AlmaCarvajal10
71,1637955021856817153,2023-03-20 23:11:23+00:00,"Radio Fórmula (México)
AMLO aseguró que en la reunión que sostuvo con legisladores de EU no se tocó el tema del fentanilo por respeto, pues “ya quedó claro que no lo aceptamos y quien mencione eso ofende a México”.
#AbriendoLaConversación #RadioFormulaMx.
https://t.co/HMlE2NktDL.",AlvaroC63558417
72,1637954984024088578,2023-03-20 23:11:14+00:00,"Te seré sincera siempre , me encantas pero no aportas en mi paz mental",NathyCarvajalP
73,1637954849508663300,2023-03-20 23:10:42+00:00,"Lo puedes tener todo, pero siempre va a faltar algo❤️",AlmaCarvajal10
74,1637954733141897216,2023-03-20 23:10:14+00:00,"Siempre voy a querer lo mejor para ti pero si me tengo que ir , me voy",NathyCarvajalP
75,1637954628879876096,2023-03-20 23:09:49+00:00,#chiringuitoarbitros asensio viene de estar en posición de fuera juego y cuando carvajal pasa el balón aún esta rn fuera juego eso en la vida puede ser gol,tomasga1972
76,1637954475448057856,2023-03-20 23:09:13+00:00,Mami cómo te explico que no me gusta nadie,NathyCarvajalP
77,1637954396423090177,2023-03-20 23:08:54+00:00,Hoy peque con un pudincito de chocolate 🥺,NathyCarvajalP
78,1637954233973473280,2023-03-20 23:08:15+00:00,"🏡 Te esperamos en la #CasaAbierta de #CondominioFirenze 

👉🏻 Este sábado 25 y domingo 26 de marzo de 10h00 - 16h00  

🤝 Financia tu nuevo hogar junto a #MutualistaAzuay  

📍Ubicación: Ángel Carvajal y Carlos Arizaga - Misicata.

#NuevoHogar #TuCasaListaconlaMutualista #Cuenca https://t.co/pbXQsUtYPr",MutualistaAzuay
79,1637953984299249664,2023-03-20 23:07:16+00:00,"Cuando pierde, el Madrid utiliza todas sus armas para desviar debates como el mal juego, como que Benzema ha estado a un nivel pésimo, como que Carvajal siga siendo el lateral derecho del Madrid, como los 12 puntos, poniendo el foco en una decisión acertada y en Negreira",zapapafrita
80,1637953963919278081,2023-03-20 23:07:11+00:00,"🎙️@AlbertoPereiro 

""En el Madrid no hay mucha autocrítica, están cansados con el tema del VAR. El fuera de juego de Asensio, la posible expulsión de Gavi, posible falta a Carvajal en el gol..."" https://t.co/q0X3yUSaQE",RadioestadioN
81,1637953963784826883,2023-03-20 23:07:11+00:00,📌Y la de que Carvajal es un coladero por esa banda te la sabes ?,AndrewF22110415
82,1637953849263632394,2023-03-20 23:06:44+00:00,es increíble la cantidad de veces seguidas y sin cansarme que puedo escuchar Un Coco,david_carv11
83,1637953809690271744,2023-03-20 23:06:34+00:00,"Técnicamente es mentira, no puede dormir en más de una cama🤣🤣🤣 a lo mejor duerme con más de uno en la misma cama😜😜😜 y no la dejan salir sin darle una jugosa despedida 💩💩💩",Guiller02276814
84,1637953729440653312,2023-03-20 23:06:15+00:00,Arnau me representa y Carvajal un mal perdedor https://t.co/wTgPsU7PuD,culesdelpuebl0
85,1637953473843982336,2023-03-20 23:05:14+00:00,Uno comienza a unir cosas y se va aclarando la luz en medio de la oscuridad,michelcarvajal_
86,1637953423130738691,2023-03-20 23:05:02+00:00,"Ay no, qué día tan aburrido, la próxima me ofrezco pa trabajar más bien JAJAJA no más festivos para mí",kancdu
87,1637953353039609857,2023-03-20 23:04:45+00:00,Carvajal ya está viejo y la edad no perdona pero lo de Mendy es XD,p_pfgx
88,1637953332546351105,2023-03-20 23:04:40+00:00,No se lo deseo a nadieeeee,NathyCarvajalP
89,1637953234043039744,2023-03-20 23:04:17+00:00,Yo solo llame para verte,NathyCarvajalP
90,1637953104082501632,2023-03-20 23:03:46+00:00,"Esto no se ve en el Chirincirco... Carvajal agrediendo a Arnau tenas, el 3er portero del Barcelona",Guille_Che
91,1637952989133455361,2023-03-20 23:03:18+00:00,"Por lo menos hay buenas noticias para #Venezuela el gobierno produce otro tipo de queso ajjaj por eso Hugo ""Pollo"" Carvajal está preso. #SiguemeYTeSigo #siguemeytesigotvmas #FelizLunes #Marzo2023 #SiguemeYTeSigoCumplo",Mardoniokorn
92,1637952533418196997,2023-03-20 23:01:30+00:00,LO MAS PEGAO #Musica #WBCenFOX Oscar Gamarra y Camilo Carvajal by Ese Beso #Colombia #WBCenFOX 👇 https://t.co/kwqcd6vhGG,ZuliaVallenata
93,1637952460898664448,2023-03-20 23:01:13+00:00,"Los que pedís que Carlo se vaya, ¿pediréis también que renueven a Kross, Modric y Carvajal no?..

Hay que ser gilipollas a las 3…",Miiyito_
94,1637952255042150400,2023-03-20 23:00:23+00:00,"Que triste tu comentario, te refleja de tomo y lomo en tu ideología perversa, feliz serias tomando tu las armas y eliminar a tus adversarios... Eres una mera sombra impregnada de decadencia",Guiller02276814
95,1637952198414876679,2023-03-20 23:00:10+00:00,No me entra en la cabeza que seas “periodista” de futbol y vengas a poner una imagen de Carvajal cuando el balón ya ha salido de su bota para justificar que no hay fuera de juego. Tienes menos idea que un crio de 2 años.,Sergio23151
96,1637951631290408960,2023-03-20 22:57:55+00:00,Os recomiendo encarecidamente este hilo sobre el pobre Gavi que salió mal del codo pq Carvajal le dio con los dientes...,profesorgeohis
97,1637951125092540416,2023-03-20 22:55:54+00:00,"#ChiringuitoCuentaAtras lo de Gabi a Carvajal, falta,cómo mucho tarjeta amarilla,la entrada de Nacho al borde de área tarjeta amarilla,siendo la segunda roja y espulsion",cuest_eduardo
98,1637950983476224001,2023-03-20 22:55:20+00:00,"Dos Asesinos.   Una de Nahuel y Maldonado, el Otro Junto con la Hiena Vidal Asesinos de Favaloro.  QUE POCOS VALORES SE MANEJAN EN ESTE ISPA.",GronchoPeronist
99,1637950935895883778,2023-03-20 22:55:09+00:00,🇪🇸 Justicia española prorroga la prisión preventiva para el Pollo Carvajal https://t.co/N2AcQQ8sNC,ALnaviocom
100,1637950646748958723,2023-03-20 22:54:00+00:00,"Ante crisis policiaca, Consuelo Cruz, debe dejar el cargo de Secretaria de Seguridad, dice Carvajal  https://t.co/x5LPAxUInG",DiarSinSecretos
101,1637950584757305344,2023-03-20 22:53:45+00:00,Lo traía de vuelta. 100% enserio. Se mea en Carvajal.,Kelle4Three
102,1637950429362282503,2023-03-20 22:53:08+00:00,"Voz de América (USA)
Los mercados bursátiles sufren por el fracaso de algunos bancos regionales en Estados Unidos. Hoy la crisis es global y varios bancos centrales, incluida la Reserva Federal, entraron en acción. 

Iacopo D Luzi tiene lo ultimo...
https://t.co/dFgIdE0Qae.",AlvaroC63558417
103,1637950340279533568,2023-03-20 22:52:47+00:00,"Yo no sé a cuántos hay que renovar de Kroos / Modric / Benzema sabiendo que Ancelotti los va a poner todos los minutos de todos los partidos, pero limpiarse a Carvajal y Lucas y traer un lateral derecho medio competente sí que sé que urge.",nandoda88
104,1637950315642372096,2023-03-20 22:52:41+00:00,"El año pasado me hicieron un dibujito y me dijeron aquí tienes tus flores amarillas, ya veremos dijo el ciego",michelcarvajal_
105,1637950204023304192,2023-03-20 22:52:14+00:00,"Voz de América (USA)
Migrantes en Nueva York, EEUU, se han encontrado con una iglesia en el corazón de la ciudad donde además de impartirse misa, se les asesora legalmente con sus casos migratorios. Ángela González nos cuenta de qué...
https://t.co/S2aHQPrW0L.",AlvaroC63558417
106,1637949868709756928,2023-03-20 22:50:54+00:00,"VoVoz de América (USA)
El último diplomático del Vaticano que quedaba en Nicaragua abandonó el país y clausuró la sede diplomática. La Unión Europea asegura que el presidente Daniel Ortega suspendió de forma unilateral las relaciones diplomáticas entre...
https://t.co/RhcbTEyDdU.",AlvaroC63558417
107,1637949759314100224,2023-03-20 22:50:28+00:00,¡Ya están listos! - Contigo Puebla https://t.co/4oItpV4i9R,EnriqueCGC1
108,1637949710366576641,2023-03-20 22:50:17+00:00,El ejemplo 🤣,michelcarvajal_
109,1637949425413677062,2023-03-20 22:49:09+00:00,"Radio Fides de Bolivia. 

🔴 LA HORA DEL PAÍS - VESPERTINO 🔴
https://t.co/Gy3KN9ttve
101.5 𝑓𝑚 - 760 𝑎𝑚
https://t.co/XHhD9prm97",AlvaroC63558417
110,1637949420149800960,2023-03-20 22:49:08+00:00,"#ChiringuitoCuentaAtrás ¿No vais a hablar de la falta de Lewandoski a Carvajal, previa al gol del Barca?",MaelaMon
111,1637948839318487044,2023-03-20 22:46:49+00:00,"#LibertadYOrden 
Realidad y tendencia, sin bodegas ni bots.
Libertad y Orden impuestos por nuestras gloriosas FFAA con el apoyo ciudadano.
LIBERTAD Y ORDEN en nuestra amada Colombia.
#FueraPetro",sercarpo
112,1637948478817959938,2023-03-20 22:45:23+00:00,Lo de Carvajal es intensidad y ADN. Lo de Gavi es juego sucio. Así va la narrativa de la caverna.,csanchez29
113,1637948361461362688,2023-03-20 22:44:55+00:00,"Si uno quiere esperar que otr@ haga por uno lo que uno no quiere hàcer por uno mismo, entonces uno debe estar preparado para esperar toda la vida.",OscarCarvajaI
114,1637948076068405248,2023-03-20 22:43:47+00:00,Yo con Plata soy lo peor que me puede pasar,natacarvajallm
115,1637948032737062912,2023-03-20 22:43:37+00:00,"Entonces lo q diga el MP en su relato fáctico es cierto, cosas cómo esas ha dicho el MP en cada uno de los casos y no ejecuta
Extraño es que siendo Danilo el principal objetivo y el MP teniendo esa prueba no lo imputa ¿Por qué? 

Ese MP dijo q Dicent era el cabecilla sin pruebas https://t.co/KbI1SPKzze",HRCC07
116,1637947895617036288,2023-03-20 22:43:04+00:00,Esto buscan China y Rusia con su relación https://t.co/1TP4CKL2MX vía @_masinformacion,OscarCa31889692
117,1637947673272627201,2023-03-20 22:42:11+00:00,Siempre que tengo terapia es como un ya no sé qué contarle aaaaah pero salgo diciéndole lo que tenia guardado y que ni yo sabía,AnaCarvajal24
118,1637947433513627650,2023-03-20 22:41:14+00:00,"El Dr. Julito Hazim se pregunta:

👉si Abinader puede explicar lo del helicóptero de la Vega
👉lo del nombramiento de Michel Dicent en la Lotería

yo le agrego:
👉si Abinader puede explicar lo del financiamiento a su campaña de Miguel Gutiérrez y su hermano
👉lo de Yamil Abreu https://t.co/RBMxgKH1f9",HRCC07
119,1637947306392580096,2023-03-20 22:40:44+00:00,"My Danny me escribió con los crisoles académicos que he acreedor en Norteamérica desde Miami lo siguiente:""Papi no quiero que te involucre en las redes sociales en los últimos temas del Ministerio Publico,recuérdate que ni abuelo Frank y tú han recibido nada de ningún gobierno"".",TitoCarvajal7
120,1637947122564861952,2023-03-20 22:40:00+00:00,Los detalles 👉 | La justicia española prorroga la prisión preventiva de Hugo “el Pollo” Carvajal https://t.co/rcOKTS67x9,FraseSimple
