,Tweet Id,Datetime,Tweet,Username
761,1637845419588763656,2023-03-20 15:55:52+00:00,"En el Madrid no todos son como Carvajal. Imagino que después de esto, que debería ser lo normal, harán campaña contra Tchouameni como cuando querían echar a Alaba por votar a Messi en el The Best. https://t.co/jcuBnlrgi9",UNIVERSO_1899
762,1637845414907981824,2023-03-20 15:55:51+00:00,no entiendo que es todo el hate y tabú que ronda en los dating apps. Tf do u want ppl to meet? LA FLORISTERIA? ponete serio,NickyCarvajal1
763,1637845301040906248,2023-03-20 15:55:24+00:00,Q poco aprecia su vida para encararse con Carvajal,mangeIasecas
764,1637844891903328257,2023-03-20 15:53:46+00:00,"Jajajaja tremendo becerro ese Carvajal, a llorar a Cibeles.",gregperfect
765,1637844810470965253,2023-03-20 15:53:27+00:00,"Ser un adulto joven e independiente, significa olvidarse constantemente de poner algo a descongelar para poder comer y sobrevivir 🙃",Luis_MCarvajal
766,1637844739033579520,2023-03-20 15:53:10+00:00,Ojeras nivel: 3 day pass,DCarvajalH
767,1637844546967990273,2023-03-20 15:52:24+00:00,El periodismo español a la merced del hombre más poderoso de España si dice que Carvajal es un santo y el chavalín Arnau va a por Carvajal así te lo venden,andxtm
768,1637844418475577346,2023-03-20 15:51:53+00:00,Un novio que me lleve a bailar y bailarle bien deli.🥴🥴,Eva_Carvajal_
769,1637844286170341378,2023-03-20 15:51:22+00:00,"Cuando ves más cerca el momento de cero espacios para el desarrollo del periodismo 😥 A quien corresponda: por favor, resguardo policial para @LeninArtieda 🙏🏻",marycarvajal
770,1637844058453180418,2023-03-20 15:50:27+00:00,"🏫 ✨ Así se vivió el inicio de clases en el Colegio Emblemático Melitón Carvajal de Lima. 

📷: Félix Contreras | Fotografía-GLR https://t.co/hjmr9Pv30P",elpopular_pe
771,1637844055294967808,2023-03-20 15:50:27+00:00,Ves esta acción ataque-defensa de Carvajal y entiendes porque el Madrid a 20 de Marzo no está peleando codo con codo LaLiga con el Barça.,alvaroricaart
772,1637844029797793797,2023-03-20 15:50:21+00:00,En lo dicho. Todo fue culpa de Layú... digo Carvajal.  🤦🏻‍♂️,Quique_Llh
773,1637843971522084865,2023-03-20 15:50:07+00:00,"Que lamentable estos de @marca Arnau se fué a por Carbajal dicen, mira a ver un poco antes cuando le coge del cuello, llericas. Arnau Tenas se fue a por Carvajal tras el partido https://t.co/JlgH2MMsET a través de @marca",Moloc1
774,1637843902781702145,2023-03-20 15:49:50+00:00,"Que es como decir que Carvajal  mordió a Gabi en el codo. Después  de tantos años de pelopincho en Movistar , es la indecencia personificada",PedrearteOnuba
775,1637843785265684483,2023-03-20 15:49:22+00:00,Carvajal era un muerto andante x el terreno😂😂😂,I_am_Chris98
776,1637843513806143491,2023-03-20 15:48:18+00:00,"Amigo el reglamento dice que, en cuanto se toca el balón es fuera de juego y se ve perfectamente como Carvajal ya está tocando el balón.",Marley990
777,1637843410814922752,2023-03-20 15:47:53+00:00,Pff que pringao haciendo que quiere ir corriendo a por el cuando lo tienen agarrado jajajajajajajajajaja si lo sueltan Máximo se encara con Carvajal,HassanLaarif
778,1637843253457297410,2023-03-20 15:47:15+00:00,"Pero si a mí @diarioas ,@marca y @elconfidencial me habían contado que Arnau se fue a por Carvajal.",boca419
779,1637843129406574595,2023-03-20 15:46:46+00:00,"¡Dejen de mentir, parásitos narcochavistas!
Están en medio de un ajuste de cuentas para quedarse con todo.
¿#juntoscontralasmafias?
¡Tendrían que cometer seppuku, no joda!
Y yo no los veo tan valientes como para hacer eso…",Wily_S
780,1637843125363171330,2023-03-20 15:46:45+00:00,"Carvajal, retratado en el Clásico y en el gol de Kessie: 39 segundos anticompetitivos https://t.co/pPc00UtG8E",DMQRealMadrid
781,1637843081004187648,2023-03-20 15:46:34+00:00,"También digo, me parece raro que Carvajal justo se vaya a por este who. Habría que saber las dos partes también",Littlefitchy
782,1637843057197346820,2023-03-20 15:46:29+00:00,🤓 siempre me han interesado los procesos https://t.co/x2r9sSJan5,kotecarvajal
783,1637843053883817984,2023-03-20 15:46:28+00:00,¡Echa un vistazo al vídeo de Movistar Plus+! #TikTok https://t.co/TVMSHUbJxj carvajal eres un .......................................................,MTeodoronadal
784,1637842860300025858,2023-03-20 15:45:42+00:00,"En cuanto twiter me permita seguir dando follow los seguiré haciendo.

Muchas gracias a todos por ayudarme a incrementar de seguidores mi cuenta nueva.

Excelente inicio de semana amigos 😇

Muchas gracias 🙏",Ignacio31717255
785,1637842812669444097,2023-03-20 15:45:30+00:00,"Carvajal Mendy, y tengo alguna duda con Karim, pero se me hace muy fuerte echar a una leyenda.",lukiifdez
786,1637842798031323138,2023-03-20 15:45:27+00:00,"Esta acción de Gavi sobre Ceballos igual que el codazo sobre Carvajal no es casta, ni entrega... son AGRESIONES que el reglamento arbitral @CTARFEF NO permite al resto de 19 clubes, solo al Barça porque Laporta sigue comprando árbitros para que no se sancionen ni revise el VAR.",Hernandezcule_
787,1637842648906997760,2023-03-20 15:44:51+00:00,"Mi mujer y yo conocimos a Angel Sanz Briz, autentico heroe y persona maravillosa, en Nueva York, donde era el Consul de España, a principios de los años sesenta.",jcarvajalur7
788,1637842492778328068,2023-03-20 15:44:14+00:00,Suélteme el brazo,josedacarvajal
789,1637842409450078208,2023-03-20 15:43:54+00:00,"Ancelotti nos ha dado mucho pero ya se acabó si tiempo. Que en vez de poner a Rodrygo en la banda derecha, para crear más ataques y abrir la defensa, lo deja de punta izquierda para estorbar a Vinicius y dejar toda la puta banda derecha sola para Carvajal. Y así mil veces.",Tribu_Apache
790,1637842332509696003,2023-03-20 15:43:36+00:00,Sin embargo Carvajal via libre para agredir.,MercadoATM
791,1637842329510846467,2023-03-20 15:43:35+00:00,La de Carvajal no se revisa como en Bilbao y no sabemos por qué,aledevca7
792,1637842250053955586,2023-03-20 15:43:16+00:00,Carvajal ya está viejo y gordo  https://t.co/1s7LQYv2SP,migueltasc0n
793,1637842092213915649,2023-03-20 15:42:39+00:00,"El problema de que sigan en plantilla:Benzema,Modric,Kroos,Carvajal… es que el entrenador que esté, estará condicionado! En muchos partidos los pondrán sin merecerlo,pero como son leyendas y mandan mucho… para mi,cuanto antes se vayan del @realmadrid  mejor !",19Cassano
794,1637841869399814144,2023-03-20 15:41:45+00:00,a saber que coño le dice Carvajal a Arnau Tenas para que reaccione así eh,balb_f1
795,1637841787766308864,2023-03-20 15:41:26+00:00,"A ver si entienden  que Fede no es puntero derecho, Nacho es central, Carvajal no le preocupa jugar mal,  no tiene competencia, Benzema ya debe salir si juega mal",juancasvaldez
796,1637841602885427201,2023-03-20 15:40:42+00:00,"Sabéis una cosa? De La Fuente se ha cargado a Ferran y Fati, pero sigue llevando a Carvajal 😂😂😂 #Barça #SeleccionEspañola",MTeresaBS1
797,1637841535331860480,2023-03-20 15:40:26+00:00,Carvajal siempre ha sido nefastísimo,Jano_Espinozaa
798,1637841337885114370,2023-03-20 15:39:39+00:00,Los que piden falta sobre Carvajal en el gol de KESSIE son los mismos que presumen 14 champions en fuera de lugar,SoY_JuLiTTo
799,1637841274660167682,2023-03-20 15:39:24+00:00,"Qué manipuladores y qué mal perder tienen estos vikingos. Carvajal un alma de la caridad, si. No sería al revés, @marca?",Luiskar65
800,1637841218699665409,2023-03-20 15:39:10+00:00,"Te están metiendo por los ojos eel empujón de Gabi y su correspondiente teatro madridista, pero no te muestran al retrasado de Carvajal yendo a por Arnau y cogerle del cuello…no, eso no",Depot02423706
801,1637841177574506497,2023-03-20 15:39:01+00:00,"No veo a los madridistas haciendo autocrítica.
Hicieron un partido normalito tirando a malo, cuando era su última oportunidad de engancharse a la liga.
Y solo hay excusas y excusas, Carvajal un muerto, vini 2 veces y me estoy pasando, Benzema horrible, Valverde peor… y así",pedrilibers
802,1637841174877687808,2023-03-20 15:39:00+00:00,"Nunca fue nadie Carvajal, y ahora tiene que ir a por chavales que sí lo son, se nota la frustración",CuleArmyy
803,1637840990164639746,2023-03-20 15:38:16+00:00,"De la gente no, de la banca. Y ya van???",josedacarvajal
804,1637840568087617537,2023-03-20 15:36:35+00:00,Sólo te fijas en Carvajal con la música de fondo y es que te ríes sin querer 😂😂,GabriFlores94
805,1637840505546440705,2023-03-20 15:36:20+00:00,Aranu agarra a Carvajal y lo mata.,masegt77
806,1637840474084868097,2023-03-20 15:36:13+00:00,"Ceballos y Carvajal en cuanto vean a Gavi en las rozas:
https://t.co/06UAdfwAMN",fraguano99
807,1637840472751194114,2023-03-20 15:36:12+00:00,"Esto tampoco se vió en la TV, roja asegurada pa Carvajal.",SecardenOk
808,1637840410478297088,2023-03-20 15:35:58+00:00,"Preocupa y duele todo lo que pasa en el país. Tenemos derecho a trabajar y a vivir en paz, sin amenazas, sin presiones, sin miedo. Hoy son @LeninArtieda y @EcuavisaInforma, ¿mañana quién? La solidaridad en estos días ya no es opcional,es un deber,si queremos salir de este agujero",anymini
809,1637840354178203650,2023-03-20 15:35:44+00:00,"En ésta imagen todavía la tiene Carvajal, y NO, no es fuera de juego https://t.co/Mswsc2tLSJ",GxldeFede15
810,1637840283919429635,2023-03-20 15:35:27+00:00,"Cerdallos y Carvajal hacen agresiones con y sin balón: “Es normal es que de están jugando mucho y los nervios juegan una mala pasada”
Lo hace Gavi: “vaya guarro! Otra vez sin la roja, siempre igual, al borde del reglamento”

Y si hablamos de Vinicius… cuántos partidos +",pedrilibers
811,1637840282023518210,2023-03-20 15:35:27+00:00,no puedo ser tan exigente conmigo misma,SaraayCarvajal
812,1637840207524372481,2023-03-20 15:35:09+00:00,"Buenos días amigos  !!

Feliz inicio de semana

👇👇👇🤣🤣🤣🤣🤣

https://t.co/a1VLsYJtC4",Ignacio31717255
813,1637840195813883906,2023-03-20 15:35:06+00:00,[CHOREOGRAPHY] 지민 (Jimin) ‘Set Me Free Pt.2’ Dance Practice https://t.co/DC6nF5P7kd vía @YouTube,adabelyscarvaja
814,1637840181557358592,2023-03-20 15:35:03+00:00,"Se les ha olvidado poner los trozos de vídeo donde Carvajal agarra del cuello a Arnau. Luego lloran por los frames, pero mira qué finos para elegirlos aquí.",SergioMCorrales
815,1637839702848950279,2023-03-20 15:33:09+00:00,"Una pena, grandes pérdidas!!!",thito30
816,1637839652714430466,2023-03-20 15:32:57+00:00,"Al amanecer el dia despues del ataque de Juan N Cortina y sus hombres a Brownsville, Jose Maria Carvajal, uno de los hombres más influyentes en la región; salió a las calles diciendo que el detendría la violencia. Estando del lado norte del Río, hizo señas al Crnl Miguel Tijerina https://t.co/5PgiwA42yI",IngenieroPetrol
817,1637839538532786177,2023-03-20 15:32:30+00:00,LO MAS PEGAO #Musica #WBCenFOX Oscar Gamarra y Camilo Carvajal by La Amenaza #Colombia #WBCenFOX 👇 https://t.co/kwqcd6vhGG,ZuliaVallenata
818,1637839395406454785,2023-03-20 15:31:56+00:00,Q Carvajal se chino porq Arnau le dijo facha de los cojones  https://t.co/GrzmaQTLfL,assereqbola2
819,1637839285784133641,2023-03-20 15:31:29+00:00,Tensión tras la derrota del Real Madrid en el Camp Nou: Carvajal se encaró con Arnau Tenas https://t.co/j8YdsqRFaI,20m
820,1637839253387321345,2023-03-20 15:31:22+00:00,"Ancelotti out
Benzema banca
Modric banca
Kroos banca
Carvajal out

Haber ganado la Champions la temporada pasada nos ha hecho un gran daño. Sino Floper no despierta out también.

2 laterales
1 medio creativo
1 killer
1 extremo derecho",thisfernando7
821,1637839251172671489,2023-03-20 15:31:21+00:00,"Antes: 207.9€
Ahora: 175.99€ 😱📉 -15% 😱
Don Descanso Mulhacén Colchón Viscoelástico, Espuma, Altura 26cm, 135x190 Cm

👉https://t.co/Y9H1YIfYth

Gavi Alonso Benzema Sergi Roberto #ElClasico Barça Carvajal https://t.co/8aD8w9gnAe",economame
822,1637839156809195524,2023-03-20 15:30:59+00:00,"#HIPISMO &amp; #PARLEY 

Escuchen al Parasito de Fred Rafael Desideiro Carvajal, para Jalarle Bolas al Potro no se equivoca el Medico Frustrado este. Puros incompetentes en INH TV. https://t.co/MlFoM99abV",StudBakuSports
823,1637839141965557760,2023-03-20 15:30:55+00:00,JAJAJA qué lindo este pibe Carvajal,josechgz
824,1637839058817654786,2023-03-20 15:30:35+00:00,"Y en esto se resume el presente no solo de Carvajal, sino de un par más.
Que carajos hace Carvajal yendo a presionar como loco a esa parte, dejando el espacio por dónde atacan para el 2-1. Desde hace tiempo no es jugador de nivel Real Madrid, ojalá se tomen en serio fichar un LD.",JorgeL2P
825,1637838803850100737,2023-03-20 15:29:35+00:00,Yo creo que Ceballos no se fue a por Gavi ni Arnau a por Carvajal. Creo que Gavi agredió a Ceballos y Carvajal cogió del cuello a Arnau.,Dvinuesa
826,1637838795411271680,2023-03-20 15:29:33+00:00,Hacer paddle es terapia 💙 https://t.co/EqvL6L2HKk,tatoxcarvajal
827,1637838756089667585,2023-03-20 15:29:23+00:00,"Ayer el clasico no se pierde por el árbitro se pierde por lo siguiente:
1: mal planteamiento del técnico
2: no puede seguir carvajal de lateral derecho titular
3: Benzema ahora mismo es 1 menos,",JocsanCoello
828,1637838562421796865,2023-03-20 15:28:37+00:00,Cómo me la paso 24/7  / cómo soy https://t.co/1Dg83hLB9W,andreycaas
829,1637838188017246208,2023-03-20 15:27:08+00:00,El PC sigue sumando puntos en contra... puro trucherio https://t.co/OV6oHQPmOR,Leo_Tuitero
830,1637837972358799360,2023-03-20 15:26:16+00:00,Carvajal es el típico que va de gallito y luego a la que le sueltan la primera sale llorando.,CantuATM
831,1637837776082141186,2023-03-20 15:25:30+00:00,"Estoy preocupado por el codo de Gavi , habría que denunciar que Carvajal le dio con la barbilla en el codo..",Carlos_YR1
832,1637837693982834691,2023-03-20 15:25:10+00:00,"Que.puto asco da Carvajal, maldito",ImTh3Hate
833,1637837439581528064,2023-03-20 15:24:09+00:00,"Dice la prensa que Arnau Tenas se fue a por Carvajal en el final… lo que no ponen es que fue al revés. 
Una vez más, la prensa nacionalmadridista

https://t.co/wlrI9Im0jF",DiegoOjeda724
834,1637837321289576449,2023-03-20 15:23:41+00:00,A propósito de la vuelta a Cataluña. Montar una startup es como el ciclismo de ruta. Muchas etapas de gran fondo donde pequeños éxitos y derrotas se van acumulando para el resultado final: un exit o morir,camiloCoNl
835,1637837275512950784,2023-03-20 15:23:30+00:00,"#SomosGuardianesDelPueblo

#20Mar Ante cualquier situación de peligro acude al GAES más cercano de tu jurisdicción.

🚨 Estamos para protegerte.

 #LaFANBEsVenezuela
.@GNB31Portuguesa https://t.co/VLtm63U0ny",CarvajalBravoC
836,1637837174585303044,2023-03-20 15:23:06+00:00,"Lo de Dani Carvajal el domingo, lo de Carioca-Guido Pizarro el sábado, es similitud de que ya aun que sea de Jerarquía di no aportas mejor ya hazte a un lado. De verdad, si aman los colores del equipo reconozcan que no pueden ya, y cedan el paso a alguien mejor.",Eltigre15161718
837,1637837140477325312,2023-03-20 15:22:58+00:00,Jugar monopolio y quedar en bancarrota es mi pasión jajajajajaja,Leonarcl19
838,1637837100392370178,2023-03-20 15:22:48+00:00,Es el día de la felicidad a sonreír https://t.co/Egy0GxtiYx,CarvajalFrancys
839,1637837091471081475,2023-03-20 15:22:46+00:00,"Después del partido de ayer aun lo tengo mas claro q el Taurino se equivoca.

Carvajal es malo no, lo siguiente.. xD ☠️
Nacho de lateral meh! y de central, se vera las caras contra Haaland 💀
Ceballos juega solo los minutos basura en el RM🤔",shudoh79
840,1637836910453313537,2023-03-20 15:22:03+00:00,Carvajal solo sirve para crear polémica o algo?,JohanCoutinhoVF
841,1637836301926793222,2023-03-20 15:19:38+00:00,"Antes: 499€
Ahora: 319€ 😱📉 -36% 😱
Cecotec Patinetes Eléctricos Bongo Serie A. Potencia Máxima De 700 W, Batería Extraíble E Intercambiable, Aut...

👉https://t.co/yvSw8jTjpC

Gavi Benzema Alonso Sergi Roberto #ElClasico Barça Carvajal https://t.co/KlNkcOtO66",economame
842,1637836296348659713,2023-03-20 15:19:37+00:00,"Lo de Dani Carvajal es tristísimo: 
 https://t.co/OmvZ7coFVj",SoyCristianRey
843,1637836276329054208,2023-03-20 15:19:32+00:00,Recoge el fruto de tu sudor... https://t.co/O4cPkH20cs,alitoscor
844,1637836229851897858,2023-03-20 15:19:21+00:00,"A mí lo que me van a tener que explicar es por qué teniendo a este Carvajal, ayer tras los cambios le coloca toda la banda derecha para él,como si fuera R.James, que había jugadas en las que estaba de extremo, sabiendo que es muy limitado, el 2º gol viene de varias cagadas suyas.",Ed7Edu
845,1637836176034865156,2023-03-20 15:19:08+00:00,"Entre Carvajal que no está en su mejor momento y Valverde que no es extremo pero juega siempre de extremo, nuestra amenaza ofensiva por la banda derecha es inexistente. Y los rivales lo saben. Sobreprotegen la izquierda sabiendo que por la derecha pueden estar tranquilos.",1PabloCabezas
846,1637836090546479104,2023-03-20 15:18:48+00:00,"Carvajal es de la mayor escoria que hay en el mundo del Fútbol, menudo tonto",HolaSoyDomy
847,1637835941078528001,2023-03-20 15:18:12+00:00,Pero no muestran cuando Carvajal va y lo agarra del cuello primero!!! https://t.co/0Le0YSRAj8 via @marca,Catocho9
848,1637835649830010880,2023-03-20 15:17:03+00:00,... Y de pronto el mundo se puso en blanco y negro y ella... Ella brillo de color!,giecarvajal
849,1637835475254919169,2023-03-20 15:16:21+00:00,"¡Promoción de música gratis disponible ahora! Obtenga su acceso gratuito a los éxitos más recientes aquí.
https://t.co/BApohyAvPP

#ElClasico #Gavi #Alonso #Benzema #SergiRoberto #Barça #Carvajal #FelizLunes #Madrid #ConexiónHonduras3 #Asensio #Mendilibar #Sampaoli #Araujo",dekuu_sfr
850,1637835241686548480,2023-03-20 15:15:25+00:00,"A todo esto: Para línea polémica  la que tiró el VAR en la ida en el fuera de juego que precede al penalti a Rodrygo. De aquello no se habló nada. Tampoco del penalti de Carvajal a Lewandowski.
En la primera vuelta todo de maravilla, eh, a pesar de que sí hubo polémica de verdad",1899Azulgrana
851,1637835235613192193,2023-03-20 15:15:24+00:00,"La verdad es que fue Carvajal el que se fue a por Arnau Tenas, pero supongo que queda mejor así 🤷🏼‍♂️",isaacfandos97
852,1637835211424579586,2023-03-20 15:15:18+00:00,😲😲 😬😬 y aqui no paso nada si fuese sido el #RealMadrid ya usteden se imagina,Marialex_ca11
853,1637835042276687872,2023-03-20 15:14:38+00:00,"""La humildad es el único terreno en el que puede crecer la verdadera unidad. Solo cuando Cristo sea más precioso para nosotros que nuestra propia reputación, abandonaremos nuestras pequeñas rivalidades y agendas personales. -Michael Reeves",hellen_carvajal
854,1637835002506358784,2023-03-20 15:14:28+00:00,"pobre carvajal, así termino caminando yo despues de una media corrida en el navideño 🤣",IrvingHdz_
855,1637834973943087105,2023-03-20 15:14:21+00:00,"No vale joder solo a carvajal, ni benzema, vinicius o asensio hace el recorrido luego de perder la pelota. El madrid es un equipo y todos juegan para el mismo escudo, todos deben de hacer el esfuerzo y queda claro que no les importa pelear la liga",ale27rangel
856,1637834763259060225,2023-03-20 15:13:31+00:00,"Si no agarran a Tenas, te matan Carvajal. Payaso.",moreno_yhoan
857,1637834623039205376,2023-03-20 15:12:58+00:00,"Ymj haber perdido e irte a por el portero suplente, carvajal tiene la neurona justa pa no cagarse encima",Stevens_narvaez
858,1637834612574498818,2023-03-20 15:12:55+00:00,Carvajal es un lloron maricon.,LuisFAguilar99
859,1637834426682843139,2023-03-20 15:12:11+00:00,"El Madrid, con Mendy, juega con uno menos. Con Carvajal, juega contra 12.
Fue bueno mientras duró, lo dio todo, pero está a años luz del nivel que necesita el Madrid. Y ya no es algo puntual",chequevarajr
860,1637834145727488001,2023-03-20 15:11:04+00:00,"No he visto ni una sola imagen en la televisión en la que se muestre como es Carvajal el que agarra del cuello a Arnau Tenas y luego ya se revuelve el portero del Barcelona.

Solo se ve como directamente es el portero el que va a por él",crea_periodismo
861,1637834122411343874,2023-03-20 15:10:58+00:00,"Por lo que sea empieza a medias. Yo quiero ver más contexto. 
 Siendo carvajal es probable que simplemente sea gilipollas . Tambien te digo que no entiendo cuando os quejais de que no lo echen si nos haría  un favor...",kamikazRm22
862,1637833681568931840,2023-03-20 15:09:13+00:00,"Carvajal, subnormal",EstebanDJ_87
863,1637833676540002304,2023-03-20 15:09:12+00:00,"Que hueva que se quejen tanto de los árbitros pensamiento de equipo pequeño. Y no lo somos, el problema es que el Madrid a dejo ir 20 puntos haciendo el ridiculo. Jugamos con Benzema, Kroos, Modric y Carvajal todos los partidos y ya jugamos con 4 jugadores menos así no se compite",thisfernando7
864,1637833360906113025,2023-03-20 15:07:57+00:00,"Que lamentable es Carvajal, encima tarda en regresar y Lewandowski se deshace de él fácilmente.

Pero da igual, no se buscará a un LD hasta que el decida.

https://t.co/A043uQqwLc",MrARMCF
865,1637833339448197121,2023-03-20 15:07:52+00:00,"Karl Marx: El Progreso y lós caminos del arte.
CEMEES https://t.co/KdNfzlZzKl",EnriqueCGC1
866,1637833117451911168,2023-03-20 15:06:59+00:00,Santiago Pavlovic destrozó a Pamela Jiles: Reveló que toda su vida ha sido un fraude y que se jacta de recibir millones de la empresa Caffarena -  https://t.co/Jv6uAED4TD,FabianC63564754
867,1637832806137987072,2023-03-20 15:05:45+00:00,"Que Carvajal es gilipollas ya lo sabíamos... y por desgracia, que en Marca son unos manipuladores, también",isma_code
868,1637832718611275780,2023-03-20 15:05:24+00:00,"Carvajal:
Guarro, antideportivo, y mal perdedor. 
Siempre.
Qué asco de tuercebotas.",FraykinJavier
869,1637832630208024579,2023-03-20 15:05:03+00:00,"Se nota claramente que, o Putin camina medio raro o, tiene problemas para andar por su pierna izquierda!!",CarvajalOctavio
870,1637832621752295426,2023-03-20 15:05:01+00:00,Cnd va a tocar hablar de q Achraf era nuestro y no se ha guardado ni una opción de compra barata/preferencia para cuando empezara el declive de Carvajal,SSantosm23
871,1637832561278832643,2023-03-20 15:04:46+00:00,"Fiscalía española pidió prorrogar prisión de Hugo ""El Pollo"" Carvajal https://t.co/N4Sz0Z7tfW",Elpoliticonews
872,1637832475589111810,2023-03-20 15:04:26+00:00,"Vinicius Tobias no puede tener oportunidades viendo a Carvajal liándola cada semana en serio?

Ancelotti está a punto de ser despedido.",OcapoFlex
873,1637832439195115520,2023-03-20 15:04:17+00:00,"Van a estar Carvajal y Ceballos en el mismo vestuario que Gavi. Encima gestionado por el bufón de luis de la fuente, se van a dar de ostias fijo",yeraymiranda_
874,1637832349038661632,2023-03-20 15:03:56+00:00,Carvajal es un pedazo de maula del copón,JoseMC_RM
875,1637832304839077890,2023-03-20 15:03:45+00:00,"Está claro, que el segundo frame es justamente cuando Carvajal está soltando el balón, y obviamente, Asensio que estaba saliendo ya no está en fuera de juego.Pero las decisiones las toman los que las toman. Por qué no se revisaron las dos agresiones de Gavi? Sobre todo la segunda",MichaelRaigal
876,1637831988101935106,2023-03-20 15:02:30+00:00,"Arnau Tenas estalló tras la provocación de Carvajal: Tuvieron que pararlo entre cuatro https://t.co/pulrcrOhaD 
Gargajal en todas las salsas. 
El sucesor del quillo Ramos. 
A cual peor.",FraykinJavier
877,1637831964290961411,2023-03-20 15:02:24+00:00,Lo que cita Ecuadorplay Doc @JorgeSosaMeza pilas,PedroMontalvanC
878,1637831917478330369,2023-03-20 15:02:13+00:00,"Miguel Serrano pretende hacernos creer que entre que Carvajal golpea el balón y sale de su pie pasan 3 segundos.

Fijaos en el marcador y los segundos que marca en cada frame.

Son un meme y no dan para más que para ser el hazmerreír.",FlorianGuirtz
879,1637831785110224897,2023-03-20 15:01:41+00:00,"Desde 2013, la ONU celebra el #20de Mar el Día Internacional de la Felicidad, como reconocimiento al bienestar y la felicidad en la humanidad y la necesidad de que tome relevancia  en las políticas de los gobiernos.
@_LaAvanzadora 
@vicent_carvajal 
@MPPEDUCACION https://t.co/kDRqgaAv6Q",DGRPA1
880,1637831692076437506,2023-03-20 15:01:19+00:00,"Señora Lewin, empiece del año 70,71,72 hasta llegar porque tuvieron que ASUMIR las FFAA y ORDEN el año 73, NO borre la historia, de esos años de 💩que VIVIMOS gobernando los comunistas, al IGUAL que ahora estamos viviendo en las🙌del sr.Boric, su PRESIDENTE, 🙈",ccarvajalpe
881,1637831650796093441,2023-03-20 15:01:09+00:00,Carvajal siempre es un subnormal..  #Valores,ETano21
882,1637831567211999232,2023-03-20 15:00:49+00:00,Ni por Mendy y ni por Militao. Ese gol fue culpa de Carvajal. Ya se está pareciendo a los últimos años de Marcelo,ElLlanero2022
883,1637831407958458369,2023-03-20 15:00:11+00:00,"Carvajal es tan especial que golpea el balón directamente con su pierna ya totalmente estirada. Como si tuviera una muleta.

Periodistas se hacen llamar...",BrunoBipigi
884,1637831285681823747,2023-03-20 14:59:42+00:00,Buen día 🌈 ☀️ https://t.co/GGSiWfVEjz,CamilaBurbano04
885,1637831223211900928,2023-03-20 14:59:27+00:00,historia que tu hiciste,Axwl_ll
886,1637831214299054083,2023-03-20 14:59:25+00:00,"“Fue un tremendo robo a los GURÚS, no había fuera de judgo en esa posición…”

OTra cámara mostró ASENCIO estaba en buena posición cuando Carvajal le pasó la pelota. 😜😜😜 https://t.co/C9YxkO502s",lurico915
887,1637830950389252096,2023-03-20 14:58:22+00:00,Lewandoski manda a volar a carvajal cuando dio el taco JAJAJAJA,jesu4na
888,1637830851399503873,2023-03-20 14:57:59+00:00,carvajal estaba peleando por su vida https://t.co/zZOxtecN7A,theIuckyten
