,Tweet Id,Datetime,Tweet,Username
335,1637953356176973825,2023-03-20 23:04:46+00:00,Que frío 🥶 https://t.co/Msvu1oVNcf,Leonardo_Lara21
336,1637953350745432064,2023-03-20 23:04:45+00:00,"Pues me volví lector de cómics
 
#freemanhwa #Japancomics #comicbooks

https://t.co/cZixk3K77b https://t.co/O59o6n9SoJ",lara03688723
337,1637953341094522881,2023-03-20 23:04:42+00:00,Y al que te toque click clackkkk,_Sollara_
338,1637953319590043649,2023-03-20 23:04:37+00:00,"la q me gusta no me contesta desde hace 15 minutos, de rindo, el amor no existe 😭",laritaaagw
339,1637953149431595009,2023-03-20 23:03:57+00:00,"David no justifiques lo injustificable. Si quieres a tu pareja por más que estés rodeado de chicas preciosas, si la quieres de verdad no la engañas. Coño, recordad a Hugo y Lara 🥺🥺#LaIslaDeLasTentaciones9",marionamp94
340,1637953121648353281,2023-03-20 23:03:50+00:00,"Que feo enterarme de todo ahora, más que tristeza es decepción, pero bueno uno nunca termina de conocer a las personas🙌",lara_luiselli
341,1637953112886353921,2023-03-20 23:03:48+00:00,"""Nunca imaginé jugar segunda, me dieron una propuesta que me gustó con un objetivo que es subir a Primera"" Agnel Flores. 
Vinotinto y que ha vestido camisetas como la del Monagas, La Guaira, Táchira, Atlético Venezuela y Lara. 
Hoy parte de @tfcguanare en la #LigaFutve2 https://t.co/TUaEVLrsBI",paodeportess
342,1637953069001457666,2023-03-20 23:03:38+00:00,que cacete,laralaroca_yzx
343,1637953062827606016,2023-03-20 23:03:36+00:00,"LARA LOGAN
 https://t.co/nXwVFexbVZ",Ga42Boy
344,1637953056280047618,2023-03-20 23:03:34+00:00,"Estoy tan tan feliz, y a la vez me da tanto miedo, pero Julio, no te hagas mucho de rogar porfi🥹🫶🏻",lara_GV14
345,1637953006971809792,2023-03-20 23:03:23+00:00,#Sucesos | Al menos 76 personas fueron detenidas en las últimas horas en Venezuela en varios operativos de seguridad efectuados por el CICPC #20Mar https://t.co/9P2t9IR0kT,laprensalara
346,1637953004895711237,2023-03-20 23:03:22+00:00,quisiera llorar lloviendo😭😭😭😭😭ahhreee4re,larabecerraa22
347,1637952937799434241,2023-03-20 23:03:06+00:00,gosto bue de ti 🫶🏻,monteirinho08
348,1637952778235527170,2023-03-20 23:02:28+00:00,De mis momentos más ezquizos el día de ayer eh,Emmanuel_lara23
349,1637952755607257089,2023-03-20 23:02:23+00:00,Al borde del suicido 😁😁,Laraibarraa_
350,1637952715623104517,2023-03-20 23:02:13+00:00,Comienzo la primavera comiendo corazón de champiñones 🍄🧡🥰🤟🏻 https://t.co/ZxU3VBjKQ5,LaraVF5
351,1637952696232865792,2023-03-20 23:02:09+00:00,Voceros de la institución Cnp..deben ser más reactivos..Colegio Nacional de Periodistas..no divagen más..Goyo desde Lara Luis Eduardo pepper con la lucha,peppervision
352,1637952695523835905,2023-03-20 23:02:08+00:00,Hoy #20Mar jornada de trabajo de partido @unt_iribarrenmu seguimos avanzando @partidoUNT @UNT_Lara_ https://t.co/H6LSYXx5TQ,unt_iribarrenmu
353,1637952695033012225,2023-03-20 23:02:08+00:00,Agustín Lara. https://t.co/n4HbBm8AXB,RamonBorbon4
354,1637952512283033600,2023-03-20 23:01:25+00:00,"Ayno, creo que si me chingue el tobillo. 🥺🥺🥺",mich_lt18
355,1637952500170096640,2023-03-20 23:01:22+00:00,"Irse a tiempo, es llegar temprano a otro lado ✨",LaraGirotti
356,1637952487054360576,2023-03-20 23:01:19+00:00,dos pruebas desaprobadas en un día:(,PilarLara02_
357,1637952480918007808,2023-03-20 23:01:17+00:00,"« Aquí te comparto Tres (3) Cursos y Ofertas de Empleo como Personal Trainers en los Estados Unidos, además de información y consejos útiles que te servirán para convertirte...
Origen » #BalanceSpa https://t.co/Yu79xMDS2H https://t.co/YZ5DzbewAQ",carloslara5
358,1637952424907243523,2023-03-20 23:01:04+00:00,Estoy releyendo un libro donde ella es una periodista que va a cubrir lo que sucede en los campos de concentración de Corea del Norte. Él y su mejor amigo son presos de eso horrible lugar. Por azares de la vida ellos logran salir pero ella no recuerda mucho lo sucedido debido,songcovey_
359,1637952214084861954,2023-03-20 23:00:14+00:00,Hay swifties que no se recuperaron del covid 😔✊,andy_lara23
360,1637952211673051136,2023-03-20 23:00:13+00:00,Fingir demencia y seguir como estilo de vida @romibiassoni @VillordoLuisina,LaraaaRobledo
361,1637952178387132417,2023-03-20 23:00:05+00:00,"La emoción de Lara Dibildos en el último adiós a Laura Valenzuela: Álvaro Muñoz Escassi, su gran apoyo https://t.co/7NmcaQB84A https://t.co/DjwP8l1YNs",bekiaes
362,1637952160708317185,2023-03-20 23:00:01+00:00,"Explora los temas más importantes del mundo preadolescente junto a ""Ask Lara"" en @NTVChile.

📡Sigue la señal en vivo ➡https://t.co/7KeInZJGcF

 📲Todas las noticias en el sitio oficial de #NTV➡ https://t.co/u8SDO7xqo2 https://t.co/XQ8oNEIgwS",NTVChile
363,1637952155339595776,2023-03-20 23:00:00+00:00,Señores esta es la pura verdad asi que hagamos uso de nuestra inteligencia politica y nuestra inteligencia emocional. Eh pal palacio que vamos si Dios quiere en 2024 con el @PLDenlinea y @AbelMartinezD la única esperanza del pueblo dominicano #SeVan https://t.co/sRHQq6gCnu,MarcelinoLara17
364,1637951952620249088,2023-03-20 22:59:11+00:00,Vos sos una payasa estás a puro dolor.,laritaa14402816
365,1637951912246132736,2023-03-20 22:59:02+00:00,AY ES HERMOSA,lar4mz
366,1637951834496069632,2023-03-20 22:58:43+00:00,yo digo q estoy mejor xq ahora aunque sea tengo la voluntad de reconocer las pequeñas cosas que me hacen bien y repetirlas diariamente para no volver a la misma mierda de siempre pero la verdad que eso que duele sigue estando ahí y dudo que en algún momento se vaya :/,LaraCarbajo
367,1637951830771617792,2023-03-20 22:58:42+00:00,Muero por un sándwich del pelado de tiktok,LariBattiston2
368,1637951801767985153,2023-03-20 22:58:35+00:00,esta humedad no me deja respirar!,daviifloress
369,1637951790938193920,2023-03-20 22:58:33+00:00,Venga México!,Armando_Lara_08
370,1637951778439278592,2023-03-20 22:58:30+00:00,"Si tan serio es GH y siempre buscó aclarar las cosas que pasaban en la casa con respecto al afuera,  hoy estaría buenísimo que paren un poco todo digan algo de lo que esta pasando con Corazza, que no se hagan los pelotudos.",Lararh95
371,1637951765864923137,2023-03-20 22:58:27+00:00,Triste porque mi bebé no se dejó ver la carita 🥺🥲,LaraBarrionue18
372,1637951664891244545,2023-03-20 22:58:03+00:00,Chatoooonmentalmente,DiegoPezoLara
373,1637951634348072960,2023-03-20 22:57:55+00:00,"El número uno de la sensualidad,del carisma y de la pasión tiene nombre y apellido y ese es mi @gregoriopernia amo todo de él,éste hombre es todo 🔥🔥🔥🔥🔥 😍❤️🥰 saludo desde #españa #Andalucía",soniaLM2
374,1637951580036104193,2023-03-20 22:57:43+00:00,"Me rindo, ya me di cuenta que no es conmigo. Cuídate y se feliz",jamilex_lara
375,1637951454404018176,2023-03-20 22:57:13+00:00,más de un cubata,Lara23710
376,1637951429628264448,2023-03-20 22:57:07+00:00,Mejor te ignoro a formarte un peo.,Valeria_Lia12
377,1637951392819052544,2023-03-20 22:56:58+00:00,Lara Jean vibes💕 https://t.co/lHlR8JOS1t,songcovey_
378,1637951111050010625,2023-03-20 22:55:51+00:00,En otras noticias que a nadie le importa...,alardillon
379,1637951087448555521,2023-03-20 22:55:45+00:00,así empezamos https://t.co/cAuQb9QDen,sonnylvs_
380,1637951083904376832,2023-03-20 22:55:44+00:00,Si #ElSalvador ahora lo conoce todo el mundo 😎🧢🇸🇻👇🏿,Mario_LaraH
381,1637951065655066624,2023-03-20 22:55:40+00:00,"Articulo de Lara Carrasco en Infolibre que incluye mi analisis y consideraciones sobre el exceso de mortalidad observado en España de 2020 a 2022  que coincide con los tres años de  pandemia de COVID 19
https://t.co/pCrFYU2OVf",lopezacunad
382,1637951063700516864,2023-03-20 22:55:39+00:00,"Hoy conmemoramos la importancia de la felicidad, cómo parte integral en el desarrollo y bienestar de todas las personas que conforman la gran familia de la #cruzroja.
⠀
#DíaInternacionalDeLaFelicidad
⠀ https://t.co/xU8SZbtndM",CruzRojaVeLara
383,1637950965532987393,2023-03-20 22:55:16+00:00,Pero pienso en tiiiii las 24hs,LaraIsaurralde
384,1637950904040144896,2023-03-20 22:55:01+00:00,Largo se me está haciendo marzo con una trasferencia pequeñita estoy ya,LaraIza20
385,1637950817410924549,2023-03-20 22:54:41+00:00,"Así de grave es la ignorancia en @AsambleaEcuador ... para que no te pase este tipo de pendejadas, contrata asesores que sepan leer y por lo menos usen/manejen/tengan @lexisecuador #JuicioPoliticoALasso",alardillon
386,1637950645872349185,2023-03-20 22:54:00+00:00,Rafael Caldera en La Sorbona: la democracia como manera de vivir https://t.co/F2ICBVDk3H Por @ramosflamerich,CorreodeLara
387,1637950565811462147,2023-03-20 22:53:41+00:00,"Los comunicadores social no podemos ser indiferentes ante ,en las diferentes plataformas,de la sobre dosis de corrupción... somos un país narco,en quiebra,sin educación formal y sin sentido humano en cuanto al respeto de la sociedad..desde Lara...lucha",peppervision
388,1637950507170816004,2023-03-20 22:53:27+00:00,q loco q siempre q está me dice q tiene mala espina con mis amistades pasa algo mmh,rephhf91
389,1637950401507983365,2023-03-20 22:53:02+00:00,"la ultima oportunidad que le doy al amor,deseenme suerte",LaraCaroseli
390,1637950348282273792,2023-03-20 22:52:49+00:00,Cómo me puede frustrar tanto...?,LaraMarc7
391,1637950284084269058,2023-03-20 22:52:34+00:00,"[20/3/23 18:36:04] Ca❤️: te amo
 [20/3/23 18:36:05] Ca❤️: sabes
Sin dudas es mi ❤️‍🩹",lara_agustina20
392,1637950242262773760,2023-03-20 22:52:24+00:00,El 🫀 apagado.,jamilex_lara
393,1637950205839519744,2023-03-20 22:52:15+00:00,El 19 de mayo tenemos una cita con mi amor programada hace dos meses,Lara33874505
394,1637950153624567808,2023-03-20 22:52:02+00:00,"Ahora mismo reunidos , los factores de Cojimar. Puntualizando detalles de la prueba dinámica. Todos con un solo propósito, garantizar unas elecciones bien organizadas. CIT Cojimar como Centro Padrino está presente.
#Elecciones2023 
#cubaelige https://t.co/vt1HHuhFeN",cesarla12883196
395,1637950085798547458,2023-03-20 22:51:46+00:00,"Uno de mis mayores miedos en la vida es llegar a la adultez siendo una imbécil de esta categoría y no darme cuenta, ni tener un entorno que me lo haga saber.
De paso tiro el unpopular opinión de que la gente que consume a yanina Latorre es igual de nefasta que ella",Laraislas_
396,1637950076780683264,2023-03-20 22:51:44+00:00,Me delata lo gorda que mi debilidad es la masita cruda de la pastafrola 🤤🤤,lararios_6
397,1637949861248090114,2023-03-20 22:50:53+00:00,"te amo lightiny ver. 1, te amo https://t.co/WGLhYtY1Yn",uknowsan
398,1637949777697554432,2023-03-20 22:50:33+00:00,Y por que No toman la denuncia? Cual es el problema? https://t.co/LMS09J2Dwu,MarcelinoLara17
399,1637949679269736448,2023-03-20 22:50:09+00:00,"Como escribió Dominique Lapierre, arde París",laraa_zhivago
400,1637949665365598208,2023-03-20 22:50:06+00:00,Frio miseravi,FlapLara1
401,1637949596528721920,2023-03-20 22:49:50+00:00,"Por favor.
No otra vez.",Lara99Mila
402,1637949551809052673,2023-03-20 22:49:39+00:00,"No cabe duda que hasta para esos son PENDEJOS los Troll y los BOTS me la Pérez Prado con música de Agustín Lara dile a tus patrones que no sean codos que te den para un buen Oftalmólogo checa Domingo 18 de Marzo Zócalo Camitalino,@FERMNESTEVEZ3,@Ovima77 te vas a morir de HAMBRE",Macruz76701932
403,1637949447496769539,2023-03-20 22:49:14+00:00,Se acabó ya todo.,jamilex_lara
404,1637949364483289088,2023-03-20 22:48:54+00:00,"La ilusión nos engaña, acariciándonos.
- José Narosky https://t.co/ESHMB4rlbW",l4r4_15
405,1637949320467972096,2023-03-20 22:48:44+00:00,Soy la Nana de la casa en mi descanso ja,DiegoPezoLara
406,1637949276239302656,2023-03-20 22:48:33+00:00,"Posiblemente este software fue uno de los mejores regalos que me han hecho, Thx Sayuri si vez esto &lt;3 https://t.co/B67xjDAbiQ",hiimnotlara
407,1637949271445233664,2023-03-20 22:48:32+00:00,"yo en mi momento más esquizofrénico del día:
-oye izan, cuanto tiempo llevas siendo primo de rebeca?",larabenmenn
408,1637949247231258631,2023-03-20 22:48:26+00:00,prr que menina chata,littlejudejohn
409,1637949170668511235,2023-03-20 22:48:08+00:00,"Que ni se le ocurra hablarme, porque estoy mas que bien sin el",Lara_zapata4
410,1637949102309638145,2023-03-20 22:47:52+00:00,Cooooñoooo pero así cualquiera Cuarto Bate. Maña fuera dicen en mi campo! Come callao Mijo y No deje ver refajo. Por eso es que dice que multitud de Fiscalía era pagada. Es que sabe mucho de eso. El ladrón juzga por su condición. A el hay que pagarle y mucho! https://t.co/IJH5Mfvp2Q,MarcelinoLara17
411,1637949076414033920,2023-03-20 22:47:46+00:00,"#20Mar | Diosdado Cabello: ""Ser corrupto no es ser revolucionario, no es revolucionario quien se ponga una camisa roja y esté robando (...) estamos actuando contra esas excepciones"" https://t.co/MYzYkrMLrF",laprensalara
412,1637948804010852355,2023-03-20 22:46:41+00:00,"me encantan ambos siendo sincera
I vote #LeftandRight for #BestMusicVideo at the #iHeartAwards",jeoniista
413,1637948776135401473,2023-03-20 22:46:34+00:00,por dios parecen hermanos,eugebIack3
414,1637948735047999488,2023-03-20 22:46:24+00:00,La #FANB es determinantes para la construcción de una sociedad cada vez más justa y por ellos ustedes deben seguir consolidando el nuevo pensamiento militar Bolivariano https://t.co/CMOSpziWsH,PtoLara
415,1637948724927184897,2023-03-20 22:46:22+00:00,Lara es la mejor🥹😂 https://t.co/cIeBN8OERY,VernicaGimnezA1
416,1637948722717011969,2023-03-20 22:46:21+00:00,"¡No olvides sonreir hoy y todos los días!
Recuerda que tu sonrisa puede cambiar la vida de otra persona. 😄 😊😃🙂🙃😁
#internationaldayofhappiness #internationaldayofhappiness2023 https://t.co/TFbH6s5N7C",LaraMedia
417,1637948553791254530,2023-03-20 22:45:41+00:00,quiero amigos para ir a mac después del colegio,laraszmigielski
418,1637948494555013123,2023-03-20 22:45:27+00:00,#LaIslaDeLasTentaciones9 igual de TEATRERA que su madre.. https://t.co/XrjbIiU9ud,LaraRoci0
419,1637948492403425283,2023-03-20 22:45:26+00:00,primer día y ya se hablo de la tesis😀,HamptonLars1
420,1637948435356581888,2023-03-20 22:45:13+00:00,Cámara de industriales del estado Lara: La capacidad de la industria venezolana durante el último trimestre del año 2022 fue de 39.9% #20Mar - https://t.co/VNKDD9cLsD,elimpulsocom
421,1637948330008272896,2023-03-20 22:44:48+00:00,Esos 5 minutos an sido los mejores de mi vida ❤️‍🩹,HectorVizcain16
422,1637948249691549696,2023-03-20 22:44:28+00:00,"yo: tranquila todo es temporal y tiene solución 🧘☄️🚬
yo hoy: si tengo otro ataque de ansiedad así esta semana me mato😼",hescpriority
423,1637948227763699713,2023-03-20 22:44:23+00:00,"#Nacionales | La operatividad del sector industrial privado de Venezuela, conformado por unas 2.000 compañías, creció 12,9 puntos en el cuarto trimestre del año pasado #20Mar https://t.co/OQyU7UU0Mb",laprensalara
424,1637948226404855808,2023-03-20 22:44:23+00:00,Las caras juan las caras #LaIslaDeLasTentaciones9,Pr99Lara
425,1637948149296766981,2023-03-20 22:44:05+00:00,ya oscurece temprano se acerca las dos estaciones mas deprimentes del año,JuliLara_
426,1637948096087826434,2023-03-20 22:43:52+00:00,"siempre b, siempre ves estés donde estés",laraproroblox74
427,1637947902122246144,2023-03-20 22:43:06+00:00,"Le preguntó qué come cuando viaja...
No sé las otras preguntas y tampoco sus respuestas, pero qué tanto esperaba q se explayara ¿?",OnlyIDKIDC
428,1637947870279073792,2023-03-20 22:42:58+00:00,"Me vino hoy y rindo toda la semana jaja 
Voy a llorar como una verdadera puta 🤙🥵",Lara__Lpz
429,1637947832115011594,2023-03-20 22:42:49+00:00,Ganitas del sábado,Laraaraujoo2
430,1637947756479143938,2023-03-20 22:42:31+00:00,❤️🤩 Feliz día de la Poesía,laralopezrne
431,1637947583925727232,2023-03-20 22:41:50+00:00,Esta era yo hace 7 años y aún siento igual cuando oigo esos “benditos tambores” https://t.co/ekSKz51Unr,ChariLaraGine
432,1637947567056076802,2023-03-20 22:41:46+00:00,"Les invito a tod@s mis seguidores a escuchar DOMINICANISIMA RADIO! 👇 Ahora con merengues clasicos! https://t.co/cdfd0uwiRi

#musica #Dominicana
#clasicos
@Armando_vargas",TomasLara
433,1637947533367312386,2023-03-20 22:41:38+00:00,wao yo,mingibiscus
434,1637947357659627525,2023-03-20 22:40:56+00:00,Estoy re metida en hacer la mía ojalá eso salga bien🍀,Lara06368513
435,1637947211613888513,2023-03-20 22:40:21+00:00,Fuertísimo me estás manifestando hoy 🫠,laraliestevez
436,1637947105674248192,2023-03-20 22:39:56+00:00,"Que buen puente, si hacía falta",yael_larac
437,1637947101496614912,2023-03-20 22:39:55+00:00,Me suena,JoseAlbertoRad2
438,1637947075554836483,2023-03-20 22:39:49+00:00,"Mi vida desde que el se fue es colegio, dormir , no comer y colegio devuelta 💆🏻‍♀️",lara_chcheman
439,1637947062166732806,2023-03-20 22:39:45+00:00,Lloro me duele mucho el dedo,LaraMarcangel0
440,1637947007292588032,2023-03-20 22:39:32+00:00,"Matutino Especial en el CDI PALMARES por el día Mundial de la Salud Bucodental
@cubacooperaven 
@medica_lara https://t.co/EqTmVmeAV3",manuelerik506
441,1637947002565677057,2023-03-20 22:39:31+00:00,"Literalmente me siento tan decepcionada y se que está mal pero wey que muera mi pc Justo ahora, después de tanto esfuerzo. Aveces no entiendo las cosas de la vida.",LaraYamilete
442,1637946849884610561,2023-03-20 22:38:55+00:00,¿Qué tal se mira mi pescado empapelado? https://t.co/2UbTJ6mRoG,LaraMexico3
443,1637946761258909697,2023-03-20 22:38:34+00:00,Que ganas de comer un tiramisu fua,Lara__Lpz
444,1637946747182804992,2023-03-20 22:38:30+00:00,"Ahí estaré, hablemos o no, esa fue la promesa",ConstenlaLara
445,1637946701783678980,2023-03-20 22:38:19+00:00,jsksj ojalá todas las que conocieron a shawn pierdan la memoria y no se acuerden nunca de este momento hablo desde la envidia total,holdonlara
446,1637946586998407168,2023-03-20 22:37:52+00:00,Ahora súper muerta 😢,lausodark
447,1637946575543574534,2023-03-20 22:37:49+00:00,Me voy a matar,mingibiscus
448,1637946485227569154,2023-03-20 22:37:28+00:00,"Cuidado que los de niñes, todes y chiques no se sienten hembra ni macho así que no ofendamos a la fauna",ansy1997
449,1637946422766063617,2023-03-20 22:37:13+00:00,"Mi devolución sobre la heladería nueva de diag 73 “giulietta”
Atención: excelente 100/10
Helado muy rico, pero para paladar fino 8/10
Relación precio calidad: muy caro 😞 7/10",Laraislas_
450,1637946361630056448,2023-03-20 22:36:58+00:00,"Hacemos un llamado al estado venezolano, @NicolasMaduro @TarekWiliamSaab @mpsala1 @MinpublicoVEN si tenemos una ley para las personas de la 3era edad, no puede ser solo por tenerla, importante es hacer cumplirla! #URGENTE #PDVSA",ocandochavista
451,1637946327848964096,2023-03-20 22:36:50+00:00,Que hermosa es Cali Lara🤰🏻,marianespinos18
452,1637946286363082753,2023-03-20 22:36:40+00:00,agh veo algo más criticando a Taylor por lo más mínimo y cometo asesinato,htsevermore
453,1637946246676578304,2023-03-20 22:36:31+00:00,Pana es tan fácil juzgar sin conocer las razones.,CesarfrancoLa
454,1637946196667904005,2023-03-20 22:36:19+00:00,"Se me fue la infancia con don Alipio Vera y el guatón Ravani, Tellier sigue vivo, hasta cuando",pancholaraxd
455,1637946168171716608,2023-03-20 22:36:12+00:00,Ya casi empieza el encuentro entre #México🇲🇽 contra Japón 🇯🇵 en el #WorldBaseballClassic!!!!,CarlosLaraM81
456,1637946094503202817,2023-03-20 22:35:55+00:00,q gracioso q lara estudie aca pq le puedo mandar q estoy enfrente suyo AHRE,arminfachero
457,1637946073996992516,2023-03-20 22:35:50+00:00,mi tía hizo un grupo para tirarle huevos a mi prima q cumple 15 y hay 30 personas😐,lara_casas10
458,1637946050542444546,2023-03-20 22:35:44+00:00,Cuando suben las notas al aula virtual #LaIslaDeLasTentaciones9 https://t.co/HvG2ExwViu,Pr99Lara
459,1637946050299174912,2023-03-20 22:35:44+00:00,"1.860 familias beneficiadas por limpieza de quebrada en Jacinto Lara #20Mar https://t.co/394ceWbMop March 20, 2023 at 05:59PM #NoticiasLara",Ginamar121
460,1637945889879670784,2023-03-20 22:35:06+00:00,Y hace falta que te diga que me muero por tener algo contigo🎶🎶,M4pach31
461,1637945868929171459,2023-03-20 22:35:01+00:00,"que bronca me da cuando opinan de mí vida,nadie te pregunto loco no rompas las pelotas,no es problema tuyo lo que haga o no hagaaa",laraaaasofiaaaa
462,1637945856916684803,2023-03-20 22:34:58+00:00,Mi madre me regala helado de frutilla y menta podrán ? 🤣🤣,Larablfv
463,1637945749924110337,2023-03-20 22:34:32+00:00,Baek te extraño 😭😭😭😭😭,mingibiscus
464,1637945689425555456,2023-03-20 22:34:18+00:00,ojalá fueras mi “idiota”,im__kimlara
465,1637945682454618119,2023-03-20 22:34:16+00:00,hashtag enamorado,LaraOliveraC
466,1637945651559268352,2023-03-20 22:34:09+00:00,"tal cual, se han convertido de los mejores 💙",darkofsouls
467,1637945611977621505,2023-03-20 22:34:00+00:00,BASTA QUÉ- https://t.co/NMQnASqLu9,mingibiscus
468,1637945569858531330,2023-03-20 22:33:50+00:00,soñé que comía un pan dulce con un montón de frutas. El paraíso realmente,daviifloress
469,1637945566071070721,2023-03-20 22:33:49+00:00,Un amigo compro por 8 findes seguidos mesas en jet 🛐 cuidada por la producción,LaraPando_
470,1637945493836709888,2023-03-20 22:33:31+00:00,Si te dicen que yo me estoy curando es la verdad 🎶,1230_valentain
471,1637945487172026370,2023-03-20 22:33:30+00:00,"pero, que verguenza",htsevermore
472,1637945432507596801,2023-03-20 22:33:17+00:00,"Decirle a tu pareja cuando estás inseguro y cómo se manifiesta en la relación crea intimidad emocional. Si estás acostumbrado a ser indirecto o pasivo-agresivo, al principio te dará miedo. Dale a tu pareja la oportunidad de conocer el (verdadero) tú.",840Lara
473,1637945352132124675,2023-03-20 22:32:58+00:00,Q YA SAQUEN EL SIGUIENTE INTEGRANTE DEL QSMP ME ESTOY CAGANDO DE NERVIOS ALFKAXJ 😭,lalaquacks
474,1637945302471647232,2023-03-20 22:32:46+00:00,Más claro Ni EL agua parece una escena de la película del famoso narco mejicano que financio campaña de Peña Nieto Un #PandoraPapers persiguiendo a opositores políticos en El Cartel de los Sapos!  https://t.co/bTui8ctRrR,MarcelinoLara17
475,1637945266568593409,2023-03-20 22:32:37+00:00,"Ambiente de desilusión en la ciudadanía que votó en 2019 por un cambio en la Justicia y en la Fiscalía.
El mensaje es malo para la República y la Democracia. Veremos como sigue.
Pero da una preocupante sensación de donde reside el verdadero poder.",Alfredolara29
476,1637945263452213248,2023-03-20 22:32:37+00:00,llegue ayer a las 12 y m acabo d despertar no entiendo nada,lsss1_
477,1637945210893389830,2023-03-20 22:32:24+00:00,"Y si, hacer ejercicio si funciona para la ansiedad …",MoreneaLara
478,1637945201221091328,2023-03-20 22:32:22+00:00,Equipo del SDEFGGPP https://t.co/4FOi4z5G5N,SDEFGGPP_Lara
479,1637945182518755328,2023-03-20 22:32:17+00:00,Que pedo con el estacionamiento de la caseta Tlalpan?? https://t.co/AF9p30uH1I,SalatielDL
480,1637945160674754560,2023-03-20 22:32:12+00:00,Apartamento en venta La Piedad Cabudare 23-25205 RM 04145148282 en Cabudare/Lara/Venezuela en Venta https://t.co/vXMrzQR7F1,inmueblesrah
481,1637945157340508160,2023-03-20 22:32:11+00:00,Derecha ( todos preto),lara_gattaa
482,1637945109097627648,2023-03-20 22:32:00+00:00,"#Lara| Los funcionarios de la oficina regional Carora se mantienen desplegados en las diferentes paradas de transporte del municipio Torres, con el fin de supervisar el cobro de las tarifas autorizas del pasaje
-
#INTT21AñosContigo #20Mar #JuntosContraLasMafias https://t.co/251ekUqEAJ",oficial_intt
483,1637945093863936001,2023-03-20 22:31:56+00:00,LSXJLAJSKAJAJJA ESTE ES BUENÍSIMO,lalaquacks
484,1637945085743513603,2023-03-20 22:31:54+00:00,"Jajajajaja parce se perdió todo el respeto, solo por decir que me gusta el frío jajaja https://t.co/J9Tx0KeXtN",MoreneaLara
485,1637944964280614913,2023-03-20 22:31:25+00:00,Gracias por amenizarme el viaje Lara 🖤 https://t.co/Lr0fwVgQ8W,consolegas
486,1637944963949379587,2023-03-20 22:31:25+00:00,"A este video lo llamaremos La venganza de Dani 
Te llevastes a mi hermana, hoy te quedas sin pulmón 🤣 🤣 🤣 🤣",EthelLa51822513
487,1637944892461662208,2023-03-20 22:31:08+00:00,"Me habló uno para que le muestre los mates que vendo, le respondí que hay mucha variedad, y me tira : ""Y ALGUNO QUE TE GUSTE COMO PARA CUANDO VENGAS A TOMAR"" 
Nunca me hablé, ni lo conozco 🤣 https://t.co/UDOiep98Ek",_LaraGonzalezz
488,1637944722126692353,2023-03-20 22:30:27+00:00,"También os puede pasar como a mi, que dejé de comerlo sin querer y en mi viaje a Italia viví pegada al WC porque mi cuerpo se desacostumbró a digerirlo. 

Unos macarrones con tomatico a la semana y arreglado.",LaraSmirnova_
489,1637944649913335808,2023-03-20 22:30:10+00:00,No estoy preparada psicologicamente para fumarme mañana a las ingresantes de la carrera,ConradLara00
490,1637944609601880065,2023-03-20 22:30:01+00:00,#20Mar | #Lara | El Sindicato Automotor del estado Lara hizo este miércoles una asamblea para debatir sobre varias problemáticas que enfrenta el sector transporte en la entidad. https://t.co/EMmBLJuaDq,nta_vzla
491,1637944595303596032,2023-03-20 22:29:57+00:00,"Vergüenza nacional.
Los que tienen el deber de acusar en nombre del Estado, o sea en nombre de todos los uruguayos, no tienen interés en investigar a los dirigentes de izquierda y sus gobiernos. 
El sistema político apesta.
Y mucha gente continúa desilusionándose.",Alfredolara29
