,Tweet Id,Datetime,Tweet,Username
815,1637411616160456706,2023-03-19 11:12:05+00:00,El Tigres Monterrey lo único que tiene de clásico es el under 1.5,fer_mora25
816,1637411026395078656,2023-03-19 11:09:44+00:00,El Clásico del que todos hablarán es el #Guadalajara vs. #América luego de que #Monterrey tuvo una ajustada victoria sobre #Tigres. https://t.co/RKY7IwB4sf,reformacancha
817,1637410826377101312,2023-03-19 11:08:57+00:00,El Clásico del que todos hablarán es el #Guadalajara vs. #América luego de que #Monterrey tuvo una ajustada victoria sobre #Tigres. https://t.co/5wfvlV4A6w,canchamural
818,1637410702502526976,2023-03-19 11:08:27+00:00,"Las PANTHER de @Pitt_MBB de nuestros #TIGRES Guillermo y Jorge Díaz Graham juegan hoy 🆚 Xavier en el encuentro de segunda ronda del March Madness 🏆🏀

Mucha suerte 🍀 chicos 🙌🏼 😉 

#MarchMadness    #NCAA #LetsGOPanthers #FamiliaTigre #MásTigresquenunca 🐯

📸 @Pitt_MBB https://t.co/CUMCIni5aU",csd_basket
819,1637410479722098688,2023-03-19 11:07:34+00:00,La Puerta Negra Los Tigres del Norte                     Now playing El Piporro El Taconazo by !,EvinNado
820,1637409677423124482,2023-03-19 11:04:23+00:00,La Puerta Negra Los Tigres del Norte                     Now playing Frontera No Se Va by !,EvinNado
821,1637408608655745027,2023-03-19 11:00:08+00:00,La Puerta Negra Los Tigres del Norte                     Now playing Juan Gabriel El Noa-Noa by !,EvinNado
822,1637408005233819649,2023-03-19 10:57:44+00:00,La Puerta Negra Los Tigres del Norte                     Now playing Vaqueros del Norte Mataron a la Paloma by !,EvinNado
823,1637406627291713536,2023-03-19 10:52:16+00:00,"We perdí en mía predicciones 
De ayer chivas y tigres
Espero hoy remediar mi mufa 
Vamos Madrid y Pio FC",Arturo1308JR
824,1637405638845251584,2023-03-19 10:48:20+00:00,"#Video ¡LOS RAYADOS SE QUEDARON CON EL CLÁSICO! Por el golazo de Luis Romo, Monterrey venció 1-0 a Tigres por la fecha 12 y lidera con 8 puntos de ventaja en la #LigaMX.  https://t.co/2sNy8kdUVp",SC_ESPN
825,1637404158373314561,2023-03-19 10:42:27+00:00,La Puerta Negra Los Tigres del Norte                     Now playing Invasores de Nuevo Leon Es Demasiado Tarde by !,EvinNado
826,1637403680843464708,2023-03-19 10:40:33+00:00,"Las pendejadas que le escribían los aficionados esos a los que les molestaba que Tuca hiciera campeón a Tigres...le pedían al puñetas de su ""patroncito"" que lo corriera",Bel_Es
827,1637401524023222272,2023-03-19 10:31:59+00:00,"Lista la Avenida de Los Tigres, hermosa y luciendo los colores rojo, azul y blanco, espera el inicio de la 62 Serie Nacional de Béisbol. #LatirAvileño #CiegodeÁvila #YoVotoXTodos https://t.co/2wcWXYQdTj",Yuri08345688
828,1637400462323331075,2023-03-19 10:27:46+00:00,Se quieren matar entre los tigres,elfifas2003
829,1637400151542169600,2023-03-19 10:26:32+00:00,"Monterrey ganó por la minima en el Clásico Regio.

Los Rayados del Monterrey se llevo la victoria por 0-1 a los Tigres UANL en la Jornada 12 del Torneo Clausura 2023 de Liga MX desde el Estadio Universitario. https://t.co/XHa93TqfsO",ZonaDeportesMX4
830,1637399061463461888,2023-03-19 10:22:12+00:00,"perdieron los tigres, pero estuve toda la noche hasta las 3 con mi novia. la vida es buena 🚬🚬🚬🚬",GuzmanCarlos666
831,1637398194115018752,2023-03-19 10:18:45+00:00,Me gustan los tigres.,ccoo_mcn
832,1637396686011240449,2023-03-19 10:12:45+00:00,perdio Chivas perdio Tigres u..u,Vic_Zazux
833,1637396043510829056,2023-03-19 10:10:12+00:00,Rayados de Monterrey vence al Club Tigres en la edición 129 del Clásico Regio vía @sdpnoticias https://t.co/6IUAanMwEP,csiller0724
834,1637388441099927554,2023-03-19 09:40:00+00:00,"El equipo venezolano ha conquistado con su juego a los fanáticos que, al igual que el combinado, apuestan por llegar por primera vez la final del Clásico, liderados por el toletero de los Tigres de Detroit Miguel Cabrera #19Mar https://t.co/2tvZwrMi6O",Analitica
835,1637387592948752384,2023-03-19 09:36:38+00:00,Monterrey vence a Tigres y se confirma como líder del Clausura 2023 https://t.co/cr3HQQ5tJN,RadioAnimeTzl
836,1637386450877464576,2023-03-19 09:32:05+00:00,La Puerta Negra Los Tigres del Norte                     Now playing Mier Te Amo by !,EvinNado
837,1637385399235428354,2023-03-19 09:27:54+00:00,"Si si y si, si funo a Salma por la derrota de mis tigres 😪",GiovaniReta
838,1637383676114661378,2023-03-19 09:21:04+00:00,"Señora SAS, Palenque, México - Trump - Drones, USA, Mike Pompeo - vacaciones todo incluido, Rayados, Tigres - Alexa Moreno - The Cure, Ticketmaster - seguridad - San Nicolás - Juárez - Corea del Sur - Colosio - IEEPCNL, UANLeer #eitmedia #eitnoticias #noticias #titulares https://t.co/TfYWHmkwrp",eitmediaglobal
839,1637383550482669569,2023-03-19 09:20:34+00:00,lo quiero para mis tigres,BrandonOlgun1
840,1637383006577913857,2023-03-19 09:18:24+00:00,"Dice la Peña Sierras de Paz que en caso que Cesar Zamora no acepte ir a Colombia debe pedirsele que vaya a Moscu y Kiev para buscar la Paz. Para darle color y alegria a la mision don  Cesar debia llevar al conjunto musical   "" Los Tigres del Ritmo,""",leondeacoyapa
841,1637381840964132864,2023-03-19 09:13:46+00:00,Tigres no es para cobardes😬🇸🇪,jairsalasss
842,1637380880472612869,2023-03-19 09:09:57+00:00,"⚽️ Rayados de Monterrey venció 0-1 a Tigres de la UANL, en el clásico del norte del país, y se confirmaron como líderes del Clausura 2023 del futbol mexicano 🥅🇲🇽 https://t.co/mmUbUaq6VI",Alerta__QRoo
843,1637380798557954048,2023-03-19 09:09:38+00:00,"⚽️ Rayados de Monterrey venció 0-1 a Tigres de la UANL, en el clásico del norte del país, y se confirmaron como líderes del Clausura 2023 del futbol mexicano 🥅🇲🇽 https://t.co/HS86jdWoAV",Infocancun_
844,1637379559673716736,2023-03-19 09:04:42+00:00,Con mis tigres siempre! https://t.co/Z1L8RTpdQT,LuyssRoberto
845,1637378747115421697,2023-03-19 09:01:28+00:00,Perdieron mis tigres y los warriors 🤧,OsvaldoRobles9
846,1637378388242358272,2023-03-19 09:00:03+00:00,habra perdido tigres pero el city gano 6-0,L3ou12
847,1637378379283562496,2023-03-19 09:00:01+00:00,#PorSiTeLoPerdiste | Tigres Sub 20 y Sub 18 derrotaron a Rayados en el #ClásicoRegio. Acá te contamos. ➡ https://t.co/JuRhTBOfWH https://t.co/0W0ZFcZImU,oncediariomx
848,1637378130598846464,2023-03-19 08:59:02+00:00,Perdieron mis tigres,Fernand1234456
849,1637374600140169216,2023-03-19 08:45:00+00:00,"A la finalización del partido de cuartos de final masculino, con victoria de Tigres Miguel Catalán por 57-63, hablamos con los MVPs Santalucia, Nuño Ruiz y Miguel Rebolledo.

https://t.co/KxxIvpAmlX https://t.co/DX9SHMGaxw",CopaColegialZGZ
850,1637374184086020098,2023-03-19 08:43:21+00:00,Esto es tigres,icarus454
851,1637372626355261440,2023-03-19 08:37:09+00:00,"Jajajaja!! Perdieron tus tigres en la cancha más pasional?? Pi che clásico regiomontano más aburrido, en el clásico nacional hubo 6 goles, ya ves como si es mejor el de América vs chivas!! Eres un hocicon!! Jajajaja y más jajaja!!",Sr_chikito29
852,1637372015064563714,2023-03-19 08:34:43+00:00,deveras q verguenza ser de tigres,patriciotamez_
853,1637371988829261825,2023-03-19 08:34:37+00:00,Esto NO es Tigres!!!,Bel_Es
854,1637371855286816773,2023-03-19 08:34:05+00:00,Mis Tigres no se merecen que yo tenga una cobija como ésta 👇😭 https://t.co/aAB4QJRofk,Gueryyah
855,1637371027666681856,2023-03-19 08:30:48+00:00,En Donde Esta En Donde Esta Esa Pinche Limochima Que nos Iba A Ganar jajaja @Rayados #ClasicoRegio129 #Rayados #EnLaVidaYEnLaCancha Ganes o Pierdas #ArribaElMonterrey si señor El Clásico Se Lo Queda La Pandilla del MTY con Marcador de 0-1 En Casa de Los Tigres,pablodanielrdzv
856,1637370242417455105,2023-03-19 08:27:41+00:00,En Donde Esta En Donde Esta Esa Pinche Limochima Que nos Iba A Ganar jajaja @Rayados #ClasicoRegio129 #Rayados #EnLaVidaYEnLaCancha Ganes o Pierdas #ArribaElMonterrey si señor El Clásico Se Lo Queda La Pandilla del MTY con Marcador de 0-1 En Casa de Los Tigres,PabloDa51250561
857,1637369751356813313,2023-03-19 08:25:44+00:00,La Puerta Negra Los Tigres del Norte                     Now playing Raymix ¿Dónde Estarás? by !,EvinNado
858,1637369476684595201,2023-03-19 08:24:38+00:00,ACANO DE LLEGAR DE UN CONCIERTO DE LOS TIGRES DEL NORTE AHUEVOOOOOO https://t.co/7s0Widk9Ha,two_sxnshine
859,1637368665350782976,2023-03-19 08:21:25+00:00,"q fife me veo pero tigres, chivas y pumas 😭😭",haericita
860,1637368504469839872,2023-03-19 08:20:46+00:00,"No jugaron a nada!!

Estás destruyendo a Tigres desde adentro con tus decisiones",Bel_Es
861,1637368364656893953,2023-03-19 08:20:13+00:00,Cada vez que estoy triste veo el resumen de la remontada de magallanes a tigres que juego tan bello dios mio la energía que me da,eliaaaaaaanny
862,1637366318243405827,2023-03-19 08:12:05+00:00,Yo cuando vea a mis amigos tigres,waafer505
863,1637365171067789313,2023-03-19 08:07:32+00:00,A por cierto chingensumadre los tigres que rentaron abono a rayados,RamiroTamez123
864,1637363744089993216,2023-03-19 08:01:51+00:00,"A ver! Aaaaaaa veeeerrr! Las cosas como son! 

Nuevo León sigue siendo Tigre! Y eso desde 1978! Cuando Tigres ganó la primer liga!

Y se refrendó el 10-12-17! Le duela a quien le duela! 

😎😎😎😎😎",Tigreforsiempre
865,1637363544122327043,2023-03-19 08:01:04+00:00,"El super flamante refuerzo de Tigres Gorriaran en su 1er clásico se le congelo el pecho y salió lesionado 🤣🤣🤣

Me acuerdo cuando los incompuñetas se estaban burlando de los fichajes baratos de Rayados y resulta que han salido mejor que sus súper refuerzos bombas 🤣🤣🤣",Alan10158700
866,1637363225019777025,2023-03-19 07:59:48+00:00,"De todos los mexicanos que tiene Tigres no se hace uno:

- COLDOVA 🥶
- Lainez alias el 007 🤡
- Loroña sigue en el equipo???
- Angulo de ser de los mejores centrales de la liga a ser lateral izquierdo 🤦
- Reyes 💀
- Aquino ya está viejo

Y querían ser la base de la selección🤡",Alan10158700
867,1637363209748217856,2023-03-19 07:59:44+00:00,La Puerta Negra Los Tigres del Norte                     Now playing Player's La Enorme Distancia by !,EvinNado
868,1637362445588082689,2023-03-19 07:56:42+00:00,"no me hablen banda, perdieron mis tigres",EnriqueRiveeraa
869,1637362083900669952,2023-03-19 07:55:16+00:00,"Los Tigres avanzaron y lograron sobreponerse al Orlando City en el duelo de felinos, importante resultado de cara al CLÁSICO REGIO, Tigres cumplió su cometido y se enfrentará al sorpresivo Motagua en 4tos de final. #Tigres #UANL #orlandocity #concachampions #ligamx #motagua https://t.co/ko95XkMuIV",FutandChill1
870,1637361428746174465,2023-03-19 07:52:39+00:00,En Donde Esta En Donde Esta Esa Pinche Limochima Que nos Iba A Ganar jajaja @Rayados #ClasicoRegio129 #Rayados #EnLaVidaYEnLaCancha Ganes o Pierdas #ArribaElMonterrey si señor El Clásico Se Lo Queda La Pandilla del MTY con Marcador de 0-1 En Casa de Los Tigres,pablito0322
871,1637361062017114112,2023-03-19 07:51:12+00:00,Vamos lo Tigres de México 🐯🇲🇽,tonersss
872,1637360803215974400,2023-03-19 07:50:10+00:00,La Puerta Negra Los Tigres del Norte                     Now playing Ramon Ayala Mi Piquito de Oro by !,EvinNado
873,1637360789752279040,2023-03-19 07:50:07+00:00,Háganme reír que tigres ya me esta haciendo llorar.😞,AldoRobledo5
874,1637360048417431552,2023-03-19 07:47:10+00:00,MeridianoTV: LVBP: Tiburones de La Guaira se hacen con Anthony Santander en cambio con Tigres de Aragua https://t.co/G7FBXnh0PY,jjmontoya79
875,1637359140749148171,2023-03-19 07:43:34+00:00,“nos la pelaron los tigres” tú jugaste o q we?,fatiiigzz
876,1637358864348717058,2023-03-19 07:42:28+00:00,"Feliz día al padre que casi me arroja a los tigres de bengala cuando tenía cinco o seis años.
¡Felicidades papá! ¡Te quiero!
#DiaDelPadre https://t.co/gGd6TBVJXw",FaeHmola
877,1637358361980149761,2023-03-19 07:40:28+00:00,"Haces más de 10 años, que los favoritos para campeones son:

Rayados
América
Tigres

No sé hasta cuando seguirá así, tal vez unos 15 más...",TORRESrobe
878,1637358331852406784,2023-03-19 07:40:21+00:00,Perdió tigres perdió mi familia,Demian08360012
879,1637357177097560064,2023-03-19 07:35:46+00:00,Jajajaaj se nota que rayados lleno el estadio de tigres,nathan_suaarez
880,1637357132164083712,2023-03-19 07:35:35+00:00,La Puerta Negra Los Tigres del Norte                     Now playing Intocable  Y Todo Para Que by !,EvinNado
881,1637356340816257026,2023-03-19 07:32:26+00:00,Quien para ir a ver los tigres del norte mañanaV,AngelBarderos
882,1637356230699106304,2023-03-19 07:32:00+00:00,La Puerta Negra Los Tigres del Norte                     Now playing Cadetes de Linares  Pueblito by !,EvinNado
883,1637356062801113090,2023-03-19 07:31:20+00:00,"Vámonos c/calma pero al amanecer del domingo 19/03/2023 @clubleonfc tiene 2 partidos menos que América, Toluca, Tigres y Chivas, por lo que está en sus , o mejor dicho en sus garras, rebasarlos. Deseamos los de 💚que esto nos dé hasta para la segunda posición del #Clausura2023 !",leon_rgl
884,1637355646059266048,2023-03-19 07:29:41+00:00,"#SomosCornerMX

Rayados gana el clásico

Emocionante partido el que se vivió esta noche en el estadio universitario, con un increíble disparo de Romo (68’) Rayados vence 1-0 a Tigres en un cerrado encuentro.

Via:@juanpablo_floresarroyo https://t.co/WZlR6X2EFZ",CornerMX1
885,1637355406140882950,2023-03-19 07:28:44+00:00,La Puerta Negra Los Tigres del Norte                     Now playing Super Lamas  No Voy A Trabajar by !,EvinNado
886,1637355182060105729,2023-03-19 07:27:50+00:00,FELICITEN A MI BFI QUE CUMPLE AÑOS HOY‼️,TigresAlReves
887,1637354608174481408,2023-03-19 07:25:33+00:00,Ayer cayeron los clubes más habladores jajajajajajajaja chivas y tigres.,luissgo12
888,1637354212093751296,2023-03-19 07:23:59+00:00,"Tohru/tigres💛

no  la  pude  terminar  a  tiempo  jsjsj,
espero  les  guste👌🏼❤️
#Tigres #LigaMX #tohru https://t.co/I9SbazJJ5L",fer_draw7
889,1637353593215897605,2023-03-19 07:21:31+00:00,"Que se bajen del barco los que se tengan que bajar, CON TIGRES ES SIEMPRE PASE LO QUE PASE",32humberto0
890,1637353500660346880,2023-03-19 07:21:09+00:00,El calendario de los 5 siguientes partidos de los Tigres tras el perder el Clásico Regio ante Monterrey https://t.co/UaTbTsZxXE https://t.co/O9iy14Ejg2,Pasion_Tigres_
891,1637353321806659585,2023-03-19 07:20:27+00:00,"RUGEN LOS TIGRES DEL NORTE EN CASA, MEXICALI CELEBRA 120 AÑOS 

Salen a tocar los Los Tigres del Norte para celebrar los 120 años de Mexicali, la agrupación que adoptó a Mexicali como su segunda casa se encuentra interpretando sus más grandes éxitos. Fot… https://t.co/v28jsfNvzh https://t.co/HHWi5mjuF9",Canal66tv
892,1637353160888004608,2023-03-19 07:19:48+00:00,Los reales y yo quebrándonos la chompa por que ofni nos vamos a llevar al antro en Monterrey y chingos de raza aquí con la del tigres y rayados 🤡🤡🤡,tonymontoya95
893,1637352671030943744,2023-03-19 07:17:51+00:00,Toda la razón! Morena ha utilizado hasta videos de celebraciones de los Tigres de UANL... presumiendo qué es gente que los apoya!,agrotechniccal
894,1637352494580858881,2023-03-19 07:17:09+00:00,"tigres 
chivas
pumas 👏👏👏",jikoogida
895,1637352437647286272,2023-03-19 07:16:56+00:00,quiero tranquilidad ya que los Tigres se llevaron toda mi paz y felicidad 🥲,danielibarra_17
896,1637352240372490240,2023-03-19 07:16:09+00:00,Jajajaa esos tigres namas no🤣🫵🏻,Junior_vallej0
897,1637351964567633922,2023-03-19 07:15:03+00:00,LIGA PREMIUM D1. CB AS PONTES 49 – TIGRES MÁIS DESCANSO 82 - https://t.co/HByTqyHkmA #AsPontes https://t.co/vCcCKuSKhS,amigus_aspontes
898,1637351804739506177,2023-03-19 07:14:25+00:00,"solo tigres, pero no soy fan, solo creo que son un buen equipo",joahbae
899,1637351682551189504,2023-03-19 07:13:56+00:00,Ya me iba a dormir y cerca de mi casa hay un concierto de los tigres del Norte y se escucha muy bien,BeasLilia
900,1637351528758378497,2023-03-19 07:13:19+00:00,La Puerta Negra Los Tigres del Norte                     Now playing Mana Oye Mi Amor by !,EvinNado
901,1637350868633657344,2023-03-19 07:10:42+00:00,La Puerta Negra Los Tigres del Norte                     Now playing Cadetes de Linares Cruzando el Puente  by !,EvinNado
902,1637350635585560578,2023-03-19 07:09:46+00:00,"Perdieron mis Tigres el clásico, perdí mi tarjeta de nómina, me hicieron cargos no reconocidos en mi tarjeta de crédito, choque el carro, se vino una racha de frío y regreso mi parálisis facial, ya sueltame dios, no soy tu mejor guerrero.",Adrian_Cobain12
903,1637349703875428352,2023-03-19 07:06:04+00:00,"tantas cosas en esta vida me han ilusionado y decepcionado pero no se compara con la ilusión que me metió tigres esta temporada, chtm chima Ruiz",daviiid_ca
904,1637349211938123777,2023-03-19 07:04:07+00:00,"➟ 𝙁𝙄𝙉𝘼𝙇 | Tigres 0-1 Rayados
¡𝗘𝗟 𝗖𝗟𝗔́𝗦𝗜𝗖𝗢 𝗘𝗦 𝗥𝗔𝗬𝗔𝗗𝗢! Rayados vence como visitante a Tigres en el Clásico Regio. Romo marcó un golazo. Monterrey líder con 31pts, mientras que Tigres es 4.° con 21pts. #LigaMX #ClasicoRegio129 https://t.co/VChk5BrlOP",Fairp_mx
905,1637349182003396608,2023-03-19 07:04:00+00:00,"Y donde quedaron los tigres ? JAJAJAJJAAJJA puro osico con su ""afición"" 🥶🥶🥶🥶🥶",Jaureguiaazul
906,1637348357650694144,2023-03-19 07:00:43+00:00,"Si alguien me hubiera dicho hace 35, 37 años que un día iba a escuchar a Benny Ibarra (Timbiriche) cantando ""La Banda del Carro Rojo"" (Tigres.) En la Arena CDMX, lo hubiera dudado de sobremanera..!",JManuelArriaga3
907,1637348259646545920,2023-03-19 07:00:20+00:00,abriendo mi cumpleaños con los tigres del norte,pumppcat
908,1637348178780471297,2023-03-19 07:00:00+00:00,LVBP: Tiburones de La Guaira se hacen con Anthony Santander en cambio con Tigres de Aragua https://t.co/VypAJ4wXiL,MeridianoTV
909,1637347968687767553,2023-03-19 06:59:10+00:00,"Yo bien feliz haciendo una quest en Monster Hunter
Sencilla
Conseguir 3 Lenguas de Popo (así se llama el bicho, a mi no me digan nada)

Y ahí estoy, tasajeando uno, arrancándole la lengua
Giro la cámara y tengo un chingado Tigres en la cola!
Ni ruido hizo el perro

Me infarté Q~Q",CodeSymbioticVT
910,1637347789796519937,2023-03-19 06:58:28+00:00,"Ches reventadores de mierda, pero no los quiero ver cuándo este equipo levante, que seguros que levantaran porque esto es TIGRES que sale adelante, se levantaran, lo sé",Rayo_MQN
911,1637347753687760896,2023-03-19 06:58:19+00:00,ndms por ti si le voy a tigres preciosa😍,_Bandaaaaaa
912,1637347695026221056,2023-03-19 06:58:05+00:00,"Es Neta? No le entendiste?
Ahí dije clarito, “ni empataba” (EM-PA-TA-BA), con 3 equipos equis. “Equis” es = a:
San Luis, Juárez y Orlando.
Con Rayados perdió!
PER-DIÓ!
Analiza bien cómo lees.
PD. Y Rayados y Tigres aún no son gdes. No son equis (d un tiempo pa’cá, así q relájate)",piniramones
913,1637347557444648960,2023-03-19 06:57:32+00:00,"Tigres Nunca Solo 
#ClasicoRegio129 https://t.co/KVzwvHVeOd",alex_talancon
914,1637346999837007873,2023-03-19 06:55:19+00:00,"Necesitamos que tigres tenga gente que en verdad sepa de Futbol y no solo usar twitter.
El equipo se cae a pedazos y no hacen nada para reaccionar🤐",tigre9715
915,1637346959789793284,2023-03-19 06:55:10+00:00,"📝 Rayados por la mínima vence a Tigres en el clásico regio.

https://t.co/tD7mgYP0Pm https://t.co/kWAgvrLOj6",deportivistamx
916,1637346823277821953,2023-03-19 06:54:37+00:00,Lo bueno es q tenderé otra semana sin tigres en mis redes jajaja ya ven q esos weyes nomas cuando ganan hablan jajajaja,JKARLOS_
917,1637346596349267968,2023-03-19 06:53:43+00:00,La Puerta Negra Los Tigres del Norte                     Now playing Lupillo Rivera Despreciado by !,EvinNado
918,1637346410801553408,2023-03-19 06:52:59+00:00,Oye @piziogmz cómo les fue al tigres contra el ame y contra rayados ?,jesusszamoram
919,1637346154760351744,2023-03-19 06:51:58+00:00,"Si Diego Reyes jugara todos los partidos cómo jugó vs Rayados, se ganaría la renovación con Tigres.

El defensa mexicano 🇲🇽🛡️ a pesar de la derrota dio un gran partido. https://t.co/wMLwjpcseS",Fafhoo
920,1637345954331238400,2023-03-19 06:51:10+00:00,"Los clientes favoritos de Jonathan Rodríguez en México.

10 Guadalajara
7 América
7 León
7 Tigres
7 Toluca https://t.co/bR0CM02GlD",golesycifras
921,1637344733075845120,2023-03-19 06:46:19+00:00,nombre que 🐶 friazo pase en el estadio que horror todo por pensar que no iba a hacer tanto frío y luego perdieron mis tigres 1 cosa les pedí vale madres salganse de tw quiero estar sola,edavt_
922,1637344675840368640,2023-03-19 06:46:05+00:00,Nada más se salvan las chulas de esos tigres que tan allanando 😂,Deniiz6
923,1637344458386681857,2023-03-19 06:45:13+00:00,"Hay quienes se quejan pq Mty no salió a comerse a tigres todo el partido
Pf,Cuando entenderán q este equipo le juega a cada equipo asumanera diferente,
 vuce tiene su dosis para cada 1.
Cuadrados los q siguen esperando que vuce va a jugar todos los partidos igual.
NO LE ENTIENDEN",SiguealMty
924,1637344263468900354,2023-03-19 06:44:27+00:00,tres tristes tigres trigaban tigro en un trigal,Kerfunn
925,1637344152995209216,2023-03-19 06:44:01+00:00,"Cruz Azul después de ganar muy al estilo del Tuca, 1 a 0, ya es octavo y tiene un partido pendiente. 

Creo que el Potro tuvo la mala suerte de enfrentarse a Toluca, Tigres y Monterrey. 

En la era Ferreti, sus sinodales han sido Juárez, Pumas y San Luis.",catpardo2023
926,1637343816284766209,2023-03-19 06:42:40+00:00,"Está la noche bien fría en #Monterrey 
Perdieron los #Tigres no hay fiesta ni vino 😞🍷
Es muy feo así.",raularriaga24
927,1637343245016473600,2023-03-19 06:40:24+00:00,"Acabo de destrozar mi TV de 84"" con rabia Este Tigres me avergüenza. Mis 2 hijos están llorando asustados de mi ira mientras camino por la habitación temblando No puedo soportar esto más. duerman a todos los delanteros de este equipo o mis hijos no comerán hasta el año que viene",Brauliowya2
928,1637342808162852865,2023-03-19 06:38:40+00:00,El combo su perra puta miada madreeee hdp culeros ganó la raya. A webo culeros chinguen a su madre los tigres... https://t.co/xNZhALux17,MIK_EL_ANGEL
929,1637342765716500480,2023-03-19 06:38:30+00:00,"Los clásicos se los llevaron Rayados y el America !

🐯Tigres 0-1 Rayados 🐧
🔵⚪️ Luis Romo ⚽️ 

🔴⚪️Chivas 2-4 America 🦅

🦅  Jonatan Rodríguez 16’ 38’ Leonardo Suárez 42’ Henry 53’ ⚽️

🔴⚪️  Lara (ag) 62’ Sergio Flores 72’ ⚽️

#LigaBBVAMX  #Jornada12",UBSportMX
930,1637342760846884865,2023-03-19 06:38:29+00:00,"Putos Tigres me amargaron la noche, lo bueno que GOA y Yung beef siempre me entendieron https://t.co/hF08RuwgWd",endorfinadealer
931,1637342697760464896,2023-03-19 06:38:14+00:00,"Andan bien perdidos algunos aficionados de Tigres tirando culpas hasta a la directiva, cuando los resultados dependen de los 11 + banca y cuerpo técnico.",_AlfonsoPinto
932,1637342612439851009,2023-03-19 06:37:53+00:00,Perdió Tigres hoy también perdió mi familia,angelmata__
933,1637342175863160832,2023-03-19 06:36:09+00:00,"Hoy nadie grita en el Vestidor de TIGRES...

El Último que lo hizo fue el @IngRodriguezM ...

Hoy es una Fiesta 🎉 porque hay ""amigos"" en la dirección técnica y no una autoridad dirigiendo al Club...

No lo digo yo, lo dicen los resultados...🙌

LAMENTABLE.",GalenoXXXT
934,1637341767304445952,2023-03-19 06:34:32+00:00,Los Tigres del Norte - Gallo De Pelea,WZBC_Live
935,1637341749038153728,2023-03-19 06:34:27+00:00,Monterrey se impone por la mínima a Tigres en enredado partido y se lleva el Clásico Regio https://t.co/31MG8HMf1V,laopfutbol
936,1637341193712414720,2023-03-19 06:32:15+00:00,La Puerta Negra Los Tigres del Norte                     Now playing Bronco Compadre del Alma by !,EvinNado
937,1637341108962205697,2023-03-19 06:31:55+00:00,al final no gano tigres,luz_rojo_
938,1637341072022962176,2023-03-19 06:31:46+00:00,Tigres hasta el cajón cárajo aquí nadie se baja del barco,AlanFernandoMt1
939,1637340889394868225,2023-03-19 06:31:03+00:00,El Nuevo clasico national es America vs Tigres,kylo3ddy
940,1637340856473485313,2023-03-19 06:30:55+00:00,"Que playera pesa más en el fútbol mexicano 
#Monterrey #Tigres @absalon78 @javierehdz @edutorresr @Tigre_TX @jbvalder @fernando_andere 
@TIGRILLA_ACERO @ale_orvananos @Tamedamus @HugoJoaquinSuar @rgtito @TitoVilla1982 @Karla_LopezG",bendf31
941,1637340764903706626,2023-03-19 06:30:33+00:00,Que Diosito nos dé muchos años más de Pizarro y Carioca en tigres … Amén,JairFlores
942,1637340579158712322,2023-03-19 06:29:49+00:00,"Tras las victorias vs Tigres y Chivas queda más que claro que el rival más grande a vencer del @ClubAmerica es a él mismo

Los errores individuales, falta de lectura de los juegos y cambios malos además de tardíos, han sido determinantes en partidos importantes",CFAKuri
943,1637340487269900288,2023-03-19 06:29:27+00:00,"Saluden Al Superlider 😎 
El mejor visitante invicto de visitante 
El mejor Equipo 
ya le Gano al Campeon y A Tigres 
Ke mas quieren sigue el America lo tenemos de hijos 🤍💙🔥😎 
Monterrey esta ser Campeon https://t.co/ciDoQ80iF2",angeljhoanruiz5
944,1637340296634593282,2023-03-19 06:28:41+00:00,Están muy callados los tigres,Picho_SP
945,1637340294621323265,2023-03-19 06:28:41+00:00,"En un duelo sin emociones, Monterrey vence a Tigres en el Clásico Regio https://t.co/46J3B2VOXc #futmx",Golmxweb
