,Tweet Id,Datetime,Tweet,Username
1223,1637315218740072448,2023-03-19 04:49:02+00:00,La Puerta Negra Los Tigres del Norte                     Now playing Carlos y Jose El Chubasco by !,EvinNado
1224,1637315178701127680,2023-03-19 04:48:53+00:00,"EL UNICO Y VERDADERO CLASICO ES EL DE AMERICA Y CHIVAS, QUE SE DEJEN DE MAMADAS LOS REGIOS TIGRES Y RAYADOS ES BIEN ABURRIDO",GallitoVip
1225,1637315068093255680,2023-03-19 04:48:26+00:00,"A que mis #tigres  ya 3 tecnicos desde que se fue el #Tuca y este equipo se esta cayendo a pedazos , bien lo dijo no de vayan a caer
Todas las rachas que tenia el equipo ya se estan pediendo.... lamentable lo que pasa con el equipo..",sharly27
1226,1637315054545543169,2023-03-19 04:48:23+00:00,Celebro la victoria del juego contra tigres y me voy a terminar peleando con aficionados del LEÓN?????,Asael_13
1227,1637315014116737029,2023-03-19 04:48:13+00:00,Mas triste que tres tigres pero tranquila mami que tu hijo sufre pero no llora,ymbback
1228,1637314977160675331,2023-03-19 04:48:05+00:00,"Culpo directamente a Rodrigo Bazán de salar los dos clásicos, al subir historias con las jerseys de chivas y Tigres",AloinFerrer
1229,1637314957032275970,2023-03-19 04:48:00+00:00,"""Las dudas las tienen ustedes"": 'Chima' Ruiz habló sobre su continuidad al cargo de Tigres 

¿Crees que los felinos deberían buscar otro director técnico?
 
https://t.co/NujcSL72wp https://t.co/A4cUHOsmPQ",mediotiempo
1230,1637314931384020992,2023-03-19 04:47:54+00:00,El Cruz azul volvió a ganar y Tigres volvió a perder.,DavilaCarloss
1231,1637314874156908544,2023-03-19 04:47:40+00:00,El chima dirigiendo al mejor plantel de la liga https://t.co/H0weJkX8Kg,ElTigreRGV
1232,1637314855135838210,2023-03-19 04:47:35+00:00,"Tigres no es para novatos, lo siento pero al Chima le quedo muy grande el equipo se sabe",LuisLazarog
1233,1637314850035576837,2023-03-19 04:47:34+00:00,Cabecita Rodríguez aplicándonos un gol igualito al del tigres ptm,s_chuma0
1234,1637314793768927232,2023-03-19 04:47:21+00:00,PRIMER CAPITULO Y YA ESTOY LLORANDO PUTA MADRE,tigres_elmejor
1235,1637314741436665857,2023-03-19 04:47:08+00:00,FRANCKY OENDEJA TODO ES TU CULPA CHUPAME EL PITO QUE NO TENGO,tigres_elmejor
1236,1637314657357643776,2023-03-19 04:46:48+00:00,VOY A LLORAR LA MORRA ESTA EN COMA Y EL NOVIO LE TERMINO LA CSNCION 😭😭😭😭😭😭😭😭 NOOOOOOO CHINGA TU MADRE ES 😭😭😭 ESTOY LLORANDO SALGANSE DE TWOTTER 😭😭😭😭,tigres_elmejor
1237,1637314576277438464,2023-03-19 04:46:29+00:00,Humilde Emilio Lara regalando un gol a @Chivas,cositas_detig
1238,1637314493305765888,2023-03-19 04:46:09+00:00,"Fuera el DT de tigres (que ni me se su nombre, real no tengo idea quien es), pero ya fuera, plss",graceayalav
1239,1637314472573386755,2023-03-19 04:46:04+00:00,Mamamamamaron los tigres!,lobitogonz
1240,1637314463924723713,2023-03-19 04:46:02+00:00,Que bonita se veía y eso que tenía la de tigres😍,RochaErvitti
1241,1637314408509521920,2023-03-19 04:45:49+00:00,"No me gusta NADA el Tigres de Chima Ruiz 😣 le tengo mucho cariño al cuerpo técnico, pero no se juega a nada 🤷🏼‍♀️",dareli_esparza
1242,1637314347130126337,2023-03-19 04:45:34+00:00,Oigan quien es el DT de tigres y porque lo hemos aguantado tantos partidos? No tiene ni idea de lo que es el fútbol,graceayalav
1243,1637314275206217728,2023-03-19 04:45:17+00:00,Que paso tigres 😆😆,sofiiq__
1244,1637314255522283521,2023-03-19 04:45:13+00:00,Hubiera ido al puto bandazo en vez de quedarme a ver a mis pinchés tigres 😞,ErickPerezSsj
1245,1637314210848813056,2023-03-19 04:45:02+00:00,"¿La falta de contundencia de Tigres le hizo perder el Clásico 129?

“Si no hace gol Gignac, no hace gol nadie” 🐯😱

📻 690 AM - 92.9 FM
📱➡️ https://t.co/hFP7ZSWidV https://t.co/y6XnaRu83F",rg690
1246,1637313965519781890,2023-03-19 04:44:03+00:00,"Que asco dan los mexicanos hablando de futbol como si supiesen lo que es...
Lleno de tuits de monterrey, chivas, tigres...
No le importan a nadie.
Ne existen.
No le importa ni a los propios mexicanos.",unnuevofurbo
1247,1637313799425347588,2023-03-19 04:43:24+00:00,todos los tigres a llorar 🥺,lauren_saanchez
1248,1637313717741453313,2023-03-19 04:43:04+00:00,A esos q le van alas chivas y al tigres se vale llorar eh 🤣,leonel_saul_
1249,1637313701244968961,2023-03-19 04:43:00+00:00,"De TIGRES toda la vida , pero jugamos cagada. Cada vez peor y se nota que ocupamos un DT de verdad.",alfonso_poy
1250,1637313650540027905,2023-03-19 04:42:48+00:00,"Para haber agarrado a @TigresOficial CANSADO, debiste meterle mínimo 4 @Rayados pero no para eso sirves 🤭🤭🤭… tigres siempre te mete de a 6 ⚽️⚽️⚽️⚽️⚽️⚽️",Maxer64
1251,1637313634782068741,2023-03-19 04:42:45+00:00,todavía no muere pero yo ya le ando chillando,tigres_elmejor
1252,1637313581250228224,2023-03-19 04:42:32+00:00,porqieee 😭😭😭😭😭 PORQIE SIEMPRE QUE ME ENCARIÑO.CON UN PERSONAJE MUEREEE 😭😭😭😭😭😭😭😭😭😭😭😭💔💔💔💔💔💔,tigres_elmejor
1253,1637313572752506883,2023-03-19 04:42:30+00:00,YO YA ERA TIGRE...esta pinché pendejada no la apoyo....yo la critico...yo no soy conformista....yo exijo....ellos no son tigres....YO SOY TIGRE,LuisRobhermclen
1254,1637313536681558016,2023-03-19 04:42:21+00:00,"CON UN GOL DE OTRO PARTIDO

En un encuentro al que no le pasaba nada, #Rayados derrotó a #Tigres por la mínima en el Volcán, gracias a un golazo descomunal de Luis Romo, que la clavó al ángulo desde fuera del área, para quedarse con el #ClásicoRegio. 

0-1. https://t.co/dUAvrCsVfP",AtmosferaD
1255,1637313469908152320,2023-03-19 04:42:05+00:00,"#ClásicoRegiomontano:  En un duelo sin emociones, Monterrey vence a Tigres en el Clásico Regio. https://t.co/9uU8dfXKUL",lado_mx
1256,1637313456717037570,2023-03-19 04:42:02+00:00,Lo único bueno de ser aficionado de tigres hoy es que a todos les va a importar más la derrota de Chivas que de su equipo mierdero.,_duderino_
1257,1637313385229320193,2023-03-19 04:41:45+00:00,"Con un golazo de Romo, Rayados gana el clásico regio y sigue enrachado y como líder en la tabla general.

#tigres #rayados #ligabbvamx #ligamx #futbol #soccer #football https://t.co/hURgZSu5NK",Armandrums86
1258,1637313344435548160,2023-03-19 04:41:35+00:00,"Donde estaban?? cuando Tigres lo unico bueno que hacian en la temporada era ganar el clasico y ni eso hacia, que cada vez que iban con los pinches chilangos era goleada segura, donde estaban cuando descendieron???",LuisRobhermclen
1259,1637313287195881474,2023-03-19 04:41:22+00:00,Los muchachos estaban bien pero en el 8vo se durmieron y perdieron porque los tigres no estában ready to go @Soyyenny29,fumigador01
1260,1637313233370468352,2023-03-19 04:41:09+00:00,"no me asusta la derrota, aki nadie se baja del barco, siempre de tigres 🐯",jakisit4
1261,1637313193281241089,2023-03-19 04:40:59+00:00,"Dejen de engañarse Todos en el 2023
LOS GRANDES SON 3 nada mas Monterrey, Tigres y America.
#clasicoregio #ClasicoDeMexico  #clasiconacional  #rayados #america #tigres",clicka821
1262,1637313175552135168,2023-03-19 04:40:55+00:00,"Es una burla comparar la banca que tiene @Chivas  contra las que tiene equipos como América, Tigres, Monterrey, Toluca, etc. Ponte las pilas wey @Amauryvz",eberlaborin
1263,1637313137631215616,2023-03-19 04:40:46+00:00,Nmms mi cuñado me regalo dos playeras de tigres😩,rincon_alb
1264,1637313101975670784,2023-03-19 04:40:37+00:00,"Los Tigres nunca perdemos.
Siempre ganamos!!!!
Salú!!! I ñorrrr!!!’ https://t.co/v2ukRaxZHT",rioslawyer
1265,1637313075127767043,2023-03-19 04:40:31+00:00,1- Ganó MONTERREY. 2- perdió tigres. 3- golearon a las chivas jajajajajaj que bonito día🥰,DavidDavilaV
1266,1637312968781176833,2023-03-19 04:40:06+00:00,Pa recordar que tigres es un equipo chico,axamaro
1267,1637312966713327618,2023-03-19 04:40:05+00:00,Hágame feliz porque tigres me esta haciendo llorar,Crissssrdz11
1268,1637312949630144512,2023-03-19 04:40:01+00:00,Así calificamos a los jugadores de #Tigres que vieron acción en la derrota ante #Rayados por 1-0 en el #ClásicoRegio. https://t.co/DRJX4ZvkXf,CANCHAELNORTE
1269,1637312670004019201,2023-03-19 04:38:54+00:00,"Todos estos imbéciles que están con tigres ahora, se irán, yo me quedaré; ellos dejaran de ser Tigres, YO NO y no salgan con su estupides que soy tigre de moda",LuisRobhermclen
1270,1637312661900623878,2023-03-19 04:38:53+00:00,GOLAZO DE LARA.,pikatuits_
1271,1637312525845798915,2023-03-19 04:38:20+00:00,"Rafa Puente es TAN CAGADA que hizo ver como equipos fuertes a:

Tigres, Atlas, Chivas Santos y los que faltan.",ElPete_MX
1272,1637312512944373763,2023-03-19 04:38:17+00:00,"Hay dignidad en la derrota de Tigres… en la de Chivas , no",rickypedraza
1273,1637312474163605504,2023-03-19 04:38:08+00:00,pinches tigres siempre me fallan😫,vanggukh
1274,1637312454496534528,2023-03-19 04:38:03+00:00,A TU LADO TODO ES MEJOOOOOOR,TigresAlReves
1275,1637312451665428483,2023-03-19 04:38:02+00:00,mamaron los tigres,CesarVigi1
1276,1637312383591776257,2023-03-19 04:37:46+00:00,Y tigres?,Vitela_13
1277,1637312364012789761,2023-03-19 04:37:42+00:00,ESTUVO EN UNO DE LOS VOLUMENES ANTERIORES PERO NO ME ACUERDO EN CUAAAAL,tigres_elmejor
1278,1637312287022219265,2023-03-19 04:37:23+00:00,"Este tipo los mando ALV !!!
Entiendaaaaan https://t.co/LHu3Yue7NL",ElCapoDelTwiter
1279,1637312270467317761,2023-03-19 04:37:19+00:00,A ELLA LA CONOZXO,tigres_elmejor
1280,1637312236963221504,2023-03-19 04:37:11+00:00,"¿Estan de acuerdo?

¿Quién es el culpable de lo que esta pasando en Tigres?",andresn
1281,1637312219728715777,2023-03-19 04:37:07+00:00,"Hasta jugando latelarito vaciamos el bbva 

Tigres siempre será tu PAPÁ 😎😎😎😎",IngRodriguezM
1282,1637312197788413952,2023-03-19 04:37:02+00:00,"Y es qué hay que ser sinceros, no se puede competir si no tienes a los mejores mexicanos de la liga , y esos están en mty , tigres y el propio america , y tuzos con sus jugadores jóvenes",tito3k
1283,1637312124748812288,2023-03-19 04:36:44+00:00,"La única contratación desde Thauvin que ha seguido el template que venía haciendo Tigres.

De Europa, y de la Premier League, en una posición super urgente, y que llegara directo a liderar la defensa.",eddievf
1284,1637312124027383810,2023-03-19 04:36:44+00:00,"Si le vas a los Tigres, me la pelán!… menós mis primos, los quiero! Haha",LouuiA
1285,1637312046113996800,2023-03-19 04:36:26+00:00,Chingo a su madre tigres,israeledwin2
1286,1637311995778048000,2023-03-19 04:36:14+00:00,"Tigres perdió vs Chivas, America y Rayados… 

MALDITA LA COSA",betobarragan8
1287,1637311983832690689,2023-03-19 04:36:11+00:00,Tigres ya tiro el torneo. Lamentablemente.,MarioDobleEle
1288,1637311958864080897,2023-03-19 04:36:05+00:00,Tigres pierde pero es como si ganara o cómo era 🤣🤣🤣🤣,SiSoyMolina
1289,1637311898327691264,2023-03-19 04:35:51+00:00,"queda MÁS que demostrado que:

en el clasico NACIONAL
CHIVAS LO DEVALUA

y que en el clasico regio
EL VUCEBUS LO DEVALUA",RAULGAR75399979
1290,1637311828278558721,2023-03-19 04:35:34+00:00,"Zoológicos de México envían 200 tigres a la India; buscan salvarlos de la extinción https://t.co/gju7LUkPRs…
vía @notiambientales https://t.co/dtHEtdB3GG",lucho2680
1291,1637311816291295233,2023-03-19 04:35:31+00:00,Ok Chima etc y  Nico Ibañez ...?🤔 https://t.co/bJDFLNGbKA,ElCapoDelTwiter
1292,1637311784804548614,2023-03-19 04:35:23+00:00,Siempre tigres pase lo que pase🙏🏻,Cristian_jr3
1293,1637311777758146560,2023-03-19 04:35:22+00:00,perdieron mis tigres y no fui a ver al nata,oscarhdzprz
1294,1637311743092219906,2023-03-19 04:35:13+00:00,"Ya basta.
@edutorresr para DT de Tigres y asunto arreglado.
Sí o no, @Tonyvachi ...
@rg690 #Postpartido #ClásicoRegio129",AbogadoDelTuca
1295,1637311742618288130,2023-03-19 04:35:13+00:00,"Los dos habladores (3 en este caso) quedaron exhibidos hoy
1. Los regios (Tigres y Monterrey) que decían que su clásico es el mejor y fue el partido más aburrido..
2. Las Chiv4s: al momento les están metiendo 4 y decían que el América la iba a pasar muy mal.",CastilloD_98
1296,1637311725656580096,2023-03-19 04:35:09+00:00,todo es culpa de mariana q le cambió la camisa a su hija después de q samuel le pusiera la real=la de tigres,wourrista
1297,1637311694576951297,2023-03-19 04:35:02+00:00,"El técnico de Tigres aseguró que no ve las criticas hacia su equipo, y se enfoca en dejar atrás la serie de malos resultados de las últimas jornadas.

https://t.co/aSjEBrwi0J",postamx
1298,1637311657968820227,2023-03-19 04:34:53+00:00,"Con un @TigresOficial en su peor momento.
Era la oportunidad de oro de rayados para un marcador de escándalo, ni hablar.
@Rayados ganó bien, hizo lo necesario, un gol.
Tigres aún es tiempo de mejorar o de plano caerse a pedazos, pero la camisa sigue bien puesta",AlmaguerMAP
1299,1637311633222402049,2023-03-19 04:34:47+00:00,Rayados vs tigres https://t.co/AByoVpC2na,mreyesgzz2810
1300,1637311611663777792,2023-03-19 04:34:42+00:00,"Del repaso de Celso Ortiz a la media cancha de tigres no vamos hablar o si?
#Clasico129",AlejandroDav1HS
1301,1637311528381603841,2023-03-19 04:34:22+00:00,Resumen de los partidos de hoy…. #clasicoregio #ClasicoDeMexico #rayados #tigres https://t.co/pTXNgNw2Q7,MtyAnteElMund0
1302,1637311444868820992,2023-03-19 04:34:02+00:00,"En lo dicho; América, Tigres, Monterrey, Pachuca se sientan en una mesa en la que ni Chivas, Pumas y hasta Cruz Azul no comen…",HakbarCJ
1303,1637311432831258624,2023-03-19 04:34:00+00:00,"Raza no se ganchen, ni se enojen por qué Tigres perdió. Sean felices como Mauricio. Uds muriendose y a quien le debe apurar parece que está muy feliz con  el desempeño del equipo.",ElSandeces
1304,1637311415877812224,2023-03-19 04:33:55+00:00,"Buenas noches mi gente , animooo ni pex no se jugo a nada y nos dio el resultado que merecíamos , molestos pero daleeeeee tigres. https://t.co/FKNyWmQY3X",_soyjaqui
1305,1637311293190287363,2023-03-19 04:33:26+00:00,"▪️ LIGA MX
▪️ Tigres 0 : 1 Monterrey

Clásico Regio y parecía una buena oportunidad para que Joao Rojas vuelva al césped. Sin embargo, por cuarta semana consecutiva, el ex Emelec y Aucas se quedó en el banco de los relevos. https://t.co/2GPNohotKW",MrOFFSIDER
1306,1637311292254957568,2023-03-19 04:33:26+00:00,Es que nosotros los tigres somos humildes así que los dejamos ganar😽,PerlaEs97496050
1307,1637311204187095041,2023-03-19 04:33:05+00:00,Lo bueno es que aquí somos fans de béisbol. https://t.co/qdQScvF9w9,pikatuits_
1308,1637311074364997632,2023-03-19 04:32:34+00:00,"Los últimos partidos de Tigres en el Volcán

vs Juárez 0-0 🟰
vs Chivas 1-2 ❌
vs Orlando 0-0 🟰
vs América 0-2 ❌
vs Rayados 0-1 ❌ 

¿Hay forma de revertirlo? En casa quedan Mazatlán, Motagua y Puebla, más juegos de CONCACAF que se puedan sumar. https://t.co/NCmTldJcOc",edutorresr
1309,1637311014772305922,2023-03-19 04:32:20+00:00,"donde quedaron los Tigres que decían que Rayados le ganaba a puro equipo chico? 

CUANTA RAZÓN TENÍAN JAJAJAJAJAJA",tetragastesta
1310,1637310838481514499,2023-03-19 04:31:38+00:00,"Quitando a Nahuel, Samir y Aquino fueron los únicos que dieron un buen partido. Ni individual, ni mucho menos en conjunto, se vio Tigres hoy.",kevinmontanof
1311,1637310814708277248,2023-03-19 04:31:32+00:00,"Tengo que aceptar que esperaba que los Rayados fueran a “golear” a Tigres, pero no se les ve mucho jsjsjs",sofiardz2901
1312,1637310777576116224,2023-03-19 04:31:23+00:00,"Y a Tigres, puebla, Mazatlán, San luis, etc.",EseSolleiro
1313,1637310772769325056,2023-03-19 04:31:22+00:00,Ojala sigs perdiendo tigres toda su vida,victrfv18
1314,1637310768336044032,2023-03-19 04:31:21+00:00,Más triste que tres tristes tigres,Raynesdelgado_
1315,1637310739361701889,2023-03-19 04:31:14+00:00,alv jeanca y los pinches tigres,u87823
1316,1637310705576583168,2023-03-19 04:31:06+00:00,La Puerta Negra Los Tigres del Norte                     Now playing ID RL 3  by !,EvinNado
1317,1637310555026333697,2023-03-19 04:30:30+00:00,Se viene fecha FIFA momento de reflexionar momento de unión y comprometerse y seguir en el barco hay mucho que arreglar y este equipo puede levantar no todo está perdido a cerrar como saben vamos tigres ! https://t.co/7FQciW02Kq,antwancastro1
1318,1637310553029746688,2023-03-19 04:30:30+00:00,"Cada vez q me bajo del carro un señor pendejo me dice, “Nos chingaron eda”, no me recuerde q perdieron mis tigres don😭😭",Brayan_2211
1319,1637310532951711745,2023-03-19 04:30:25+00:00,"A dormir a gusto gracias a mis Rayados, mañana hasta con ganas voy a jalar porqué no veré la felicidad que hoy traían mis compañeros los tigres",Pau_NDA
1320,1637310495626518529,2023-03-19 04:30:16+00:00,Perdió tigres y también perdió mi familia,Nohemi81020271
1321,1637310461870784512,2023-03-19 04:30:08+00:00,"🧤 E S T E B A N   A N D R A D A 🧤

Monterrey se lleva El Clásico Regio al vencer 1-0 a Tigres en el Volcán 🌋.

Esteban Andrada se erige como la figura del partido tras parar todo lo que le llegó. 🥇

#Monterrey #Phetru https://t.co/cOdG7m7xzC",Phetru
1322,1637310446964228099,2023-03-19 04:30:04+00:00,Al menos no somos las Chivas JAAJAJAJAAJAJAJAJAJAAJAJAJA,pikatuits_
1323,1637310427234435074,2023-03-19 04:30:00+00:00,"Rayados de Monterrey venció 0-1 a Tigres de la UANL, en el clásico del norte del país, y se confirmaron como líderes del Clausura 2023 del futbol mexicano https://t.co/zuUQnAIQmB https://t.co/i7xydZcZBs",lopezdoriga
1324,1637310417339908096,2023-03-19 04:29:57+00:00,"Al Ame le dio en el orgullo esa derrota con Pachuca, la semana pasada destrozó a tigres y hoy está destrozando y aplastando a las chivas.",chuycurtis
1325,1637310385530314752,2023-03-19 04:29:50+00:00,Todavía no corren al Chima #tigres ? @TigresOficial,RobertoDavila10
1326,1637310310980763648,2023-03-19 04:29:32+00:00,"Gracias Chivas, hacen el dolor de mis Tigres menos feo jaja",JulesSugoi
1327,1637310230651387904,2023-03-19 04:29:13+00:00,Las chivas están peor que los tigres,jorgeluiszamaes
1328,1637310158194745344,2023-03-19 04:28:56+00:00,Buen triunfo de Rayados y son justos ganadores gracias a  Andrada y la falta de contundencia de Tigres.,LKikeGarcia
1329,1637310071024635905,2023-03-19 04:28:35+00:00,Mal y de malas mis Tigres… 🫠,Paco10Mendoza
1330,1637310048304087041,2023-03-19 04:28:29+00:00,"Tigres sigue en coma, en cuidados intensivos, cada vez peor.

La reconstrucción con el nuevo DT empezará hasta Mayo, ahora Tigres debe enfocarse solo en una cosa: Ganar la concachampions.",gpader
1331,1637310037067530240,2023-03-19 04:28:27+00:00,"EL CLÁSICO FUE PARA RAYADOS 🤠

Con un golazo de Romo, Monterrey se llevó el triunfo ante Tigres. 

Matemáticamente ya están en la Liguilla. 

El reporte de @sergiotrevino9

#CentralFOX https://t.co/YrZ4leAiiW",CentralFOXMX
1332,1637309966859087872,2023-03-19 04:28:10+00:00,Perdieron mis tigres 😞😞,HuertaMaximiano
1333,1637309950866096131,2023-03-19 04:28:06+00:00,jaaaja como odio a los tigres 😷🖕,Jahir245v
1334,1637309877209948160,2023-03-19 04:27:49+00:00,"Hoy la afición de tigres abandonó a su equipo 
https://t.co/Npf6Ckd2U5",SancardillaNort
1335,1637309863326801921,2023-03-19 04:27:45+00:00,Tigres perdió. 😞,wolffievr
1336,1637309780896120836,2023-03-19 04:27:26+00:00,PINCHES TIGRES A CHUPARLA,SPV0204
1337,1637309765033373696,2023-03-19 04:27:22+00:00,"Tigres, siempre de @TigresOficial 😎😎😎",damon_u2
1338,1637309752274190336,2023-03-19 04:27:19+00:00,"Hace rato me mandaron por WhatsApp una cadenita de San Judas y no la mandé a las 20 personas que me tocaban, será por eso que perdieron mis tigres?",eldelaconsty
1339,1637309654387552259,2023-03-19 04:26:56+00:00,no vale v tigres 🤣🤣,pipedlacruz
1340,1637309421402443777,2023-03-19 04:26:00+00:00,"¿Se dieron cuenta de que salió Guido Pizarro y el equipo se vio mejor?

Ya va siendo momento de que coma banca, ya basta de jerarquias. 

Y pensar qué hay gente que prefiere a Pizarro por encima de Carioca jajaja, saben una mierda de fútbol.",SomosTigres_
1341,1637309394156224513,2023-03-19 04:25:53+00:00,"1 vez más toca seguir en este pinche barco tan hermoso de tigres, no abandonamos, como otros… en fin, se apoyó y se alentó pero no venimos jugando a nada, total, es un partido más y ya 🤣, cuando sea otra final abren lo q quieran el hocico, puro pinche tigres y que chsm rayados",dashmon
1342,1637309302162554880,2023-03-19 04:25:32+00:00,"Hoy se acabo la mentira, hoy oficialmente dejo ser hincha de este equipo chico y diminuto como lo es tigres. Hola club america, un equipo grande e histórico, hoy tienes un fan en tus filas.",daviiid_ca
1343,1637309208822521856,2023-03-19 04:25:09+00:00,estoy deprimido porq perdieron los tigres y vienen a chingar con las evidencias jajajaj novoy a hacer na,eliansuareeez
1344,1637309202044428290,2023-03-19 04:25:08+00:00,"Hoy También hay que destacar la Actuación de Esteban Andrada, hoy tuvo 2 Grandes Atajadas y logro dejar a la delantera de Tigres en 0.

Esté es el Andrada que queremos ver qué demuestre que pesa en la cancha y sea seguro en el arco.

Aplausos para la SABANDIJA. https://t.co/pGoTz7TJhP",AntiTigre1
1345,1637309168691322886,2023-03-19 04:25:00+00:00,"#Deportes ⚽ | Luis Romo anotó el tanto que evitó un frío empate en el llamado clásico regiomontano para que Monterrey se impusiera por 1-0 ante los Tigres, en la fecha 12 del torneo Clausura 2023. 

https://t.co/IPEtCXwoxk",LaJornadaMaya
1346,1637309167835795456,2023-03-19 04:25:00+00:00,Como que perdio el tigres 😩,Whiteboy17362
1347,1637309163826028545,2023-03-19 04:24:59+00:00,mi cordura pende de un hilo y a tigres se le ocurre perder en el clásico😵‍💫,DianaMonQuiroz
1348,1637309074751594496,2023-03-19 04:24:37+00:00,"#Tigres no tiene nada que hacer este torneo, paso de ser el mejor en las 3-4 jornadas a ser el 6to si bien nos va... el #Chima debe de ir por todo en la @TheChampions y despedirse del equipo al finalizar. @guido19pizarro , #Carioca agarren su dignidad y déjenos ser felices.",Eltigre15161718
1349,1637309026756116480,2023-03-19 04:24:26+00:00,"⚽️ #ClásicoRegio | ""¡EL GRUPO ESTA UNIDO, ESTA FUERTE!""

'Chima' Ruiz no tiene ninguna duda sobre su continuidad en Tigres y expresa que se dedica a trabajar.

📹 @jahircardenasm

#ABCDeportes | 📻 92.1 FM y 660 AM https://t.co/BUU9eBs4d4",abcdeportesmty
1350,1637308972897058816,2023-03-19 04:24:13+00:00,#Video ?? ¡Cabecita hizo una CALCA! Mismo golazo a Chivas y a Tigres  ? #shorts #viral: https://t.co/lRo7di2IXD,lado_mx
1351,1637308929452457987,2023-03-19 04:24:03+00:00,"#Venezuela Primera Fecha 7

La Guaira 3-0 Zamora
Monagas 1-1 Estudiantes M.

#México Clausura Fecha 12

Cruz Azul 1-0 At. de San Luis
Tigres 0-1 Monterrey https://t.co/KuikQuRGZ5",SolamenteFulbo
1352,1637308916638928899,2023-03-19 04:24:00+00:00,"Uno de los objetivos de cada semestre es ganar el clásico y Tigres fracasó, además quedó claro que Chima Ruiz no es técnico para este equipo, y las individualidades están lejos de su mejor momento.

Físicamente, técnicamente y tácticamente https://t.co/D599QC7wtm… https://t.co/u64P9rlHyg",edutorresr
1353,1637308905771393024,2023-03-19 04:23:57+00:00,"Los mam4dores añoran un tipo que literalmente los mando a la Vga 
Y a quien quiso esa Papa caliente y es de casa desde su llegada no le dan su respaldo.
Pero lo dije... Ahí está @RicardoLaVolpeG https://t.co/tIEAmgoBX7",ElCapoDelTwiter
1354,1637308825479831552,2023-03-19 04:23:38+00:00,"“Rayados cagón, Rayados cagón, la Puta que te parió”.
Canta la LyL

Pobres weyes, insultan a Rayados en vez de criticar
a los Tigres.
Piensan que alentar y apoyar es la solución.

Finalmente aficionados que apoyan",ArizpeMiguelZ
1355,1637308741878988802,2023-03-19 04:23:18+00:00,Me encanta que festejen cuando le ganan a tigres 🫶🏻,dancampillo
1356,1637308731082829824,2023-03-19 04:23:15+00:00,Juegan mejor los tamaleros salvajes de Villa Juárez de tercera división que mis tigres en estos momentos.,eldelaconsty
1357,1637308729178595328,2023-03-19 04:23:15+00:00,"A chivas, Cruz Azul y Tigres.",leonvid7
1358,1637308692902080513,2023-03-19 04:23:06+00:00,mama… mamaron los tigres🤪,eddycastilloo
1359,1637308660236931073,2023-03-19 04:22:58+00:00,"Con todo respeto, ¿en que pensaban los que apodaron a Tigres como ""la limoChima""? Desde ahí nos salvaron alv.",ACVargas1710
1360,1637308588099088384,2023-03-19 04:22:41+00:00,"Te dejamos el resumen @CervezaTecate de nuestro partido de la jornada 12 del Clausura 2023.

#SiempreContigo 👊🏼 #EstoEsTigres 🐯",TigresOficial
1361,1637308540879527937,2023-03-19 04:22:30+00:00,Mis tigres perdieron pq yo no me puse la camisa 😢,esthergarzac
1362,1637308506679148546,2023-03-19 04:22:22+00:00,"Tigres está en manos de dirigentes que ven al club como una marca, y esta la explotan a toda madre.

Pero de fútbol saben lo que yo sé de alemán...",JaimeGarza94
1363,1637308416048734208,2023-03-19 04:22:00+00:00,Te hablan puñ3tas @maurodoehner  @M_Culebro  parece que son los directivos más p3ndejos de México! https://t.co/zgBGrmhdOj,DonTigres
1364,1637308375405932544,2023-03-19 04:21:51+00:00,"Dude como me estresa que los tigres no aguanten la neta, es solo fútbol ni están jugando ustedes JAJAAJJ digo no hubieran ganado por que ahí si andan diciendo todo el mes que quién es el campeón y no se k, pero pierden y son los primeros en sacar+",shmebulock0_0
1365,1637308223794413569,2023-03-19 04:21:14+00:00,Tigres no jugó mal pero estos partidos se tienen que ganar,Sanchez_Mag
1366,1637308215179313152,2023-03-19 04:21:12+00:00,"Aunque perdieron mis tigres, la afición es de la mejor y los Libres y Lokos se sacaron la daga 😁🤞🏽",MelvinDwayne_
